,title,source,link,date
33,Small signal modulation of photonic crystal surface emitting lasers ...,Nature.com,news.google.com/articles/CBMiMmh0dHBzOi8vd3d3Lm5hdHVyZS5jb20vYXJ0aWNsZXMvczQxNTk4LTAyMy00NTQxNC030gEA?hl=en-IN&gl=IN&ceid=IN%3Aen,2023-11-03
23,Six-hour time-restricted feeding inhibits lung cancer progression and ...,BMC Medicine,news.google.com/articles/CBMiSWh0dHBzOi8vYm1jbWVkaWNpbmUuYmlvbWVkY2VudHJhbC5jb20vYXJ0aWNsZXMvMTAuMTE4Ni9zMTI5MTYtMDIzLTAzMTMxLXnSAQA?hl=en-IN&gl=IN&ceid=IN%3Aen,2023-11-03
44,A novel approach to interface high-Q Fabry–Pérot resonators with ...,American Institute of Physics,news.google.com/articles/CBMieGh0dHBzOi8vcHVicy5haXAub3JnL2FpcC9hcHAvYXJ0aWNsZS84LzExLzExNjEwNS8yOTE5NjUxL0Etbm92ZWwtYXBwcm9hY2gtdG8taW50ZXJmYWNlLWhpZ2gtUS1GYWJyeS1QZXJvdD9zZWFyY2hyZXN1bHQ9MdIBAA?hl=en-IN&gl=IN&ceid=IN%3Aen,2023-11-03
39,Caribbean salinity anomalies contributed to variable North Atlantic ...,Science,news.google.com/articles/CBMiMmh0dHBzOi8vd3d3LnNjaWVuY2Uub3JnL2RvaS8xMC4xMTI2L3NjaWFkdi5hZGcyNjM50gEA?hl=en-IN&gl=IN&ceid=IN%3Aen,2023-11-03
37,Significant influence of four highly conserved amino-acids in ...,Nature.com,news.google.com/articles/CBMiMmh0dHBzOi8vd3d3Lm5hdHVyZS5jb20vYXJ0aWNsZXMvczQxNTk4LTAyMy00NjMwNi020gEA?hl=en-IN&gl=IN&ceid=IN%3Aen,2023-11-03
36,GRSF1 antagonizes age-associated hypercoagulability via ...,Nature.com,news.google.com/articles/CBMiMmh0dHBzOi8vd3d3Lm5hdHVyZS5jb20vYXJ0aWNsZXMvczQxNDE5LTAyMy0wNjI0Mi050gEA?hl=en-IN&gl=IN&ceid=IN%3Aen,2023-11-03
31,"Delineation of prototypical degradation mechanism, characterization ...",John Wiley & Sons,news.google.com/articles/CBMiNGh0dHBzOi8vb25saW5lbGlicmFyeS53aWxleS5jb20vZG9pLzEwLjEwMDIvYm1jLjU3NjHSAQA?hl=en-IN&gl=IN&ceid=IN%3Aen,2023-11-03
28,Non-coding RNA-mediated endothelial-to-mesenchymal transition ...,Cardiovascular Diabetology,news.google.com/articles/CBMiRWh0dHBzOi8vY2FyZGlhYi5iaW9tZWRjZW50cmFsLmNvbS9hcnRpY2xlcy8xMC4xMTg2L3MxMjkzMy0wMjMtMDIwMzktNNIBAA?hl=en-IN&gl=IN&ceid=IN%3Aen,2023-11-03
27,Plasma essential fatty acid on hospital admission is a marker of ...,Nature.com,news.google.com/articles/CBMiMmh0dHBzOi8vd3d3Lm5hdHVyZS5jb20vYXJ0aWNsZXMvczQxNTk4LTAyMy00NjI0Ny0w0gEA?hl=en-IN&gl=IN&ceid=IN%3Aen,2023-11-03
25,Diversity of Thelazia spp. in domestic cattle from Romania ...,Parasites & Vectors,news.google.com/articles/CBMiUWh0dHBzOi8vcGFyYXNpdGVzYW5kdmVjdG9ycy5iaW9tZWRjZW50cmFsLmNvbS9hcnRpY2xlcy8xMC4xMTg2L3MxMzA3MS0wMjMtMDYwMTItONIBAA?hl=en-IN&gl=IN&ceid=IN%3Aen,2023-11-03
