,title,source,link,date
25,PacBio next-generation sequencing uncovers Apicomplexa diversity ...,Nature.com,news.google.com/articles/CBMiMmh0dHBzOi8vd3d3Lm5hdHVyZS5jb20vYXJ0aWNsZXMvczQxNTk4LTAyMy00MDg5NS150gEA?hl=en-IN&gl=IN&ceid=IN%3Aen,2023-09-12
13,Determination of ticagrelol in rat plasma and tablets by micellar ...,John Wiley & Sons,news.google.com/articles/CBMiOmh0dHBzOi8vb25saW5lbGlicmFyeS53aWxleS5jb20vZG9pLzEwLjEwMDIvanNzYy4yMDIzMDA0NTTSAQA?hl=en-IN&gl=IN&ceid=IN%3Aen,2023-09-12
24,"Prime Announces Expansion Drilling Results From the Z-T,",GlobeNewswire,news.google.com/articles/CBMiqAFodHRwczovL3d3dy5nbG9iZW5ld3N3aXJlLmNvbS9uZXdzLXJlbGVhc2UvMjAyMy8wOS8xMi8yNzQxNDE5LzAvZW4vUHJpbWUtQW5ub3VuY2VzLUV4cGFuc2lvbi1EcmlsbGluZy1SZXN1bHRzLUZyb20tdGhlLVotVC1HdWFkYWx1cGUtYW5kLUNlbnRyYWwtWm9uZXMtYXQtTG9zLVJleWVzLmh0bWzSAQA?hl=en-IN&gl=IN&ceid=IN%3Aen,2023-09-12
20,Quantitative determination of specialised metabolites in different ...,John Wiley & Sons,news.google.com/articles/CBMiNGh0dHBzOi8vb25saW5lbGlicmFyeS53aWxleS5jb20vZG9pLzEwLjEwMDIvcGNhLjMyNzjSAQA?hl=en-IN&gl=IN&ceid=IN%3Aen,2023-09-12
17,Subchronic toxicity evaluation of Huobahuagen extract and plasma ...,John Wiley & Sons,news.google.com/articles/CBMiNGh0dHBzOi8vb25saW5lbGlicmFyeS53aWxleS5jb20vZG9pLzEwLjEwMDIvamF0LjQ1MzLSAQA?hl=en-IN&gl=IN&ceid=IN%3Aen,2023-09-12
33,Silybin meglumine and hepatic fibrosis treatment | IJN,Dove Medical Press,news.google.com/articles/CBMigwFodHRwczovL3d3dy5kb3ZlcHJlc3MuY29tL2NvbWJpbmVkLWFtcGhpcGhpbGljLXNpbHliaW4tbWVnbHVtaW5lLW5hbm9zdXNwZW5zaW9uLWVmZmVjdGl2ZS1hZ2FpbnMtcGVlci1yZXZpZXdlZC1mdWxsdGV4dC1hcnRpY2xlLUlKTtIBAA?hl=en-IN&gl=IN&ceid=IN%3Aen,2023-09-12
14,Cigarette smoking contributes to Th1/Th2 cell dysfunction | COPD,Dove Medical Press,news.google.com/articles/CBMihAFodHRwczovL3d3dy5kb3ZlcHJlc3MuY29tL2NpZ2FyZXR0ZS1zbW9raW5nLWNvbnRyaWJ1dGVzLXRvLXRoMXRoMi1jZWxsLWR5c2Z1bmN0aW9uLXZpYS10aGUtY3l0b2stcGVlci1yZXZpZXdlZC1mdWxsdGV4dC1hcnRpY2xlLUNPUETSAQA?hl=en-IN&gl=IN&ceid=IN%3Aen,2023-09-12
10,Increased breast cancer incidence among women living in areas ...,News-Medical.Net,news.google.com/articles/CBMikQFodHRwczovL3d3dy5uZXdzLW1lZGljYWwubmV0L25ld3MvMjAyMzA5MTEvSW5jcmVhc2VkLWJyZWFzdC1jYW5jZXItaW5jaWRlbmNlLWFtb25nLXdvbWVuLWxpdmluZy1pbi1hcmVhcy13aXRoLWhpZ2gtcGFydGljdWxhdGUtbWF0dGVyLWxldmVscy5hc3B40gEA?hl=en-IN&gl=IN&ceid=IN%3Aen,2023-09-12
43,Study on consistency of greenhouse gas concentrations between ...,EurekAlert,news.google.com/articles/CBMiMGh0dHBzOi8vd3d3LmV1cmVrYWxlcnQub3JnL25ld3MtcmVsZWFzZXMvMTAwMDk0NNIBAA?hl=en-IN&gl=IN&ceid=IN%3Aen,2023-09-12
6,The inhibition of pancreatic cancer progression by K-Ras ...,Nature.com,news.google.com/articles/CBMiMmh0dHBzOi8vd3d3Lm5hdHVyZS5jb20vYXJ0aWNsZXMvczQxNTk4LTAyMy00MTgzNS020gEA?hl=en-IN&gl=IN&ceid=IN%3Aen,2023-09-12
