,title,source,link,date
15,The tumor-enriched small molecule gambogic amide suppresses ...,Nature.com,news.google.com/articles/CBMiMmh0dHBzOi8vd3d3Lm5hdHVyZS5jb20vYXJ0aWNsZXMvczQxMzkyLTAyMy0wMTY2Ni0z0gEA?hl=en-IN&gl=IN&ceid=IN%3Aen,2023-11-08
26,Exploration of porous imine‐based covalent organic framework for ...,John Wiley,news.google.com/articles/CBMiOmh0dHBzOi8vb25saW5lbGlicmFyeS53aWxleS5jb20vZG9pLzEwLjEwMDIvanNzYy4yMDIzMDA1MzXSAQA?hl=en-IN&gl=IN&ceid=IN%3Aen,2023-11-07
21,Surface-exposed chaperonin 60 derived from Propionibacterium ...,Nature.com,news.google.com/articles/CBMiMmh0dHBzOi8vd3d3Lm5hdHVyZS5jb20vYXJ0aWNsZXMvczQxNTk4LTAyMy00NjQzNi140gEA?hl=en-IN&gl=IN&ceid=IN%3Aen,2023-11-07
40,Transcriptomics profile of human bronchial epithelial cells exposed ...,Nature.com,news.google.com/articles/CBMiMmh0dHBzOi8vd3d3Lm5hdHVyZS5jb20vYXJ0aWNsZXMvczQxNTk4LTAyMy00NjcyNC020gEA?hl=en-IN&gl=IN&ceid=IN%3Aen,2023-11-07
41,Endothelial barrier protection via PLC-PKC-FAK pathway | JIR,Dove Medical Press,news.google.com/articles/CBMigwFodHRwczovL3d3dy5kb3ZlcHJlc3MuY29tL2xwYTItYWxsZXZpYXRlcy1zZXB0aWMtYWN1dGUtbHVuZy1pbmp1cnktdmlhLXByb3RlY3RpdmUtZW5kb3RoZWxpYWwtYmEtcGVlci1yZXZpZXdlZC1mdWxsdGV4dC1hcnRpY2xlLUpJUtIBAA?hl=en-IN&gl=IN&ceid=IN%3Aen,2023-11-07
48,Amphiphilic erlotinib analogue as novel nanomedicine | IJN,Dove Medical Press,news.google.com/articles/CBMigwFodHRwczovL3d3dy5kb3ZlcHJlc3MuY29tL2VuZ2luZWVyaW5nLW9mLWFtcGhpcGhpbGljLWVybG90aW5pYi1hbmFsb2d1ZS1hcy1ub3ZlbC1uYW5vbWVkaWNpbmUtZm8tcGVlci1yZXZpZXdlZC1mdWxsdGV4dC1hcnRpY2xlLUlKTtIBAA?hl=en-IN&gl=IN&ceid=IN%3Aen,2023-11-07
51,Effect & mechanism of Sanhuang ointment on MRSA infection | IDR,Dove Medical Press,news.google.com/articles/CBMigwFodHRwczovL3d3dy5kb3ZlcHJlc3MuY29tL2V2YWx1YXRpb24tb2YtdGhlLWVmZmVjdC1hbmQtbWVjaGFuaXNtLW9mLXNhbmh1YW5nLW9pbnRtZW50LW9uLW1yc2EtaW4tcGVlci1yZXZpZXdlZC1mdWxsdGV4dC1hcnRpY2xlLUlEUtIBAA?hl=en-IN&gl=IN&ceid=IN%3Aen,2023-11-07
25,Analyzing the scale dependent effect of urban building morphology ...,Nature.com,news.google.com/articles/CBMiMmh0dHBzOi8vd3d3Lm5hdHVyZS5jb20vYXJ0aWNsZXMvczQxNTk4LTAyMy00NjQzNy130gEA?hl=en-IN&gl=IN&ceid=IN%3Aen,2023-11-07
23,Targeting nucleic acid phase transitions as a mechanism of action ...,Nature.com,news.google.com/articles/CBMiMmh0dHBzOi8vd3d3Lm5hdHVyZS5jb20vYXJ0aWNsZXMvczQxNDY3LTAyMy00MjM3NC000gEA?hl=en-IN&gl=IN&ceid=IN%3Aen,2023-11-07
22,Gradient porous structures of mycelium: a quantitative structure ...,Nature.com,news.google.com/articles/CBMiMmh0dHBzOi8vd3d3Lm5hdHVyZS5jb20vYXJ0aWNsZXMvczQxNTk4LTAyMy00NTg0Mi010gEA?hl=en-IN&gl=IN&ceid=IN%3Aen,2023-11-07
