,title,source,link,date
3,"Starching Clay Market Competitive Landscape and Progress 2023-2029 by Key Players | BASF SE , Musim Mas H",Benzinga,news.google.com/articles/CBMimQFodHRwczovL3d3dy5iZW56aW5nYS5jb20vcHJlc3NyZWxlYXNlcy8yMy8wOS8zNDE4NzU0Ni9zdGFyY2hpbmctY2xheS1tYXJrZXQtY29tcGV0aXRpdmUtbGFuZHNjYXBlLWFuZC1wcm9ncmVzcy0yMDIzLTIwMjktYnkta2V5LXBsYXllcnMtYmFzZi1zZS1tdXNpbS1tYXPSAS1odHRwczovL3d3dy5iZW56aW5nYS5jb20vYW1wL2NvbnRlbnQvMzQxODc1NDY?hl=en-IN&gl=IN&ceid=IN%3Aen,2023-09-02
14,Preparation of ZnGa2O4 nanoflowers and their full-color ...,Nature.com,news.google.com/articles/CBMiMmh0dHBzOi8vd3d3Lm5hdHVyZS5jb20vYXJ0aWNsZXMvczQxNTk4LTAyMy00MTY1OC010gEA?hl=en-IN&gl=IN&ceid=IN%3Aen,2023-09-02
30,Top-down structuring of freshwater bacterial communities by ...,Nature.com,news.google.com/articles/CBMiMmh0dHBzOi8vd3d3Lm5hdHVyZS5jb20vYXJ0aWNsZXMvczQzNzA1LTAyMy0wMDI4OS030gEA?hl=en-IN&gl=IN&ceid=IN%3Aen,2023-09-02
29,Atmosphere injection of sea salts during large explosive submarine ...,Nature.com,news.google.com/articles/CBMiMmh0dHBzOi8vd3d3Lm5hdHVyZS5jb20vYXJ0aWNsZXMvczQxNTk4LTAyMy00MTYzOS040gEA?hl=en-IN&gl=IN&ceid=IN%3Aen,2023-09-02
26,Experimental investigation and quantitative prediction in ...,Nature.com,news.google.com/articles/CBMiMmh0dHBzOi8vd3d3Lm5hdHVyZS5jb20vYXJ0aWNsZXMvczQxNTk4LTAyMy00MTU3OC000gEA?hl=en-IN&gl=IN&ceid=IN%3Aen,2023-09-02
21,Enhancing photosynthetic CO2 fixation by assembling metal-organic ...,Nature.com,news.google.com/articles/CBMiMmh0dHBzOi8vd3d3Lm5hdHVyZS5jb20vYXJ0aWNsZXMvczQxNDY3LTAyMy00MDgzOS0w0gEA?hl=en-IN&gl=IN&ceid=IN%3Aen,2023-09-02
31,"Azithromycin promotes proliferation, and inhibits inflammation in ...",Nature.com,news.google.com/articles/CBMiMmh0dHBzOi8vd3d3Lm5hdHVyZS5jb20vYXJ0aWNsZXMvczQxNTk4LTAyMy00MTU3Ny010gEA?hl=en-IN&gl=IN&ceid=IN%3Aen,2023-09-02
28,Targeting CaMKK2 Inhibits Actin Cytoskeletal Assembly to Suppress ...,Cancer Discovery,news.google.com/articles/CBMiaWh0dHBzOi8vYWFjcmpvdXJuYWxzLm9yZy9jYW5jZXJyZXMvYXJ0aWNsZS84My8xNy8yODg5LzcyODU5MS9UYXJnZXRpbmctQ2FNS0syLUluaGliaXRzLUFjdGluLUN5dG9za2VsZXRhbNIBAA?hl=en-IN&gl=IN&ceid=IN%3Aen,2023-09-01
11,Opsonization-independent antigen-specific recognition by myeloid ...,Science,news.google.com/articles/CBMiMmh0dHBzOi8vd3d3LnNjaWVuY2Uub3JnL2RvaS8xMC4xMTI2L3NjaWFkdi5hZGcxODEy0gEA?hl=en-IN&gl=IN&ceid=IN%3Aen,2023-09-01
35,Lactiplantibacillus plantarum as a novel platform for production and ...,Nature.com,news.google.com/articles/CBMiMmh0dHBzOi8vd3d3Lm5hdHVyZS5jb20vYXJ0aWNsZXMvczQxNTk4LTAyMy00MTU1OS030gEA?hl=en-IN&gl=IN&ceid=IN%3Aen,2023-09-01
