,title,source,link,date
11,Determination of ticagrelol in rat plasma and tablets by micellar ...,John Wiley & Sons,news.google.com/articles/CBMiOmh0dHBzOi8vb25saW5lbGlicmFyeS53aWxleS5jb20vZG9pLzEwLjEwMDIvanNzYy4yMDIzMDA0NTTSAQA?hl=en-IN&gl=IN&ceid=IN%3Aen,2023-09-12
37,Study on consistency of greenhouse gas concentrations between ...,EurekAlert,news.google.com/articles/CBMiMGh0dHBzOi8vd3d3LmV1cmVrYWxlcnQub3JnL25ld3MtcmVsZWFzZXMvMTAwMDk0NNIBAA?hl=en-IN&gl=IN&ceid=IN%3Aen,2023-09-12
25,Silybin meglumine and hepatic fibrosis treatment | IJN,Dove Medical Press,news.google.com/articles/CBMigwFodHRwczovL3d3dy5kb3ZlcHJlc3MuY29tL2NvbWJpbmVkLWFtcGhpcGhpbGljLXNpbHliaW4tbWVnbHVtaW5lLW5hbm9zdXNwZW5zaW9uLWVmZmVjdGl2ZS1hZ2FpbnMtcGVlci1yZXZpZXdlZC1mdWxsdGV4dC1hcnRpY2xlLUlKTtIBAA?hl=en-IN&gl=IN&ceid=IN%3Aen,2023-09-12
17,Quantitative determination of specialised metabolites in different ...,John Wiley & Sons,news.google.com/articles/CBMiNGh0dHBzOi8vb25saW5lbGlicmFyeS53aWxleS5jb20vZG9pLzEwLjEwMDIvcGNhLjMyNzjSAQA?hl=en-IN&gl=IN&ceid=IN%3Aen,2023-09-12
31,Discovery of l-threonine transaldolases for enhanced biosynthesis of ...,Nature.com,news.google.com/articles/CBMiMmh0dHBzOi8vd3d3Lm5hdHVyZS5jb20vYXJ0aWNsZXMvczQyMDAzLTAyMy0wNTI5My0w0gEA?hl=en-IN&gl=IN&ceid=IN%3Aen,2023-09-11
20,FLEX 2023 Takeaways: Flexible and Printed Electronics Move into ...,EMSNow,news.google.com/articles/CBMicGh0dHBzOi8vd3d3LmVtc25vdy5jb20vZmxleC0yMDIzLXRha2Vhd2F5cy1mbGV4aWJsZS1hbmQtcHJpbnRlZC1lbGVjdHJvbmljcy1tb3ZlLWludG8tZWxlY3Ryb25pY3MtbWFudWZhY3R1cmluZy_SAQA?hl=en-IN&gl=IN&ceid=IN%3Aen,2023-09-11
50,Ameliorating Preterm Infant Cerebral White Matter Injury | NDT,Dove Medical Press,news.google.com/articles/CBMigwFodHRwczovL3d3dy5kb3ZlcHJlc3MuY29tL29saWdvZGVuZHJvY3l0ZS1wcm9nZW5pdG9yLWNlbGwtdHJhbnNwbGFudGF0aW9uLWFtZWxpb3JhdGVzLXByZXRlcm0taW4tcGVlci1yZXZpZXdlZC1mdWxsdGV4dC1hcnRpY2xlLU5EVNIBAA?hl=en-IN&gl=IN&ceid=IN%3Aen,2023-09-11
48,Melatonin Attenuates Sepsis-Induced Acute Lung Injury | DDDT,Dove Medical Press,news.google.com/articles/CBMihAFodHRwczovL3d3dy5kb3ZlcHJlc3MuY29tL21lbGF0b25pbi1hdHRlbnVhdGVzLXNlcHNpcy1pbmR1Y2VkLWFjdXRlLWx1bmctaW5qdXJ5LXZpYS1pbmhpYml0aW5nLWUtcGVlci1yZXZpZXdlZC1mdWxsdGV4dC1hcnRpY2xlLURERFTSAQA?hl=en-IN&gl=IN&ceid=IN%3Aen,2023-09-11
47,Morphological and physiological adaptations of psychrophilic ...,Nature.com,news.google.com/articles/CBMiMmh0dHBzOi8vd3d3Lm5hdHVyZS5jb20vYXJ0aWNsZXMvczQxNTk4LTAyMy00MjE3OS140gEA?hl=en-IN&gl=IN&ceid=IN%3Aen,2023-09-11
46,Acquisition of resistance to FEP/AVI in K. pneumoniae | IDR,Dove Medical Press,news.google.com/articles/CBMigwFodHRwczovL3d3dy5kb3ZlcHJlc3MuY29tL2luLXZpdHJvLWFjdGl2aXR5LW9mLWNlZmVwaW1lYXZpYmFjdGFtLWFnYWluc3QtY2FyYmFwZW5lbS1yZXNpc3RhbnQta2wtcGVlci1yZXZpZXdlZC1mdWxsdGV4dC1hcnRpY2xlLUlEUtIBAA?hl=en-IN&gl=IN&ceid=IN%3Aen,2023-09-11
