,title,source,link,date
3,Shin-Etsu Chemical to further drive forward its QST® substrate ...,Business Wire,news.google.com/articles/CBMirQFodHRwczovL3d3dy5idXNpbmVzc3dpcmUuY29tL25ld3MvaG9tZS8yMDIzMDkwNDM2MzM4Mi9lbi9TaGluLUV0c3UtQ2hlbWljYWwtdG8tZnVydGhlci1kcml2ZS1mb3J3YXJkLWl0cy1RU1QlQzIlQUUtc3Vic3RyYXRlLWJ1c2luZXNzLWZvci1pbXBsZW1lbnRhdGlvbi1pbi1HYU4tcG93ZXItZGV2aWNlc9IBAA?hl=en-IN&gl=IN&ceid=IN%3Aen,2023-09-05
18,Suzano SA Patent: Process for Producing Microfibrillated ...,Packaging Gateway,news.google.com/articles/CBMiiQFodHRwczovL3d3dy5wYWNrYWdpbmctZ2F0ZXdheS5jb20vZGF0YS1pbnNpZ2h0cy9zdXphbm8tZmlsZXMtcGF0ZW50LWZvci1wcm9jZXNzLWZvci1wcm9kdWNpbmctbWljcm9maWJyaWxsYXRlZC1uYW5vZmlicmlsbGF0ZWQtY2VsbHVsb3NlL9IBAA?hl=en-IN&gl=IN&ceid=IN%3Aen,2023-09-05
10,Remarkable Improvements After Cataract Surgery in a Presumed ...,Cureus,news.google.com/articles/CBMijAFodHRwczovL3d3dy5jdXJldXMuY29tL2FydGljbGVzLzE4Mjg0NC1yZW1hcmthYmxlLWltcHJvdmVtZW50cy1hZnRlci1jYXRhcmFjdC1zdXJnZXJ5LWluLWEtcHJlc3VtZWQtZW5kLXN0YWdlLWdsYXVjb21hLXBhdGllbnQtYS1jYXNlLXJlcG9ydNIBAA?hl=en-IN&gl=IN&ceid=IN%3Aen,2023-09-05
24,IL10-GE-PNPs for targeted inhibition of vascular restenosis | IJN,Dove Medical Press,news.google.com/articles/CBMigwFodHRwczovL3d3dy5kb3ZlcHJlc3MuY29tL2dseWNvc3lsYXRpb24tZW5naW5lZXJlZC1wbGF0ZWxldC1tZW1icmFuZS1jb2F0ZWQtaW50ZXJsZXVraW4tMTAtbmFub3AtcGVlci1yZXZpZXdlZC1mdWxsdGV4dC1hcnRpY2xlLUlKTtIBAA?hl=en-IN&gl=IN&ceid=IN%3Aen,2023-09-05
51,Pedogenesis of typical zonal soil drives belowground bacterial ...,Nature.com,news.google.com/articles/CBMiMmh0dHBzOi8vd3d3Lm5hdHVyZS5jb20vYXJ0aWNsZXMvczQxNTk4LTAyMy00MTQwMS0w0gEA?hl=en-IN&gl=IN&ceid=IN%3Aen,2023-09-04
42,Improving the cytotoxic response of tumor-infiltrating lymphocytes ...,Nature.com,news.google.com/articles/CBMiMmh0dHBzOi8vd3d3Lm5hdHVyZS5jb20vYXJ0aWNsZXMvczQxNDE3LTAyMy0wMDY1OC0z0gEA?hl=en-IN&gl=IN&ceid=IN%3Aen,2023-09-04
40,Single-cell RNA sequencing of murine hearts for studying the ...,Nature.com,news.google.com/articles/CBMiMmh0dHBzOi8vd3d3Lm5hdHVyZS5jb20vYXJ0aWNsZXMvczQxNTk3LTAyMy0wMjMzMy020gEA?hl=en-IN&gl=IN&ceid=IN%3Aen,2023-09-04
35,"Vietnam Sealant Web Films Market Overview, Top Key Players, Growth, Size, Share, and Forecast 2023 to 203",Benzinga,news.google.com/articles/CBMimQFodHRwczovL3d3dy5iZW56aW5nYS5jb20vcHJlc3NyZWxlYXNlcy8yMy8wOS8zNDIwMzA0NS92aWV0bmFtLXNlYWxhbnQtd2ViLWZpbG1zLW1hcmtldC1vdmVydmlldy10b3Ata2V5LXBsYXllcnMtZ3Jvd3RoLXNpemUtc2hhcmUtYW5kLWZvcmVjYXN0LTIwMjMtdG8tMjDSAS1odHRwczovL3d3dy5iZW56aW5nYS5jb20vYW1wL2NvbnRlbnQvMzQyMDMwNDU?hl=en-IN&gl=IN&ceid=IN%3Aen,2023-09-04
19,Coleus vettiveroides ethanolic root extract induces cytotoxicity by ...,John Wiley,news.google.com/articles/CBMiNGh0dHBzOi8vb25saW5lbGlicmFyeS53aWxleS5jb20vZG9pLzEwLjEwMDIvamF0LjQ1MzbSAQA?hl=en-IN&gl=IN&ceid=IN%3Aen,2023-09-04
23,Cryo-EM structure and molecular mechanism of abscisic acid ...,Nature.com,news.google.com/articles/CBMiMmh0dHBzOi8vd3d3Lm5hdHVyZS5jb20vYXJ0aWNsZXMvczQxNDc3LTAyMy0wMTUwOS030gEA?hl=en-IN&gl=IN&ceid=IN%3Aen,2023-09-04
