,title,source,link,date
15,Adipose stromal cells bioproducts as cell-free therapies ...,Journal of Translational Medicine,news.google.com/articles/CBMiVGh0dHBzOi8vdHJhbnNsYXRpb25hbC1tZWRpY2luZS5iaW9tZWRjZW50cmFsLmNvbS9hcnRpY2xlcy8xMC4xMTg2L3MxMjk2Ny0wMjMtMDQ2MDItOdIBAA?hl=en-IN&gl=IN&ceid=IN%3Aen,2023-10-16
40,"JWST Observes the Kuiper Belt: Sedna, Gonggong, and Quaoar",Universe Today,news.google.com/articles/CBMiXWh0dHBzOi8vd3d3LnVuaXZlcnNldG9kYXkuY29tLzE2MzQ4My9qd3N0LW9ic2VydmVzLXRoZS1rdWlwZXItYmVsdC1zZWRuYS1nb25nZ29uZy1hbmQtcXVhb2FyL9IBAA?hl=en-IN&gl=IN&ceid=IN%3Aen,2023-10-15
35,Accuracy of Different Lens Power Calculation Formulas in Patients ...,Cureus,news.google.com/articles/CBMifmh0dHBzOi8vd3d3LmN1cmV1cy5jb20vYXJ0aWNsZXMvMTg4ODQ4LWFjY3VyYWN5LW9mLWRpZmZlcmVudC1sZW5zLXBvd2VyLWNhbGN1bGF0aW9uLWZvcm11bGFzLWluLXBhdGllbnRzLXdpdGgtbWF0dXJlLWNhdGFyYWN0c9IBAA?hl=en-IN&gl=IN&ceid=IN%3Aen,2023-10-15
33,Regulation of dermal fibroblasts by human neutrophil peptides ...,Nature.com,news.google.com/articles/CBMiMmh0dHBzOi8vd3d3Lm5hdHVyZS5jb20vYXJ0aWNsZXMvczQxNTk4LTAyMy00NDg4OS040gEA?hl=en-IN&gl=IN&ceid=IN%3Aen,2023-10-15
44,Reverse pH-dependent fluorescence protein visualizes pattern of ...,Nature.com,news.google.com/articles/CBMiMmh0dHBzOi8vd3d3Lm5hdHVyZS5jb20vYXJ0aWNsZXMvczQxNTk4LTAyMy00NDc1OC000gEA?hl=en-IN&gl=IN&ceid=IN%3Aen,2023-10-15
28,Hydrothermal extraction and physicochemical characterization of ...,Nature.com,news.google.com/articles/CBMiMmh0dHBzOi8vd3d3Lm5hdHVyZS5jb20vYXJ0aWNsZXMvczQxNTk4LTAyMy00Mzk4OS050gEA?hl=en-IN&gl=IN&ceid=IN%3Aen,2023-10-15
23,The effect of quaternary ammonium polyethylenimine nanoparticles ...,Nature.com,news.google.com/articles/CBMiMmh0dHBzOi8vd3d3Lm5hdHVyZS5jb20vYXJ0aWNsZXMvczQxNTk4LTAyMy00Mzg1MS150gEA?hl=en-IN&gl=IN&ceid=IN%3Aen,2023-10-15
53,Library of single-etch silicon nitride grating couplers for low-loss and ...,Nature.com,news.google.com/articles/CBMiMmh0dHBzOi8vd3d3Lm5hdHVyZS5jb20vYXJ0aWNsZXMvczQxNTk4LTAyMy00NDgyNC140gEA?hl=en-IN&gl=IN&ceid=IN%3Aen,2023-10-14
36,Quantitative analysis of gastrointestinal fluid absorption and ...,Nature.com,news.google.com/articles/CBMiMmh0dHBzOi8vd3d3Lm5hdHVyZS5jb20vYXJ0aWNsZXMvczQxNTk4LTAyMy00NDc0Mi150gEA?hl=en-IN&gl=IN&ceid=IN%3Aen,2023-10-14
31,Establishment of a transparent soil system to study Bacillus subtilis ...,Nature.com,news.google.com/articles/CBMiMmh0dHBzOi8vd3d3Lm5hdHVyZS5jb20vYXJ0aWNsZXMvczQzNzA1LTAyMy0wMDMxOC010gEA?hl=en-IN&gl=IN&ceid=IN%3Aen,2023-10-14
