,title,source,link,date
28,Accuracy of Different Lens Power Calculation Formulas in Patients ...,Cureus,news.google.com/articles/CBMifmh0dHBzOi8vd3d3LmN1cmV1cy5jb20vYXJ0aWNsZXMvMTg4ODQ4LWFjY3VyYWN5LW9mLWRpZmZlcmVudC1sZW5zLXBvd2VyLWNhbGN1bGF0aW9uLWZvcm11bGFzLWluLXBhdGllbnRzLXdpdGgtbWF0dXJlLWNhdGFyYWN0c9IBAA?hl=en-IN&gl=IN&ceid=IN%3Aen,2023-10-15
18,The effect of quaternary ammonium polyethylenimine nanoparticles ...,Nature.com,news.google.com/articles/CBMiMmh0dHBzOi8vd3d3Lm5hdHVyZS5jb20vYXJ0aWNsZXMvczQxNTk4LTAyMy00Mzg1MS150gEA?hl=en-IN&gl=IN&ceid=IN%3Aen,2023-10-15
20,Reverse pH-dependent fluorescence protein visualizes pattern of ...,Nature.com,news.google.com/articles/CBMiMmh0dHBzOi8vd3d3Lm5hdHVyZS5jb20vYXJ0aWNsZXMvczQxNTk4LTAyMy00NDc1OC000gEA?hl=en-IN&gl=IN&ceid=IN%3Aen,2023-10-15
41,Hydrothermal extraction and physicochemical characterization of ...,Nature.com,news.google.com/articles/CBMiMmh0dHBzOi8vd3d3Lm5hdHVyZS5jb20vYXJ0aWNsZXMvczQxNTk4LTAyMy00Mzk4OS050gEA?hl=en-IN&gl=IN&ceid=IN%3Aen,2023-10-15
53,Rapid detection of vaccinia virus using biofunctionalized fiber-optic ...,Nature.com,news.google.com/articles/CBMiMmh0dHBzOi8vd3d3Lm5hdHVyZS5jb20vYXJ0aWNsZXMvczQxNTk4LTAyMy00NDkyNi020gEA?hl=en-IN&gl=IN&ceid=IN%3Aen,2023-10-14
10,"Safety, sustainability and security for Europe's mineral processing ...",Cordis News,news.google.com/articles/CBMidmh0dHBzOi8vY29yZGlzLmV1cm9wYS5ldS9hcnRpY2xlL2lkLzQ0NzA5MC1zYWZldHktc3VzdGFpbmFiaWxpdHktYW5kLXNlY3VyaXR5LWZvci1ldXJvcGUtcy1taW5lcmFsLXByb2Nlc3NpbmctaW5kdXN0cnnSAQA?hl=en-IN&gl=IN&ceid=IN%3Aen,2023-10-14
12,CEP20 promotes invasion and metastasis of non-small cell lung ...,Nature.com,news.google.com/articles/CBMiMmh0dHBzOi8vd3d3Lm5hdHVyZS5jb20vYXJ0aWNsZXMvczQxNTk4LTAyMy00NDc1NC040gEA?hl=en-IN&gl=IN&ceid=IN%3Aen,2023-10-14
33,Quantitative analysis of gastrointestinal fluid absorption and ...,Nature.com,news.google.com/articles/CBMiMmh0dHBzOi8vd3d3Lm5hdHVyZS5jb20vYXJ0aWNsZXMvczQxNTk4LTAyMy00NDc0Mi150gEA?hl=en-IN&gl=IN&ceid=IN%3Aen,2023-10-14
50,Library of single-etch silicon nitride grating couplers for low-loss and ...,Nature.com,news.google.com/articles/CBMiMmh0dHBzOi8vd3d3Lm5hdHVyZS5jb20vYXJ0aWNsZXMvczQxNTk4LTAyMy00NDgyNC140gEA?hl=en-IN&gl=IN&ceid=IN%3Aen,2023-10-14
57,EOGT enables residual Notch signaling in mouse intestinal cells ...,Nature.com,news.google.com/articles/CBMiMmh0dHBzOi8vd3d3Lm5hdHVyZS5jb20vYXJ0aWNsZXMvczQxNTk4LTAyMy00NDUwOS010gEA?hl=en-IN&gl=IN&ceid=IN%3Aen,2023-10-14
