,title,source,link,date
13,The materials and techniques of The Lamentation of Christ (ca. 1460 ...,John Wiley,news.google.com/articles/CBMiNGh0dHBzOi8vb25saW5lbGlicmFyeS53aWxleS5jb20vZG9pLzEwLjEwMDIveHJzLjM0MDTSAQA?hl=en-IN&gl=IN&ceid=IN%3Aen,2023-10-03
9,X‐ray fluorescence analysis of mercury in human hairs using a ...,John Wiley,news.google.com/articles/CBMiNGh0dHBzOi8vb25saW5lbGlicmFyeS53aWxleS5jb20vZG9pLzEwLjEwMDIveHJzLjM0MDbSAQA?hl=en-IN&gl=IN&ceid=IN%3Aen,2023-10-03
27,Ecological mechanisms and current systems shape the modular ...,Nature.com,news.google.com/articles/CBMiMmh0dHBzOi8vd3d3Lm5hdHVyZS5jb20vYXJ0aWNsZXMvczQxNDY3LTAyMy00MTkwOS160gEA?hl=en-IN&gl=IN&ceid=IN%3Aen,2023-10-02
12,Screening and identification of potential hypoglycemic and ...,John Wiley,news.google.com/articles/CBMiNGh0dHBzOi8vb25saW5lbGlicmFyeS53aWxleS5jb20vZG9pLzEwLjEwMDIvcGNhLjMyODXSAQA?hl=en-IN&gl=IN&ceid=IN%3Aen,2023-10-02
18,Mediating effect of body fat percentage in the association between ...,BMC Public Health,news.google.com/articles/CBMiTWh0dHBzOi8vYm1jcHVibGljaGVhbHRoLmJpb21lZGNlbnRyYWwuY29tL2FydGljbGVzLzEwLjExODYvczEyODg5LTAyMy0xNjgxNS0w0gEA?hl=en-IN&gl=IN&ceid=IN%3Aen,2023-10-02
17,Specific peptide conjugation to a therapeutic antibody leads to ...,Nature.com,news.google.com/articles/CBMiMmh0dHBzOi8vd3d3Lm5hdHVyZS5jb20vYXJ0aWNsZXMvczQxNTk4LTAyMy00MzQzMS0w0gEA?hl=en-IN&gl=IN&ceid=IN%3Aen,2023-10-02
43,Fast functional mapping of ligand-gated ion channels ...,Nature.com,news.google.com/articles/CBMiMmh0dHBzOi8vd3d3Lm5hdHVyZS5jb20vYXJ0aWNsZXMvczQyMDAzLTAyMy0wNTM0MC130gEA?hl=en-IN&gl=IN&ceid=IN%3Aen,2023-10-02
38,High-fat diet promotes tumor growth in the patient-derived orthotopic ...,Nature.com,news.google.com/articles/CBMiMmh0dHBzOi8vd3d3Lm5hdHVyZS5jb20vYXJ0aWNsZXMvczQxNTk4LTAyMy00Mzc5Ny0x0gEA?hl=en-IN&gl=IN&ceid=IN%3Aen,2023-10-02
14,Ventilation and the Risk of Health Care–Associated Infections,Infection Control Today,news.google.com/articles/CBMiXWh0dHBzOi8vd3d3LmluZmVjdGlvbmNvbnRyb2x0b2RheS5jb20vdmlldy92ZW50aWxhdGlvbi1yaXNrLWhlYWx0aC1jYXJlLWFzc29jaWF0ZWQtaW5mZWN0aW9uc9IBAA?hl=en-IN&gl=IN&ceid=IN%3Aen,2023-10-02
47,Multi-omics reveal neuroprotection of Acer truncatum Bunge Seed ...,Nature.com,news.google.com/articles/CBMiMmh0dHBzOi8vd3d3Lm5hdHVyZS5jb20vYXJ0aWNsZXMvczQyMDAzLTAyMy0wNTM0MS050gEA?hl=en-IN&gl=IN&ceid=IN%3Aen,2023-10-02
