,title,source,link,date
3,IR-817 encapsulated in albumin nanoparticles for imaging | IJN,Dove Medical Press,news.google.com/articles/CBMigwFodHRwczovL3d3dy5kb3ZlcHJlc3MuY29tL211bHRpZnVuY3Rpb25hbC1uZWFyLWluZnJhcmVkLWR5ZS1pci04MTctZW5jYXBzdWxhdGVkLWluLWFsYnVtaW4tbmFub3AtcGVlci1yZXZpZXdlZC1mdWxsdGV4dC1hcnRpY2xlLUlKTtIBAA?hl=en-IN&gl=IN&ceid=IN%3Aen,2023-09-04
7,Coleus vettiveroides ethanolic root extract induces cytotoxicity by ...,John Wiley,news.google.com/articles/CBMiNGh0dHBzOi8vb25saW5lbGlicmFyeS53aWxleS5jb20vZG9pLzEwLjEwMDIvamF0LjQ1MzbSAQA?hl=en-IN&gl=IN&ceid=IN%3Aen,2023-09-04
6,Efficacy of Different Root Canal Irrigating Solutions in Removing ...,Cureus,news.google.com/articles/CBMimgFodHRwczovL3d3dy5jdXJldXMuY29tL2FydGljbGVzLzE4NDc0NS1lZmZpY2FjeS1vZi1kaWZmZXJlbnQtcm9vdC1jYW5hbC1pcnJpZ2F0aW5nLXNvbHV0aW9ucy1pbi1yZW1vdmluZy1zbWVhci1sYXllci1hLXNjYW5uaW5nLWVsZWN0cm9uLW1pY3Jvc2NvcGljLXN0dWR50gEA?hl=en-IN&gl=IN&ceid=IN%3Aen,2023-09-04
14,Generation of inactivated IL2RG and RAG1 monkeys with severe ...,Nature.com,news.google.com/articles/CBMiMmh0dHBzOi8vd3d3Lm5hdHVyZS5jb20vYXJ0aWNsZXMvczQxMzkyLTAyMy0wMTU0NC150gEA?hl=en-IN&gl=IN&ceid=IN%3Aen,2023-09-03
74,PVA Fiber Market Growth Outlook from 2023 to 2030 and it is projecting at 13.2% CAGR with market's trends,Benzinga,news.google.com/articles/CBMimQFodHRwczovL3d3dy5iZW56aW5nYS5jb20vcHJlc3NyZWxlYXNlcy8yMy8wOS8zNDE5NDEzNS9wdmEtZmliZXItbWFya2V0LWdyb3d0aC1vdXRsb29rLWZyb20tMjAyMy10by0yMDMwLWFuZC1pdC1pcy1wcm9qZWN0aW5nLWF0LTEzLTItY2Fnci13aXRoLW1hcmtldHMtdHLSAS1odHRwczovL3d3dy5iZW56aW5nYS5jb20vYW1wL2NvbnRlbnQvMzQxOTQxMzU?hl=en-IN&gl=IN&ceid=IN%3Aen,2023-09-03
36,Preparation of ZnGa2O4 nanoflowers and their full-color ...,Nature.com,news.google.com/articles/CBMiMmh0dHBzOi8vd3d3Lm5hdHVyZS5jb20vYXJ0aWNsZXMvczQxNTk4LTAyMy00MTY1OC010gEA?hl=en-IN&gl=IN&ceid=IN%3Aen,2023-09-02
35,Top-down structuring of freshwater bacterial communities by ...,Nature.com,news.google.com/articles/CBMiMmh0dHBzOi8vd3d3Lm5hdHVyZS5jb20vYXJ0aWNsZXMvczQzNzA1LTAyMy0wMDI4OS030gEA?hl=en-IN&gl=IN&ceid=IN%3Aen,2023-09-02
28,Enhancing photosynthetic CO2 fixation by assembling metal-organic ...,Nature.com,news.google.com/articles/CBMiMmh0dHBzOi8vd3d3Lm5hdHVyZS5jb20vYXJ0aWNsZXMvczQxNDY3LTAyMy00MDgzOS0w0gEA?hl=en-IN&gl=IN&ceid=IN%3Aen,2023-09-02
31,Atmosphere injection of sea salts during large explosive submarine ...,Nature.com,news.google.com/articles/CBMiMmh0dHBzOi8vd3d3Lm5hdHVyZS5jb20vYXJ0aWNsZXMvczQxNTk4LTAyMy00MTYzOS040gEA?hl=en-IN&gl=IN&ceid=IN%3Aen,2023-09-02
66,Long-term behavioral adaptation of Oldowan toolmakers to resource ...,Nature.com,news.google.com/articles/CBMiMmh0dHBzOi8vd3d3Lm5hdHVyZS5jb20vYXJ0aWNsZXMvczQxNTk4LTAyMy00MDc5My0z0gEA?hl=en-IN&gl=IN&ceid=IN%3Aen,2023-09-01
