,title,source,link,date
14,Innovative strategy for the conservation of a millennial mausoleum ...,Nature.com,news.google.com/articles/CBMiMmh0dHBzOi8vd3d3Lm5hdHVyZS5jb20vYXJ0aWNsZXMvczQxNTIyLTAyMy0wMDQzOC050gEA?hl=en-IN&gl=IN&ceid=IN%3Aen,2023-09-23
18,Rapid identification of chemical constituents of Chaihu‐jia‐Longgu ...,John Wiley,news.google.com/articles/CBMiOmh0dHBzOi8vb25saW5lbGlicmFyeS53aWxleS5jb20vZG9pLzEwLjEwMDIvc3NjcC4yMDIzMDAxMDPSAQA?hl=en-IN&gl=IN&ceid=IN%3Aen,2023-09-23
2,"Nifty, Sensex Headed Lower Subject to Pullback Rallies – Weekly ...",Moneylife,news.google.com/articles/CBMid2h0dHBzOi8vd3d3Lm1vbmV5bGlmZS5pbi9hcnRpY2xlL25pZnR5LXNlbnNleC1oZWFkZWQtbG93ZXItc3ViamVjdC10by1wdWxsYmFjay1yYWxsaWVzLXdlZWtseS1jbG9zaW5nLXJlcG9ydC83MjA3My5odG1s0gEA?hl=en-IN&gl=IN&ceid=IN%3Aen,2023-09-22
21,Walking the tightrope: a look at air change rates,Cleanroom Technology,news.google.com/articles/CBMibWh0dHBzOi8vd3d3LmNsZWFucm9vbXRlY2hub2xvZ3kuY29tL25ld3MvYXJ0aWNsZV9wYWdlL1dhbGtpbmdfdGhlX3RpZ2h0cm9wZV9hX2xvb2tfYXRfYWlyX2NoYW5nZV9yYXRlcy8yMTE1NzPSAQA?hl=en-IN&gl=IN&ceid=IN%3Aen,2023-09-22
54,mRNA vaccines encoding fusion proteins of monkeypox virus ...,Nature.com,news.google.com/articles/CBMiMmh0dHBzOi8vd3d3Lm5hdHVyZS5jb20vYXJ0aWNsZXMvczQxNDY3LTAyMy00MTYyOC010gEA?hl=en-IN&gl=IN&ceid=IN%3Aen,2023-09-22
41,Unveiling Exoplanet Secrets: The Near-Infrared Spectrograph on the ...,Spectroscopy Online,news.google.com/articles/CBMihAFodHRwczovL3d3dy5zcGVjdHJvc2NvcHlvbmxpbmUuY29tL3ZpZXcvdW52ZWlsaW5nLWV4b3BsYW5ldC1zZWNyZXRzLXRoZS1uZWFyLWluZnJhcmVkLXNwZWN0cm9ncmFwaC1vbi10aGUtamFtZXMtd2ViYi1zcGFjZS10ZWxlc2NvcGXSAQA?hl=en-IN&gl=IN&ceid=IN%3Aen,2023-09-22
40,Unveiling metabolic pathways involved in the extreme desiccation ...,Nature.com,news.google.com/articles/CBMiMmh0dHBzOi8vd3d3Lm5hdHVyZS5jb20vYXJ0aWNsZXMvczQxNTk4LTAyMy00MTg3OS040gEA?hl=en-IN&gl=IN&ceid=IN%3Aen,2023-09-22
5,The gut microbiota and its biogeography,Nature.com,news.google.com/articles/CBMiMmh0dHBzOi8vd3d3Lm5hdHVyZS5jb20vYXJ0aWNsZXMvczQxNTc5LTAyMy0wMDk2OS0w0gEA?hl=en-IN&gl=IN&ceid=IN%3Aen,2023-09-22
38,Two-tiered mutualism improves survival and competitiveness of ...,Nature.com,news.google.com/articles/CBMiMmh0dHBzOi8vd3d3Lm5hdHVyZS5jb20vYXJ0aWNsZXMvczQxMzk2LTAyMy0wMTUxOS010gEA?hl=en-IN&gl=IN&ceid=IN%3Aen,2023-09-22
30,Metagenomic data from surface seawater of the east coast of South ...,Nature.com,news.google.com/articles/CBMiMmh0dHBzOi8vd3d3Lm5hdHVyZS5jb20vYXJ0aWNsZXMvczQxNTk3LTAyMy0wMjU1Ni030gEA?hl=en-IN&gl=IN&ceid=IN%3Aen,2023-09-22
