,title,source,link,date
14,Years of life lost and long-term outcomes due to glomerular disease ...,Nature.com,news.google.com/articles/CBMiMmh0dHBzOi8vd3d3Lm5hdHVyZS5jb20vYXJ0aWNsZXMvczQxNTk4LTAyMy00NjI2OC050gEA?hl=en-IN&gl=IN&ceid=IN%3Aen,2023-11-05
16,Preparation and properties of novel binary and ternary highly ...,Nature.com,news.google.com/articles/CBMiMmh0dHBzOi8vd3d3Lm5hdHVyZS5jb20vYXJ0aWNsZXMvczQxNTk4LTAyMy00NjA4My0y0gEA?hl=en-IN&gl=IN&ceid=IN%3Aen,2023-11-05
21,Alumina and glass-bead blasting effect on bond strength of zirconia ...,Nature.com,news.google.com/articles/CBMiMmh0dHBzOi8vd3d3Lm5hdHVyZS5jb20vYXJ0aWNsZXMvczQxNTk4LTAyMy00NjU0OC000gEA?hl=en-IN&gl=IN&ceid=IN%3Aen,2023-11-05
27,Deficiency of histone variant macroH2A1.1 is associated with ...,Nature.com,news.google.com/articles/CBMiMmh0dHBzOi8vd3d3Lm5hdHVyZS5jb20vYXJ0aWNsZXMvczQxNTk4LTAyMy00NjMwNC040gEA?hl=en-IN&gl=IN&ceid=IN%3Aen,2023-11-05
30,Highly oxidized albumin is cleared by liver sinusoidal endothelial ...,Nature.com,news.google.com/articles/CBMiMmh0dHBzOi8vd3d3Lm5hdHVyZS5jb20vYXJ0aWNsZXMvczQxNTk4LTAyMy00NjQ2Mi050gEA?hl=en-IN&gl=IN&ceid=IN%3Aen,2023-11-05
36,BOPP Wrap Market expected to grow exponentially by 2029 ...,Argyle Report,news.google.com/articles/CBMiqQFodHRwczovL3d3dy5hcmd5bGVyZXBvcnQuY29tL2J1c2luZXNzL2JvcHAtd3JhcC1tYXJrZXQtZXhwZWN0ZWQtdG8tZ3Jvdy1leHBvbmVudGlhbGx5LWJ5LTIwMjktdGFnaGxlZWYtaW5kdXN0cmllcy1jY2wtaW5kdXN0cmllcy1qaW5kYWwtcG9seS1maWxtcy1zaWJ1ci1ob2xkaW5ncy8yNjAzNTMv0gEA?hl=en-IN&gl=IN&ceid=IN%3Aen,2023-11-04
60,3D Printing Miniatures: All You Need to Get Started,All3DP,news.google.com/articles/CBMiOGh0dHBzOi8vYWxsM2RwLmNvbS8yLzNkLXByaW50aW5nLW1pbmlhdHVyZXMtZ2V0LXN0YXJ0ZWQv0gEA?hl=en-IN&gl=IN&ceid=IN%3Aen,2023-11-04
53,Historical navigation routes in European waters leave their footprint ...,Nature.com,news.google.com/articles/CBMiMmh0dHBzOi8vd3d3Lm5hdHVyZS5jb20vYXJ0aWNsZXMvczQxNTk4LTAyMy00NjE3NC0w0gEA?hl=en-IN&gl=IN&ceid=IN%3Aen,2023-11-04
51,Electrochemical etching strategy for shaping monolithic 3D ...,Nature.com,news.google.com/articles/CBMiMmh0dHBzOi8vd3d3Lm5hdHVyZS5jb20vYXJ0aWNsZXMvczQxNTk4LTAyMy00NjExMC0y0gEA?hl=en-IN&gl=IN&ceid=IN%3Aen,2023-11-04
18,Improved artificial intelligence discrimination of minor histological ...,Nature.com,news.google.com/articles/CBMiMmh0dHBzOi8vd3d3Lm5hdHVyZS5jb20vYXJ0aWNsZXMvczQxNTk4LTAyMy00NjQ3Mi030gEA?hl=en-IN&gl=IN&ceid=IN%3Aen,2023-11-04
