,title,source,link,date
4,Researchers Fabricate Back-Contact Micrometric Photovoltaic Cells ...,Photonics.com,news.google.com/articles/CBMiWGh0dHBzOi8vd3d3LnBob3Rvbmljcy5jb20vQXJ0aWNsZXMvUmVzZWFyY2hlcnNfRmFicmljYXRlX0JhY2stQ29udGFjdF9NaWNyb21ldHJpYy9hNjk0OTTSAThodHRwczovL3d3dy5waG90b25pY3MuY29tL0FNUC9BTVBfQXJ0aWNsZS5hc3B4P0FJRD02OTQ5NA?hl=en-IN&gl=IN&ceid=IN%3Aen,2023-11-28
42,Nanoplatforms Augment Sonodynamic Induced Necroptosis at HCC ...,Dove Medical Press,news.google.com/articles/CBMigwFodHRwczovL3d3dy5kb3ZlcHJlc3MuY29tL3Nvbm9zZW5zaXRpemVyLW5hbm9wbGF0Zm9ybXMtYXVnbWVudGVkLXNvbm9keW5hbWljLXRoZXJhcHktc2Vuc2l0aXppbmctcGVlci1yZXZpZXdlZC1mdWxsdGV4dC1hcnRpY2xlLUlKTtIBAA?hl=en-IN&gl=IN&ceid=IN%3Aen,2023-11-28
24,Intrinsic plasticity of Purkinje cell serves homeostatic regulation of ...,Nature.com,news.google.com/articles/CBMiMmh0dHBzOi8vd3d3Lm5hdHVyZS5jb20vYXJ0aWNsZXMvczQxMzgwLTAyMy0wMjMyMC040gEA?hl=en-IN&gl=IN&ceid=IN%3Aen,2023-11-28
19,Development and validation of an UPLC-MS/MS method | DDDT,Dove Medical Press,news.google.com/articles/CBMihAFodHRwczovL3d3dy5kb3ZlcHJlc3MuY29tL2RldmVsb3BtZW50LWFuZC12YWxpZGF0aW9uLWEtdXBsYy1tc21zLW1ldGhvZC1mb3ItcXVhbnRpZmljYXRpb24tb2YtcGUtcGVlci1yZXZpZXdlZC1mdWxsdGV4dC1hcnRpY2xlLURERFTSAQA?hl=en-IN&gl=IN&ceid=IN%3Aen,2023-11-28
18,Aneuploidy during development in facultative parthenogenetic ...,Nature.com,news.google.com/articles/CBMiMmh0dHBzOi8vd3d3Lm5hdHVyZS5jb20vYXJ0aWNsZXMvczQxNDM3LTAyMy0wMDY2NC160gEA?hl=en-IN&gl=IN&ceid=IN%3Aen,2023-11-28
17,c(RGDfK)-surface functionalized NLCs loaded with gefitinib | IJN,Dove Medical Press,news.google.com/articles/CBMigwFodHRwczovL3d3dy5kb3ZlcHJlc3MuY29tL3BlbnRhcGVwdGlkZS1jcmdkZmstc3VyZmFjZS1lbmdpbmVlcmVkLW5hbm9zdHJ1Y3R1cmVkLWxpcGlkLWNhcnJpZXJzLWEtcGVlci1yZXZpZXdlZC1mdWxsdGV4dC1hcnRpY2xlLUlKTtIBAA?hl=en-IN&gl=IN&ceid=IN%3Aen,2023-11-28
15,A randomized controlled trial of nebulized surfactant for the ...,Nature.com,news.google.com/articles/CBMiMmh0dHBzOi8vd3d3Lm5hdHVyZS5jb20vYXJ0aWNsZXMvczQxNTk4LTAyMy00NzY3Mi140gEA?hl=en-IN&gl=IN&ceid=IN%3Aen,2023-11-28
14,Identification of the absorbed constituents and metabolites of ...,John Wiley,news.google.com/articles/CBMiNGh0dHBzOi8vb25saW5lbGlicmFyeS53aWxleS5jb20vZG9pLzEwLjEwMDIvYm1jLjU3ODPSAQA?hl=en-IN&gl=IN&ceid=IN%3Aen,2023-11-28
16,Saccharomyces cerevisiae additions normalized hemocyte ...,Nature.com,news.google.com/articles/CBMiMmh0dHBzOi8vd3d3Lm5hdHVyZS5jb20vYXJ0aWNsZXMvczQxNTk4LTAyMy00NzMyMy0x0gEA?hl=en-IN&gl=IN&ceid=IN%3Aen,2023-11-28
46,AET Offering Cutting-Edge LED Display Tech with a Pixel Pitch of ...,Bisinfotech,news.google.com/articles/CBMigAFodHRwczovL3d3dy5iaXNpbmZvdGVjaC5jb20vYWV0LW9mZmVyaW5nLWN1dHRpbmctZWRnZS1sZWQtZGlzcGxheS10ZWNoLXdpdGgtYS1waXhlbC1waXRjaC1vZi0wLTYtbWlsbGltZXRlcnMtd2l0aC1hLXBpeGVsLXBpdGNoL9IBAA?hl=en-IN&gl=IN&ceid=IN%3Aen,2023-11-28
