,title,source,link,date
45,Integrated Analysis of Non-coding RNA and mRNA Expression | JIR,Dove Medical Press,news.google.com/articles/CBMigwFodHRwczovL3d3dy5kb3ZlcHJlc3MuY29tL2ludGVncmF0ZWQtYW5hbHlzaXMtb2Ytbm9uLWNvZGluZy1ybmEtYW5kLW1ybmEtZXhwcmVzc2lvbi1wcm9maWxlcy1pbi0tcGVlci1yZXZpZXdlZC1mdWxsdGV4dC1hcnRpY2xlLUpJUtIBAA?hl=en-IN&gl=IN&ceid=IN%3Aen,2023-09-01
38,Lactiplantibacillus plantarum as a novel platform for production and ...,Nature.com,news.google.com/articles/CBMiMmh0dHBzOi8vd3d3Lm5hdHVyZS5jb20vYXJ0aWNsZXMvczQxNTk4LTAyMy00MTU1OS030gEA?hl=en-IN&gl=IN&ceid=IN%3Aen,2023-09-01
49,Long-term behavioral adaptation of Oldowan toolmakers to resource ...,Nature.com,news.google.com/articles/CBMiMmh0dHBzOi8vd3d3Lm5hdHVyZS5jb20vYXJ0aWNsZXMvczQxNTk4LTAyMy00MDc5My0z0gEA?hl=en-IN&gl=IN&ceid=IN%3Aen,2023-09-01
15,Targeting CaMKK2 Inhibits Actin Cytoskeletal Assembly to Suppress ...,Cancer Discovery,news.google.com/articles/CBMiaWh0dHBzOi8vYWFjcmpvdXJuYWxzLm9yZy9jYW5jZXJyZXMvYXJ0aWNsZS84My8xNy8yODg5LzcyODU5MS9UYXJnZXRpbmctQ2FNS0syLUluaGliaXRzLUFjdGluLUN5dG9za2VsZXRhbNIBAA?hl=en-IN&gl=IN&ceid=IN%3Aen,2023-09-01
18,Investigation of TGF‐α‐overexpressing mouse hepatocytes (TAMH ...,John Wiley,news.google.com/articles/CBMiNGh0dHBzOi8vb25saW5lbGlicmFyeS53aWxleS5jb20vZG9pLzEwLjEwMDIvamF0LjQ1MzjSAQA?hl=en-IN&gl=IN&ceid=IN%3Aen,2023-09-01
26,Environmentally relevant lead alters nuclear integrity in erythrocytes ...,John Wiley,news.google.com/articles/CBMiNGh0dHBzOi8vb25saW5lbGlicmFyeS53aWxleS5jb20vZG9pLzEwLjEwMDIvamF0LjQ1MzfSAQA?hl=en-IN&gl=IN&ceid=IN%3Aen,2023-09-01
20,Theranostic approach to specifically targeting the interloop region of ...,Nature.com,news.google.com/articles/CBMiMmh0dHBzOi8vd3d3Lm5hdHVyZS5jb20vYXJ0aWNsZXMvczQxNTk4LTAyMy0zOTQwNy050gEA?hl=en-IN&gl=IN&ceid=IN%3Aen,2023-09-01
56,X-ray free electron laser observation of ultrafast lattice behaviour ...,Nature.com,news.google.com/articles/CBMiMmh0dHBzOi8vd3d3Lm5hdHVyZS5jb20vYXJ0aWNsZXMvczQxNTk4LTAyMy00MDI4My020gEA?hl=en-IN&gl=IN&ceid=IN%3Aen,2023-08-31
39,Microplastic contamination of lettuces grown in urban vegetable ...,Nature.com,news.google.com/articles/CBMiMmh0dHBzOi8vd3d3Lm5hdHVyZS5jb20vYXJ0aWNsZXMvczQxNTk4LTAyMy00MDg0MC160gEA?hl=en-IN&gl=IN&ceid=IN%3Aen,2023-08-31
36,Resistive switching and battery-like characteristics in highly ...,Nature.com,news.google.com/articles/CBMiMmh0dHBzOi8vd3d3Lm5hdHVyZS5jb20vYXJ0aWNsZXMvczQxNTk4LTAyMy00MDg5MS0y0gEA?hl=en-IN&gl=IN&ceid=IN%3Aen,2023-08-31
