,title,source,link,date
27,Unravelling molecular mechanisms involved in resistance priming ...,Nature.com,news.google.com/articles/CBMiMmh0dHBzOi8vd3d3Lm5hdHVyZS5jb20vYXJ0aWNsZXMvczQxNTk4LTAyMy00MTk4MS140gEA?hl=en-IN&gl=IN&ceid=IN%3Aen,2023-09-06
17,Isolation of Spirosoma foliorum sp. nov. from the fallen leaf of Acer ...,Nature.com,news.google.com/articles/CBMiMmh0dHBzOi8vd3d3Lm5hdHVyZS5jb20vYXJ0aWNsZXMvczQxNTk4LTAyMy0zNTEwOC010gEA?hl=en-IN&gl=IN&ceid=IN%3Aen,2023-09-06
40,Combining Olaparib and Ascorbic acid on nanoparticles | IJN,Dove Medical Press,news.google.com/articles/CBMigwFodHRwczovL3d3dy5kb3ZlcHJlc3MuY29tL2NvbWJpbmluZy1vbGFwYXJpYi1hbmQtYXNjb3JiaWMtYWNpZC1vbi1uYW5vcGFydGljbGVzLXRvLWVuaGFuY2UtdGhlLWQtcGVlci1yZXZpZXdlZC1mdWxsdGV4dC1hcnRpY2xlLUlKTtIBAA?hl=en-IN&gl=IN&ceid=IN%3Aen,2023-09-06
45,PLGA/MBG scaffolds doped with ZIF-8 nanoparticles | IJN,Dove Medical Press,news.google.com/articles/CBMigwFodHRwczovL3d3dy5kb3ZlcHJlc3MuY29tL2VuaGFuY2VkLW9zdGVvZ2VuaWMtYWN0aXZpdHktYW5kLWJvbmUtcmVwYWlyLWFiaWxpdHktb2YtcGxnYW1iZy1zY2FmZm8tcGVlci1yZXZpZXdlZC1mdWxsdGV4dC1hcnRpY2xlLUlKTtIBAA?hl=en-IN&gl=IN&ceid=IN%3Aen,2023-09-06
29,Picosecond spin-orbit torque–induced coherent magnetization ...,Science,news.google.com/articles/CBMiMmh0dHBzOi8vd3d3LnNjaWVuY2Uub3JnL2RvaS8xMC4xMTI2L3NjaWFkdi5hZGg1NTYy0gEA?hl=en-IN&gl=IN&ceid=IN%3Aen,2023-09-06
26,The role of the retinal vasculature in age-related macular ...,Nature.com,news.google.com/articles/CBMiMmh0dHBzOi8vd3d3Lm5hdHVyZS5jb20vYXJ0aWNsZXMvczQxNDMzLTAyMy0wMjcyMS030gEA?hl=en-IN&gl=IN&ceid=IN%3Aen,2023-09-06
25,Circadian rhythm disruptions associated with opioid use disorder in ...,Nature.com,news.google.com/articles/CBMiMmh0dHBzOi8vd3d3Lm5hdHVyZS5jb20vYXJ0aWNsZXMvczQxMzgwLTAyMy0wMjI0MS020gEA?hl=en-IN&gl=IN&ceid=IN%3Aen,2023-09-06
24,Loss of attachment promotes proline accumulation and excretion in ...,Science,news.google.com/articles/CBMiMmh0dHBzOi8vd3d3LnNjaWVuY2Uub3JnL2RvaS8xMC4xMTI2L3NjaWFkdi5hZGgyMDIz0gEA?hl=en-IN&gl=IN&ceid=IN%3Aen,2023-09-06
23,Digital assay for rapid electronic quantification of clinical pathogens ...,Science,news.google.com/articles/CBMiMmh0dHBzOi8vd3d3LnNjaWVuY2Uub3JnL2RvaS8xMC4xMTI2L3NjaWFkdi5hZGk0OTk30gEA?hl=en-IN&gl=IN&ceid=IN%3Aen,2023-09-06
48,Nanoparticles with HA coating show diverse health effects | IJN,Dove Medical Press,news.google.com/articles/CBMigwFodHRwczovL3d3dy5kb3ZlcHJlc3MuY29tL2RvcGVkLW11bHRpcGxlLW5hbm9wYXJ0aWNsZXMtd2l0aC1oeWRyb3h5YXBhdGl0ZS1jb2F0aW5nLXNob3ctZGl2ZXJzZS0tcGVlci1yZXZpZXdlZC1mdWxsdGV4dC1hcnRpY2xlLUlKTtIBAA?hl=en-IN&gl=IN&ceid=IN%3Aen,2023-09-06
