,title,source,link,date
2,The future is now: Innovations in vitreoretinal surgery 3D viewing ...,Ophthalmology Times Europe,news.google.com/articles/CBMigQFodHRwczovL2V1cm9wZS5vcGh0aGFsbW9sb2d5dGltZXMuY29tL3ZpZXcvdGhlLWZ1dHVyZS1pcy1ub3ctaW5ub3ZhdGlvbnMtaW4tdml0cmVvcmV0aW5hbC1zdXJnZXJ5LTNkLXZpZXdpbmctc3lzdGVtcy1hbmQtcm9ib3RpY3PSAQA?hl=en-IN&gl=IN&ceid=IN%3Aen,2023-11-16
18,Study of the strongest dust storm occurred in Uzbekistan in ...,Nature.com,news.google.com/articles/CBMiMmh0dHBzOi8vd3d3Lm5hdHVyZS5jb20vYXJ0aWNsZXMvczQxNTk4LTAyMy00MjI1Ni0x0gEA?hl=en-IN&gl=IN&ceid=IN%3Aen,2023-11-16
30,Vitamin B12 is a limiting factor for induced cellular plasticity and ...,Nature.com,news.google.com/articles/CBMiMmh0dHBzOi8vd3d3Lm5hdHVyZS5jb20vYXJ0aWNsZXMvczQyMjU1LTAyMy0wMDkxNi020gEA?hl=en-IN&gl=IN&ceid=IN%3Aen,2023-11-16
29,Comprehensive two-dimensional liquid chromatography,Nature.com,news.google.com/articles/CBMiMmh0dHBzOi8vd3d3Lm5hdHVyZS5jb20vYXJ0aWNsZXMvczQzNTg2LTAyMy0wMDI2OS0w0gEA?hl=en-IN&gl=IN&ceid=IN%3Aen,2023-11-16
28,PSKR1 balances the plant growth–defence trade-off in the ...,Nature.com,news.google.com/articles/CBMiMmh0dHBzOi8vd3d3Lm5hdHVyZS5jb20vYXJ0aWNsZXMvczQxNDc3LTAyMy0wMTUzOS0x0gEA?hl=en-IN&gl=IN&ceid=IN%3Aen,2023-11-16
26,Molecular and cellular characterization of four putative nucleotide ...,Nature.com,news.google.com/articles/CBMiMmh0dHBzOi8vd3d3Lm5hdHVyZS5jb20vYXJ0aWNsZXMvczQxNTk4LTAyMy00NzExNC040gEA?hl=en-IN&gl=IN&ceid=IN%3Aen,2023-11-16
22,Efficient protocol for the differentiation of kidney podocytes from ...,Nature.com,news.google.com/articles/CBMiMmh0dHBzOi8vd3d3Lm5hdHVyZS5jb20vYXJ0aWNsZXMvczQxNTk4LTAyMy00NzA4Ny040gEA?hl=en-IN&gl=IN&ceid=IN%3Aen,2023-11-16
35,COL10A1 promotes tumorigenesis by modulating CD276 in ...,BMC Gastroenterology,news.google.com/articles/CBMiTmh0dHBzOi8vYm1jZ2FzdHJvZW50ZXJvbC5iaW9tZWRjZW50cmFsLmNvbS9hcnRpY2xlcy8xMC4xMTg2L3MxMjg3Ni0wMjMtMDMwNDUtMtIBAA?hl=en-IN&gl=IN&ceid=IN%3Aen,2023-11-16
20,The efficacy and safety of multi-loop traction device for gastric ...,Nature.com,news.google.com/articles/CBMiMmh0dHBzOi8vd3d3Lm5hdHVyZS5jb20vYXJ0aWNsZXMvczQxNTk4LTAyMy00NzM5MC000gEA?hl=en-IN&gl=IN&ceid=IN%3Aen,2023-11-16
21,Systematic mining of the human microbiome identifies antimicrobial ...,Nature.com,news.google.com/articles/CBMiMmh0dHBzOi8vd3d3Lm5hdHVyZS5jb20vYXJ0aWNsZXMvczQxNTY0LTAyMy0wMTUyNC020gEA?hl=en-IN&gl=IN&ceid=IN%3Aen,2023-11-16
