,title,source,link,date
31,An immortal porcine preadipocyte cell strain for efficient production ...,Nature.com,news.google.com/articles/CBMiMmh0dHBzOi8vd3d3Lm5hdHVyZS5jb20vYXJ0aWNsZXMvczQyMDAzLTAyMy0wNTU4My030gEA?hl=en-IN&gl=IN&ceid=IN%3Aen,2023-11-25
25,Manufacturing of quantum-tunneling MIM nanodiodes via rapid ...,Nature.com,news.google.com/articles/CBMiMmh0dHBzOi8vd3d3Lm5hdHVyZS5jb20vYXJ0aWNsZXMvczQxNTk4LTAyMy00Nzc3NS010gEA?hl=en-IN&gl=IN&ceid=IN%3Aen,2023-11-25
44,"Waterproofing Admixture Market worth $9.58 billion by 2030, growing at a CAGR of 7.34% - Exclusive Report by 3",openPR,news.google.com/articles/CBMiXWh0dHBzOi8vd3d3Lm9wZW5wci5jb20vbmV3cy8zMzAzMTI0L3dhdGVycHJvb2ZpbmctYWRtaXh0dXJlLW1hcmtldC13b3J0aC05LTU4LWJpbGxpb24tYnktMjAzMNIBXGh0dHBzOi8vd3d3Lm9wZW5wci5jb20vYW1wLzMzMDMxMjQvd2F0ZXJwcm9vZmluZy1hZG1peHR1cmUtbWFya2V0LXdvcnRoLTktNTgtYmlsbGlvbi1ieS0yMDMw?hl=en-IN&gl=IN&ceid=IN%3Aen,2023-11-25
34,A1BG-AS1 promotes adriamycin resistance of breast cancer by ...,Nature.com,news.google.com/articles/CBMiMmh0dHBzOi8vd3d3Lm5hdHVyZS5jb20vYXJ0aWNsZXMvczQxNTk4LTAyMy00Nzk1Ni0y0gEA?hl=en-IN&gl=IN&ceid=IN%3Aen,2023-11-25
30,Tamoxifen for the treatment of myeloproliferative neoplasms: A ...,Nature.com,news.google.com/articles/CBMiMmh0dHBzOi8vd3d3Lm5hdHVyZS5jb20vYXJ0aWNsZXMvczQxNDY3LTAyMy00MzE3NS010gEA?hl=en-IN&gl=IN&ceid=IN%3Aen,2023-11-25
14,Essential oil components of turmeric inhibit hepatic lipidification and ...,Nature.com,news.google.com/articles/CBMiMmh0dHBzOi8vd3d3Lm5hdHVyZS5jb20vYXJ0aWNsZXMvczQxNTk4LTAyMy00NzA5Ny020gEA?hl=en-IN&gl=IN&ceid=IN%3Aen,2023-11-25
16,Latest Nanopositioning Scanners for Optical Coherence ...,AZoNano,news.google.com/articles/CBMiM2h0dHBzOi8vd3d3LmF6b25hbm8uY29tL2FydGljbGUuYXNweD9BcnRpY2xlSUQ9NjYxMtIBAA?hl=en-IN&gl=IN&ceid=IN%3Aen,2023-11-25
17,Symbiodiniaceae photophysiology and stress resilience is ...,Nature.com,news.google.com/articles/CBMiMmh0dHBzOi8vd3d3Lm5hdHVyZS5jb20vYXJ0aWNsZXMvczQxNTk4LTAyMy00ODAyMC050gEA?hl=en-IN&gl=IN&ceid=IN%3Aen,2023-11-25
18,Effect of polyethylene terephthalate particles on filamentous bacteria ...,Nature.com,news.google.com/articles/CBMiMmh0dHBzOi8vd3d3Lm5hdHVyZS5jb20vYXJ0aWNsZXMvczQxNTk4LTAyMy00ODI1Ny000gEA?hl=en-IN&gl=IN&ceid=IN%3Aen,2023-11-25
27,Development and evaluation of specific polymerase chain reaction ...,Parasites & Vectors,news.google.com/articles/CBMiUWh0dHBzOi8vcGFyYXNpdGVzYW5kdmVjdG9ycy5iaW9tZWRjZW50cmFsLmNvbS9hcnRpY2xlcy8xMC4xMTg2L3MxMzA3MS0wMjMtMDYwNDUtetIBAA?hl=en-IN&gl=IN&ceid=IN%3Aen,2023-11-25
