,title,source,link,date
3,IR-817 encapsulated in albumin nanoparticles for imaging | IJN,Dove Medical Press,news.google.com/articles/CBMigwFodHRwczovL3d3dy5kb3ZlcHJlc3MuY29tL211bHRpZnVuY3Rpb25hbC1uZWFyLWluZnJhcmVkLWR5ZS1pci04MTctZW5jYXBzdWxhdGVkLWluLWFsYnVtaW4tbmFub3AtcGVlci1yZXZpZXdlZC1mdWxsdGV4dC1hcnRpY2xlLUlKTtIBAA?hl=en-IN&gl=IN&ceid=IN%3Aen,2023-09-04
18,"Vietnam Sealant Web Films Market Overview, Top Key Players, Growth, Size, Share, and Forecast 2023 to 203",Benzinga,news.google.com/articles/CBMimQFodHRwczovL3d3dy5iZW56aW5nYS5jb20vcHJlc3NyZWxlYXNlcy8yMy8wOS8zNDIwMzA0NS92aWV0bmFtLXNlYWxhbnQtd2ViLWZpbG1zLW1hcmtldC1vdmVydmlldy10b3Ata2V5LXBsYXllcnMtZ3Jvd3RoLXNpemUtc2hhcmUtYW5kLWZvcmVjYXN0LTIwMjMtdG8tMjDSAS1odHRwczovL3d3dy5iZW56aW5nYS5jb20vYW1wL2NvbnRlbnQvMzQyMDMwNDU?hl=en-IN&gl=IN&ceid=IN%3Aen,2023-09-04
61,"Mechanical Carbon Market Size, Share and Competitive Analysis 2023 to 2029 Carbone Lorraine (French), SG",Benzinga,news.google.com/articles/CBMimQFodHRwczovL3d3dy5iZW56aW5nYS5jb20vcHJlc3NyZWxlYXNlcy8yMy8wOS8zNDIwMDI1OC9tZWNoYW5pY2FsLWNhcmJvbi1tYXJrZXQtc2l6ZS1zaGFyZS1hbmQtY29tcGV0aXRpdmUtYW5hbHlzaXMtMjAyMy10by0yMDI5LWNhcmJvbmUtbG9ycmFpbmUtZnJlbmNoLXPSAS1odHRwczovL3d3dy5iZW56aW5nYS5jb20vYW1wL2NvbnRlbnQvMzQyMDAyNTg?hl=en-IN&gl=IN&ceid=IN%3Aen,2023-09-04
37,Pedogenesis of typical zonal soil drives belowground bacterial ...,Nature.com,news.google.com/articles/CBMiMmh0dHBzOi8vd3d3Lm5hdHVyZS5jb20vYXJ0aWNsZXMvczQxNTk4LTAyMy00MTQwMS0w0gEA?hl=en-IN&gl=IN&ceid=IN%3Aen,2023-09-04
26,Improving the cytotoxic response of tumor-infiltrating lymphocytes ...,Nature.com,news.google.com/articles/CBMiMmh0dHBzOi8vd3d3Lm5hdHVyZS5jb20vYXJ0aWNsZXMvczQxNDE3LTAyMy0wMDY1OC0z0gEA?hl=en-IN&gl=IN&ceid=IN%3Aen,2023-09-04
25,Single-cell RNA sequencing of murine hearts for studying the ...,Nature.com,news.google.com/articles/CBMiMmh0dHBzOi8vd3d3Lm5hdHVyZS5jb20vYXJ0aWNsZXMvczQxNTk3LTAyMy0wMjMzMy020gEA?hl=en-IN&gl=IN&ceid=IN%3Aen,2023-09-04
35,"AusQuest Limited - FURTHER DRILLING PLANNED AT THE MORRISEY MAGNETITE PROJECT, WA",Marketscreener.com,news.google.com/articles/CBMiogFodHRwczovL3d3dy5tYXJrZXRzY3JlZW5lci5jb20vcXVvdGUvc3RvY2svQVVTUVVFU1QtTElNSVRFRC0xMDM1MzY2MS9uZXdzL0F1c1F1ZXN0LUxpbWl0ZWQtRlVSVEhFUi1EUklMTElORy1QTEFOTkVELUFULVRIRS1NT1JSSVNFWS1NQUdORVRJVEUtUFJPSkVDVC1XQS00NDc2NTM3MS_SAaYBaHR0cHM6Ly93d3cubWFya2V0c2NyZWVuZXIuY29tL2FtcC9xdW90ZS9zdG9jay9BVVNRVUVTVC1MSU1JVEVELTEwMzUzNjYxL25ld3MvQXVzUXVlc3QtTGltaXRlZC1GVVJUSEVSLURSSUxMSU5HLVBMQU5ORUQtQVQtVEhFLU1PUlJJU0VZLU1BR05FVElURS1QUk9KRUNULVdBLTQ0NzY1MzcxLw?hl=en-IN&gl=IN&ceid=IN%3Aen,2023-09-04
12,Cryo-EM structure and molecular mechanism of abscisic acid ...,Nature.com,news.google.com/articles/CBMiMmh0dHBzOi8vd3d3Lm5hdHVyZS5jb20vYXJ0aWNsZXMvczQxNDc3LTAyMy0wMTUwOS030gEA?hl=en-IN&gl=IN&ceid=IN%3Aen,2023-09-04
7,Arctic warming by abundant fine sea salt aerosols from blowing snow,Nature.com,news.google.com/articles/CBMiMmh0dHBzOi8vd3d3Lm5hdHVyZS5jb20vYXJ0aWNsZXMvczQxNTYxLTAyMy0wMTI1NC040gEA?hl=en-IN&gl=IN&ceid=IN%3Aen,2023-09-04
8,Coleus vettiveroides ethanolic root extract induces cytotoxicity by ...,John Wiley,news.google.com/articles/CBMiNGh0dHBzOi8vb25saW5lbGlicmFyeS53aWxleS5jb20vZG9pLzEwLjEwMDIvamF0LjQ1MzbSAQA?hl=en-IN&gl=IN&ceid=IN%3Aen,2023-09-04
