,title,source,link,date
6,Improved artificial intelligence discrimination of minor histological ...,Nature.com,news.google.com/articles/CBMiMmh0dHBzOi8vd3d3Lm5hdHVyZS5jb20vYXJ0aWNsZXMvczQxNTk4LTAyMy00NjQ3Mi030gEA?hl=en-IN&gl=IN&ceid=IN%3Aen,2023-11-04
33,Historical navigation routes in European waters leave their footprint ...,Nature.com,news.google.com/articles/CBMiMmh0dHBzOi8vd3d3Lm5hdHVyZS5jb20vYXJ0aWNsZXMvczQxNTk4LTAyMy00NjE3NC0w0gEA?hl=en-IN&gl=IN&ceid=IN%3Aen,2023-11-04
26,SAA suppresses α-PD-1 induced anti-tumor immunity by driving TH2 ...,Nature.com,news.google.com/articles/CBMiMmh0dHBzOi8vd3d3Lm5hdHVyZS5jb20vYXJ0aWNsZXMvczQxNDE5LTAyMy0wNjE5OC130gEA?hl=en-IN&gl=IN&ceid=IN%3Aen,2023-11-04
25,Inulin-enriched Megamonas funiformis ameliorates metabolic ...,Nature.com,news.google.com/articles/CBMiMmh0dHBzOi8vd3d3Lm5hdHVyZS5jb20vYXJ0aWNsZXMvczQxNTIyLTAyMy0wMDQ1MS150gEA?hl=en-IN&gl=IN&ceid=IN%3Aen,2023-11-04
31,Non-coding RNA-mediated endothelial-to-mesenchymal transition ...,Cardiovascular Diabetology,news.google.com/articles/CBMiRWh0dHBzOi8vY2FyZGlhYi5iaW9tZWRjZW50cmFsLmNvbS9hcnRpY2xlcy8xMC4xMTg2L3MxMjkzMy0wMjMtMDIwMzktNNIBAA?hl=en-IN&gl=IN&ceid=IN%3Aen,2023-11-03
20,The roles of surround inhibition for the intrinsic function of the ...,pnas.org,news.google.com/articles/CBMiMGh0dHBzOi8vd3d3LnBuYXMub3JnL2RvaS8xMC4xMDczL3BuYXMuMjMxMzA1ODEyMNIBAA?hl=en-IN&gl=IN&ceid=IN%3Aen,2023-11-03
39,Small signal modulation of photonic crystal surface emitting lasers ...,Nature.com,news.google.com/articles/CBMiMmh0dHBzOi8vd3d3Lm5hdHVyZS5jb20vYXJ0aWNsZXMvczQxNTk4LTAyMy00NTQxNC030gEA?hl=en-IN&gl=IN&ceid=IN%3Aen,2023-11-03
49,Caribbean salinity anomalies contributed to variable North Atlantic ...,Science,news.google.com/articles/CBMiMmh0dHBzOi8vd3d3LnNjaWVuY2Uub3JnL2RvaS8xMC4xMTI2L3NjaWFkdi5hZGcyNjM50gEA?hl=en-IN&gl=IN&ceid=IN%3Aen,2023-11-03
37,Construction of Streptomyces coelicolor A3(2) mutants that ...,Nature.com,news.google.com/articles/CBMiMmh0dHBzOi8vd3d3Lm5hdHVyZS5jb20vYXJ0aWNsZXMvczQxNTk4LTAyMy00NjQxMC030gEA?hl=en-IN&gl=IN&ceid=IN%3Aen,2023-11-03
35,"Delineation of prototypical degradation mechanism, characterization ...",John Wiley,news.google.com/articles/CBMiNGh0dHBzOi8vb25saW5lbGlicmFyeS53aWxleS5jb20vZG9pLzEwLjEwMDIvYm1jLjU3NjHSAQA?hl=en-IN&gl=IN&ceid=IN%3Aen,2023-11-03
