,title,source,link,date
17,Mumbai News Live Updates: 17 of 22 monitoring stations in city report ‘moderate’ Air Quality Index today,The Indian Express,news.google.com/articles/CBMipAFodHRwczovL2luZGlhbmV4cHJlc3MuY29tL2FydGljbGUvY2l0aWVzL211bWJhaS9tdW1iYWktbmV3cy1saXZlLXVwZGF0ZXMtYWlyLXF1YWxpdHktcG9sbHV0aW9uLWVrbmF0aC1zaGluZGUtc2hhcmFkLXBhd2FyLXNoaXYtc2VuYS1ianAtbmNwLXRyYWZmaWMtd2VhdGhlci04OTk0NDQ3L9IBqQFodHRwczovL2luZGlhbmV4cHJlc3MuY29tL2FydGljbGUvY2l0aWVzL211bWJhaS9tdW1iYWktbmV3cy1saXZlLXVwZGF0ZXMtYWlyLXF1YWxpdHktcG9sbHV0aW9uLWVrbmF0aC1zaGluZGUtc2hhcmFkLXBhd2FyLXNoaXYtc2VuYS1ianAtbmNwLXRyYWZmaWMtd2VhdGhlci04OTk0NDQ3L2xpdGUv?hl=en-IN&gl=IN&ceid=IN%3Aen,2023-10-22
48,Short chain fatty acids facilitate protective immunity by macrophages ...,Nature.com,news.google.com/articles/CBMiMmh0dHBzOi8vd3d3Lm5hdHVyZS5jb20vYXJ0aWNsZXMvczQxNTk4LTAyMy00NTM0MC040gEA?hl=en-IN&gl=IN&ceid=IN%3Aen,2023-10-21
47,Application of ensemble machine learning approach to assess the ...,Nature.com,news.google.com/articles/CBMiMmh0dHBzOi8vd3d3Lm5hdHVyZS5jb20vYXJ0aWNsZXMvczQxNTk4LTAyMy00MzY4OS000gEA?hl=en-IN&gl=IN&ceid=IN%3Aen,2023-10-21
27,Characterisation and identification of chemical constituents in ...,John Wiley & Sons,news.google.com/articles/CBMiNGh0dHBzOi8vb25saW5lbGlicmFyeS53aWxleS5jb20vZG9pLzEwLjEwMDIvcGNhLjMyOTXSAQA?hl=en-IN&gl=IN&ceid=IN%3Aen,2023-10-20
26,"Simultaneous estimation of propyphenazone, flurbiprofen, and their ...",John Wiley & Sons,news.google.com/articles/CBMiOmh0dHBzOi8vb25saW5lbGlicmFyeS53aWxleS5jb20vZG9pLzEwLjEwMDIvc3NjcC4yMDIzMDAxMDTSAQA?hl=en-IN&gl=IN&ceid=IN%3Aen,2023-10-20
51,M2 macrophage-derived lncRNA MIR4435-2HG promotes IH | IJN,Dove Medical Press,news.google.com/articles/CBMigwFodHRwczovL3d3dy5kb3ZlcHJlc3MuY29tL20yLW1hY3JvcGhhZ2UtZGVyaXZlZC1leG9zb21hbC1sbmNybmEtbWlyNDQzNS0yaGctcHJvbW90ZXMtcHJvZ3Jlc3Npb24tcGVlci1yZXZpZXdlZC1mdWxsdGV4dC1hcnRpY2xlLUlKTtIBAA?hl=en-IN&gl=IN&ceid=IN%3Aen,2023-10-20
18,Man presents for refractive surgery consultation,Healio,news.google.com/articles/CBMiY2h0dHBzOi8vd3d3LmhlYWxpby5jb20vbmV3cy9vcGh0aGFsbW9sb2d5LzIwMjMxMDE2L21hbi1wcmVzZW50cy1mb3ItcmVmcmFjdGl2ZS1zdXJnZXJ5LWNvbnN1bHRhdGlvbtIBAA?hl=en-IN&gl=IN&ceid=IN%3Aen,2023-10-20
11,The murine retinal pigment epithelium requires peroxisomal β ...,pnas.org,news.google.com/articles/CBMiMGh0dHBzOi8vd3d3LnBuYXMub3JnL2RvaS8xMC4xMDczL3BuYXMuMjMwMTczMzEyMNIBAA?hl=en-IN&gl=IN&ceid=IN%3Aen,2023-10-20
38,Active Cladding Alignment Splicer | Fujikura Europe Ltd. | Oct 2023,Photonics.com,news.google.com/articles/CBMiTGh0dHBzOi8vd3d3LnBob3Rvbmljcy5jb20vUHJvZHVjdHMvQWN0aXZlX0NsYWRkaW5nX0FsaWdubWVudF9TcGxpY2VyL3ByNjkxMjbSAQA?hl=en-IN&gl=IN&ceid=IN%3Aen,2023-10-20
60,Large contributions of petrogenic and aged soil-derived organic ...,Nature.com,news.google.com/articles/CBMiMmh0dHBzOi8vd3d3Lm5hdHVyZS5jb20vYXJ0aWNsZXMvczQxNTk4LTAyMy00NTE0MS160gEA?hl=en-IN&gl=IN&ceid=IN%3Aen,2023-10-20
