,title,source,link,date
47,Innovative geopolymer-based cold asphalt emulsion mixture as eco ...,Nature.com,news.google.com/articles/CBMiMmh0dHBzOi8vd3d3Lm5hdHVyZS5jb20vYXJ0aWNsZXMvczQxNTk4LTAyMy00NDYzMC010gEA?hl=en-IN&gl=IN&ceid=IN%3Aen,2023-10-13
21,Direct regulation of the cardiac ryanodine receptor (RyR2) by O ...,Cardiovascular Diabetology,news.google.com/articles/CBMiRWh0dHBzOi8vY2FyZGlhYi5iaW9tZWRjZW50cmFsLmNvbS9hcnRpY2xlcy8xMC4xMTg2L3MxMjkzMy0wMjMtMDIwMTAtM9IBAA?hl=en-IN&gl=IN&ceid=IN%3Aen,2023-10-13
40,Enhanced detection of viruses for improved water safety | Scientific ...,Nature.com,news.google.com/articles/CBMiMmh0dHBzOi8vd3d3Lm5hdHVyZS5jb20vYXJ0aWNsZXMvczQxNTk4LTAyMy00NDUyOC0y0gEA?hl=en-IN&gl=IN&ceid=IN%3Aen,2023-10-13
11,Spatial Profiling of Circular RNAs in Cancer Reveals High ...,Cancer Discovery,news.google.com/articles/CBMiaWh0dHBzOi8vYWFjcmpvdXJuYWxzLm9yZy9jYW5jZXJyZXMvYXJ0aWNsZS84My8yMC8zMzQwLzcyOTUwNi9TcGF0aWFsLVByb2ZpbGluZy1vZi1DaXJjdWxhci1STkFzLWluLUNhbmNlctIBAA?hl=en-IN&gl=IN&ceid=IN%3Aen,2023-10-13
42,Char dominates black carbon aerosol emission and its historic ...,Nature.com,news.google.com/articles/CBMiMmh0dHBzOi8vd3d3Lm5hdHVyZS5jb20vYXJ0aWNsZXMvczQxNDY3LTAyMy00MjE5Mi040gEA?hl=en-IN&gl=IN&ceid=IN%3Aen,2023-10-13
26,Scalable multimodal weak anion exchange chromatographic ...,John Wiley,news.google.com/articles/CBMiOmh0dHBzOi8vb25saW5lbGlicmFyeS53aWxleS5jb20vZG9pLzEwLjEwMDIvZWxwcy4yMDIzMDAxMDbSAQA?hl=en-IN&gl=IN&ceid=IN%3Aen,2023-10-13
24,Exploring late Pleistocene bioturbation on Yermak Plateau to assess ...,Nature.com,news.google.com/articles/CBMiMmh0dHBzOi8vd3d3Lm5hdHVyZS5jb20vYXJ0aWNsZXMvczQxNTk4LTAyMy00NDI5NS0w0gEA?hl=en-IN&gl=IN&ceid=IN%3Aen,2023-10-13
22,Transcriptomic analysis of the antimicrobial activity of prodigiosin ...,Nature.com,news.google.com/articles/CBMiMmh0dHBzOi8vd3d3Lm5hdHVyZS5jb20vYXJ0aWNsZXMvczQxNTk4LTAyMy00NDYxMi030gEA?hl=en-IN&gl=IN&ceid=IN%3Aen,2023-10-13
33,Genomic adaptation of giant viruses in polar oceans,Nature.com,news.google.com/articles/CBMiMmh0dHBzOi8vd3d3Lm5hdHVyZS5jb20vYXJ0aWNsZXMvczQxNDY3LTAyMy00MTkxMC020gEA?hl=en-IN&gl=IN&ceid=IN%3Aen,2023-10-12
37,Integrating spatial transcriptomics data across different conditions ...,Nature.com,news.google.com/articles/CBMiMmh0dHBzOi8vd3d3Lm5hdHVyZS5jb20vYXJ0aWNsZXMvczQzNTg4LTAyMy0wMDUyOC130gEA?hl=en-IN&gl=IN&ceid=IN%3Aen,2023-10-12
