,title,source,link,date
17,A liquid chromatography‐tandem mass spectrometry method for ...,John Wiley & Sons,news.google.com/articles/CBMiOmh0dHBzOi8vb25saW5lbGlicmFyeS53aWxleS5jb20vZG9pLzEwLjEwMDIvanNzYy4yMDIzMDAwOTDSAQA?hl=en-IN&gl=IN&ceid=IN%3Aen,2023-09-09
5,Physicists unveil revolutionary technique to write in water,The Week,news.google.com/articles/CBMicGh0dHBzOi8vd3d3LnRoZXdlZWsuaW4vbmV3cy9zY2ktdGVjaC8yMDIzLzA5LzA5L3BoeXNpY2lzdHMtdW52ZWlsLXJldm9sdXRpb25hcnktdGVjaG5pcXVlLXRvLXdyaXRlLWluLXdhdGVyLmh0bWzSAXRodHRwczovL3d3dy50aGV3ZWVrLmluL25ld3Mvc2NpLXRlY2gvMjAyMy8wOS8wOS9waHlzaWNpc3RzLXVudmVpbC1yZXZvbHV0aW9uYXJ5LXRlY2huaXF1ZS10by13cml0ZS1pbi13YXRlci5hbXAuaHRtbA?hl=en-IN&gl=IN&ceid=IN%3Aen,2023-09-09
6,Inducing an LCST in hydrophilic polysaccharides via engineered ...,Nature.com,news.google.com/articles/CBMiMmh0dHBzOi8vd3d3Lm5hdHVyZS5jb20vYXJ0aWNsZXMvczQxNTk4LTAyMy00MTk0Ny160gEA?hl=en-IN&gl=IN&ceid=IN%3Aen,2023-09-09
38,In vitro hyperspectral biomarkers of human chondrosarcoma cells in ...,Nature.com,news.google.com/articles/CBMiMmh0dHBzOi8vd3d3Lm5hdHVyZS5jb20vYXJ0aWNsZXMvczQxNTk4LTAyMy00MTk5MS050gEA?hl=en-IN&gl=IN&ceid=IN%3Aen,2023-09-09
23,High‐performance liquid chromatography‐tandem mass ...,John Wiley & Sons,news.google.com/articles/CBMiOmh0dHBzOi8vb25saW5lbGlicmFyeS53aWxleS5jb20vZG9pLzEwLjEwMDIvanNzYy4yMDIzMDAzOTXSAQA?hl=en-IN&gl=IN&ceid=IN%3Aen,2023-09-09
16,Evaluation of a polarization-enhanced laparoscopy prototype for ...,Nature.com,news.google.com/articles/CBMiMmh0dHBzOi8vd3d3Lm5hdHVyZS5jb20vYXJ0aWNsZXMvczQxNTk4LTAyMy00MTM2MS010gEA?hl=en-IN&gl=IN&ceid=IN%3Aen,2023-09-09
30,Echinococcus granulosus cyst fluid inhibits inflammatory responses ...,Parasites & Vectors,news.google.com/articles/CBMiUWh0dHBzOi8vcGFyYXNpdGVzYW5kdmVjdG9ycy5iaW9tZWRjZW50cmFsLmNvbS9hcnRpY2xlcy8xMC4xMTg2L3MxMzA3MS0wMjMtMDU5NDgtMdIBAA?hl=en-IN&gl=IN&ceid=IN%3Aen,2023-09-09
18,Anti-atopic dermatitis effect of fish collagen on house dust mite ...,Nature.com,news.google.com/articles/CBMiMmh0dHBzOi8vd3d3Lm5hdHVyZS5jb20vYXJ0aWNsZXMvczQxNTk4LTAyMy00MTgzMS130gEA?hl=en-IN&gl=IN&ceid=IN%3Aen,2023-09-09
53,The SGLT2 inhibitor canagliflozin suppresses growth and enhances ...,Nature.com,news.google.com/articles/CBMiMmh0dHBzOi8vd3d3Lm5hdHVyZS5jb20vYXJ0aWNsZXMvczQyMDAzLTAyMy0wNTI4OS130gEA?hl=en-IN&gl=IN&ceid=IN%3Aen,2023-09-08
25,Comparing and integrating TMT‐SPS‐MS3 and label‐free ...,John Wiley & Sons,news.google.com/articles/CBMiOmh0dHBzOi8vb25saW5lbGlicmFyeS53aWxleS5jb20vZG9pLzEwLjEwMDIvcG1pYy4yMDIzMDAyMznSAQA?hl=en-IN&gl=IN&ceid=IN%3Aen,2023-09-08
