,title,source,link,date
6,Bright and sensitive red voltage indicators for imaging action ...,Science,news.google.com/articles/CBMiMmh0dHBzOi8vd3d3LnNjaWVuY2Uub3JnL2RvaS8xMC4xMTI2L3NjaWFkdi5hZGk0MjA40gEA?hl=en-IN&gl=IN&ceid=IN%3Aen,2023-11-22
38,Bony-fish-like scales in a Silurian maxillate placoderm,Nature.com,news.google.com/articles/CBMiMmh0dHBzOi8vd3d3Lm5hdHVyZS5jb20vYXJ0aWNsZXMvczQxNDY3LTAyMy00MzU1Ny050gEA?hl=en-IN&gl=IN&ceid=IN%3Aen,2023-11-22
29,Lipidure-based micropattern fabrication for stereotyping cell ...,Nature.com,news.google.com/articles/CBMiMmh0dHBzOi8vd3d3Lm5hdHVyZS5jb20vYXJ0aWNsZXMvczQxNTk4LTAyMy00NzUxNi040gEA?hl=en-IN&gl=IN&ceid=IN%3Aen,2023-11-22
30,The effect of altered pH growth conditions on the production ...,John Wiley,news.google.com/articles/CBMiOmh0dHBzOi8vb25saW5lbGlicmFyeS53aWxleS5jb20vZG9pLzEwLjEwMDIvcG1pYy4yMDIzMDAyNjnSAQA?hl=en-IN&gl=IN&ceid=IN%3Aen,2023-11-22
31,"HILPS, a long noncoding RNA essential for global oxygen sensing ...",Science,news.google.com/articles/CBMiMmh0dHBzOi8vd3d3LnNjaWVuY2Uub3JnL2RvaS8xMC4xMTI2L3NjaWFkdi5hZGkxODY30gEA?hl=en-IN&gl=IN&ceid=IN%3Aen,2023-11-22
34,ELOA3: A primate-specific RNA polymerase II elongation factor ...,Science,news.google.com/articles/CBMiMmh0dHBzOi8vd3d3LnNjaWVuY2Uub3JnL2RvaS8xMC4xMTI2L3NjaWFkdi5hZGoxMjYx0gEA?hl=en-IN&gl=IN&ceid=IN%3Aen,2023-11-22
36,Hopfion rings in a cubic chiral magnet,Nature.com,news.google.com/articles/CBMiMmh0dHBzOi8vd3d3Lm5hdHVyZS5jb20vYXJ0aWNsZXMvczQxNTg2LTAyMy0wNjY1OC010gEA?hl=en-IN&gl=IN&ceid=IN%3Aen,2023-11-22
37,Structural insights into cytokine cleavage by inflammatory caspase-4,Nature.com,news.google.com/articles/CBMiMmh0dHBzOi8vd3d3Lm5hdHVyZS5jb20vYXJ0aWNsZXMvczQxNTg2LTAyMy0wNjc1MS050gEA?hl=en-IN&gl=IN&ceid=IN%3Aen,2023-11-22
41,Hydrangea paniculata coumarins attenuate experimental ...,Nature.com,news.google.com/articles/CBMiMmh0dHBzOi8vd3d3Lm5hdHVyZS5jb20vYXJ0aWNsZXMvczQyMDAzLTAyMy0wNTU4MS050gEA?hl=en-IN&gl=IN&ceid=IN%3Aen,2023-11-22
27,NPLOC4 is a potential target and a poor prognostic signature in lung ...,Nature.com,news.google.com/articles/CBMiMmh0dHBzOi8vd3d3Lm5hdHVyZS5jb20vYXJ0aWNsZXMvczQxNTk4LTAyMy00Nzc4Mi020gEA?hl=en-IN&gl=IN&ceid=IN%3Aen,2023-11-22
