,title,source,link,date
53,Orange juice containing Pediococcus acidilactici CE51 modulates ...,Nature.com,news.google.com/articles/CBMiMmh0dHBzOi8vd3d3Lm5hdHVyZS5jb20vYXJ0aWNsZXMvczQxNTk4LTAyMy00NTgxOS000gEA?hl=en-IN&gl=IN&ceid=IN%3Aen,2023-10-28
15,Systematic pharmacology-based strategy to explore the mechanism ...,Nature.com,news.google.com/articles/CBMiMmh0dHBzOi8vd3d3Lm5hdHVyZS5jb20vYXJ0aWNsZXMvczQxNTk4LTAyMy00NTc0MS050gEA?hl=en-IN&gl=IN&ceid=IN%3Aen,2023-10-28
40,Shared biomarkers and immune cell infiltration signatures in ...,Nature.com,news.google.com/articles/CBMiMmh0dHBzOi8vd3d3Lm5hdHVyZS5jb20vYXJ0aWNsZXMvczQxNTk4LTAyMy00NDg1My020gEA?hl=en-IN&gl=IN&ceid=IN%3Aen,2023-10-28
25,Association of macular outward scleral height with axial length ...,Nature.com,news.google.com/articles/CBMiMmh0dHBzOi8vd3d3Lm5hdHVyZS5jb20vYXJ0aWNsZXMvczQxNDMzLTAyMy0wMjgwNC010gEA?hl=en-IN&gl=IN&ceid=IN%3Aen,2023-10-28
21,OnePlus Open vs Google Pixel Fold: Which foldable is worth your money?,Sportskeeda,news.google.com/articles/CBMiZGh0dHBzOi8vd3d3LnNwb3J0c2tlZWRhLmNvbS9nYW1pbmctdGVjaC9vbmVwbHVzLW9wZW4tdnMtZ29vZ2xlLXBpeGVsLWZvbGQtd2hpY2gtZm9sZGFibGUtd29ydGgtbW9uZXnSAWhodHRwczovL3d3dy5zcG9ydHNrZWVkYS5jb20vYW1wL2dhbWluZy10ZWNoL29uZXBsdXMtb3Blbi12cy1nb29nbGUtcGl4ZWwtZm9sZC13aGljaC1mb2xkYWJsZS13b3J0aC1tb25leQ?hl=en-IN&gl=IN&ceid=IN%3Aen,2023-10-28
20,Molecular-phylogenetic analyses of Ixodes species from South ...,Parasites & Vectors,news.google.com/articles/CBMiUWh0dHBzOi8vcGFyYXNpdGVzYW5kdmVjdG9ycy5iaW9tZWRjZW50cmFsLmNvbS9hcnRpY2xlcy8xMC4xMTg2L3MxMzA3MS0wMjMtMDU5OTgtNdIBAA?hl=en-IN&gl=IN&ceid=IN%3Aen,2023-10-28
16,Longitudinal structure-function analysis of molecularly-confirmed ...,Nature.com,news.google.com/articles/CBMiMmh0dHBzOi8vd3d3Lm5hdHVyZS5jb20vYXJ0aWNsZXMvczQxNDMzLTAyMy0wMjc5MS030gEA?hl=en-IN&gl=IN&ceid=IN%3Aen,2023-10-28
27,Long-term viable chimeric nephrons generated from progenitor cells ...,Nature.com,news.google.com/articles/CBMiMmh0dHBzOi8vd3d3Lm5hdHVyZS5jb20vYXJ0aWNsZXMvczQyMDAzLTAyMy0wNTQ4NC050gEA?hl=en-IN&gl=IN&ceid=IN%3Aen,2023-10-28
55,How Subtalar Kinematics Affects Knee Laxity in Soccer Players After ...,Cureus,news.google.com/articles/CBMijAFodHRwczovL3d3dy5jdXJldXMuY29tL2FydGljbGVzLzE5MTYzOC1ob3ctc3VidGFsYXIta2luZW1hdGljcy1hZmZlY3RzLWtuZWUtbGF4aXR5LWluLXNvY2Nlci1wbGF5ZXJzLWFmdGVyLWFudGVyaW9yLWNydWNpYXRlLWxpZ2FtZW50LWluanVyedIBAA?hl=en-IN&gl=IN&ceid=IN%3Aen,2023-10-28
34,The anticancer and antibacterial potential of bioactive secondary ...,Nature.com,news.google.com/articles/CBMiMmh0dHBzOi8vd3d3Lm5hdHVyZS5jb20vYXJ0aWNsZXMvczQxNTk4LTAyMy00NTkxMC130gEA?hl=en-IN&gl=IN&ceid=IN%3Aen,2023-10-27
