,title,source,link,date
19,Extraction solvent selection for Cannabis sativa L. by efficient ...,John Wiley & Sons,news.google.com/articles/CBMiNGh0dHBzOi8vb25saW5lbGlicmFyeS53aWxleS5jb20vZG9pLzEwLjEwMDIvcGNhLjMyODLSAQA?hl=en-IN&gl=IN&ceid=IN%3Aen,2023-09-15
13,MEG3 activates necroptosis in human neuron xenografts modeling ...,Science,news.google.com/articles/CBMiM2h0dHBzOi8vd3d3LnNjaWVuY2Uub3JnL2RvaS8xMC4xMTI2L3NjaWVuY2UuYWJwOTU1NtIBAA?hl=en-IN&gl=IN&ceid=IN%3Aen,2023-09-14
15,Formation of vesicular structures from fatty acids formed under ...,Nature.com,news.google.com/articles/CBMiMmh0dHBzOi8vd3d3Lm5hdHVyZS5jb20vYXJ0aWNsZXMvczQxNTk4LTAyMy00MjU1Mi130gEA?hl=en-IN&gl=IN&ceid=IN%3Aen,2023-09-14
26,Cellular harmonics for the morphology-invariant analysis of ...,Nature.com,news.google.com/articles/CBMiMmh0dHBzOi8vd3d3Lm5hdHVyZS5jb20vYXJ0aWNsZXMvczQzNTg4LTAyMy0wMDUxMi000gEA?hl=en-IN&gl=IN&ceid=IN%3Aen,2023-09-14
27,Inflammation and oxidative stress markers in type 2 diabetes ...,Cardiovascular Diabetology,news.google.com/articles/CBMiRWh0dHBzOi8vY2FyZGlhYi5iaW9tZWRjZW50cmFsLmNvbS9hcnRpY2xlcy8xMC4xMTg2L3MxMjkzMy0wMjMtMDE5NzktMdIBAA?hl=en-IN&gl=IN&ceid=IN%3Aen,2023-09-14
20,Atomic faulting induced exceptional cryogenic strain hardening in ...,Science,news.google.com/articles/CBMiM2h0dHBzOi8vd3d3LnNjaWVuY2Uub3JnL2RvaS8xMC4xMTI2L3NjaWVuY2UuYWRqMzk3NNIBAA?hl=en-IN&gl=IN&ceid=IN%3Aen,2023-09-14
30,CryoEM reveals that ribosomes in microsporidian spores are locked ...,Nature.com,news.google.com/articles/CBMiMmh0dHBzOi8vd3d3Lm5hdHVyZS5jb20vYXJ0aWNsZXMvczQxNTY0LTAyMy0wMTQ2OS130gEA?hl=en-IN&gl=IN&ceid=IN%3Aen,2023-09-14
17,Formation of lunar surface water associated with high-energy ...,Nature.com,news.google.com/articles/CBMiMmh0dHBzOi8vd3d3Lm5hdHVyZS5jb20vYXJ0aWNsZXMvczQxNTUwLTAyMy0wMjA4MS150gEA?hl=en-IN&gl=IN&ceid=IN%3Aen,2023-09-14
23,Empirical Raman calibration of trioctahedral ferromagnesium ...,John Wiley & Sons,news.google.com/articles/CBMiNGh0dHBzOi8vb25saW5lbGlicmFyeS53aWxleS5jb20vZG9pLzEwLjEwMDIvanJzLjY1OTbSAQA?hl=en-IN&gl=IN&ceid=IN%3Aen,2023-09-14
12,The temporal dynamics of Plasmodium species infection after ...,Malaria Journal,news.google.com/articles/CBMiTGh0dHBzOi8vbWFsYXJpYWpvdXJuYWwuYmlvbWVkY2VudHJhbC5jb20vYXJ0aWNsZXMvMTAuMTE4Ni9zMTI5MzYtMDIzLTA0NzEyLTHSAQA?hl=en-IN&gl=IN&ceid=IN%3Aen,2023-09-14
