,title,source,link,date
36,Long-Circulating Lipid Nanospheres | IJN,Dove Medical Press,news.google.com/articles/CBMigwFodHRwczovL3d3dy5kb3ZlcHJlc3MuY29tL2xvbmctY2lyY3VsYXRpbmctbGlwaWQtbmFub3NwaGVyZXMtbG9hZGVkLXdpdGgtZmx1cmJpcHJvZmVuLWF4ZXRpbC1mb3ItcGVlci1yZXZpZXdlZC1mdWxsdGV4dC1hcnRpY2xlLUlKTtIBAA?hl=en-IN&gl=IN&ceid=IN%3Aen,2023-09-08
48,Performance evaluation of the AiDx multi-diagnostic automated ...,Nature.com,news.google.com/articles/CBMiMmh0dHBzOi8vd3d3Lm5hdHVyZS5jb20vYXJ0aWNsZXMvczQxNTk4LTAyMy00MjA0OS020gEA?hl=en-IN&gl=IN&ceid=IN%3Aen,2023-09-08
20,Non-thermal atmospheric pressure plasma treatment increases ...,Nature.com,news.google.com/articles/CBMiMmh0dHBzOi8vd3d3Lm5hdHVyZS5jb20vYXJ0aWNsZXMvczQxNTk4LTAyMy00MTkwNS050gEA?hl=en-IN&gl=IN&ceid=IN%3Aen,2023-09-08
16,Glutamine supplementation alleviated aortic atherosclerosis in mice ...,John Wiley & Sons,news.google.com/articles/CBMiOmh0dHBzOi8vb25saW5lbGlicmFyeS53aWxleS5jb20vZG9pLzEwLjEwMDIvcG1pYy4yMDIzMDAxNznSAQA?hl=en-IN&gl=IN&ceid=IN%3Aen,2023-09-08
13,Comparing and integrating TMT‐SPS‐MS3 and label‐free ...,John Wiley & Sons,news.google.com/articles/CBMiOmh0dHBzOi8vb25saW5lbGlicmFyeS53aWxleS5jb20vZG9pLzEwLjEwMDIvcG1pYy4yMDIzMDAyMznSAQA?hl=en-IN&gl=IN&ceid=IN%3Aen,2023-09-08
41,Rice straw-derived smoke water promotes rice root growth under ...,Nature.com,news.google.com/articles/CBMiMmh0dHBzOi8vd3d3Lm5hdHVyZS5jb20vYXJ0aWNsZXMvczQxNTk4LTAyMy00MTk4Ny010gEA?hl=en-IN&gl=IN&ceid=IN%3Aen,2023-09-08
56,Time Dependent Capacitance Drift of X7RMLCCs Under Exposure ...,ELE Times,news.google.com/articles/CBMicmh0dHBzOi8vd3d3LmVsZXRpbWVzLmNvbS90aW1lLWRlcGVuZGVudC1jYXBhY2l0YW5jZS1kcmlmdC1vZi14N3JtbGNjcy11bmRlci1leHBvc3VyZS10by1hLWNvbnN0YW50LWRjLWJpYXMtdm9sdGFnZdIBAA?hl=en-IN&gl=IN&ceid=IN%3Aen,2023-09-08
6,"Sildenafil, a phosphodiesterase-5 inhibitor, stimulates angiogenesis ...",Journal of Translational Medicine,news.google.com/articles/CBMiVGh0dHBzOi8vdHJhbnNsYXRpb25hbC1tZWRpY2luZS5iaW9tZWRjZW50cmFsLmNvbS9hcnRpY2xlcy8xMC4xMTg2L3MxMjk2Ny0wMjMtMDQ0NDEtONIBAA?hl=en-IN&gl=IN&ceid=IN%3Aen,2023-09-08
5,"Kaolin Clay Market Share, Size and Forecast to 2030 | BASF, Imerys ...",Digital Journal,news.google.com/articles/CBMilAFodHRwczovL3d3dy5kaWdpdGFsam91cm5hbC5jb20vcHIvbmV3cy90aGVleHByZXNzd2lyZS9rYW9saW4tY2xheS1tYXJrZXQtc2hhcmUtc2l6ZS1hbmQtZm9yZWNhc3QtdG8tMjAzMC1iYXNmLWltZXJ5cy1hc2hhcHVyYS1ncm91cC0xMjgtcGFnZXMtcmVwb3J00gEA?hl=en-IN&gl=IN&ceid=IN%3Aen,2023-09-08
32,The SGLT2 inhibitor canagliflozin suppresses growth and enhances ...,Nature.com,news.google.com/articles/CBMiMmh0dHBzOi8vd3d3Lm5hdHVyZS5jb20vYXJ0aWNsZXMvczQyMDAzLTAyMy0wNTI4OS130gEA?hl=en-IN&gl=IN&ceid=IN%3Aen,2023-09-08
