,title,source,link,date
27,BFGF combined with ultrapulsed fractional CO2 for acne scars | CCID,Dove Medical Press,news.google.com/articles/CBMihAFodHRwczovL3d3dy5kb3ZlcHJlc3MuY29tL3RoZXJhcGV1dGljLWVmZmljYWN5LW9mLWJvdmluZS1iYXNpYy1maWJyb2JsYXN0LWdyb3d0aC1mYWN0b3ItY29tYmluZWQtcGVlci1yZXZpZXdlZC1mdWxsdGV4dC1hcnRpY2xlLUNDSUTSAQA?hl=en-IN&gl=IN&ceid=IN%3Aen,2023-10-10
24,Mutation in Polycomb repressive complex 2 gene OsFIE2 promotes ...,Nature.com,news.google.com/articles/CBMiMmh0dHBzOi8vd3d3Lm5hdHVyZS5jb20vYXJ0aWNsZXMvczQxNDc3LTAyMy0wMTUzNi000gEA?hl=en-IN&gl=IN&ceid=IN%3Aen,2023-10-09
16,Resolution of fibrosis in mdx dystrophic mouse after oral ...,Nature.com,news.google.com/articles/CBMiMmh0dHBzOi8vd3d3Lm5hdHVyZS5jb20vYXJ0aWNsZXMvczQxNTk4LTAyMy00NDMzMC0w0gEA?hl=en-IN&gl=IN&ceid=IN%3Aen,2023-10-09
23,Rapid discovery of high-affinity antibodies via massively parallel ...,Nature.com,news.google.com/articles/CBMiMmh0dHBzOi8vd3d3Lm5hdHVyZS5jb20vYXJ0aWNsZXMvczQxNTUxLTAyMy0wMTA5My0z0gEA?hl=en-IN&gl=IN&ceid=IN%3Aen,2023-10-09
30,Effect of electrode materials on resistive switching behaviour of ...,Nature.com,news.google.com/articles/CBMiMmh0dHBzOi8vd3d3Lm5hdHVyZS5jb20vYXJ0aWNsZXMvczQxNTk4LTAyMy00NDExMC130gEA?hl=en-IN&gl=IN&ceid=IN%3Aen,2023-10-09
21,Direct neuronal conversion of microglia/macrophages reinstates ...,pnas.org,news.google.com/articles/CBMiMGh0dHBzOi8vd3d3LnBuYXMub3JnL2RvaS8xMC4xMDczL3BuYXMuMjMwNzk3MjEyMNIBAA?hl=en-IN&gl=IN&ceid=IN%3Aen,2023-10-09
35,Coevolution between marine Aeromonas and phages reveals ...,Nature.com,news.google.com/articles/CBMiMmh0dHBzOi8vd3d3Lm5hdHVyZS5jb20vYXJ0aWNsZXMvczQxMzk2LTAyMy0wMTUyOS0z0gEA?hl=en-IN&gl=IN&ceid=IN%3Aen,2023-10-09
19,Fully automated sequential immunofluorescence (seqIF) for ...,Nature.com,news.google.com/articles/CBMiMmh0dHBzOi8vd3d3Lm5hdHVyZS5jb20vYXJ0aWNsZXMvczQxNTk4LTAyMy00MzQzNS130gEA?hl=en-IN&gl=IN&ceid=IN%3Aen,2023-10-09
18,Use of natural biotechnological processes to modify the nutritional ...,Nature.com,news.google.com/articles/CBMiMmh0dHBzOi8vd3d3Lm5hdHVyZS5jb20vYXJ0aWNsZXMvczQxNTk4LTAyMy00NDIzOS040gEA?hl=en-IN&gl=IN&ceid=IN%3Aen,2023-10-09
17,Identification and structural and biophysical characterization of a ...,pnas.org,news.google.com/articles/CBMiMGh0dHBzOi8vd3d3LnBuYXMub3JnL2RvaS8xMC4xMDczL3BuYXMuMjIyMDAyOTEyMNIBAA?hl=en-IN&gl=IN&ceid=IN%3Aen,2023-10-09
