,title,source,link,date
53,Unravelling molecular mechanisms involved in resistance priming ...,Nature.com,news.google.com/articles/CBMiMmh0dHBzOi8vd3d3Lm5hdHVyZS5jb20vYXJ0aWNsZXMvczQxNTk4LTAyMy00MTk4MS140gEA?hl=en-IN&gl=IN&ceid=IN%3Aen,2023-09-06
17,"Bleaching Earth Market Dynamic Demand, Growth, Strategies and Forecast 2031",openPR,news.google.com/articles/CBMiW2h0dHBzOi8vd3d3Lm9wZW5wci5jb20vbmV3cy8zMTk4MTM1L2JsZWFjaGluZy1lYXJ0aC1tYXJrZXQtZHluYW1pYy1kZW1hbmQtZ3Jvd3RoLXN0cmF0ZWdpZXPSAVpodHRwczovL3d3dy5vcGVucHIuY29tL2FtcC8zMTk4MTM1L2JsZWFjaGluZy1lYXJ0aC1tYXJrZXQtZHluYW1pYy1kZW1hbmQtZ3Jvd3RoLXN0cmF0ZWdpZXM?hl=en-IN&gl=IN&ceid=IN%3Aen,2023-09-06
34,Combining Olaparib and Ascorbic acid on nanoparticles | IJN,Dove Medical Press,news.google.com/articles/CBMigwFodHRwczovL3d3dy5kb3ZlcHJlc3MuY29tL2NvbWJpbmluZy1vbGFwYXJpYi1hbmQtYXNjb3JiaWMtYWNpZC1vbi1uYW5vcGFydGljbGVzLXRvLWVuaGFuY2UtdGhlLWQtcGVlci1yZXZpZXdlZC1mdWxsdGV4dC1hcnRpY2xlLUlKTtIBAA?hl=en-IN&gl=IN&ceid=IN%3Aen,2023-09-06
32,Prime Mining Releases High-Grade Drill Results from Two New ...,BNamericas English,news.google.com/articles/CBMifmh0dHBzOi8vd3d3LmJuYW1lcmljYXMuY29tL2VuL25ld3MvcHJpbWUtbWluaW5nLXJlbGVhc2VzLWhpZ2gtZ3JhZGUtZHJpbGwtcmVzdWx0cy1mcm9tLXR3by1uZXctZ2VuZXJhdGl2ZS10YXJnZXRzLWF0LWxvcy1yZXllc9IBAA?hl=en-IN&gl=IN&ceid=IN%3Aen,2023-09-06
43,Nanoparticles with HA coating show diverse health effects | IJN,Dove Medical Press,news.google.com/articles/CBMigwFodHRwczovL3d3dy5kb3ZlcHJlc3MuY29tL2RvcGVkLW11bHRpcGxlLW5hbm9wYXJ0aWNsZXMtd2l0aC1oeWRyb3h5YXBhdGl0ZS1jb2F0aW5nLXNob3ctZGl2ZXJzZS0tcGVlci1yZXZpZXdlZC1mdWxsdGV4dC1hcnRpY2xlLUlKTtIBAA?hl=en-IN&gl=IN&ceid=IN%3Aen,2023-09-06
46,Exploring the mechanisms of modified Bu-Shen-Yi-Qi decoction ...,Dove Medical Press,news.google.com/articles/CBMihAFodHRwczovL3d3dy5kb3ZlcHJlc3MuY29tL2V4cGxvcmluZy10aGUtbWVjaGFuaXNtcy1vZi1tb2RpZmllZC1idS1zaGVuLXlpLXFpLWRlY29jdGlvbi1mb3ItY29wZC0tcGVlci1yZXZpZXdlZC1mdWxsdGV4dC1hcnRpY2xlLURERFTSAQA?hl=en-IN&gl=IN&ceid=IN%3Aen,2023-09-06
23,The role of the retinal vasculature in age-related macular ...,Nature.com,news.google.com/articles/CBMiMmh0dHBzOi8vd3d3Lm5hdHVyZS5jb20vYXJ0aWNsZXMvczQxNDMzLTAyMy0wMjcyMS030gEA?hl=en-IN&gl=IN&ceid=IN%3Aen,2023-09-06
22,Time-dependent cell-state selection identifies transiently expressed ...,Nature.com,news.google.com/articles/CBMiMmh0dHBzOi8vd3d3Lm5hdHVyZS5jb20vYXJ0aWNsZXMvczQyMDAzLTAyMy0wNTI5Ny130gEA?hl=en-IN&gl=IN&ceid=IN%3Aen,2023-09-06
21,Circadian rhythm disruptions associated with opioid use disorder in ...,Nature.com,news.google.com/articles/CBMiMmh0dHBzOi8vd3d3Lm5hdHVyZS5jb20vYXJ0aWNsZXMvczQxMzgwLTAyMy0wMjI0MS020gEA?hl=en-IN&gl=IN&ceid=IN%3Aen,2023-09-06
37,Isolation of Spirosoma foliorum sp. nov. from the fallen leaf of Acer ...,Nature.com,news.google.com/articles/CBMiMmh0dHBzOi8vd3d3Lm5hdHVyZS5jb20vYXJ0aWNsZXMvczQxNTk4LTAyMy0zNTEwOC010gEA?hl=en-IN&gl=IN&ceid=IN%3Aen,2023-09-06
