,title,source,link,date
35,Comprehensive study of allergenic tree species: Palynological ...,John Wiley,news.google.com/articles/CBMiNGh0dHBzOi8vb25saW5lbGlicmFyeS53aWxleS5jb20vZG9pLzEwLjEwMDIvYm1jLjU3NzTSAQA?hl=en-IN&gl=IN&ceid=IN%3Aen,2023-11-17
38,"With the new proactive extinguisher, GFI ignites a new era in fire safety",The Worldfolio,news.google.com/articles/CBMidmh0dHBzOi8vd3d3LnRoZXdvcmxkZm9saW8uY29tL2ludGVydmlld3MvZ2ZpLWNyZWF0b3JzLW9mLWlubm92YXRpdmUtZmlyZXN1cHByZXNzaW9uLXRlY2hub2xvZ3ktbG9vay10by1nby1nbG9iYWwvNTk3OC_SAQA?hl=en-IN&gl=IN&ceid=IN%3Aen,2023-11-17
25,Multi-modal proteomic characterization of lysosomal function and ...,Molecular Neurodegeneration,news.google.com/articles/CBMiWGh0dHBzOi8vbW9sZWN1bGFybmV1cm9kZWdlbmVyYXRpb24uYmlvbWVkY2VudHJhbC5jb20vYXJ0aWNsZXMvMTAuMTE4Ni9zMTMwMjQtMDIzLTAwNjczLXfSAQA?hl=en-IN&gl=IN&ceid=IN%3Aen,2023-11-16
53,Mechanism of target site selection by type V-K CRISPR-associated ...,Science,news.google.com/articles/CBMiM2h0dHBzOi8vd3d3LnNjaWVuY2Uub3JnL2RvaS8xMC4xMTI2L3NjaWVuY2UuYWRqODU0M9IBAA?hl=en-IN&gl=IN&ceid=IN%3Aen,2023-11-16
40,COL10A1 promotes tumorigenesis by modulating CD276 in ...,BMC Gastroenterology,news.google.com/articles/CBMiTmh0dHBzOi8vYm1jZ2FzdHJvZW50ZXJvbC5iaW9tZWRjZW50cmFsLmNvbS9hcnRpY2xlcy8xMC4xMTg2L3MxMjg3Ni0wMjMtMDMwNDUtMtIBAA?hl=en-IN&gl=IN&ceid=IN%3Aen,2023-11-16
36,Vitamin B12 is a limiting factor for induced cellular plasticity and ...,Nature.com,news.google.com/articles/CBMiMmh0dHBzOi8vd3d3Lm5hdHVyZS5jb20vYXJ0aWNsZXMvczQyMjU1LTAyMy0wMDkxNi020gEA?hl=en-IN&gl=IN&ceid=IN%3Aen,2023-11-16
34,Comprehensive two-dimensional liquid chromatography,Nature.com,news.google.com/articles/CBMiMmh0dHBzOi8vd3d3Lm5hdHVyZS5jb20vYXJ0aWNsZXMvczQzNTg2LTAyMy0wMDI2OS0w0gEA?hl=en-IN&gl=IN&ceid=IN%3Aen,2023-11-16
33,PSKR1 balances the plant growth–defence trade-off in the ...,Nature.com,news.google.com/articles/CBMiMmh0dHBzOi8vd3d3Lm5hdHVyZS5jb20vYXJ0aWNsZXMvczQxNDc3LTAyMy0wMTUzOS0x0gEA?hl=en-IN&gl=IN&ceid=IN%3Aen,2023-11-16
30,Molecular and cellular characterization of four putative nucleotide ...,Nature.com,news.google.com/articles/CBMiMmh0dHBzOi8vd3d3Lm5hdHVyZS5jb20vYXJ0aWNsZXMvczQxNTk4LTAyMy00NzExNC040gEA?hl=en-IN&gl=IN&ceid=IN%3Aen,2023-11-16
28,Tunable force transduction through the Escherichia coli cell ...,pnas.org,news.google.com/articles/CBMiMGh0dHBzOi8vd3d3LnBuYXMub3JnL2RvaS8xMC4xMDczL3BuYXMuMjMwNjcwNzEyMNIBAA?hl=en-IN&gl=IN&ceid=IN%3Aen,2023-11-16
