,title,source,link,date
0,"Starching Clay Market Competitive Landscape and Progress 2023-2029 by Key Players | BASF SE , Musim Mas H",Benzinga,news.google.com/articles/CBMimQFodHRwczovL3d3dy5iZW56aW5nYS5jb20vcHJlc3NyZWxlYXNlcy8yMy8wOS8zNDE4NzU0Ni9zdGFyY2hpbmctY2xheS1tYXJrZXQtY29tcGV0aXRpdmUtbGFuZHNjYXBlLWFuZC1wcm9ncmVzcy0yMDIzLTIwMjktYnkta2V5LXBsYXllcnMtYmFzZi1zZS1tdXNpbS1tYXPSAS1odHRwczovL3d3dy5iZW56aW5nYS5jb20vYW1wL2NvbnRlbnQvMzQxODc1NDY?hl=en-IN&gl=IN&ceid=IN%3Aen,2023-09-02
15,Experimental investigation and quantitative prediction in ...,Nature.com,news.google.com/articles/CBMiMmh0dHBzOi8vd3d3Lm5hdHVyZS5jb20vYXJ0aWNsZXMvczQxNTk4LTAyMy00MTU3OC000gEA?hl=en-IN&gl=IN&ceid=IN%3Aen,2023-09-02
28,Enhancing photosynthetic CO2 fixation by assembling metal-organic ...,Nature.com,news.google.com/articles/CBMiMmh0dHBzOi8vd3d3Lm5hdHVyZS5jb20vYXJ0aWNsZXMvczQxNDY3LTAyMy00MDgzOS0w0gEA?hl=en-IN&gl=IN&ceid=IN%3Aen,2023-09-02
16,Atmosphere injection of sea salts during large explosive submarine ...,Nature.com,news.google.com/articles/CBMiMmh0dHBzOi8vd3d3Lm5hdHVyZS5jb20vYXJ0aWNsZXMvczQxNTk4LTAyMy00MTYzOS040gEA?hl=en-IN&gl=IN&ceid=IN%3Aen,2023-09-02
37,"Azithromycin promotes proliferation, and inhibits inflammation in ...",Nature.com,news.google.com/articles/CBMiMmh0dHBzOi8vd3d3Lm5hdHVyZS5jb20vYXJ0aWNsZXMvczQxNTk4LTAyMy00MTU3Ny010gEA?hl=en-IN&gl=IN&ceid=IN%3Aen,2023-09-02
8,Preparation of ZnGa2O4 nanoflowers and their full-color ...,Nature.com,news.google.com/articles/CBMiMmh0dHBzOi8vd3d3Lm5hdHVyZS5jb20vYXJ0aWNsZXMvczQxNTk4LTAyMy00MTY1OC010gEA?hl=en-IN&gl=IN&ceid=IN%3Aen,2023-09-02
40,CCR7 acts as both a sensor and a sink for CCL19 to coordinate ...,Science,news.google.com/articles/CBMiNmh0dHBzOi8vd3d3LnNjaWVuY2Uub3JnL2RvaS8xMC4xMTI2L3NjaWltbXVub2wuYWRjOTU4NNIBAA?hl=en-IN&gl=IN&ceid=IN%3Aen,2023-09-01
25,Targeting CaMKK2 Inhibits Actin Cytoskeletal Assembly to Suppress ...,Cancer Discovery,news.google.com/articles/CBMiaWh0dHBzOi8vYWFjcmpvdXJuYWxzLm9yZy9jYW5jZXJyZXMvYXJ0aWNsZS84My8xNy8yODg5LzcyODU5MS9UYXJnZXRpbmctQ2FNS0syLUluaGliaXRzLUFjdGluLUN5dG9za2VsZXRhbNIBAA?hl=en-IN&gl=IN&ceid=IN%3Aen,2023-09-01
60,"Shelf-life, bioburden, water and oxygen permeability studies of laser ...",Nature.com,news.google.com/articles/CBMiMmh0dHBzOi8vd3d3Lm5hdHVyZS5jb20vYXJ0aWNsZXMvczQxNTk4LTAyMy00MTQ3Ny040gEA?hl=en-IN&gl=IN&ceid=IN%3Aen,2023-09-01
59,Integrated Analysis of Non-coding RNA and mRNA Expression | JIR,Dove Medical Press,news.google.com/articles/CBMigwFodHRwczovL3d3dy5kb3ZlcHJlc3MuY29tL2ludGVncmF0ZWQtYW5hbHlzaXMtb2Ytbm9uLWNvZGluZy1ybmEtYW5kLW1ybmEtZXhwcmVzc2lvbi1wcm9maWxlcy1pbi0tcGVlci1yZXZpZXdlZC1mdWxsdGV4dC1hcnRpY2xlLUpJUtIBAA?hl=en-IN&gl=IN&ceid=IN%3Aen,2023-09-01
