,title,source,link,date
0,"Stock Market Live Updates: Sensex and Nifty weaken amid mixed global signals; Cipla, HDFC Life gain",BusinessLine,news.google.com/articles/CBMieGh0dHBzOi8vd3d3LnRoZWhpbmR1YnVzaW5lc3NsaW5lLmNvbS9tYXJrZXRzL3NoYXJlLW1hcmtldC1uaWZ0eS1zZW5zZXgtbGl2ZS11cGRhdGVzLTYtc2VwdGVtYmVyLTIwMjMvYXJ0aWNsZTY3MjczNzk1LmVjZdIBfWh0dHBzOi8vd3d3LnRoZWhpbmR1YnVzaW5lc3NsaW5lLmNvbS9tYXJrZXRzL3NoYXJlLW1hcmtldC1uaWZ0eS1zZW5zZXgtbGl2ZS11cGRhdGVzLTYtc2VwdGVtYmVyLTIwMjMvYXJ0aWNsZTY3MjczNzk1LmVjZS9hbXAv?hl=en-IN&gl=IN&ceid=IN%3Aen,2023-09-06
35,Nanoparticles with HA coating show diverse health effects | IJN,Dove Medical Press,news.google.com/articles/CBMigwFodHRwczovL3d3dy5kb3ZlcHJlc3MuY29tL2RvcGVkLW11bHRpcGxlLW5hbm9wYXJ0aWNsZXMtd2l0aC1oeWRyb3h5YXBhdGl0ZS1jb2F0aW5nLXNob3ctZGl2ZXJzZS0tcGVlci1yZXZpZXdlZC1mdWxsdGV4dC1hcnRpY2xlLUlKTtIBAA?hl=en-IN&gl=IN&ceid=IN%3Aen,2023-09-06
25,Combining Olaparib and Ascorbic acid on nanoparticles | IJN,Dove Medical Press,news.google.com/articles/CBMigwFodHRwczovL3d3dy5kb3ZlcHJlc3MuY29tL2NvbWJpbmluZy1vbGFwYXJpYi1hbmQtYXNjb3JiaWMtYWNpZC1vbi1uYW5vcGFydGljbGVzLXRvLWVuaGFuY2UtdGhlLWQtcGVlci1yZXZpZXdlZC1mdWxsdGV4dC1hcnRpY2xlLUlKTtIBAA?hl=en-IN&gl=IN&ceid=IN%3Aen,2023-09-06
38,Exploring the mechanisms of modified Bu-Shen-Yi-Qi decoction ...,Dove Medical Press,news.google.com/articles/CBMihAFodHRwczovL3d3dy5kb3ZlcHJlc3MuY29tL2V4cGxvcmluZy10aGUtbWVjaGFuaXNtcy1vZi1tb2RpZmllZC1idS1zaGVuLXlpLXFpLWRlY29jdGlvbi1mb3ItY29wZC0tcGVlci1yZXZpZXdlZC1mdWxsdGV4dC1hcnRpY2xlLURERFTSAQA?hl=en-IN&gl=IN&ceid=IN%3Aen,2023-09-06
33,Linking extreme seasonality and gene expression in Arctic marine ...,Nature.com,news.google.com/articles/CBMiMmh0dHBzOi8vd3d3Lm5hdHVyZS5jb20vYXJ0aWNsZXMvczQxNTk4LTAyMy00MTIwNC0z0gEA?hl=en-IN&gl=IN&ceid=IN%3Aen,2023-09-05
37,Environmental DNA reveals the genetic diversity and population ...,pnas.org,news.google.com/articles/CBMiMGh0dHBzOi8vd3d3LnBuYXMub3JnL2RvaS8xMC4xMDczL3BuYXMuMjMwNzM0NTEyMNIBAA?hl=en-IN&gl=IN&ceid=IN%3Aen,2023-09-05
4,Fatty acid elongation by ELOVL6 hampers remyelination by ...,pnas.org,news.google.com/articles/CBMiMGh0dHBzOi8vd3d3LnBuYXMub3JnL2RvaS8xMC4xMDczL3BuYXMuMjMwMTAzMDEyMNIBAA?hl=en-IN&gl=IN&ceid=IN%3Aen,2023-09-05
27,68Ga-bisphosphonates for the imaging of extraosseous calcification ...,Nature.com,news.google.com/articles/CBMiMmh0dHBzOi8vd3d3Lm5hdHVyZS5jb20vYXJ0aWNsZXMvczQxNTk4LTAyMy00MTE0OS030gEA?hl=en-IN&gl=IN&ceid=IN%3Aen,2023-09-05
24,Integrated transcriptomic and proteomic analyses of plerocercoid ...,Parasites & Vectors,news.google.com/articles/CBMiUWh0dHBzOi8vcGFyYXNpdGVzYW5kdmVjdG9ycy5iaW9tZWRjZW50cmFsLmNvbS9hcnRpY2xlcy8xMC4xMTg2L3MxMzA3MS0wMjMtMDU5NDEtONIBAA?hl=en-IN&gl=IN&ceid=IN%3Aen,2023-09-05
23,Microplastics influence on herbicides removal and biosurfactants ...,Nature.com,news.google.com/articles/CBMiMmh0dHBzOi8vd3d3Lm5hdHVyZS5jb20vYXJ0aWNsZXMvczQxNTk4LTAyMy00MTIxMC010gEA?hl=en-IN&gl=IN&ceid=IN%3Aen,2023-09-05
