,title,source,link,date
0,Does 20 Microns (NSE:20MICRONS) Have A Healthy Balance Sheet?,Simply Wall St,news.google.com/articles/CBMiigFodHRwczovL3NpbXBseXdhbGwuc3Qvc3RvY2tzL2luL21hdGVyaWFscy9uc2UtMjBtaWNyb25zLzIwLW1pY3JvbnMtc2hhcmVzL25ld3MvZG9lcy0yMC1taWNyb25zLW5zZTIwbWljcm9ucy1oYXZlLWEtaGVhbHRoeS1iYWxhbmNlLXNoZWV0LTLSAY4BaHR0cHM6Ly9zaW1wbHl3YWxsLnN0L3N0b2Nrcy9pbi9tYXRlcmlhbHMvbnNlLTIwbWljcm9ucy8yMC1taWNyb25zLXNoYXJlcy9uZXdzL2RvZXMtMjAtbWljcm9ucy1uc2UyMG1pY3JvbnMtaGF2ZS1hLWhlYWx0aHktYmFsYW5jZS1zaGVldC0yL2FtcA?hl=en-IN&gl=IN&ceid=IN%3Aen,2023-09-07
16,The identification and genetic characteristics of Quang Binh virus ...,Parasites & Vectors,news.google.com/articles/CBMiUWh0dHBzOi8vcGFyYXNpdGVzYW5kdmVjdG9ycy5iaW9tZWRjZW50cmFsLmNvbS9hcnRpY2xlcy8xMC4xMTg2L3MxMzA3MS0wMjMtMDU5MzgtM9IBAA?hl=en-IN&gl=IN&ceid=IN%3Aen,2023-09-07
39,PGC-1α inhibits M2 macrophage polarization and alleviates liver ...,Nature.com,news.google.com/articles/CBMiMmh0dHBzOi8vd3d3Lm5hdHVyZS5jb20vYXJ0aWNsZXMvczQxNDIwLTAyMy0wMTYzNi0y0gEA?hl=en-IN&gl=IN&ceid=IN%3Aen,2023-09-07
29,MicroCT data provide evidence correcting the previous ...,Nature.com,news.google.com/articles/CBMiMmh0dHBzOi8vd3d3Lm5hdHVyZS5jb20vYXJ0aWNsZXMvczQxNTk4LTAyMy0zOTE1OC030gEA?hl=en-IN&gl=IN&ceid=IN%3Aen,2023-09-07
25,A type 2 immune circuit in the stomach controls mammalian ...,Science,news.google.com/articles/CBMiM2h0dHBzOi8vd3d3LnNjaWVuY2Uub3JnL2RvaS8xMC4xMTI2L3NjaWVuY2UuYWRkNTY0OdIBAA?hl=en-IN&gl=IN&ceid=IN%3Aen,2023-09-07
22,Method for Producing Outer Panel with Character Line Using Punch ...,Mining Technology,news.google.com/articles/CBMijQFodHRwczovL3d3dy5taW5pbmctdGVjaG5vbG9neS5jb20vZGF0YS1pbnNpZ2h0cy9uaXBwb24tc3RlZWwtZ2V0cy1ncmFudC1mb3ItbWV0aG9kLWZvci1wcm9kdWNpbmctb3V0ZXItcGFuZWwtd2l0aC1jaGFyYWN0ZXItbGluZS11c2luZy1wdW5jaC_SAQA?hl=en-IN&gl=IN&ceid=IN%3Aen,2023-09-07
20,Contactless deformation of fluid interfaces by acoustic radiation ...,Nature.com,news.google.com/articles/CBMiMmh0dHBzOi8vd3d3Lm5hdHVyZS5jb20vYXJ0aWNsZXMvczQxNTk4LTAyMy0zOTQ2NC0w0gEA?hl=en-IN&gl=IN&ceid=IN%3Aen,2023-09-07
19,Spatial metabolomics: from a niche field towards a driver of innovation,Nature.com,news.google.com/articles/CBMiMmh0dHBzOi8vd3d3Lm5hdHVyZS5jb20vYXJ0aWNsZXMvczQyMjU1LTAyMy0wMDg4MS0w0gEA?hl=en-IN&gl=IN&ceid=IN%3Aen,2023-09-07
34,Association between endothelial nitric oxide synthase (eNOS) gene ...,Nature.com,news.google.com/articles/CBMiMmh0dHBzOi8vd3d3Lm5hdHVyZS5jb20vYXJ0aWNsZXMvczQxNTk4LTAyMy00MTkyMC130gEA?hl=en-IN&gl=IN&ceid=IN%3Aen,2023-09-07
17,Inhibition of selenoprotein synthesis is not the mechanism by which ...,Nature.com,news.google.com/articles/CBMiMmh0dHBzOi8vd3d3Lm5hdHVyZS5jb20vYXJ0aWNsZXMvczQxNTk4LTAyMy0zNjc5Ni050gEA?hl=en-IN&gl=IN&ceid=IN%3Aen,2023-09-07
