,title,source,link,date
1,Non-destructive testing of interfacial stiffness based on spring model ...,Nature.com,news.google.com/articles/CBMiMmh0dHBzOi8vd3d3Lm5hdHVyZS5jb20vYXJ0aWNsZXMvczQxNTk4LTAyMy00Mjg4Ny000gEA?hl=en-IN&gl=IN&ceid=IN%3Aen,2023-09-21
16,Separation and quantitation of valacyclovir enantiomers using ...,John Wiley & Sons,news.google.com/articles/CBMiOmh0dHBzOi8vb25saW5lbGlicmFyeS53aWxleS5jb20vZG9pLzEwLjEwMDIvc3NjcC4yMDIzMDAxNDXSAQA?hl=en-IN&gl=IN&ceid=IN%3Aen,2023-09-21
51,Identification and characterization of a novel nanobody | IJN,Dove Medical Press,news.google.com/articles/CBMigwFodHRwczovL3d3dy5kb3ZlcHJlc3MuY29tL2lkZW50aWZpY2F0aW9uLWFuZC1jaGFyYWN0ZXJpemF0aW9uLW9mLWEtbm92ZWwtbmFub2JvZHktYWdhaW5zdC1odW1hbi0tcGVlci1yZXZpZXdlZC1mdWxsdGV4dC1hcnRpY2xlLUlKTtIBAA?hl=en-IN&gl=IN&ceid=IN%3Aen,2023-09-21
36,Effects of a postbiotic SLFC non scalp microbiome | CCID,Dove Medical Press,news.google.com/articles/CBMihAFodHRwczovL3d3dy5kb3ZlcHJlc3MuY29tL2VmZmVjdHMtb2YtYS1wb3N0YmlvdGljLXNhY2NoYXJvbXljZXMtYW5kLWxhY3RvYmFjaWxsdXMtZmVybWVudC1jb21wbGUtcGVlci1yZXZpZXdlZC1mdWxsdGV4dC1hcnRpY2xlLUNDSUTSAQA?hl=en-IN&gl=IN&ceid=IN%3Aen,2023-09-21
26,Sterilized Anopheles funestus can autodisseminate sufficient ...,Malaria Journal,news.google.com/articles/CBMiTGh0dHBzOi8vbWFsYXJpYWpvdXJuYWwuYmlvbWVkY2VudHJhbC5jb20vYXJ0aWNsZXMvMTAuMTE4Ni9zMTI5MzYtMDIzLTA0Njk5LTnSAQA?hl=en-IN&gl=IN&ceid=IN%3Aen,2023-09-21
24,Quality consistency evaluation of chemical composition and ...,John Wiley & Sons,news.google.com/articles/CBMiNGh0dHBzOi8vb25saW5lbGlicmFyeS53aWxleS5jb20vZG9pLzEwLjEwMDIvYm1jLjU3NDXSAQA?hl=en-IN&gl=IN&ceid=IN%3Aen,2023-09-21
22,Tau suppresses microtubule-regulated pancreatic insulin secretion ...,Nature.com,news.google.com/articles/CBMiMmh0dHBzOi8vd3d3Lm5hdHVyZS5jb20vYXJ0aWNsZXMvczQxMzgwLTAyMy0wMjI2Ny130gEA?hl=en-IN&gl=IN&ceid=IN%3Aen,2023-09-21
20,Sex- and suicide-specific alterations in the kynurenine pathway in ...,Nature.com,news.google.com/articles/CBMiMmh0dHBzOi8vd3d3Lm5hdHVyZS5jb20vYXJ0aWNsZXMvczQxMzg2LTAyMy0wMTczNi040gEA?hl=en-IN&gl=IN&ceid=IN%3Aen,2023-09-21
19,Motorola Launches edge 40 neo – World’s Lightest 5G Smartphone with IP68 Underwater Protection 144Hz Curved Display at a starting price of Rs. 20 999,The Week,news.google.com/articles/CBMiS2h0dHBzOi8vd3d3LnRoZXdlZWsuaW4vd2lyZS11cGRhdGVzL2J1c2luZXNzLzIwMjMvMDkvMjEvZGNtODctbW90b3JvbGEuaHRtbNIBT2h0dHBzOi8vd3d3LnRoZXdlZWsuaW4vd2lyZS11cGRhdGVzL2J1c2luZXNzLzIwMjMvMDkvMjEvZGNtODctbW90b3JvbGEuYW1wLmh0bWw?hl=en-IN&gl=IN&ceid=IN%3Aen,2023-09-21
25,"Dispersal, habitat filtering, and eco-evolutionary dynamics as drivers ...",Nature.com,news.google.com/articles/CBMiMmh0dHBzOi8vd3d3Lm5hdHVyZS5jb20vYXJ0aWNsZXMvczQxMzk2LTAyMy0wMTUxNi040gEA?hl=en-IN&gl=IN&ceid=IN%3Aen,2023-09-21
