,title,source,link,date
13,Beneficial effects of recombinant CER-001 high-density lipoprotein ...,BMC Medicine,news.google.com/articles/CBMiSWh0dHBzOi8vYm1jbWVkaWNpbmUuYmlvbWVkY2VudHJhbC5jb20vYXJ0aWNsZXMvMTAuMTE4Ni9zMTI5MTYtMDIzLTAzMDU3LTXSAQA?hl=en-IN&gl=IN&ceid=IN%3Aen,2023-11-02
21,Quantum capital of the world: Emerging field that could solve ‘unsolvable’ problems,WGN TV Chicago,news.google.com/articles/CBMidGh0dHBzOi8vd2dudHYuY29tL25ld3MvY292ZXItc3RvcnkvcXVhbnR1bS1jYXBpdGFsLW9mLXRoZS13b3JsZC1lbWVyZ2luZy1maWVsZC10aGF0LWNvdWxkLXNvbHZlLXVuc29sdmFibGUtcHJvYmxlbXMv0gF4aHR0cHM6Ly93Z250di5jb20vbmV3cy9jb3Zlci1zdG9yeS9xdWFudHVtLWNhcGl0YWwtb2YtdGhlLXdvcmxkLWVtZXJnaW5nLWZpZWxkLXRoYXQtY291bGQtc29sdmUtdW5zb2x2YWJsZS1wcm9ibGVtcy9hbXAv?hl=en-IN&gl=IN&ceid=IN%3Aen,2023-11-02
25,Intrathecal delivery of nanoparticle PARP inhibitor to the ...,Science,news.google.com/articles/CBMiOGh0dHBzOi8vd3d3LnNjaWVuY2Uub3JnL2RvaS8xMC4xMTI2L3NjaXRyYW5zbG1lZC5hZGkxNjE30gEA?hl=en-IN&gl=IN&ceid=IN%3Aen,2023-11-01
27,Nuclear magnetic resonance spectroscopy to quantify major ...,Nature.com,news.google.com/articles/CBMiMmh0dHBzOi8vd3d3Lm5hdHVyZS5jb20vYXJ0aWNsZXMvczQxNTk4LTAyMy00NjE0My030gEA?hl=en-IN&gl=IN&ceid=IN%3Aen,2023-11-01
45,Filamentous virus-like particles are present in coral dinoflagellates ...,Nature.com,news.google.com/articles/CBMiMmh0dHBzOi8vd3d3Lm5hdHVyZS5jb20vYXJ0aWNsZXMvczQxMzk2LTAyMy0wMTUyNi020gEA?hl=en-IN&gl=IN&ceid=IN%3Aen,2023-11-01
51,Preclinical evaluation of [58mCo]Co-DOTA-PSMA-617 for Auger ...,Nature.com,news.google.com/articles/CBMiMmh0dHBzOi8vd3d3Lm5hdHVyZS5jb20vYXJ0aWNsZXMvczQxNTk4LTAyMy00MzQyOS040gEA?hl=en-IN&gl=IN&ceid=IN%3Aen,2023-11-01
40,Injectable tissue prosthesis for instantaneous closed-loop ...,Nature.com,news.google.com/articles/CBMiMmh0dHBzOi8vd3d3Lm5hdHVyZS5jb20vYXJ0aWNsZXMvczQxNTg2LTAyMy0wNjYyOC140gEA?hl=en-IN&gl=IN&ceid=IN%3Aen,2023-11-01
39,Combining biophysical parameters with thermal and RGB indices ...,Nature.com,news.google.com/articles/CBMiMmh0dHBzOi8vd3d3Lm5hdHVyZS5jb20vYXJ0aWNsZXMvczQxNTk4LTAyMy00NTY4Mi0z0gEA?hl=en-IN&gl=IN&ceid=IN%3Aen,2023-11-01
52,Artificial surface labelling of Escherichia coli with StrepTagII antigen ...,Nature.com,news.google.com/articles/CBMiMmh0dHBzOi8vd3d3Lm5hdHVyZS5jb20vYXJ0aWNsZXMvczQxNTk4LTAyMy00NjAyNi140gEA?hl=en-IN&gl=IN&ceid=IN%3Aen,2023-11-01
36,ATM-Inhibitor AZD1390 Is a Radiosensitizer for Breast Cancer CNS ...,Cancer Discovery,news.google.com/articles/CBMib2h0dHBzOi8vYWFjcmpvdXJuYWxzLm9yZy9jbGluY2FuY2VycmVzL2FydGljbGUvMjkvMjEvNDQ5Mi83Mjk2NDAvQVRNLUluaGliaXRvci1BWkQxMzkwLUlzLWEtUmFkaW9zZW5zaXRpemVyLWZvctIBAA?hl=en-IN&gl=IN&ceid=IN%3Aen,2023-11-01
