,title,source,link,date
3,Bioactive ambuic acid congeners from endophytic fungus ...,Nature.com,news.google.com/articles/CBMiMmh0dHBzOi8vd3d3Lm5hdHVyZS5jb20vYXJ0aWNsZXMvczQxNDI5LTAyMy0wMDY3NC0z0gEA?hl=en-IN&gl=IN&ceid=IN%3Aen,2023-11-13
21,Detection of cellular traction forces via the force-triggered Cas12a ...,Nature.com,news.google.com/articles/CBMiMmh0dHBzOi8vd3d3Lm5hdHVyZS5jb20vYXJ0aWNsZXMvczQxNTUxLTAyMy0wMTExNC0x0gEA?hl=en-IN&gl=IN&ceid=IN%3Aen,2023-11-13
41,Wallbridge Discovers New Area of Gold Mineralization 15 kilometres ...,GlobeNewswire,news.google.com/articles/CBMimgFodHRwczovL3d3dy5nbG9iZW5ld3N3aXJlLmNvbS9uZXdzLXJlbGVhc2UvMjAyMy8xMS8xMy8yNzc4ODQ4LzAvZW4vV2FsbGJyaWRnZS1EaXNjb3ZlcnMtTmV3LUFyZWEtb2YtR29sZC1NaW5lcmFsaXphdGlvbi0xNS1raWxvbWV0cmVzLUVhc3Qtb2YtRmVuZWxvbi5odG1s0gEA?hl=en-IN&gl=IN&ceid=IN%3Aen,2023-11-13
5,Soil organic carbon stocks increased across the tide-induced salinity ...,Nature.com,news.google.com/articles/CBMiMmh0dHBzOi8vd3d3Lm5hdHVyZS5jb20vYXJ0aWNsZXMvczQxNTk4LTAyMy00NTQxMS130gEA?hl=en-IN&gl=IN&ceid=IN%3Aen,2023-11-13
26,Assessment of Genotoxic Biomarker in Tongue and Buccal Mucosal ...,Cureus,news.google.com/articles/CBMitQFodHRwczovL3d3dy5jdXJldXMuY29tL2FydGljbGVzLzIwNDIzOC1hc3Nlc3NtZW50LW9mLWdlbm90b3hpYy1iaW9tYXJrZXItaW4tdG9uZ3VlLWFuZC1idWNjYWwtbXVjb3NhbC1lcGl0aGVsaWFsLWNlbGxzLW9mLWNvdmlkLTE5LXBhdGllbnRzLWFuLW9ic2VydmF0aW9uYWwtc3R1ZHk_c2NvcmVfYXJ0aWNsZT10cnVl0gEA?hl=en-IN&gl=IN&ceid=IN%3Aen,2023-11-13
24,Unsupervised classification for region of interest in X-ray ...,Nature.com,news.google.com/articles/CBMiMmh0dHBzOi8vd3d3Lm5hdHVyZS5jb20vYXJ0aWNsZXMvczQxNTk4LTAyMy00NTMzNi000gEA?hl=en-IN&gl=IN&ceid=IN%3Aen,2023-11-13
23,Shenshuaifu granule attenuates acute kidney injury | DDDT,Dove Medical Press,news.google.com/articles/CBMihAFodHRwczovL3d3dy5kb3ZlcHJlc3MuY29tL3NoZW5zaHVhaWZ1LWdyYW51bGUtYXR0ZW51YXRlcy1hY3V0ZS1raWRuZXktaW5qdXJ5LWJ5LWluaGliaXRpbmctZmVycm8tcGVlci1yZXZpZXdlZC1mdWxsdGV4dC1hcnRpY2xlLURERFTSAQA?hl=en-IN&gl=IN&ceid=IN%3Aen,2023-11-13
30,Induced alternative splicing an opportunity to study PCSK9 protein ...,Nature.com,news.google.com/articles/CBMiMmh0dHBzOi8vd3d3Lm5hdHVyZS5jb20vYXJ0aWNsZXMvczQxNTk4LTAyMy00NzAwNS150gEA?hl=en-IN&gl=IN&ceid=IN%3Aen,2023-11-13
48,CopAur Near Surface Resource Expansion at Kinsley Mountain ...,Marketscreener.com,news.google.com/articles/CBMiuwFodHRwczovL3d3dy5tYXJrZXRzY3JlZW5lci5jb20vcXVvdGUvc3RvY2svQ09QQVVSLU1JTkVSQUxTLUlOQy00OTQ3ODIxMy9uZXdzL0NvcEF1ci1OZWFyLVN1cmZhY2UtUmVzb3VyY2UtRXhwYW5zaW9uLWF0LUtpbnNsZXktTW91bnRhaW4tTWFpbi1QaXQtRHJpbGxzLTE0LU1ldHJlcy1vZi0wLTUxLWctdC1Hb2wtNDUzMTIwMjAv0gEA?hl=en-IN&gl=IN&ceid=IN%3Aen,2023-11-13
18,Inhibition of the proline metabolism rate-limiting enzyme P5CS ...,Nature.com,news.google.com/articles/CBMiMmh0dHBzOi8vd3d3Lm5hdHVyZS5jb20vYXJ0aWNsZXMvczQyMjU1LTAyMy0wMDkxOS0z0gEA?hl=en-IN&gl=IN&ceid=IN%3Aen,2023-11-13
