,title,source,link,date
12,Beneficial effects of recombinant CER-001 high-density lipoprotein ...,BMC Medicine,news.google.com/articles/CBMiSWh0dHBzOi8vYm1jbWVkaWNpbmUuYmlvbWVkY2VudHJhbC5jb20vYXJ0aWNsZXMvMTAuMTE4Ni9zMTI5MTYtMDIzLTAzMDU3LTXSAQA?hl=en-IN&gl=IN&ceid=IN%3Aen,2023-11-02
42,A Kinase Interacting Protein 1 regulates mitochondrial protein levels ...,Nature.com,news.google.com/articles/CBMiMmh0dHBzOi8vd3d3Lm5hdHVyZS5jb20vYXJ0aWNsZXMvczQxNTk4LTAyMy00NTk2MS160gEA?hl=en-IN&gl=IN&ceid=IN%3Aen,2023-11-01
39,The SGLT2 inhibitor dapagliflozin improves kidney function in ...,Science,news.google.com/articles/CBMiOGh0dHBzOi8vd3d3LnNjaWVuY2Uub3JnL2RvaS8xMC4xMTI2L3NjaXRyYW5zbG1lZC5hYm40MjE00gEA?hl=en-IN&gl=IN&ceid=IN%3Aen,2023-11-01
30,Nuclear magnetic resonance spectroscopy to quantify major ...,Nature.com,news.google.com/articles/CBMiMmh0dHBzOi8vd3d3Lm5hdHVyZS5jb20vYXJ0aWNsZXMvczQxNTk4LTAyMy00NjE0My030gEA?hl=en-IN&gl=IN&ceid=IN%3Aen,2023-11-01
31,ATM-Inhibitor AZD1390 Is a Radiosensitizer for Breast Cancer CNS ...,Cancer Discovery,news.google.com/articles/CBMib2h0dHBzOi8vYWFjcmpvdXJuYWxzLm9yZy9jbGluY2FuY2VycmVzL2FydGljbGUvMjkvMjEvNDQ5Mi83Mjk2NDAvQVRNLUluaGliaXRvci1BWkQxMzkwLUlzLWEtUmFkaW9zZW5zaXRpemVyLWZvctIBAA?hl=en-IN&gl=IN&ceid=IN%3Aen,2023-11-01
32,"Efficacy and safety in mice of repeated, lifelong administration of an ...",Nature.com,news.google.com/articles/CBMiMmh0dHBzOi8vd3d3Lm5hdHVyZS5jb20vYXJ0aWNsZXMvczQxNTQxLTAyMy0wMDc3MC0z0gEA?hl=en-IN&gl=IN&ceid=IN%3Aen,2023-11-01
34,Mitochondrial hypermetabolism precedes impaired autophagy and ...,Nature.com,news.google.com/articles/CBMiMmh0dHBzOi8vd3d3Lm5hdHVyZS5jb20vYXJ0aWNsZXMvczQxMzgwLTAyMy0wMjI4OS000gEA?hl=en-IN&gl=IN&ceid=IN%3Aen,2023-11-01
36,Combining biophysical parameters with thermal and RGB indices ...,Nature.com,news.google.com/articles/CBMiMmh0dHBzOi8vd3d3Lm5hdHVyZS5jb20vYXJ0aWNsZXMvczQxNTk4LTAyMy00NTY4Mi0z0gEA?hl=en-IN&gl=IN&ceid=IN%3Aen,2023-11-01
61,Condensin dysfunction is a reproductive isolating barrier in mice,Nature.com,news.google.com/articles/CBMiMmh0dHBzOi8vd3d3Lm5hdHVyZS5jb20vYXJ0aWNsZXMvczQxNTg2LTAyMy0wNjcwMC020gEA?hl=en-IN&gl=IN&ceid=IN%3Aen,2023-11-01
57,Exploring Nomograms for ICL Size Selection in Myopia | OPTH,Dove Medical Press,news.google.com/articles/CBMihAFodHRwczovL3d3dy5kb3ZlcHJlc3MuY29tL2V4cGxvcmluZy1ub21vZ3JhbXMtZm9yLWltcGxhbnRhYmxlLWNvbGxhbWVyLWxlbnMtc2l6ZS1zZWxlY3Rpb24taW4tbXktcGVlci1yZXZpZXdlZC1mdWxsdGV4dC1hcnRpY2xlLU9QVEjSAQA?hl=en-IN&gl=IN&ceid=IN%3Aen,2023-11-01
