,title,source,link,date
42,Application of ensemble machine learning approach to assess the ...,Nature.com,news.google.com/articles/CBMiMmh0dHBzOi8vd3d3Lm5hdHVyZS5jb20vYXJ0aWNsZXMvczQxNTk4LTAyMy00MzY4OS000gEA?hl=en-IN&gl=IN&ceid=IN%3Aen,2023-10-21
67,From the Abyss of Space: Webb Observes 3 Dwarf Planets in the ...,SciTechDaily,news.google.com/articles/CBMiYmh0dHBzOi8vc2NpdGVjaGRhaWx5LmNvbS9mcm9tLXRoZS1hYnlzcy1vZi1zcGFjZS13ZWJiLW9ic2VydmVzLTMtZHdhcmYtcGxhbmV0cy1pbi10aGUta3VpcGVyLWJlbHQv0gEA?hl=en-IN&gl=IN&ceid=IN%3Aen,2023-10-21
44,Short chain fatty acids facilitate protective immunity by macrophages ...,Nature.com,news.google.com/articles/CBMiMmh0dHBzOi8vd3d3Lm5hdHVyZS5jb20vYXJ0aWNsZXMvczQxNTk4LTAyMy00NTM0MC040gEA?hl=en-IN&gl=IN&ceid=IN%3Aen,2023-10-21
23,"Simultaneous estimation of propyphenazone, flurbiprofen, and their ...",John Wiley & Sons,news.google.com/articles/CBMiOmh0dHBzOi8vb25saW5lbGlicmFyeS53aWxleS5jb20vZG9pLzEwLjEwMDIvc3NjcC4yMDIzMDAxMDTSAQA?hl=en-IN&gl=IN&ceid=IN%3Aen,2023-10-20
28,Why construction dust is lethal for all and kids are the most vulnerable,The Indian Express,news.google.com/articles/CBMia2h0dHBzOi8vaW5kaWFuZXhwcmVzcy5jb20vYXJ0aWNsZS9jaXRpZXMvbXVtYmFpL3doeS1jb25zdHJ1Y3Rpb24tZHVzdC1pcy1sZXRoYWwtZm9yLWtpZHMtbGFib3VyZXJzLTg5OTEzNTcv0gFwaHR0cHM6Ly9pbmRpYW5leHByZXNzLmNvbS9hcnRpY2xlL2NpdGllcy9tdW1iYWkvd2h5LWNvbnN0cnVjdGlvbi1kdXN0LWlzLWxldGhhbC1mb3Ita2lkcy1sYWJvdXJlcnMtODk5MTM1Ny9saXRlLw?hl=en-IN&gl=IN&ceid=IN%3Aen,2023-10-20
79,Elon Musk talks Tesla: “We dug our own grave with the Cybertruck”,Ars Technica,news.google.com/articles/CBMiZGh0dHBzOi8vYXJzdGVjaG5pY2EuY29tL2NhcnMvMjAyMy8xMC9lbG9uLW11c2stdGFsa3MtdGVzbGEtd2UtZHVnLW91ci1vd24tZ3JhdmUtd2l0aC10aGUtY3liZXJ0cnVjay_SAWhodHRwczovL2Fyc3RlY2huaWNhLmNvbS9jYXJzLzIwMjMvMTAvZWxvbi1tdXNrLXRhbGtzLXRlc2xhLXdlLWR1Zy1vdXItb3duLWdyYXZlLXdpdGgtdGhlLWN5YmVydHJ1Y2svYW1wLw?hl=en-IN&gl=IN&ceid=IN%3Aen,2023-10-19
15,Neutralizing antibodies from prior exposure to dengue virus ...,Nature.com,news.google.com/articles/CBMiMmh0dHBzOi8vd3d3Lm5hdHVyZS5jb20vYXJ0aWNsZXMvczQzODU2LTAyMy0wMDM3OC030gEA?hl=en-IN&gl=IN&ceid=IN%3Aen,2023-10-19
65,Apple iPhone 15 Pro Vs. iPhone 15 Pro Max: Which Should You Choose?,Forbes,news.google.com/articles/CBMigQFodHRwczovL3d3dy5mb3JiZXMuY29tL3NpdGVzL2ZvcmJlcy1wZXJzb25hbC1zaG9wcGVyLzIwMjMvMTAvMTkvYXBwbGUtaXBob25lLTE1LXByby12cy1pcGhvbmUtMTUtcHJvLW1heC13aGljaC1zaG91bGQteW91LWNob29zZS_SAYUBaHR0cHM6Ly93d3cuZm9yYmVzLmNvbS9zaXRlcy9mb3JiZXMtcGVyc29uYWwtc2hvcHBlci8yMDIzLzEwLzE5L2FwcGxlLWlwaG9uZS0xNS1wcm8tdnMtaXBob25lLTE1LXByby1tYXgtd2hpY2gtc2hvdWxkLXlvdS1jaG9vc2UvYW1wLw?hl=en-IN&gl=IN&ceid=IN%3Aen,2023-10-19
63,Antiviral type III CRISPR signalling via conjugation of ATP and SAM,Nature.com,news.google.com/articles/CBMiMmh0dHBzOi8vd3d3Lm5hdHVyZS5jb20vYXJ0aWNsZXMvczQxNTg2LTAyMy0wNjYyMC010gEA?hl=en-IN&gl=IN&ceid=IN%3Aen,2023-10-18
57,Precise surface functionalization of PLGA particles for human T cell ...,Nature.com,news.google.com/articles/CBMiMmh0dHBzOi8vd3d3Lm5hdHVyZS5jb20vYXJ0aWNsZXMvczQxNTk2LTAyMy0wMDg4Ny040gEA?hl=en-IN&gl=IN&ceid=IN%3Aen,2023-10-18
