,title,source,link,date
12,A novel method for extracting metals from asteroids using non ...,Nature.com,news.google.com/articles/CBMiMmh0dHBzOi8vd3d3Lm5hdHVyZS5jb20vYXJ0aWNsZXMvczQxNTk4LTAyMy00NDE1Mi0w0gEA?hl=en-IN&gl=IN&ceid=IN%3Aen,2023-10-08
20,Effect of Air Pollution Particulate Matter on Ischemic and ...,Cureus,news.google.com/articles/CBMihQFodHRwczovL3d3dy5jdXJldXMuY29tL2FydGljbGVzLzExNjQ0NS1lZmZlY3Qtb2YtYWlyLXBvbGx1dGlvbi1wYXJ0aWN1bGF0ZS1tYXR0ZXItb24taXNjaGVtaWMtYW5kLWhlbW9ycmhhZ2ljLXN0cm9rZS1hLXNjb3BpbmctcmV2aWV30gEA?hl=en-IN&gl=IN&ceid=IN%3Aen,2023-10-08
26,Study on signal transmission mechanism of arbuscular mycorrhizal ...,Nature.com,news.google.com/articles/CBMiMmh0dHBzOi8vd3d3Lm5hdHVyZS5jb20vYXJ0aWNsZXMvczQxNTk4LTAyMy00MzI3OC010gEA?hl=en-IN&gl=IN&ceid=IN%3Aen,2023-10-07
64,Google Pixel 8 vs Apple iPhone 15: Which should you buy?,Android Authority,news.google.com/articles/CBMiS2h0dHBzOi8vd3d3LmFuZHJvaWRhdXRob3JpdHkuY29tL2dvb2dsZS1waXhlbC04LXZzLWFwcGxlLWlwaG9uZS0xNS0zMzcwNDMxL9IBAA?hl=en-IN&gl=IN&ceid=IN%3Aen,2023-10-07
53,Samsung Bioepis Presents Post-hoc Analysis of Phase 3 Clinical ...,StreetInsider.com,news.google.com/articles/CBMi2QFodHRwczovL3d3dy5zdHJlZXRpbnNpZGVyLmNvbS9HbG9iZStOZXdzd2lyZS9TYW1zdW5nK0Jpb2VwaXMrUHJlc2VudHMrUG9zdC1ob2MrQW5hbHlzaXMrb2YrUGhhc2UrMytDbGluaWNhbCtUcmlhbCtmb3IrU0IxNSUyQythK1Byb3Bvc2VkK0Jpb3NpbWlsYXIrdG8rRXlsZWElRTIlODElQjErJTI4QWZsaWJlcmNlcHQlMjklMkMrYXQrRVVSRVRJTkErMjAyMy8yMjI1MDUwMC5odG1s0gEA?hl=en-IN&gl=IN&ceid=IN%3Aen,2023-10-07
52,Cryo-EM elucidates the uroplakin complex structure within liquid ...,Nature.com,news.google.com/articles/CBMiMmh0dHBzOi8vd3d3Lm5hdHVyZS5jb20vYXJ0aWNsZXMvczQyMDAzLTAyMy0wNTM5My140gEA?hl=en-IN&gl=IN&ceid=IN%3Aen,2023-10-07
30,Comparison of corneal measurements using two different ...,Nature.com,news.google.com/articles/CBMiMmh0dHBzOi8vd3d3Lm5hdHVyZS5jb20vYXJ0aWNsZXMvczQxNTk4LTAyMy00NDEzMy0z0gEA?hl=en-IN&gl=IN&ceid=IN%3Aen,2023-10-07
35,Multifunctional fibers enable modulation of cortical and deep brain ...,Science,news.google.com/articles/CBMiMmh0dHBzOi8vd3d3LnNjaWVuY2Uub3JnL2RvaS8xMC4xMTI2L3NjaWFkdi5hZGgwOTc00gEA?hl=en-IN&gl=IN&ceid=IN%3Aen,2023-10-06
2,Back-to-back 52-week highs in this multibagger stock; Company ...,Dalal Street Investment Journal,news.google.com/articles/CBMiwQFodHRwOi8vd3d3LmRzaWouaW4vRFNJSkFydGljbGVEZXRhaWwvQXJ0TUlELzEwMTYzL0FydGljbGVJRC8zMzcxNC9CYWNrLXRvLWJhY2stNTItd2Vlay1oaWdocy1pbi10aGlzLW11bHRpYmFnZ2VyLXN0b2NrLUNvbXBhbnktZm9ybXMtYS1KVi13aXRoLVNpZXZlcnQtQmF1c3RvZmZlLUF1c2xhbmRzYmV0ZWlsaWd1bmdlbi1HbWJILTMzNzE00gEA?hl=en-IN&gl=IN&ceid=IN%3Aen,2023-10-06
61,"Identification and validation of FPR1, FPR2, IL17RA and TLR7 as ...",Nature.com,news.google.com/articles/CBMiMmh0dHBzOi8vd3d3Lm5hdHVyZS5jb20vYXJ0aWNsZXMvczQxNTk4LTAyMy00MzQ0MC160gEA?hl=en-IN&gl=IN&ceid=IN%3Aen,2023-10-06
