,title,source,link,date
9,Optimization of microwave-assisted extraction of antioxidant ...,Nature.com,news.google.com/articles/CBMiMmh0dHBzOi8vd3d3Lm5hdHVyZS5jb20vYXJ0aWNsZXMvczQxNTk4LTAyMy00MjMwMy140gEA?hl=en-IN&gl=IN&ceid=IN%3Aen,2023-09-10
55,Griddient: a microfluidic array to generate reconfigurable gradients ...,Nature.com,news.google.com/articles/CBMiMmh0dHBzOi8vd3d3Lm5hdHVyZS5jb20vYXJ0aWNsZXMvczQyMDAzLTAyMy0wNTI4Mi0z0gEA?hl=en-IN&gl=IN&ceid=IN%3Aen,2023-09-09
5,Physicists unveil revolutionary technique to write in water,The Week,news.google.com/articles/CBMicGh0dHBzOi8vd3d3LnRoZXdlZWsuaW4vbmV3cy9zY2ktdGVjaC8yMDIzLzA5LzA5L3BoeXNpY2lzdHMtdW52ZWlsLXJldm9sdXRpb25hcnktdGVjaG5pcXVlLXRvLXdyaXRlLWluLXdhdGVyLmh0bWzSAXRodHRwczovL3d3dy50aGV3ZWVrLmluL25ld3Mvc2NpLXRlY2gvMjAyMy8wOS8wOS9waHlzaWNpc3RzLXVudmVpbC1yZXZvbHV0aW9uYXJ5LXRlY2huaXF1ZS10by13cml0ZS1pbi13YXRlci5hbXAuaHRtbA?hl=en-IN&gl=IN&ceid=IN%3Aen,2023-09-09
43,Echinococcus granulosus cyst fluid inhibits inflammatory responses ...,Parasites & Vectors,news.google.com/articles/CBMiUWh0dHBzOi8vcGFyYXNpdGVzYW5kdmVjdG9ycy5iaW9tZWRjZW50cmFsLmNvbS9hcnRpY2xlcy8xMC4xMTg2L3MxMzA3MS0wMjMtMDU5NDgtMdIBAA?hl=en-IN&gl=IN&ceid=IN%3Aen,2023-09-09
42,Transparent wood composite prepared from two commercially ...,Nature.com,news.google.com/articles/CBMiMmh0dHBzOi8vd3d3Lm5hdHVyZS5jb20vYXJ0aWNsZXMvczQxNTk4LTAyMy00MjI0Mi030gEA?hl=en-IN&gl=IN&ceid=IN%3Aen,2023-09-09
40,High‐performance liquid chromatography‐tandem mass ...,John Wiley & Sons,news.google.com/articles/CBMiOmh0dHBzOi8vb25saW5lbGlicmFyeS53aWxleS5jb20vZG9pLzEwLjEwMDIvanNzYy4yMDIzMDAzOTXSAQA?hl=en-IN&gl=IN&ceid=IN%3Aen,2023-09-09
13,Inducing an LCST in hydrophilic polysaccharides via engineered ...,Nature.com,news.google.com/articles/CBMiMmh0dHBzOi8vd3d3Lm5hdHVyZS5jb20vYXJ0aWNsZXMvczQxNTk4LTAyMy00MTk0Ny160gEA?hl=en-IN&gl=IN&ceid=IN%3Aen,2023-09-09
34,Anti-atopic dermatitis effect of fish collagen on house dust mite ...,Nature.com,news.google.com/articles/CBMiMmh0dHBzOi8vd3d3Lm5hdHVyZS5jb20vYXJ0aWNsZXMvczQxNTk4LTAyMy00MTgzMS130gEA?hl=en-IN&gl=IN&ceid=IN%3Aen,2023-09-09
32,Evaluation of a polarization-enhanced laparoscopy prototype for ...,Nature.com,news.google.com/articles/CBMiMmh0dHBzOi8vd3d3Lm5hdHVyZS5jb20vYXJ0aWNsZXMvczQxNTk4LTAyMy00MTM2MS010gEA?hl=en-IN&gl=IN&ceid=IN%3Aen,2023-09-09
48,In vitro hyperspectral biomarkers of human chondrosarcoma cells in ...,Nature.com,news.google.com/articles/CBMiMmh0dHBzOi8vd3d3Lm5hdHVyZS5jb20vYXJ0aWNsZXMvczQxNTk4LTAyMy00MTk5MS050gEA?hl=en-IN&gl=IN&ceid=IN%3Aen,2023-09-09
