,title,source,link,date
3,AI-empowered accountants could elevate the industry,IT-Online,news.google.com/articles/CBMiV2h0dHBzOi8vaXQtb25saW5lLmNvLnphLzIwMjMvMTAvMDIvYWktZW1wb3dlcmVkLWFjY291bnRhbnRzLWNvdWxkLWVsZXZhdGUtdGhlLWluZHVzdHJ5L9IBAA?hl=en-IN&gl=IN&ceid=IN%3Aen,2023-10-02
4,"India Solar Rooftop Market New Opportunities, Sales Revenue And Leading Players",openPR,news.google.com/articles/CBMiXmh0dHBzOi8vd3d3Lm9wZW5wci5jb20vbmV3cy8zMjMyMDIxL2luZGlhLXNvbGFyLXJvb2Z0b3AtbWFya2V0LW5ldy1vcHBvcnR1bml0aWVzLXNhbGVzLXJldmVudWXSAV1odHRwczovL3d3dy5vcGVucHIuY29tL2FtcC8zMjMyMDIxL2luZGlhLXNvbGFyLXJvb2Z0b3AtbWFya2V0LW5ldy1vcHBvcnR1bml0aWVzLXNhbGVzLXJldmVudWU?hl=en-IN&gl=IN&ceid=IN%3Aen,2023-10-02
5,Decades of damage: Ocean bears brunt of Tairāwhiti erosion,Newsroom,news.google.com/articles/CBMiLGh0dHBzOi8vd3d3Lm5ld3Nyb29tLmNvLm56L2RlY2FkZXMtb2YtZGFtYWdl0gEyaHR0cHM6Ly93d3cubmV3c3Jvb20uY28ubnovZGVjYWRlcy1vZi1kYW1hZ2U_YW1wPTE?hl=en-IN&gl=IN&ceid=IN%3Aen,2023-10-02
6,‘Reconciliation economy’: Why Indigenous founders need more access to capital,Global News,news.google.com/articles/CBMiV2h0dHBzOi8vZ2xvYmFsbmV3cy5jYS9uZXdzLzk5OTU0ODAvcmVjb25jaWxpYXRpb24tZWNvbm9teS1pbmRpZ2Vub3VzLWFjY2Vzcy10by1jYXBpdGFsL9IBW2h0dHBzOi8vZ2xvYmFsbmV3cy5jYS9uZXdzLzk5OTU0ODAvcmVjb25jaWxpYXRpb24tZWNvbm9teS1pbmRpZ2Vub3VzLWFjY2Vzcy10by1jYXBpdGFsL2FtcC8?hl=en-IN&gl=IN&ceid=IN%3Aen,2023-10-02
8,Former Congressman Chris Stewart to Lead World's Premier ...,Benzinga,news.google.com/articles/CBMiigFodHRwczovL3d3dy5iZW56aW5nYS5jb20vcHJlc3NyZWxlYXNlcy8yMy8xMC9uMzUwMjcxNjkvZm9ybWVyLWNvbmdyZXNzbWFuLWNocmlzLXN0ZXdhcnQtdG8tbGVhZC13b3JsZHMtcHJlbWllci1hZXJvc3BhY2UtZGVmZW5zZS1lY29zeXN0ZW3SAQA?hl=en-IN&gl=IN&ceid=IN%3Aen,2023-10-02
1,Why are rare earth elements so rare?,Livescience.com,news.google.com/articles/CBMiVGh0dHBzOi8vd3d3LmxpdmVzY2llbmNlLmNvbS9wbGFuZXQtZWFydGgvZ2VvbG9neS93aHktYXJlLXJhcmUtZWFydGgtZWxlbWVudHMtc28tcmFyZdIBAA?hl=en-IN&gl=IN&ceid=IN%3Aen,2023-10-01
9,Toy Fair® Announces Upcoming Dates and Locations for Iconic Show,Benzinga,news.google.com/articles/CBMidmh0dHBzOi8vd3d3LmJlbnppbmdhLmNvbS9wcmVzc3JlbGVhc2VzLzIzLzEwL24zNTAyMDc3OS90b3ktZmFpci1hbm5vdW5jZXMtdXBjb21pbmctZGF0ZXMtYW5kLWxvY2F0aW9ucy1mb3ItaWNvbmljLXNob3fSAQA?hl=en-IN&gl=IN&ceid=IN%3Aen,2023-10-01
2,DNA and glass mix creates ultralight high-strength material,Interesting Engineering,news.google.com/articles/CBMiaGh0dHBzOi8vaW50ZXJlc3RpbmdlbmdpbmVlcmluZy5jb20vaW5ub3ZhdGlvbi9kbmEtYW5kLWdsYXNzLWNvbWJpbmVkLXRvLW1ha2UtdWx0cmEtbGlnaHQtc3Ryb25nLW1hdGVyaWFs0gEA?hl=en-IN&gl=IN&ceid=IN%3Aen,2023-09-30
7,Climate Resilience Along the Mekong River: Economic Development and Sustainable Utilisation of Water in Riparian Southeast Asia,Observer Research Foundation,news.google.com/articles/CBMiTWh0dHBzOi8vd3d3Lm9yZm9ubGluZS5vcmcvcmVzZWFyY2gvY2xpbWF0ZS1yZXNpbGllbmNlLWFsb25nLXRoZS1tZWtvbmctcml2ZXIv0gFNaHR0cHM6Ly93d3cub3Jmb25saW5lLm9yZy9yZXNlYXJjaC9jbGltYXRlLXJlc2lsaWVuY2UtYWxvbmctdGhlLW1la29uZy1yaXZlci8?hl=en-IN&gl=IN&ceid=IN%3Aen,2023-09-27
11,10 best artist and illustration agents in New York City,Creative Boom,news.google.com/articles/CBMiT2h0dHBzOi8vd3d3LmNyZWF0aXZlYm9vbS5jb20vcmVzb3VyY2VzLzEwLWJlc3QtaWxsdXN0cmF0aW9uLWFnZW50cy1pbi1uZXcteW9yay_SAQA?hl=en-IN&gl=IN&ceid=IN%3Aen,2023-09-25
