,title,source,link,date
0,Elevators and Escalators Market |xclusive Report with Detailed Study Analysis,Benzinga,news.google.com/articles/CBMiggFodHRwczovL3d3dy5iZW56aW5nYS5jb20vcHJlc3NyZWxlYXNlcy8yMy8wOS8zNDQyNjQyNy9lbGV2YXRvcnMtYW5kLWVzY2FsYXRvcnMtbWFya2V0LXhjbHVzaXZlLXJlcG9ydC13aXRoLWRldGFpbGVkLXN0dWR5LWFuYWx5c2lz0gEtaHR0cHM6Ly93d3cuYmVuemluZ2EuY29tL2FtcC9jb250ZW50LzM0NDI2NDI3?hl=en-IN&gl=IN&ceid=IN%3Aen,2023-09-11
8,The biomethane boondoggle that could derail clean hydrogen,Canary Media,news.google.com/articles/CBMiaGh0dHBzOi8vd3d3LmNhbmFyeW1lZGlhLmNvbS9hcnRpY2xlcy9oeWRyb2dlbi90aGUtYmlvbWV0aGFuZS1ib29uZG9nZ2xlLXRoYXQtY291bGQtZGVyYWlsLWNsZWFuLWh5ZHJvZ2Vu0gEA?hl=en-IN&gl=IN&ceid=IN%3Aen,2023-09-11
16,Ribbon Mixers analysis highlights crucial parameters for forecasting the industry's future with a project,Benzinga,news.google.com/articles/CBMimQFodHRwczovL3d3dy5iZW56aW5nYS5jb20vcHJlc3NyZWxlYXNlcy8yMy8wOS8zNDQyMDA1OS9yaWJib24tbWl4ZXJzLWFuYWx5c2lzLWhpZ2hsaWdodHMtY3J1Y2lhbC1wYXJhbWV0ZXJzLWZvci1mb3JlY2FzdGluZy10aGUtaW5kdXN0cnlzLWZ1dHVyZS13aXRoLWEtcHLSAS1odHRwczovL3d3dy5iZW56aW5nYS5jb20vYW1wL2NvbnRlbnQvMzQ0MjAwNTk?hl=en-IN&gl=IN&ceid=IN%3Aen,2023-09-11
12,"Harvard Law Grads Give Boston Cold Shoulder, Take Jobs Elsewhere",Bloomberg Law,news.google.com/articles/CBMiaGh0dHBzOi8vbmV3cy5ibG9vbWJlcmdsYXcuY29tL2xpdGlnYXRpb24vaGFydmFyZC1sYXctZ3JhZHMtZ2l2ZS1ib3N0b24tY29sZC1zaG91bGRlci10YWtlLWpvYnMtZWxzZXdoZXJl0gEA?hl=en-IN&gl=IN&ceid=IN%3Aen,2023-09-11
11,Contract Packaging Market Quantitative and Qualitative Analysis | Market Challenges and Forecast till 203,Benzinga,news.google.com/articles/CBMimQFodHRwczovL3d3dy5iZW56aW5nYS5jb20vcHJlc3NyZWxlYXNlcy8yMy8wOS8zNDQyNjAzNC9jb250cmFjdC1wYWNrYWdpbmctbWFya2V0LXF1YW50aXRhdGl2ZS1hbmQtcXVhbGl0YXRpdmUtYW5hbHlzaXMtbWFya2V0LWNoYWxsZW5nZXMtYW5kLWZvcmVjYXN0LXRpbGzSAS1odHRwczovL3d3dy5iZW56aW5nYS5jb20vYW1wL2NvbnRlbnQvMzQ0MjYwMzQ?hl=en-IN&gl=IN&ceid=IN%3Aen,2023-09-11
10,Contract Packaging Market Forthcoming Trends and Share Analysis by 2030,Benzinga,news.google.com/articles/CBMifWh0dHBzOi8vd3d3LmJlbnppbmdhLmNvbS9wcmVzc3JlbGVhc2VzLzIzLzA5LzM0NDQ2NTQ0L2NvbnRyYWN0LXBhY2thZ2luZy1tYXJrZXQtZm9ydGhjb21pbmctdHJlbmRzLWFuZC1zaGFyZS1hbmFseXNpcy1ieS0yMDMw0gEtaHR0cHM6Ly93d3cuYmVuemluZ2EuY29tL2FtcC9jb250ZW50LzM0NDQ2NTQ0?hl=en-IN&gl=IN&ceid=IN%3Aen,2023-09-11
1,"Calcium Gluconate Market Size and Market Drivers Analysis | Emerging Trends, New Developments and Forecas",Benzinga,news.google.com/articles/CBMimQFodHRwczovL3d3dy5iZW56aW5nYS5jb20vcHJlc3NyZWxlYXNlcy8yMy8wOS8zNDQzOTg5My9jYWxjaXVtLWdsdWNvbmF0ZS1tYXJrZXQtc2l6ZS1hbmQtbWFya2V0LWRyaXZlcnMtYW5hbHlzaXMtZW1lcmdpbmctdHJlbmRzLW5ldy1kZXZlbG9wbWVudHMtYW5kLWZvcmXSAS1odHRwczovL3d3dy5iZW56aW5nYS5jb20vYW1wL2NvbnRlbnQvMzQ0Mzk4OTM?hl=en-IN&gl=IN&ceid=IN%3Aen,2023-09-11
18,Eight candidates in contention for five positions on Shire of Denmark ...,Albany Advertiser,news.google.com/articles/CBMikwFodHRwczovL3d3dy5hbGJhbnlhZHZlcnRpc2VyLmNvbS5hdS9uZXdzL2FsYmFueS1hZHZlcnRpc2VyL2VpZ2h0LWNhbmRpZGF0ZXMtaW4tY29udGVudGlvbi1mb3ItZml2ZS1wb3NpdGlvbnMtb24tc2hpcmUtb2YtZGVubWFyay1jb3VuY2lsLWMtMTE4NjQ5NzLSAQA?hl=en-IN&gl=IN&ceid=IN%3Aen,2023-09-11
7,"On H Street, Some Black Business Owners Say They’re Fighting The ...",DCist,news.google.com/articles/CBMiVmh0dHBzOi8vZGNpc3QuY29tL3N0b3J5LzIzLzA5LzExL2gtc3RyZWV0LWdlbnRyaWZ5aW5nLWFuYy1saXF1b3ItbGljZW5zZXMta2l0Y2hlbmNyYXkv0gEA?hl=en-IN&gl=IN&ceid=IN%3Aen,2023-09-11
6,2023 Global Ribbon Mixers Market Insights: Recent Analysis and Extensive Industry Forecast till 2030,Benzinga,news.google.com/articles/CBMimQFodHRwczovL3d3dy5iZW56aW5nYS5jb20vcHJlc3NyZWxlYXNlcy8yMy8wOS8zNDQ0MTQzOC8yMDIzLWdsb2JhbC1yaWJib24tbWl4ZXJzLW1hcmtldC1pbnNpZ2h0cy1yZWNlbnQtYW5hbHlzaXMtYW5kLWV4dGVuc2l2ZS1pbmR1c3RyeS1mb3JlY2FzdC10aWxsLTIwMzDSAS1odHRwczovL3d3dy5iZW56aW5nYS5jb20vYW1wL2NvbnRlbnQvMzQ0NDE0Mzg?hl=en-IN&gl=IN&ceid=IN%3Aen,2023-09-11
