,title,source,link,date
44,Mazagon Dock Shipbuilders Ltd launches 4th ship of Project 17A ...,Equity Bulls,news.google.com/articles/CBMiMmh0dHBzOi8vd3d3LmVxdWl0eWJ1bGxzLmNvbS9jYXRlZ29yeS5waHA_aWQ9MzM3NTYz0gEA?hl=en-IN&gl=IN&ceid=IN%3Aen,2023-09-01
41,"Fifth Circuit Rules against NRC, vacating consolidated Interim ...",Lexology,news.google.com/articles/CBMiU2h0dHBzOi8vd3d3LmxleG9sb2d5LmNvbS9saWJyYXJ5L2RldGFpbC5hc3B4P2c9OTQ1YzMzMjItMDAyOS00NTMyLWIwY2QtZTc2MmZjMTJmZmEz0gEA?hl=en-IN&gl=IN&ceid=IN%3Aen,2023-09-01
23,Puravankara: Soaring to new peaks,Construction Week Online India,news.google.com/articles/CBMiTWh0dHBzOi8vd3d3LmNvbnN0cnVjdGlvbndlZWtvbmxpbmUuaW4vcGVvcGxlL3B1cmF2YW5rYXJhLXNvYXJpbmctdG8tbmV3LXBlYWtz0gEA?hl=en-IN&gl=IN&ceid=IN%3Aen,2023-09-01
1,"The Global All-terrain Crane Market is forecasted to grow by USD 4465.8 mn during 2022-2027, accelerating at a CAGR of 5.2% during the forecast period",Yahoo Finance,news.google.com/articles/CBMiVGh0dHBzOi8vZmluYW5jZS55YWhvby5jb20vbmV3cy9nbG9iYWwtdGVycmFpbi1jcmFuZS1tYXJrZXQtZm9yZWNhc3RlZC0xNDQxMDA1MTQuaHRtbNIBXGh0dHBzOi8vZmluYW5jZS55YWhvby5jb20vYW1waHRtbC9uZXdzL2dsb2JhbC10ZXJyYWluLWNyYW5lLW1hcmtldC1mb3JlY2FzdGVkLTE0NDEwMDUxNC5odG1s?hl=en-IN&gl=IN&ceid=IN%3Aen,2023-08-31
3,"Concrete Placing Booms Market 2023 Industry Size, Trends, Global Growth, Insights and Forecast Research R",Benzinga,news.google.com/articles/CBMimQFodHRwczovL3d3dy5iZW56aW5nYS5jb20vcHJlc3NyZWxlYXNlcy8yMy8wOC8zNDE0ODkwNC9jb25jcmV0ZS1wbGFjaW5nLWJvb21zLW1hcmtldC0yMDIzLWluZHVzdHJ5LXNpemUtdHJlbmRzLWdsb2JhbC1ncm93dGgtaW5zaWdodHMtYW5kLWZvcmVjYXN0LXJlc2VhcmPSAS1odHRwczovL3d3dy5iZW56aW5nYS5jb20vYW1wL2NvbnRlbnQvMzQxNDg5MDQ?hl=en-IN&gl=IN&ceid=IN%3Aen,2023-08-31
55,The Deep Potential of Pakistan's Climate Finance,The Diplomat,news.google.com/articles/CBMiUGh0dHBzOi8vdGhlZGlwbG9tYXQuY29tLzIwMjMvMDkvdGhlLWRlZXAtcG90ZW50aWFsLW9mLXBha2lzdGFucy1jbGltYXRlLWZpbmFuY2Uv0gEA?hl=en-IN&gl=IN&ceid=IN%3Aen,2023-08-31
42,Why Titan Machinery (TITN) Shares Are Rocketing Today? - Titan Machinery (NASDAQ:TITN),Benzinga,news.google.com/articles/CBMiZGh0dHBzOi8vd3d3LmJlbnppbmdhLmNvbS9uZXdzL2Vhcm5pbmdzLzIzLzA4LzM0MTQ1NTAwL3doeS10aXRhbi1tYWNoaW5lcnktc2hhcmVzLWFyZS1yb2NrZXRpbmctdG9kYXnSAS1odHRwczovL3d3dy5iZW56aW5nYS5jb20vYW1wL2NvbnRlbnQvMzQxNDU1MDA?hl=en-IN&gl=IN&ceid=IN%3Aen,2023-08-31
39,Jiwanram Sheoduttrai Industries Wins Approval From NSE SME DRHP To Raise Funds Via IPO,Goodreturns,news.google.com/articles/CBMigwFodHRwczovL3d3dy5nb29kcmV0dXJucy5pbi9uZXdzL2ppd2FucmFtLXNoZW9kdXR0cmFpLWluZHVzdHJpZXMtd2lucy1hcHByb3ZhbC1mcm9tLW5zZS1zbWUtZHJocC10by1yYWlzZS1mdW5kcy12aWEtaXBvLTEyOTc0ODMuaHRtbNIBiwFodHRwczovL3d3dy5nb29kcmV0dXJucy5pbi9hbXBodG1sL25ld3Mvaml3YW5yYW0tc2hlb2R1dHRyYWktaW5kdXN0cmllcy13aW5zLWFwcHJvdmFsLWZyb20tbnNlLXNtZS1kcmhwLXRvLXJhaXNlLWZ1bmRzLXZpYS1pcG8tMTI5NzQ4My5odG1s?hl=en-IN&gl=IN&ceid=IN%3Aen,2023-08-31
29,"Global Tappet Market 2023-2028: Roller Tappets Take the Lead: NSK Ltd., GT Technologies, and OTICS Corp. Revolutionize Engine Efficiency",Yahoo Finance,news.google.com/articles/CBMiTGh0dHBzOi8vZmluYW5jZS55YWhvby5jb20vbmV3cy9nbG9iYWwtdGFwcGV0LW1hcmtldC0yMDIzLTIwMjgtMTAxNDAwNzc2Lmh0bWzSAVRodHRwczovL2ZpbmFuY2UueWFob28uY29tL2FtcGh0bWwvbmV3cy9nbG9iYWwtdGFwcGV0LW1hcmtldC0yMDIzLTIwMjgtMTAxNDAwNzc2Lmh0bWw?hl=en-IN&gl=IN&ceid=IN%3Aen,2023-08-31
61,ICYMI: Governor Ron DeSantis Issues Updates on Hurricane Idalia,FloridaJobs.org,news.google.com/articles/CBMid2h0dHBzOi8vZmxvcmlkYWpvYnMub3JnL25ld3MtY2VudGVyL0RFTy1QcmVzcy8yMDIzLzA4LzMxL2ljeW1pLWdvdmVybm9yLXJvbi1kZXNhbnRpcy1pc3N1ZXMtdXBkYXRlcy1vbi1odXJyaWNhbmUtaWRhbGlh0gEA?hl=en-IN&gl=IN&ceid=IN%3Aen,2023-08-31
