,title,source,link,date
13,The synergy of the XPO1 inhibitors combined with the BET inhibitor ...,Nature.com,news.google.com/articles/CBMiMmh0dHBzOi8vd3d3Lm5hdHVyZS5jb20vYXJ0aWNsZXMvczQxNTk4LTAyMy00NTcyMS160gEA?hl=en-IN&gl=IN&ceid=IN%3Aen,2023-10-29
24,Unlocking fertility’s secret recipe using lab-created cells,Drug Discovery News,news.google.com/articles/CBMiY2h0dHBzOi8vd3d3LmRydWdkaXNjb3ZlcnluZXdzLmNvbS91bmxvY2tpbmctZmVydGlsaXR5LXMtc2VjcmV0LXJlY2lwZS11c2luZy1sYWItY3JlYXRlZC1jZWxscy0xNTc5MdIBAA?hl=en-IN&gl=IN&ceid=IN%3Aen,2023-10-27
8,Environmental impacts and remediation of dye-containing wastewater,Nature.com,news.google.com/articles/CBMiMmh0dHBzOi8vd3d3Lm5hdHVyZS5jb20vYXJ0aWNsZXMvczQzMDE3LTAyMy0wMDQ4OS040gEA?hl=en-IN&gl=IN&ceid=IN%3Aen,2023-10-26
28,Advances in the management of systemic lupus erythematosus,The BMJ,news.google.com/articles/CBMiL2h0dHBzOi8vd3d3LmJtai5jb20vY29udGVudC8zODMvYm1qLTIwMjItMDczOTgw0gEA?hl=en-IN&gl=IN&ceid=IN%3Aen,2023-10-26
37,Precision BioSciences Presents Preclinical Data Highlighting ...,Business Wire,news.google.com/articles/CBMi8wFodHRwczovL3d3dy5idXNpbmVzc3dpcmUuY29tL25ld3MvaG9tZS8yMDIzMTAyNjg4NDgzNy9lbi9QcmVjaXNpb24tQmlvU2NpZW5jZXMtUHJlc2VudHMtUHJlY2xpbmljYWwtRGF0YS1IaWdobGlnaHRpbmctQ2FwYWJpbGl0aWVzLW9mLUFSQ1VTLWZvci1HZW5lLUluc2VydGlvbi1hbmQtRXhjaXNpb24tYXQtdGhlLUV1cm9wZWFuLVNvY2lldHktb2YtR2VuZS1DZWxsLVRoZXJhcHktRVNHQ1QtMzB0aC1Bbm51YWwtQ29uZ3Jlc3PSAQA?hl=en-IN&gl=IN&ceid=IN%3Aen,2023-10-26
0,Food Enzymes Market size to grow by USD 914.04 million from 2022 to 2027 - Technavio,Yahoo Finance,news.google.com/articles/CBMiS2h0dHBzOi8vZmluYW5jZS55YWhvby5jb20vbmV3cy9mb29kLWVuenltZXMtbWFya2V0LXNpemUtZ3Jvdy0xOTMwMDA2NjIuaHRtbNIBU2h0dHBzOi8vZmluYW5jZS55YWhvby5jb20vYW1waHRtbC9uZXdzL2Zvb2QtZW56eW1lcy1tYXJrZXQtc2l6ZS1ncm93LTE5MzAwMDY2Mi5odG1s?hl=en-IN&gl=IN&ceid=IN%3Aen,2023-10-25
60,Food Waste Management Market is anticipated to value at US ...,InvestorsObserver,news.google.com/articles/CBMiPWh0dHBzOi8vd3d3LmludmVzdG9yc29ic2VydmVyLmNvbS9uZXdzL3FtLXByLzU3MDg4OTUzNjc3NjM5MTjSAQA?hl=en-IN&gl=IN&ceid=IN%3Aen,2023-10-25
39,Scientists Create World's Most Water-Resistant Surface - Slashdot,Slashdot,news.google.com/articles/CBMiaWh0dHBzOi8vc2NpZW5jZS5zbGFzaGRvdC5vcmcvc3RvcnkvMjMvMTAvMjQvMDExMDI0Ni9zY2llbnRpc3RzLWNyZWF0ZS13b3JsZHMtbW9zdC13YXRlci1yZXNpc3RhbnQtc3VyZmFjZdIBAA?hl=en-IN&gl=IN&ceid=IN%3Aen,2023-10-24
42,Synergistic investigation of natural and synthetic C1-trophic ...,Nature.com,news.google.com/articles/CBMiMmh0dHBzOi8vd3d3Lm5hdHVyZS5jb20vYXJ0aWNsZXMvczQxNDY3LTAyMy00MjE2Ni130gEA?hl=en-IN&gl=IN&ceid=IN%3Aen,2023-10-21
