,title,source,link,date
4,"Hong Kong bankers have lots of free time, anxiety as deals slump",The Malaysian Reserve,news.google.com/articles/CBMia2h0dHBzOi8vdGhlbWFsYXlzaWFucmVzZXJ2ZS5jb20vMjAyMy8xMS8yOS9ob25nLWtvbmctYmFua2Vycy1oYXZlLWxvdHMtb2YtZnJlZS10aW1lLWFueGlldHktYXMtZGVhbHMtc2x1bXAv0gEA?hl=en-IN&gl=IN&ceid=IN%3Aen,2023-11-29
5,Optical Communication Lens Market Will Create Highest Returns by 2028 along with Russia-Ukraine War Tracking A,openPR,news.google.com/articles/CBMiYWh0dHBzOi8vd3d3Lm9wZW5wci5jb20vbmV3cy8zMzA3ODI0L29wdGljYWwtY29tbXVuaWNhdGlvbi1sZW5zLW1hcmtldC13aWxsLWNyZWF0ZS1oaWdoZXN0LXJldHVybnPSAWBodHRwczovL3d3dy5vcGVucHIuY29tL2FtcC8zMzA3ODI0L29wdGljYWwtY29tbXVuaWNhdGlvbi1sZW5zLW1hcmtldC13aWxsLWNyZWF0ZS1oaWdoZXN0LXJldHVybnM?hl=en-IN&gl=IN&ceid=IN%3Aen,2023-11-29
0,Vehicle Refinish Coating Market: Emerging Micro-Trends: Unveiling Market Secrets in 2023 | Axalta Coating Syst,openPR,news.google.com/articles/CBMiWWh0dHBzOi8vd3d3Lm9wZW5wci5jb20vbmV3cy8zMzA3MTY2L3ZlaGljbGUtcmVmaW5pc2gtY29hdGluZy1tYXJrZXQtZW1lcmdpbmctbWljcm8tdHJlbmRz0gFYaHR0cHM6Ly93d3cub3BlbnByLmNvbS9hbXAvMzMwNzE2Ni92ZWhpY2xlLXJlZmluaXNoLWNvYXRpbmctbWFya2V0LWVtZXJnaW5nLW1pY3JvLXRyZW5kcw?hl=en-IN&gl=IN&ceid=IN%3Aen,2023-11-28
6,"Stolen Vehicle Recovery Systems Market [2023-2031] Industry Size, Share, Trends, Opportunities, Growth Analysi",openPR,news.google.com/articles/CBMiXWh0dHBzOi8vd3d3Lm9wZW5wci5jb20vbmV3cy8zMzA2MjE5L3N0b2xlbi12ZWhpY2xlLXJlY292ZXJ5LXN5c3RlbXMtbWFya2V0LTIwMjMtMjAzMS1pbmR1c3RyedIBXGh0dHBzOi8vd3d3Lm9wZW5wci5jb20vYW1wLzMzMDYyMTkvc3RvbGVuLXZlaGljbGUtcmVjb3Zlcnktc3lzdGVtcy1tYXJrZXQtMjAyMy0yMDMxLWluZHVzdHJ5?hl=en-IN&gl=IN&ceid=IN%3Aen,2023-11-28
10,"Global Automotive Centre Console Market Size, Share, Price, Trends, Growth, Analysis, Report, Forecast 2024-20",openPR,news.google.com/articles/CBMiXGh0dHBzOi8vd3d3Lm9wZW5wci5jb20vbmV3cy8zMzA2ODMwL2dsb2JhbC1hdXRvbW90aXZlLWNlbnRyZS1jb25zb2xlLW1hcmtldC1zaXplLXNoYXJlLXByaWNl0gFbaHR0cHM6Ly93d3cub3BlbnByLmNvbS9hbXAvMzMwNjgzMC9nbG9iYWwtYXV0b21vdGl2ZS1jZW50cmUtY29uc29sZS1tYXJrZXQtc2l6ZS1zaGFyZS1wcmljZQ?hl=en-IN&gl=IN&ceid=IN%3Aen,2023-11-28
17,"Global MultiTouch Screen Market is expected to reach USD 10.05 billion by 2029, with a remarkable CAGR of 9.78",openPR,news.google.com/articles/CBMiYmh0dHBzOi8vd3d3Lm9wZW5wci5jb20vbmV3cy8zMzAxMzQ2L2dsb2JhbC1tdWx0aXRvdWNoLXNjcmVlbi1tYXJrZXQtaXMtZXhwZWN0ZWQtdG8tcmVhY2gtdXNkLTEwLTA10gFhaHR0cHM6Ly93d3cub3BlbnByLmNvbS9hbXAvMzMwMTM0Ni9nbG9iYWwtbXVsdGl0b3VjaC1zY3JlZW4tbWFya2V0LWlzLWV4cGVjdGVkLXRvLXJlYWNoLXVzZC0xMC0wNQ?hl=en-IN&gl=IN&ceid=IN%3Aen,2023-11-24
