,title,source,link,date
22,"The Telemedicine Carts & Systems market is expected to grow at a significant rate from 2023 to 2030, with",Benzinga,news.google.com/articles/CBMimQFodHRwczovL3d3dy5iZW56aW5nYS5jb20vcHJlc3NyZWxlYXNlcy8yMy8wOS8zNDE5NDAzOS90aGUtdGVsZW1lZGljaW5lLWNhcnRzLXN5c3RlbXMtbWFya2V0LWlzLWV4cGVjdGVkLXRvLWdyb3ctYXQtYS1zaWduaWZpY2FudC1yYXRlLWZyb20tMjAyMy10by0yMDMwLXfSAS1odHRwczovL3d3dy5iZW56aW5nYS5jb20vYW1wL2NvbnRlbnQvMzQxOTQwMzk?hl=en-IN&gl=IN&ceid=IN%3Aen,2023-09-03
26,"Insightful Answers in Media Processors Market Research Report: Industry Overview, Trends, and Forecasted",Benzinga,news.google.com/articles/CBMimQFodHRwczovL3d3dy5iZW56aW5nYS5jb20vcHJlc3NyZWxlYXNlcy8yMy8wOS8zNDE5MzA3OC9pbnNpZ2h0ZnVsLWFuc3dlcnMtaW4tbWVkaWEtcHJvY2Vzc29ycy1tYXJrZXQtcmVzZWFyY2gtcmVwb3J0LWluZHVzdHJ5LW92ZXJ2aWV3LXRyZW5kcy1hbmQtZm9yZWNhc3TSAS1odHRwczovL3d3dy5iZW56aW5nYS5jb20vYW1wL2NvbnRlbnQvMzQxOTMwNzg?hl=en-IN&gl=IN&ceid=IN%3Aen,2023-09-03
29,The projected CAGR of 13.6% from 2023 to 2030 implies that the Complex Programmable Logic Devices (CPLD),Benzinga,news.google.com/articles/CBMimQFodHRwczovL3d3dy5iZW56aW5nYS5jb20vcHJlc3NyZWxlYXNlcy8yMy8wOS8zNDE5MjM3NS90aGUtcHJvamVjdGVkLWNhZ3Itb2YtMTMtNi1mcm9tLTIwMjMtdG8tMjAzMC1pbXBsaWVzLXRoYXQtdGhlLWNvbXBsZXgtcHJvZ3JhbW1hYmxlLWxvZ2ljLWRldmljZXMtY3DSAS1odHRwczovL3d3dy5iZW56aW5nYS5jb20vYW1wL2NvbnRlbnQvMzQxOTIzNzU?hl=en-IN&gl=IN&ceid=IN%3Aen,2023-09-03
23,"Dental Rapid Prototyping Systems Market research analysis with types, applications and Growth Production",Benzinga,news.google.com/articles/CBMimQFodHRwczovL3d3dy5iZW56aW5nYS5jb20vcHJlc3NyZWxlYXNlcy8yMy8wOS8zNDE4OTIwNi9kZW50YWwtcmFwaWQtcHJvdG90eXBpbmctc3lzdGVtcy1tYXJrZXQtcmVzZWFyY2gtYW5hbHlzaXMtd2l0aC10eXBlcy1hcHBsaWNhdGlvbnMtYW5kLWdyb3d0aC1wcm9kdWPSAS1odHRwczovL3d3dy5iZW56aW5nYS5jb20vYW1wL2NvbnRlbnQvMzQxODkyMDY?hl=en-IN&gl=IN&ceid=IN%3Aen,2023-09-02
35,'Starfield' Fan Banned From Subreddit For Narcing On Leaker To Cops,Slashdot,news.google.com/articles/CBMic2h0dHBzOi8vZ2FtZXMuc2xhc2hkb3Qub3JnL3N0b3J5LzIzLzA5LzAyLzA1MzYyMzMvc3RhcmZpZWxkLWZhbi1iYW5uZWQtZnJvbS1zdWJyZWRkaXQtZm9yLW5hcmNpbmctb24tbGVha2VyLXRvLWNvcHPSAQA?hl=en-IN&gl=IN&ceid=IN%3Aen,2023-09-02
7,Digiaccel rewriting business education; Using deeptech to evade ...,YourStory,news.google.com/articles/CBMiU2h0dHBzOi8veW91cnN0b3J5LmNvbS8yMDIzLzA4L2RpZ2lhY2NlbC1yZXdyaXRpbmctYnVzaW5lc3MtZWR1Y2F0aW9uLS1jeWJlcnNlY3VyaXR50gEA?hl=en-IN&gl=IN&ceid=IN%3Aen,2023-09-01
9,Scott Herkelman Q&A: AMD Radeon boss answers your burning RX ...,Club386,news.google.com/articles/CBMiZWh0dHBzOi8vd3d3LmNsdWIzODYuY29tL3Njb3R0LWhlcmtlbG1hbi1xYS1hbWQtcmFkZW9uLWJvc3MtYW5zd2Vycy15b3VyLWJ1cm5pbmctcngtNzgwMC14dC1xdWVzdGlvbnMv0gEA?hl=en-IN&gl=IN&ceid=IN%3Aen,2023-08-31
25,"Application-to-Person SMS and API Market Worldwide Industry Analysis, Future Demand and Forecast till 2029",openPR,news.google.com/articles/CBMiX2h0dHBzOi8vd3d3Lm9wZW5wci5jb20vbmV3cy8zMTkwMDY5L2FwcGxpY2F0aW9uLXRvLXBlcnNvbi1zbXMtYW5kLWFwaS1tYXJrZXQtd29ybGR3aWRlLWluZHVzdHJ50gFeaHR0cHM6Ly93d3cub3BlbnByLmNvbS9hbXAvMzE5MDA2OS9hcHBsaWNhdGlvbi10by1wZXJzb24tc21zLWFuZC1hcGktbWFya2V0LXdvcmxkd2lkZS1pbmR1c3RyeQ?hl=en-IN&gl=IN&ceid=IN%3Aen,2023-08-31
4,"Aluminum Caps for Beverage Packaging Market Size 2023 Latest Insights, Growth Rate, Future Trends, and Bu",Benzinga,news.google.com/articles/CBMimQFodHRwczovL3d3dy5iZW56aW5nYS5jb20vcHJlc3NyZWxlYXNlcy8yMy8wOC8zNDEwNzQ3MS9hbHVtaW51bS1jYXBzLWZvci1iZXZlcmFnZS1wYWNrYWdpbmctbWFya2V0LXNpemUtMjAyMy1sYXRlc3QtaW5zaWdodHMtZ3Jvd3RoLXJhdGUtZnV0dXJlLXRyZW5kcy1hbmTSAS1odHRwczovL3d3dy5iZW56aW5nYS5jb20vYW1wL2NvbnRlbnQvMzQxMDc0NzE?hl=en-IN&gl=IN&ceid=IN%3Aen,2023-08-30
8,AMD: Is This The Next Nvidia?,Seeking Alpha,news.google.com/articles/CBMiRGh0dHBzOi8vc2Vla2luZ2FscGhhLmNvbS9hcnRpY2xlLzQ2MzE3MTQtYW1kLWlzLXRoaXMtdGhlLW5leHQtbnZpZGlh0gEA?hl=en-IN&gl=IN&ceid=IN%3Aen,2023-08-29
