,title,source,link,date
7,"Valiant Laboratories IPO GMP, Price, Allotment, Profit Estimate 2023",IPO Central,news.google.com/articles/CBMiSGh0dHBzOi8vaXBvY2VudHJhbC5pbi92YWxpYW50LWxhYm9yYXRvcmllcy1pcG8tZ21wLXByaWNlLWRhdGUtYWxsb3RtZW50L9IBAA?hl=en-IN&gl=IN&ceid=IN%3Aen,2023-09-19
16,NIIT Stock Soars by 56% in September - Expert Opinions on ...,Share Price India News,news.google.com/articles/CBMiYmh0dHBzOi8vc2hhcmVwcmljZWluZGlhLmNvbS9uaWl0LXN0b2NrLXNvYXJzLWJ5LTU2LWluLXNlcHRlbWJlci1leHBlcnQtb3BpbmlvbnMtb24td2hldGhlci10by1idXkv0gEA?hl=en-IN&gl=IN&ceid=IN%3Aen,2023-09-18
21,"Updater Services IPO GMP, Price, Allotment, Profit Estimate 2023",IPO Central,news.google.com/articles/CBMiRGh0dHBzOi8vaXBvY2VudHJhbC5pbi91cGRhdGVyLXNlcnZpY2VzLWlwby1nbXAtcHJpY2UtZGF0ZS1hbGxvdG1lbnQv0gEA?hl=en-IN&gl=IN&ceid=IN%3Aen,2023-09-16
24,"JSW Infra IPO GMP, Price, Allotment, Profit Estimate 2023",IPO Central,news.google.com/articles/CBMiPWh0dHBzOi8vaXBvY2VudHJhbC5pbi9qc3ctaW5mcmEtaXBvLWdtcC1wcmljZS1kYXRlLWFsbG90bWVudC_SAQA?hl=en-IN&gl=IN&ceid=IN%3Aen,2023-09-13
25,"Manoj Vaibhav Gems IPO GMP, Price, Allotment, Profit Estimate 2023",IPO Central,news.google.com/articles/CBMiRmh0dHBzOi8vaXBvY2VudHJhbC5pbi9tYW5vai12YWliaGF2LWdlbXMtaXBvLWdtcC1wcmljZS1kYXRlLWFsbG90bWVudC_SAQA?hl=en-IN&gl=IN&ceid=IN%3Aen,2023-09-13
19,"India Wealth Management Market 2023 Industry Size, Share, Trends, Opportunities, Growth Analysis and Fore",Benzinga,news.google.com/articles/CBMimQFodHRwczovL3d3dy5iZW56aW5nYS5jb20vcHJlc3NyZWxlYXNlcy8yMy8wOS8zNDQ3ODYyMy9pbmRpYS13ZWFsdGgtbWFuYWdlbWVudC1tYXJrZXQtMjAyMy1pbmR1c3RyeS1zaXplLXNoYXJlLXRyZW5kcy1vcHBvcnR1bml0aWVzLWdyb3d0aC1hbmFseXNpcy1hbmQtZm_SAS1odHRwczovL3d3dy5iZW56aW5nYS5jb20vYW1wL2NvbnRlbnQvMzQ0Nzg2MjM?hl=en-IN&gl=IN&ceid=IN%3Aen,2023-09-12
26,"Yatra Online IPO GMP, Price, Allotment, Profit Estimate 2023",IPO Central,news.google.com/articles/CBMiQGh0dHBzOi8vaXBvY2VudHJhbC5pbi95YXRyYS1vbmxpbmUtaXBvLWdtcC1wcmljZS1kYXRlLWFsbG90bWVudC_SAQA?hl=en-IN&gl=IN&ceid=IN%3Aen,2023-09-11
34,"Zaggle IPO GMP, Price, Allotment, Profit Estimate 2023",IPO Central,news.google.com/articles/CBMiOmh0dHBzOi8vaXBvY2VudHJhbC5pbi96YWdnbGUtaXBvLWdtcC1wcmljZS1kYXRlLWFsbG90bWVudC_SAQA?hl=en-IN&gl=IN&ceid=IN%3Aen,2023-09-08
12,ETtech Explainer: Decoding the buzz around Sebi’s finfluencer guidelines,The Economic Times,news.google.com/articles/CBMijAFodHRwczovL20uZWNvbm9taWN0aW1lcy5jb20vdGVjaC90ZWNobm9sb2d5L2V0dGVjaC1leHBsYWluZXItZGVjb2RpbmctdGhlLWJ1enotYXJvdW5kLXNlYmlzLWZpbmZsdWVuY2VyLWd1aWRlbGluZXMvYXJ0aWNsZXNob3cvMTAzNDM1MTI2LmNtc9IBkAFodHRwczovL20uZWNvbm9taWN0aW1lcy5jb20vdGVjaC90ZWNobm9sb2d5L2V0dGVjaC1leHBsYWluZXItZGVjb2RpbmctdGhlLWJ1enotYXJvdW5kLXNlYmlzLWZpbmZsdWVuY2VyLWd1aWRlbGluZXMvYW1wX2FydGljbGVzaG93LzEwMzQzNTEyNi5jbXM?hl=en-IN&gl=IN&ceid=IN%3Aen,2023-09-07
38,"RR Kabel IPO GMP, Price, Allotment, Profit Estimate 2023",IPO Central,news.google.com/articles/CBMiPGh0dHBzOi8vaXBvY2VudHJhbC5pbi9yci1rYWJlbC1pcG8tZ21wLXByaWNlLWRhdGUtYWxsb3RtZW50L9IBAA?hl=en-IN&gl=IN&ceid=IN%3Aen,2023-09-06
