,title,source,link,date
98,Eden Hazard: An ode to football’s best slacker… and his helpful bum,The Athletic,news.google.com/articles/CBMiR2h0dHBzOi8vdGhlYXRobGV0aWMuY29tLzQ5NDgxMjEvMjAyMy8xMC8xMS9lZGVuLWhhemFyZC1vZGUtc2xhY2tlci1idW0v0gFNaHR0cHM6Ly90aGVhdGhsZXRpYy5jb20vNDk0ODEyMS8yMDIzLzEwLzExL2VkZW4taGF6YXJkLW9kZS1zbGFja2VyLWJ1bS8_YW1wPTE?hl=en-IN&gl=IN&ceid=IN%3Aen,2023-10-11
93,"7 Hardest Tomb Raider Games, Ranked",GameRant,news.google.com/articles/CBMiL2h0dHBzOi8vZ2FtZXJhbnQuY29tL3RvbWItcmFpZGVyLWhhcmRlc3QtZ2FtZXMv0gEA?hl=en-IN&gl=IN&ceid=IN%3Aen,2023-10-11
89,Jungle Ventures launches program to support early-stage startups ...,TechNode Global,news.google.com/articles/CBMiIGh0dHBzOi8vdGVjaG5vZGUuZ2xvYmFsLz9wPTU5NDIy0gEA?hl=en-IN&gl=IN&ceid=IN%3Aen,2023-10-11
55,Osborne Clarke advises VR Ventures / Redstone on investment in ...,Osborne Clarke,news.google.com/articles/CBMiXmh0dHBzOi8vd3d3Lm9zYm9ybmVjbGFya2UuY29tL25ld3Mvb3Nib3JuZS1jbGFya2UtYWR2aXNlcy12ci12ZW50dXJlcy1yZWRzdG9uZS1pbnZlc3RtZW50LW9ydXPSAQA?hl=en-IN&gl=IN&ceid=IN%3Aen,2023-10-10
95,"Eye On Business; Riverview/Apollo Beach, October 2023",Osprey Observer,news.google.com/articles/CBMiW2h0dHBzOi8vd3d3Lm9zcHJleW9ic2VydmVyLmNvbS8yMDIzLzEwL2V5ZS1vbi1idXNpbmVzcy1yaXZlcnZpZXctYXBvbGxvLWJlYWNoLW9jdG9iZXItMjAyMy_SAQA?hl=en-IN&gl=IN&ceid=IN%3Aen,2023-10-10
88,"Paramount+ Charts Course for ‘Populist’ Series With Multi-Season Potential, Says Paramount TV Studio President Nicole Clemens",Yahoo News UK,news.google.com/articles/CBMiUGh0dHBzOi8vdWsubmV3cy55YWhvby5jb20vcGFyYW1vdW50LWNoYXJ0cy1jb3Vyc2UtcG9wdWxpc3Qtc2VyaWVzLTE4NDYwNDk5NC5odG1s0gFYaHR0cHM6Ly91ay5uZXdzLnlhaG9vLmNvbS9hbXBodG1sL3BhcmFtb3VudC1jaGFydHMtY291cnNlLXBvcHVsaXN0LXNlcmllcy0xODQ2MDQ5OTQuaHRtbA?hl=en-IN&gl=IN&ceid=IN%3Aen,2023-10-10
70,Oakland looks to regulate Airbnb and Vrbo short-term rentals,Oaklandside,news.google.com/articles/CBMiQ2h0dHBzOi8vb2FrbGFuZHNpZGUub3JnLzIwMjMvMTAvMTAvYWlyYm5iLXZyYm8tcmVndWxhdGlvbnMtb2FrbGFuZC_SAQA?hl=en-IN&gl=IN&ceid=IN%3Aen,2023-10-10
67,Five Things to Know About the Buick LPGA Shanghai,LPGA,news.google.com/articles/CBMiUGh0dHBzOi8vd3d3LmxwZ2EuY29tL25ld3MvMjAyMy9maXZlLXRoaW5ncy10by1rbm93LWFib3V0LXRoZS1idWljay1scGdhLXNoYW5naGFp0gEA?hl=en-IN&gl=IN&ceid=IN%3Aen,2023-10-10
66,SOUND OF FREEDOM Surpasses Oscar Winner's Box Office Take,Movieguide,news.google.com/articles/CBMiZmh0dHBzOi8vd3d3Lm1vdmllZ3VpZGUub3JnL25ld3MtYXJ0aWNsZXMvc291bmQtb2YtZnJlZWRvbS1zdXJwYXNzZXMtb3NjYXItd2lubmVycy1ib3gtb2ZmaWNlLXRha2UuaHRtbNIBAA?hl=en-IN&gl=IN&ceid=IN%3Aen,2023-10-10
58,McDonald’s Halloween Squishmallows: When can I get the limited-edition plushies?...,The US Sun,news.google.com/articles/CBMiTWh0dHBzOi8vd3d3LnRoZS1zdW4uY29tL21vbmV5LzkyOTY4MjUvbWNkb25hbGRzLWhhbGxvd2Vlbi1zcXVpc2htYWxsb3dzLTIwMjMv0gFRaHR0cHM6Ly93d3cudGhlLXN1bi5jb20vbW9uZXkvOTI5NjgyNS9tY2RvbmFsZHMtaGFsbG93ZWVuLXNxdWlzaG1hbGxvd3MtMjAyMy9hbXAv?hl=en-IN&gl=IN&ceid=IN%3Aen,2023-10-10
