,title,source,link,date
20,"USB Car Chargers Market Report Analysis, Growth Prospects, Industry Size, Company Share, Major Competitors, Re",openPR,news.google.com/articles/CBMiXGh0dHBzOi8vd3d3Lm9wZW5wci5jb20vbmV3cy8zMjIyOTQxL3VzYi1jYXItY2hhcmdlcnMtbWFya2V0LXJlcG9ydC1hbmFseXNpcy1ncm93dGgtcHJvc3BlY3Rz0gFbaHR0cHM6Ly93d3cub3BlbnByLmNvbS9hbXAvMzIyMjk0MS91c2ItY2FyLWNoYXJnZXJzLW1hcmtldC1yZXBvcnQtYW5hbHlzaXMtZ3Jvd3RoLXByb3NwZWN0cw?hl=en-IN&gl=IN&ceid=IN%3Aen,2023-09-25
14,"Silicon Hexaboride Market 2023: Global Business Growth, Demand, Trends, Key Players and Forecasts till 2029| S",openPR,news.google.com/articles/CBMiWWh0dHBzOi8vd3d3Lm9wZW5wci5jb20vbmV3cy8zMjIyNTU3L3NpbGljb24taGV4YWJvcmlkZS1tYXJrZXQtMjAyMy1nbG9iYWwtYnVzaW5lc3MtZ3Jvd3Ro0gFYaHR0cHM6Ly93d3cub3BlbnByLmNvbS9hbXAvMzIyMjU1Ny9zaWxpY29uLWhleGFib3JpZGUtbWFya2V0LTIwMjMtZ2xvYmFsLWJ1c2luZXNzLWdyb3d0aA?hl=en-IN&gl=IN&ceid=IN%3Aen,2023-09-25
16,"TMR Sensing ICs Market Report Analysis, Growth Prospects, Industry Size, Company Share, Major Competitors, Reg",openPR,news.google.com/articles/CBMiW2h0dHBzOi8vd3d3Lm9wZW5wci5jb20vbmV3cy8zMjIyOTI5L3Rtci1zZW5zaW5nLWljcy1tYXJrZXQtcmVwb3J0LWFuYWx5c2lzLWdyb3d0aC1wcm9zcGVjdHPSAVpodHRwczovL3d3dy5vcGVucHIuY29tL2FtcC8zMjIyOTI5L3Rtci1zZW5zaW5nLWljcy1tYXJrZXQtcmVwb3J0LWFuYWx5c2lzLWdyb3d0aC1wcm9zcGVjdHM?hl=en-IN&gl=IN&ceid=IN%3Aen,2023-09-25
17,"Industrial Bag Dust Filter Market 2020 | In-Depth Analysis Of Industry Share, Size, Growth and Regional Outloo",openPR,news.google.com/articles/CBMiXGh0dHBzOi8vd3d3Lm9wZW5wci5jb20vbmV3cy8zMjIzMDA1L2luZHVzdHJpYWwtYmFnLWR1c3QtZmlsdGVyLW1hcmtldC0yMDIwLWluLWRlcHRoLWFuYWx5c2lz0gFbaHR0cHM6Ly93d3cub3BlbnByLmNvbS9hbXAvMzIyMzAwNS9pbmR1c3RyaWFsLWJhZy1kdXN0LWZpbHRlci1tYXJrZXQtMjAyMC1pbi1kZXB0aC1hbmFseXNpcw?hl=en-IN&gl=IN&ceid=IN%3Aen,2023-09-25
18,"Watch Battery Market Size and Share Insights - Market Key Players with Growth Status, Revenue Expectations, an",openPR,news.google.com/articles/CBMiY2h0dHBzOi8vd3d3Lm9wZW5wci5jb20vbmV3cy8zMjIyOTcyL3dhdGNoLWJhdHRlcnktbWFya2V0LXNpemUtYW5kLXNoYXJlLWluc2lnaHRzLW1hcmtldC1rZXktcGxheWVyc9IBYmh0dHBzOi8vd3d3Lm9wZW5wci5jb20vYW1wLzMyMjI5NzIvd2F0Y2gtYmF0dGVyeS1tYXJrZXQtc2l6ZS1hbmQtc2hhcmUtaW5zaWdodHMtbWFya2V0LWtleS1wbGF5ZXJz?hl=en-IN&gl=IN&ceid=IN%3Aen,2023-09-25
19,"Extra Coarse Grinding Wheel Market Size 2023, Trends, Value, Top Players and Future Expectations to 2029",openPR,news.google.com/articles/CBMiYWh0dHBzOi8vd3d3Lm9wZW5wci5jb20vbmV3cy8zMjIyMzYwL2V4dHJhLWNvYXJzZS1ncmluZGluZy13aGVlbC1tYXJrZXQtc2l6ZS0yMDIzLXRyZW5kcy12YWx1ZS10b3DSAWBodHRwczovL3d3dy5vcGVucHIuY29tL2FtcC8zMjIyMzYwL2V4dHJhLWNvYXJzZS1ncmluZGluZy13aGVlbC1tYXJrZXQtc2l6ZS0yMDIzLXRyZW5kcy12YWx1ZS10b3A?hl=en-IN&gl=IN&ceid=IN%3Aen,2023-09-25
22,Emergency Response Systems Market Is Booming Across the Globe and Witness Huge Growth by Key Players to 2030,openPR,news.google.com/articles/CBMiYWh0dHBzOi8vd3d3Lm9wZW5wci5jb20vbmV3cy8zMjIyNDc0L2VtZXJnZW5jeS1yZXNwb25zZS1zeXN0ZW1zLW1hcmtldC1pcy1ib29taW5nLWFjcm9zcy10aGUtZ2xvYmXSAWBodHRwczovL3d3dy5vcGVucHIuY29tL2FtcC8zMjIyNDc0L2VtZXJnZW5jeS1yZXNwb25zZS1zeXN0ZW1zLW1hcmtldC1pcy1ib29taW5nLWFjcm9zcy10aGUtZ2xvYmU?hl=en-IN&gl=IN&ceid=IN%3Aen,2023-09-25
23,"Maritime Security Market Size, Growth, Share, Regional Prospects, Opportunities and Forecast 2030",openPR,news.google.com/articles/CBMiV2h0dHBzOi8vd3d3Lm9wZW5wci5jb20vbmV3cy8zMjIyMjQ2L21hcml0aW1lLXNlY3VyaXR5LW1hcmtldC1zaXplLWdyb3d0aC1zaGFyZS1yZWdpb25hbNIBVmh0dHBzOi8vd3d3Lm9wZW5wci5jb20vYW1wLzMyMjIyNDYvbWFyaXRpbWUtc2VjdXJpdHktbWFya2V0LXNpemUtZ3Jvd3RoLXNoYXJlLXJlZ2lvbmFs?hl=en-IN&gl=IN&ceid=IN%3Aen,2023-09-25
42,Biological Organic Fertilizers Market Report by Worldwide Market Trends & Opportunities and Forecast to 2030,openPR,news.google.com/articles/CBMiXWh0dHBzOi8vd3d3Lm9wZW5wci5jb20vbmV3cy8zMjE4MDk4L2Jpb2xvZ2ljYWwtb3JnYW5pYy1mZXJ0aWxpemVycy1tYXJrZXQtcmVwb3J0LWJ5LXdvcmxkd2lkZdIBXGh0dHBzOi8vd3d3Lm9wZW5wci5jb20vYW1wLzMyMTgwOTgvYmlvbG9naWNhbC1vcmdhbmljLWZlcnRpbGl6ZXJzLW1hcmtldC1yZXBvcnQtYnktd29ybGR3aWRl?hl=en-IN&gl=IN&ceid=IN%3Aen,2023-09-22
47,"Clinical Mass Spectrometry Market 2023: Global Industry Share, Demand, Revenue, Size, Trends, Development, Opp",openPR,news.google.com/articles/CBMiYGh0dHBzOi8vd3d3Lm9wZW5wci5jb20vbmV3cy8zMjE4MjE2L2NsaW5pY2FsLW1hc3Mtc3BlY3Ryb21ldHJ5LW1hcmtldC0yMDIzLWdsb2JhbC1pbmR1c3RyeS1zaGFyZdIBX2h0dHBzOi8vd3d3Lm9wZW5wci5jb20vYW1wLzMyMTgyMTYvY2xpbmljYWwtbWFzcy1zcGVjdHJvbWV0cnktbWFya2V0LTIwMjMtZ2xvYmFsLWluZHVzdHJ5LXNoYXJl?hl=en-IN&gl=IN&ceid=IN%3Aen,2023-09-22
