,title,source,link,date
5,Recycled Metal Market Size and Forecasts (2020 - 2030),openPR,news.google.com/articles/CBMiVmh0dHBzOi8vd3d3Lm9wZW5wci5jb20vbmV3cy8zMjEzNTA0L3JlY3ljbGVkLW1ldGFsLW1hcmtldC1zaXplLWFuZC1mb3JlY2FzdHMtMjAyMC0yMDMw0gFVaHR0cHM6Ly93d3cub3BlbnByLmNvbS9hbXAvMzIxMzUwNC9yZWN5Y2xlZC1tZXRhbC1tYXJrZXQtc2l6ZS1hbmQtZm9yZWNhc3RzLTIwMjAtMjAzMA?hl=en-IN&gl=IN&ceid=IN%3Aen,2023-09-19
7,"Electrolytic Copper Metal Powder Material Market Leading Players, Growth, Production, And Opportunities 2023-2",openPR,news.google.com/articles/CBMiXGh0dHBzOi8vd3d3Lm9wZW5wci5jb20vbmV3cy8zMjEyMzY3L2VsZWN0cm9seXRpYy1jb3BwZXItbWV0YWwtcG93ZGVyLW1hdGVyaWFsLW1hcmtldC1sZWFkaW5n0gFbaHR0cHM6Ly93d3cub3BlbnByLmNvbS9hbXAvMzIxMjM2Ny9lbGVjdHJvbHl0aWMtY29wcGVyLW1ldGFsLXBvd2Rlci1tYXRlcmlhbC1tYXJrZXQtbGVhZGluZw?hl=en-IN&gl=IN&ceid=IN%3Aen,2023-09-18
19,"Electron Grade Nickel Powder Market Size, Growth Forecast, Emerging Trends And Forecast Analysis To 2029| Hunt",openPR,news.google.com/articles/CBMiXGh0dHBzOi8vd3d3Lm9wZW5wci5jb20vbmV3cy8zMjEyMTcxL2VsZWN0cm9uLWdyYWRlLW5pY2tlbC1wb3dkZXItbWFya2V0LXNpemUtZ3Jvd3RoLWZvcmVjYXN00gFbaHR0cHM6Ly93d3cub3BlbnByLmNvbS9hbXAvMzIxMjE3MS9lbGVjdHJvbi1ncmFkZS1uaWNrZWwtcG93ZGVyLW1hcmtldC1zaXplLWdyb3d0aC1mb3JlY2FzdA?hl=en-IN&gl=IN&ceid=IN%3Aen,2023-09-18
20,"Neoprene Rubber Sheets Market Size by Manufacturers, Regions, And Forecast to 2029| Deesawala Rubber Industrie",openPR,news.google.com/articles/CBMiX2h0dHBzOi8vd3d3Lm9wZW5wci5jb20vbmV3cy8zMjEyMzQ5L25lb3ByZW5lLXJ1YmJlci1zaGVldHMtbWFya2V0LXNpemUtYnktbWFudWZhY3R1cmVycy1yZWdpb25z0gFeaHR0cHM6Ly93d3cub3BlbnByLmNvbS9hbXAvMzIxMjM0OS9uZW9wcmVuZS1ydWJiZXItc2hlZXRzLW1hcmtldC1zaXplLWJ5LW1hbnVmYWN0dXJlcnMtcmVnaW9ucw?hl=en-IN&gl=IN&ceid=IN%3Aen,2023-09-18
22,Single Crystal Nickel Cobalt Lithium ManganeseTernary Cathode Material with Primary Particles Market Analysis,openPR,news.google.com/articles/CBMiYWh0dHBzOi8vd3d3Lm9wZW5wci5jb20vbmV3cy8zMjEyMzYwL3NpbmdsZS1jcnlzdGFsLW5pY2tlbC1jb2JhbHQtbGl0aGl1bS1tYW5nYW5lc2V0ZXJuYXJ5LWNhdGhvZGXSAWBodHRwczovL3d3dy5vcGVucHIuY29tL2FtcC8zMjEyMzYwL3NpbmdsZS1jcnlzdGFsLW5pY2tlbC1jb2JhbHQtbGl0aGl1bS1tYW5nYW5lc2V0ZXJuYXJ5LWNhdGhvZGU?hl=en-IN&gl=IN&ceid=IN%3Aen,2023-09-18
4,Love for gold and longing for husband: Indian hockey captain Savita gears up for Asiad,The Hindu,news.google.com/articles/CBMijwFodHRwczovL3d3dy50aGVoaW5kdS5jb20vc3BvcnQvaG9ja2V5L2xvdmUtZm9yLWdvbGQtYW5kLWxvbmdpbmctZm9yLWh1c2JhbmQtaW5kaWFuLWhvY2tleS1jYXB0YWluLXNhdml0YS1nZWFycy11cC1mb3ItYXNpYWQvYXJ0aWNsZTY3MzEyODYwLmVjZdIBlAFodHRwczovL3d3dy50aGVoaW5kdS5jb20vc3BvcnQvaG9ja2V5L2xvdmUtZm9yLWdvbGQtYW5kLWxvbmdpbmctZm9yLWh1c2JhbmQtaW5kaWFuLWhvY2tleS1jYXB0YWluLXNhdml0YS1nZWFycy11cC1mb3ItYXNpYWQvYXJ0aWNsZTY3MzEyODYwLmVjZS9hbXAv?hl=en-IN&gl=IN&ceid=IN%3Aen,2023-09-15
0,Penny Stocks: Stocks likely to be in focus tomorrow!,Dalal Street Investment Journal,news.google.com/articles/CBMiXmh0dHBzOi8vd3d3LmRzaWouaW4vZHNpamFydGljbGVkZXRhaWwvcGVubnktc3RvY2tzLXN0b2Nrcy1saWtlbHktdG8tYmUtaW4tZm9jdXMtdG9tb3Jyb3ctMzMyNDLSAQA?hl=en-IN&gl=IN&ceid=IN%3Aen,2023-09-14
33,"Ultrafine Bismuth Powder Market Size 2023, Global Industry Demand, Share, Top Players and Future Expectations",openPR,news.google.com/articles/CBMiXWh0dHBzOi8vd3d3Lm9wZW5wci5jb20vbmV3cy8zMjA4NTc0L3VsdHJhZmluZS1iaXNtdXRoLXBvd2Rlci1tYXJrZXQtc2l6ZS0yMDIzLWdsb2JhbC1pbmR1c3RyedIBXGh0dHBzOi8vd3d3Lm9wZW5wci5jb20vYW1wLzMyMDg1NzQvdWx0cmFmaW5lLWJpc211dGgtcG93ZGVyLW1hcmtldC1zaXplLTIwMjMtZ2xvYmFsLWluZHVzdHJ5?hl=en-IN&gl=IN&ceid=IN%3Aen,2023-09-14
35,"Cam Locks Market Research Report with Size, Share, Value, CAGR, Outlook, Analysis, Data, and News 2023-2030",openPR,news.google.com/articles/CBMiX2h0dHBzOi8vd3d3Lm9wZW5wci5jb20vbmV3cy8zMjA4ODgwL2NhbS1sb2Nrcy1tYXJrZXQtcmVzZWFyY2gtcmVwb3J0LXdpdGgtc2l6ZS1zaGFyZS12YWx1ZS1jYWdy0gFeaHR0cHM6Ly93d3cub3BlbnByLmNvbS9hbXAvMzIwODg4MC9jYW0tbG9ja3MtbWFya2V0LXJlc2VhcmNoLXJlcG9ydC13aXRoLXNpemUtc2hhcmUtdmFsdWUtY2Fncg?hl=en-IN&gl=IN&ceid=IN%3Aen,2023-09-14
36,"Milk Packaging Market (COVID-19 Analysis) with Industry Share, Growth, Trends Analysis by 2028",openPR,news.google.com/articles/CBMiX2h0dHBzOi8vd3d3Lm9wZW5wci5jb20vbmV3cy8zMjA4NDcwL21pbGstcGFja2FnaW5nLW1hcmtldC1jb3ZpZC0xOS1hbmFseXNpcy13aXRoLWluZHVzdHJ5LXNoYXJl0gFeaHR0cHM6Ly93d3cub3BlbnByLmNvbS9hbXAvMzIwODQ3MC9taWxrLXBhY2thZ2luZy1tYXJrZXQtY292aWQtMTktYW5hbHlzaXMtd2l0aC1pbmR1c3RyeS1zaGFyZQ?hl=en-IN&gl=IN&ceid=IN%3Aen,2023-09-14
