,title,source,link,date
5,Chef to get creative in the cold,Australian Department of Defence,news.google.com/articles/CBMiTWh0dHBzOi8vd3d3LmRlZmVuY2UuZ292LmF1L25ld3MtZXZlbnRzL25ld3MvMjAyMy0xMS0wOS9jaGVmLWdldC1jcmVhdGl2ZS1jb2xk0gEA?hl=en-IN&gl=IN&ceid=IN%3Aen,2023-11-09
21,Deadline nears for Sussex fishing vessels to claim government grant for compulsory monitoring kit,Yahoo News UK,news.google.com/articles/CBMiTmh0dHBzOi8vdWsubmV3cy55YWhvby5jb20vZGVhZGxpbmUtbmVhcnMtc3Vzc2V4LWZpc2hpbmctdmVzc2Vscy0xMTU5NDYwNzUuaHRtbNIBVmh0dHBzOi8vdWsubmV3cy55YWhvby5jb20vYW1waHRtbC9kZWFkbGluZS1uZWFycy1zdXNzZXgtZmlzaGluZy12ZXNzZWxzLTExNTk0NjA3NS5odG1s?hl=en-IN&gl=IN&ceid=IN%3Aen,2023-11-09
48,North Greenland Ice Shelves Have Lost 35% of Their Volume In Last ...,Slashdot,news.google.com/articles/CBMiiQFodHRwczovL25ld3Muc2xhc2hkb3Qub3JnL3N0b3J5LzIzLzExLzA4LzA3NTIzNy9ub3J0aC1ncmVlbmxhbmQtaWNlLXNoZWx2ZXMtaGF2ZS1sb3N0LTM1LW9mLXRoZWlyLXZvbHVtZS1pbi1sYXN0LWhhbGYtY2VudHVyeS1zdHVkeS1maW5kc9IBAA?hl=en-IN&gl=IN&ceid=IN%3Aen,2023-11-08
22,"AI must be harnessed for public good, says former Australian PM Julia Gillard",Yahoo News UK,news.google.com/articles/CBMiRmh0dHBzOi8vdWsubmV3cy55YWhvby5jb20vYWktbXVzdC1oYXJuZXNzZWQtcHVibGljLWdvb2QtMjAyMTAxMDQ1Lmh0bWzSAU5odHRwczovL3VrLm5ld3MueWFob28uY29tL2FtcGh0bWwvYWktbXVzdC1oYXJuZXNzZWQtcHVibGljLWdvb2QtMjAyMTAxMDQ1Lmh0bWw?hl=en-IN&gl=IN&ceid=IN%3Aen,2023-11-08
11,FOI documents reveal RSV Nuyina's $875k fuel cost blowout after Antarctic icebreaker banned from transiting Tasman Bridge,ABC News,news.google.com/articles/CBMibWh0dHBzOi8vd3d3LmFiYy5uZXQuYXUvbmV3cy8yMDIzLTExLTA4L2FhZC1mb2ktcmV2ZWFscy1jb3N0LWJsb3dvdXQtdGFzbWFuLWJyaWRnZS1udXlpbmEtc2FmZXR5LWJhbi8xMDMwNzM2NjLSAShodHRwczovL2FtcC5hYmMubmV0LmF1L2FydGljbGUvMTAzMDczNjYy?hl=en-IN&gl=IN&ceid=IN%3Aen,2023-11-07
19,Indo-Asian News Service-HOLLAND AMERICA LINE'S BLACK ...,IANS India Pvt Ltd,news.google.com/articles/CBMikgFodHRwczovL2lhbnMuaW4vcHItd2lyZS1kZXRhaWwvaG9sbGFuZC1hbWVyaWNhLWxpbmVzLWJsYWNrLWZyaWRheS1zYWxlLWZlYXR1cmVzLXByZXBhaWQtY3Jldy1hcHByZWNpYXRpb24tYW5kLXVwLXRvLTMwLW9mZi1jcnVpc2UtZmFyZXMtMDctMTEtMjAyM9IBAA?hl=en-IN&gl=IN&ceid=IN%3Aen,2023-11-07
18,Man accused of physically assaulting woman at Antarctica's McMurdo Station was sent to remote icefield where h,Daily Mail,news.google.com/articles/CBMi4wFodHRwczovL3d3dy5kYWlseW1haWwuY28udWsvbmV3cy9hcnRpY2xlLTEyNzE2Mjc3L01hbi1hY2N1c2VkLXBoeXNpY2FsbHktYXNzYXVsdGluZy13b21hbi1BbnRhcmN0aWNhcy1NY011cmRvLVN0YXRpb24tc2VudC1yZW1vdGUtaWNlZmllbGQtdGFza2VkLXByb3RlY3RpbmctcHJvZmVzc29yLXRocmVlLXlvdW5nLXN0dWRlbnRzLXN0YXlpbmctd2Vlay13YXJyYW50LWFycmVzdC1pc3N1ZWQuaHRtbNIB5wFodHRwczovL3d3dy5kYWlseW1haWwuY28udWsvbmV3cy9hcnRpY2xlLTEyNzE2Mjc3L2FtcC9NYW4tYWNjdXNlZC1waHlzaWNhbGx5LWFzc2F1bHRpbmctd29tYW4tQW50YXJjdGljYXMtTWNNdXJkby1TdGF0aW9uLXNlbnQtcmVtb3RlLWljZWZpZWxkLXRhc2tlZC1wcm90ZWN0aW5nLXByb2Zlc3Nvci10aHJlZS15b3VuZy1zdHVkZW50cy1zdGF5aW5nLXdlZWstd2FycmFudC1hcnJlc3QtaXNzdWVkLmh0bWw?hl=en-IN&gl=IN&ceid=IN%3Aen,2023-11-06
7,New study sheds light on Adélie penguins' reliance on declining sea ...,EurekAlert,news.google.com/articles/CBMiMGh0dHBzOi8vd3d3LmV1cmVrYWxlcnQub3JnL25ld3MtcmVsZWFzZXMvMTAwNjgyMtIBAA?hl=en-IN&gl=IN&ceid=IN%3Aen,2023-11-06
20,High sensitivity of summer temperatures to stratospheric sulfur ...,pnas.org,news.google.com/articles/CBMiMGh0dHBzOi8vd3d3LnBuYXMub3JnL2RvaS8xMC4xMDczL3BuYXMuMjIyMTgxMDEyMNIBAA?hl=en-IN&gl=IN&ceid=IN%3Aen,2023-11-06
6,Italian ultra-endurance cyclist returns to Antarctica crossing where isolation is the enemy,The Guardian,news.google.com/articles/CBMie2h0dHBzOi8vd3d3LnRoZWd1YXJkaWFuLmNvbS93b3JsZC8yMDIzL25vdi8wNS9vbWFyLWRpLWZlbGljZS1jeWNsZS1hY3Jvc3MtYW50YXJjdGljYS1zZWNvbmQtYXR0ZW1wdC1pbnRlcnZpZXctZmFtaWx5LWhlYWx0aNIBe2h0dHBzOi8vYW1wLnRoZWd1YXJkaWFuLmNvbS93b3JsZC8yMDIzL25vdi8wNS9vbWFyLWRpLWZlbGljZS1jeWNsZS1hY3Jvc3MtYW50YXJjdGljYS1zZWNvbmQtYXR0ZW1wdC1pbnRlcnZpZXctZmFtaWx5LWhlYWx0aA?hl=en-IN&gl=IN&ceid=IN%3Aen,2023-11-04
