,title,source,link,date
29,Microbial growth in actual martian regolith in the form of Mars ...,Nature.com,news.google.com/articles/CBMiMmh0dHBzOi8vd3d3Lm5hdHVyZS5jb20vYXJ0aWNsZXMvczQzMjQ3LTAyMy0wMTA0Mi030gEA?hl=en-IN&gl=IN&ceid=IN%3Aen,2023-10-17
22,How Are Unsuitable Planes Converted For Use On Aircraft Carriers?,Simple Flying,news.google.com/articles/CBMiTWh0dHBzOi8vc2ltcGxlZmx5aW5nLmNvbS91bnN1aXRhYmxlLXBsYW5lcy1haXJjcmFmdC1jYXJyaWVyLWNvbnZlcnNpb24tZ3VpZGUv0gEA?hl=en-IN&gl=IN&ceid=IN%3Aen,2023-10-17
4,Rare Antarctic Books Top Nobu Shirase Expedition Auction,Fine Books & Collections Magazine,news.google.com/articles/CBMiamh0dHBzOi8vd3d3LmZpbmVib29rc21hZ2F6aW5lLmNvbS9maW5lLWJvb2tzLW5ld3MvcmFyZS1hbnRhcmN0aWMtYm9va3MtdG9wLW5vYnUtc2hpcmFzZS1leHBlZGl0aW9uLWF1Y3Rpb27SAQA?hl=en-IN&gl=IN&ceid=IN%3Aen,2023-10-17
25,Aurora Expeditions appoints a Southeast US sales director in Florida,Seatrade Cruise News,news.google.com/articles/CBMib2h0dHBzOi8vd3d3LnNlYXRyYWRlLWNydWlzZS5jb20vcGVvcGxlLW9waW5pb25zL2F1cm9yYS1leHBlZGl0aW9ucy1hcHBvaW50cy1zb3V0aGVhc3QtdXMtc2FsZXMtZGlyZWN0b3ItZmxvcmlkYdIBAA?hl=en-IN&gl=IN&ceid=IN%3Aen,2023-10-17
24,Daily Press Briefing by the Office of the Spokesperson for the ...,United Nations,news.google.com/articles/CBMiLWh0dHBzOi8vcHJlc3MudW4ub3JnL2VuLzIwMjMvZGIyMzEwMTcuZG9jLmh0bdIBAA?hl=en-IN&gl=IN&ceid=IN%3Aen,2023-10-17
13,A road trip to the edge of the Earth,BBC.com,news.google.com/articles/CBMiUGh0dHBzOi8vd3d3LmJiYy5jb20vdHJhdmVsL2FydGljbGUvMjAyMzEwMTYtYS1yb2FkLXRyaXAtdG8tdGhlLWVkZ2Utb2YtdGhlLWVhcnRo0gEA?hl=en-IN&gl=IN&ceid=IN%3Aen,2023-10-16
14,I live at the South Pole: Here's my daily routine in -122F weather,Newsweek,news.google.com/articles/CBMiPWh0dHBzOi8vd3d3Lm5ld3N3ZWVrLmNvbS93b21hbi1zaGFyZXMtbGlmZS1zb3V0aC1wb2xlLTE4MzQ4NDnSAQA?hl=en-IN&gl=IN&ceid=IN%3Aen,2023-10-16
20,Analysis: Nuclear energy would be a clean win for remote and ...,Brighter World,news.google.com/articles/CBMifGh0dHBzOi8vYnJpZ2h0ZXJ3b3JsZC5tY21hc3Rlci5jYS9hcnRpY2xlcy9hbmFseXNpcy1udWNsZWFyLWVuZXJneS13b3VsZC1iZS1hLWNsZWFuLXdpbi1mb3ItcmVtb3RlLWFuZC1ub3J0aGVybi1jb21tdW5pdGllcy_SAQA?hl=en-IN&gl=IN&ceid=IN%3Aen,2023-10-16
21,Ice station rebuild: the Scot on a mission to repair an Antarctic ...,HeraldScotland,news.google.com/articles/CBMiWmh0dHBzOi8vd3d3LmhlcmFsZHNjb3RsYW5kLmNvbS9uZXdzLzIzODUyNDYzLnNjb3QtYW50YXJjdGljLW1pc3Npb24tZml4LWhpc3RvcmljLXd3Mi1iYXNlL9IBAA?hl=en-IN&gl=IN&ceid=IN%3Aen,2023-10-15
5,Study Finds Over 40% of Antarctica's Ice Shelves Have Shrunk ...,OPP.Today,news.google.com/articles/CBMiZ2h0dHBzOi8vd3d3Lm9wcC50b2RheS9oZWFsdGgvYW50YXJjdGljYS1oYXMtbG9zdC03LTV0bi10b25uZXMtb2YtaWNlLXNpbmNlLTE5OTctc2NpZW50aXN0cy1maW5kLzEzMzkwMi_SAQA?hl=en-IN&gl=IN&ceid=IN%3Aen,2023-10-13
