,title,source,link,date
1,"Bedbugs, ticks, and worms: A traveler's guide to pests",National Geographic,news.google.com/articles/CBMiW2h0dHBzOi8vd3d3Lm5hdGlvbmFsZ2VvZ3JhcGhpYy5jb20vdHJhdmVsL2FydGljbGUvYmVkYnVncy10cmF2ZWwtbWFsYXJpYS1seW1lLWRpc2Vhc2UtYXZvaWTSAQA?hl=en-IN&gl=IN&ceid=IN%3Aen,2023-10-19
21,Common loss of far-red light photoacclimation in cyanobacteria from ...,Nature.com,news.google.com/articles/CBMiMmh0dHBzOi8vd3d3Lm5hdHVyZS5jb20vYXJ0aWNsZXMvczQzNzA1LTAyMy0wMDMxOS000gEA?hl=en-IN&gl=IN&ceid=IN%3Aen,2023-10-19
22,Midday Nowcast: Some Clouds and Light Rain,alabamawx.com,news.google.com/articles/CBMiI2h0dHBzOi8vd3d3LmFsYWJhbWF3eC5jb20vP3A9MjYwMzEx0gEA?hl=en-IN&gl=IN&ceid=IN%3Aen,2023-10-19
70,American Employees Reinvent the Sick Day,Slashdot,news.google.com/articles/CBMiWWh0dHBzOi8vbmV3cy5zbGFzaGRvdC5vcmcvc3RvcnkvMjMvMTAvMTgvMTgxMDIyOC9hbWVyaWNhbi1lbXBsb3llZXMtcmVpbnZlbnQtdGhlLXNpY2stZGF50gEA?hl=en-IN&gl=IN&ceid=IN%3Aen,2023-10-18
3,Ice in a greenhouse world: What deep-time geology tells us about ...,New Scientist,news.google.com/articles/CBMiVGh0dHBzOi8vd3d3Lm5ld3NjaWVudGlzdC5jb20vc2NpZW5jZS1ldmVudHMvaWNlLWdyZWVuaG91c2Utd29ybGQtZ2VvbG9neS1hbnRhcmN0aWNhL9IBAA?hl=en-IN&gl=IN&ceid=IN%3Aen,2023-10-18
24,How Are Unsuitable Planes Converted For Use On Aircraft Carriers?,Simple Flying,news.google.com/articles/CBMiTWh0dHBzOi8vc2ltcGxlZmx5aW5nLmNvbS91bnN1aXRhYmxlLXBsYW5lcy1haXJjcmFmdC1jYXJyaWVyLWNvbnZlcnNpb24tZ3VpZGUv0gEA?hl=en-IN&gl=IN&ceid=IN%3Aen,2023-10-17
32,Microbial growth in actual martian regolith in the form of Mars ...,Nature.com,news.google.com/articles/CBMiMmh0dHBzOi8vd3d3Lm5hdHVyZS5jb20vYXJ0aWNsZXMvczQzMjQ3LTAyMy0wMTA0Mi030gEA?hl=en-IN&gl=IN&ceid=IN%3Aen,2023-10-17
9,Rare Antarctic Books Top Nobu Shirase Expedition Auction,Fine Books & Collections Magazine,news.google.com/articles/CBMiamh0dHBzOi8vd3d3LmZpbmVib29rc21hZ2F6aW5lLmNvbS9maW5lLWJvb2tzLW5ld3MvcmFyZS1hbnRhcmN0aWMtYm9va3MtdG9wLW5vYnUtc2hpcmFzZS1leHBlZGl0aW9uLWF1Y3Rpb27SAQA?hl=en-IN&gl=IN&ceid=IN%3Aen,2023-10-17
27,Aurora Expeditions appoints a Southeast US sales director in Florida,Seatrade Cruise News,news.google.com/articles/CBMib2h0dHBzOi8vd3d3LnNlYXRyYWRlLWNydWlzZS5jb20vcGVvcGxlLW9waW5pb25zL2F1cm9yYS1leHBlZGl0aW9ucy1hcHBvaW50cy1zb3V0aGVhc3QtdXMtc2FsZXMtZGlyZWN0b3ItZmxvcmlkYdIBAA?hl=en-IN&gl=IN&ceid=IN%3Aen,2023-10-17
19,A road trip to the edge of the Earth,BBC.com,news.google.com/articles/CBMiUGh0dHBzOi8vd3d3LmJiYy5jb20vdHJhdmVsL2FydGljbGUvMjAyMzEwMTYtYS1yb2FkLXRyaXAtdG8tdGhlLWVkZ2Utb2YtdGhlLWVhcnRo0gEA?hl=en-IN&gl=IN&ceid=IN%3Aen,2023-10-16
