,title,source,link,date
4,Diet-derived male sex pheromone compounds affect female choice ...,Nature.com,news.google.com/articles/CBMiMmh0dHBzOi8vd3d3Lm5hdHVyZS5jb20vYXJ0aWNsZXMvczQxNTk4LTAyMy00NzA0MS040gEA?hl=en-IN&gl=IN&ceid=IN%3Aen,2023-11-13
29,North America Cosmetic Chemicals Market Upcoming Ascent The ...,Taiwan News,news.google.com/articles/CBMiLWh0dHBzOi8vd3d3LnRhaXdhbm5ld3MuY29tLnR3L2VuL25ld3MvNTAzOTMxOdIBAA?hl=en-IN&gl=IN&ceid=IN%3Aen,2023-11-13
12,Shenshuaifu granule attenuates acute kidney injury | DDDT,Dove Medical Press,news.google.com/articles/CBMihAFodHRwczovL3d3dy5kb3ZlcHJlc3MuY29tL3NoZW5zaHVhaWZ1LWdyYW51bGUtYXR0ZW51YXRlcy1hY3V0ZS1raWRuZXktaW5qdXJ5LWJ5LWluaGliaXRpbmctZmVycm8tcGVlci1yZXZpZXdlZC1mdWxsdGV4dC1hcnRpY2xlLURERFTSAQA?hl=en-IN&gl=IN&ceid=IN%3Aen,2023-11-13
13,Is erythritol safe? What experts say about the artificial sweetener,USA TODAY,news.google.com/articles/CBMiXmh0dHBzOi8vd3d3LnVzYXRvZGF5LmNvbS9zdG9yeS9saWZlL2hlYWx0aC13ZWxsbmVzcy8yMDIzLzExLzEzL2lzLWVyeXRocml0b2wtc2FmZS83MTQ4NTQ0MDAwNy_SAQA?hl=en-IN&gl=IN&ceid=IN%3Aen,2023-11-13
26,Asia Pacific Cosmetic Chemicals Market Future’s Flight The ...,Taiwan News,news.google.com/articles/CBMiLWh0dHBzOi8vd3d3LnRhaXdhbm5ld3MuY29tLnR3L2VuL25ld3MvNTAzOTMxN9IBAA?hl=en-IN&gl=IN&ceid=IN%3Aen,2023-11-13
25,"7 'Healthy' Foods to Skip, According to Dietitian",Healthnews.com,news.google.com/articles/CBMiXWh0dHBzOi8vaGVhbHRobmV3cy5jb20vbnV0cml0aW9uL2hlYWx0aHktZWF0aW5nL2hlYWx0aHktZm9vZHMtdG8tc2tpcC1hY2NvcmRpbmctdG8tZGlldGl0aWFuL9IBAA?hl=en-IN&gl=IN&ceid=IN%3Aen,2023-11-12
2,"The Healthiest Alcoholic Drink, From A Registered Dietitian",Forbes,news.google.com/articles/CBMibWh0dHBzOi8vd3d3LmZvcmJlcy5jb20vc2l0ZXMvdGFueWFha2ltLzIwMjMvMTEvMTIvdGhlLWhlYWx0aGllc3QtYWxjb2hvbGljLWRyaW5rLWZyb20tYS1yZWdpc3RlcmVkLWRpZXRpdGlhbi_SAXFodHRwczovL3d3dy5mb3JiZXMuY29tL3NpdGVzL3RhbnlhYWtpbS8yMDIzLzExLzEyL3RoZS1oZWFsdGhpZXN0LWFsY29ob2xpYy1kcmluay1mcm9tLWEtcmVnaXN0ZXJlZC1kaWV0aXRpYW4vYW1wLw?hl=en-IN&gl=IN&ceid=IN%3Aen,2023-11-12
15,"Artificial Sweeteners Guide: Nutrition, Benefits, Side Effects, and More",Everyday Health,news.google.com/articles/CBMiSmh0dHBzOi8vd3d3LmV2ZXJ5ZGF5aGVhbHRoLmNvbS9kaWV0LW51dHJpdGlvbi9hcnRpZmljaWFsLXN3ZWV0ZW5lcnMvZ3VpZGUv0gEA?hl=en-IN&gl=IN&ceid=IN%3Aen,2023-11-11
20,Genomics of soil depth niche partitioning in the Thaumarchaeota ...,Nature.com,news.google.com/articles/CBMiMmh0dHBzOi8vd3d3Lm5hdHVyZS5jb20vYXJ0aWNsZXMvczQxNDY3LTAyMy00MzE5Ni0w0gEA?hl=en-IN&gl=IN&ceid=IN%3Aen,2023-11-11
64,"Electronic Data Interchange in Banking Market: Global Opportunity Analysis and Industry Forecast, 2023-2032",openPR,news.google.com/articles/CBMiWGh0dHBzOi8vd3d3Lm9wZW5wci5jb20vbmV3cy8zMjgxNTU5L2VsZWN0cm9uaWMtZGF0YS1pbnRlcmNoYW5nZS1pbi1iYW5raW5nLW1hcmtldC1nbG9iYWzSAVdodHRwczovL3d3dy5vcGVucHIuY29tL2FtcC8zMjgxNTU5L2VsZWN0cm9uaWMtZGF0YS1pbnRlcmNoYW5nZS1pbi1iYW5raW5nLW1hcmtldC1nbG9iYWw?hl=en-IN&gl=IN&ceid=IN%3Aen,2023-11-09
