,title,source,link,date
0,Best Microcap Stocks Under Rs 500 To Add To Your Watchlist,Trade Brains,news.google.com/articles/CBMiOWh0dHBzOi8vdHJhZGVicmFpbnMuaW4vYmVzdC1taWNyb2NhcC1zdG9ja3MtdW5kZXItcnMtNTAwL9IBAA?hl=en-IN&gl=IN&ceid=IN%3Aen,2023-11-17
29,"Pharmaceutical Excipients Market Business Outlook, Revenue Forecast and Growth Prospective",openPR,news.google.com/articles/CBMiXWh0dHBzOi8vd3d3Lm9wZW5wci5jb20vbmV3cy8zMjkwOTUxL3BoYXJtYWNldXRpY2FsLWV4Y2lwaWVudHMtbWFya2V0LWJ1c2luZXNzLW91dGxvb2stcmV2ZW51ZdIBXGh0dHBzOi8vd3d3Lm9wZW5wci5jb20vYW1wLzMyOTA5NTEvcGhhcm1hY2V1dGljYWwtZXhjaXBpZW50cy1tYXJrZXQtYnVzaW5lc3Mtb3V0bG9vay1yZXZlbnVl?hl=en-IN&gl=IN&ceid=IN%3Aen,2023-11-17
28,"Erythritol Beverage Market Is Thriving Worldwide with Mitsubishi Shoji Foodtech, ADM, Cargill",openPR,news.google.com/articles/CBMiWWh0dHBzOi8vd3d3Lm9wZW5wci5jb20vbmV3cy8zMjg5NTUyL2VyeXRocml0b2wtYmV2ZXJhZ2UtbWFya2V0LWlzLXRocml2aW5nLXdvcmxkd2lkZS13aXRo0gFYaHR0cHM6Ly93d3cub3BlbnByLmNvbS9hbXAvMzI4OTU1Mi9lcnl0aHJpdG9sLWJldmVyYWdlLW1hcmtldC1pcy10aHJpdmluZy13b3JsZHdpZGUtd2l0aA?hl=en-IN&gl=IN&ceid=IN%3Aen,2023-11-16
41,"Adriano Ramos Pinto, Calabria Family Wines, Davy & Co Limited, GrupoSogevinus Fine Wines, Precept Wine, Queved",openPR,news.google.com/articles/CBMiXWh0dHBzOi8vd3d3Lm9wZW5wci5jb20vbmV3cy8zMjg5OTIwL2Fkcmlhbm8tcmFtb3MtcGludG8tY2FsYWJyaWEtZmFtaWx5LXdpbmVzLWRhdnktY28tbGltaXRlZNIBXGh0dHBzOi8vd3d3Lm9wZW5wci5jb20vYW1wLzMyODk5MjAvYWRyaWFuby1yYW1vcy1waW50by1jYWxhYnJpYS1mYW1pbHktd2luZXMtZGF2eS1jby1saW1pdGVk?hl=en-IN&gl=IN&ceid=IN%3Aen,2023-11-16
35,"Metal Biocides Market size to cross $5.87 billion by 2031, driven by rising investments in building infrastruc",openPR,news.google.com/articles/CBMiY2h0dHBzOi8vd3d3Lm9wZW5wci5jb20vbmV3cy8zMjkwMTcyL21ldGFsLWJpb2NpZGVzLW1hcmtldC1zaXplLXRvLWNyb3NzLTUtODctYmlsbGlvbi1ieS0yMDMxLWRyaXZlbtIBYmh0dHBzOi8vd3d3Lm9wZW5wci5jb20vYW1wLzMyOTAxNzIvbWV0YWwtYmlvY2lkZXMtbWFya2V0LXNpemUtdG8tY3Jvc3MtNS04Ny1iaWxsaW9uLWJ5LTIwMzEtZHJpdmVu?hl=en-IN&gl=IN&ceid=IN%3Aen,2023-11-16
12,More than meows: How bacteria help cats communicate,Science Daily,news.google.com/articles/CBMiPmh0dHBzOi8vd3d3LnNjaWVuY2VkYWlseS5jb20vcmVsZWFzZXMvMjAyMy8xMS8yMzExMTYxNDA4NDIuaHRt0gEA?hl=en-IN&gl=IN&ceid=IN%3Aen,2023-11-16
14,New study shows forever chemicals found in indoor air and in clothes,UNC Gillings School of Global Public Health,news.google.com/articles/CBMiYmh0dHBzOi8vc3BoLnVuYy5lZHUvc3BoLW5ld3MvbmV3LXN0dWR5LXNob3dzLWZvcmV2ZXItY2hlbWljYWxzLWZvdW5kLWluLWluZG9vci1haXItYW5kLWluLWNsb3RoZXMv0gEA?hl=en-IN&gl=IN&ceid=IN%3Aen,2023-11-16
15,Nickel-catalyzed ester carbonylation promoted by imidazole-derived ...,Science,news.google.com/articles/CBMiM2h0dHBzOi8vd3d3LnNjaWVuY2Uub3JnL2RvaS8xMC4xMTI2L3NjaWVuY2UuYWRlMzE3OdIBAA?hl=en-IN&gl=IN&ceid=IN%3Aen,2023-11-16
22,Greenway Technologies : Non-Reliance on Previously Issued ...,Marketscreener.com,news.google.com/articles/CBMirwFodHRwczovL3d3dy5tYXJrZXRzY3JlZW5lci5jb20vcXVvdGUvc3RvY2svR1JFRU5XQVktVEVDSE5PTE9HSUVTLUlOQy0xMjA3OTE4NjkvbmV3cy9HcmVlbndheS1UZWNobm9sb2dpZXMtTm9uLVJlbGlhbmNlLW9uLVByZXZpb3VzbHktSXNzdWVkLUZpbmFuY2lhbC1SZXBvcnQtRm9ybS04LUstNDUzNzY2OTAv0gEA?hl=en-IN&gl=IN&ceid=IN%3Aen,2023-11-16
5,Service-XYLITOL'S RISE IN GLOBAL DEMAND: AN ANALYTICAL ...,IANS India Pvt Ltd,news.google.com/articles/CBMiqwFodHRwczovL2lhbnMuaW4vcHItd2lyZS1kZXRhaWwveHlsaXRvbHMtcmlzZS1pbi1nbG9iYWwtZGVtYW5kLWFuLWFuYWx5dGljYWwtbWFya2V0LXJlcG9ydC1mZWF0dXJpbmctcHJvZmlsZXMtb2YtYXJjaXRla2Jpby1jYXJnaWxsLWRmaS1pbmdyZWRpb24tenVjaGVtLWFuZC1tb3JlLTE2LTExLTIwMjPSAQA?hl=en-IN&gl=IN&ceid=IN%3Aen,2023-11-15
