,title,source,link,date
10,"NASA Spaceline Current Awareness List #1,073 – 3 November ...",Astrobiology News,news.google.com/articles/CBMihAFodHRwczovL2FzdHJvYmlvbG9neS5jb20vMjAyMy8xMS9uYXNhLXNwYWNlbGluZS1jdXJyZW50LWF3YXJlbmVzcy1saXN0LTEwNzMtMy1ub3ZlbWJlci0yMDIzLXNwYWNlLWxpZmUtc2NpZW5jZS1yZXNlYXJjaC1yZXN1bHRzLmh0bWzSAQA?hl=en-IN&gl=IN&ceid=IN%3Aen,2023-11-03
15,SETI Works Best When Telescopes Double-Check Each Other,Universe Today,news.google.com/articles/CBMiXWh0dHBzOi8vd3d3LnVuaXZlcnNldG9kYXkuY29tLzE2Mzg4OS9zZXRpLXdvcmtzLWJlc3Qtd2hlbi10ZWxlc2NvcGVzLWRvdWJsZS1jaGVjay1lYWNoLW90aGVyL9IBAA?hl=en-IN&gl=IN&ceid=IN%3Aen,2023-11-03
11,Thermal decomposition as the activity driver of near-Earth asteroid ...,Nature.com,news.google.com/articles/CBMiMmh0dHBzOi8vd3d3Lm5hdHVyZS5jb20vYXJ0aWNsZXMvczQxNTUwLTAyMy0wMjA5MS130gEA?hl=en-IN&gl=IN&ceid=IN%3Aen,2023-11-02
25,Large regional variability in geomagnetic storm effects in the auroral ...,Nature.com,news.google.com/articles/CBMiMmh0dHBzOi8vd3d3Lm5hdHVyZS5jb20vYXJ0aWNsZXMvczQxNTk4LTAyMy00NjM1Mi0w0gEA?hl=en-IN&gl=IN&ceid=IN%3Aen,2023-11-02
27,"Display Packaging Industry 2030 | Mondi, Smurfit Kappa, Sonoco ...",Argyle Report,news.google.com/articles/CBMifmh0dHBzOi8vd3d3LmFyZ3lsZXJlcG9ydC5jb20vdW5jYXRlZ29yaXNlZC9kaXNwbGF5LXBhY2thZ2luZy1pbmR1c3RyeS0yMDMwLW1vbmRpLXNtdXJmaXQta2FwcGEtc29ub2NvLXByb2R1Y3RzLWNvbXBhbnkvMTIzNDIzL9IBAA?hl=en-IN&gl=IN&ceid=IN%3Aen,2023-11-01
5,Salts and organics on Ganymede’s surface observed by the JIRAM ...,Nature.com,news.google.com/articles/CBMiMmh0dHBzOi8vd3d3Lm5hdHVyZS5jb20vYXJ0aWNsZXMvczQxNTUwLTAyMy0wMjEwNy010gEA?hl=en-IN&gl=IN&ceid=IN%3Aen,2023-10-30
17,Geophysical evidence for an enriched molten silicate layer above ...,Nature.com,news.google.com/articles/CBMiMmh0dHBzOi8vd3d3Lm5hdHVyZS5jb20vYXJ0aWNsZXMvczQxNTg2LTAyMy0wNjYwMS040gEA?hl=en-IN&gl=IN&ceid=IN%3Aen,2023-10-25
18,Detection of the infrared aurora at Uranus with Keck-NIRSPEC,Nature.com,news.google.com/articles/CBMiMmh0dHBzOi8vd3d3Lm5hdHVyZS5jb20vYXJ0aWNsZXMvczQxNTUwLTAyMy0wMjA5Ni010gEA?hl=en-IN&gl=IN&ceid=IN%3Aen,2023-10-23
