,title,source,link,date
0,Minutes-duration optical flares with supernova luminosities,Nature.com,news.google.com/articles/CBMiMmh0dHBzOi8vd3d3Lm5hdHVyZS5jb20vYXJ0aWNsZXMvczQxNTg2LTAyMy0wNjY3My020gEA?hl=en-IN&gl=IN&ceid=IN%3Aen,2023-11-15
4,Aligned grains and scattered light found in gaps of planet-forming disk,Nature.com,news.google.com/articles/CBMiMmh0dHBzOi8vd3d3Lm5hdHVyZS5jb20vYXJ0aWNsZXMvczQxNTg2LTAyMy0wNjY0OC030gEA?hl=en-IN&gl=IN&ceid=IN%3Aen,2023-11-15
7,Io’s polar volcanic thermal emission indicative of magma ocean and ...,Nature.com,news.google.com/articles/CBMiMmh0dHBzOi8vd3d3Lm5hdHVyZS5jb20vYXJ0aWNsZXMvczQxNTUwLTAyMy0wMjEyMy010gEA?hl=en-IN&gl=IN&ceid=IN%3Aen,2023-11-13
3,A Milky Way-like barred spiral galaxy at a redshift of 3,Nature.com,news.google.com/articles/CBMiMmh0dHBzOi8vd3d3Lm5hdHVyZS5jb20vYXJ0aWNsZXMvczQxNTg2LTAyMy0wNjYzNi140gEA?hl=en-IN&gl=IN&ceid=IN%3Aen,2023-11-08
9,Phosphorus-bearing molecules PO and PN at the edge of the Galaxy,Nature.com,news.google.com/articles/CBMiMmh0dHBzOi8vd3d3Lm5hdHVyZS5jb20vYXJ0aWNsZXMvczQxNTg2LTAyMy0wNjYxNi0x0gEA?hl=en-IN&gl=IN&ceid=IN%3Aen,2023-11-08
