,title,source,link,date
1,The achievement of gender parity in a large astrophysics research ...,Nature.com,news.google.com/articles/CBMiMmh0dHBzOi8vd3d3Lm5hdHVyZS5jb20vYXJ0aWNsZXMvczQxNTUwLTAyMy0wMjA3OS020gEA?hl=en-IN&gl=IN&ceid=IN%3Aen,2023-11-16
29,GTA Online Weekly Update 16th November: All You Need to Know,AFK Gaming,news.google.com/articles/CBMiYGh0dHBzOi8vYWZrZ2FtaW5nLmNvbS9nYW1pbmcvZ2VuZXJhbC9ndGEtb25saW5lLXdlZWtseS11cGRhdGUtMTZ0aC1ub3ZlbWJlci1hbGwteW91LW5lZWQtdG8ta25vd9IBamh0dHBzOi8vYWZrZ2FtaW5nLmNvbS9hbXAvc3RvcnkvZ2FtaW5nL2dlbmVyYWwvZ3RhLW9ubGluZS13ZWVrbHktdXBkYXRlLTE2dGgtbm92ZW1iZXItYWxsLXlvdS1uZWVkLXRvLWtub3c?hl=en-IN&gl=IN&ceid=IN%3Aen,2023-11-16
7,Io’s polar volcanic thermal emission indicative of magma ocean and ...,Nature.com,news.google.com/articles/CBMiMmh0dHBzOi8vd3d3Lm5hdHVyZS5jb20vYXJ0aWNsZXMvczQxNTUwLTAyMy0wMjEyMy010gEA?hl=en-IN&gl=IN&ceid=IN%3Aen,2023-11-13
2,A Milky Way-like barred spiral galaxy at a redshift of 3,Nature.com,news.google.com/articles/CBMiMmh0dHBzOi8vd3d3Lm5hdHVyZS5jb20vYXJ0aWNsZXMvczQxNTg2LTAyMy0wNjYzNi140gEA?hl=en-IN&gl=IN&ceid=IN%3Aen,2023-11-08
3,Phosphorus-bearing molecules PO and PN at the edge of the Galaxy,Nature.com,news.google.com/articles/CBMiMmh0dHBzOi8vd3d3Lm5hdHVyZS5jb20vYXJ0aWNsZXMvczQxNTg2LTAyMy0wNjYxNi0x0gEA?hl=en-IN&gl=IN&ceid=IN%3Aen,2023-11-08
