,title,source,link,date
13,"Kuantum Papers Ltd Share Price Today, KUANTUM Share Price ...",Business Today,news.google.com/articles/CBMiUWh0dHBzOi8vd3d3LmJ1c2luZXNzdG9kYXkuaW4vc3RvY2tzL2t1YW50dW0tcGFwZXJzLWx0ZC1rdWFudHVtLXNoYXJlLXByaWNlLTM2NDQyNtIBAA?hl=en-IN&gl=IN&ceid=IN%3Aen,2023-10-21
7,"Kay Power & Paper Ltd Share Price Today, Stock Price BSE",Business Today,news.google.com/articles/CBMiSmh0dHBzOi8vd3d3LmJ1c2luZXNzdG9kYXkuaW4vc3RvY2tzL2theS1wb3dlci1wYXBlci1sdGQtc2hhcmUtcHJpY2UtMzYzNTI10gEA?hl=en-IN&gl=IN&ceid=IN%3Aen,2023-10-20
2,An intense narrow equatorial jet in Jupiter’s lower stratosphere ...,Nature.com,news.google.com/articles/CBMiMmh0dHBzOi8vd3d3Lm5hdHVyZS5jb20vYXJ0aWNsZXMvczQxNTUwLTAyMy0wMjA5OS0y0gEA?hl=en-IN&gl=IN&ceid=IN%3Aen,2023-10-19
4,Detection of ultra-fast radio bursts from FRB 20121102A,Nature.com,news.google.com/articles/CBMiMmh0dHBzOi8vd3d3Lm5hdHVyZS5jb20vYXJ0aWNsZXMvczQxNTUwLTAyMy0wMjEwMS140gEA?hl=en-IN&gl=IN&ceid=IN%3Aen,2023-10-19
5,Record-breaking fast radio burst offers path to weigh the Universe,EurekAlert,news.google.com/articles/CBMiMGh0dHBzOi8vd3d3LmV1cmVrYWxlcnQub3JnL25ld3MtcmVsZWFzZXMvMTAwNDY0OdIBAA?hl=en-IN&gl=IN&ceid=IN%3Aen,2023-10-19
28,Observing cosmic-ray extensive air showers with a silicon imaging ...,Nature.com,news.google.com/articles/CBMiMmh0dHBzOi8vd3d3Lm5hdHVyZS5jb20vYXJ0aWNsZXMvczQxNTk4LTAyMy00MjE2NC000gEA?hl=en-IN&gl=IN&ceid=IN%3Aen,2023-10-12
16,The increase in the surface brightness of the night sky and its ...,Nature.com,news.google.com/articles/CBMiMmh0dHBzOi8vd3d3Lm5hdHVyZS5jb20vYXJ0aWNsZXMvczQxNTk4LTAyMy00NDQyMy130gEA?hl=en-IN&gl=IN&ceid=IN%3Aen,2023-10-10
