,title,source,link,date
2,"Michael Harris II has 3 hits, 3 runs, 2 steals vs. Giants",MLB.com,news.google.com/articles/CBMiT2h0dHBzOi8vd3d3Lm1sYi5jb20vbmV3cy9taWNoYWVsLWhhcnJpcy1paS1oYXMtMy1oaXRzLTMtcnVucy0yLXN0ZWFscy12cy1naWFudHPSAQA?hl=en-IN&gl=IN&ceid=IN%3Aen,2023-08-26
1,"Heat Advisory in effect until 8 p.m. Sunday for North Georgia before cooler temps, rain return",FOX 5 Atlanta,news.google.com/articles/CBMifGh0dHBzOi8vd3d3LmZveDVhdGxhbnRhLmNvbS9uZXdzL2hlYXQtYWR2aXNvci1pbi1lZmZlY3QtdW50aWwtOC1wLW0tc3VuZGF5LWZvci1ub3J0aC1nZW9yZ2lhLWJlZm9yZS1jb29sZXItdGVtcHMtcmFpbi1yZXR1cm7SAYABaHR0cHM6Ly93d3cuZm94NWF0bGFudGEuY29tL25ld3MvaGVhdC1hZHZpc29yLWluLWVmZmVjdC11bnRpbC04LXAtbS1zdW5kYXktZm9yLW5vcnRoLWdlb3JnaWEtYmVmb3JlLWNvb2xlci10ZW1wcy1yYWluLXJldHVybi5hbXA?hl=en-IN&gl=IN&ceid=IN%3Aen,2023-08-26
21,US Masters T10 League 2023: Texas Chargers thump Atlanta Riders by 22 runs on important day,CricTracker,news.google.com/articles/CBMijQFodHRwczovL3d3dy5jcmljdHJhY2tlci5jb20vY3JpY2tldC1wcmVzcy1yZWxlYXNlL3VzLW1hc3RlcnMtdDEwLWxlYWd1ZS0yMDIzLXRleGFzLWNoYXJnZXJzLXRodW1wLWF0bGFudGEtcmlkZXJzLWJ5LTIyLXJ1bnMtb24taW1wb3J0YW50LWRheS_SAZMBaHR0cHM6Ly93d3cuY3JpY3RyYWNrZXIuY29tL2NyaWNrZXQtcHJlc3MtcmVsZWFzZS91cy1tYXN0ZXJzLXQxMC1sZWFndWUtMjAyMy10ZXhhcy1jaGFyZ2Vycy10aHVtcC1hdGxhbnRhLXJpZGVycy1ieS0yMi1ydW5zLW9uLWltcG9ydGFudC1kYXkvP2FtcD0x?hl=en-IN&gl=IN&ceid=IN%3Aen,2023-08-26
7,Opinion | Scenes From Waiting for Trump on a Hot Atlanta Afternoon,The New York Times,news.google.com/articles/CBMiTmh0dHBzOi8vd3d3Lm55dGltZXMuY29tLzIwMjMvMDgvMjYvb3Bpbmlvbi9mdWx0b24tY291bnR5LWphaWwtbWVkaWEtdHJ1bXAuaHRtbNIBAA?hl=en-IN&gl=IN&ceid=IN%3Aen,2023-08-26
43,"Harrison Floyd remains in jail, says he can't afford private lawyer",Reuters,news.google.com/articles/CBMiaGh0dHBzOi8vd3d3LnJldXRlcnMuY29tL2xlZ2FsL3RydW1wLWNvLWRlZmVuZGFudC1zbWl0aC1hcHBlYXItYXRsYW50YS1jb3VydC1lbGVjdGlvbi1jaGFyZ2VzLTIwMjMtMDgtMjUv0gEA?hl=en-IN&gl=IN&ceid=IN%3Aen,2023-08-26
78,'We All Look Alike to Them': Former Atlanta Mayor Keisha Lance Bottoms Says She Was Mistaken for Fani Willis By ...,Atlanta Black Star,news.google.com/articles/CBMiswFodHRwczovL2F0bGFudGFibGFja3N0YXIuY29tLzIwMjMvMDgvMjUvZm9ybWVyLWF0bGFudGEtbWF5b3Ita2Vpc2hhLWxhbmNlLWJvdHRvbXMtc2F5cy1zaGUtd2FzLW1pc3Rha2VuLWZvci1mYW5pLXdpbGxpcy1ieS10cnVtcC1zdXBwb3J0ZXJzLXdoby15ZWxsZWQtbG9jay1oZXItdXAtb3V0c2lkZS1vZi1qYWlsL9IBAA?hl=en-IN&gl=IN&ceid=IN%3Aen,2023-08-26
49,Trump’s mug shot made public by Fulton County Jail after arrest,NBC News,news.google.com/articles/CBMib2h0dHBzOi8vd3d3Lm5iY25ld3MuY29tL3BvbGl0aWNzL2RvbmFsZC10cnVtcC9kb25hbGQtdHJ1bXAtbXVnc2hvdC1nZW9yZ2lhLWphaWwtZnVsdG9uLWNvdW50eS1hcnJlc3QtcmNuYTEwMTY2NNIBK2h0dHBzOi8vd3d3Lm5iY25ld3MuY29tL25ld3MvYW1wL3JjbmExMDE2NjQ?hl=en-IN&gl=IN&ceid=IN%3Aen,2023-08-25
64,Trump's jailhouse mug shot makes history after Atlanta surrender,China Daily,news.google.com/articles/CBMiTGh0dHBzOi8vZ2xvYmFsLmNoaW5hZGFpbHkuY29tLmNuL2EvMjAyMzA4LzI2L1dTNjRlOTMxOWZhMzEwMzUyNjBiODFlNTMzLmh0bWzSAQA?hl=en-IN&gl=IN&ceid=IN%3Aen,2023-08-25
55,Former Kanye West publicist Trevian Kutti booked at Fulton Jail, The Atlanta Journal Constitution,news.google.com/articles/CBMidGh0dHBzOi8vd3d3LmFqYy5jb20vbmV3cy9mb3JtZXIta2FueWUtd2VzdC1wdWJsaWNpc3QtdHJldmlhbi1rdXR0aS1ib29rZWQtYXQtZnVsdG9uLWphaWwvMllQRVAzNjRLQkNWREhSS1lTQ05GQlVYREkv0gEA?hl=en-IN&gl=IN&ceid=IN%3Aen,2023-08-25
71,Trump's jailhouse mug shot makes history after Atlanta surrender,China Daily,news.google.com/articles/CBMiSWh0dHBzOi8vd3d3LmNoaW5hZGFpbHkuY29tLmNuL2EvMjAyMzA4LzI2L1dTNjRlOTMxOWZhMzEwMzUyNjBiODFlNTMzLmh0bWzSAQA?hl=en-IN&gl=IN&ceid=IN%3Aen,2023-08-25
