,title,source,link,date
16,Georgia Power seeks more energy generation capacity - The Current,The Current GA,news.google.com/articles/CBMiWGh0dHBzOi8vdGhlY3VycmVudGdhLm9yZy8yMDIzLzExLzA0L2dlb3JnaWEtcG93ZXItc2Vla3MtbW9yZS1lbmVyZ3ktZ2VuZXJhdGlvbi1jYXBhY2l0eS_SAQA?hl=en-IN&gl=IN&ceid=IN%3Aen,2023-11-04
12,Martell Cognac Soars Beyond The Expected At Record-Breaking ...,Bossip,news.google.com/articles/CBMiXGh0dHBzOi8vYm9zc2lwLmNvbS8yNTI5MTg1L21hcnRlbGwtY29nbmFjLXNoaW5lcy1pbW1lcnNpdmUtYWN0aXZhdGlvbi1vbmUtbXVzaWNmZXN0LWF0bGFudGEv0gEA?hl=en-IN&gl=IN&ceid=IN%3Aen,2023-11-04
20,Suspect charged for allegedly driving through nuclear station gate ...,Atlanta News First,news.google.com/articles/CBMieGh0dHBzOi8vd3d3LmF0bGFudGFuZXdzZmlyc3QuY29tLzIwMjMvMTEvMDQvc3VzcGVjdC1jaGFyZ2VkLWFsbGVnZWRseS1kcml2aW5nLXRocm91Z2gtbnVjbGVhci1zdGF0aW9uLWdhdGUtc2hlcmlmZi1zYXlzL9IBAA?hl=en-IN&gl=IN&ceid=IN%3Aen,2023-11-04
19,Stutzmann leads Atlanta Symphony Orchestra and Chorus in works ...,EarRelevant,news.google.com/articles/CBMihQFodHRwczovL3d3dy5lYXJyZWxldmFudC5uZXQvMjAyMy8xMS9zdHV0em1hbm4tbGVhZHMtYXRsYW50YS1zeW1waG9ueS1vcmNoZXN0cmEtYW5kLWNob3J1cy1pbi13b3Jrcy1ieS1icmFobXMtcmFjaG1hbmlub2ZmLWFuZC1kdm9yYWsv0gEA?hl=en-IN&gl=IN&ceid=IN%3Aen,2023-11-04
55,Cincinnati Southern Railway Could Be a Boon for the City—If We ...,Common Dreams,news.google.com/articles/CBMiRWh0dHBzOi8vd3d3LmNvbW1vbmRyZWFtcy5vcmcvb3Bpbmlvbi9jaW5jaW5uYXRpLXNvdXRoZXJuLXJhaWx3YXktc2FsZdIBAA?hl=en-IN&gl=IN&ceid=IN%3Aen,2023-11-04
57,"Minnesota Vikings vs. Atlanta Falcons Prediction, Preview, and ...",Winners and Whiners,news.google.com/articles/CBMiZ2h0dHBzOi8vd2lubmVyc2FuZHdoaW5lcnMuY29tL2dhbWVzL25mbC8xMS01LTIwMjMvbWlubmVzb3RhLXZpa2luZ3MtdnMtYXRsYW50YS1mYWxjb25zLXByZWRpY3Rpb24tODEwNC_SAQA?hl=en-IN&gl=IN&ceid=IN%3Aen,2023-11-04
73,"Commanders WR Curtis Samuel, OL Ricky Stromberg OUT vs. Pats",Sports Illustrated,news.google.com/articles/CBMiigFodHRwczovL3d3dy5zaS5jb20vbmZsL2NvbW1hbmRlcnMvbmV3cy93YXNoaW5ndG9uLWNvbW1hbmRlcnMtd3ItY3VydGlzLXNhbXVlbC1vbC1yaWNreS1zdHJvbWJlcmctb3V0LXZzLW5ldy1lbmdsYW5kLXBhdHJpb3RzLWluanVyeS1yZXBvcnTSAQA?hl=en-IN&gl=IN&ceid=IN%3Aen,2023-11-03
7,AJC hip-hop doc chronicles evolution of Atlanta's cultural dominance, The Atlanta Journal Constitution,news.google.com/articles/CBMikAFodHRwczovL3d3dy5hamMuY29tL2xpZmUvYXJ0cy1jdWx0dXJlL2hpcC1ob3AtNTAvYWpjLWhpcC1ob3AtZG9jLWNocm9uaWNsZXMtZXZvbHV0aW9uLW9mLWF0bGFudGFzLWN1bHR1cmFsLWRvbWluYW5jZS9RUzRSRUZCQjNaSEJERlNYV1lFNVk0TFM2SS_SAQA?hl=en-IN&gl=IN&ceid=IN%3Aen,2023-11-03
69,HOOPS CENTRAL: #11/12 Lady Vols vs. USA Women's National ...,University of Tennessee Athletics,news.google.com/articles/CBMiemh0dHBzOi8vdXRzcG9ydHMuY29tL25ld3MvMjAyMy8xMS8zL3dvbWVucy1iYXNrZXRiYWxsLWhvb3BzLWNlbnRyYWwtMTEtMTItbGFkeS12b2xzLXZzLXVzYS13b21lbnMtbmF0aW9uYWwtdGVhbS1leGhpYml0aW9u0gEA?hl=en-IN&gl=IN&ceid=IN%3Aen,2023-11-03
10,Ping x Hideoki Bespoke debut new limited-edition collection,Golfweek,news.google.com/articles/CBMiX2h0dHBzOi8vZ29sZndlZWsudXNhdG9kYXkuY29tLzIwMjMvMTEvMDMvcGluZy1oaWRlb2tpLWJlc3Bva2UtZGVidXQtbGltaXRlZC1lZGl0aW9uLWNvbGxlY3Rpb24v0gEA?hl=en-IN&gl=IN&ceid=IN%3Aen,2023-11-03
