,title,source,link,date
28,Two Atlanta Braves rightfully named as NL award finalists,House That Hank Built,news.google.com/articles/CBMia2h0dHBzOi8vaG91c2V0aGF0aGFua2J1aWx0LmNvbS9wb3N0cy90d28tYXRsYW50YS1icmF2ZXMtcmlnaHRmdWxseS1uYW1lZC1hcy1ubC1hd2FyZC1maW5hbGlzdHMtMDFoZWtyNDl0N3F20gEA?hl=en-IN&gl=IN&ceid=IN%3Aen,2023-11-07
11,The Tin Lizzy's Team Is Opening an Arcade and Pinball Bar in East ...,Eater Atlanta,news.google.com/articles/CBMib2h0dHBzOi8vYXRsYW50YS5lYXRlci5jb20vMjAyMy8xMS83LzIzOTUwNDA0L3Rpbi1waW4tZ2FtZS1iYXItYXJjYWRlLXBpbmJhbGwtdGFjb3Mtb3BlbmluZy1lYXN0LWNvYmItdGluLWxpenp5c9IBAA?hl=en-IN&gl=IN&ceid=IN%3Aen,2023-11-07
25,"Vikings' Joshua Dobbs had 'dream' game, wowed former QBs",Star Tribune,news.google.com/articles/CBMiamh0dHBzOi8vd3d3LnN0YXJ0cmlidW5lLmNvbS92aWtpbmdzLWpvc2h1YS1kb2Jicy1kZWJ1dC1mcmFuLXRhcmtlbnRvbi1yaWNoLWdhbm5vbi1jaGlwLXNjb2dnaW5zLzYwMDMxNzg5NS_SAQA?hl=en-IN&gl=IN&ceid=IN%3Aen,2023-11-07
31,The Classical Jewels of the Black Mecca — THE BITTER ...,The Bitter Southerner,news.google.com/articles/CBMiUWh0dHBzOi8vYml0dGVyc291dGhlcm5lci5jb20vZmVhdHVyZS8yMDIzL3RoZS1jbGFzc2ljYWwtamV3ZWxzLW9mLXRoZS1ibGFjay1tZWNjYdIBAA?hl=en-IN&gl=IN&ceid=IN%3Aen,2023-11-07
35,Atlanta Braves Holdings Inc Announces Details of Secondary Public ...,Best Stocks,news.google.com/articles/CBMiRWh0dHBzOi8vYmVzdHN0b2Nrcy5jb20vYXRsYW50YS1icmF2ZXMtaG9sZGluZ3MtaW5jLWFubm91bmNlcy1kZXRhaWxzL9IBAA?hl=en-IN&gl=IN&ceid=IN%3Aen,2023-11-07
38,FOCO runs MASSIVE sale on all in-stock Braves bobbleheads,Sports Illustrated,news.google.com/articles/CBMiXGh0dHBzOi8vd3d3LnNpLmNvbS9tbGIvYnJhdmVzL25ld3MvZm9jby1ydW5zLW1hc3NpdmUtc2FsZS1vbi1hbGwtaW4tc3RvY2stYnJhdmVzLWJvYmJsZWhlYWRz0gEA?hl=en-IN&gl=IN&ceid=IN%3Aen,2023-11-07
41,Drugs aren’t required to be tested in people who are obese. Here’s why that’s a problem,Atlanta News First,news.google.com/articles/CBMieGh0dHBzOi8vd3d3LmF0bGFudGFuZXdzZmlyc3QuY29tLzIwMjMvMTEvMDcvZHJ1Z3MtYXJlbnQtcmVxdWlyZWQtYmUtdGVzdGVkLXBlb3BsZS13aG8tYXJlLW9iZXNlLWhlcmVzLXdoeS10aGF0cy1wcm9ibGVtL9IBhwFodHRwczovL3d3dy5hdGxhbnRhbmV3c2ZpcnN0LmNvbS8yMDIzLzExLzA3L2RydWdzLWFyZW50LXJlcXVpcmVkLWJlLXRlc3RlZC1wZW9wbGUtd2hvLWFyZS1vYmVzZS1oZXJlcy13aHktdGhhdHMtcHJvYmxlbS8_b3V0cHV0VHlwZT1hbXA?hl=en-IN&gl=IN&ceid=IN%3Aen,2023-11-07
46,Sanofi Issues Update on Shortages of Beyfortus for Respiratory ...,Pharmaceutical Executive,news.google.com/articles/CBMibWh0dHBzOi8vd3d3LnBoYXJtZXhlYy5jb20vdmlldy9zYW5vZmktaXNzdWVzLXVwZGF0ZS1vbi1zaG9ydGFnZXMtb2YtYmV5Zm9ydHVzLWZvci1yZXNwaXJhdG9yeS1zeW5jeXRpYWwtdmlydXPSAQA?hl=en-IN&gl=IN&ceid=IN%3Aen,2023-11-07
50,Ecosystems as Infrastructure: A New Way of Looking at Climate ...,Yale Environment 360,news.google.com/articles/CBMiMmh0dHBzOi8vZTM2MC55YWxlLmVkdS9mZWF0dXJlcy9rYXRlLW9yZmYtaW50ZXJ2aWV30gEA?hl=en-IN&gl=IN&ceid=IN%3Aen,2023-11-07
14,Atlanta Braves unsurprisingly decline option of lefty reliever Brad Hand,House That Hank Built,news.google.com/articles/CBMie2h0dHBzOi8vaG91c2V0aGF0aGFua2J1aWx0LmNvbS9wb3N0cy9hdGxhbnRhLWJyYXZlcy11bnN1cnByaXNpbmdseS1kZWNsaW5lLW9wdGlvbi1mb3ItbGVmdHktcmVsaWV2ZXItYnJhZC1oYW5kLTAxaGVnam10cHdwNtIBAA?hl=en-IN&gl=IN&ceid=IN%3Aen,2023-11-07
