,title,source,link,date
53,Dozens of Trump supporters cheer him on as former president turns himself in at Georgia jail,The Associated Press,news.google.com/articles/CBMia2h0dHBzOi8vYXBuZXdzLmNvbS9hcnRpY2xlL3RydW1wLW1hZ2EtZmFucy1zdXJyZW5kZXItamFpbC1hdGxhbnRhLWVsZWN0aW9uLWMzMGU0ODM2ZTNkOWYyYzk3NTFjYzM4YTY5NzVjMmJi0gEA?hl=en-IN&gl=IN&ceid=IN%3Aen,2023-08-25
12,"Trump returns to X, formerly Twitter, with mug shot and appeal for donations",Al Arabiya English,news.google.com/articles/CBMia2h0dHBzOi8vZW5nbGlzaC5hbGFyYWJpeWEubmV0L05ld3Mvd29ybGQvMjAyMy8wOC8yNS9UcnVtcC1zLW11Zy1zaG90LXJlbGVhc2VkLWFmdGVyLWJvb2tpbmctYXQtQXRsYW50YS1qYWls0gFvaHR0cHM6Ly9lbmdsaXNoLmFsYXJhYml5YS5uZXQvYW1wL05ld3Mvd29ybGQvMjAyMy8wOC8yNS9UcnVtcC1zLW11Zy1zaG90LXJlbGVhc2VkLWFmdGVyLWJvb2tpbmctYXQtQXRsYW50YS1qYWls?hl=en-IN&gl=IN&ceid=IN%3Aen,2023-08-25
38,Trump mugshot released in Georgia elections case: Live updates,CNBC,news.google.com/articles/CBMiWGh0dHBzOi8vd3d3LmNuYmMuY29tLzIwMjMvMDgvMjQvZG9uYWxkLXRydW1wLXRvLWJlLWFycmVzdGVkLWluLWdlb3JnaWEtbGl2ZS11cGRhdGVzLmh0bWzSAVxodHRwczovL3d3dy5jbmJjLmNvbS9hbXAvMjAyMy8wOC8yNC9kb25hbGQtdHJ1bXAtdG8tYmUtYXJyZXN0ZWQtaW4tZ2VvcmdpYS1saXZlLXVwZGF0ZXMuaHRtbA?hl=en-IN&gl=IN&ceid=IN%3Aen,2023-08-25
39,Trump's mug shot released after booking at Georgia jail on election charges,Reuters,news.google.com/articles/CBMiaWh0dHBzOi8vd3d3LnJldXRlcnMuY29tL2xlZ2FsL3RydW1wLXJlcG9ydC1hdGxhbnRhLWphaWwtZmFjZS1jaGFyZ2VzLWVsZWN0aW9uLXN1YnZlcnNpb24tY2FzZS0yMDIzLTA4LTI0L9IBAA?hl=en-IN&gl=IN&ceid=IN%3Aen,2023-08-25
40,Trump Surrenders at Atlanta Jail in Election Interference Case,The New York Times,news.google.com/articles/CBMiTWh0dHBzOi8vd3d3Lm55dGltZXMuY29tL2xpdmUvMjAyMy8wOC8yNC91cy90cnVtcC1nZW9yZ2lhLXN1cnJlbmRlci1pbmRpY3RtZW500gEA?hl=en-IN&gl=IN&ceid=IN%3Aen,2023-08-25
41,Trump’s mug shot made public by Fulton County Jail after arrest,NBC News,news.google.com/articles/CBMib2h0dHBzOi8vd3d3Lm5iY25ld3MuY29tL3BvbGl0aWNzL2RvbmFsZC10cnVtcC9kb25hbGQtdHJ1bXAtbXVnc2hvdC1nZW9yZ2lhLWphaWwtZnVsdG9uLWNvdW50eS1hcnJlc3QtcmNuYTEwMTY2NNIBK2h0dHBzOi8vd3d3Lm5iY25ld3MuY29tL25ld3MvYW1wL3JjbmExMDE2NjQ?hl=en-IN&gl=IN&ceid=IN%3Aen,2023-08-25
42,House Republicans Begin Investigating Willis as Trump Is Booked,The New York Times,news.google.com/articles/CBMiWWh0dHBzOi8vd3d3Lm55dGltZXMuY29tLzIwMjMvMDgvMjQvdXMvcG9saXRpY3MvZmFuaS13aWxsaXMtcmVwdWJsaWNhbnMtaW52ZXN0aWdhdGlvbi5odG1s0gEA?hl=en-IN&gl=IN&ceid=IN%3Aen,2023-08-25
45,"One image, one face, one American moment: The Donald Trump mug shot",The Associated Press,news.google.com/articles/CBMiXGh0dHBzOi8vYXBuZXdzLmNvbS9hcnRpY2xlL211Zy1zaG90LWRvbmFsZC10cnVtcC1pbmRpY3RtZW50LTgzOTkyMDExNmEyNDRkZjNlNTViZGVkZjMzODIwYTgw0gEA?hl=en-IN&gl=IN&ceid=IN%3Aen,2023-08-25
86,Live updates: Trump surrenders to Fulton County authorities in Georgia 2020 election case,CNN,news.google.com/articles/CBMidWh0dHBzOi8vd3d3LmNubi5jb20vcG9saXRpY3MvbGl2ZS1uZXdzL3RydW1wLWdlb3JnaWEtc3VycmVuZGVyLWluZGljdG1lbnQtMDgtMjQtMjMvaF8zYzdmMGNkMDdiZTMwNjdlMDZlMzRjYTc3ZThiMGRiMdIBYWh0dHBzOi8vYW1wLmNubi5jb20vY25uL3BvbGl0aWNzL2xpdmUtbmV3cy90cnVtcC1nZW9yZ2lhLXN1cnJlbmRlci1pbmRpY3RtZW50LTA4LTI0LTIzL2luZGV4Lmh0bWw?hl=en-IN&gl=IN&ceid=IN%3Aen,2023-08-25
60,Trump supporters crowd around Atlanta jail for president's booking,Axios,news.google.com/articles/CBMiWmh0dHBzOi8vd3d3LmF4aW9zLmNvbS8yMDIzLzA4LzI0L3RydW1wLXN1cHBvcnRlcnMtY3Jvd2QtZnVsdG9uLWNvdW50eS1qYWlsLWF0bGFudGEtZ2VvcmdpYdIBAA?hl=en-IN&gl=IN&ceid=IN%3Aen,2023-08-25
