,title,source,link,date
97,Busking the Stereotypes: The story of Atlanta's street performers ...,WABE 90.1 FM,news.google.com/articles/CBMiVWh0dHBzOi8vd3d3LndhYmUub3JnL2J1c2tpbmctdGhlLXN0ZXJlb3R5cGVzLXRoZS1zdG9yeS1vZi1hdGxhbnRhcy1zdHJlZXQtcGVyZm9ybWVycy_SAQA?hl=en-IN&gl=IN&ceid=IN%3Aen,2023-08-25
44,Donald Trump arrest photo from Fulton County jail marks historic first,USA TODAY,news.google.com/articles/CBMie2h0dHBzOi8vd3d3LnVzYXRvZGF5LmNvbS9zdG9yeS9uZXdzL3BvbGl0aWNzLzIwMjMvMDgvMjQvdHJ1bXAtc3VycmVuZGVyLWFycmVzdGVkLWdlb3JnaWEtZWxlY3Rpb24tbGl2ZS11cGRhdGVzLzcwNjYyMDk4MDA3L9IBAA?hl=en-IN&gl=IN&ceid=IN%3Aen,2023-08-25
63,"Trump wrongfully arrested, protesters claim outside Atlanta jail",The Jerusalem Post,news.google.com/articles/CBMiNmh0dHBzOi8vd3d3Lmpwb3N0LmNvbS9hbWVyaWNhbi1wb2xpdGljcy9hcnRpY2xlLTc1NjE3NtIBAA?hl=en-IN&gl=IN&ceid=IN%3Aen,2023-08-25
79,"Atlanta jail releases Trump's mug shot during speedy booking, shows scowling former president",Republic World,news.google.com/articles/CBMinQFodHRwczovL3d3dy5yZXB1YmxpY3dvcmxkLmNvbS93b3JsZC1uZXdzL3VzLW5ld3MvYXRsYW50YS1qYWlsLXJlbGVhc2VzLXRydW1wcy1tdWctc2hvdC1kdXJpbmctc3BlZWR5LWJvb2tpbmctc2hvd3Mtc2Nvd2xpbmctZm9ybWVyLXByZXNpZGVudC1hcnRpY2xlc2hvdy5odG1s0gGhAWh0dHBzOi8vd3d3LnJlcHVibGljd29ybGQuY29tL2FtcC93b3JsZC1uZXdzL3VzLW5ld3MvYXRsYW50YS1qYWlsLXJlbGVhc2VzLXRydW1wcy1tdWctc2hvdC1kdXJpbmctc3BlZWR5LWJvb2tpbmctc2hvd3Mtc2Nvd2xpbmctZm9ybWVyLXByZXNpZGVudC1hcnRpY2xlc2hvdy5odG1s?hl=en-IN&gl=IN&ceid=IN%3Aen,2023-08-25
35,Trump seeks to make the most of historic Georgia mugshot,BBC,news.google.com/articles/CBMiMWh0dHBzOi8vd3d3LmJiYy5jb20vbmV3cy93b3JsZC11cy1jYW5hZGEtNjY2MTI0MzPSATVodHRwczovL3d3dy5iYmMuY29tL25ld3Mvd29ybGQtdXMtY2FuYWRhLTY2NjEyNDMzLmFtcA?hl=en-IN&gl=IN&ceid=IN%3Aen,2023-08-25
36,"Trump arrest full recap: Mugshot, surrender, what’s next in Georgia election case",CNBC,news.google.com/articles/CBMiWGh0dHBzOi8vd3d3LmNuYmMuY29tLzIwMjMvMDgvMjQvZG9uYWxkLXRydW1wLXRvLWJlLWFycmVzdGVkLWluLWdlb3JnaWEtbGl2ZS11cGRhdGVzLmh0bWzSAVxodHRwczovL3d3dy5jbmJjLmNvbS9hbXAvMjAyMy8wOC8yNC9kb25hbGQtdHJ1bXAtdG8tYmUtYXJyZXN0ZWQtaW4tZ2VvcmdpYS1saXZlLXVwZGF0ZXMuaHRtbA?hl=en-IN&gl=IN&ceid=IN%3Aen,2023-08-25
37,"One image, one face, one American moment: The Donald Trump mug shot",The Associated Press,news.google.com/articles/CBMiXGh0dHBzOi8vYXBuZXdzLmNvbS9hcnRpY2xlL211Zy1zaG90LWRvbmFsZC10cnVtcC1pbmRpY3RtZW50LTgzOTkyMDExNmEyNDRkZjNlNTViZGVkZjMzODIwYTgw0gEA?hl=en-IN&gl=IN&ceid=IN%3Aen,2023-08-25
38,"Donald Trump surrenders in Atlanta, has mug shot taken",CNN,news.google.com/articles/CBMiamh0dHBzOi8vd3d3LmNubi5jb20vMjAyMy8wOC8yNC9wb2xpdGljcy9kb25hbGQtdHJ1bXAtc3VycmVuZGVyLWZ1bHRvbi1jb3VudHktamFpbC1jcmltaW5hbC1jYXNlL2luZGV4Lmh0bWzSAQA?hl=en-IN&gl=IN&ceid=IN%3Aen,2023-08-25
39,"Trump returns to site formerly known as Twitter, posts his mug shot shortly after Georgia surrender",The Associated Press,news.google.com/articles/CBMiV2h0dHBzOi8vYXBuZXdzLmNvbS9hcnRpY2xlL3RydW1wLXR3aXR0ZXItdHdlZXRzLXJldHVybi00OTU5NGI5ZjcyYzY4YTMwOTc1OGUxOWJjOWNkY2UwZtIBAA?hl=en-IN&gl=IN&ceid=IN%3Aen,2023-08-25
40,Trump’s mug shot made public by Fulton County Jail after arrest,NBC News,news.google.com/articles/CBMib2h0dHBzOi8vd3d3Lm5iY25ld3MuY29tL3BvbGl0aWNzL2RvbmFsZC10cnVtcC9kb25hbGQtdHJ1bXAtbXVnc2hvdC1nZW9yZ2lhLWphaWwtZnVsdG9uLWNvdW50eS1hcnJlc3QtcmNuYTEwMTY2NNIBK2h0dHBzOi8vd3d3Lm5iY25ld3MuY29tL25ld3MvYW1wL3JjbmExMDE2NjQ?hl=en-IN&gl=IN&ceid=IN%3Aen,2023-08-25
