,title,source,link,date
29,"On Argentina's Pampas, Farmers Are All In on Libertarian Milei",Bloomberg,news.google.com/articles/CBMicGh0dHBzOi8vd3d3LmJsb29tYmVyZy5jb20vbmV3cy9hcnRpY2xlcy8yMDIzLTExLTEwL29uLWFyZ2VudGluYS1zLXBhbXBhcy1mYXJtZXJzLWFyZS1hbGwtaW4tb24tbGliZXJ0YXJpYW4tbWlsZWnSAQA?hl=en-IN&gl=IN&ceid=IN%3Aen,2023-11-10
80,Bayer cae en ventas por el 'efecto glifosato' y el tipo de cambio,Revista Fruit Today: Noticias sobre sector hortofrutícola,news.google.com/articles/CBMiV2h0dHBzOi8vZnJ1aXR0b2RheS5jb20vYmF5ZXItY2FlLWVuLXZlbnRhcy1wb3ItZWwtZWZlY3RvLWdsaWZvc2F0by15LWVsLXRpcG8tZGUtY2FtYmlvL9IBAA?hl=en-IN&gl=IN&ceid=IN%3Aen,2023-11-10
68,Senior Pressure Safety Engineer,The Chemical Engineer,news.google.com/articles/CBMiTmh0dHBzOi8vam9icy50aGVjaGVtaWNhbGVuZ2luZWVyLmNvbS9qb2IvNzAzMS9zZW5pb3ItcHJlc3N1cmUtc2FmZXR5LWVuZ2luZWVyL9IBAA?hl=en-IN&gl=IN&ceid=IN%3Aen,2023-11-10
49,"United Kingdom Crop Protection Chemicals Market Size, Share, Report, Forecast 2024-2032",openPR,news.google.com/articles/CBMiXmh0dHBzOi8vd3d3Lm9wZW5wci5jb20vbmV3cy8zMjgzOTY1L3VuaXRlZC1raW5nZG9tLWNyb3AtcHJvdGVjdGlvbi1jaGVtaWNhbHMtbWFya2V0LXNpemUtc2hhcmXSAV1odHRwczovL3d3dy5vcGVucHIuY29tL2FtcC8zMjgzOTY1L3VuaXRlZC1raW5nZG9tLWNyb3AtcHJvdGVjdGlvbi1jaGVtaWNhbHMtbWFya2V0LXNpemUtc2hhcmU?hl=en-IN&gl=IN&ceid=IN%3Aen,2023-11-10
42,"Integrated Pest Management (IPM) Market Overview, Share, Trend, Segmentation And Forecast To 2032",openPR,news.google.com/articles/CBMiWGh0dHBzOi8vd3d3Lm9wZW5wci5jb20vbmV3cy8zMjgzNDM3L2ludGVncmF0ZWQtcGVzdC1tYW5hZ2VtZW50LWlwbS1tYXJrZXQtb3ZlcnZpZXctc2hhcmXSAVdodHRwczovL3d3dy5vcGVucHIuY29tL2FtcC8zMjgzNDM3L2ludGVncmF0ZWQtcGVzdC1tYW5hZ2VtZW50LWlwbS1tYXJrZXQtb3ZlcnZpZXctc2hhcmU?hl=en-IN&gl=IN&ceid=IN%3Aen,2023-11-10
26,Senior Plant Engineer,The Chemical Engineer,news.google.com/articles/CBMiRGh0dHBzOi8vam9icy50aGVjaGVtaWNhbGVuZ2luZWVyLmNvbS9qb2IvNzAyOS9zZW5pb3ItcGxhbnQtZW5naW5lZXIv0gEA?hl=en-IN&gl=IN&ceid=IN%3Aen,2023-11-10
24,(CIIE) German companies cast vote of confidence in Chinese market,Xinhua,news.google.com/articles/CBMiSGh0dHBzOi8vZW5nbGlzaC5uZXdzLmNuLzIwMjMxMTEwLzA2NzY2OWE5MzVhMTRlMTlhYTRhYWQzMjQ4OWM5NjAxL2MuaHRtbNIBAA?hl=en-IN&gl=IN&ceid=IN%3Aen,2023-11-10
18,Specialty Pesticides Market Size will Observe Lucrative Surge by the ...,Kalkine Media,news.google.com/articles/CBMikQFodHRwczovL2thbGtpbmVtZWRpYS5jb20vbmV3cy93b3JsZC1uZXdzL3NwZWNpYWx0eS1wZXN0aWNpZGVzLW1hcmtldC1zaXplLXdpbGwtb2JzZXJ2ZS1sdWNyYXRpdmUtc3VyZ2UtYnktdGhlLWVuZC0yMDMwLWJheWVyLWNyb3BzY2llbmNlLWxsYy1iYXNm0gEA?hl=en-IN&gl=IN&ceid=IN%3Aen,2023-11-10
16,Bayer demonstrates digital technologies as a key enabler for ...,Farmers Review Africa,news.google.com/articles/CBMidmh0dHBzOi8vZmFybWVyc3Jldmlld2FmcmljYS5jb20vYmF5ZXItZGVtb25zdHJhdGVzLWRpZ2l0YWwtdGVjaG5vbG9naWVzLWFzLWEta2V5LWVuYWJsZXItZm9yLXJlZ2VuZXJhdGl2ZS1hZ3JpY3VsdHVyZS_SAQA?hl=en-IN&gl=IN&ceid=IN%3Aen,2023-11-09
83,AgriHolland Nieuws: Bayer overweegt afsplitsing van divise Crop ...,AgriHolland,news.google.com/articles/CBMiKWh0dHBzOi8vd3d3LmFncmlob2xsYW5kLm5sL25pZXV3cy8yNTIwMjcv0gEA?hl=en-IN&gl=IN&ceid=IN%3Aen,2023-11-09
