,title,source,link,date
11,"GRSE earns Rs 1,654 crore revenue from operations in 1st half of FY 2023-24",PSU Watch,news.google.com/articles/CBMibGh0dHBzOi8vcHN1d2F0Y2guY29tL2RlZmVuY2V3YXRjaC9ncnNlLWVhcm5zLXJzLTE2NTQtY3JvcmUtcmV2ZW51ZS1mcm9tLW9wZXJhdGlvbnMtaW4tMXN0LWhhbGYtb2YtZnktMjAyMy0yNNIBdmh0dHBzOi8vcHN1d2F0Y2guY29tL2FtcC9zdG9yeS9kZWZlbmNld2F0Y2gvZ3JzZS1lYXJucy1ycy0xNjU0LWNyb3JlLXJldmVudWUtZnJvbS1vcGVyYXRpb25zLWluLTFzdC1oYWxmLW9mLWZ5LTIwMjMtMjQ?hl=en-IN&gl=IN&ceid=IN%3Aen,2023-11-10
15,CSR: REC to provide assistance of Rs 10 crore to persons with disabilities,PSU Watch,news.google.com/articles/CBMiZ2h0dHBzOi8vcHN1d2F0Y2guY29tL2NzcndhdGNoL2Nzci1yZWMtdG8tcHJvdmlkZS1hc3Npc3RhbmNlLW9mLXJzLTEwLWNyb3JlLXRvLXBlcnNvbnMtd2l0aC1kaXNhYmlsaXRpZXPSAXFodHRwczovL3BzdXdhdGNoLmNvbS9hbXAvc3RvcnkvY3Nyd2F0Y2gvY3NyLXJlYy10by1wcm92aWRlLWFzc2lzdGFuY2Utb2YtcnMtMTAtY3JvcmUtdG8tcGVyc29ucy13aXRoLWRpc2FiaWxpdGllcw?hl=en-IN&gl=IN&ceid=IN%3Aen,2023-11-10
36,"India to be added to UK safe states list, ruling out asylum rights for illegal migrants from the country",PSU Watch,news.google.com/articles/CBMiPGh0dHBzOi8vcHN1d2F0Y2guY29tL25ld3N1cGRhdGVzL3ByZXNzLXJlbGVhc2UvdWstaW5kaWEtc2FmZdIBRmh0dHBzOi8vcHN1d2F0Y2guY29tL2FtcC9zdG9yeS9uZXdzdXBkYXRlcy9wcmVzcy1yZWxlYXNlL3VrLWluZGlhLXNhZmU?hl=en-IN&gl=IN&ceid=IN%3Aen,2023-11-09
30,"Have nothing to hide, cooperated with probe into school jobs scam: TMC''s Abhishek",PSU Watch,news.google.com/articles/CBMiOmh0dHBzOi8vcHN1d2F0Y2guY29tL25ld3N1cGRhdGVzL3ByZXNzLXJlbGVhc2Uvd2ItYWJoaXNoZWvSAURodHRwczovL3BzdXdhdGNoLmNvbS9hbXAvc3RvcnkvbmV3c3VwZGF0ZXMvcHJlc3MtcmVsZWFzZS93Yi1hYmhpc2hlaw?hl=en-IN&gl=IN&ceid=IN%3Aen,2023-11-09
68,Gujarat HC rejects Kejriwal's review plea against order setting aside CIC directive to give information about PM Modi's degree,PSU Watch,news.google.com/articles/CBMiSWh0dHBzOi8vcHN1d2F0Y2guY29tL25ld3N1cGRhdGVzL3ByZXNzLXJlbGVhc2UvZ2otaGMta2Vqcml3YWwtbW9kaS1kZWdyZWXSAVNodHRwczovL3BzdXdhdGNoLmNvbS9hbXAvc3RvcnkvbmV3c3VwZGF0ZXMvcHJlc3MtcmVsZWFzZS9nai1oYy1rZWpyaXdhbC1tb2RpLWRlZ3JlZQ?hl=en-IN&gl=IN&ceid=IN%3Aen,2023-11-09
66,Senior BJP leader Ashutosh Tandon passes away at 63,PSU Watch,news.google.com/articles/CBMiPGh0dHBzOi8vcHN1d2F0Y2guY29tL25ld3N1cGRhdGVzL3ByZXNzLXJlbGVhc2UvdXAtbWxhLWRlbWlzZdIBRmh0dHBzOi8vcHN1d2F0Y2guY29tL2FtcC9zdG9yeS9uZXdzdXBkYXRlcy9wcmVzcy1yZWxlYXNlL3VwLW1sYS1kZW1pc2U?hl=en-IN&gl=IN&ceid=IN%3Aen,2023-11-09
34,"Smog towers not A solution to Delhi-NCR'S air pollution problem, Centre not in favour of installing more giant air purifiers: Sources",PSU Watch,news.google.com/articles/CBMiRWh0dHBzOi8vcHN1d2F0Y2guY29tL25ld3N1cGRhdGVzL3ByZXNzLXJlbGVhc2UvcG9sbHV0aW9uLWRlbGhpLWNlbnRyZdIBT2h0dHBzOi8vcHN1d2F0Y2guY29tL2FtcC9zdG9yeS9uZXdzdXBkYXRlcy9wcmVzcy1yZWxlYXNlL3BvbGx1dGlvbi1kZWxoaS1jZW50cmU?hl=en-IN&gl=IN&ceid=IN%3Aen,2023-11-09
35,"I-T searches at residences, offices of Congress candidate Srinivas Reddy in Telangana",PSU Watch,news.google.com/articles/CBMiU2h0dHBzOi8vcHN1d2F0Y2guY29tL25ld3N1cGRhdGVzL3ByZXNzLXJlbGVhc2UvdGwtaW5jb21lLXRheC1zZWFyY2hzLWNvbmctY2FuZGlkYXRl0gFdaHR0cHM6Ly9wc3V3YXRjaC5jb20vYW1wL3N0b3J5L25ld3N1cGRhdGVzL3ByZXNzLXJlbGVhc2UvdGwtaW5jb21lLXRheC1zZWFyY2hzLWNvbmctY2FuZGlkYXRl?hl=en-IN&gl=IN&ceid=IN%3Aen,2023-11-09
53,Preneet Kaur voted in support of LS ethics panel report recommending Moitra's expulsion: Sources,PSU Watch,news.google.com/articles/CBMiSGh0dHBzOi8vcHN1d2F0Y2guY29tL25ld3N1cGRhdGVzL3ByZXNzLXJlbGVhc2UvcGFuZWwtbW9pdHJhLXByZW5lZXQta2F1ctIBUmh0dHBzOi8vcHN1d2F0Y2guY29tL2FtcC9zdG9yeS9uZXdzdXBkYXRlcy9wcmVzcy1yZWxlYXNlL3BhbmVsLW1vaXRyYS1wcmVuZWV0LWthdXI?hl=en-IN&gl=IN&ceid=IN%3Aen,2023-11-09
26,T'gana Minister Rama Rao escapes unhurt after almost falling off campaign vehicle,PSU Watch,news.google.com/articles/CBMiVmh0dHBzOi8vcHN1d2F0Y2guY29tL25ld3N1cGRhdGVzL3ByZXNzLXJlbGVhc2UvZWxlY3Rpb25zLXRlbGFuZ2FuYS1sZC1taW5pc3Rlci12ZWhpY2xl0gFgaHR0cHM6Ly9wc3V3YXRjaC5jb20vYW1wL3N0b3J5L25ld3N1cGRhdGVzL3ByZXNzLXJlbGVhc2UvZWxlY3Rpb25zLXRlbGFuZ2FuYS1sZC1taW5pc3Rlci12ZWhpY2xl?hl=en-IN&gl=IN&ceid=IN%3Aen,2023-11-09
