,title,source,link,date
12,CSR: REC to provide assistance of Rs 10 crore to persons with disabilities,PSU Watch,news.google.com/articles/CBMiZ2h0dHBzOi8vcHN1d2F0Y2guY29tL2NzcndhdGNoL2Nzci1yZWMtdG8tcHJvdmlkZS1hc3Npc3RhbmNlLW9mLXJzLTEwLWNyb3JlLXRvLXBlcnNvbnMtd2l0aC1kaXNhYmlsaXRpZXPSAXFodHRwczovL3BzdXdhdGNoLmNvbS9hbXAvc3RvcnkvY3Nyd2F0Y2gvY3NyLXJlYy10by1wcm92aWRlLWFzc2lzdGFuY2Utb2YtcnMtMTAtY3JvcmUtdG8tcGVyc29ucy13aXRoLWRpc2FiaWxpdGllcw?hl=en-IN&gl=IN&ceid=IN%3Aen,2023-11-10
25,"U'khand witnessed stricter anti-copying, anti-conversion laws in 23rd year of foundation: CM Dhami",PSU Watch,news.google.com/articles/CBMiPGh0dHBzOi8vcHN1d2F0Y2guY29tL25ld3N1cGRhdGVzL3ByZXNzLXJlbGVhc2UvdWtkLWRheS1kaGFtadIBRmh0dHBzOi8vcHN1d2F0Y2guY29tL2FtcC9zdG9yeS9uZXdzdXBkYXRlcy9wcmVzcy1yZWxlYXNlL3VrZC1kYXktZGhhbWk?hl=en-IN&gl=IN&ceid=IN%3Aen,2023-11-09
28,"Have nothing to hide, cooperated with probe into school jobs scam: TMC''s Abhishek",PSU Watch,news.google.com/articles/CBMiOmh0dHBzOi8vcHN1d2F0Y2guY29tL25ld3N1cGRhdGVzL3ByZXNzLXJlbGVhc2Uvd2ItYWJoaXNoZWvSAURodHRwczovL3BzdXdhdGNoLmNvbS9hbXAvc3RvcnkvbmV3c3VwZGF0ZXMvcHJlc3MtcmVsZWFzZS93Yi1hYmhpc2hlaw?hl=en-IN&gl=IN&ceid=IN%3Aen,2023-11-09
29,"Smog towers not A solution to Delhi-NCR'S air pollution problem, Centre not in favour of installing more giant air purifiers: Sources",PSU Watch,news.google.com/articles/CBMiRWh0dHBzOi8vcHN1d2F0Y2guY29tL25ld3N1cGRhdGVzL3ByZXNzLXJlbGVhc2UvcG9sbHV0aW9uLWRlbGhpLWNlbnRyZdIBT2h0dHBzOi8vcHN1d2F0Y2guY29tL2FtcC9zdG9yeS9uZXdzdXBkYXRlcy9wcmVzcy1yZWxlYXNlL3BvbGx1dGlvbi1kZWxoaS1jZW50cmU?hl=en-IN&gl=IN&ceid=IN%3Aen,2023-11-09
31,"I-T searches at residences, offices of Congress candidate Srinivas Reddy in Telangana",PSU Watch,news.google.com/articles/CBMiU2h0dHBzOi8vcHN1d2F0Y2guY29tL25ld3N1cGRhdGVzL3ByZXNzLXJlbGVhc2UvdGwtaW5jb21lLXRheC1zZWFyY2hzLWNvbmctY2FuZGlkYXRl0gFdaHR0cHM6Ly9wc3V3YXRjaC5jb20vYW1wL3N0b3J5L25ld3N1cGRhdGVzL3ByZXNzLXJlbGVhc2UvdGwtaW5jb21lLXRheC1zZWFyY2hzLWNvbmctY2FuZGlkYXRl?hl=en-IN&gl=IN&ceid=IN%3Aen,2023-11-09
61,Gujarat HC rejects Kejriwal's review plea against order setting aside CIC directive to give information about PM Modi's degree,PSU Watch,news.google.com/articles/CBMiSWh0dHBzOi8vcHN1d2F0Y2guY29tL25ld3N1cGRhdGVzL3ByZXNzLXJlbGVhc2UvZ2otaGMta2Vqcml3YWwtbW9kaS1kZWdyZWXSAVNodHRwczovL3BzdXdhdGNoLmNvbS9hbXAvc3RvcnkvbmV3c3VwZGF0ZXMvcHJlc3MtcmVsZWFzZS9nai1oYy1rZWpyaXdhbC1tb2RpLWRlZ3JlZQ?hl=en-IN&gl=IN&ceid=IN%3Aen,2023-11-09
33,"India to be added to UK safe states list, ruling out asylum rights for illegal migrants from the country",PSU Watch,news.google.com/articles/CBMiPGh0dHBzOi8vcHN1d2F0Y2guY29tL25ld3N1cGRhdGVzL3ByZXNzLXJlbGVhc2UvdWstaW5kaWEtc2FmZdIBRmh0dHBzOi8vcHN1d2F0Y2guY29tL2FtcC9zdG9yeS9uZXdzdXBkYXRlcy9wcmVzcy1yZWxlYXNlL3VrLWluZGlhLXNhZmU?hl=en-IN&gl=IN&ceid=IN%3Aen,2023-11-09
34,"Cong expert in taking nation's progress in reverse gear, deprive it of power for 100 years: PM Modi",PSU Watch,news.google.com/articles/CBMiQGh0dHBzOi8vcHN1d2F0Y2guY29tL25ld3N1cGRhdGVzL3ByZXNzLXJlbGVhc2UvZWxlY3Rpb25zLW1wLWNvbmfSAUpodHRwczovL3BzdXdhdGNoLmNvbS9hbXAvc3RvcnkvbmV3c3VwZGF0ZXMvcHJlc3MtcmVsZWFzZS9lbGVjdGlvbnMtbXAtY29uZw?hl=en-IN&gl=IN&ceid=IN%3Aen,2023-11-09
36,"New Zealand win toss, ask Sri Lanka to bat",PSU Watch,news.google.com/articles/CBMiRGh0dHBzOi8vcHN1d2F0Y2guY29tL25ld3N1cGRhdGVzL3ByZXNzLXJlbGVhc2Uvc3BvLWNyaS13Yy1uei1zbC10b3Nz0gFOaHR0cHM6Ly9wc3V3YXRjaC5jb20vYW1wL3N0b3J5L25ld3N1cGRhdGVzL3ByZXNzLXJlbGVhc2Uvc3BvLWNyaS13Yy1uei1zbC10b3Nz?hl=en-IN&gl=IN&ceid=IN%3Aen,2023-11-09
24,"TDP, Janasena to hold meetings; discuss action plan for all Assembly constituencies in Andhra Pradesh",PSU Watch,news.google.com/articles/CBMiPmh0dHBzOi8vcHN1d2F0Y2guY29tL25ld3N1cGRhdGVzL3ByZXNzLXJlbGVhc2UvYXAtdGRwLWphbmFzZW5h0gFIaHR0cHM6Ly9wc3V3YXRjaC5jb20vYW1wL3N0b3J5L25ld3N1cGRhdGVzL3ByZXNzLXJlbGVhc2UvYXAtdGRwLWphbmFzZW5h?hl=en-IN&gl=IN&ceid=IN%3Aen,2023-11-09
