,title,source,link,date
0,"Diwali 2023 shares: SBI, BDL & L&T among ICICIdirect's top Muhurat stock picks",Business Today,news.google.com/articles/CBMikAFodHRwczovL3d3dy5idXNpbmVzc3RvZGF5LmluL21hcmtldHMvc3RvY2stcGlja3Mvc3RvcnkvZGl3YWxpLTIwMjMtc2hhcmVzLXNiaS1iZGwtbHQtYW1vbmctaWNpY2lkaWVjdHMtdG9wLW11aHVyYXQtc3RvY2stcGlja3MtNDA1MTkxLTIwMjMtMTEtMDnSAZQBaHR0cHM6Ly93d3cuYnVzaW5lc3N0b2RheS5pbi9hbXAvbWFya2V0cy9zdG9jay1waWNrcy9zdG9yeS9kaXdhbGktMjAyMy1zaGFyZXMtc2JpLWJkbC1sdC1hbW9uZy1pY2ljaWRpZWN0cy10b3AtbXVodXJhdC1zdG9jay1waWNrcy00MDUxOTEtMjAyMy0xMS0wOQ?hl=en-IN&gl=IN&ceid=IN%3Aen,2023-11-09
22,SC upholds validity of key provisions of Insolvency and Bankruptcy Code,PSU Watch,news.google.com/articles/CBMiPGh0dHBzOi8vcHN1d2F0Y2guY29tL25ld3N1cGRhdGVzL3ByZXNzLXJlbGVhc2Uvc2MtaW5zb2x2ZW5jedIBRmh0dHBzOi8vcHN1d2F0Y2guY29tL2FtcC9zdG9yeS9uZXdzdXBkYXRlcy9wcmVzcy1yZWxlYXNlL3NjLWluc29sdmVuY3k?hl=en-IN&gl=IN&ceid=IN%3Aen,2023-11-09
26,"If Nitish was wrong, get NCERT books changed too: JD(U) ministers",PSU Watch,news.google.com/articles/CBMiOWh0dHBzOi8vcHN1d2F0Y2guY29tL25ld3N1cGRhdGVzL3ByZXNzLXJlbGVhc2UvYmgtY291bmNpbNIBAA?hl=en-IN&gl=IN&ceid=IN%3Aen,2023-11-09
27,Ministers will work at ground level to ensure implementation of ...,PSU Watch,news.google.com/articles/CBMiRGh0dHBzOi8vcHN1d2F0Y2guY29tL25ld3N1cGRhdGVzL3ByZXNzLXJlbGVhc2UvZGwtcG9sbHV0aW9uLWxkLXJhaS0y0gEA?hl=en-IN&gl=IN&ceid=IN%3Aen,2023-11-09
28,"Fashion brand Snitch looks to open 7-8 offline stores in FY24, expand deeper into Indian geographies",PSU Watch,news.google.com/articles/CBMiOWh0dHBzOi8vcHN1d2F0Y2guY29tL25ld3N1cGRhdGVzL3ByZXNzLXJlbGVhc2UvYml6LXNuaXRjaNIBQ2h0dHBzOi8vcHN1d2F0Y2guY29tL2FtcC9zdG9yeS9uZXdzdXBkYXRlcy9wcmVzcy1yZWxlYXNlL2Jpei1zbml0Y2g?hl=en-IN&gl=IN&ceid=IN%3Aen,2023-11-09
29,Sadananda Gowda told by BJP leadership not to contest LS polls ...,PSU Watch,news.google.com/articles/CBMiTWh0dHBzOi8vcHN1d2F0Y2guY29tL25ld3N1cGRhdGVzL3ByZXNzLXJlbGVhc2Uva2Etc2FkYW5hbmRhLWdvd2RhLXllZGl5dXJhcHBh0gEA?hl=en-IN&gl=IN&ceid=IN%3Aen,2023-11-09
30,FibreNet case: SC adjourns hearing on Chandrababu Naidu's plea seeking anticipatory bail to Nov 30,PSU Watch,news.google.com/articles/CBMiRmh0dHBzOi8vcHN1d2F0Y2guY29tL25ld3N1cGRhdGVzL3ByZXNzLXJlbGVhc2Uvc2MtY2hhbmRyYWJhYnUtZmlicmVuZXTSAVBodHRwczovL3BzdXdhdGNoLmNvbS9hbXAvc3RvcnkvbmV3c3VwZGF0ZXMvcHJlc3MtcmVsZWFzZS9zYy1jaGFuZHJhYmFidS1maWJyZW5ldA?hl=en-IN&gl=IN&ceid=IN%3Aen,2023-11-09
31,Senior BJP leader Ashutosh Tandon passes away at 63,PSU Watch,news.google.com/articles/CBMiPGh0dHBzOi8vcHN1d2F0Y2guY29tL25ld3N1cGRhdGVzL3ByZXNzLXJlbGVhc2UvdXAtbWxhLWRlbWlzZdIBAA?hl=en-IN&gl=IN&ceid=IN%3Aen,2023-11-09
32,ED raid on Kandala Cooperative Bank in Kerala continues; CPI ...,PSU Watch,news.google.com/articles/CBMiTWh0dHBzOi8vcHN1d2F0Y2guY29tL25ld3N1cGRhdGVzL3ByZXNzLXJlbGVhc2Uva2wtZWQtcmFpZC1sZC1jb29wZXJhdGl2ZS1iYW5r0gEA?hl=en-IN&gl=IN&ceid=IN%3Aen,2023-11-09
33,"J-K: Attempts to push in more militants before winter always there; forces alert, says BSF DG",PSU Watch,news.google.com/articles/CBMiOGh0dHBzOi8vcHN1d2F0Y2guY29tL25ld3N1cGRhdGVzL3ByZXNzLXJlbGVhc2UvamstYnNmLWRn0gFCaHR0cHM6Ly9wc3V3YXRjaC5jb20vYW1wL3N0b3J5L25ld3N1cGRhdGVzL3ByZXNzLXJlbGVhc2UvamstYnNmLWRn?hl=en-IN&gl=IN&ceid=IN%3Aen,2023-11-09
