,title,source,link,date
49,The Best Digital Picture Frames to Bring Your Photos to Life,The Wall Street Journal,news.google.com/articles/CBMiRGh0dHBzOi8vd3d3Lndzai5jb20vYnV5c2lkZS9ob21lL2Jlc3QtZGlnaXRhbC1waWN0dXJlLWZyYW1lLTE3YjQyYWE50gEA?hl=en-IN&gl=IN&ceid=IN%3Aen,2023-11-20
16,"Black Friday 2023 sales: Shop 50 best sales at Walmart, Target ...",Reviewed,news.google.com/articles/CBMijwFodHRwczovL3Jldmlld2VkLnVzYXRvZGF5LmNvbS9ibGFjay1mcmlkYXkvZmVhdHVyZXMvYmxhY2stZnJpZGF5LWRlYWxzLXNhbGVzLTExLTIwLTIwMjM_dXRtX3NvdXJjZT11c2F0JnV0bV9tZWRpdW09cmVmZXJyYWwmdXRtX2NhbXBhaWduPWNvbGxhYtIBAA?hl=en-IN&gl=IN&ceid=IN%3Aen,2023-11-20
37,A 2023 gift guide that will strike a chord: 10 ideas for the music lover ...,Quartz,news.google.com/articles/CBMiUGh0dHBzOi8vcXouY29tL2EtMjAyMy1naWZ0LWd1aWRlLXRoYXQtd2lsbC1zdHJpa2UtYS1jaG9yZC0xMC1pZGVhcy1mby0xODUxMDM1Njc50gEA?hl=en-IN&gl=IN&ceid=IN%3Aen,2023-11-20
4,How the mortgage industry is responding to the rise of AI,National Mortgage News,news.google.com/articles/CBMiY2h0dHBzOi8vd3d3Lm5hdGlvbmFsbW9ydGdhZ2VuZXdzLmNvbS9saXN0L2hvdy10aGUtbW9ydGdhZ2UtaW5kdXN0cnktaXMtcmVzcG9uZGluZy10by10aGUtcmlzZS1vZi1hadIBAA?hl=en-IN&gl=IN&ceid=IN%3Aen,2023-11-20
45,"Fall River small businesses, ski shop, tools, ready for holidays",Fall River Herald News,news.google.com/articles/CBMimwFodHRwczovL3d3dy5oZXJhbGRuZXdzLmNvbS9zdG9yeS9saWZlc3R5bGUvMjAyMy8xMS8yMC9mYWxsLXJpdmVyLW1hLXNtYWxsLWJ1c2luZXNzZXMtc2tpLXNob3AtdG9vbHMtYm91dGlxdWUtcmVhZHktZm9yLXNob3BwaW5nLWxvY2FsLWhvbGlkYXlzLzcxNjAzMTk4MDA3L9IBAA?hl=en-IN&gl=IN&ceid=IN%3Aen,2023-11-20
6,Psychological factors underlying attitudes toward AI tools,Nature.com,news.google.com/articles/CBMiMmh0dHBzOi8vd3d3Lm5hdHVyZS5jb20vYXJ0aWNsZXMvczQxNTYyLTAyMy0wMTczNC0y0gEA?hl=en-IN&gl=IN&ceid=IN%3Aen,2023-11-20
29,17 Best Tatcha Black Friday Deals Of 2023,Allure,news.google.com/articles/CBMiN2h0dHBzOi8vd3d3LmFsbHVyZS5jb20vc3RvcnkvdGF0Y2hhLWJsYWNrLWZyaWRheS0yMDIzLTPSAQA?hl=en-IN&gl=IN&ceid=IN%3Aen,2023-11-20
26,Actors Community Theatre to present radio play December 1st & 2nd,Dubois County Free Press,news.google.com/articles/CBMiZmh0dHBzOi8vd3d3LmR1Ym9pc2NvdW50eWZyZWVwcmVzcy5jb20vYWN0b3JzLWNvbW11bml0eS10aGVhdHJlLXRvLXByZXNlbnQtcmFkaW8tcGxheS1kZWNlbWJlci0xc3QtMm5kL9IBAA?hl=en-IN&gl=IN&ceid=IN%3Aen,2023-11-20
24,Antinociceptive effect of intermittent fasting via the orexin pathway ...,Nature.com,news.google.com/articles/CBMiMmh0dHBzOi8vd3d3Lm5hdHVyZS5jb20vYXJ0aWNsZXMvczQxNTk4LTAyMy00NzI3OC0z0gEA?hl=en-IN&gl=IN&ceid=IN%3Aen,2023-11-20
20,What are grocery store hours for Thanksgiving in Bradenton? What’s open and closed,Bradenton Herald,news.google.com/articles/CBMiOmh0dHBzOi8vd3d3LmJyYWRlbnRvbi5jb20vbmV3cy9sb2NhbC9hcnRpY2xlMjgxOTY4NzI4Lmh0bWzSATpodHRwczovL2FtcC5icmFkZW50b24uY29tL25ld3MvbG9jYWwvYXJ0aWNsZTI4MTk2ODcyOC5odG1s?hl=en-IN&gl=IN&ceid=IN%3Aen,2023-11-20
