,title,source,link,date
23,Things to do in November: the best design events happening this ...,Design Week,news.google.com/articles/CBMiYWh0dHBzOi8vd3d3LmRlc2lnbndlZWsuY28udWsvaXNzdWVzLzMwLW9jdG9iZXItMy1ub3ZlbWJlci0yMDIzL2Rlc2lnbi1ldmVudHMtZ3VpZGUtbm92ZW1iZXItMjAyMy_SAQA?hl=en-IN&gl=IN&ceid=IN%3Aen,2023-11-01
18,Predicting Conversion to Psychosis Using Machine Learning: Are ...,Am J Psychiatry,news.google.com/articles/CBMiPmh0dHBzOi8vYWpwLnBzeWNoaWF0cnlvbmxpbmUub3JnL2RvaS8xMC4xMTc2L2FwcGkuYWpwLjIwMjMwNzEx0gEA?hl=en-IN&gl=IN&ceid=IN%3Aen,2023-11-01
2,Advancing AI and Machine Learning Beyond Predictive Capabilities,Eos,news.google.com/articles/CBMiXGh0dHBzOi8vZW9zLm9yZy9lZGl0b3JzLXZveC9hZHZhbmNpbmctYWktYW5kLW1hY2hpbmUtbGVhcm5pbmctYmV5b25kLXByZWRpY3RpdmUtY2FwYWJpbGl0aWVz0gEA?hl=en-IN&gl=IN&ceid=IN%3Aen,2023-11-01
3,JHS play tells true story of 'Radium Girls' who fought for worker rights ...,Joplin Globe,news.google.com/articles/CBMiqwFodHRwczovL3d3dy5qb3BsaW5nbG9iZS5jb20vbmV3cy9sb2NhbF9uZXdzL2pocy1wbGF5LXRlbGxzLXRydWUtc3Rvcnktb2YtcmFkaXVtLWdpcmxzLXdoby1mb3VnaHQtZm9yLXdvcmtlci1yaWdodHMtaGVhbHRoL2FydGljbGVfOWUxZGM0OTQtNzgzYy0xMWVlLTlkNzctOWI3Nzg2MTgxNGVlLmh0bWzSAQA?hl=en-IN&gl=IN&ceid=IN%3Aen,2023-11-01
35,ChatDev : Communicative Agents for Software Development,Unite.AI,news.google.com/articles/CBMiS2h0dHBzOi8vd3d3LnVuaXRlLmFpL2NoYXRkZXYtY29tbXVuaWNhdGl2ZS1hZ2VudHMtZm9yLXNvZnR3YXJlLWRldmVsb3BtZW50L9IBAA?hl=en-IN&gl=IN&ceid=IN%3Aen,2023-11-01
21,Blind Montco Artists To Be Featured At Upcoming Exhibition,Patch,news.google.com/articles/CBMiXGh0dHBzOi8vcGF0Y2guY29tL3Blbm5zeWx2YW5pYS9sYW5zZGFsZS9ibGluZC1tb250Y28tYXJ0aXN0cy1iZS1mZWF0dXJlZC11cGNvbWluZy1leGhpYml0aW9u0gEA?hl=en-IN&gl=IN&ceid=IN%3Aen,2023-11-01
6,Time-traveling through data: The new frontier for health and social ...,Health Service Journal,news.google.com/articles/CBMiemh0dHBzOi8vd3d3Lmhzai5jby51ay9oc2otcGFydG5lcnMvdGltZS10cmF2ZWxpbmctdGhyb3VnaC1kYXRhLXRoZS1uZXctZnJvbnRpZXItZm9yLWhlYWx0aC1hbmQtc29jaWFsLWNhcmUvNzAzNTg0OS5hcnRpY2xl0gEA?hl=en-IN&gl=IN&ceid=IN%3Aen,2023-11-01
51,Bariatric Surgery at 16,The New York Times,news.google.com/articles/CBMiR2h0dHBzOi8vd3d3Lm55dGltZXMuY29tLzIwMjMvMTAvMzEvbWFnYXppbmUvdGVlbi1iYXJpYXRyaWMtc3VyZ2VyeS5odG1s0gEA?hl=en-IN&gl=IN&ceid=IN%3Aen,2023-11-01
10,RECAP | It's All Over For JANA PITTMAN On THE AMAZING RACE ...,TV Blackbox,news.google.com/articles/CBMidGh0dHBzOi8vdHZibGFja2JveC5jb20uYXUvcGFnZS8yMDIzLzExLzAxL3JlY2FwLWl0cy1hbGwtb3Zlci1mb3ItamFuYS1waXR0bWFuLW9uLXRoZS1hbWF6aW5nLXJhY2UtY2VsZWJyaXR5LWVkaXRpb24v0gEA?hl=en-IN&gl=IN&ceid=IN%3Aen,2023-11-01
12,Photobiomodulation therapy alleviates repeated closed head injury ...,John Wiley,news.google.com/articles/CBMiOmh0dHBzOi8vb25saW5lbGlicmFyeS53aWxleS5jb20vZG9pLzEwLjEwMDIvamJpby4yMDIzMDAzNDPSAQA?hl=en-IN&gl=IN&ceid=IN%3Aen,2023-11-01
