,title,source,link,date
0,PensacolaBeach.com and Innisfree Hotels to Host the 1st Innisfree Food Challenge,Benzinga,news.google.com/articles/CBMihwFodHRwczovL3d3dy5iZW56aW5nYS5jb20vcHJlc3NyZWxlYXNlcy8yMy8wOS9uMzQ3Mjg1MDQvcGVuc2Fjb2xhYmVhY2gtY29tLWFuZC1pbm5pc2ZyZWUtaG90ZWxzLXRvLWhvc3QtdGhlLTFzdC1pbm5pc2ZyZWUtZm9vZC1jaGFsbGVuZ2XSAS1odHRwczovL3d3dy5iZW56aW5nYS5jb20vYW1wL2NvbnRlbnQvMzQ3Mjg1MDQ?hl=en-IN&gl=IN&ceid=IN%3Aen,2023-09-19
2,10 incredible travel ideas for an unforgettable last-minute break,The Independent,news.google.com/articles/CBMic2h0dHBzOi8vd3d3LmluZGVwZW5kZW50LmNvLnVrL3RyYXZlbC8xMC1pbmNyZWRpYmxlLXRyYXZlbC1pZGVhcy1mb3ItYW4tdW5mb3JnZXR0YWJsZS1sYXN0bWludXRlLWJyZWFrLWIyNDEyMTIxLmh0bWzSAQA?hl=en-IN&gl=IN&ceid=IN%3Aen,2023-09-18
4,Kuwait's finance ministry says cyber attack hits one of its systems,Arab News,news.google.com/articles/CBMiJWh0dHBzOi8vd3d3LmFyYWJuZXdzLmNvbS9ub2RlLzIzNzU3NjbSASlodHRwczovL3d3dy5hcmFibmV3cy5jb20vbm9kZS8yMzc1NzY2L2FtcA?hl=en-IN&gl=IN&ceid=IN%3Aen,2023-09-18
5,Indian Air Force Takes Delivery of First C295 Aircraft from Airbus,Travel News Asia,news.google.com/articles/CBMiPmh0dHBzOi8vd3d3LnRyYXZlbG5ld3Nhc2lhLmNvbS9uZXdzMjMvMTg5LUluZGlhbkFpckZvcmNlLnNodG1s0gEA?hl=en-IN&gl=IN&ceid=IN%3Aen,2023-09-18
6,Saudi Council of Economic and Development Affairs reviews ...,Arab News,news.google.com/articles/CBMiMmh0dHBzOi8vd3d3LmFyYWJuZXdzLmNvbS9ub2RlLzIzNzU2MzEvc2F1ZGktYXJhYmlh0gEpaHR0cHM6Ly93d3cuYXJhYm5ld3MuY29tL25vZGUvMjM3NTYzMS9hbXA?hl=en-IN&gl=IN&ceid=IN%3Aen,2023-09-18
1,"Long a destination, Morehead City on road to change",Coastal Review Online,news.google.com/articles/CBMiVWh0dHBzOi8vY29hc3RhbHJldmlldy5vcmcvMjAyMy8wOS9sb25nLWEtZGVzdGluYXRpb24tbW9yZWhlYWQtY2l0eS1vbi1yb2FkLXRvLWNoYW5nZS_SAQA?hl=en-IN&gl=IN&ceid=IN%3Aen,2023-09-14
