,title,source,link,date
0,Kuwait's finance ministry says cyber attack hits one of its systems,Arab News,news.google.com/articles/CBMiNmh0dHBzOi8vd3d3LmFyYWJuZXdzLmNvbS9ub2RlLzIzNzU3NjYvYnVzaW5lc3MtZWNvbm9tedIBAA?hl=en-IN&gl=IN&ceid=IN%3Aen,2023-09-18
1,UAE posts revenue growth of 32% in 2022: Finance ministry,Arab News,news.google.com/articles/CBMiNmh0dHBzOi8vd3d3LmFyYWJuZXdzLmNvbS9ub2RlLzIzNzU2NzYvYnVzaW5lc3MtZWNvbm9tedIBKWh0dHBzOi8vd3d3LmFyYWJuZXdzLmNvbS9ub2RlLzIzNzU2NzYvYW1w?hl=en-IN&gl=IN&ceid=IN%3Aen,2023-09-18
3,Kaspersky expands regional presence with opening of 1st ...,Arab News,news.google.com/articles/CBMiNmh0dHBzOi8vd3d3LmFyYWJuZXdzLmNvbS9ub2RlLzIzNzU3MjEvYnVzaW5lc3MtZWNvbm9tedIBKWh0dHBzOi8vd3d3LmFyYWJuZXdzLmNvbS9ub2RlLzIzNzU3MjEvYW1w?hl=en-IN&gl=IN&ceid=IN%3Aen,2023-09-18
4,Saudi Council of Economic and Development Affairs reviews ...,Arab News,news.google.com/articles/CBMiJWh0dHBzOi8vd3d3LmFyYWJuZXdzLmNvbS9ub2RlLzIzNzU2MzHSASlodHRwczovL3d3dy5hcmFibmV3cy5jb20vbm9kZS8yMzc1NjMxL2FtcA?hl=en-IN&gl=IN&ceid=IN%3Aen,2023-09-18
8,The decline of the West: America's Pacific cities face a bleak future,The Spectator,news.google.com/articles/CBMiaGh0dHBzOi8vd3d3LnNwZWN0YXRvci5jby51ay9hcnRpY2xlL3RoZS1kZWNsaW5lLW9mLXRoZS13ZXN0LWFtZXJpY2FzLXBhY2lmaWMtY2l0aWVzLWZhY2UtYS1ibGVhay1mdXR1cmUv0gEA?hl=en-IN&gl=IN&ceid=IN%3Aen,2023-09-17
2,"Long a destination, Morehead City on road to change",Coastal Review Online,news.google.com/articles/CBMiVWh0dHBzOi8vY29hc3RhbHJldmlldy5vcmcvMjAyMy8wOS9sb25nLWEtZGVzdGluYXRpb24tbW9yZWhlYWQtY2l0eS1vbi1yb2FkLXRvLWNoYW5nZS_SAQA?hl=en-IN&gl=IN&ceid=IN%3Aen,2023-09-14
