,title,source,link,date
27,Why Blue Bell Ice Cream Tastes So Incredibly Good,Mashed,news.google.com/articles/CBMiOGh0dHBzOi8vd3d3Lm1hc2hlZC5jb20vMTM5NDMxNS93aHktaXMtYmx1ZS1iZWxsLXNvLWdvb2Qv0gEA?hl=en-IN&gl=IN&ceid=IN%3Aen,2023-09-17
13,Gen Z Fashion Forward: Unveiling India's Stylish Innerwear Revolution,Prittle Prattle News,news.google.com/articles/CBMicWh0dHBzOi8vd3d3LnByaXR0bGVwcmF0dGxlbmV3cy5jb20vbGlmZXN0eWxlL2dlbi16LWZhc2hpb24tZm9yd2FyZC11bnZlaWxpbmctaW5kaWFzLXN0eWxpc2gtaW5uZXJ3ZWFyLXJldm9sdXRpb24v0gEA?hl=en-IN&gl=IN&ceid=IN%3Aen,2023-09-17
51,The Military Protective Eyewear market trend analysis indicates a positive outlook with a projected CAGR,Benzinga,news.google.com/articles/CBMimQFodHRwczovL3d3dy5iZW56aW5nYS5jb20vcHJlc3NyZWxlYXNlcy8yMy8wOS8zNDY2MzQ4MS90aGUtbWlsaXRhcnktcHJvdGVjdGl2ZS1leWV3ZWFyLW1hcmtldC10cmVuZC1hbmFseXNpcy1pbmRpY2F0ZXMtYS1wb3NpdGl2ZS1vdXRsb29rLXdpdGgtYS1wcm9qZWN0ZWTSAS1odHRwczovL3d3dy5iZW56aW5nYS5jb20vYW1wL2NvbnRlbnQvMzQ2NjM0ODE?hl=en-IN&gl=IN&ceid=IN%3Aen,2023-09-17
48,8 Best Router Switch for 2023,Robots.net,news.google.com/articles/CBMiPmh0dHBzOi8vcm9ib3RzLm5ldC90ZWNoLXJldmlld3MvOC1iZXN0LXJvdXRlci1zd2l0Y2gtZm9yLTIwMjMv0gEA?hl=en-IN&gl=IN&ceid=IN%3Aen,2023-09-17
47,13 Best Cisco Router for 2023,Robots.net,news.google.com/articles/CBMiPmh0dHBzOi8vcm9ib3RzLm5ldC90ZWNoLXJldmlld3MvMTMtYmVzdC1jaXNjby1yb3V0ZXItZm9yLTIwMjMv0gEA?hl=en-IN&gl=IN&ceid=IN%3Aen,2023-09-17
46,Sanctions lifted on Venezuelan and Iranian oil unlikely to affect short ...,Arab News,news.google.com/articles/CBMiJWh0dHBzOi8vd3d3LmFyYWJuZXdzLmNvbS9ub2RlLzIzNzUwNzHSASlodHRwczovL3d3dy5hcmFibmV3cy5jb20vbm9kZS8yMzc1MDcxL2FtcA?hl=en-IN&gl=IN&ceid=IN%3Aen,2023-09-17
41,Bill Wagner: Navy football takes encouraging step forward in near ...,Capital Gazette,news.google.com/articles/CBMiemh0dHBzOi8vd3d3LmNhcGl0YWxnYXpldHRlLmNvbS9zcG9ydHMvbmF2eS9hYy1jcy1uYXZ5LWZvbGxvdy1jb2x1bW4tbWVtcGhpcy0yMDIzMDkxNy00amE0cTJna3l6YWpqazJsdmQzd2pyYzZuYS1zdG9yeS5odG1s0gEA?hl=en-IN&gl=IN&ceid=IN%3Aen,2023-09-17
15,Country’s first electric vehicle manufacturing plant underway in Chattogram,The Daily Star,news.google.com/articles/CBMifmh0dHBzOi8vd3d3LnRoZWRhaWx5c3Rhci5uZXQvdGVjaC1zdGFydHVwL25ld3MvY291bnRyeXMtZmlyc3QtZWxlY3RyaWMtdmVoaWNsZS1tYW51ZmFjdHVyaW5nLXBsYW50LXVuZGVyd2F5LWNoYXR0b2dyYW0tMzQyMDIxMdIBggFodHRwczovL3d3dy50aGVkYWlseXN0YXIubmV0L3RlY2gtc3RhcnR1cC9uZXdzL2NvdW50cnlzLWZpcnN0LWVsZWN0cmljLXZlaGljbGUtbWFudWZhY3R1cmluZy1wbGFudC11bmRlcndheS1jaGF0dG9ncmFtLTM0MjAyMTE_YW1w?hl=en-IN&gl=IN&ceid=IN%3Aen,2023-09-17
52,"Light Aircraft Market trends, Market metrics and sales are the focus of this report, and market size whic",Benzinga,news.google.com/articles/CBMimQFodHRwczovL3d3dy5iZW56aW5nYS5jb20vcHJlc3NyZWxlYXNlcy8yMy8wOS8zNDY1OTY4NS9saWdodC1haXJjcmFmdC1tYXJrZXQtdHJlbmRzLW1hcmtldC1tZXRyaWNzLWFuZC1zYWxlcy1hcmUtdGhlLWZvY3VzLW9mLXRoaXMtcmVwb3J0LWFuZC1tYXJrZXQtc2l6ZS3SAS1odHRwczovL3d3dy5iZW56aW5nYS5jb20vYW1wL2NvbnRlbnQvMzQ2NTk2ODU?hl=en-IN&gl=IN&ceid=IN%3Aen,2023-09-17
6,Circular Design Challenge announces its worldwide expansion,Daijiworld.com,news.google.com/articles/CBMiOmh0dHBzOi8vd3d3LmRhaWppd29ybGQuY29tL25ld3MvbmV3c0Rpc3BsYXk_bmV3c0lEPTExMjEzOTLSAQA?hl=en-IN&gl=IN&ceid=IN%3Aen,2023-09-17
