,title,source,link,date
43,HeyGen Review: The Best AI Video Generator for Businesses?,Unite.AI,news.google.com/articles/CBMiI2h0dHBzOi8vd3d3LnVuaXRlLmFpL2hleWdlbi1yZXZpZXcv0gEA?hl=en-IN&gl=IN&ceid=IN%3Aen,2023-09-25
26,"Our Focus is on Delhi NCR and Rajasthan, Uddhav Poddar of ...",India Retailing,news.google.com/articles/CBMicWh0dHBzOi8vd3d3LmluZGlhcmV0YWlsaW5nLmNvbS8yMDIzLzA5LzI0L291ci1mb2N1cy1pcy1vbi1kZWxoaS1uY3ItYW5kLXJhamFzdGhhbi11ZGRoYXYtcG9kZGFyLW9mLWJodW1pa2EtZ3JvdXAv0gEA?hl=en-IN&gl=IN&ceid=IN%3Aen,2023-09-24
48,AI Marketing: The Future of SEO & AI in Digital Marketing According ...,Varsity Online,news.google.com/articles/CBMidGh0dHBzOi8vd3d3LnZhcnNpdHkuY28udWsvc3BvbnNvcmVkL2FpLW1hcmtldGluZy10aGUtZnV0dXJlLW9mLXNlby1haS1pbi1kaWdpdGFsLW1hcmtldGluZy1hY2NvcmRpbmctdG8tYWdlbmN5LW9wYWNl0gEA?hl=en-IN&gl=IN&ceid=IN%3Aen,2023-09-24
46,Young changemakers tackle societal issues at 'SHAPEATHON',Arab News,news.google.com/articles/CBMiNGh0dHBzOi8vd3d3LmFyYWJuZXdzLmNvbS9ub2RlLzIzNzk4NjEvY29ycG9yYXRlLW5ld3PSASlodHRwczovL3d3dy5hcmFibmV3cy5jb20vbm9kZS8yMzc5ODYxL2FtcA?hl=en-IN&gl=IN&ceid=IN%3Aen,2023-09-24
42,LuLu Group opens food processing and export hub in Italy,Arab News,news.google.com/articles/CBMiNGh0dHBzOi8vd3d3LmFyYWJuZXdzLmNvbS9ub2RlLzIzNzk4NTYvY29ycG9yYXRlLW5ld3PSASlodHRwczovL3d3dy5hcmFibmV3cy5jb20vbm9kZS8yMzc5ODU2L2FtcA?hl=en-IN&gl=IN&ceid=IN%3Aen,2023-09-24
29,Nestlé set to unveil fresh initiatives in ambitious category growth ...,The Moodie Davitt Report,news.google.com/articles/CBMibWh0dHBzOi8vd3d3Lm1vb2RpZWRhdml0dHJlcG9ydC5jb20vbmVzdGxlLXNldC10by11bnZlaWwtZnJlc2gtaW5pdGlhdGl2ZXMtaW4tYW1iaXRpb3VzLWNhdGVnb3J5LWdyb3d0aC1kcml2ZS_SAQA?hl=en-IN&gl=IN&ceid=IN%3Aen,2023-09-24
28,"Goodbye, fashion connoisseur brands: How niche clothing went mainstream",EL PAÍS USA,news.google.com/articles/CBMihQFodHRwczovL2VuZ2xpc2guZWxwYWlzLmNvbS9lY29ub215LWFuZC1idXNpbmVzcy8yMDIzLTA5LTI0L2dvb2RieWUtZmFzaGlvbi1jb25ub2lzc2V1ci1icmFuZHMtaG93LW5pY2hlLWNsb3RoaW5nLXdlbnQtbWFpbnN0cmVhbS5odG1s0gGUAWh0dHBzOi8vZW5nbGlzaC5lbHBhaXMuY29tL2Vjb25vbXktYW5kLWJ1c2luZXNzLzIwMjMtMDktMjQvZ29vZGJ5ZS1mYXNoaW9uLWNvbm5vaXNzZXVyLWJyYW5kcy1ob3ctbmljaGUtY2xvdGhpbmctd2VudC1tYWluc3RyZWFtLmh0bWw_b3V0cHV0VHlwZT1hbXA?hl=en-IN&gl=IN&ceid=IN%3Aen,2023-09-24
64,8 Of The Greatest Buick Muscle Cars You Never Knew About,CarBuzz,news.google.com/articles/CBMiLmh0dHBzOi8vY2FyYnV6ei5jb20vZmVhdHVyZXMvYnVpY2stbXVzY2xlLWNhcnPSAQA?hl=en-IN&gl=IN&ceid=IN%3Aen,2023-09-23
55,Sean Wotherspoon and the adidas Gazelle for Hypebeast's Sole ...,HYPEBEAST,news.google.com/articles/CBMiW2h0dHBzOi8vaHlwZWJlYXN0LmNvbS8yMDIzLzkvc2Vhbi13b3RoZXJzcG9vbi1hZGlkYXMtZ2F6ZWxsZS1oeXBlYmVhc3Qtc29sZS1tYXRlcy1pbnRlcnZpZXfSAQA?hl=en-IN&gl=IN&ceid=IN%3Aen,2023-09-23
34,Hilton's Flagship Brand Makes Highly Anticipated Debut in the ...,That's Online,news.google.com/articles/CBMidGh0dHBzOi8vd3d3LnRoYXRzbWFncy5jb20vc2hhbmdoYWkvcG9zdC8zNjUxOS9oaWx0b24tcy1mbGFnc2hpcC1icmFuZC1tYWtlcy1oaWdobHktYW50aWNpcGF0ZWQtZGVidXQtaW4tdGhlLW1hbGRpdmVz0gEA?hl=en-IN&gl=IN&ceid=IN%3Aen,2023-09-22
