,title,source,link,date
30,"TCBY, Mrs. Fields franchisor acquired by Pearl Street Equity",Restaurant Dive,news.google.com/articles/CBMiZmh0dHBzOi8vd3d3LnJlc3RhdXJhbnRkaXZlLmNvbS9uZXdzL3RjYnktbXJzLWZpZWxkcy1mcmFuY2hpc29yLWFjcXVpcmVkLWJ5LXBlYXJsLXN0cmVldC1lcXVpdHkvNjk3ODU3L9IBAA?hl=en-IN&gl=IN&ceid=IN%3Aen,2023-10-26
22,New chicken concept opens in Fairfax District,Park Labrea News/Beverly Press,news.google.com/articles/CBMiT2h0dHBzOi8vYmV2ZXJseXByZXNzLmNvbS8yMDIzLzEwL25ldy1jaGlja2VuLWNvbmNlcHQtb3BlbnMtaW4tZmFpcmZheC1kaXN0cmljdC_SAQA?hl=en-IN&gl=IN&ceid=IN%3Aen,2023-10-26
70,Jerry Lockspeiser: Will 2024 mark the end of the UK wine trade as ...,Harpers Wine & Spirit Trade Review,news.google.com/articles/CBMihQFodHRwczovL2hhcnBlcnMuY28udWsvbmV3cy9mdWxsc3RvcnkucGhwL2FpZC8zMjAxNy9KZXJyeV9Mb2Nrc3BlaXNlcjpfV2lsbF8yMDI0X21hcmtfdGhlX2VuZF9vZl90aGVfVUtfd2luZV90cmFkZV9hc193ZV9rbm93X2l0Xy5odG1s0gEA?hl=en-IN&gl=IN&ceid=IN%3Aen,2023-10-26
63,Honda Prelude revived as sleek hybrid coupe,Autocar,news.google.com/articles/CBMiQWh0dHBzOi8vd3d3LmF1dG9jYXIuY28udWsvY2FyLW5ld3MvbmV3LWNhcnMvaG9uZGEtcHJlbHVkZS1jb25jZXB00gEA?hl=en-IN&gl=IN&ceid=IN%3Aen,2023-10-26
62,Blockchain Payments for Businesses: Here's Everything You Need ...,TechCabal,news.google.com/articles/CBMiZmh0dHBzOi8vdGVjaGNhYmFsLmNvbS8yMDIzLzEwLzI2L2Jsb2NrY2hhaW4tcGF5bWVudHMtZm9yLWJ1c2luZXNzZXMtaGVyZXMtZXZlcnl0aGluZy15b3UtbmVlZC10by1rbm93L9IBAA?hl=en-IN&gl=IN&ceid=IN%3Aen,2023-10-26
61,How You Can Leverage the Power of AI and ChatGPT at Your Hotel ...,Hospitality Net,news.google.com/articles/CBMiM2h0dHBzOi8vd3d3Lmhvc3BpdGFsaXR5bmV0Lm9yZy9vcGluaW9uLzQxMTg4MDYuaHRtbNIBAA?hl=en-IN&gl=IN&ceid=IN%3Aen,2023-10-26
60,Quality education: Training solutions for hospitality education | By ...,Hospitality Net,news.google.com/articles/CBMiM2h0dHBzOi8vd3d3Lmhvc3BpdGFsaXR5bmV0Lm9yZy9vcGluaW9uLzQxMTg4MTMuaHRtbNIBAA?hl=en-IN&gl=IN&ceid=IN%3Aen,2023-10-26
59,"""NEOWIZ’ Hit Mobile RPG BrownDust2 Unleashes the Story Pack 10 ...",Games Press,news.google.com/articles/CBMiZGh0dHBzOi8vd3d3LmdhbWVzcHJlc3MuY29tL2VuLVVTL05FT1dJWi1IaXQtTW9iaWxlLVJQRy1Ccm93bkR1c3QyLVVubGVhc2hlcy10aGUtU3RvcnktUGFjay0xMC1VcGRhdGXSAQA?hl=en-IN&gl=IN&ceid=IN%3Aen,2023-10-26
51,"On fear of missing out, social networks use disorder tendencies and ...",BMC Psychology,news.google.com/articles/CBMiS2h0dHBzOi8vYm1jcHN5Y2hvbG9neS5iaW9tZWRjZW50cmFsLmNvbS9hcnRpY2xlcy8xMC4xMTg2L3M0MDM1OS0wMjMtMDEzNDItOdIBAA?hl=en-IN&gl=IN&ceid=IN%3Aen,2023-10-26
49,Jollibee brings Singapore’s Common Man Coffee to Philippines,Philstar.com,news.google.com/articles/CBMibWh0dHBzOi8vd3d3LnBoaWxzdGFyLmNvbS9idXNpbmVzcy8yMDIzLzEwLzI3LzIzMDY3ODkvam9sbGliZWUtYnJpbmdzLXNpbmdhcG9yZXMtY29tbW9uLW1hbi1jb2ZmZWUtcGhpbGlwcGluZXPSAXJodHRwczovL3d3dy5waGlsc3Rhci5jb20vYnVzaW5lc3MvMjAyMy8xMC8yNy8yMzA2Nzg5L2pvbGxpYmVlLWJyaW5ncy1zaW5nYXBvcmVzLWNvbW1vbi1tYW4tY29mZmVlLXBoaWxpcHBpbmVzL2FtcC8?hl=en-IN&gl=IN&ceid=IN%3Aen,2023-10-26
