,title,source,link,date
0,Mastering Derivatives: Choosing Between Long Put Butterfly and Long Call Butterfly Strategies for Low Volatility Markets,BusinessLine,news.google.com/articles/CBMihgFodHRwczovL3d3dy50aGVoaW5kdWJ1c2luZXNzbGluZS5jb20vcG9ydGZvbGlvL2NvbW1vZGl0eS1hbmFseXNpcy9tYXN0ZXJpbmctZGVyaXZhdGl2ZXMtYXJlLXlvdS1oYXZpbmctYnV0dGVyZmxpZXMvYXJ0aWNsZTY3MjMxNjc5LmVjZdIBiwFodHRwczovL3d3dy50aGVoaW5kdWJ1c2luZXNzbGluZS5jb20vcG9ydGZvbGlvL2NvbW1vZGl0eS1hbmFseXNpcy9tYXN0ZXJpbmctZGVyaXZhdGl2ZXMtYXJlLXlvdS1oYXZpbmctYnV0dGVyZmxpZXMvYXJ0aWNsZTY3MjMxNjc5LmVjZS9hbXAv?hl=en-IN&gl=IN&ceid=IN%3Aen,2023-08-25
10,"Identification of North, Central & South American butterfly type ...",The University of Sydney,news.google.com/articles/CBMigAFodHRwczovL3d3dy5zeWRuZXkuZWR1LmF1L211c2V1bS93aGF0cy1vbi90YWxrcy1hbmQtZXZlbnRzL2lkZW50aWZpY2F0aW9uLW9mLW5vcnRoLS1jZW50cmFsLS0tc291dGgtYW1lcmljYW4tYnV0dGVyZmx5LXR5cGUuaHRtbNIBAA?hl=en-IN&gl=IN&ceid=IN%3Aen,2023-08-25
74,Let's Get Growing - Butterfly weed and milkweed,Southern Standard,news.google.com/articles/CBMiamh0dHBzOi8vd3d3LnNvdXRoZXJuc3RhbmRhcmQuY29tL3RvcC1zdG9yaWVzL2xvY2FsLWhlYWRsaW5lcy9sZXRzLWdldC1ncm93aW5nLWJ1dHRlcmZseS13ZWVkLWFuZC1taWxrd2VlZC_SAQA?hl=en-IN&gl=IN&ceid=IN%3Aen,2023-08-25
37,Research suggests monarch butterflies may be in less danger than we think,Phys.org,news.google.com/articles/CBMiPWh0dHBzOi8vcGh5cy5vcmcvbmV3cy8yMDIzLTA4LW1vbmFyY2gtYnV0dGVyZmxpZXMtZGFuZ2VyLmh0bWzSATxodHRwczovL3BoeXMub3JnL25ld3MvMjAyMy0wOC1tb25hcmNoLWJ1dHRlcmZsaWVzLWRhbmdlci5hbXA?hl=en-IN&gl=IN&ceid=IN%3Aen,2023-08-25
29,A Southwest Harbor preserve is a haven for the elusive monarch ...,Bangor Daily News,news.google.com/articles/CBMia2h0dHBzOi8vd3d3LmJhbmdvcmRhaWx5bmV3cy5jb20vMjAyMy8wOC8yNS9vdXRkb29ycy9zb3V0aHdlc3QtaGFyYm9yLW1vbmFyY2gtYnV0dGVyZmx5LXByZXNlcnZlLXhvYXNxMWkyOWkv0gEA?hl=en-IN&gl=IN&ceid=IN%3Aen,2023-08-25
13,How I made my garden more butterfly-friendly – without letting it go ...,The Telegraph,news.google.com/articles/CBMiY2h0dHBzOi8vd3d3LnRlbGVncmFwaC5jby51ay9nYXJkZW5pbmcvcHJvYmxlbS1zb2x2aW5nL2hvdy1pLW1hZGUtbXktZ2FyZGVuLW1vcmUtYnV0dGVyZmx5LWZyaWVuZGx5L9IBAA?hl=en-IN&gl=IN&ceid=IN%3Aen,2023-08-25
44,"High Performance Butterfly Valve Market: Growth Prospects, Industry Players, Innovative Technologies, and Appl",openPR,news.google.com/articles/CBMiXGh0dHBzOi8vd3d3Lm9wZW5wci5jb20vbmV3cy8zMTgyNDc4L2hpZ2gtcGVyZm9ybWFuY2UtYnV0dGVyZmx5LXZhbHZlLW1hcmtldC1ncm93dGgtcHJvc3BlY3Rz0gFbaHR0cHM6Ly93d3cub3BlbnByLmNvbS9hbXAvMzE4MjQ3OC9oaWdoLXBlcmZvcm1hbmNlLWJ1dHRlcmZseS12YWx2ZS1tYXJrZXQtZ3Jvd3RoLXByb3NwZWN0cw?hl=en-IN&gl=IN&ceid=IN%3Aen,2023-08-25
24,Museum researchers enlist hundreds of home gardeners in fight to save the iconic monarch butterfly,Phys.org,news.google.com/articles/CBMiSGh0dHBzOi8vcGh5cy5vcmcvbmV3cy8yMDIzLTA4LW11c2V1bS1odW5kcmVkcy1ob21lLWdhcmRlbmVycy1pY29uaWMuaHRtbNIBR2h0dHBzOi8vcGh5cy5vcmcvbmV3cy8yMDIzLTA4LW11c2V1bS1odW5kcmVkcy1ob21lLWdhcmRlbmVycy1pY29uaWMuYW1w?hl=en-IN&gl=IN&ceid=IN%3Aen,2023-08-24
22,Butterfly Effect: Making Homes for Endangered Monarchs,Retrospect,news.google.com/articles/CBMiVGh0dHBzOi8vd3d3LnRoZXJldHJvc3BlY3QuY29tL25ld3MvYnV0dGVyZmx5LWVmZmVjdC1tYWtpbmctaG9tZXMtZW5kYW5nZXJlZC1tb25hcmNoc9IBAA?hl=en-IN&gl=IN&ceid=IN%3Aen,2023-08-24
43,Damien Hirst | H7-3. Butterfly Heart (large) (2020) | Available for Sale,Artsy,news.google.com/articles/CBMiSGh0dHBzOi8vd3d3LmFydHN5Lm5ldC9hcnR3b3JrL2RhbWllbi1oaXJzdC1oNy0zLWJ1dHRlcmZseS1oZWFydC1sYXJnZS0yMNIBAA?hl=en-IN&gl=IN&ceid=IN%3Aen,2023-08-24
