,title,source,link,date
17,Mitsubishi UFJ Trust & Banking Corp Makes Strategic Investment in ...,Best Stocks,news.google.com/articles/CBMiQWh0dHBzOi8vYmVzdHN0b2Nrcy5jb20vbWl0c3ViaXNoaS11ZmotdHJ1c3QtYmFua2luZy1jb3JwLW1ha2VzLXMv0gEA?hl=en-IN&gl=IN&ceid=IN%3Aen,2023-08-26
0,2023 Best Places to Work Awards: Captrust,The Business Journals,news.google.com/articles/CBMiVmh0dHBzOi8vd3d3LmJpempvdXJuYWxzLmNvbS90cmlhbmdsZS9uZXdzLzIwMjMvMDgvMjQvYmVzdC1wbGFjZXMtdG8td29yay1jYXB0cnVzdC5odG1s0gFaaHR0cHM6Ly93d3cuYml6am91cm5hbHMuY29tL3RyaWFuZ2xlL25ld3MvMjAyMy8wOC8yNC9iZXN0LXBsYWNlcy10by13b3JrLWNhcHRydXN0LmFtcC5odG1s?hl=en-IN&gl=IN&ceid=IN%3Aen,2023-08-25
16,Mount Yale Investment Advisors LLC Boosts Stake in US Foods ...,MarketBeat,news.google.com/articles/CBMiSmh0dHBzOi8vd3d3Lm1hcmtldGJlYXQuY29tL2luc3RhbnQtYWxlcnRzL255c2UtdXNmZC1zZWMtZmlsaW5nLTIwMjMtMDgtMjUv0gEA?hl=en-IN&gl=IN&ceid=IN%3Aen,2023-08-25
48,FY2023 EPS Estimates for Denbury Inc. (NYSE:DEN) Lifted by Analyst,MarketBeat,news.google.com/articles/CBMiWWh0dHBzOi8vd3d3Lm1hcmtldGJlYXQuY29tL2luc3RhbnQtYWxlcnRzL255c2UtZGVuLWFuYWx5c3QtZWFybmluZ3MtZXN0aW1hdGVzLTIwMjMtMDgtMjUv0gEA?hl=en-IN&gl=IN&ceid=IN%3Aen,2023-08-25
45,STAAR Surgical Receives Moderate Buy Consensus Rating and ...,Best Stocks,news.google.com/articles/CBMiSmh0dHBzOi8vYmVzdHN0b2Nrcy5jb20vc3RhYXItc3VyZ2ljYWwtcmVjZWl2ZXMtbW9kZXJhdGUtYnV5LWNvbnNlbnN1cy1yYXQv0gEA?hl=en-IN&gl=IN&ceid=IN%3Aen,2023-08-25
44,Analysts Issue Forecasts for Grocery Outlet Holding Corp.'s FY2023 ...,MarketBeat,news.google.com/articles/CBMiWmh0dHBzOi8vd3d3Lm1hcmtldGJlYXQuY29tL2luc3RhbnQtYWxlcnRzL25hc2RhcS1nby1hbmFseXN0LWVhcm5pbmdzLWVzdGltYXRlcy0yMDIzLTA4LTI1L9IBAA?hl=en-IN&gl=IN&ceid=IN%3Aen,2023-08-25
42,Bessemer Group Inc. Invests $135000 in First Interstate BancSystem ...,MarketBeat,news.google.com/articles/CBMiTGh0dHBzOi8vd3d3Lm1hcmtldGJlYXQuY29tL2luc3RhbnQtYWxlcnRzL25hc2RhcS1maWJrLXNlYy1maWxpbmctMjAyMy0wOC0yNS_SAQA?hl=en-IN&gl=IN&ceid=IN%3Aen,2023-08-25
28,Federated Hermes Inc. Shows Confidence in Allbirds with ...,Best Stocks,news.google.com/articles/CBMiSWh0dHBzOi8vYmVzdHN0b2Nrcy5jb20vZmVkZXJhdGVkLWhlcm1lcy1pbmMtc2hvd3MtY29uZmlkZW5jZS1pbi1hbGxiaXJkcy_SAQA?hl=en-IN&gl=IN&ceid=IN%3Aen,2023-08-25
27,Russell Investments Group Ltd. Decreases Stake in Helen of Troy ...,Best Stocks,news.google.com/articles/CBMiS2h0dHBzOi8vYmVzdHN0b2Nrcy5jb20vcnVzc2VsbC1pbnZlc3RtZW50cy1ncm91cC1sdGQtZGVjcmVhc2VzLXN0YWtlLWluLTE1L9IBAA?hl=en-IN&gl=IN&ceid=IN%3Aen,2023-08-25
25,"Spectrum Brands Holdings, Inc. Faces Stake Reduction and Mixed ...",Best Stocks,news.google.com/articles/CBMiSGh0dHBzOi8vYmVzdHN0b2Nrcy5jb20vc3BlY3RydW0tYnJhbmRzLWhvbGRpbmdzLWluYy1mYWNlcy1zdGFrZS1yZWR1Y3RpL9IBAA?hl=en-IN&gl=IN&ceid=IN%3Aen,2023-08-25
