,title,source,link,date
17,Harlem Globetrotters Coming to Bud Walton Arena on April 11,Razorbacks Arkansas,news.google.com/articles/CBMiW2h0dHBzOi8vYXJrYW5zYXNyYXpvcmJhY2tzLmNvbS9oYXJsZW0tZ2xvYmV0cm90dGVycy1jb21pbmctdG8tYnVkLXdhbHRvbi1hcmVuYS1vbi1hcHJpbC0xMS_SAQA?hl=en-IN&gl=IN&ceid=IN%3Aen,2023-11-20
14,How to Start Smart With a Talent Marketplace,MIT Sloan Management Review,news.google.com/articles/CBMiUWh0dHBzOi8vc2xvYW5yZXZpZXcubWl0LmVkdS9hcnRpY2xlL2hvdy10by1zdGFydC1zbWFydC13aXRoLWEtdGFsZW50LW1hcmtldHBsYWNlL9IBAA?hl=en-IN&gl=IN&ceid=IN%3Aen,2023-11-20
34,"Lekic: “A lot of work and discipline inside these 1,000 goals”",European Handball Federation,news.google.com/articles/CBMiY2h0dHBzOi8vZWhmY2wuZXVyb2hhbmRiYWxsLmNvbS9uZXdzL2VuL2xla2ljLWEtbG90LW9mLXdvcmstYW5kLWRpc2NpcGxpbmUtaW5zaWRlLXRoZXNlLTEtMDAwLWdvYWxzL9IBAA?hl=en-IN&gl=IN&ceid=IN%3Aen,2023-11-20
33,C4 Therapeutics Strengthens Board of Directors with Owen Hughes ...,GlobeNewswire,news.google.com/articles/CBMikwFodHRwczovL3d3dy5nbG9iZW5ld3N3aXJlLmNvbS9uZXdzLXJlbGVhc2UvMjAyMy8xMS8yMC8yNzgzMTAxLzAvZW4vQzQtVGhlcmFwZXV0aWNzLVN0cmVuZ3RoZW5zLUJvYXJkLW9mLURpcmVjdG9ycy13aXRoLU93ZW4tSHVnaGVzLUFwcG9pbnRtZW50Lmh0bWzSAQA?hl=en-IN&gl=IN&ceid=IN%3Aen,2023-11-20
31,"Awards & Honors: Sainristil Earns Conference, National Honors for ...",MGoBlue,news.google.com/articles/CBMiTGh0dHBzOi8vbWdvYmx1ZS5jb20vbmV3cy8yMDIzLzExLzIwLzIwMjMtbWljaGlnYW4tZm9vdGJhbGwtYXdhcmRzLWFuZC1ob25vcnPSAQA?hl=en-IN&gl=IN&ceid=IN%3Aen,2023-11-20
30,Factors in turnover intention of cardiothoracic surgery residents ...,Nature.com,news.google.com/articles/CBMiMmh0dHBzOi8vd3d3Lm5hdHVyZS5jb20vYXJ0aWNsZXMvczQxNTk4LTAyMy00NjU4OC130gEA?hl=en-IN&gl=IN&ceid=IN%3Aen,2023-11-20
29,"Clorox Scapegoats Cyber Chief, Rewards Board After Crisis",Forbes,news.google.com/articles/CBMibGh0dHBzOi8vd3d3LmZvcmJlcy5jb20vc2l0ZXMvbm9haGJhcnNreS8yMDIzLzExLzIwL2Nsb3JveC1zY2FwZWdvYXRzLWN5YmVyLWNoaWVmLXJld2FyZHMtYm9hcmQtYWZ0ZXItY3Jpc2lzL9IBAA?hl=en-IN&gl=IN&ceid=IN%3Aen,2023-11-20
27,Razorbacks Win Five-Set Thriller over Florida on Senior Day,Razorbacks Arkansas,news.google.com/articles/CBMiW2h0dHBzOi8vYXJrYW5zYXNyYXpvcmJhY2tzLmNvbS9yYXpvcmJhY2tzLXdpbi1maXZlLXNldC10aHJpbGxlci1vdmVyLWZsb3JpZGEtb24tc2VuaW9yLWRheS_SAQA?hl=en-IN&gl=IN&ceid=IN%3Aen,2023-11-20
26,"How to talk to an elderly relative about Altman, OpenAI and Microsoft",Financial Times,news.google.com/articles/CBMiP2h0dHBzOi8vd3d3LmZ0LmNvbS9jb250ZW50LzZkZDI5MmMwLWE1NTEtNDYwOS04NjQ5LWY2YjY5YjIwZjg0NtIBAA?hl=en-IN&gl=IN&ceid=IN%3Aen,2023-11-20
25,Menstruation and support at work,Chartered Institute of Personnel and Development,news.google.com/articles/CBMiR2h0dHBzOi8vd3d3LmNpcGQub3JnL3VrL2tub3dsZWRnZS9yZXBvcnRzL21lbnN0cnVhdGlvbi1zdXBwb3J0LWF0LXdvcmsv0gEA?hl=en-IN&gl=IN&ceid=IN%3Aen,2023-11-20
