,title,source,link,date
14,Admission | Kenneth C. Griffin Department of Economics,Kenneth C. Griffin Department of Economics,news.google.com/articles/CBMiN2h0dHBzOi8vZWNvbm9taWNzLnVjaGljYWdvLmVkdS9ncmFkdWF0ZS1zdHVkeS9hZG1pc3Npb27SAQA?hl=en-IN&gl=IN&ceid=IN%3Aen,2023-09-27
5,Freshly minted Jio Financial is already the hottest new employer,The Ken,news.google.com/articles/CBMiU2h0dHBzOi8vdGhlLWtlbi5jb20vc3RvcnkvZnJlc2hseS1taW50ZWQtamlvLWZpbmFuY2lhbC1pcy10aGUtaG90dGVzdC1uZXctZW1wbG95ZXIv0gEA?hl=en-IN&gl=IN&ceid=IN%3Aen,2023-09-27
8,Sam Curran's ambition: winning the 50-Over World Cup with England,Times of India,news.google.com/articles/CBMikQFodHRwczovL20udGltZXNvZmluZGlhLmNvbS9zcG9ydHMvY3JpY2tldC9pY2Mtd29ybGQtY3VwL3NhbS1jdXJyYW5zLWFtYml0aW9uLXdpbm5pbmctdGhlLTUwLW92ZXItd29ybGQtY3VwLXdpdGgtZW5nbGFuZC9hcnRpY2xlc2hvdy8xMDM5NzUzNzMuY21z0gGVAWh0dHBzOi8vbS50aW1lc29maW5kaWEuY29tL3Nwb3J0cy9jcmlja2V0L2ljYy13b3JsZC1jdXAvc2FtLWN1cnJhbnMtYW1iaXRpb24td2lubmluZy10aGUtNTAtb3Zlci13b3JsZC1jdXAtd2l0aC1lbmdsYW5kL2FtcF9hcnRpY2xlc2hvdy8xMDM5NzUzNzMuY21z?hl=en-IN&gl=IN&ceid=IN%3Aen,2023-09-27
15,David Montgomery injury update: Latest on Lions RB for fantasy football Week 4,Sportskeeda,news.google.com/articles/CBMiZmh0dHBzOi8vd3d3LnNwb3J0c2tlZWRhLmNvbS9uZmwvZGF2aWQtbW9udGdvbWVyeS1pbmp1cnktdXBkYXRlLWxhdGVzdC1saW9ucy1yYi1mYW50YXN5LWZvb3RiYWxsLXdlZWstNNIBamh0dHBzOi8vd3d3LnNwb3J0c2tlZWRhLmNvbS9hbXAvbmZsL2RhdmlkLW1vbnRnb21lcnktaW5qdXJ5LXVwZGF0ZS1sYXRlc3QtbGlvbnMtcmItZmFudGFzeS1mb290YmFsbC13ZWVrLTQ?hl=en-IN&gl=IN&ceid=IN%3Aen,2023-09-27
13,"Smiling from fast lane, Ludvig Åberg's Ryder Cup legend begins now",RyderCup.com,news.google.com/articles/CBMiZGh0dHBzOi8vd3d3LnJ5ZGVyY3VwLmNvbS9uZXdzLW1lZGlhL3NtaWxpbmctZnJvbS1mYXN0LWxhbmUtbHVkdmlnLWFiZXJncy1yeWRlci1jdXAtbGVnZW5kLWJlZ2lucy1ub3fSAQA?hl=en-IN&gl=IN&ceid=IN%3Aen,2023-09-26
26,What does ex-Prime Minister Nawaz Sharif's return mean for ...,Anadolu Agency | English,news.google.com/articles/CBMifGh0dHBzOi8vd3d3LmFhLmNvbS50ci9lbi9hc2lhLXBhY2lmaWMvd2hhdC1kb2VzLWV4LXByaW1lLW1pbmlzdGVyLW5hd2F6LXNoYXJpZi1zLXJldHVybi1tZWFuLWZvci1wYWtpc3Rhbi1zLXBvbGl0aWNzLzMwMDEyMzjSAQA?hl=en-IN&gl=IN&ceid=IN%3Aen,2023-09-26
24,Ken Roczen On Second Overall At SMX Finale,Racer X Online,news.google.com/articles/CBMiNmh0dHBzOi8vcmFjZXJ4b25saW5lLmNvbS8yMDIzLzA5LzI2L2luc2lnaHQta2VuLXJvY3plbtIBAA?hl=en-IN&gl=IN&ceid=IN%3Aen,2023-09-26
23,News and Notes ahead of NDSU,University of South Dakota Athletics,news.google.com/articles/CBMiTWh0dHBzOi8vZ295b3Rlcy5jb20vbmV3cy8yMDIzLzkvMjYvZm9vdGJhbGwtbmV3cy1hbmQtbm90ZXMtYWhlYWQtb2YtbmRzdS5hc3B40gEA?hl=en-IN&gl=IN&ceid=IN%3Aen,2023-09-26
22,NIU Opens Mid-American Conference Play at Toledo,Northern Illinois University Athletics,news.google.com/articles/CBMiW2h0dHBzOi8vbml1aHVza2llcy5jb20vbmV3cy8yMDIzLzkvMjYvbml1LW9wZW5zLW1pZC1hbWVyaWNhbi1jb25mZXJlbmNlLXBsYXktYXQtdG9sZWRvLmFzcHjSAQA?hl=en-IN&gl=IN&ceid=IN%3Aen,2023-09-26
21,Elon To Host No. 5/4 William & Mary For Family Weekend - Elon ...,Elon University Athletics,news.google.com/articles/CBMiaGh0dHBzOi8vZWxvbnBob2VuaXguY29tL25ld3MvMjAyMy85LzI2L2Zvb3RiYWxsLWVsb24tdG8taG9zdC1uby01LTQtd2lsbGlhbS1tYXJ5LWZvci1mYW1pbHktd2Vla2VuZC5hc3B40gEA?hl=en-IN&gl=IN&ceid=IN%3Aen,2023-09-26
