,title,source,link,date
0,"In conversation with CA Arun Poddar, Executive Director and CEO of ...",Dalal Street Investment Journal,news.google.com/articles/CBMijAFodHRwczovL3d3dy5kc2lqLmluL2RzaWphcnRpY2xlZGV0YWlsL2luLWNvbnZlcnNhdGlvbi13aXRoLWNhLWFydW4tcG9kZGFyLWV4ZWN1dGl2ZS1kaXJlY3Rvci1hbmQtY2VvLW9mLWNob2ljZS1pbnRlcm5hdGlvbmFsLWxpbWl0ZWQtMzQ0MDMtMtIBAA?hl=en-IN&gl=IN&ceid=IN%3Aen,2023-11-07
2,"Stock Market Live: Sensex, Nifty Trade Lower As HDFC, ICICI Bank Drag; Quess Corp Up Over 5%",BQ Prime,news.google.com/articles/CBMinQFodHRwczovL3d3dy5icXByaW1lLmNvbS9tYXJrZXRzL3N0b2NrLW1hcmtldC1saXZlLXVwZGF0ZXMtNy1ub3ZlbWJlci0yMDIzLWdpZnQtbmlmdHktc2lnbmFscy1jYXV0aW91cy1vcGVuLWNpcGxhLWJhamFqLWZpbmFuY2UtcXVlc3MtY29ycC1ocGNsLW55a2FhLWluLWZvY3Vz0gGhAWh0dHBzOi8vd3d3LmJxcHJpbWUuY29tL2FtcC9tYXJrZXRzL3N0b2NrLW1hcmtldC1saXZlLXVwZGF0ZXMtNy1ub3ZlbWJlci0yMDIzLWdpZnQtbmlmdHktc2lnbmFscy1jYXV0aW91cy1vcGVuLWNpcGxhLWJhamFqLWZpbmFuY2UtcXVlc3MtY29ycC1ocGNsLW55a2FhLWluLWZvY3Vz?hl=en-IN&gl=IN&ceid=IN%3Aen,2023-11-07
11,"IRCTC to announce Q2 results, Mamaearth IPO listing: Top News on November 7; share markets, petrol price, Australia vs Afghanistan World Cup match, Chhattisgarh Assembly Elections",Business Today,news.google.com/articles/CBMi7gFodHRwczovL3d3dy5idXNpbmVzc3RvZGF5LmluL3Zpc3VhbHN0b3JpZXMvbmV3cy9pcmN0Yy10by1hbm5vdW5jZS1xMi1yZXN1bHRzLW1hbWFlYXJ0aC1pcG8tbGlzdGluZy10b3AtbmV3cy1vbi1ub3ZlbWJlci03LXNoYXJlLW1hcmtldHMtcGV0cm9sLXByaWNlLWF1c3RyYWxpYS12cy1hZmdoYW5pc3Rhbi13b3JsZC1jdXAtbWF0Y2gtY2hoYXR0aXNnYXJoLWFzc2VtYmx5LWVsZWN0aW9ucy03NDYyMS0wNy0xMS0yMDIz0gHuAWh0dHBzOi8vd3d3LmJ1c2luZXNzdG9kYXkuaW4vdmlzdWFsc3Rvcmllcy9uZXdzL2lyY3RjLXRvLWFubm91bmNlLXEyLXJlc3VsdHMtbWFtYWVhcnRoLWlwby1saXN0aW5nLXRvcC1uZXdzLW9uLW5vdmVtYmVyLTctc2hhcmUtbWFya2V0cy1wZXRyb2wtcHJpY2UtYXVzdHJhbGlhLXZzLWFmZ2hhbmlzdGFuLXdvcmxkLWN1cC1tYXRjaC1jaGhhdHRpc2dhcmgtYXNzZW1ibHktZWxlY3Rpb25zLTc0NjIxLTA3LTExLTIwMjM?hl=en-IN&gl=IN&ceid=IN%3Aen,2023-11-07
13,Fujitsu signs agreement with Andalusian Regional Government to ...,Fujitsu,news.google.com/articles/CBMiVGh0dHBzOi8vd3d3LmZ1aml0c3UuY29tL2dsb2JhbC9hYm91dC9yZXNvdXJjZXMvbmV3cy9wcmVzcy1yZWxlYXNlcy8yMDIzLzExMDctMDEuaHRtbNIBAA?hl=en-IN&gl=IN&ceid=IN%3Aen,2023-11-07
4,"Protean eGov Technologies IPO to open, Max Healthcare, Bikaji Foods Q2 results in Top News on November 6: Colgate-Palmolive (India) among ex-dividend stocks, share markets, Bank Nifty outlook",Business Today,news.google.com/articles/CBMi-QFodHRwczovL3d3dy5idXNpbmVzc3RvZGF5LmluL3Zpc3VhbHN0b3JpZXMvbmV3cy9wcm90ZWFuLWVnb3YtdGVjaG5vbG9naWVzLWlwby10by1vcGVuLW1heC1oZWFsdGhjYXJlLWJpa2FqaS1mb29kcy1xMi1yZXN1bHRzLWluLXRvcC1uZXdzLW9uLW5vdmVtYmVyLTYtY29sZ2F0ZS1wYWxtb2xpdmUtaW5kaWEtYW1vbmctZXgtZGl2aWRlbmQtc3RvY2tzLXNoYXJlLW1hcmtldHMtYmFuay1uaWZ0eS1vdXRsb29rLTc0MDkxLTA2LTExLTIwMjPSAfkBaHR0cHM6Ly93d3cuYnVzaW5lc3N0b2RheS5pbi92aXN1YWxzdG9yaWVzL25ld3MvcHJvdGVhbi1lZ292LXRlY2hub2xvZ2llcy1pcG8tdG8tb3Blbi1tYXgtaGVhbHRoY2FyZS1iaWthamktZm9vZHMtcTItcmVzdWx0cy1pbi10b3AtbmV3cy1vbi1ub3ZlbWJlci02LWNvbGdhdGUtcGFsbW9saXZlLWluZGlhLWFtb25nLWV4LWRpdmlkZW5kLXN0b2Nrcy1zaGFyZS1tYXJrZXRzLWJhbmstbmlmdHktb3V0bG9vay03NDA5MS0wNi0xMS0yMDIz?hl=en-IN&gl=IN&ceid=IN%3Aen,2023-11-06
8,Why Is Germany the Ideal Choice for Managing Your AI Data Center ...,Data Center Knowledge,news.google.com/articles/CBMifGh0dHBzOi8vd3d3LmRhdGFjZW50ZXJrbm93bGVkZ2UuY29tL2luZHVzdHJ5LXBlcnNwZWN0aXZlcy93aHktZ2VybWFueS1pZGVhbC1jaG9pY2UtbWFuYWdpbmcteW91ci1haS1kYXRhLWNlbnRlci1yZXF1aXJlbWVudHPSAQA?hl=en-IN&gl=IN&ceid=IN%3Aen,2023-11-06
14,American Brew Crafts Unveils BlockBuster Ultra Lager,Business Wire India,news.google.com/articles/CBMiYWh0dHBzOi8vd3d3LmJ1c2luZXNzd2lyZWluZGlhLmNvbS9hbWVyaWNhbi1icmV3LWNyYWZ0cy11bnZlaWxzLWJsb2NrYnVzdGVyLXVsdHJhLWxhZ2VyLTg3MzM1Lmh0bWzSAQA?hl=en-IN&gl=IN&ceid=IN%3Aen,2023-11-06
16,A model-independent redundancy measure for human versus ...,Nature.com,news.google.com/articles/CBMiMmh0dHBzOi8vd3d3Lm5hdHVyZS5jb20vYXJ0aWNsZXMvczQxNTk4LTAyMy00NjM5MC040gEA?hl=en-IN&gl=IN&ceid=IN%3Aen,2023-11-06
18,Effective optimization of irrigation networks with pressure-driven ...,Nature.com,news.google.com/articles/CBMiMmh0dHBzOi8vd3d3Lm5hdHVyZS5jb20vYXJ0aWNsZXMvczQxNTk4LTAyMy00NTg0NC0z0gEA?hl=en-IN&gl=IN&ceid=IN%3Aen,2023-11-06
9,Choice Hotels Calls on Wyndham Hotels & Resorts to Engage in ...,PR Newswire,news.google.com/articles/CBMif2h0dHBzOi8vd3d3LnBybmV3c3dpcmUuY29tL25ld3MtcmVsZWFzZXMvY2hvaWNlLWhvdGVscy1jYWxscy1vbi13eW5kaGFtLWhvdGVscy0tcmVzb3J0cy10by1lbmdhZ2UtaW4tZGlzY3Vzc2lvbnMtMzAxOTY3ODU5Lmh0bWzSAQA?hl=en-IN&gl=IN&ceid=IN%3Aen,2023-10-25
