,title,source,link,date
3,Validation of a short version of the Lee fatigue scale in adults living ...,BMC Public Health,news.google.com/articles/CBMiTWh0dHBzOi8vYm1jcHVibGljaGVhbHRoLmJpb21lZGNlbnRyYWwuY29tL2FydGljbGVzLzEwLjExODYvczEyODg5LTAyMy0xNzAzNi0x0gEA?hl=en-IN&gl=IN&ceid=IN%3Aen,2023-10-31
5,Reducing the rate of central line-associated bloodstream infections ...,BMC Infectious Diseases,news.google.com/articles/CBMiSmh0dHBzOi8vYm1jaW5mZWN0ZGlzLmJpb21lZGNlbnRyYWwuY29tL2FydGljbGVzLzEwLjExODYvczEyODc5LTAyMy0wODc0NC010gEA?hl=en-IN&gl=IN&ceid=IN%3Aen,2023-10-30
11,Family engagement in care for medical trainees and early career ...,BMC Medical Education,news.google.com/articles/CBMiSGh0dHBzOi8vYm1jbWVkZWR1Yy5iaW9tZWRjZW50cmFsLmNvbS9hcnRpY2xlcy8xMC4xMTg2L3MxMjkwOS0wMjMtMDQ3OTItMtIBAA?hl=en-IN&gl=IN&ceid=IN%3Aen,2023-10-27
7,Metaverse Market is set to grow by USD 1.15 Billion- Technavio,IT News Online,news.google.com/articles/CBMibGh0dHA6Ly93d3cuaXRuZXdzb25saW5lLmNvbS9QUk5ld3N3aXJlL01ldGF2ZXJzZS1NYXJrZXQtaXMtc2V0LXRvLWdyb3ctYnktVVNELTEuMTUtQmlsbGlvbi0tVGVjaG5hdmlvLzk1MzU3M9IBAA?hl=en-IN&gl=IN&ceid=IN%3Aen,2023-10-26
9,Underrepresentation of blind and deaf participants in the All of Us ...,Nature.com,news.google.com/articles/CBMiMmh0dHBzOi8vd3d3Lm5hdHVyZS5jb20vYXJ0aWNsZXMvczQxNTkxLTAyMy0wMjYwNy140gEA?hl=en-IN&gl=IN&ceid=IN%3Aen,2023-10-26
