,title,source,link,date
0,Metaverse Market is set to grow by USD 1.15 Billion- Technavio,Longview News-Journal,news.google.com/articles/CBMijQFodHRwczovL3d3dy5uZXdzLWpvdXJuYWwuY29tL21ldGF2ZXJzZS1tYXJrZXQtaXMtc2V0LXRvLWdyb3ctYnktdXNkLTEtMTUtYmlsbGlvbi0tdGVjaG5hdmlvL2FydGljbGVfODYxYzNlNWMtOTI3NC01NWU4LWEzNTYtMDE3MTIzNjQ1N2RkLmh0bWzSAQA?hl=en-IN&gl=IN&ceid=IN%3Aen,2023-10-26
4,Underrepresentation of blind and deaf participants in the All of Us ...,Nature.com,news.google.com/articles/CBMiMmh0dHBzOi8vd3d3Lm5hdHVyZS5jb20vYXJ0aWNsZXMvczQxNTkxLTAyMy0wMjYwNy140gEA?hl=en-IN&gl=IN&ceid=IN%3Aen,2023-10-26
6,"Knowledge, perception, and willingness to provide telepharmacy ...",BMC Medical Education,news.google.com/articles/CBMiSGh0dHBzOi8vYm1jbWVkZWR1Yy5iaW9tZWRjZW50cmFsLmNvbS9hcnRpY2xlcy8xMC4xMTg2L3MxMjkwOS0wMjMtMDQ3OTAtNNIBAA?hl=en-IN&gl=IN&ceid=IN%3Aen,2023-10-26
8,A pill as a quick solution: association between painkiller intake ...,Nature.com,news.google.com/articles/CBMiMmh0dHBzOi8vd3d3Lm5hdHVyZS5jb20vYXJ0aWNsZXMvczQxNTk4LTAyMy00NTI2Ny0w0gEA?hl=en-IN&gl=IN&ceid=IN%3Aen,2023-10-26
9,Identification of PCB congeners and their thresholds associated with ...,Nature.com,news.google.com/articles/CBMiMmh0dHBzOi8vd3d3Lm5hdHVyZS5jb20vYXJ0aWNsZXMvczQxNTk4LTAyMy00NTMwMS0x0gEA?hl=en-IN&gl=IN&ceid=IN%3Aen,2023-10-26
5,Comparison of students' readiness from six health education ...,BMC Medical Education,news.google.com/articles/CBMiSGh0dHBzOi8vYm1jbWVkZWR1Yy5iaW9tZWRjZW50cmFsLmNvbS9hcnRpY2xlcy8xMC4xMTg2L3MxMjkwOS0wMjMtMDQ3NzYtMtIBAA?hl=en-IN&gl=IN&ceid=IN%3Aen,2023-10-25
13,Contraceptives Knowledge and Perception in Jordan | OAJC,Dove Medical Press,news.google.com/articles/CBMihAFodHRwczovL3d3dy5kb3ZlcHJlc3MuY29tL2NvbnRyYWNlcHRpdmVzLWtub3dsZWRnZS1hbmQtcGVyY2VwdGlvbi1hLWNyb3NzLXNlY3Rpb25hbC1zdHVkeS1hbW9uZy0tcGVlci1yZXZpZXdlZC1mdWxsdGV4dC1hcnRpY2xlLU9BSkPSAQA?hl=en-IN&gl=IN&ceid=IN%3Aen,2023-10-24
31,Rewind: Reimagining Multidimensional Poverty Index-Telangana,Telangana Today,news.google.com/articles/CBMiTGh0dHBzOi8vdGVsYW5nYW5hdG9kYXkuY29tL3Jld2luZC1yZWltYWdpbmluZy1tdWx0aWRpbWVuc2lvbmFsLXBvdmVydHktaW5kZXjSAQA?hl=en-IN&gl=IN&ceid=IN%3Aen,2023-10-21
