,title,source,link,date
5,"Quality of life, people living with HIV on antiretrovirals | HIV",Dove Medical Press,news.google.com/articles/CBMigwFodHRwczovL3d3dy5kb3ZlcHJlc3MuY29tL3F1YWxpdHktb2YtbGlmZS1vZi1wZW9wbGUtbGl2aW5nLXdpdGgtaGl2LW9uLWFudGlyZXRyb3ZpcmFsLXRoZXJhcHktYS0tcGVlci1yZXZpZXdlZC1mdWxsdGV4dC1hcnRpY2xlLUhJVtIBAA?hl=en-IN&gl=IN&ceid=IN%3Aen,2023-11-10
6,Coverage with Selected Vaccines and Exemption from School ...,CDC,news.google.com/articles/CBMiRGh0dHBzOi8vd3d3LmNkYy5nb3YvbW13ci92b2x1bWVzLzcyL3dyL21tNzI0NWEyLmh0bT9zX2NpZD1tbTcyNDVhMl930gEA?hl=en-IN&gl=IN&ceid=IN%3Aen,2023-11-09
8,Emphatic information on bone mineral loss using quantitative ...,Nature.com,news.google.com/articles/CBMiMmh0dHBzOi8vd3d3Lm5hdHVyZS5jb20vYXJ0aWNsZXMvczQxNTk4LTAyMy00NDQwNy130gEA?hl=en-IN&gl=IN&ceid=IN%3Aen,2023-11-08
12,Construct validity of a questionnaire for measuring student ...,BMC Medical Education,news.google.com/articles/CBMiSGh0dHBzOi8vYm1jbWVkZWR1Yy5iaW9tZWRjZW50cmFsLmNvbS9hcnRpY2xlcy8xMC4xMTg2L3MxMjkwOS0wMjMtMDQ4MjAtMdIBAA?hl=en-IN&gl=IN&ceid=IN%3Aen,2023-11-07
0,"CL Educate Limited Appoints Manish Gupta, as Executive Vice ...",Marketscreener.com,news.google.com/articles/CBMimgFodHRwczovL3d3dy5tYXJrZXRzY3JlZW5lci5jb20vcXVvdGUvc3RvY2svQ0wtRURVQ0FURS1MSU1JVEVELTM0NzI4NTE4L25ld3MvQ0wtRWR1Y2F0ZS1MaW1pdGVkLUFwcG9pbnRzLU1hbmlzaC1HdXB0YS1hcy1FeGVjdXRpdmUtVmljZS1QcmVzaWRlbnQtNDUyMzgxMDgv0gEA?hl=en-IN&gl=IN&ceid=IN%3Aen,2023-11-03
