,title,source,link,date
7,The future landscape of large language models in medicine ...,Nature.com,news.google.com/articles/CBMiMmh0dHBzOi8vd3d3Lm5hdHVyZS5jb20vYXJ0aWNsZXMvczQzODU2LTAyMy0wMDM3MC0x0gEA?hl=en-IN&gl=IN&ceid=IN%3Aen,2023-10-10
8,Tele-mentoring - a way to expand laparoscopic simulator training for ...,BMC Medical Education,news.google.com/articles/CBMiSGh0dHBzOi8vYm1jbWVkZWR1Yy5iaW9tZWRjZW50cmFsLmNvbS9hcnRpY2xlcy8xMC4xMTg2L3MxMjkwOS0wMjMtMDQ3MTkteNIBAA?hl=en-IN&gl=IN&ceid=IN%3Aen,2023-10-10
10,The effects of weight loss on health-related quality of life in obese ...,BioMed Central,news.google.com/articles/CBMiTWh0dHBzOi8vYm1jd29tZW5zaGVhbHRoLmJpb21lZGNlbnRyYWwuY29tL2FydGljbGVzLzEwLjExODYvczEyOTA1LTAyMy0wMjY4Mi050gEA?hl=en-IN&gl=IN&ceid=IN%3Aen,2023-10-10
14,Musculoskeletal Pain Market Set to Observe Remunerative Growth ...,GlobeNewswire,news.google.com/articles/CBMitQFodHRwczovL3d3dy5nbG9iZW5ld3N3aXJlLmNvbS9uZXdzLXJlbGVhc2UvMjAyMy8xMC8xMC8yNzU3ODI1LzAvZW4vTXVzY3Vsb3NrZWxldGFsLVBhaW4tTWFya2V0LVNldC10by1PYnNlcnZlLVJlbXVuZXJhdGl2ZS1Hcm93dGgtRHVyaW5nLXRoZS1TdHVkeS1QZXJpb2QtMjAxOS0yMDMyLURlbHZlSW5zaWdodC5odG1s0gEA?hl=en-IN&gl=IN&ceid=IN%3Aen,2023-10-10
17,GM Breweries falls 9% after Q2 profit declines in September quarter,Republic World,news.google.com/articles/CBMiYWh0dHBzOi8vd3d3LnJlcHVibGljd29ybGQuY29tL2J1c2luZXNzL21hcmtldHMvZ20tYnJld2VyaWVzLWZhbGxzLTktYWZ0ZXItcTItcHJvZml0LWRlY2xpbmVzLm5ld3PSAQA?hl=en-IN&gl=IN&ceid=IN%3Aen,2023-10-10
13,Recognising and managing osteoarthritis flares in primary care,The BMJ,news.google.com/articles/CBMiL2h0dHBzOi8vd3d3LmJtai5jb20vY29udGVudC8zODMvYm1qLTIwMjMtMDc2NDU10gEA?hl=en-IN&gl=IN&ceid=IN%3Aen,2023-10-09
