,title,source,link,date
5,Associations of screen-based sedentary activities with all cause ...,BMC Public Health,news.google.com/articles/CBMiTWh0dHBzOi8vYm1jcHVibGljaGVhbHRoLmJpb21lZGNlbnRyYWwuY29tL2FydGljbGVzLzEwLjExODYvczEyODg5LTAyMy0xNzA1MC0z0gEA?hl=en-IN&gl=IN&ceid=IN%3Aen,2023-11-02
7,NSW Government Bulletin: Commencement of the PID Act 2022 in ...,Lexology,news.google.com/articles/CBMiU2h0dHBzOi8vd3d3LmxleG9sb2d5LmNvbS9saWJyYXJ5L2RldGFpbC5hc3B4P2c9YjQ1MWM4ZTItN2UzZC00MjYwLWE1OTktNThkMDQ0MTcwY2Zm0gEA?hl=en-IN&gl=IN&ceid=IN%3Aen,2023-11-02
8,Seminole Tribe of Florida will introduce sports betting at casinos ...,Creative Loafing Tampa,news.google.com/articles/CBMic2h0dHBzOi8vd3d3LmNsdGFtcGEuY29tL25ld3Mvc2VtaW5vbGUtdHJpYmUtb2YtZmxvcmlkYS13aWxsLWludHJvZHVjZS1zcG9ydHMtYmV0dGluZy1hdC1jYXNpbm9zLW5leHQtbW9udGgtMTY2Mjc3MjHSAQA?hl=en-IN&gl=IN&ceid=IN%3Aen,2023-11-02
10,APA Council Reports | American Journal of Psychiatry,Am J Psychiatry,news.google.com/articles/CBMiPmh0dHBzOi8vYWpwLnBzeWNoaWF0cnlvbmxpbmUub3JnL2RvaS8xMC4xMTc2L2FwcGkuYWpwLjIzMTgwMDEx0gEA?hl=en-IN&gl=IN&ceid=IN%3Aen,2023-11-01
11,Comparative study of posaconazole and voriconazole for primary ...,Nature.com,news.google.com/articles/CBMiMmh0dHBzOi8vd3d3Lm5hdHVyZS5jb20vYXJ0aWNsZXMvczQxNTk4LTAyMy00NjMyOC0w0gEA?hl=en-IN&gl=IN&ceid=IN%3Aen,2023-11-01
