,title,source,link,date
19,"U.S. Drinking Water Often Contains Toxic Contaminants, Scientists ...",Technology Networks,news.google.com/articles/CBMigwFodHRwczovL3d3dy50ZWNobm9sb2d5bmV0d29ya3MuY29tL2FwcGxpZWQtc2NpZW5jZXMvbmV3cy91cy1kcmlua2luZy13YXRlci1vZnRlbi1jb250YWlucy10b3hpYy1jb250YW1pbmFudHMtc2NpZW50aXN0cy13YXJuLTM3OTU1NtIBAA?hl=en-IN&gl=IN&ceid=IN%3Aen,2023-10-05
25,Why False Energy Hopes Are Bad for Africa,Foreign Policy,news.google.com/articles/CBMiigFodHRwczovL2ZvcmVpZ25wb2xpY3kuY29tLzIwMjMvMTAvMDUvYWZyaWNhLWNsaW1hdGUtZW5lcmd5LXRyYW5zaXRpb24tcmVuZXdhYmxlLXdpbmQtc29sYXItZm9zc2lsLWZ1ZWxzLW5ldC16ZXJvLz90cGNjPXJlY2lyY19sYXRlc3QwNjI5MjHSAQA?hl=en-IN&gl=IN&ceid=IN%3Aen,2023-10-05
32,New technology uses good old-fashioned wind to power giant cargo ...,KGOU,news.google.com/articles/CBMiiwFodHRwczovL3d3dy5rZ291Lm9yZy9zY2llbmNlLXRlY2hub2xvZ3ktYW5kLWVudmlyb25tZW50LzIwMjMtMTAtMDUvbmV3LXRlY2hub2xvZ3ktdXNlcy1nb29kLW9sZC1mYXNoaW9uZWQtd2luZC10by1wb3dlci1naWFudC1jYXJnby12ZXNzZWxz0gEA?hl=en-IN&gl=IN&ceid=IN%3Aen,2023-10-05
35,Why the propane industry is after school buses,Vox.com,news.google.com/articles/CBMiVmh0dHBzOi8vd3d3LnZveC5jb20vY2xpbWF0ZS8yMzg5NjE5Ny9lbGVjdHJpYy1zY2hvb2wtYnVzLXByb3BhbmUtZGllc2VsLXBvbGx1dGlvbi1raWRz0gEA?hl=en-IN&gl=IN&ceid=IN%3Aen,2023-10-05
2,Fundamentally strong stocks in India's top booming sectors to keep ...,Trade Brains,news.google.com/articles/CBMibGh0dHBzOi8vdHJhZGVicmFpbnMuaW4vZmVhdHVyZXMvZnVuZGFtZW50YWxseS1zdHJvbmctc3RvY2tzLWluLWluZGlhcy10b3AtYm9vbWluZy1zZWN0b3JzLXRvLWtlZXAtYW4tZXllLW9uL9IBAA?hl=en-IN&gl=IN&ceid=IN%3Aen,2023-10-04
30,KBR Signs MoU with SolydEra for an Integrated Green Ammonia ...,PR Newswire,news.google.com/articles/CBMilQFodHRwczovL3d3dy5wcm5ld3N3aXJlLmNvbS9uZXdzLXJlbGVhc2VzL2tici1zaWducy1tb3Utd2l0aC1zb2x5ZGVyYS1mb3ItYW4taW50ZWdyYXRlZC1ncmVlbi1hbW1vbmlhLXNvbGlkLW94aWRlLWVsZWN0cm9seXplci1zb2x1dGlvbi0zMDE5NDYyNjcuaHRtbNIBAA?hl=en-IN&gl=IN&ceid=IN%3Aen,2023-10-04
38,Final CHIPS Act Regulations May Provide Insight into Definition of a ...,Mayer Brown,news.google.com/articles/CBMi8wFodHRwczovL3d3dy5tYXllcmJyb3duLmNvbS9lbi9wZXJzcGVjdGl2ZXMtZXZlbnRzL3B1YmxpY2F0aW9ucy8yMDIzLzEwL2ZpbmFsLWNoaXBzLWFjdC1yZWd1bGF0aW9ucy1tYXktcHJvdmlkZS1pbnNpZ2h0LWludG8tZGVmaW5pdGlvbi1vZi1hLWZvcmVpZ24tZW50aXR5LW9mLWNvbmNlcm4taW4tdGhlLWluZmxhdGlvbi1yZWR1Y3Rpb24tYWN0LWFuZC10aGUtaW5mcmFzdHJ1Y3R1cmUtaW52ZXN0bWVudC1hbmQtam9icy1hY3TSAQA?hl=en-IN&gl=IN&ceid=IN%3Aen,2023-10-04
21,Fujitsu and Atmonia discover a novel catalyst candidate for clean ...,Fujitsu,news.google.com/articles/CBMiVGh0dHBzOi8vd3d3LmZ1aml0c3UuY29tL2dsb2JhbC9hYm91dC9yZXNvdXJjZXMvbmV3cy9wcmVzcy1yZWxlYXNlcy8yMDIzLzEwMDMtMDEuaHRtbNIBAA?hl=en-IN&gl=IN&ceid=IN%3Aen,2023-10-03
24,CHIPS and Science: FY24 Research Appropriations Short by Over ...,Federation Of American Scientists,news.google.com/articles/CBMiN2h0dHBzOi8vZmFzLm9yZy9wdWJsaWNhdGlvbi9meTI0LWNoaXBzLXNob3J0LTctYmlsbGlvbi_SAQA?hl=en-IN&gl=IN&ceid=IN%3Aen,2023-10-03
29,Fighting Climate Change Demands Urgent Action in Environmental ...,United Nations,news.google.com/articles/CBMiLWh0dHBzOi8vcHJlc3MudW4ub3JnL2VuLzIwMjMvZ2FlZjM1ODQuZG9jLmh0bdIBAA?hl=en-IN&gl=IN&ceid=IN%3Aen,2023-10-03
