,title,source,link,date
20,China Wind Joins Clean Tech Sectors Caught in Trade Crosshairs,Bloomberg,news.google.com/articles/CBMicWh0dHBzOi8vd3d3LmJsb29tYmVyZy5jb20vbmV3cy9hcnRpY2xlcy8yMDIzLTEwLTExL2NoaW5hLXdpbmQtam9pbnMtY2xlYW4tdGVjaC1zZWN0b3JzLWNhdWdodC1pbi10cmFkZS1jcm9zc2hhaXJz0gEA?hl=en-IN&gl=IN&ceid=IN%3Aen,2023-10-11
27,"No looking back: Energy Transition in SAARC nations Bangladesh, Bhutan, Nepal, Maldives and Sri Lanka",ETN News,news.google.com/articles/CBMiZWh0dHBzOi8vZXRuLm5ld3MvYnV6ei9zYWFyYy1uYXRpb25zLWJhbmdsYWRlc2gtYmh1dGFuLW5lcGFsLW1hbGRpdmVzLXNyaS1sYW5rYS1lbmVyZ3ktdHJhbnNpdGlvbi0yMDIz0gFwaHR0cHM6Ly9ldG4ubmV3cy9idXp6L3NhYXJjLW5hdGlvbnMtYmFuZ2xhZGVzaC1iaHV0YW4tbmVwYWwtbWFsZGl2ZXMtc3JpLWxhbmthLWVuZXJneS10cmFuc2l0aW9uLTIwMjM_Zm9ybWF0PWFtcA?hl=en-IN&gl=IN&ceid=IN%3Aen,2023-10-11
31,"KraneShares Enters German ETF Market, Listing Six UCITS ...",GlobeNewswire,news.google.com/articles/CBMiqgFodHRwczovL3d3dy5nbG9iZW5ld3N3aXJlLmNvbS9uZXdzLXJlbGVhc2UvMjAyMy8xMC8xMS8yNzU4MDQ1LzAvZW4vS3JhbmVTaGFyZXMtRW50ZXJzLUdlcm1hbi1FVEYtTWFya2V0LUxpc3RpbmctU2l4LVVDSVRTLVN0cmF0ZWdpZXMtb24tdGhlLURldXRzY2hlLUIlQzMlQjZyc2UtWGV0cmEuaHRtbNIBAA?hl=en-IN&gl=IN&ceid=IN%3Aen,2023-10-11
23,Commodity-Dependent States Underperforming in Development ...,United Nations,news.google.com/articles/CBMiLWh0dHBzOi8vcHJlc3MudW4ub3JnL2VuLzIwMjMvZ2FlZjM1ODkuZG9jLmh0bdIBAA?hl=en-IN&gl=IN&ceid=IN%3Aen,2023-10-10
29,The Belt and Road Initiative: A Key Pillar of the Global Community of ...,China Daily,news.google.com/articles/CBMiSWh0dHBzOi8vd3d3LmNoaW5hZGFpbHkuY29tLmNuL2EvMjAyMzEwLzExL1dTNjUyNWRlMmJhMzEwOTA2ODJhNWU3ZDAxLmh0bWzSAQA?hl=en-IN&gl=IN&ceid=IN%3Aen,2023-10-10
15,"Widening Digital Gap between Developed, Developing States ...",United Nations,news.google.com/articles/CBMiLWh0dHBzOi8vcHJlc3MudW4ub3JnL2VuLzIwMjMvZ2FlZjM1ODcuZG9jLmh0bdIBAA?hl=en-IN&gl=IN&ceid=IN%3Aen,2023-10-06
6,Fundamentally strong stocks in India's top booming sectors to keep ...,Trade Brains,news.google.com/articles/CBMibGh0dHBzOi8vdHJhZGVicmFpbnMuaW4vZmVhdHVyZXMvZnVuZGFtZW50YWxseS1zdHJvbmctc3RvY2tzLWluLWluZGlhcy10b3AtYm9vbWluZy1zZWN0b3JzLXRvLWtlZXAtYW4tZXllLW9uL9IBAA?hl=en-IN&gl=IN&ceid=IN%3Aen,2023-10-04
52,USAID Power Africa Launches 'Growing Green Jobs' for women in ...,US Embassy and Consulate in Nigeria,news.google.com/articles/CBMicmh0dHBzOi8vbmcudXNlbWJhc3N5Lmdvdi91c2FpZC1wb3dlci1hZnJpY2EtbGF1bmNoZXMtZ3Jvd2luZy1ncmVlbi1qb2JzLWZvci13b21lbi1pbi10aGUtZW5lcmd5LXNlY3Rvci1pbi1uaWdlcmlhL9IBAA?hl=en-IN&gl=IN&ceid=IN%3Aen,2023-09-28
