,title,source,link,date
2,Fundamentally strong stocks in India's top booming sectors to keep ...,Trade Brains,news.google.com/articles/CBMibGh0dHBzOi8vdHJhZGVicmFpbnMuaW4vZmVhdHVyZXMvZnVuZGFtZW50YWxseS1zdHJvbmctc3RvY2tzLWluLWluZGlhcy10b3AtYm9vbWluZy1zZWN0b3JzLXRvLWtlZXAtYW4tZXllLW9uL9IBAA?hl=en-IN&gl=IN&ceid=IN%3Aen,2023-10-04
26,KBR Signs MoU with SolydEra for an Integrated Green Ammonia ...,PR Newswire,news.google.com/articles/CBMilQFodHRwczovL3d3dy5wcm5ld3N3aXJlLmNvbS9uZXdzLXJlbGVhc2VzL2tici1zaWducy1tb3Utd2l0aC1zb2x5ZGVyYS1mb3ItYW4taW50ZWdyYXRlZC1ncmVlbi1hbW1vbmlhLXNvbGlkLW94aWRlLWVsZWN0cm9seXplci1zb2x1dGlvbi0zMDE5NDYyNjcuaHRtbNIBAA?hl=en-IN&gl=IN&ceid=IN%3Aen,2023-10-04
31,NIIFL Launches ~$600 Mn Bi-Lateral India-Japan Fund,IndianWeb2.com,news.google.com/articles/CBMiTmh0dHBzOi8vd3d3LmluZGlhbndlYjIuY29tLzIwMjMvMTAvbmlpZmwtbGF1bmNoZXMtNjAwLW1uLWJpLWxhdGVyYWwtaW5kaWEuaHRtbNIBAA?hl=en-IN&gl=IN&ceid=IN%3Aen,2023-10-04
34,Final CHIPS Act Regulations May Provide Insight into Definition of a ...,Mayer Brown,news.google.com/articles/CBMi8wFodHRwczovL3d3dy5tYXllcmJyb3duLmNvbS9lbi9wZXJzcGVjdGl2ZXMtZXZlbnRzL3B1YmxpY2F0aW9ucy8yMDIzLzEwL2ZpbmFsLWNoaXBzLWFjdC1yZWd1bGF0aW9ucy1tYXktcHJvdmlkZS1pbnNpZ2h0LWludG8tZGVmaW5pdGlvbi1vZi1hLWZvcmVpZ24tZW50aXR5LW9mLWNvbmNlcm4taW4tdGhlLWluZmxhdGlvbi1yZWR1Y3Rpb24tYWN0LWFuZC10aGUtaW5mcmFzdHJ1Y3R1cmUtaW52ZXN0bWVudC1hbmQtam9icy1hY3TSAQA?hl=en-IN&gl=IN&ceid=IN%3Aen,2023-10-04
20,Fujitsu and Atmonia discover a novel catalyst candidate for clean ...,Fujitsu,news.google.com/articles/CBMiVGh0dHBzOi8vd3d3LmZ1aml0c3UuY29tL2dsb2JhbC9hYm91dC9yZXNvdXJjZXMvbmV3cy9wcmVzcy1yZWxlYXNlcy8yMDIzLzEwMDMtMDEuaHRtbNIBAA?hl=en-IN&gl=IN&ceid=IN%3Aen,2023-10-03
23,CHIPS and Science: FY24 Research Appropriations Short by Over ...,Federation Of American Scientists,news.google.com/articles/CBMiN2h0dHBzOi8vZmFzLm9yZy9wdWJsaWNhdGlvbi9meTI0LWNoaXBzLXNob3J0LTctYmlsbGlvbi_SAQA?hl=en-IN&gl=IN&ceid=IN%3Aen,2023-10-03
27,Fighting Climate Change Demands Urgent Action in Environmental ...,United Nations,news.google.com/articles/CBMiLWh0dHBzOi8vcHJlc3MudW4ub3JnL2VuLzIwMjMvZ2FlZjM1ODQuZG9jLmh0bdIBAA?hl=en-IN&gl=IN&ceid=IN%3Aen,2023-10-03
35,"Clean Energy Market Size, Share, Growth Analysis, Demand ...",Digital Journal,news.google.com/articles/CBMiiQFodHRwczovL3d3dy5kaWdpdGFsam91cm5hbC5jb20vcHIvbmV3cy9uZXdzbWFudHJhYS9jbGVhbi1lbmVyZ3ktbWFya2V0LXNpemUtc2hhcmUtZ3Jvd3RoLWFuYWx5c2lzLWRlbWFuZC1vcHBvcnR1bml0eS1hbmQtZm9yZWNhc3QtdG8tMjAyN9IBAA?hl=en-IN&gl=IN&ceid=IN%3Aen,2023-10-03
21,Researchers develop new technology to clean up big pharma and create new ‘green’ drugs: ‘This is not limited to pharmaceuticals’,Yahoo News,news.google.com/articles/CBMiTmh0dHBzOi8vbmV3cy55YWhvby5jb20vcmVzZWFyY2hlcnMtZGV2ZWxvcC10ZWNobm9sb2d5LWNsZWFuLWJpZy0xMTMwMDAxMTEuaHRtbNIBVmh0dHBzOi8vbmV3cy55YWhvby5jb20vYW1waHRtbC9yZXNlYXJjaGVycy1kZXZlbG9wLXRlY2hub2xvZ3ktY2xlYW4tYmlnLTExMzAwMDExMS5odG1s?hl=en-IN&gl=IN&ceid=IN%3Aen,2023-09-29
37,Initiative to foster clean energy jobs for women and youth in Nigeria,ESI-Africa.com,news.google.com/articles/CBMibWh0dHBzOi8vd3d3LmVzaS1hZnJpY2EuY29tL3dlc3QtYWZyaWNhL2luaXRpYXRpdmUtdG8tZm9zdGVyLWNsZWFuLWVuZXJneS1qb2JzLWZvci13b21lbi1hbmQteW91dGgtaW4tbmlnZXJpYS_SAXNodHRwczovL3d3dy5lc2ktYWZyaWNhLmNvbS93ZXN0LWFmcmljYS9pbml0aWF0aXZlLXRvLWZvc3Rlci1jbGVhbi1lbmVyZ3ktam9icy1mb3Itd29tZW4tYW5kLXlvdXRoLWluLW5pZ2VyaWEvP2FtcD0x?hl=en-IN&gl=IN&ceid=IN%3Aen,2023-09-29
