,title,source,link,date
5,Researchers develop new technology to clean up big pharma and create new ‘green’ drugs: ‘This is not limited to pharmaceuticals’,Yahoo News,news.google.com/articles/CBMiTmh0dHBzOi8vbmV3cy55YWhvby5jb20vcmVzZWFyY2hlcnMtZGV2ZWxvcC10ZWNobm9sb2d5LWNsZWFuLWJpZy0xMTMwMDAxMTEuaHRtbNIBVmh0dHBzOi8vbmV3cy55YWhvby5jb20vYW1waHRtbC9yZXNlYXJjaGVycy1kZXZlbG9wLXRlY2hub2xvZ3ktY2xlYW4tYmlnLTExMzAwMDExMS5odG1s?hl=en-IN&gl=IN&ceid=IN%3Aen,2023-09-29
28,Lawrence Livermore grabs two spots in DOE's Energy Earthshot ...,Lawrence Livermore National Laboratory (.gov),news.google.com/articles/CBMiY2h0dHBzOi8vd3d3LmxsbmwuZ292L2FydGljbGUvNTA0MTEvbGF3cmVuY2UtbGl2ZXJtb3JlLWdyYWJzLXR3by1zcG90cy1kb2VzLWVuZXJneS1lYXJ0aHNob3QtcHJvZ3JhbdIBAA?hl=en-IN&gl=IN&ceid=IN%3Aen,2023-09-29
14,Apple and Acumen Ignite Clean Energy Innovation for India’s Marginalized Communities,Times Now,news.google.com/articles/CBMibWh0dHBzOi8vd3d3LnRpbWVzbm93bmV3cy5jb20vdGVjaG5vbG9neS1zY2llbmNlL2FwcGxlLWFjdW1lbi1jbGVhbi1lbmVyZ3ktYWNjZWxlcmF0b3ItaW5kaWEtYXJ0aWNsZS0xMDQwMzY3MznSAXFodHRwczovL3d3dy50aW1lc25vd25ld3MuY29tL3RlY2hub2xvZ3ktc2NpZW5jZS9hcHBsZS1hY3VtZW4tY2xlYW4tZW5lcmd5LWFjY2VsZXJhdG9yLWluZGlhLWFydGljbGUtMTA0MDM2NzM5L2FtcA?hl=en-IN&gl=IN&ceid=IN%3Aen,2023-09-29
60,"Perry Public Library, Carnegie Library Museum announce October ...",Des Moines Register,news.google.com/articles/CBMinAFodHRwczovL3d3dy5kZXNtb2luZXNyZWdpc3Rlci5jb20vc3RvcnkvbmV3cy9sb2NhbC9wZXJyeS8yMDIzLzA5LzI5L3BlcnJ5LXB1YmxpYy1saWJyYXJ5LWNhcm5lZ2llLWxpYnJhcnktbXVzZXVtLWFubm91bmNlLW9jdG9iZXItMjAyMy1wcm9ncmFtcy83MDkwNTUwNzAwNy_SAQA?hl=en-IN&gl=IN&ceid=IN%3Aen,2023-09-29
37,Secretary Antony J. Blinken With Mexican Foreign Secretary Alicia ...,Department of State,news.google.com/articles/CBMi2QFodHRwczovL3d3dy5zdGF0ZS5nb3Yvc2VjcmV0YXJ5LWFudG9ueS1qLWJsaW5rZW4td2l0aC1tZXhpY2FuLWZvcmVpZ24tc2VjcmV0YXJ5LWFsaWNpYS1iYXJjZW5hLXNlY3JldGFyeS1vZi1jb21tZXJjZS1naW5hLXJhaW1vbmRvLW1leGljYW4tc2VjcmV0YXJ5LW9mLWVjb25vbXktcmFxdWVsLWJ1ZW5yb3N0cm8tYW5kLXUtcy10cmFkZS1yZXByZXNlbnRhdGl2ZS1rYXRoZXJpbmUv0gEA?hl=en-IN&gl=IN&ceid=IN%3Aen,2023-09-29
21,Initiative to foster clean energy jobs for women and youth in Nigeria,ESI-Africa.com,news.google.com/articles/CBMibWh0dHBzOi8vd3d3LmVzaS1hZnJpY2EuY29tL3dlc3QtYWZyaWNhL2luaXRpYXRpdmUtdG8tZm9zdGVyLWNsZWFuLWVuZXJneS1qb2JzLWZvci13b21lbi1hbmQteW91dGgtaW4tbmlnZXJpYS_SAXNodHRwczovL3d3dy5lc2ktYWZyaWNhLmNvbS93ZXN0LWFmcmljYS9pbml0aWF0aXZlLXRvLWZvc3Rlci1jbGVhbi1lbmVyZ3ktam9icy1mb3Itd29tZW4tYW5kLXlvdXRoLWluLW5pZ2VyaWEvP2FtcD0x?hl=en-IN&gl=IN&ceid=IN%3Aen,2023-09-29
24,Deeptech startup oorja raises $1.5 million in pre-Series A funding,CIO News,news.google.com/articles/CBMiQGh0dHBzOi8vY2lvbmV3cy5jby5pbi9kZWVwdGVjaC1zdGFydHVwLW9vcmphLXJhaXNlcy0xLTUtbWlsbGlvbi_SAQA?hl=en-IN&gl=IN&ceid=IN%3Aen,2023-09-29
36,2023 Scientific Forum: Nuclear Innovations for Net Zero,International Atomic Energy Agency,news.google.com/articles/CBMiW2h0dHBzOi8vd3d3LmlhZWEub3JnL25ld3NjZW50ZXIvbmV3cy8yMDIzLXNjaWVudGlmaWMtZm9ydW0tbnVjbGVhci1pbm5vdmF0aW9ucy1mb3ItbmV0LXplcm_SAQA?hl=en-IN&gl=IN&ceid=IN%3Aen,2023-09-28
35,NETL Scientist Participates in Research Experience in Carbon ...,National Energy Technology Laboratory,news.google.com/articles/CBMiH2h0dHBzOi8vbmV0bC5kb2UuZ292L25vZGUvMTI5MjnSAQA?hl=en-IN&gl=IN&ceid=IN%3Aen,2023-09-28
82,Sree Rayalaseema Hi-Strength Hypo Ltd Share Price Today ...,Business Today,news.google.com/articles/CBMiZ2h0dHBzOi8vd3d3LmJ1c2luZXNzdG9kYXkuaW4vc3RvY2tzL3NyZWUtcmF5YWxhc2VlbWEtaGktc3RyZW5ndGgtaHlwby1sdGQtc3JoaHlwb2x0ZC1zaGFyZS1wcmljZS0zNjM1MDLSAQA?hl=en-IN&gl=IN&ceid=IN%3Aen,2023-09-28
