,title,source,link,date
9,[Latest] Global Smart Grid Market Size/Share Worth USD 185.6 ...,GlobeNewswire,news.google.com/articles/CBMi_AFodHRwczovL3d3dy5nbG9iZW5ld3N3aXJlLmNvbS9uZXdzLXJlbGVhc2UvMjAyMy8xMS8wOS8yNzc2OTE3LzAvZW4vTGF0ZXN0LUdsb2JhbC1TbWFydC1HcmlkLU1hcmtldC1TaXplLVNoYXJlLVdvcnRoLVVTRC0xODUtNi1CaWxsaW9uLWJ5LTIwMzItYXQtYS02LTc1LUNBR1ItQ3VzdG9tLU1hcmtldC1JbnNpZ2h0cy1BbmFseXNpcy1PdXRsb29rLUxlYWRlcnMtUmVwb3J0LVRyZW5kcy1Gb3JlY2FzdC1TZWdtZW50YXRpb24tR3Jvd3RoLmh0bWzSAQA?hl=en-IN&gl=IN&ceid=IN%3Aen,2023-11-09
17,Metal And Metal Oxide Nanoparticles Market: Driving Innovations in Nanomaterials | American Elements,EIN News,news.google.com/articles/CBMiiwFodHRwczovL3d3dy5laW5uZXdzLmNvbS9wcl9uZXdzLzY2NzM3Mzg3OC9tZXRhbC1hbmQtbWV0YWwtb3hpZGUtbmFub3BhcnRpY2xlcy1tYXJrZXQtZHJpdmluZy1pbm5vdmF0aW9ucy1pbi1uYW5vbWF0ZXJpYWxzLWFtZXJpY2FuLWVsZW1lbnRz0gGPAWh0dHBzOi8vd3d3LmVpbm5ld3MuY29tL2FtcC9wcl9uZXdzLzY2NzM3Mzg3OC9tZXRhbC1hbmQtbWV0YWwtb3hpZGUtbmFub3BhcnRpY2xlcy1tYXJrZXQtZHJpdmluZy1pbm5vdmF0aW9ucy1pbi1uYW5vbWF0ZXJpYWxzLWFtZXJpY2FuLWVsZW1lbnRz?hl=en-IN&gl=IN&ceid=IN%3Aen,2023-11-09
5,Efficacy and safety of therapies for COVID-19 in pregnancy: a ...,BMC Infectious Diseases,news.google.com/articles/CBMiSmh0dHBzOi8vYm1jaW5mZWN0ZGlzLmJpb21lZGNlbnRyYWwuY29tL2FydGljbGVzLzEwLjExODYvczEyODc5LTAyMy0wODc0Ny0y0gEA?hl=en-IN&gl=IN&ceid=IN%3Aen,2023-11-09
15,"Electrical Steel Market: Powering the Future of Electrical Infrastructure | NLMK, Voestalpine AG, POSCO, Nippo",openPR,news.google.com/articles/CBMiXWh0dHBzOi8vd3d3Lm9wZW5wci5jb20vbmV3cy8zMjgyNjQ0L2VsZWN0cmljYWwtc3RlZWwtbWFya2V0LXBvd2VyaW5nLXRoZS1mdXR1cmUtb2YtZWxlY3RyaWNhbNIBXGh0dHBzOi8vd3d3Lm9wZW5wci5jb20vYW1wLzMyODI2NDQvZWxlY3RyaWNhbC1zdGVlbC1tYXJrZXQtcG93ZXJpbmctdGhlLWZ1dHVyZS1vZi1lbGVjdHJpY2Fs?hl=en-IN&gl=IN&ceid=IN%3Aen,2023-11-09
11,"Amines Market: Diversifying Applications and Fueling Industry Growth | Arkema SA, AkzoNobel N.V., Alkyl Amines",openPR,news.google.com/articles/CBMiYGh0dHBzOi8vd3d3Lm9wZW5wci5jb20vbmV3cy8zMjgyOTM3L2FtaW5lcy1tYXJrZXQtZGl2ZXJzaWZ5aW5nLWFwcGxpY2F0aW9ucy1hbmQtZnVlbGluZy1pbmR1c3RyedIBX2h0dHBzOi8vd3d3Lm9wZW5wci5jb20vYW1wLzMyODI5MzcvYW1pbmVzLW1hcmtldC1kaXZlcnNpZnlpbmctYXBwbGljYXRpb25zLWFuZC1mdWVsaW5nLWluZHVzdHJ5?hl=en-IN&gl=IN&ceid=IN%3Aen,2023-11-09
10,Domestic parasitic infections in patients with asthma | JAA,Dove Medical Press,news.google.com/articles/CBMigwFodHRwczovL3d3dy5kb3ZlcHJlc3MuY29tL2RvbWVzdGljLXBhcmFzaXRpYy1pbmZlY3Rpb25zLWluLXBhdGllbnRzLXdpdGgtYXN0aG1hLWFuZC1lb3Npbm9waGlsaWEtcGVlci1yZXZpZXdlZC1mdWxsdGV4dC1hcnRpY2xlLUpBQdIBAA?hl=en-IN&gl=IN&ceid=IN%3Aen,2023-11-08
24,"E-Commerce Packaging Market Size, Share & Trends Analysis, Growing Industry Demand, and Segment Forecast till",openPR,news.google.com/articles/CBMiWmh0dHBzOi8vd3d3Lm9wZW5wci5jb20vbmV3cy8zMjgwNTgwL2UtY29tbWVyY2UtcGFja2FnaW5nLW1hcmtldC1zaXplLXNoYXJlLXRyZW5kcy1hbmFseXNpc9IBWWh0dHBzOi8vd3d3Lm9wZW5wci5jb20vYW1wLzMyODA1ODAvZS1jb21tZXJjZS1wYWNrYWdpbmctbWFya2V0LXNpemUtc2hhcmUtdHJlbmRzLWFuYWx5c2lz?hl=en-IN&gl=IN&ceid=IN%3Aen,2023-11-08
16,"Water Soluble Npk Fertilizers Market Growth and Trends by 2023-2030, Competitive Strategies, and Research Meth",openPR,news.google.com/articles/CBMiWmh0dHBzOi8vd3d3Lm9wZW5wci5jb20vbmV3cy8zMjgwNjAwL3dhdGVyLXNvbHVibGUtbnBrLWZlcnRpbGl6ZXJzLW1hcmtldC1ncm93dGgtYW5kLXRyZW5kc9IBWWh0dHBzOi8vd3d3Lm9wZW5wci5jb20vYW1wLzMyODA2MDAvd2F0ZXItc29sdWJsZS1ucGstZmVydGlsaXplcnMtbWFya2V0LWdyb3d0aC1hbmQtdHJlbmRz?hl=en-IN&gl=IN&ceid=IN%3Aen,2023-11-08
28,"Automotive Interior Materials Market Share, Business Statistics, Product Scope, Growth Prediction and Challeng",openPR,news.google.com/articles/CBMiV2h0dHBzOi8vd3d3Lm9wZW5wci5jb20vbmV3cy8zMjgwNTY4L2F1dG9tb3RpdmUtaW50ZXJpb3ItbWF0ZXJpYWxzLW1hcmtldC1zaGFyZS1idXNpbmVzc9IBVmh0dHBzOi8vd3d3Lm9wZW5wci5jb20vYW1wLzMyODA1NjgvYXV0b21vdGl2ZS1pbnRlcmlvci1tYXRlcmlhbHMtbWFya2V0LXNoYXJlLWJ1c2luZXNz?hl=en-IN&gl=IN&ceid=IN%3Aen,2023-11-08
8,Long-term outcomes of an educational paediatric antimicrobial ...,Archives of Disease in Childhood,news.google.com/articles/CBMiRWh0dHBzOi8vYWRjLmJtai5jb20vY29udGVudC9lYXJseS8yMDIzLzExLzA3L2FyY2hkaXNjaGlsZC0yMDIyLTMyMzgwMtIBAA?hl=en-IN&gl=IN&ceid=IN%3Aen,2023-11-08
