,title,source,link,date
5,Herpes Zoster and COVID-19 vaccination | CCID,Dove Medical Press,news.google.com/articles/CBMid2h0dHBzOi8vd3d3LmRvdmVwcmVzcy5jb20vaGVycGVzLXpvc3Rlci1hbmQtY292aWQtMTktdmFjY2luYXRpb24tYS1uYXJyYXRpdmUtcmV2aWV3LXBlZXItcmV2aWV3ZWQtZnVsbHRleHQtYXJ0aWNsZS1DQ0lE0gEA?hl=en-IN&gl=IN&ceid=IN%3Aen,2023-11-16
6,"Carbon Fiber Reinforced Plastics (CFRP) Market Growth Strategies, Top Key Players, Competitive Analysis and Pr",openPR,news.google.com/articles/CBMiV2h0dHBzOi8vd3d3Lm9wZW5wci5jb20vbmV3cy8zMjkwMTUyL2NhcmJvbi1maWJlci1yZWluZm9yY2VkLXBsYXN0aWNzLWNmcnAtbWFya2V0LWdyb3d0aNIBVmh0dHBzOi8vd3d3Lm9wZW5wci5jb20vYW1wLzMyOTAxNTIvY2FyYm9uLWZpYmVyLXJlaW5mb3JjZWQtcGxhc3RpY3MtY2ZycC1tYXJrZXQtZ3Jvd3Ro?hl=en-IN&gl=IN&ceid=IN%3Aen,2023-11-16
8,"Luxury Travel Market Growth Assessment, Industry Trends ...",Kalkine Media,news.google.com/articles/CBMimAFodHRwczovL2thbGtpbmVtZWRpYS5jb20vbmV3cy93b3JsZC1uZXdzL2x1eHVyeS10cmF2ZWwtbWFya2V0LWdyb3d0aC1hc3Nlc3NtZW50LWluZHVzdHJ5LXRyZW5kcy1jaGFuZ2luZy1kZXZlbG9wbWVudC1zdHJhdGVnaWVzLWJ5LTIwMzAtdHJhdmNvYS10dS1lbGl0ZdIBAA?hl=en-IN&gl=IN&ceid=IN%3Aen,2023-11-16
13,"Europe Sporting Goods Market Analysis 2023, Rising Industry Share, Business Statistics and Major Key Players -",openPR,news.google.com/articles/CBMiXmh0dHBzOi8vd3d3Lm9wZW5wci5jb20vbmV3cy8zMjkwMTg1L2V1cm9wZS1zcG9ydGluZy1nb29kcy1tYXJrZXQtYW5hbHlzaXMtMjAyMy1yaXNpbmctaW5kdXN0cnnSAV1odHRwczovL3d3dy5vcGVucHIuY29tL2FtcC8zMjkwMTg1L2V1cm9wZS1zcG9ydGluZy1nb29kcy1tYXJrZXQtYW5hbHlzaXMtMjAyMy1yaXNpbmctaW5kdXN0cnk?hl=en-IN&gl=IN&ceid=IN%3Aen,2023-11-16
14,"Pest Control Products And Services Market Analysis Growth Strategies, Business Statistics, Product Innovations",openPR,news.google.com/articles/CBMiXWh0dHBzOi8vd3d3Lm9wZW5wci5jb20vbmV3cy8zMjkwMjI5L3Blc3QtY29udHJvbC1wcm9kdWN0cy1hbmQtc2VydmljZXMtbWFya2V0LWFuYWx5c2lzLWdyb3d0aNIBXGh0dHBzOi8vd3d3Lm9wZW5wci5jb20vYW1wLzMyOTAyMjkvcGVzdC1jb250cm9sLXByb2R1Y3RzLWFuZC1zZXJ2aWNlcy1tYXJrZXQtYW5hbHlzaXMtZ3Jvd3Ro?hl=en-IN&gl=IN&ceid=IN%3Aen,2023-11-16
15,"Indonesia Infant Nutrition Market Share, Size: 2023, Future Demand, Competitive Analysis, Developing Trends by",openPR,news.google.com/articles/CBMiXGh0dHBzOi8vd3d3Lm9wZW5wci5jb20vbmV3cy8zMjkwMTk3L2luZG9uZXNpYS1pbmZhbnQtbnV0cml0aW9uLW1hcmtldC1zaGFyZS1zaXplLTIwMjMtZnV0dXJl0gFbaHR0cHM6Ly93d3cub3BlbnByLmNvbS9hbXAvMzI5MDE5Ny9pbmRvbmVzaWEtaW5mYW50LW51dHJpdGlvbi1tYXJrZXQtc2hhcmUtc2l6ZS0yMDIzLWZ1dHVyZQ?hl=en-IN&gl=IN&ceid=IN%3Aen,2023-11-16
16,"Online Retail Market Share 2023, Growth Factors, Business Overview, Top Key Players with Global Industry Trend",openPR,news.google.com/articles/CBMiW2h0dHBzOi8vd3d3Lm9wZW5wci5jb20vbmV3cy8zMjkwMjEyL29ubGluZS1yZXRhaWwtbWFya2V0LXNoYXJlLTIwMjMtZ3Jvd3RoLWZhY3RvcnMtYnVzaW5lc3PSAVpodHRwczovL3d3dy5vcGVucHIuY29tL2FtcC8zMjkwMjEyL29ubGluZS1yZXRhaWwtbWFya2V0LXNoYXJlLTIwMjMtZ3Jvd3RoLWZhY3RvcnMtYnVzaW5lc3M?hl=en-IN&gl=IN&ceid=IN%3Aen,2023-11-16
17,"Vegan Food Market Size, Business Trends, Competitive Outlook, Emerging Dynamics and Forecast to 2030 | Hain Ce",openPR,news.google.com/articles/CBMiXmh0dHBzOi8vd3d3Lm9wZW5wci5jb20vbmV3cy8zMjkwMTYxL3ZlZ2FuLWZvb2QtbWFya2V0LXNpemUtYnVzaW5lc3MtdHJlbmRzLWNvbXBldGl0aXZlLW91dGxvb2vSAV1odHRwczovL3d3dy5vcGVucHIuY29tL2FtcC8zMjkwMTYxL3ZlZ2FuLWZvb2QtbWFya2V0LXNpemUtYnVzaW5lc3MtdHJlbmRzLWNvbXBldGl0aXZlLW91dGxvb2s?hl=en-IN&gl=IN&ceid=IN%3Aen,2023-11-16
3,[Latest] Global Retail E-Commerce Market Size/Share Worth USD ...,GlobeNewswire,news.google.com/articles/CBMi_AFodHRwczovL3d3dy5nbG9iZW5ld3N3aXJlLmNvbS9uZXdzLXJlbGVhc2UvMjAyMy8xMS8xNS8yNzgwNjgyLzAvZW4vTGF0ZXN0LUdsb2JhbC1SZXRhaWwtRS1Db21tZXJjZS1NYXJrZXQtU2l6ZS1TaGFyZS1Xb3J0aC1VU0QtNy05LVRyaWxsaW9uLWJ5LTIwMzItYXQtYS04LTUtQ0FHUi1DdXN0b20tTWFya2V0LUluc2lnaHRzLUFuYWx5c2lzLU91dGxvb2stTGVhZGVycy1SZXBvcnQtVHJlbmRzLUZvcmVjYXN0LVNlZ21lbnRhdGlvbi1HLmh0bWzSAQA?hl=en-IN&gl=IN&ceid=IN%3Aen,2023-11-15
24,"Global Organic Fertilizer Market Analysis by Share, Growth Rate, SWOT Analysis, Segmentation and Forecast 2023",openPR,news.google.com/articles/CBMiXWh0dHBzOi8vd3d3Lm9wZW5wci5jb20vbmV3cy8zMjg4Mzk4L2dsb2JhbC1vcmdhbmljLWZlcnRpbGl6ZXItbWFya2V0LWFuYWx5c2lzLWJ5LXNoYXJlLWdyb3d0aNIBXGh0dHBzOi8vd3d3Lm9wZW5wci5jb20vYW1wLzMyODgzOTgvZ2xvYmFsLW9yZ2FuaWMtZmVydGlsaXplci1tYXJrZXQtYW5hbHlzaXMtYnktc2hhcmUtZ3Jvd3Ro?hl=en-IN&gl=IN&ceid=IN%3Aen,2023-11-15
