,title,source,link,date
44,"Zero Liquid Discharge Systems Market Size, Key Competitors, Business opportunities, Trend Analysis 2029 | Aqua",openPR,news.google.com/articles/CBMiXWh0dHBzOi8vd3d3Lm9wZW5wci5jb20vbmV3cy8zMjE2NDAyL3plcm8tbGlxdWlkLWRpc2NoYXJnZS1zeXN0ZW1zLW1hcmtldC1zaXplLWtleS1jb21wZXRpdG9yc9IBXGh0dHBzOi8vd3d3Lm9wZW5wci5jb20vYW1wLzMyMTY0MDIvemVyby1saXF1aWQtZGlzY2hhcmdlLXN5c3RlbXMtbWFya2V0LXNpemUta2V5LWNvbXBldGl0b3Jz?hl=en-IN&gl=IN&ceid=IN%3Aen,2023-09-21
10,India Intravenous Anesthetic Market Share and Size: Recent ...,Digital Journal,news.google.com/articles/CBMi4gFodHRwczovL3d3dy5kaWdpdGFsam91cm5hbC5jb20vcHIvbmV3cy9jb2hlcmVudC1tYXJrZXQtaW5zaWdodHMvaW5kaWEtaW50cmF2ZW5vdXMtYW5lc3RoZXRpYy1tYXJrZXQtc2hhcmUtYW5kLXNpemUtcmVjZW50LWdyb3dpbmctdHJlbmQtMjAzMC1hc3RyYXplbmVjYS1wbGMtZnJlc2VuaXVzLWthYmktYWJidmllLWluYy1iYXh0ZXItaW50ZXJuYXRpb25hbC1pbmMtYnJhdW4tbWVsc3VuZ2VuLWFn0gEA?hl=en-IN&gl=IN&ceid=IN%3Aen,2023-09-21
40,"2023-2029 Precipitated Silica Market Size, Future Scope, Share Analysis by Company | Evonik Industries AG, PPG",openPR,news.google.com/articles/CBMiYGh0dHBzOi8vd3d3Lm9wZW5wci5jb20vbmV3cy8zMjE2MTQ3LzIwMjMtMjAyOS1wcmVjaXBpdGF0ZWQtc2lsaWNhLW1hcmtldC1zaXplLWZ1dHVyZS1zY29wZS1zaGFyZdIBX2h0dHBzOi8vd3d3Lm9wZW5wci5jb20vYW1wLzMyMTYxNDcvMjAyMy0yMDI5LXByZWNpcGl0YXRlZC1zaWxpY2EtbWFya2V0LXNpemUtZnV0dXJlLXNjb3BlLXNoYXJl?hl=en-IN&gl=IN&ceid=IN%3Aen,2023-09-21
41,"Geotextile Tubes Market Size and Growth Analysis, and Competitive Landscape with Top Key Players like Ace Geos",openPR,news.google.com/articles/CBMiVGh0dHBzOi8vd3d3Lm9wZW5wci5jb20vbmV3cy8zMjE2MjIzL2dlb3RleHRpbGUtdHViZXMtbWFya2V0LXNpemUtYW5kLWdyb3d0aC1hbmFseXNpc9IBU2h0dHBzOi8vd3d3Lm9wZW5wci5jb20vYW1wLzMyMTYyMjMvZ2VvdGV4dGlsZS10dWJlcy1tYXJrZXQtc2l6ZS1hbmQtZ3Jvd3RoLWFuYWx5c2lz?hl=en-IN&gl=IN&ceid=IN%3Aen,2023-09-21
31,"Abrasives Market Size, Share, Product, Industry Growth, Trend, Geographies, and Forecast | CAGR of 5.11%, to r",openPR,news.google.com/articles/CBMiXWh0dHBzOi8vd3d3Lm9wZW5wci5jb20vbmV3cy8zMjE2NDEyL2FicmFzaXZlcy1tYXJrZXQtc2l6ZS1zaGFyZS1wcm9kdWN0LWluZHVzdHJ5LWdyb3d0aC10cmVuZNIBXGh0dHBzOi8vd3d3Lm9wZW5wci5jb20vYW1wLzMyMTY0MTIvYWJyYXNpdmVzLW1hcmtldC1zaXplLXNoYXJlLXByb2R1Y3QtaW5kdXN0cnktZ3Jvd3RoLXRyZW5k?hl=en-IN&gl=IN&ceid=IN%3Aen,2023-09-21
30,"High Strength Steel Market Outlook and Opportunities | Industry Dynamics, Top Players ArcelorMittal S.A., Unit",openPR,news.google.com/articles/CBMiYWh0dHBzOi8vd3d3Lm9wZW5wci5jb20vbmV3cy8zMjE2MjQyL2hpZ2gtc3RyZW5ndGgtc3RlZWwtbWFya2V0LW91dGxvb2stYW5kLW9wcG9ydHVuaXRpZXMtaW5kdXN0cnnSAWBodHRwczovL3d3dy5vcGVucHIuY29tL2FtcC8zMjE2MjQyL2hpZ2gtc3RyZW5ndGgtc3RlZWwtbWFya2V0LW91dGxvb2stYW5kLW9wcG9ydHVuaXRpZXMtaW5kdXN0cnk?hl=en-IN&gl=IN&ceid=IN%3Aen,2023-09-21
42,"Acrylic Emulsions Market growing at a CAGR of 7.5%, Recent Industry SCOPE, TRENDS AND DEVELOPMENTS and Forecas",openPR,news.google.com/articles/CBMiXGh0dHBzOi8vd3d3Lm9wZW5wci5jb20vbmV3cy8zMjE2MTU5L2FjcnlsaWMtZW11bHNpb25zLW1hcmtldC1ncm93aW5nLWF0LWEtY2Fnci1vZi03LTUtcmVjZW500gFbaHR0cHM6Ly93d3cub3BlbnByLmNvbS9hbXAvMzIxNjE1OS9hY3J5bGljLWVtdWxzaW9ucy1tYXJrZXQtZ3Jvd2luZy1hdC1hLWNhZ3Itb2YtNy01LXJlY2VudA?hl=en-IN&gl=IN&ceid=IN%3Aen,2023-09-21
24,Allergy Immunotherapy Market to See Huge Growth by 2030 ...,Digital Journal,news.google.com/articles/CBMivAFodHRwczovL3d3dy5kaWdpdGFsam91cm5hbC5jb20vcHIvbmV3cy9jb2hlcmVudC1tYXJrZXQtaW5zaWdodHMvYWxsZXJneS1pbW11bm90aGVyYXB5LW1hcmtldC10by1zZWUtaHVnZS1ncm93dGgtYnktMjAzMC1zdGFsbGVyZ2VuZXMtZ3JlZXItYWxrLWFiZWxsby1hLXMtYWxsZXJneS10aGVyYXBldXRpY3MtYWxsZXJnb3BoYXJtYdIBAA?hl=en-IN&gl=IN&ceid=IN%3Aen,2023-09-21
18,"Utility Boiler Market Size, Share Analysis 2030",Benzinga,news.google.com/articles/CBMiZGh0dHBzOi8vd3d3LmJlbnppbmdhLmNvbS9wcmVzc3JlbGVhc2VzLzIzLzA5LzM0Nzc3NzI5L3V0aWxpdHktYm9pbGVyLW1hcmtldC1zaXplLXNoYXJlLWFuYWx5c2lzLTIwMzDSAQA?hl=en-IN&gl=IN&ceid=IN%3Aen,2023-09-21
36,"Shape Memory Alloys Market Outlook, Opportunities, Industry Dynamics, Key Players Seabird Metal, Saes Gaetters",openPR,news.google.com/articles/CBMiXWh0dHBzOi8vd3d3Lm9wZW5wci5jb20vbmV3cy8zMjE2MzI1L3NoYXBlLW1lbW9yeS1hbGxveXMtbWFya2V0LW91dGxvb2stb3Bwb3J0dW5pdGllcy1pbmR1c3RyedIBXGh0dHBzOi8vd3d3Lm9wZW5wci5jb20vYW1wLzMyMTYzMjUvc2hhcGUtbWVtb3J5LWFsbG95cy1tYXJrZXQtb3V0bG9vay1vcHBvcnR1bml0aWVzLWluZHVzdHJ5?hl=en-IN&gl=IN&ceid=IN%3Aen,2023-09-21
