,title,source,link,date
28,"Social media usage and students' social anxiety, loneliness and well ...",BMC Psychology,news.google.com/articles/CBMiS2h0dHBzOi8vYm1jcHN5Y2hvbG9neS5iaW9tZWRjZW50cmFsLmNvbS9hcnRpY2xlcy8xMC4xMTg2L3M0MDM1OS0wMjMtMDEzOTgtN9IBAA?hl=en-IN&gl=IN&ceid=IN%3Aen,2023-10-31
12,AI has potential to improve health care – and computer attacks,Medical Economics,news.google.com/articles/CBMiYmh0dHBzOi8vd3d3Lm1lZGljYWxlY29ub21pY3MuY29tL3ZpZXcvYWktaGFzLXBvdGVudGlhbC10by1pbXByb3ZlLWhlYWx0aC1jYXJlLWFuZC1jb21wdXRlci1hdHRhY2tz0gEA?hl=en-IN&gl=IN&ceid=IN%3Aen,2023-10-30
21,A Web-GIS tool for diagnosing spatial orientation of young adults ...,Nature.com,news.google.com/articles/CBMiMmh0dHBzOi8vd3d3Lm5hdHVyZS5jb20vYXJ0aWNsZXMvczQxNTk4LTAyMy00NTI2OC160gEA?hl=en-IN&gl=IN&ceid=IN%3Aen,2023-10-30
40,Undergraduate programs in Saudi Arabian governmental uni's | AMEP,Dove Medical Press,news.google.com/articles/CBMihAFodHRwczovL3d3dy5kb3ZlcHJlc3MuY29tL2ZhY3VsdHktYW5kLXN0dWRlbnRzLXBlcnNwZWN0aXZlLW9mLWhlYWx0aC1pbmZvcm1hdGljcy1wcm9ncmFtcy1pbi1zYXUtcGVlci1yZXZpZXdlZC1mdWxsdGV4dC1hcnRpY2xlLUFNRVDSAQA?hl=en-IN&gl=IN&ceid=IN%3Aen,2023-10-30
0,An excellent week for Computer Age Management Services Limited's (NSE:CAMS) institutional owners who own 37% as one-year returns inch higher,Simply Wall St,news.google.com/articles/CBMipgFodHRwczovL3NpbXBseXdhbGwuc3Qvc3RvY2tzL2luL2NvbW1lcmNpYWwtc2VydmljZXMvbnNlLWNhbXMvY29tcHV0ZXItYWdlLW1hbmFnZW1lbnQtc2VydmljZXMtc2hhcmVzL25ld3MvYW4tZXhjZWxsZW50LXdlZWstZm9yLWNvbXB1dGVyLWFnZS1tYW5hZ2VtZW50LXNlcnZpY2VzLWxpbWl00gGqAWh0dHBzOi8vc2ltcGx5d2FsbC5zdC9zdG9ja3MvaW4vY29tbWVyY2lhbC1zZXJ2aWNlcy9uc2UtY2Ftcy9jb21wdXRlci1hZ2UtbWFuYWdlbWVudC1zZXJ2aWNlcy1zaGFyZXMvbmV3cy9hbi1leGNlbGxlbnQtd2Vlay1mb3ItY29tcHV0ZXItYWdlLW1hbmFnZW1lbnQtc2VydmljZXMtbGltaXQvYW1w?hl=en-IN&gl=IN&ceid=IN%3Aen,2023-10-18
