,title,source,link,date
10,Lula says Putin would not be arrested in 2024 Brazil G20 meeting,Arab News,news.google.com/articles/CBMiJWh0dHBzOi8vd3d3LmFyYWJuZXdzLmNvbS9ub2RlLzIzNzA2ODHSASlodHRwczovL3d3dy5hcmFibmV3cy5jb20vbm9kZS8yMzcwNjgxL2FtcA?hl=en-IN&gl=IN&ceid=IN%3Aen,2023-09-10
7,What to expect from the G20 leaders' summit in India's capital New ...,Arab News,news.google.com/articles/CBMiK2h0dHBzOi8vd3d3LmFyYWJuZXdzLmNvbS9ub2RlLzIzNzAyNDYvd29ybGTSASlodHRwczovL3d3dy5hcmFibmV3cy5jb20vbm9kZS8yMzcwMjQ2L2FtcA?hl=en-IN&gl=IN&ceid=IN%3Aen,2023-09-09
9,"Syrian American CEO says Arab heritage is an asset, not a hinderance",Arab News,news.google.com/articles/CBMiK2h0dHBzOi8vd3d3LmFyYWJuZXdzLmNvbS9ub2RlLzIzNzA0MTYvd29ybGTSASlodHRwczovL3d3dy5hcmFibmV3cy5jb20vbm9kZS8yMzcwNDE2L2FtcA?hl=en-IN&gl=IN&ceid=IN%3Aen,2023-09-09
12,Philippines resupplies troops on South China Sea atoll,Arab News,news.google.com/articles/CBMiK2h0dHBzOi8vd3d3LmFyYWJuZXdzLmNvbS9ub2RlLzIzNzA1MDEvd29ybGTSASlodHRwczovL3d3dy5hcmFibmV3cy5jb20vbm9kZS8yMzcwNTAxL2FtcA?hl=en-IN&gl=IN&ceid=IN%3Aen,2023-09-09
15,Consensus on G20 joint statement lauded after initial doubts over ...,Arab News Pakistan,news.google.com/articles/CBMiKmh0dHBzOi8vd3d3LmFyYWJuZXdzLnBrL25vZGUvMjM3MDUzNi93b3JsZNIBAA?hl=en-IN&gl=IN&ceid=IN%3Aen,2023-09-09
17,"Sara Sharif's body left unrecognizable by injuries, mother claims",Arab News,news.google.com/articles/CBMiK2h0dHBzOi8vd3d3LmFyYWJuZXdzLmNvbS9ub2RlLzIzNjg0MjYvd29ybGTSASlodHRwczovL3d3dy5hcmFibmV3cy5jb20vbm9kZS8yMzY4NDI2L2FtcA?hl=en-IN&gl=IN&ceid=IN%3Aen,2023-09-09
19,"UN, Iran urge cooperation to battle sandstorm threat",Arab News Pakistan,news.google.com/articles/CBMiKmh0dHBzOi8vd3d3LmFyYWJuZXdzLnBrL25vZGUvMjM3MDM3MS93b3JsZNIBAA?hl=en-IN&gl=IN&ceid=IN%3Aen,2023-09-09
13,Climate gridlock feared at G20 summit,Arab News,news.google.com/articles/CBMiK2h0dHBzOi8vd3d3LmFyYWJuZXdzLmNvbS9ub2RlLzIzNjk2MDEvd29ybGTSASlodHRwczovL3d3dy5hcmFibmV3cy5jb20vbm9kZS8yMzY5NjAxL2FtcA?hl=en-IN&gl=IN&ceid=IN%3Aen,2023-09-08
14,Hong Kong's heaviest rain in at least 140 years floods city streets ...,Arab News,news.google.com/articles/CBMiK2h0dHBzOi8vd3d3LmFyYWJuZXdzLmNvbS9ub2RlLzIzNjk1MjEvd29ybGTSASlodHRwczovL3d3dy5hcmFibmV3cy5jb20vbm9kZS8yMzY5NTIxL2FtcA?hl=en-IN&gl=IN&ceid=IN%3Aen,2023-09-08
16,Southeast Asia summit offers chance of direct diplomacy for sparring ...,Arab News,news.google.com/articles/CBMiK2h0dHBzOi8vd3d3LmFyYWJuZXdzLmNvbS9ub2RlLzIzNjg5MDEvd29ybGTSASlodHRwczovL3d3dy5hcmFibmV3cy5jb20vbm9kZS8yMzY4OTAxL2FtcA?hl=en-IN&gl=IN&ceid=IN%3Aen,2023-09-07
