,title,source,link,date
6,36 Hours in Chicago: Things to Do and See,The New York Times,news.google.com/articles/CBMiT2h0dHBzOi8vd3d3Lm55dGltZXMuY29tL2ludGVyYWN0aXZlLzIwMjMvMDkvMjgvdHJhdmVsL3RoaW5ncy10by1kby1jaGljYWdvLmh0bWzSAQA?hl=en-IN&gl=IN&ceid=IN%3Aen,2023-09-28
7,"After Hurricane Ian, Who Will Get to Call This Beach Town Home?",The New York Times,news.google.com/articles/CBMiSWh0dHBzOi8vd3d3Lm55dGltZXMuY29tLzIwMjMvMDkvMjgvdXMvaHVycmljYW5lLWlhbi1mb3J0LW15ZXJzLWJlYWNoLmh0bWzSAQA?hl=en-IN&gl=IN&ceid=IN%3Aen,2023-09-28
9,HOME AFFORDABILITY GETS EVEN TOUGHER ACROSS U.S. DURING THIRD QUARTER AS HOME PRICES AND MORTGAGE RATES R,Benzinga,news.google.com/articles/CBMimQFodHRwczovL3d3dy5iZW56aW5nYS5jb20vcHJlc3NyZWxlYXNlcy8yMy8wOS9uMzQ5NjMxNjAvaG9tZS1hZmZvcmRhYmlsaXR5LWdldHMtZXZlbi10b3VnaGVyLWFjcm9zcy11LXMtZHVyaW5nLXRoaXJkLXF1YXJ0ZXItYXMtaG9tZS1wcmljZXMtYW5kLW1vcnRnYWdlLXLSAS1odHRwczovL3d3dy5iZW56aW5nYS5jb20vYW1wL2NvbnRlbnQvMzQ5NjMxNjA?hl=en-IN&gl=IN&ceid=IN%3Aen,2023-09-28
0,Mountain towns need housing. The U.S. Forest Service has land ...,Colorado Public Radio,news.google.com/articles/CBMiV2h0dHBzOi8vd3d3LmNwci5vcmcvMjAyMy8wOS8yNy9kaWxsb24tYWZmb3JkYWJsZS1ob3VzaW5nLWRldmVsb3BtZW50LXVzLWZvcmVzdC1zZXJ2aWNlL9IBAA?hl=en-IN&gl=IN&ceid=IN%3Aen,2023-09-27
4,[Latest Market Study] Analysis on Australia Nail Salon Market ...,GlobeNewswire,news.google.com/articles/CBMiwwFodHRwczovL3d3dy5nbG9iZW5ld3N3aXJlLmNvbS9uZXdzLXJlbGVhc2UvMjAyMy8wOS8yNy8yNzUwODEwLzAvZW4vTGF0ZXN0LU1hcmtldC1TdHVkeS1BbmFseXNpcy1vbi1BdXN0cmFsaWEtTmFpbC1TYWxvbi1NYXJrZXQtVHJlbmRzLU1hcmtldC1WYWx1ZS1TZWdtZW50LU1hcmtldC1TaGFyZS1hbmQtRm9yZWNhc3QtMjAyMy0yMDMwLmh0bWzSAQA?hl=en-IN&gl=IN&ceid=IN%3Aen,2023-09-27
8,Real estate in Canada: What new immigrants should know,CTV News,news.google.com/articles/CBMibmh0dHBzOi8vd3d3LmN0dm5ld3MuY2EvYnVzaW5lc3MvbmF2aWdhdGluZy1jYW5hZGEtcy1yZWFsLWVzdGF0ZS1sYW5kc2NhcGUtYS1ndWlkZS1mb3ItbmV3LWltbWlncmFudHMtMS42NTc5ODA00gEA?hl=en-IN&gl=IN&ceid=IN%3Aen,2023-09-27
13,Huge new 'infill' Southwood Circle planned at Winnipeg's UM,Real Estate News EXchange - RENX,news.google.com/articles/CBMiS2h0dHBzOi8vcmVueC5jYS93aW5uaXBlZ3MtaW5maWxsLXNvdXRod29vZC1jaXJjbGUtZGV2LXRvLWhvdXNlLTIwMDAwLXBlb3BsZdIBAA?hl=en-IN&gl=IN&ceid=IN%3Aen,2023-09-27
17,Where To Find The Cheapest Freehold Landed Homes In 2022/23 ...,Stacked,news.google.com/articles/CBMibWh0dHBzOi8vc3RhY2tlZGhvbWVzLmNvbS9lZGl0b3JpYWwvd2hlcmUtdG8tZmluZC10aGUtY2hlYXBlc3QtZnJlZWhvbGQtbGFuZGVkLWhvbWVzLWluLTIwMjIyMy1mcm9tLTItbWlsbGlvbi_SAQA?hl=en-IN&gl=IN&ceid=IN%3Aen,2023-09-27
11,Real estate transfers: Lakeside home in Green with massive patio ...,Akron Beacon Journal,news.google.com/articles/CBMiigFodHRwczovL3d3dy5iZWFjb25qb3VybmFsLmNvbS9zdG9yeS9idXNpbmVzcy9yZWFsLWVzdGF0ZS8yMDIzLzA5LzI2L3JlYWwtZXN0YXRlLXRyYW5zZmVycy1ncmVlbi1ob21lLXBvcnRhZ2UtbGFrZXMtc2VsbHMtODc1ay83MDkwODAyNjAwNy_SAQA?hl=en-IN&gl=IN&ceid=IN%3Aen,2023-09-26
18,The Daily Dirt Digs into Rent Overcharge Bills,The Real Deal,news.google.com/articles/CBMiW2h0dHBzOi8vdGhlcmVhbGRlYWwuY29tL25ldy15b3JrLzIwMjMvMDkvMjYvdGhlLWRhaWx5LWRpcnQtZGlncy1pbnRvLXJlbnQtb3ZlcmNoYXJnZS1iaWxscy_SAQA?hl=en-IN&gl=IN&ceid=IN%3Aen,2023-09-26
