,title,source,link,date
2,Cyient (NSE:CYIENT) Could Easily Take On More Debt,Simply Wall St,news.google.com/articles/CBMieGh0dHBzOi8vc2ltcGx5d2FsbC5zdC9zdG9ja3MvaW4vc29mdHdhcmUvbnNlLWN5aWVudC9jeWllbnQtc2hhcmVzL25ld3MvY3lpZW50LW5zZWN5aWVudC1jb3VsZC1lYXNpbHktdGFrZS1vbi1tb3JlLWRlYnQtMdIBfGh0dHBzOi8vc2ltcGx5d2FsbC5zdC9zdG9ja3MvaW4vc29mdHdhcmUvbnNlLWN5aWVudC9jeWllbnQtc2hhcmVzL25ld3MvY3lpZW50LW5zZWN5aWVudC1jb3VsZC1lYXNpbHktdGFrZS1vbi1tb3JlLWRlYnQtMS9hbXA?hl=en-IN&gl=IN&ceid=IN%3Aen,2023-09-21
4,Must-have eyeshadows of fall/winter 2023,Vogue Singapore,news.google.com/articles/CBMiIWh0dHBzOi8vdm9ndWUuc2cvZXllc2hhZG93cy0yMDIzL9IBAA?hl=en-IN&gl=IN&ceid=IN%3Aen,2023-09-21
6,Sonic Brew canned coffee gets those creative juices flowing,Beat Magazine,news.google.com/articles/CBMib2h0dHBzOi8vYmVhdC5jb20uYXUvaW50cm9kdWNpbmctc29uaWMtYnJldy10aGUtbmV3LWNhbm5lZC1jb2ZmZWUtZGVzaWduZWQtdG8tZ2V0LXRob3NlLWNyZWF0aXZlLWp1aWNlcy1mbG93aW5nL9IBAA?hl=en-IN&gl=IN&ceid=IN%3Aen,2023-09-21
21,Final Fantasy 7 Rebirth reaffirms itself as my most-anticipated JRPG ...,Gamesradar,news.google.com/articles/CBMiRGh0dHBzOi8vd3d3LmdhbWVzcmFkYXIuY29tL2ZpbmFsLWZhbnRhc3ktNy1yZWJpcnRoLWdhbWVwbGF5LXByZXZpZXcv0gEA?hl=en-IN&gl=IN&ceid=IN%3Aen,2023-09-21
0,"EXCLUSIVE! Amrish Sharma opens up on his acting school, 'Acting Ki Pathshala’, shares about his 16-years of experience as a casting director, reveals giving break to actors who are currently the top names in the industry and much more",Tellychakkar,news.google.com/articles/CBMif2h0dHBzOi8vd3d3LnRlbGx5Y2hha2thci5jb20vdHYvdHYtbmV3cy9leGNsdXNpdmUtYW1yaXNoLXNoYXJtYS1vcGVucy1oaXMtYWN0aW5nLXNjaG9vbC1hY3Rpbmcta2ktcGF0aHNoYWxhLXNoYXJlcy1hYm91dC1oaXMtMTbSAYMBaHR0cHM6Ly93d3cudGVsbHljaGFra2FyLmNvbS90di90di1uZXdzL2V4Y2x1c2l2ZS1hbXJpc2gtc2hhcm1hLW9wZW5zLWhpcy1hY3Rpbmctc2Nob29sLWFjdGluZy1raS1wYXRoc2hhbGEtc2hhcmVzLWFib3V0LWhpcy0xNj9hbXA?hl=en-IN&gl=IN&ceid=IN%3Aen,2023-09-20
3,Thomas Bertie Taylor's abstract photos find beauty in the most ...,Creative Boom,news.google.com/articles/CBMiPmh0dHBzOi8vd3d3LmNyZWF0aXZlYm9vbS5jb20vaW5zcGlyYXRpb24vdGhvbWFzLWJlcnRpZS10YXlsb3Iv0gEA?hl=en-IN&gl=IN&ceid=IN%3Aen,2023-09-20
9,ASUS TUF Gaming A15 review: shining performance on a ...,Creative Bloq,news.google.com/articles/CBMiOGh0dHBzOi8vd3d3LmNyZWF0aXZlYmxvcS5jb20vcmV2aWV3cy9hc3VzLXR1Zi1nYW1pbmctYTE10gEA?hl=en-IN&gl=IN&ceid=IN%3Aen,2023-09-20
12,The Y2K Trend Is Here To Stay – And It’s Easy To See Why,The Drum,news.google.com/articles/CBMiWGh0dHBzOi8vd3d3LnRoZWRydW0uY29tL29waW5pb24vMjAyMy8wOS8yMC90aGUteTJrLXRyZW5kLWhlcmUtc3RheS1hbmQtaXQtcy1lYXN5LXNlZS13aHnSAQA?hl=en-IN&gl=IN&ceid=IN%3Aen,2023-09-20
5,Is Hindustan Unilever (NSE:HINDUNILVR) A Risky Investment?,Simply Wall St,news.google.com/articles/CBMikAFodHRwczovL3NpbXBseXdhbGwuc3Qvc3RvY2tzL2luL2hvdXNlaG9sZC9uc2UtaGluZHVuaWx2ci9oaW5kdXN0YW4tdW5pbGV2ZXItc2hhcmVzL25ld3MvaXMtaGluZHVzdGFuLXVuaWxldmVyLW5zZWhpbmR1bmlsdnItYS1yaXNreS1pbnZlc3RtZW50LTPSAZQBaHR0cHM6Ly9zaW1wbHl3YWxsLnN0L3N0b2Nrcy9pbi9ob3VzZWhvbGQvbnNlLWhpbmR1bmlsdnIvaGluZHVzdGFuLXVuaWxldmVyLXNoYXJlcy9uZXdzL2lzLWhpbmR1c3Rhbi11bmlsZXZlci1uc2VoaW5kdW5pbHZyLWEtcmlza3ktaW52ZXN0bWVudC0zL2FtcA?hl=en-IN&gl=IN&ceid=IN%3Aen,2023-09-19
10,England need a creative spark and Marcus Smith is the answer,The Telegraph,news.google.com/articles/CBMiZ2h0dHBzOi8vd3d3LnRlbGVncmFwaC5jby51ay9ydWdieS11bmlvbi8yMDIzLzA5LzE4L2VuZ2xhbmQtbWFyY3VzLXNtaXRoLWNyZWF0aXZlLXNwYXJrLXJ1Z2J5LXdvcmxkLWN1cC_SAQA?hl=en-IN&gl=IN&ceid=IN%3Aen,2023-09-18
