,title,source,link,date
0,Creative at the Library! Eye Library launches a full week of creative ...,Suffolk Libraries,news.google.com/articles/CBMifWh0dHBzOi8vd3d3LnN1ZmZvbGtsaWJyYXJpZXMuY28udWsvYWJvdXQvbmV3cy9jcmVhdGl2ZS1hdC10aGUtbGlicmFyeS1leWUtbGlicmFyeS1sYXVuY2hlcy1hLWZ1bGwtd2Vlay1vZi1jcmVhdGl2ZS1hY3Rpdml0aWVz0gEA?hl=en-IN&gl=IN&ceid=IN%3Aen,2023-09-04
10,The Battle Over Books3 Could Change AI Forever,WIRED,news.google.com/articles/CBMiL2h0dHBzOi8vd3d3LndpcmVkLmNvbS9zdG9yeS9iYXR0bGUtb3Zlci1ib29rczMv0gEA?hl=en-IN&gl=IN&ceid=IN%3Aen,2023-09-04
21,Stranger of Paradise's Battle Mechanics Improve FFXVI's Combat ...,CBR - Comic Book Resources,news.google.com/articles/CBMiR2h0dHBzOi8vd3d3LmNici5jb20vc3RyYW5nZXItb2YtcGFyYWRpc2UtYXZvaWRzLWZmeHZpLWdhbWVwbGF5LW1pc3Rha2Uv0gEA?hl=en-IN&gl=IN&ceid=IN%3Aen,2023-09-04
19,Kilian Paris makes bold debut at Incheon International Airport with ...,The Moodie Davitt Report,news.google.com/articles/CBMie2h0dHBzOi8vd3d3Lm1vb2RpZWRhdml0dHJlcG9ydC5jb20va2lsaWFuLXBhcmlzLW1ha2VzLWJvbGQtZGVidXQtYXQtaW5jaGVvbi1pbnRlcm5hdGlvbmFsLWFpcnBvcnQtd2l0aC1zaGluc2VnYWUtZHV0eS1mcmVlL9IBAA?hl=en-IN&gl=IN&ceid=IN%3Aen,2023-09-04
18,This One Baldur's Gate 3 Trick Can Help Survey The Entire Map,Screen Rant,news.google.com/articles/CBMiRmh0dHBzOi8vc2NyZWVucmFudC5jb20vYmFsZHVycy1nYXRlLTMtcmV2ZWFsLW1hcC1zdXJ2ZXktdHJpY2stYW5pbWFscy_SAQA?hl=en-IN&gl=IN&ceid=IN%3Aen,2023-09-04
17,15 Small Bathroom Ideas To Maximise Your Space,House Beautiful,news.google.com/articles/CBMiU2h0dHBzOi8vd3d3LmhvdXNlYmVhdXRpZnVsLmNvbS91ay9kZWNvcmF0ZS9iYXRocm9vbS9nNDQ2NDk1OTcvc21hbGwtYmF0aHJvb20taWRlYXMv0gEA?hl=en-IN&gl=IN&ceid=IN%3Aen,2023-09-04
15,TENI and SHUSHI Unveil A Captivating Limited-Edition Eyewear ...,BellaNaija Style,news.google.com/articles/CBMiQWh0dHBzOi8vd3d3LmJlbGxhbmFpamFzdHlsZS5jb20vdGVuaS14LXNodXNoaS1leWV3ZWFyLWNvbGxlY3Rpb24v0gEA?hl=en-IN&gl=IN&ceid=IN%3Aen,2023-09-04
13,Foamstars: A Promising and Unique Multiplayer Gaming Experience,OPP.Today,news.google.com/articles/CBMiY2h0dHBzOi8vd3d3Lm9wcC50b2RheS9nYW1pbmcvZm9hbS1hbmQtY2hhb3MtYS1maXJzdC1pbXByZXNzaW9uLW9mLWZvYW1zdGFycy1hdC1nYW1lc2NvbS0yMDIzLzI5NjQxL9IBAA?hl=en-IN&gl=IN&ceid=IN%3Aen,2023-09-04
7,Lego releases braille bricks – here's how five other brands could ...,The Conversation,news.google.com/articles/CBMigQFodHRwczovL3RoZWNvbnZlcnNhdGlvbi5jb20vbGVnby1yZWxlYXNlcy1icmFpbGxlLWJyaWNrcy1oZXJlcy1ob3ctZml2ZS1vdGhlci1icmFuZHMtY291bGQtbWFrZS10aGVpci10b3lzLW1vcmUtYWNjZXNzaWJsZS0yMTI2MzDSAQA?hl=en-IN&gl=IN&ceid=IN%3Aen,2023-09-04
6,How this cult shoe brand is changing the fashion industry with its ...,Emirates Woman,news.google.com/articles/CBMib2h0dHBzOi8vZW1pcmF0ZXN3b21hbi5jb20vaG93LXRoaXMtY3VsdC1zaG9lLWJyYW5kLWlzLWNoYW5naW5nLXRoZS1mYXNoaW9uLWluZHVzdHJ5LXdpdGgtaXRzLWFydGlzYW5hbC1kZXNpZ25zL9IBAA?hl=en-IN&gl=IN&ceid=IN%3Aen,2023-09-04
