,title,source,link,date
17,SuperScale report reveals game development's mortality rate ...,European Gaming Industry News,news.google.com/articles/CBMiowFodHRwczovL2V1cm9wZWFuZ2FtaW5nLmV1L3BvcnRhbC9sYXRlc3QtbmV3cy8yMDIzLzExLzIyLzE0NzkwNS9zdXBlcnNjYWxlLXJlcG9ydC1yZXZlYWxzLWdhbWUtZGV2ZWxvcG1lbnRzLW1vcnRhbGl0eS1yYXRlLW92ZXJ3aGVsbWluZy1tYWpvcml0eS1kaWUtd2l0aGluLTMteWVhcnMv0gEA?hl=en-IN&gl=IN&ceid=IN%3Aen,2023-11-22
21,Layer AI raises $1.8m to supercharge game art production!,European Gaming Industry News,news.google.com/articles/CBMid2h0dHBzOi8vZXVyb3BlYW5nYW1pbmcuZXUvcG9ydGFsL2xhdGVzdC1uZXdzLzIwMjMvMTEvMjIvMTQ3ODQ4L2xheWVyLWFpLXJhaXNlcy0xLThtLXRvLXN1cGVyY2hhcmdlLWdhbWUtYXJ0LXByb2R1Y3Rpb24v0gEA?hl=en-IN&gl=IN&ceid=IN%3Aen,2023-11-22
3,New Tech Gadgets to Boost Your Productivity,OPP.Today,news.google.com/articles/CBMikQFodHRwczovL3d3dy5vcHAudG9kYXkvaGVhbHRoL2FwcGxlLWFpcnBvZHMtMm5kLWdlbi13aXRoLTUyNTAwMC1wZXJmZWN0LXJhdGluZ3MtYXJlLW5lYXJseS00MC1vZmYtaW4tYW4taW5jcmVkaWJsZS1lYXJseS1ibGFjay1mcmlkYXktc2FsZS8yMjY5ODMv0gEA?hl=en-IN&gl=IN&ceid=IN%3Aen,2023-11-21
6,New December Programs and Final November Programs from ...,Village Preservation,news.google.com/articles/CBMigAFodHRwczovL3d3dy52aWxsYWdlcHJlc2VydmF0aW9uLm9yZy9jYW1wYWlnbi11cGRhdGUvbmV3LWRlY2VtYmVyLXByb2dyYW1zLWFuZC1maW5hbC1ub3ZlbWJlci1wcm9ncmFtcy1mcm9tLXZpbGxhZ2UtcHJlc2VydmF0aW9uL9IBAA?hl=en-IN&gl=IN&ceid=IN%3Aen,2023-11-21
9,The Fitbit Charge 6 is one of the best tiny fitness trackers yet,CNN Underscored,news.google.com/articles/CBMiO2h0dHBzOi8vd3d3LmNubi5jb20vY25uLXVuZGVyc2NvcmVkL3Jldmlld3MvZml0Yml0LWNoYXJnZS020gE_aHR0cHM6Ly9hbXAuY25uLmNvbS9jbm4vY25uLXVuZGVyc2NvcmVkL3Jldmlld3MvZml0Yml0LWNoYXJnZS02?hl=en-IN&gl=IN&ceid=IN%3Aen,2023-11-21
20,Can Luxury Brands Grow in 2024? | BoF,The Business of Fashion,news.google.com/articles/CBMiUmh0dHBzOi8vd3d3LmJ1c2luZXNzb2ZmYXNoaW9uLmNvbS9icmllZmluZ3MvbHV4dXJ5L2Nhbi1sdXh1cnktYnJhbmRzLWdyb3ctaW4tMjAyNC_SAQA?hl=en-IN&gl=IN&ceid=IN%3Aen,2023-11-17
30,'Cause we are living in an autonomous world: presenting the week's ...,Retail Technology Innovation Hub,news.google.com/articles/CBMimgFodHRwczovL3JldGFpbHRlY2hpbm5vdmF0aW9uaHViLmNvbS9ob21lLzIwMjMvMTEvMTcvY2F1c2Utd2UtYXJlLWxpdmluZy1pbi1hbi1hdXRvbm9tb3VzLXdvcmxkLXJ0aWgtcnVucy10aHJvdWdoLXRoZS13ZWVrcy1jb29sZXN0LXJldGFpbC10ZWNobm9sb2d5LXBsYXlz0gEA?hl=en-IN&gl=IN&ceid=IN%3Aen,2023-11-17
19,How AI-Driven Digital Twins are Transforming Healthcare,OODA Loop,news.google.com/articles/CBMiZGh0dHBzOi8vd3d3Lm9vZGFsb29wLmNvbS9hcmNoaXZlLzIwMjMvMTEvMTYvaG93LWFpLWRyaXZlbi1kaWdpdGFsLXR3aW5zLWFyZS10cmFuc2Zvcm1pbmctaGVhbHRoY2FyZS_SAQA?hl=en-IN&gl=IN&ceid=IN%3Aen,2023-11-16
15,"I got Legion Glasses for gaming, but I’m actually using them for ASMR",Digital Trends,news.google.com/articles/CBMiRGh0dHBzOi8vd3d3LmRpZ2l0YWx0cmVuZHMuY29tL2dhbWluZy9sZW5vdm8tbGVnaW9uLWdsYXNzZXMtaGFuZHMtb24v0gFIaHR0cHM6Ly93d3cuZGlnaXRhbHRyZW5kcy5jb20vZ2FtaW5nL2xlbm92by1sZWdpb24tZ2xhc3Nlcy1oYW5kcy1vbi8_YW1w?hl=en-IN&gl=IN&ceid=IN%3Aen,2023-11-10
7,Bringing New Tech to the World: NCITE Files Patent on Suspicious ...,University of Nebraska Omaha,news.google.com/articles/CBMiSWh0dHBzOi8vd3d3LnVub21haGEuZWR1L25jaXRlL25ld3MvMjAyMy8xMS9jaGF0Ym90LXRyYW5zaXRpb24tZmVhdHVyZS5waHDSAQA?hl=en-IN&gl=IN&ceid=IN%3Aen,2023-11-09
