,title,source,link,date
8,"Share Market Highlights 12 October 2023: Sensex falls marginally; Nifty below 19,800; Infosys, Tech Mahindra among major losers",BusinessLine,news.google.com/articles/CBMiaGh0dHBzOi8vd3d3LnRoZWhpbmR1YnVzaW5lc3NsaW5lLmNvbS9tYXJrZXRzL3NoYXJlLW1hcmtldC1oaWdobGlnaHRzLTEyLW9jdG9iZXItMjAyMy9hcnRpY2xlNjc0MDkzMTMuZWNl0gFtaHR0cHM6Ly93d3cudGhlaGluZHVidXNpbmVzc2xpbmUuY29tL21hcmtldHMvc2hhcmUtbWFya2V0LWhpZ2hsaWdodHMtMTItb2N0b2Jlci0yMDIzL2FydGljbGU2NzQwOTMxMy5lY2UvYW1wLw?hl=en-IN&gl=IN&ceid=IN%3Aen,2023-10-12
11,First Generation Idol's Comeback Chart Ranking Leave Netizens ...,Koreaboo,news.google.com/articles/CBMiXWh0dHBzOi8vd3d3LmtvcmVhYm9vLmNvbS9uZXdzL2ZpcnN0LWdlbmVyYXRpb24taWRvbC1jb21lYmFjay1jaGFydC1yYW5raW5nLW5ldGl6ZW5zLWJhZmZmbGVkL9IBAA?hl=en-IN&gl=IN&ceid=IN%3Aen,2023-10-12
14,An ex vivo model for education and training of unilateral cleft lip ...,BMC Medical Education,news.google.com/articles/CBMiSGh0dHBzOi8vYm1jbWVkZWR1Yy5iaW9tZWRjZW50cmFsLmNvbS9hcnRpY2xlcy8xMC4xMTg2L3MxMjkwOS0wMjMtMDQ2NjctNtIBAA?hl=en-IN&gl=IN&ceid=IN%3Aen,2023-10-12
15,Starbucks and the growing need for climate-resistant crops,Verdict,news.google.com/articles/CBMiU2h0dHBzOi8vd3d3LnZlcmRpY3QuY28udWsvYW5hbHlzdC1jb21tZW50L3N0YXJidWNrcy1jbGltYXRlLXJlc2lzdGFudC1jb2ZmZWUtdHJlZXMv0gEA?hl=en-IN&gl=IN&ceid=IN%3Aen,2023-10-12
16,Nigeria At 63: Hollandia Sparks Dairy Power Excitement,Leadership News,news.google.com/articles/CBMiTGh0dHBzOi8vbGVhZGVyc2hpcC5uZy9uaWdlcmlhLWF0LTYzLWhvbGxhbmRpYS1zcGFya3MtZGFpcnktcG93ZXItZXhjaXRlbWVudC_SAQA?hl=en-IN&gl=IN&ceid=IN%3Aen,2023-10-06
21,5 Things To Do In Louisville This Weekend (10/6-10/8),Louisville Eccentric Observer (LEO Weekly),news.google.com/articles/CBMiVmh0dHBzOi8vd3d3Lmxlb3dlZWtseS5jb20vMjAyMy8xMC81LXRoaW5ncy10by1kby1pbi1sb3Vpc3ZpbGxlLXRoaXMtd2Vla2VuZC0xMC02LTEwLTgv0gEA?hl=en-IN&gl=IN&ceid=IN%3Aen,2023-10-05
6,Goddess of Victory: NIKKE Dazzling Cupid Update Overview,KeenGamer News,news.google.com/articles/CBMiYGh0dHBzOi8vd3d3LmtlZW5nYW1lci5jb20vYXJ0aWNsZXMvbmV3cy9nb2RkZXNzLW9mLXZpY3Rvcnktbmlra2UtZGF6emxpbmctY3VwaWQtdXBkYXRlLW92ZXJ2aWV3L9IBAA?hl=en-IN&gl=IN&ceid=IN%3Aen,2023-10-03
26,10 Terrible Supernatural Monsters That Never Returned,Screen Rant,news.google.com/articles/CBMiQmh0dHBzOi8vc2NyZWVucmFudC5jb20vc3VwZXJuYXR1cmFsLW1vbnN0ZXJzLWJhZC13b3JzdC1ub3QtcmV0dXJuL9IBAA?hl=en-IN&gl=IN&ceid=IN%3Aen,2023-10-01
