,title,source,link,date
0,Should Weakness in Data Patterns (India) Limited's (NSE:DATAPATTNS) Stock Be Seen As A Sign That Market Will Correct The Share Price Given Decent Financials?,Simply Wall St,news.google.com/articles/CBMimQFodHRwczovL3NpbXBseXdhbGwuc3Qvc3RvY2tzL2luL2NhcGl0YWwtZ29vZHMvbnNlLWRhdGFwYXR0bnMvZGF0YS1wYXR0ZXJucy1pbmRpYS1zaGFyZXMvbmV3cy9zaG91bGQtd2Vha25lc3MtaW4tZGF0YS1wYXR0ZXJucy1pbmRpYS1saW1pdGVkcy1uc2VkYXRhcGF0dG7SAZ0BaHR0cHM6Ly9zaW1wbHl3YWxsLnN0L3N0b2Nrcy9pbi9jYXBpdGFsLWdvb2RzL25zZS1kYXRhcGF0dG5zL2RhdGEtcGF0dGVybnMtaW5kaWEtc2hhcmVzL25ld3Mvc2hvdWxkLXdlYWtuZXNzLWluLWRhdGEtcGF0dGVybnMtaW5kaWEtbGltaXRlZHMtbnNlZGF0YXBhdHRuL2FtcA?hl=en-IN&gl=IN&ceid=IN%3Aen,2023-10-25
46,Earth's Vital Signs Have Worsened Beyond Anything Humans Have ...,The Weather Channel,news.google.com/articles/CBMie2h0dHBzOi8vd2VhdGhlci5jb20vZW4tSU4vaW5kaWEvY2xpbWF0ZS1jaGFuZ2UvbmV3cy8yMDIzLTEwLTI1LWVhcnRocy12aXRhbC1zaWducy1oYXZlLXdvcnNlbmVkLWJleW9uZC1hbnl0aGluZy1odW1hbnMtaGF2ZdIBAA?hl=en-IN&gl=IN&ceid=IN%3Aen,2023-10-25
72,Stop Scrolling if You Have no Idea About the Mamaearth IPO,Equitymaster,news.google.com/articles/CBMigAFodHRwczovL3d3dy5lcXVpdHltYXN0ZXIuY29tL2RldGFpbC5hc3A_ZGF0ZT0xMC8yNS8yMDIzJnN0b3J5PTUmdGl0bGU9U3RvcC1TY3JvbGxpbmctaWYtWW91LUhhdmUtbm8tSWRlYS1BYm91dC10aGUtTWFtYWVhcnRoLUlQT9IBAA?hl=en-IN&gl=IN&ceid=IN%3Aen,2023-10-25
59,Recent Advances in Inherited Cardiac Arrhythmias and Their ...,Cureus,news.google.com/articles/CBMicWh0dHBzOi8vd3d3LmN1cmV1cy5jb20vYXJ0aWNsZXMvMTkwMTMzLXJlY2VudC1hZHZhbmNlcy1pbi1pbmhlcml0ZWQtY2FyZGlhYy1hcnJoeXRobWlhcy1hbmQtdGhlaXItZ2VuZXRpYy10ZXN0aW5n0gEA?hl=en-IN&gl=IN&ceid=IN%3Aen,2023-10-25
57,Global forensic accounting market Size to Reach USD 12.75 Billion ...,GlobeNewswire,news.google.com/articles/CBMiogFodHRwczovL3d3dy5nbG9iZW5ld3N3aXJlLmNvbS9uZXdzLXJlbGVhc2UvMjAyMy8xMC8yNS8yNzY2NTM2LzAvZW4vR2xvYmFsLWZvcmVuc2ljLWFjY291bnRpbmctbWFya2V0LVNpemUtdG8tUmVhY2gtVVNELTEyLTc1LUJpbGxpb24taW4tMjAzMi1FbWVyZ2VuLVJlc2VhcmNoLmh0bWzSAQA?hl=en-IN&gl=IN&ceid=IN%3Aen,2023-10-25
39,Bridging Insurance Gaps in India: The Digitalization Revolution,NASSCOM Community,news.google.com/articles/CBMid2h0dHBzOi8vY29tbXVuaXR5Lm5hc3Njb20uaW4vY29tbXVuaXRpZXMvZGlnaXRhbC10cmFuc2Zvcm1hdGlvbi9icmlkZ2luZy1pbnN1cmFuY2UtZ2Fwcy1pbmRpYS1kaWdpdGFsaXphdGlvbi1yZXZvbHV0aW9u0gEA?hl=en-IN&gl=IN&ceid=IN%3Aen,2023-10-25
41,The changing impact of rural electrification on Indian agriculture,Nature.com,news.google.com/articles/CBMiMmh0dHBzOi8vd3d3Lm5hdHVyZS5jb20vYXJ0aWNsZXMvczQxNDY3LTAyMy00MjUzMy030gEA?hl=en-IN&gl=IN&ceid=IN%3Aen,2023-10-25
49,Attachment insecurity and breadcrumbing engagement in young ...,BMC Psychology,news.google.com/articles/CBMiS2h0dHBzOi8vYm1jcHN5Y2hvbG9neS5iaW9tZWRjZW50cmFsLmNvbS9hcnRpY2xlcy8xMC4xMTg2L3M0MDM1OS0wMjMtMDE0MDQtedIBAA?hl=en-IN&gl=IN&ceid=IN%3Aen,2023-10-25
71,Landscape genetics identified conservation priority areas for blue ...,Nature.com,news.google.com/articles/CBMiMmh0dHBzOi8vd3d3Lm5hdHVyZS5jb20vYXJ0aWNsZXMvczQxNTk4LTAyMy00NDgyMy150gEA?hl=en-IN&gl=IN&ceid=IN%3Aen,2023-10-24
68,How HR Can Harness AI to Advance DE&I,Hunt Scanlon Media,news.google.com/articles/CBMiPWh0dHBzOi8vaHVudHNjYW5sb24uY29tL2hvdy1oci1jYW4taGFybmVzcy1haS10by1hZHZhbmNlLWRlaS_SAQA?hl=en-IN&gl=IN&ceid=IN%3Aen,2023-10-23
