,title,source,link,date
77,Saudi Arabia launches 2nd phase of e-visa service for international ...,Arab News,news.google.com/articles/CBMiNmh0dHBzOi8vd3d3LmFyYWJuZXdzLmNvbS9ub2RlLzI0MDQxNjEvYnVzaW5lc3MtZWNvbm9tedIBKWh0dHBzOi8vd3d3LmFyYWJuZXdzLmNvbS9ub2RlLzI0MDQxNjEvYW1w?hl=en-IN&gl=IN&ceid=IN%3Aen,2023-11-18
30,Regional startup investments flourishing thanks to Saudi VCs,Arab News,news.google.com/articles/CBMiNmh0dHBzOi8vd3d3LmFyYWJuZXdzLmNvbS9ub2RlLzI0MDMzNTYvYnVzaW5lc3MtZWNvbm9tedIBKWh0dHBzOi8vd3d3LmFyYWJuZXdzLmNvbS9ub2RlLzI0MDMzNTYvYW1w?hl=en-IN&gl=IN&ceid=IN%3Aen,2023-11-18
5,Saudi Arabia explores investment opportunities in Caribbean at ...,Arab News,news.google.com/articles/CBMiNmh0dHBzOi8vd3d3LmFyYWJuZXdzLmNvbS9ub2RlLzI0MDk4NjEvYnVzaW5lc3MtZWNvbm9tedIBKWh0dHBzOi8vd3d3LmFyYWJuZXdzLmNvbS9ub2RlLzI0MDk4NjEvYW1w?hl=en-IN&gl=IN&ceid=IN%3Aen,2023-11-17
6,Pakistan prepares to launch digital platform to attract investors with ...,Arab News,news.google.com/articles/CBMiNmh0dHBzOi8vd3d3LmFyYWJuZXdzLmNvbS9ub2RlLzI0MTA2MTYvYnVzaW5lc3MtZWNvbm9tedIBKWh0dHBzOi8vd3d3LmFyYWJuZXdzLmNvbS9ub2RlLzI0MTA2MTYvYW1w?hl=en-IN&gl=IN&ceid=IN%3Aen,2023-11-17
8,Oil Updates – crude perks up after sharp week-long selloff on supply ...,Arab News,news.google.com/articles/CBMiNmh0dHBzOi8vd3d3LmFyYWJuZXdzLmNvbS9ub2RlLzI0MTA0NjEvYnVzaW5lc3MtZWNvbm9tedIBKWh0dHBzOi8vd3d3LmFyYWJuZXdzLmNvbS9ub2RlLzI0MTA0NjEvYW1w?hl=en-IN&gl=IN&ceid=IN%3Aen,2023-11-17
9,New policy seeks to propel Saudi aviation sector to new heights by ...,Arab News,news.google.com/articles/CBMiNmh0dHBzOi8vd3d3LmFyYWJuZXdzLmNvbS9ub2RlLzI0MTA3MjYvYnVzaW5lc3MtZWNvbm9tedIBKWh0dHBzOi8vd3d3LmFyYWJuZXdzLmNvbS9ub2RlLzI0MTA3MjYvYW1w?hl=en-IN&gl=IN&ceid=IN%3Aen,2023-11-17
2,Mideast conflict could force gaze of financial institutions away from ...,Arab News,news.google.com/articles/CBMiNmh0dHBzOi8vd3d3LmFyYWJuZXdzLmNvbS9ub2RlLzI0MTA3NDYvYnVzaW5lc3MtZWNvbm9tedIBKWh0dHBzOi8vd3d3LmFyYWJuZXdzLmNvbS9ub2RlLzI0MTA3NDYvYW1w?hl=en-IN&gl=IN&ceid=IN%3Aen,2023-11-17
0,"Saudi DCM Development to Drive Growth, Sukuk Dominates Riyal ...",Fitch Ratings,news.google.com/articles/CBMilQFodHRwczovL3d3dy5maXRjaHJhdGluZ3MuY29tL3Jlc2VhcmNoL25vbi1iYW5rLWZpbmFuY2lhbC1pbnN0aXR1dGlvbnMvc2F1ZGktZGNtLWRldmVsb3BtZW50LXRvLWRyaXZlLWdyb3d0aC1zdWt1ay1kb21pbmF0ZXMtcml5YWwtaXNzdWFuY2UtMTYtMTEtMjAyM9IBAA?hl=en-IN&gl=IN&ceid=IN%3Aen,2023-11-16
7,Saudi private sector sees steady expansion in Q3,Arab News,news.google.com/articles/CBMiNmh0dHBzOi8vd3d3LmFyYWJuZXdzLmNvbS9ub2RlLzI0MTAxMTYvYnVzaW5lc3MtZWNvbm9tedIBKWh0dHBzOi8vd3d3LmFyYWJuZXdzLmNvbS9ub2RlLzI0MTAxMTYvYW1w?hl=en-IN&gl=IN&ceid=IN%3Aen,2023-11-16
14,Deal worth $27m to give new impetus to Saudi-Australian business ...,Arab News,news.google.com/articles/CBMiNmh0dHBzOi8vd3d3LmFyYWJuZXdzLmNvbS9ub2RlLzI0MTAxMDYvYnVzaW5lc3MtZWNvbm9tedIBKWh0dHBzOi8vd3d3LmFyYWJuZXdzLmNvbS9ub2RlLzI0MTAxMDYvYW1w?hl=en-IN&gl=IN&ceid=IN%3Aen,2023-11-16
