,title,source,link,date
0,USGS partners with six states to map critical mineral potential with ...,United States Geological Survey (.gov),news.google.com/articles/CBMidGh0dHBzOi8vd3d3LnVzZ3MuZ292L25ld3MvbmF0aW9uYWwtbmV3cy1yZWxlYXNlL3VzZ3MtcGFydG5lcnMtc2l4LXN0YXRlcy1tYXAtY3JpdGljYWwtbWluZXJhbC1wb3RlbnRpYWwtY3V0dGluZy1lZGdl0gEA?hl=en-IN&gl=IN&ceid=IN%3Aen,2023-10-12
39,Shareholders approve $A26 Billion all-paper bid for Newcrest by ...,ShareCafe,news.google.com/articles/CBMib2h0dHBzOi8vd3d3LnNoYXJlY2FmZS5jb20uYXUvMjAyMy8xMC8xMi9zaGFyZWhvbGRlcnMtYXBwcm92ZS1hMjYtYmlsbGlvbi1hbGwtcGFwZXItYmlkLWZvci1uZXdjcmVzdC1ieS1uZXdtb250L9IBAA?hl=en-IN&gl=IN&ceid=IN%3Aen,2023-10-12
3,Deep-South Resources Hires Ferrodrill to Drill Haib Copper Project ...,Junior Mining Network,news.google.com/articles/CBMiugFodHRwczovL3d3dy5qdW5pb3JtaW5pbmduZXR3b3JrLmNvbS9qdW5pb3ItbWluZXItbmV3cy9wcmVzcy1yZWxlYXNlcy8yMDY3LXRzeC12ZW50dXJlL2RzbS8xNDk0NDItZGVlcC1zb3V0aC1oaXJlcy1mZXJyb2RyaWxsLXRvLWRyaWxsLXRoZS1oYWliLWNvcHBlci1wcm9qZWN0LWluLXRoZS1zb3V0aC1vZi1uYW1pYmlhLmh0bWzSAQA?hl=en-IN&gl=IN&ceid=IN%3Aen,2023-10-12
7,Will Cyprus’ neighbors let it produce and export natural gas?,Geopolitical Intelligence Services AG,news.google.com/articles/CBMiKWh0dHBzOi8vd3d3Lmdpc3JlcG9ydHNvbmxpbmUuY29tL3IvZ2FzLTIv0gEA?hl=en-IN&gl=IN&ceid=IN%3Aen,2023-10-12
11,How Fluid Mechanics Underlies Deep-Sea Mining Challenges,AZoMining,news.google.com/articles/CBMiNWh0dHBzOi8vd3d3LmF6b21pbmluZy5jb20vQXJ0aWNsZS5hc3B4P0FydGljbGVJRD0xNzY00gEA?hl=en-IN&gl=IN&ceid=IN%3Aen,2023-10-12
12,"SIGMA LITHIUM CEO ANA CABRAL NAMED ""MINING PERSON OF ...",PR Newswire,news.google.com/articles/CBMimwFodHRwczovL3d3dy5wcm5ld3N3aXJlLmNvbS9uZXdzLXJlbGVhc2VzL3NpZ21hLWxpdGhpdW0tY2VvLWFuYS1jYWJyYWwtbmFtZWQtbWluaW5nLXBlcnNvbi1vZi10aGUteWVhci1kdXJpbmctbG9uZG9uLW1ldGFsLWV4Y2hhbmdlLXdlZWstMjAyMy0zMDE5NTUwMDYuaHRtbNIBAA?hl=en-IN&gl=IN&ceid=IN%3Aen,2023-10-12
16,CO2 concentration forecasting in smart cities using a hybrid ARIMA ...,Nature.com,news.google.com/articles/CBMiMmh0dHBzOi8vd3d3Lm5hdHVyZS5jb20vYXJ0aWNsZXMvczQxNTk4LTAyMy00MjM0Ni0w0gEA?hl=en-IN&gl=IN&ceid=IN%3Aen,2023-10-12
17,Indonesia's Nickel Rush - Riding the Waves of the EV Battery ...,Lexology,news.google.com/articles/CBMiU2h0dHBzOi8vd3d3LmxleG9sb2d5LmNvbS9saWJyYXJ5L2RldGFpbC5hc3B4P2c9YTMxY2RjYWMtM2JjZC00ZDUwLWFhNDktNTAzZDNjODQwOWY10gEA?hl=en-IN&gl=IN&ceid=IN%3Aen,2023-10-12
22,New California Legislation Adds to Growing Global Climate ...,Kroll,news.google.com/articles/CBMiiAFodHRwczovL3d3dy5rcm9sbC5jb20vZW4vaW5zaWdodHMvcHVibGljYXRpb25zL3ZhbHVhdGlvbi9jYWxpZm9ybmlhLWxlZ2lzbGF0aW9uLWdsb2JhbC1jbGltYXRlLWRpc2Nsb3N1cmUtcHVibGljLWFuZC1wcml2YXRlLWVudGVycHJpc2Vz0gEA?hl=en-IN&gl=IN&ceid=IN%3Aen,2023-10-12
20,"NUPRC, MoF, Mum about Irregularities Flagged in NEITI Report ...",Africa Oil+Gas Report,news.google.com/articles/CBMibmh0dHBzOi8vYWZyaWNhb2lsZ2FzcmVwb3J0LmNvbS8yMDIzLzEwL2luLXRoZS1uZXdzL251cHJjLW1vZi1tdW0tYWJvdXQtaXJyZWd1bGFyaXRpZXMtZmxhZ2dlZC1pbi1uZWl0aS1yZXBvcnQv0gEA?hl=en-IN&gl=IN&ceid=IN%3Aen,2023-10-11
