,title,source,link,date
20,Kaushal Dikshnat Samaroh reflects the priorities of today's India: PM ...,Narendra Modi,news.google.com/articles/CBMidmh0dHBzOi8vd3d3Lm5hcmVuZHJhbW9kaS5pbi90ZXh0LW9mLXByaW1lLW1pbmlzdGVyLW5hcmVuZHJhLW1vZGlzLXZpZGVvLW1lc3NhZ2UtZHVyaW5nLWthdXNoYWwtZGlrc2hhbnQtc2FtYXJvaC01NzQ5NTfSAQA?hl=en-IN&gl=IN&ceid=IN%3Aen,2023-10-12
14,CO2 concentration forecasting in smart cities using a hybrid ARIMA ...,Nature.com,news.google.com/articles/CBMiMmh0dHBzOi8vd3d3Lm5hdHVyZS5jb20vYXJ0aWNsZXMvczQxNTk4LTAyMy00MjM0Ni0w0gEA?hl=en-IN&gl=IN&ceid=IN%3Aen,2023-10-12
47,Critical Elements Lithium Orders First Long Lead Equipment for the ...,Investing News Network,news.google.com/articles/CBMie2h0dHBzOi8vaW52ZXN0aW5nbmV3cy5jb20vY3JpdGljYWwtZWxlbWVudHMtbGl0aGl1bS1vcmRlcnMtZmlyc3QtbG9uZy1sZWFkLWVxdWlwbWVudC1mb3ItdGhlLXJvc2UtbGl0aGl1bS10YW50YWx1bS1wcm9qZWN0L9IBAA?hl=en-IN&gl=IN&ceid=IN%3Aen,2023-10-12
5,Will Cyprus’ neighbors let it produce and export natural gas?,Geopolitical Intelligence Services AG,news.google.com/articles/CBMiKWh0dHBzOi8vd3d3Lmdpc3JlcG9ydHNvbmxpbmUuY29tL3IvZ2FzLTIv0gEA?hl=en-IN&gl=IN&ceid=IN%3Aen,2023-10-12
39,Ukraine says 'holding ground' in frontline town under attack,Arab News,news.google.com/articles/CBMiK2h0dHBzOi8vd3d3LmFyYWJuZXdzLmNvbS9ub2RlLzIzOTAwNjEvd29ybGTSASlodHRwczovL3d3dy5hcmFibmV3cy5jb20vbm9kZS8yMzkwMDYxL2FtcA?hl=en-IN&gl=IN&ceid=IN%3Aen,2023-10-12
35,Shareholders approve $A26 Billion all-paper bid for Newcrest by ...,ShareCafe,news.google.com/articles/CBMib2h0dHBzOi8vd3d3LnNoYXJlY2FmZS5jb20uYXUvMjAyMy8xMC8xMi9zaGFyZWhvbGRlcnMtYXBwcm92ZS1hMjYtYmlsbGlvbi1hbGwtcGFwZXItYmlkLWZvci1uZXdjcmVzdC1ieS1uZXdtb250L9IBAA?hl=en-IN&gl=IN&ceid=IN%3Aen,2023-10-12
8,"Russia’s Low-Risk, High-Reward Strategy for its Return to Africa",Observer Research Foundation,news.google.com/articles/CBMiYmh0dHBzOi8vd3d3Lm9yZm9ubGluZS5vcmcvcmVzZWFyY2gvcnVzc2lhcy1sb3ctcmlzay1oaWdoLXJld2FyZC1zdHJhdGVneS1mb3ItaXRzLXJldHVybi10by1hZnJpY2Ev0gFiaHR0cHM6Ly93d3cub3Jmb25saW5lLm9yZy9yZXNlYXJjaC9ydXNzaWFzLWxvdy1yaXNrLWhpZ2gtcmV3YXJkLXN0cmF0ZWd5LWZvci1pdHMtcmV0dXJuLXRvLWFmcmljYS8?hl=en-IN&gl=IN&ceid=IN%3Aen,2023-10-12
18,"BTV Showcases: West Red Lake Gold, Lion One Metals, ION Energy & Osisko Metals",Investing News Network,news.google.com/articles/CBMiZGh0dHBzOi8vaW52ZXN0aW5nbmV3cy5jb20vYnR2LXNob3djYXNlcy13ZXN0LXJlZC1sYWtlLWdvbGQtbGlvbi1vbmUtbWV0YWxzLWlvbi1lbmVyZ3ktb3Npc2tvLW1ldGFscy_SAXJodHRwczovL2ludmVzdGluZ25ld3MuY29tL2FtcC9idHYtc2hvd2Nhc2VzLXdlc3QtcmVkLWxha2UtZ29sZC1saW9uLW9uZS1tZXRhbHMtaW9uLWVuZXJneS1vc2lza28tbWV0YWxzLTI2NjU5MDQyNTQ?hl=en-IN&gl=IN&ceid=IN%3Aen,2023-10-12
15,NLNG Seeks Increased Investment In Gas To Support Energy ...,Leadership News,news.google.com/articles/CBMiWmh0dHBzOi8vbGVhZGVyc2hpcC5uZy9ubG5nLXNlZWtzLWluY3JlYXNlZC1pbnZlc3RtZW50LWluLWdhcy10by1zdXBwb3J0LWVuZXJneS10cmFuc2l0aW9uL9IBAA?hl=en-IN&gl=IN&ceid=IN%3Aen,2023-10-12
25,Together and Apart: The Conundrum of the China-Russia Partnership,Asia Society,news.google.com/articles/CBMiXmh0dHBzOi8vYXNpYXNvY2lldHkub3JnL3BvbGljeS1pbnN0aXR1dGUvdG9nZXRoZXItYW5kLWFwYXJ0LWNvbnVuZHJ1bS1jaGluYS1ydXNzaWEtcGFydG5lcnNoaXDSAQA?hl=en-IN&gl=IN&ceid=IN%3Aen,2023-10-11
