,title,source,link,date
32,PH-INDIA HOLD DIALOGUE TO STRENGTHEN MARITIME ...,Rappler,news.google.com/articles/CBMiX2h0dHBzOi8vbm93eW91a25vd3BoLnJhcHBsZXIuY29tLzg0MC9waC1pbmRpYS1ob2xkLWRpYWxvZ3VlLXRvLXN0cmVuZ3RoZW4tbWFyaXRpbWUtY29vcGVyYXRpb24v0gEA?hl=en-IN&gl=IN&ceid=IN%3Aen,2023-09-14
3,GEAPP: Advancing India's Green Energy Capacities Through ...,Inventiva,news.google.com/articles/CBMiRGh0dHBzOi8vd3d3LmludmVudGl2YS5jby5pbi90cmVuZHMvZ2VhcHAtaW5kaWEtZ3JlZW4tZW5lcmd5LWNhcGFjaXQv0gEA?hl=en-IN&gl=IN&ceid=IN%3Aen,2023-09-14
22,FIVE at FIVE AU: ASX ends higher as uranium and iron ore gain ...,Proactive Investors USA,news.google.com/articles/CBMiqAFodHRwczovL3d3dy5wcm9hY3RpdmVpbnZlc3RvcnMuY29tL2NvbXBhbmllcy9uZXdzLzEwMjY0ODUvZml2ZS1hdC1maXZlLWF1LWFzeC1lbmRzLWhpZ2hlci1hcy11cmFuaXVtLWFuZC1pcm9uLW9yZS1nYWluLWF1Z3VzdC1lbXBsb3ltZW50LWJlYXRzLWV4cGVjdGF0aW9ucy0xMDI2NDg1Lmh0bWzSAQA?hl=en-IN&gl=IN&ceid=IN%3Aen,2023-09-14
29,Southern Africa to benefit from big oil and gas deposits in Namibia,IOL,news.google.com/articles/CBMilgFodHRwczovL3d3dy5pb2wuY28uemEvYnVzaW5lc3MtcmVwb3J0L2Vjb25vbXkvc291dGhlcm4tYWZyaWNhLXRvLWJlbmVmaXQtZnJvbS1iaWctb2lsLWFuZC1nYXMtZGVwb3NpdHMtaW4tbmFtaWJpYS04ZDVmYzY4Yy1mNDNhLTQ2NjEtODk1NS0yMmI4YjhhOTIwZjXSAQA?hl=en-IN&gl=IN&ceid=IN%3Aen,2023-09-14
13,Changes deep into the community,Latrobe Valley Express,news.google.com/articles/CBMiVGh0dHBzOi8vbGF0cm9iZXZhbGxleWV4cHJlc3MuY29tLmF1L25ld3MvMjAyMy8wOS8xNC9jaGFuZ2VzLWRlZXAtaW50by10aGUtY29tbXVuaXR5L9IBAA?hl=en-IN&gl=IN&ceid=IN%3Aen,2023-09-13
27,Widespread aquifer depressurization after a century of intensive ...,Science,news.google.com/articles/CBMiMmh0dHBzOi8vd3d3LnNjaWVuY2Uub3JnL2RvaS8xMC4xMTI2L3NjaWFkdi5hZGgyOTky0gEA?hl=en-IN&gl=IN&ceid=IN%3Aen,2023-09-13
20,How Deep Are the Canals in Amsterdam?,AZ Animals,news.google.com/articles/CBMiQmh0dHBzOi8vYS16LWFuaW1hbHMuY29tL2Jsb2cvaG93LWRlZXAtYXJlLXRoZS1jYW5hbHMtaW4tYW1zdGVyZGFtL9IBAA?hl=en-IN&gl=IN&ceid=IN%3Aen,2023-09-13
19,"Clean Energy Market Forecast 2023: Business Growth Drivers, Top Market Leaders, and Strategic Insights to",Benzinga,news.google.com/articles/CBMimQFodHRwczovL3d3dy5iZW56aW5nYS5jb20vcHJlc3NyZWxlYXNlcy8yMy8wOS8zNDU1NzA0MS9jbGVhbi1lbmVyZ3ktbWFya2V0LWZvcmVjYXN0LTIwMjMtYnVzaW5lc3MtZ3Jvd3RoLWRyaXZlcnMtdG9wLW1hcmtldC1sZWFkZXJzLWFuZC1zdHJhdGVnaWMtaW5zaWdodHPSAS1odHRwczovL3d3dy5iZW56aW5nYS5jb20vYW1wL2NvbnRlbnQvMzQ1NTcwNDE?hl=en-IN&gl=IN&ceid=IN%3Aen,2023-09-13
30,White House Chief of Staff's Wealth and Connections Collide With ...,The Intercept,news.google.com/articles/CBMiSWh0dHBzOi8vdGhlaW50ZXJjZXB0LmNvbS8yMDIzLzA5LzEzL2JpZGVuLWNoaWVmLXN0YWZmLWplZmYtemllbnRzLW1pbmluZy_SAQA?hl=en-IN&gl=IN&ceid=IN%3Aen,2023-09-13
14,Soil water dynamics and biomass production of young rooibos ...,Nature.com,news.google.com/articles/CBMiMmh0dHBzOi8vd3d3Lm5hdHVyZS5jb20vYXJ0aWNsZXMvczQxNTk4LTAyMy00MTY2Ni010gEA?hl=en-IN&gl=IN&ceid=IN%3Aen,2023-09-13
