,title,source,link,date
38,"Dive Deep into the Shareholding Patterns, Revenue Mix, and Predicted market size at CAGR of 9.5% of Top C",Benzinga,news.google.com/articles/CBMimQFodHRwczovL3d3dy5iZW56aW5nYS5jb20vcHJlc3NyZWxlYXNlcy8yMy8wOS8zNDE5NTM0My9kaXZlLWRlZXAtaW50by10aGUtc2hhcmVob2xkaW5nLXBhdHRlcm5zLXJldmVudWUtbWl4LWFuZC1wcmVkaWN0ZWQtbWFya2V0LXNpemUtYXQtY2Fnci1vZi05LTUtb2YtdG_SAS1odHRwczovL3d3dy5iZW56aW5nYS5jb20vYW1wL2NvbnRlbnQvMzQxOTUzNDM?hl=en-IN&gl=IN&ceid=IN%3Aen,2023-09-04
50,Batman Beyond: Neo-Gothic Updates A Classic Villain Design,CBR - Comic Book Resources,news.google.com/articles/CBMiOWh0dHBzOi8vd3d3LmNici5jb20vYmF0bWFuLWJleW9uZC1uZW8tZ290aGljLW5ldy1kZXNpZ25zL9IBAA?hl=en-IN&gl=IN&ceid=IN%3Aen,2023-09-04
36,A Deep Dive into the Across The Line Capacitor Market: Market size and Valuation with projected CAGR rate,Benzinga,news.google.com/articles/CBMimQFodHRwczovL3d3dy5iZW56aW5nYS5jb20vcHJlc3NyZWxlYXNlcy8yMy8wOS8zNDE5NTMzNS9hLWRlZXAtZGl2ZS1pbnRvLXRoZS1hY3Jvc3MtdGhlLWxpbmUtY2FwYWNpdG9yLW1hcmtldC1tYXJrZXQtc2l6ZS1hbmQtdmFsdWF0aW9uLXdpdGgtcHJvamVjdGVkLWNhZ3LSAS1odHRwczovL3d3dy5iZW56aW5nYS5jb20vYW1wL2NvbnRlbnQvMzQxOTUzMzU?hl=en-IN&gl=IN&ceid=IN%3Aen,2023-09-04
44,"Hesperetin Market Opportunity,Trend, Demand and Global Business Growth by 2029| Tokyo Chemical Industry Co., L",openPR,news.google.com/articles/CBMiWWh0dHBzOi8vd3d3Lm9wZW5wci5jb20vbmV3cy8zMTkzNTEwL2hlc3BlcmV0aW4tbWFya2V0LW9wcG9ydHVuaXR5LXRyZW5kLWRlbWFuZC1hbmQtZ2xvYmFs0gFYaHR0cHM6Ly93d3cub3BlbnByLmNvbS9hbXAvMzE5MzUxMC9oZXNwZXJldGluLW1hcmtldC1vcHBvcnR1bml0eS10cmVuZC1kZW1hbmQtYW5kLWdsb2JhbA?hl=en-IN&gl=IN&ceid=IN%3Aen,2023-09-04
31,Offshore Drilling Rigs Market Forecast Report 2023-2030 | 107 ...,Benzinga,news.google.com/articles/CBMifmh0dHBzOi8vd3d3LmJlbnppbmdhLmNvbS9wcmVzc3JlbGVhc2VzLzIzLzA5LzM0MTk2NDcxL29mZnNob3JlLWRyaWxsaW5nLXJpZ3MtbWFya2V0LWZvcmVjYXN0LXJlcG9ydC0yMDIzLTIwMzAtMTA3LXBhZ2VzLXJlcG9ydNIBAA?hl=en-IN&gl=IN&ceid=IN%3Aen,2023-09-04
45,"Silicone Diffusion Pump Oil Market Latest Trends, Industry Size, Potential Growth And Analysis Of Key Players",openPR,news.google.com/articles/CBMiXWh0dHBzOi8vd3d3Lm9wZW5wci5jb20vbmV3cy8zMTkzMzEzL3NpbGljb25lLWRpZmZ1c2lvbi1wdW1wLW9pbC1tYXJrZXQtbGF0ZXN0LXRyZW5kcy1pbmR1c3RyedIBXGh0dHBzOi8vd3d3Lm9wZW5wci5jb20vYW1wLzMxOTMzMTMvc2lsaWNvbmUtZGlmZnVzaW9uLXB1bXAtb2lsLW1hcmtldC1sYXRlc3QtdHJlbmRzLWluZHVzdHJ5?hl=en-IN&gl=IN&ceid=IN%3Aen,2023-09-04
46,"Hose Reels Market Scope is offering deep insights into historical trends and future projections, the its",Benzinga,news.google.com/articles/CBMimQFodHRwczovL3d3dy5iZW56aW5nYS5jb20vcHJlc3NyZWxlYXNlcy8yMy8wOS8zNDE5NzUwMy9ob3NlLXJlZWxzLW1hcmtldC1zY29wZS1pcy1vZmZlcmluZy1kZWVwLWluc2lnaHRzLWludG8taGlzdG9yaWNhbC10cmVuZHMtYW5kLWZ1dHVyZS1wcm9qZWN0aW9ucy10aGXSAS1odHRwczovL3d3dy5iZW56aW5nYS5jb20vYW1wL2NvbnRlbnQvMzQxOTc1MDM?hl=en-IN&gl=IN&ceid=IN%3Aen,2023-09-04
27,"Directional Drilling Services Market Size, Share, Price, Trends, Growth, Analysis, Forecast 2023-2028",Benzinga,news.google.com/articles/CBMilQFodHRwczovL3d3dy5iZW56aW5nYS5jb20vcHJlc3NyZWxlYXNlcy8yMy8wOS8zNDE5ODgxOC9kaXJlY3Rpb25hbC1kcmlsbGluZy1zZXJ2aWNlcy1tYXJrZXQtc2l6ZS1zaGFyZS1wcmljZS10cmVuZHMtZ3Jvd3RoLWFuYWx5c2lzLWZvcmVjYXN0LTIwMjMtMjAyONIBLWh0dHBzOi8vd3d3LmJlbnppbmdhLmNvbS9hbXAvY29udGVudC8zNDE5ODgxOA?hl=en-IN&gl=IN&ceid=IN%3Aen,2023-09-04
26,"Rayon Fancy Yarn Market | BILLION HANG, Cortex Textile, Filpucci spa, Grasim Industries Limited",openPR,news.google.com/articles/CBMiYGh0dHBzOi8vd3d3Lm9wZW5wci5jb20vbmV3cy8zMTkzNTc5L3JheW9uLWZhbmN5LXlhcm4tbWFya2V0LWJpbGxpb24taGFuZy1jb3J0ZXgtdGV4dGlsZS1maWxwdWNjadIBX2h0dHBzOi8vd3d3Lm9wZW5wci5jb20vYW1wLzMxOTM1NzkvcmF5b24tZmFuY3kteWFybi1tYXJrZXQtYmlsbGlvbi1oYW5nLWNvcnRleC10ZXh0aWxlLWZpbHB1Y2Np?hl=en-IN&gl=IN&ceid=IN%3Aen,2023-09-04
47,Water Treatment Flocculant Market Forecast By Type And By Application With Detailed Development History 2023-2,openPR,news.google.com/articles/CBMiWmh0dHBzOi8vd3d3Lm9wZW5wci5jb20vbmV3cy8zMTkzMzMyL3dhdGVyLXRyZWF0bWVudC1mbG9jY3VsYW50LW1hcmtldC1mb3JlY2FzdC1ieS10eXBlLWFuZNIBWWh0dHBzOi8vd3d3Lm9wZW5wci5jb20vYW1wLzMxOTMzMzIvd2F0ZXItdHJlYXRtZW50LWZsb2NjdWxhbnQtbWFya2V0LWZvcmVjYXN0LWJ5LXR5cGUtYW5k?hl=en-IN&gl=IN&ceid=IN%3Aen,2023-09-04
