,title,source,link,date
42,Fujitsu strengthens DX consulting capabilities with plans to acquire ...,Fujitsu,news.google.com/articles/CBMiVGh0dHBzOi8vd3d3LmZ1aml0c3UuY29tL2dsb2JhbC9hYm91dC9yZXNvdXJjZXMvbmV3cy9wcmVzcy1yZWxlYXNlcy8yMDIzLzA5MTgtMDEuaHRtbNIBAA?hl=en-IN&gl=IN&ceid=IN%3Aen,2023-09-18
87,Procurement update: a guide to housing joint ventures,Building,news.google.com/articles/CBMia2h0dHBzOi8vd3d3LmJ1aWxkaW5nLmNvLnVrL21hcmtldC1kYXRhL3Byb2N1cmVtZW50LXVwZGF0ZS1hLWd1aWRlLXRvLWhvdXNpbmctam9pbnQtdmVudHVyZXMvNTEyNTE2Mi5hcnRpY2xl0gEA?hl=en-IN&gl=IN&ceid=IN%3Aen,2023-09-18
23,Amazon's Prime Big Deal Days event is October 10-11,About Amazon,news.google.com/articles/CBMiVmh0dHBzOi8vd3d3LmFib3V0YW1hem9uLmNvbS9uZXdzL3JldGFpbC9hbWF6b24tYW5ub3VuY2VzLXByaW1lLWJpZy1kZWFsLWRheXMtMjAyMy1kYXRl0gEA?hl=en-IN&gl=IN&ceid=IN%3Aen,2023-09-18
64,"WorkSafe Victoria charges water tank manufacturer Polymaster after man dies, another seriously injured",ABC News,news.google.com/articles/CBMiYGh0dHBzOi8vd3d3LmFiYy5uZXQuYXUvbmV3cy8yMDIzLTA5LTE4L3BvbHltYXN0ZXItY2hhcmdlZC13b3Jrc2FmZS10YW5rLWRlbGl2ZXJ5LWRlYXRoLzEwMjg3MDM4NtIBKGh0dHBzOi8vYW1wLmFiYy5uZXQuYXUvYXJ0aWNsZS8xMDI4NzAzODY?hl=en-IN&gl=IN&ceid=IN%3Aen,2023-09-18
2,How Small Businesses Can Maximize the Benefits of Delivery Apps,CO— by the U.S. Chamber of Commerce,news.google.com/articles/CBMiV2h0dHBzOi8vd3d3LnVzY2hhbWJlci5jb20vY28vc3RhcnQvc3RyYXRlZ3kvaG93LWRlbGl2ZXJ5LWFwcHMtd29yay1mb3Itc21hbGwtYnVzaW5lc3Nlc9IBAA?hl=en-IN&gl=IN&ceid=IN%3Aen,2023-09-18
21,"Alaska Krispy Kreme van raided by doughnut-loving mama bear, cub",USA TODAY,news.google.com/articles/CBMicWh0dHBzOi8vd3d3LnVzYXRvZGF5LmNvbS9zdG9yeS9uZXdzL25hdGlvbi8yMDIzLzA5LzE4L2FsYXNrYS1rcmlzcHkta3JlbWUtdmFuLWRvdWdobnV0cy1yYWlkZWQtYmVhcnMvNzA4OTEwOTMwMDcv0gEA?hl=en-IN&gl=IN&ceid=IN%3Aen,2023-09-18
9,Identifying Routes to Integrated Water Management Delivery,WSP,news.google.com/articles/CBMiXWh0dHBzOi8vd3d3LndzcC5jb20vZW4tc2cvaW5zaWdodHMvaWRlbnRpZnlpbmctcm91dGVzLXRvLWludGVncmF0ZWQtd2F0ZXItbWFuYWdlbWVudC1kZWxpdmVyedIBAA?hl=en-IN&gl=IN&ceid=IN%3Aen,2023-09-18
34,Instacart files for an IPO as the market for new public listings thaws following Arm’s blockbuster debut last week,Fortune,news.google.com/articles/CBMiL2h0dHBzOi8vZm9ydHVuZS5jb20vMjAyMy8wOS8xOC9pbnN0YWNhcnQtaXBvLTIv0gEzaHR0cHM6Ly9mb3J0dW5lLmNvbS8yMDIzLzA5LzE4L2luc3RhY2FydC1pcG8tMi9hbXAv?hl=en-IN&gl=IN&ceid=IN%3Aen,2023-09-18
88,Screening for Hypertensive Disorders of Pregnancy: US Preventive ...,JAMA Network,news.google.com/articles/CBMiOWh0dHBzOi8vamFtYW5ldHdvcmsuY29tL2pvdXJuYWxzL2phbWEvZnVsbGFydGljbGUvMjgwOTY4MNIBAA?hl=en-IN&gl=IN&ceid=IN%3Aen,2023-09-18
6,Volkswagen’s Dealer Held Liable For Deficiency In Service; Hyderabad-I District Commission,Live Law - Indian Legal News,news.google.com/articles/CBMiqQFodHRwczovL3d3dy5saXZlbGF3LmluL2NvbnN1bWVyLWNhc2VzL3ZvbGtzd2FnZW5zLWRlYWxlci1oZWxkLWxpYWJsZS1mb3ItZGVmaWNpZW5jeS1pbi1zZXJ2aWNlLWh5ZGVyYWJhZC1pLWNvbW1pc3Npb24tYXdhcmRzLXJlZnVuZC1hbG9uZy13aXRoLXJzLTE1ay1jb21wZW5zYXRpb24tMjM4MDM30gGtAWh0dHBzOi8vd3d3LmxpdmVsYXcuaW4vYW1wL2NvbnN1bWVyLWNhc2VzL3ZvbGtzd2FnZW5zLWRlYWxlci1oZWxkLWxpYWJsZS1mb3ItZGVmaWNpZW5jeS1pbi1zZXJ2aWNlLWh5ZGVyYWJhZC1pLWNvbW1pc3Npb24tYXdhcmRzLXJlZnVuZC1hbG9uZy13aXRoLXJzLTE1ay1jb21wZW5zYXRpb24tMjM4MDM3?hl=en-IN&gl=IN&ceid=IN%3Aen,2023-09-18
