,title,source,link,date
31,"The Inductors market's size, dynamics, and anticipated development from 2023 to 2030 are analyzed in deta",Benzinga,news.google.com/articles/CBMimQFodHRwczovL3d3dy5iZW56aW5nYS5jb20vcHJlc3NyZWxlYXNlcy8yMy8wOS8zNDE5NTM1Ni90aGUtaW5kdWN0b3JzLW1hcmtldHMtc2l6ZS1keW5hbWljcy1hbmQtYW50aWNpcGF0ZWQtZGV2ZWxvcG1lbnQtZnJvbS0yMDIzLXRvLTIwMzAtYXJlLWFuYWx5emVkLWluLWTSAS1odHRwczovL3d3dy5iZW56aW5nYS5jb20vYW1wL2NvbnRlbnQvMzQxOTUzNTY?hl=en-IN&gl=IN&ceid=IN%3Aen,2023-09-04
28,Indoor Furniture Market Trends Report 2023-2030 | 99 Pages Report,Benzinga,news.google.com/articles/CBMidWh0dHBzOi8vd3d3LmJlbnppbmdhLmNvbS9wcmVzc3JlbGVhc2VzLzIzLzA5LzM0MTk2MTYwL2luZG9vci1mdXJuaXR1cmUtbWFya2V0LXRyZW5kcy1yZXBvcnQtMjAyMy0yMDMwLTk5LXBhZ2VzLXJlcG9ydNIBLWh0dHBzOi8vd3d3LmJlbnppbmdhLmNvbS9hbXAvY29udGVudC8zNDE5NjE2MA?hl=en-IN&gl=IN&ceid=IN%3Aen,2023-09-04
14,"Thai startup ecosystem a role model for Cambodia, expert says",Khmer Times,news.google.com/articles/CBMiZGh0dHBzOi8vd3d3LmtobWVydGltZXNraC5jb20vNTAxMzUzOTQxL3RoYWktc3RhcnR1cC1lY29zeXN0ZW0tYS1yb2xlLW1vZGVsLWZvci1jYW1ib2RpYS1leHBlcnQtc2F5cy_SAQA?hl=en-IN&gl=IN&ceid=IN%3Aen,2023-09-03
76,The Three Phase String Inverters market study analyses the growth prospects for the Three Phase String In,Benzinga,news.google.com/articles/CBMimQFodHRwczovL3d3dy5iZW56aW5nYS5jb20vcHJlc3NyZWxlYXNlcy8yMy8wOS8zNDE5MzIzNy90aGUtdGhyZWUtcGhhc2Utc3RyaW5nLWludmVydGVycy1tYXJrZXQtc3R1ZHktYW5hbHlzZXMtdGhlLWdyb3d0aC1wcm9zcGVjdHMtZm9yLXRoZS10aHJlZS1waGFzZS1zdHLSAS1odHRwczovL3d3dy5iZW56aW5nYS5jb20vYW1wL2NvbnRlbnQvMzQxOTMyMzc?hl=en-IN&gl=IN&ceid=IN%3Aen,2023-09-03
60,"A detailed analysis of the Silicone Impression Materials market's demand, major suppliers, and key geogra",Benzinga,news.google.com/articles/CBMimQFodHRwczovL3d3dy5iZW56aW5nYS5jb20vcHJlc3NyZWxlYXNlcy8yMy8wOS8zNDE5MzQyNC9hLWRldGFpbGVkLWFuYWx5c2lzLW9mLXRoZS1zaWxpY29uZS1pbXByZXNzaW9uLW1hdGVyaWFscy1tYXJrZXRzLWRlbWFuZC1tYWpvci1zdXBwbGllcnMtYW5kLWtleS1nZW_SAS1odHRwczovL3d3dy5iZW56aW5nYS5jb20vYW1wL2NvbnRlbnQvMzQxOTM0MjQ?hl=en-IN&gl=IN&ceid=IN%3Aen,2023-09-03
42,Tubular Solenoids Market Revenue and Forecast from 2023 - 2030 ...,Benzinga,news.google.com/articles/CBMimQFodHRwczovL3d3dy5iZW56aW5nYS5jb20vcHJlc3NyZWxlYXNlcy8yMy8wOS8zNDE5NDkzNy90dWJ1bGFyLXNvbGVub2lkcy1tYXJrZXQtcmV2ZW51ZS1hbmQtZm9yZWNhc3QtZnJvbS0yMDIzLTIwMzAtYmFzZWQtb24taXRzLWluZHVzdHJ5LWdyb3d0aC1hbmQtcmV2ZW7SAQA?hl=en-IN&gl=IN&ceid=IN%3Aen,2023-09-03
38,"The Digital Data Loggers market research report with a growing CAGR of 12.1% may aid manufacturers, suppl",Benzinga,news.google.com/articles/CBMimQFodHRwczovL3d3dy5iZW56aW5nYS5jb20vcHJlc3NyZWxlYXNlcy8yMy8wOS8zNDE5NDE5OS90aGUtZGlnaXRhbC1kYXRhLWxvZ2dlcnMtbWFya2V0LXJlc2VhcmNoLXJlcG9ydC13aXRoLWEtZ3Jvd2luZy1jYWdyLW9mLTEyLTEtbWF5LWFpZC1tYW51ZmFjdHVyZXJzLXPSAS1odHRwczovL3d3dy5iZW56aW5nYS5jb20vYW1wL2NvbnRlbnQvMzQxOTQxOTk?hl=en-IN&gl=IN&ceid=IN%3Aen,2023-09-03
37,"The Fire Safety Helmets Market Analysis Report focuses on its Market Growth development, average selling",Benzinga,news.google.com/articles/CBMimQFodHRwczovL3d3dy5iZW56aW5nYS5jb20vcHJlc3NyZWxlYXNlcy8yMy8wOS8zNDE5MzcxOC90aGUtZmlyZS1zYWZldHktaGVsbWV0cy1tYXJrZXQtYW5hbHlzaXMtcmVwb3J0LWZvY3VzZXMtb24taXRzLW1hcmtldC1ncm93dGgtZGV2ZWxvcG1lbnQtYXZlcmFnZS1zZWzSAS1odHRwczovL3d3dy5iZW56aW5nYS5jb20vYW1wL2NvbnRlbnQvMzQxOTM3MTg?hl=en-IN&gl=IN&ceid=IN%3Aen,2023-09-03
84,Forecasting the Fixed Firefighting Systems Market's Growth with a 9.7% CAGR and COVID-19 Impact Analysis,Benzinga,news.google.com/articles/CBMimQFodHRwczovL3d3dy5iZW56aW5nYS5jb20vcHJlc3NyZWxlYXNlcy8yMy8wOS8zNDE5Mzg3NS9mb3JlY2FzdGluZy10aGUtZml4ZWQtZmlyZWZpZ2h0aW5nLXN5c3RlbXMtbWFya2V0cy1ncm93dGgtd2l0aC1hLTktNy1jYWdyLWFuZC1jb3ZpZC0xOS1pbXBhY3QtYW5hbHnSAS1odHRwczovL3d3dy5iZW56aW5nYS5jb20vYW1wL2NvbnRlbnQvMzQxOTM4NzU?hl=en-IN&gl=IN&ceid=IN%3Aen,2023-09-03
80,The Rotary Die Cutters Market: An In-Depth Analysis of Industry Trends and Growth Drivers with an anticip,Benzinga,news.google.com/articles/CBMimQFodHRwczovL3d3dy5iZW56aW5nYS5jb20vcHJlc3NyZWxlYXNlcy8yMy8wOS8zNDE5MTk4My90aGUtcm90YXJ5LWRpZS1jdXR0ZXJzLW1hcmtldC1hbi1pbi1kZXB0aC1hbmFseXNpcy1vZi1pbmR1c3RyeS10cmVuZHMtYW5kLWdyb3d0aC1kcml2ZXJzLXdpdGgtYW4tYW7SAS1odHRwczovL3d3dy5iZW56aW5nYS5jb20vYW1wL2NvbnRlbnQvMzQxOTE5ODM?hl=en-IN&gl=IN&ceid=IN%3Aen,2023-09-02
