,title,source,link,date
36,Google's Cookie Killing Tech Is Now On Almost Every Chrome ...,Slashdot,news.google.com/articles/CBMicWh0dHBzOi8veXJvLnNsYXNoZG90Lm9yZy9zdG9yeS8yMy8wOS8wNy8yMTE5MjM0L2dvb2dsZXMtY29va2llLWtpbGxpbmctdGVjaC1pcy1ub3ctb24tYWxtb3N0LWV2ZXJ5LWNocm9tZS1icm93c2Vy0gEA?hl=en-IN&gl=IN&ceid=IN%3Aen,2023-09-08
37,Intelligent Process Automation (IPA) Market Global 2023: Thorough Growth Analysis from 2023 to 2030,Benzinga,news.google.com/articles/CBMilgFodHRwczovL3d3dy5iZW56aW5nYS5jb20vcHJlc3NyZWxlYXNlcy8yMy8wOS8zNDM3MDc4MC9pbnRlbGxpZ2VudC1wcm9jZXNzLWF1dG9tYXRpb24taXBhLW1hcmtldC1nbG9iYWwtMjAyMy10aG9yb3VnaC1ncm93dGgtYW5hbHlzaXMtZnJvbS0yMDIzLXRvLTIwMzDSAS1odHRwczovL3d3dy5iZW56aW5nYS5jb20vYW1wL2NvbnRlbnQvMzQzNzA3ODA?hl=en-IN&gl=IN&ceid=IN%3Aen,2023-09-08
39,Stakeholders seeking to achieve a growing CAGR of 8.4% can leverage the insights provided in the Dental C,Benzinga,news.google.com/articles/CBMimQFodHRwczovL3d3dy5iZW56aW5nYS5jb20vcHJlc3NyZWxlYXNlcy8yMy8wOS8zNDM3MzYzMS9zdGFrZWhvbGRlcnMtc2Vla2luZy10by1hY2hpZXZlLWEtZ3Jvd2luZy1jYWdyLW9mLTgtNC1jYW4tbGV2ZXJhZ2UtdGhlLWluc2lnaHRzLXByb3ZpZGVkLWluLXRoZS1kZW7SAS1odHRwczovL3d3dy5iZW56aW5nYS5jb20vYW1wL2NvbnRlbnQvMzQzNzM2MzE?hl=en-IN&gl=IN&ceid=IN%3Aen,2023-09-08
70,Forecasting the Dental Restorative Materials Market's Growth with a 8.9% CAGR and COVID-19 Impact Analysi,Benzinga,news.google.com/articles/CBMimQFodHRwczovL3d3dy5iZW56aW5nYS5jb20vcHJlc3NyZWxlYXNlcy8yMy8wOS8zNDM1MTA3MC9mb3JlY2FzdGluZy10aGUtZGVudGFsLXJlc3RvcmF0aXZlLW1hdGVyaWFscy1tYXJrZXRzLWdyb3d0aC13aXRoLWEtOC05LWNhZ3ItYW5kLWNvdmlkLTE5LWltcGFjdC1hbmHSAS1odHRwczovL3d3dy5iZW56aW5nYS5jb20vYW1wL2NvbnRlbnQvMzQzNTEwNzA?hl=en-IN&gl=IN&ceid=IN%3Aen,2023-09-08
61,"TV18 Broadcast Ltd Share Price Today, TV18BRDCST Share Price ...",Business Today,news.google.com/articles/CBMiVGh0dHBzOi8vd3d3LmJ1c2luZXNzdG9kYXkuaW4vc3RvY2tzL3R2MTgtYnJvYWRjYXN0LWx0ZC10djE4YnJkY3N0LXNoYXJlLXByaWNlLTM2Mzk4NtIBAA?hl=en-IN&gl=IN&ceid=IN%3Aen,2023-09-06
