,title,source,link,date
18,IDCOL hands over Tk70 crore to govt from its net profit,The Business Standard,news.google.com/articles/CBMiYWh0dHBzOi8vd3d3LnRic25ld3MubmV0L2Vjb25vbXkvY29ycG9yYXRlcy9pZGNvbC1oYW5kcy1vdmVyLXRrNzAtY3JvcmUtZ292dC1pdHMtbmV0LXByb2ZpdC02ODU0NzTSAQA?hl=en-IN&gl=IN&ceid=IN%3Aen,2023-08-20
42,Get A Complete List of High-Profit Companies Acquired by Reliance ...,TechnoSports Media Group,news.google.com/articles/CBMiQGh0dHBzOi8vdGVjaG5vc3BvcnRzLmNvLmluL2NvbXBhbmllcy1hY3F1aXJlZC1ieS1yZWxpYW5jZS1ncm91cC_SAQA?hl=en-IN&gl=IN&ceid=IN%3Aen,2023-08-19
46,WHO Aspartame Safety Panel Linked To Alleged Coca-Cola Front ...,Slashdot,news.google.com/articles/CBMidmh0dHBzOi8vc2NpZW5jZS5zbGFzaGRvdC5vcmcvc3RvcnkvMjMvMDgvMTgvMjIxMjIxNi93aG8tYXNwYXJ0YW1lLXNhZmV0eS1wYW5lbC1saW5rZWQtdG8tYWxsZWdlZC1jb2NhLWNvbGEtZnJvbnQtZ3JvdXDSAQA?hl=en-IN&gl=IN&ceid=IN%3Aen,2023-08-19
31,"TV18 Broadcast Ltd Share Price Today, TV18BRDCST Share Price ...",Business Today,news.google.com/articles/CBMiVGh0dHBzOi8vd3d3LmJ1c2luZXNzdG9kYXkuaW4vc3RvY2tzL3R2MTgtYnJvYWRjYXN0LWx0ZC10djE4YnJkY3N0LXNoYXJlLXByaWNlLTM2Mzk4NtIBAA?hl=en-IN&gl=IN&ceid=IN%3Aen,2023-08-18
36,"Touchwood Entertainment Ltd Share Price Today, TOUCHWOOD ...",Business Today,news.google.com/articles/CBMiXGh0dHBzOi8vd3d3LmJ1c2luZXNzdG9kYXkuaW4vc3RvY2tzL3RvdWNod29vZC1lbnRlcnRhaW5tZW50LWx0ZC10b3VjaHdvb2Qtc2hhcmUtcHJpY2UtMzY1ODE00gEA?hl=en-IN&gl=IN&ceid=IN%3Aen,2023-08-18
41,Mozilla Foundation Warns France's Proposed Web Blocking Law ...,Slashdot,news.google.com/articles/CBMiiwFodHRwczovL3lyby5zbGFzaGRvdC5vcmcvc3RvcnkvMjMvMDgvMTgvMjA1NjIwMi9tb3ppbGxhLWZvdW5kYXRpb24td2FybnMtZnJhbmNlcy1wcm9wb3NlZC13ZWItYmxvY2tpbmctbGF3LWNvdWxkLXRocmVhdGVuLXRoZS1mcmVlLWludGVybmV00gEA?hl=en-IN&gl=IN&ceid=IN%3Aen,2023-08-18
73,"Sun TV Network Ltd Share Price Today, SUNTV Share Price NSE ...",Business Today,news.google.com/articles/CBMiT2h0dHBzOi8vd3d3LmJ1c2luZXNzdG9kYXkuaW4vc3RvY2tzL3N1bi10di1uZXR3b3JrLWx0ZC1zdW50di1zaGFyZS1wcmljZS0zNjMyMjLSAQA?hl=en-IN&gl=IN&ceid=IN%3Aen,2023-08-18
0,Mukesh Ambani stocks that are trading under ₹ 50 to keep an eye on,Trade Brains,news.google.com/articles/CBMiYWh0dHBzOi8vdHJhZGVicmFpbnMuaW4vZmVhdHVyZXMvbXVrZXNoLWFtYmFuaS1zdG9ja3MtdGhhdC1hcmUtdHJhZGluZy11bmRlci01MC10by1rZWVwLWFuLWV5ZS1vbi_SAQA?hl=en-IN&gl=IN&ceid=IN%3Aen,2023-08-17
58,Scientists Recreate Pink Floyd Song By Reading Brain Signals of ...,Slashdot,news.google.com/articles/CBMifWh0dHBzOi8vc2NpZW5jZS5zbGFzaGRvdC5vcmcvc3RvcnkvMjMvMDgvMTYvMjEzOTI0Ni9zY2llbnRpc3RzLXJlY3JlYXRlLXBpbmstZmxveWQtc29uZy1ieS1yZWFkaW5nLWJyYWluLXNpZ25hbHMtb2YtbGlzdGVuZXJz0gEA?hl=en-IN&gl=IN&ceid=IN%3Aen,2023-08-17
2,Media Stocks on Prime Time: Stay Tuned for the Next Leg of ...,MarketSmith India,news.google.com/articles/CBMiaWh0dHBzOi8vbWFya2V0c21pdGhpbmRpYS5jb20vcG9zdC9tZWRpYS1zdG9ja3Mtb24tcHJpbWUtdGltZS1zdGF5LXR1bmVkLWZvci10aGUtbmV4dC1sZWctb2YtZW50ZXJ0YWlubWVudNIBAA?hl=en-IN&gl=IN&ceid=IN%3Aen,2023-08-12
