,title,source,link,date
2,ED cannot arrest people on whims and fancies; Sec 50 of PMLA does not give power to arrest: Delhi HC,ETV Bharat,news.google.com/articles/CBMipQFodHRwczovL3d3dy5ldHZiaGFyYXQuY29tL2VuZ2xpc2gvYmhhcmF0L2VkLWNhbm5vdC1hcnJlc3QtcGVvcGxlLW9uLXdoaW1zLWFuZC1mYW5jaWVzLXNlYy01MC1vZi1wbWxhLWRvZXMtbm90LWdpdmUtcG93ZXItdG8tYXJyZXN0LWRlbGhpLWhjL25hMjAyMzEwMTkyMjI5NTg3NjU3NjUzMjXSAakBaHR0cHM6Ly93d3cuZXR2YmhhcmF0LmNvbS9hbXAvZW5nbGlzaC9iaGFyYXQvZWQtY2Fubm90LWFycmVzdC1wZW9wbGUtb24td2hpbXMtYW5kLWZhbmNpZXMtc2VjLTUwLW9mLXBtbGEtZG9lcy1ub3QtZ2l2ZS1wb3dlci10by1hcnJlc3QtZGVsaGktaGMvbmEyMDIzMTAxOTIyMjk1ODc2NTc2NTMyNQ?hl=en-IN&gl=IN&ceid=IN%3Aen,2023-10-19
0,NCLT Delhi Approves Resolution Plan For Educomp Solutions Limited,Live Law - Indian Legal News,news.google.com/articles/CBMiZWh0dHBzOi8vd3d3LmxpdmVsYXcuaW4vaWJjLWNhc2VzL25jbHQtZGVsaGktYXBwcm92ZXMtcmVzb2x1dGlvbi1wbGFuLWVkdWNvbXAtc29sdXRpb25zLWxpbWl0ZWQtMjQwNDY20gFpaHR0cHM6Ly93d3cubGl2ZWxhdy5pbi9hbXAvaWJjLWNhc2VzL25jbHQtZGVsaGktYXBwcm92ZXMtcmVzb2x1dGlvbi1wbGFuLWVkdWNvbXAtc29sdXRpb25zLWxpbWl0ZWQtMjQwNDY2?hl=en-IN&gl=IN&ceid=IN%3Aen,2023-10-18
7,"ASEAN Smart Education and Learning Market Size, Share ...",Digital Journal,news.google.com/articles/CBMipwJodHRwczovL3d3dy5kaWdpdGFsam91cm5hbC5jb20vcHIvbmV3cy9jb2hlcmVudC1tYXJrZXQtaW5zaWdodHMvYXNlYW4tc21hcnQtZWR1Y2F0aW9uLWFuZC1sZWFybmluZy1tYXJrZXQtc2l6ZS1zaGFyZS1jb21wYW55LXByb2ZpbGVzLXRlY2hub2xvZ2ljYWwtZGV2ZWxvcG1lbnRzLXRyZW5kcy1pbmR1c3RyeS1ncm93dGgtc2VnbWVudHMtYW5kLWRlbWFuZC1mb3JlY2FzdC11bnRpbC0yMDMwLWFkb2JlLXN5c3RlbXMtaW5jb3Jwb3JhdGVkLWJsYWNrYm9hcmQtaW5jLWV4dHJhbWFya3MtZWR1Y2F0aW9uLXB2dC1sdGQt0gEA?hl=en-IN&gl=IN&ceid=IN%3Aen,2023-10-17
1,"Online Education Market in India is to grow by USD 3.46 billion from 2022 to 2027, the market is fragmented due to the presence of prominent companies like Aeon Learning Pvt. Ltd., Educomp Solutions Ltd. and Coursera Inc., and many more - Technavio",Yahoo Finance,news.google.com/articles/CBMiUGh0dHBzOi8vZmluYW5jZS55YWhvby5jb20vbmV3cy9vbmxpbmUtZWR1Y2F0aW9uLW1hcmtldC1pbmRpYS1ncm93LTIxMTUwMDIxNS5odG1s0gFYaHR0cHM6Ly9maW5hbmNlLnlhaG9vLmNvbS9hbXBodG1sL25ld3Mvb25saW5lLWVkdWNhdGlvbi1tYXJrZXQtaW5kaWEtZ3Jvdy0yMTE1MDAyMTUuaHRtbA?hl=en-IN&gl=IN&ceid=IN%3Aen,2023-10-11
3,"Higher Education Market size to grow by USD 63.36 billion from 2022 to 2027, The market is fragmented due to the presence of prominent companies like Adobe Inc., Advance HE and Apple Inc., and many more - Technavio",Yahoo Finance,news.google.com/articles/CBMiT2h0dHBzOi8vZmluYW5jZS55YWhvby5jb20vbmV3cy9oaWdoZXItZWR1Y2F0aW9uLW1hcmtldC1zaXplLWdyb3ctMTgwMDAwODExLmh0bWzSAVdodHRwczovL2ZpbmFuY2UueWFob28uY29tL2FtcGh0bWwvbmV3cy9oaWdoZXItZWR1Y2F0aW9uLW1hcmtldC1zaXplLWdyb3ctMTgwMDAwODExLmh0bWw?hl=en-IN&gl=IN&ceid=IN%3Aen,2023-10-11
5,"Education Apps Market is to grow by USD 124.78 billion from 2022 to 2027, The market is fragmented due to the presence of prominent companies like Age of Learning Inc., Alphabet Inc. and Babbel GmbH, and many more - Technavio",Yahoo Finance,news.google.com/articles/CBMiTGh0dHBzOi8vZmluYW5jZS55YWhvby5jb20vbmV3cy9lZHVjYXRpb24tYXBwcy1tYXJrZXQtZ3Jvdy11c2QtMTgzMDAwODgzLmh0bWzSAVRodHRwczovL2ZpbmFuY2UueWFob28uY29tL2FtcGh0bWwvbmV3cy9lZHVjYXRpb24tYXBwcy1tYXJrZXQtZ3Jvdy11c2QtMTgzMDAwODgzLmh0bWw?hl=en-IN&gl=IN&ceid=IN%3Aen,2023-10-11
10,Tooth Whitening Kit Market size to increase by USD 84.6 million ...,PR Newswire,news.google.com/articles/CBMi8QFodHRwczovL3d3dy5wcm5ld3N3aXJlLmNvbS9uZXdzLXJlbGVhc2VzL3Rvb3RoLXdoaXRlbmluZy1raXQtbWFya2V0LXNpemUtdG8taW5jcmVhc2UtYnktdXNkLTg0LTYtbWlsbGlvbi1iZXR3ZWVuLTIwMjItdG8tMjAyNy1hbi1pbmNyZWFzZS1pbi10aGUtYWRvcHRpb24tb2YtbGVkLXRlY2hub2xvZ3ktaW4tb3JhbC1jYXJlLXByb2R1Y3RzLWRyaXZlcy1tYXJrZXQtZ3Jvd3RoLS0tdGVjaG5hdmlvLTMwMTk1MjYxMy5odG1s0gEA?hl=en-IN&gl=IN&ceid=IN%3Aen,2023-10-11
11,Smart Education and Learning Market Research Report 2023-2032 ...,Digital Journal,news.google.com/articles/CBMimQFodHRwczovL3d3dy5kaWdpdGFsam91cm5hbC5jb20vcHIvbmV3cy9jZG4tbmV3c3dpcmUvc21hcnQtZWR1Y2F0aW9uLWFuZC1sZWFybmluZy1tYXJrZXQtcmVzZWFyY2gtcmVwb3J0LTIwMjMtMjAzMi1tYXJrZXQta2V5LXRyZW5kcy1hbmQtb3Bwb3J0dW5pdHktYXJlYXPSAQA?hl=en-IN&gl=IN&ceid=IN%3Aen,2023-10-10
