,title,source,link,date
1,Indo-Asian News Service-E-LEARNING MARKET IN GCC TO ...,IANS India Pvt Ltd,news.google.com/articles/CBMi_gFodHRwczovL2lhbnMuaW4vcHItd2lyZS1kZXRhaWwvZS1sZWFybmluZy1tYXJrZXQtaW4tZ2NjLXRvLWdyb3ctYnktdXNkLTk1OTAxLW1pbGxpb24tZnJvbS0yMDIzLXRvLTIwMjgtbWFya2V0LWlzLWZyYWdtZW50ZWQtZHVlLXRvLXRoZS1wcmVzZW5jZS1vZi1wcm9taW5lbnQtY29tcGFuaWVzLWxpa2UtYXJ0aWN1bGF0ZS1pbmMtY2FweXRlY2gtZnotbGxjLWFuZC1jb3Vyc2VyYS1pbmMtYW5kLW1hbnktbW9yZS10ZWNobmF2aW8tMTAtMTEtMjAyM9IBAA?hl=en-IN&gl=IN&ceid=IN%3Aen,2023-11-09
12,"Education Apps Market Report 2023, Industry Trends, Demand, Growth Rate and Forecast 2028",openPR,news.google.com/articles/CBMiXGh0dHBzOi8vd3d3Lm9wZW5wci5jb20vbmV3cy8zMjgxOTE4L2VkdWNhdGlvbi1hcHBzLW1hcmtldC1yZXBvcnQtMjAyMy1pbmR1c3RyeS10cmVuZHMtZGVtYW5k0gFbaHR0cHM6Ly93d3cub3BlbnByLmNvbS9hbXAvMzI4MTkxOC9lZHVjYXRpb24tYXBwcy1tYXJrZXQtcmVwb3J0LTIwMjMtaW5kdXN0cnktdHJlbmRzLWRlbWFuZA?hl=en-IN&gl=IN&ceid=IN%3Aen,2023-11-09
11,Understanding Red Flags in Penny Stock Investing: Decoding Risks ...,Dalal Street Investment Journal,news.google.com/articles/CBMipQFodHRwczovL3d3dy5kc2lqLmluL2RzaWphcnRpY2xlZGV0YWlsL2FydG1pZC8xMDE2My9hcnRpY2xlaWQvMzQzNzYvdW5kZXJzdGFuZGluZy1yZWQtZmxhZ3MtaW4tcGVubnktc3RvY2staW52ZXN0aW5nLWRlY29kaW5nLXJpc2tzLXdpdGgtcmVhbC13b3JsZC1jYXNlLXN0dWRpZXMtMzQzNzbSAQA?hl=en-IN&gl=IN&ceid=IN%3Aen,2023-11-06
5,Interactive Education System Rapidly Growing Market Globally ...,Argyle Report,news.google.com/articles/CBMiqwFodHRwczovL3d3dy5hcmd5bGVyZXBvcnQuY29tL2J1c2luZXNzL2ludGVyYWN0aXZlLWVkdWNhdGlvbi1zeXN0ZW0tcmFwaWRseS1ncm93aW5nLW1hcmtldC1nbG9iYWxseS1wZWFyc29uLXBsYy1lbGx1Y2lhbi1jb21wYW55LXNtYXJ0LXRlY2hub2xvZ2llcy1wcm9tZXRoZWFuLXdvcmxkLzI4NjQxMy_SAQA?hl=en-IN&gl=IN&ceid=IN%3Aen,2023-11-05
3,"Corporate Training Market size to grow by USD 56.92 billion from 2022 to 2027 |Market is fragmented due to the presence of prominent companies like Adobe Inc., Articulate Inc. and Blanchard Training and Development Inc., many more",Yahoo Finance,news.google.com/articles/CBMiUWh0dHBzOi8vZmluYW5jZS55YWhvby5jb20vbmV3cy9jb3Jwb3JhdGUtdHJhaW5pbmctbWFya2V0LXNpemUtZ3Jvdy0yMjM1MDAyNzMuaHRtbNIBWWh0dHBzOi8vZmluYW5jZS55YWhvby5jb20vYW1waHRtbC9uZXdzL2NvcnBvcmF0ZS10cmFpbmluZy1tYXJrZXQtc2l6ZS1ncm93LTIyMzUwMDI3My5odG1s?hl=en-IN&gl=IN&ceid=IN%3Aen,2023-11-02
8,Patanjali Foods moves out of ASM framework from November 1,The Statesman,news.google.com/articles/CBMibWh0dHBzOi8vd3d3LnRoZXN0YXRlc21hbi5jb20vaW5kaWEvcGF0YW5qYWxpLWZvb2RzLW1vdmVzLW91dC1vZi1hc20tZnJhbWV3b3JrLWZyb20tbm92ZW1iZXItMS0xNTAzMjM2ODU3Lmh0bWzSAXFodHRwczovL3d3dy50aGVzdGF0ZXNtYW4uY29tL2luZGlhL3BhdGFuamFsaS1mb29kcy1tb3Zlcy1vdXQtb2YtYXNtLWZyYW1ld29yay1mcm9tLW5vdmVtYmVyLTEtMTUwMzIzNjg1Ny5odG1sL2FtcA?hl=en-IN&gl=IN&ceid=IN%3Aen,2023-11-01
