,title,source,link,date
32,EXCLUSIVE: Rahul Mishra and Indian Retail Giant Reliance Detail ...,WWD,news.google.com/articles/CBMiggFodHRwczovL3d3ZC5jb20vZmFzaGlvbi1uZXdzL2Rlc2lnbmVyLWx1eHVyeS9yYWh1bC1taXNocmEtaW5kaWFuLXJldGFpbC1naWFudC1yZWxpYW5jZS11bnZlaWwtam9pbnQtdmVudHVyZS1icmFuZC1hZmV3LTEyMzU4MzYwNjcv0gEA?hl=en-IN&gl=IN&ceid=IN%3Aen,2023-09-26
26,Charity retailer wins top prize at People in Retail Awards 2023,Retail Insight Network,news.google.com/articles/CBMibGh0dHBzOi8vd3d3LnJldGFpbC1pbnNpZ2h0LW5ldHdvcmsuY29tL25ld3MvY2hhcml0eS1yZXRhaWxlci13aW5zLXRvcC1wcml6ZS1hdC1wZW9wbGUtaW4tcmV0YWlsLWF3YXJkcy0yMDIzL9IBAA?hl=en-IN&gl=IN&ceid=IN%3Aen,2023-09-26
55,The Folio Society: Celebrating 400 years of William Shakespeare,Reader's Digest,news.google.com/articles/CBMiUmh0dHBzOi8vd3d3LnJlYWRlcnNkaWdlc3QuY28udWsvY3VsdHVyZS90aGUtZm9saW8tc29jaWV0eS1jZWxlYnJhdGluZy00MDAteWVhcnMtb2bSAQA?hl=en-IN&gl=IN&ceid=IN%3Aen,2023-09-26
53,Belgian Crypto Users Rejoice as Binance Resumes Exchange ...,BTC Peers,news.google.com/articles/CBMiV2h0dHBzOi8vYnRjcGVlcnMuY29tL2JlbGdpYW4tY3J5cHRvLXVzZXJzLXJlam9pY2UtYXMtYmluYW5jZS1yZXN1bWVzLWV4Y2hhbmdlLXNlcnZpY2VzL9IBAA?hl=en-IN&gl=IN&ceid=IN%3Aen,2023-09-26
9,Kamat’s Newest ‘IRA by Orchid Hotels’ to Drive Next Phase of Growth,Travel Trends Today,news.google.com/articles/CBMiYmh0dHBzOi8vd3d3LnRyYXZlbHRyZW5kc3RvZGF5LmluL2thbWF0cy1uZXdlc3QtaXJhLWJ5LW9yY2hpZC1ob3RlbHMtdG8tZHJpdmUtbmV4dC1waGFzZS1vZi1ncm93dGgv0gEA?hl=en-IN&gl=IN&ceid=IN%3Aen,2023-09-26
13,Dunkin' And The Little Words Project Partner For New Line Of Coffee-Themed Bracelets,Yahoo Eurosport UK,news.google.com/articles/CBMiU2h0dHBzOi8vdWsuc3BvcnRzLnlhaG9vLmNvbS9uZXdzL2R1bmtpbi1saXR0bGUtd29yZHMtcHJvamVjdC1wYXJ0bmVyLTE1NTYzMDQyMS5odG1s0gFbaHR0cHM6Ly91ay5zcG9ydHMueWFob28uY29tL2FtcGh0bWwvbmV3cy9kdW5raW4tbGl0dGxlLXdvcmRzLXByb2plY3QtcGFydG5lci0xNTU2MzA0MjEuaHRtbA?hl=en-IN&gl=IN&ceid=IN%3Aen,2023-09-26
44,Dryad Global Partners with BlackBerry to Deliver Advanced Cybersecurity for Vessel Protection,Channel 16,news.google.com/articles/CBMif2h0dHBzOi8vY2hhbm5lbDE2LmRyeWFkZ2xvYmFsLmNvbS9kcnlhZC1nbG9iYWwtcGFydG5lcnMtd2l0aC1ibGFja2JlcnJ5LXRvLWRlbGl2ZXItYWR2YW5jZWQtY3liZXJzZWN1cml0eS1mb3ItdmVzc2VsLXByb3RlY3Rpb27SAYsBaHR0cHM6Ly9jaGFubmVsMTYuZHJ5YWRnbG9iYWwuY29tL2RyeWFkLWdsb2JhbC1wYXJ0bmVycy13aXRoLWJsYWNrYmVycnktdG8tZGVsaXZlci1hZHZhbmNlZC1jeWJlcnNlY3VyaXR5LWZvci12ZXNzZWwtcHJvdGVjdGlvbj9oc19hbXA9dHJ1ZQ?hl=en-IN&gl=IN&ceid=IN%3Aen,2023-09-26
15,BAYC x BAPE Unveil Streetwear Collaboration,nft now,news.google.com/articles/CBMiRmh0dHBzOi8vbmZ0bm93LmNvbS9ydW53YXkvYmF5Yy14LWJhcGUtdW52ZWlsLXN0cmVldHdlYXItY29sbGFib3JhdGlvbi_SAQA?hl=en-IN&gl=IN&ceid=IN%3Aen,2023-09-26
41,Reluctance to hold elections exposes BJP: ChLal Singh,Take One Digital Network,news.google.com/articles/CBMiW2h0dHBzOi8vd3d3LnRha2VvbmVkaWdpdGFsbmV0d29yay5jb20vcmVsdWN0YW5jZS10by1ob2xkLWVsZWN0aW9ucy1leHBvc2VzLWJqcC1jaGxhbC1zaW5naC_SAQA?hl=en-IN&gl=IN&ceid=IN%3Aen,2023-09-26
3,Everton And hummel Champion Equality With Limited Edition Shirt,evertonfc.com,news.google.com/articles/CBMiZmh0dHBzOi8vd3d3LmV2ZXJ0b25mYy5jb20vbmV3cy8zNzAwODk3L2V2ZXJ0b24tYW5kLWh1bW1lbC1jaGFtcGlvbi1lcXVhbGl0eS13aXRoLWxpbWl0ZWQtZWRpdGlvbi1zaGlydNIBAA?hl=en-IN&gl=IN&ceid=IN%3Aen,2023-09-26
