,title,source,link,date
0,Global Raised Access Floor Systems Market Size and Forecast ...,Rouge Fox,news.google.com/articles/CBMiV2h0dHBzOi8vcm91Z2Vmb3guY29tL2dsb2JhbC1yYWlzZWQtYWNjZXNzLWZsb29yLXN5c3RlbXMtbWFya2V0LXNpemUtc2NvcGUtYW5kLWZvcmVjYXN0L9IBAA?hl=en-IN&gl=IN&ceid=IN%3Aen,2023-09-19
34,"Global CNG, RNG, And Hydrogen Tanks Market Size and Forecast ...",Rouge Fox,news.google.com/articles/CBMiVmh0dHBzOi8vcm91Z2Vmb3guY29tL2dsb2JhbC1jbmctcm5nLWFuZC1oeWRyb2dlbi10YW5rcy1tYXJrZXQtc2l6ZS1zY29wZS1hbmQtZm9yZWNhc3Qv0gEA?hl=en-IN&gl=IN&ceid=IN%3Aen,2023-09-19
40,"Industrial Air Blower Market Analysis, Top Manufacturers, Forecast ...",Rouge Fox,news.google.com/articles/CBMiYGh0dHBzOi8vcm91Z2Vmb3guY29tL2luZHVzdHJpYWwtYWlyLWJsb3dlci1tYXJrZXQtYW5hbHlzaXMtdG9wLW1hbnVmYWN0dXJlcnMtZm9yZWNhc3QtMjAyMy0yMDI4L9IBAA?hl=en-IN&gl=IN&ceid=IN%3Aen,2023-09-19
43,2023 Asbesto Fiber Cement Board Market Is Booming Globally Forecast 2030 | Report Pages 104,Benzinga,news.google.com/articles/CBMijwFodHRwczovL3d3dy5iZW56aW5nYS5jb20vcHJlc3NyZWxlYXNlcy8yMy8wOS8zNDcxMTU4MC8yMDIzLWFzYmVzdG8tZmliZXItY2VtZW50LWJvYXJkLW1hcmtldC1pcy1ib29taW5nLWdsb2JhbGx5LWZvcmVjYXN0LTIwMzAtcmVwb3J0LXBhZ2VzLTEwNNIBLWh0dHBzOi8vd3d3LmJlbnppbmdhLmNvbS9hbXAvY29udGVudC8zNDcxMTU4MA?hl=en-IN&gl=IN&ceid=IN%3Aen,2023-09-19
26,"Turmeric Market Size Analysis 2023 | New Opportunities, and Innovations, Forecast 2030",Benzinga,news.google.com/articles/CBMiiAFodHRwczovL3d3dy5iZW56aW5nYS5jb20vcHJlc3NyZWxlYXNlcy8yMy8wOS8zNDcxNTEyMC90dXJtZXJpYy1tYXJrZXQtc2l6ZS1hbmFseXNpcy0yMDIzLW5ldy1vcHBvcnR1bml0aWVzLWFuZC1pbm5vdmF0aW9ucy1mb3JlY2FzdC0yMDMw0gEtaHR0cHM6Ly93d3cuYmVuemluZ2EuY29tL2FtcC9jb250ZW50LzM0NzE1MTIw?hl=en-IN&gl=IN&ceid=IN%3Aen,2023-09-19
49,"Global Agricultural Crop Insurance Market Size: Exploring Trends, Challenges, and Strategic Business inno",Benzinga,news.google.com/articles/CBMimQFodHRwczovL3d3dy5iZW56aW5nYS5jb20vcHJlc3NyZWxlYXNlcy8yMy8wOS8zNDcxNTE1Ny9nbG9iYWwtYWdyaWN1bHR1cmFsLWNyb3AtaW5zdXJhbmNlLW1hcmtldC1zaXplLWV4cGxvcmluZy10cmVuZHMtY2hhbGxlbmdlcy1hbmQtc3RyYXRlZ2ljLWJ1c2luZXNzLWnSAS1odHRwczovL3d3dy5iZW56aW5nYS5jb20vYW1wL2NvbnRlbnQvMzQ3MTUxNTc?hl=en-IN&gl=IN&ceid=IN%3Aen,2023-09-19
21,Global CNG ISO Tank Container Market Size and Forecast | CIMC ...,Rouge Fox,news.google.com/articles/CBMiUmh0dHBzOi8vcm91Z2Vmb3guY29tL2dsb2JhbC1jbmctaXNvLXRhbmstY29udGFpbmVyLW1hcmtldC1zaXplLXNjb3BlLWFuZC1mb3JlY2FzdC_SAQA?hl=en-IN&gl=IN&ceid=IN%3Aen,2023-09-19
50,"Cattle Insurance Market Projections of Share, Trends, and Growth ...",Rouge Fox,news.google.com/articles/CBMiYmh0dHBzOi8vcm91Z2Vmb3guY29tL2NhdHRsZS1pbnN1cmFuY2UtbWFya2V0LXByb2plY3Rpb25zLW9mLXNoYXJlLXRyZW5kcy1hbmQtZ3Jvd3RoLWZvci0yMDIzLTIwMzAv0gEA?hl=en-IN&gl=IN&ceid=IN%3Aen,2023-09-19
54,Medidata Launches Industry's Most Comprehensive Program to Support Clinical Trial Diversity Initiatives,Benzinga,news.google.com/articles/CBMimQFodHRwczovL3d3dy5iZW56aW5nYS5jb20vcHJlc3NyZWxlYXNlcy8yMy8wOS9iMzQ3MjQyMzIvbWVkaWRhdGEtbGF1bmNoZXMtaW5kdXN0cnlzLW1vc3QtY29tcHJlaGVuc2l2ZS1wcm9ncmFtLXRvLXN1cHBvcnQtY2xpbmljYWwtdHJpYWwtZGl2ZXJzaXR5LWluaXRpYXTSAS1odHRwczovL3d3dy5iZW56aW5nYS5jb20vYW1wL2NvbnRlbnQvMzQ3MjQyMzI?hl=en-IN&gl=IN&ceid=IN%3Aen,2023-09-19
12,"Global Table Sauce Market Size and Forecast | Justdial, Nestl India ...",Rouge Fox,news.google.com/articles/CBMiR2h0dHBzOi8vcm91Z2Vmb3guY29tL2dsb2JhbC10YWJsZS1zYXVjZS1tYXJrZXQtc2l6ZS1zY29wZS1hbmQtZm9yZWNhc3Qv0gEA?hl=en-IN&gl=IN&ceid=IN%3Aen,2023-09-19
