,title,source,link,date
37,One of the best new Pixel 8 Pro features appears to work on other ...,Android Central,news.google.com/articles/CBMiZmh0dHBzOi8vd3d3LmFuZHJvaWRjZW50cmFsLmNvbS9hcHBzLXNvZnR3YXJlL2dvb2dsZS1waXhlbC04LXByby1jb250cm9scy1jYW4tcnVuLW9uLW9sZGVyLXBpeGVsLXBob25lc9IBAA?hl=en-IN&gl=IN&ceid=IN%3Aen,2023-10-10
25,Grimaldi Forum Monaco Elevates Security and Visitor Experience ...,GlobeNewswire,news.google.com/articles/CBMitQFodHRwczovL3d3dy5nbG9iZW5ld3N3aXJlLmNvbS9uZXdzLXJlbGVhc2UvMjAyMy8xMC8xMC8yNzU3NDAyLzAvZW4vR3JpbWFsZGktRm9ydW0tTW9uYWNvLUVsZXZhdGVzLVNlY3VyaXR5LWFuZC1WaXNpdG9yLUV4cGVyaWVuY2Utd2l0aC1TdGF0ZS1vZi10aGUtQXJ0LUFJLVRlY2hub2xvZ3ktZnJvbS1pLVBSTy5odG1s0gEA?hl=en-IN&gl=IN&ceid=IN%3Aen,2023-10-10
29,I’m a gardening pro – the common mistake making your yard look cheap and why layout is essential for an ‘ex...,The US Sun,news.google.com/articles/CBMiXGh0dHBzOi8vd3d3LnRoZS1zdW4uY29tL2xpZmVzdHlsZS85MTgwNTI1L2dhcmRlbmluZy1leHBlcnQtcGxhbnRzLW1ha2UteW91ci1ob3VzZS1leHBlbnNpdmUv0gFgaHR0cHM6Ly93d3cudGhlLXN1bi5jb20vbGlmZXN0eWxlLzkxODA1MjUvZ2FyZGVuaW5nLWV4cGVydC1wbGFudHMtbWFrZS15b3VyLWhvdXNlLWV4cGVuc2l2ZS9hbXAv?hl=en-IN&gl=IN&ceid=IN%3Aen,2023-10-10
9,How to Light a Kitchen Like a Pro,CE Pro,news.google.com/articles/CBMiQGh0dHBzOi8vd3d3LmNlcHJvLmNvbS9jb250cm9sL2hvdy10by1saWdodC1hLWtpdGNoZW4tbGlrZS1hLXByby_SAQA?hl=en-IN&gl=IN&ceid=IN%3Aen,2023-10-10
28,"Downtown Springfield is safe and growing, still needs improvement",Springfield Daily Citizen,news.google.com/articles/CBMicmh0dHBzOi8vc2dmY2l0aXplbi5vcmcvZWNvbm9teS1ncm93dGgvYnVzaW5lc3MvZG93bnRvd24tc3ByaW5nZmllbGQtaXMtc2FmZS1hbmQtaXRzLWdyb3dpbmctYnV0LW5lZWRzLWltcHJvdmVtZW50L9IBAA?hl=en-IN&gl=IN&ceid=IN%3Aen,2023-10-10
12,Sneak peek inside the latest room2 opening in Belfast • Hotel Designs,Hotel Designs,news.google.com/articles/CBMiXWh0dHBzOi8vaG90ZWxkZXNpZ25zLm5ldC9pbmR1c3RyeS1uZXdzL3NuZWFrLXBlZWstaW5zaWRlLXRoZS1sYXRlc3Qtcm9vbTItb3BlbmluZy1pbi1iZWxmYXN0L9IBAA?hl=en-IN&gl=IN&ceid=IN%3Aen,2023-10-10
13,"When It Comes to Promoting Prosperity, Production Beats ...",Stanford Social Innovation Review,news.google.com/articles/CBMiYmh0dHBzOi8vc3Npci5vcmcvYXJ0aWNsZXMvZW50cnkvd2hlbl9pdF9jb21lc190b19wcm9tb3RpbmdfcHJvc3Blcml0eV9wcm9kdWN0aW9uX2JlYXRzX2NvbnN1bXB0aW9u0gEA?hl=en-IN&gl=IN&ceid=IN%3Aen,2023-10-10
14,Shanghai's New Horizon High Land Park & Civic Center / URBAN ...,ArchDaily,news.google.com/articles/CBMiamh0dHBzOi8vd3d3LmFyY2hkYWlseS5jb20vMTAwNzg2OC9zaGFuZ2hhaXMtbmV3LWhvcml6b24taGlnaC1sYW5kLXBhcmstYW5kLWNpdmljLWNlbnRlci11cmJhbi1hcmNoaXRlY3R1cmXSAQA?hl=en-IN&gl=IN&ceid=IN%3Aen,2023-10-10
27,What Must We Trust? Avoiding the Collisions Among Strategy ...,Hospitality Net,news.google.com/articles/CBMiM2h0dHBzOi8vd3d3Lmhvc3BpdGFsaXR5bmV0Lm9yZy9vcGluaW9uLzQxMTg1NjEuaHRtbNIBAA?hl=en-IN&gl=IN&ceid=IN%3Aen,2023-10-10
17,Priorities for research to support local authority action on health and ...,BMC Public Health,news.google.com/articles/CBMiTWh0dHBzOi8vYm1jcHVibGljaGVhbHRoLmJpb21lZGNlbnRyYWwuY29tL2FydGljbGVzLzEwLjExODYvczEyODg5LTAyMy0xNjcxNy0x0gEA?hl=en-IN&gl=IN&ceid=IN%3Aen,2023-10-10
