,title,source,link,date
93,Robust results make Matha digital winner in two states - The Noel D'Cunha Sunday Column,printweek,news.google.com/articles/CBMifGh0dHBzOi8vd3d3LnByaW50d2Vlay5pbi9mZWF0dXJlcy9yb2J1c3QtcmVzdWx0cy1tYWtlLW1hdGhhLWRpZ2l0YWwtd2lubmVyLWluLXR3by1zdGF0ZXMtdGhlLW5vZWwtZGN1bmhhLXN1bmRheS1jb2x1bW4tNTc4NjPSAYIBaHR0cHM6Ly93d3cucHJpbnR3ZWVrLmluL2ZlYXR1cmVzL3JvYnVzdC1yZXN1bHRzLW1ha2UtbWF0aGEtZGlnaXRhbC13aW5uZXItaW4tdHdvLXN0YXRlcy10aGUtbm9lbC1kY3VuaGEtc3VuZGF5LWNvbHVtbi01Nzg2Mz9hbXA9MQ?hl=en-IN&gl=IN&ceid=IN%3Aen,2023-08-27
2,Top 10 Long Term Crypto Investments - Coin Mining Hardware,Asia Insurance Review,news.google.com/articles/CBMiNWh0dHBzOi8vd3d3LmFzaWFpbnN1cmFuY2VyZXZpZXcuY29tL2J0Yy9ORHNWTGVkSi5odG1s0gEA?hl=en-IN&gl=IN&ceid=IN%3Aen,2023-08-27
83,Bill Gates Investment Company - How Should I Invest My Roth Ira ...,Asia Insurance Review,news.google.com/articles/CBMiNWh0dHBzOi8vd3d3LmFzaWFpbnN1cmFuY2VyZXZpZXcuY29tL2J0Yy9sc09YZHRiNS5odG1s0gEA?hl=en-IN&gl=IN&ceid=IN%3Aen,2023-08-27
91,Majid Al-Futtaim's H1 results show solid revenue and profit growth,Arab News,news.google.com/articles/CBMiNGh0dHBzOi8vd3d3LmFyYWJuZXdzLmNvbS9ub2RlLzIzNjIxMjYvY29ycG9yYXRlLW5ld3PSASlodHRwczovL3d3dy5hcmFibmV3cy5jb20vbm9kZS8yMzYyMTI2L2FtcA?hl=en-IN&gl=IN&ceid=IN%3Aen,2023-08-26
89,ENVI Lodges unveils location of luxury ecolodge in KAEC,Arab News,news.google.com/articles/CBMiNGh0dHBzOi8vd3d3LmFyYWJuZXdzLmNvbS9ub2RlLzIzNjIxMzEvY29ycG9yYXRlLW5ld3PSASlodHRwczovL3d3dy5hcmFibmV3cy5jb20vbm9kZS8yMzYyMTMxL2FtcA?hl=en-IN&gl=IN&ceid=IN%3Aen,2023-08-26
25,SECP issues first certificate of Shariah compliance - Business ...,Business Recorder,news.google.com/articles/CBMiJ2h0dHBzOi8vd3d3LmJyZWNvcmRlci5jb20vbmV3cy80MDI1OTkzM9IBAA?hl=en-IN&gl=IN&ceid=IN%3Aen,2023-08-26
28,Wunderbit Trading - High Frequency Trading At Home,Asia Insurance Review,news.google.com/articles/CBMiNWh0dHBzOi8vd3d3LmFzaWFpbnN1cmFuY2VyZXZpZXcuY29tL2J0Yy9TZXB5ekZXcC5odG1s0gEA?hl=en-IN&gl=IN&ceid=IN%3Aen,2023-08-26
4,Banks not lending despite reduced credit risks -FSC,Turks and Caicos Weekly News,news.google.com/articles/CBMiWmh0dHBzOi8vdGN3ZWVrbHluZXdzLmNvbS9iYW5rcy1ub3QtbGVuZGluZy1kZXNwaXRlLXJlZHVjZWQtY3JlZGl0LXJpc2tzLWZzYy1wMTM0NzktMTI3Lmh0bdIBAA?hl=en-IN&gl=IN&ceid=IN%3Aen,2023-08-25
6,FSC to host annual industry meeting at Shore Club,Turks and Caicos Weekly News,news.google.com/articles/CBMiWWh0dHBzOi8vdGN3ZWVrbHluZXdzLmNvbS9mc2MtdG8taG9zdC1hbm51YWwtaW5kdXN0cnktbWVldGluZy1hdC1zaG9yZS1jbHViLXAxMzQ3OC0xMjcuaHRt0gEA?hl=en-IN&gl=IN&ceid=IN%3Aen,2023-08-25
69,Procurement of Project POYNTING: | Construction Tenders | The ...,Construction Index,news.google.com/articles/CBMiOWh0dHBzOi8vd3d3LnRoZWNvbnN0cnVjdGlvbmluZGV4LmNvLnVrL3RlbmRlcnMvdmlldy8xNTQ1ONIBAA?hl=en-IN&gl=IN&ceid=IN%3Aen,2023-08-25
