,title,source,link,date
39,"The report on Milwaukee Tool market forecasted for the year 2023 - 2030 reveals a promising 9.7% CAGR, wh",Benzinga,news.google.com/articles/CBMimQFodHRwczovL3d3dy5iZW56aW5nYS5jb20vcHJlc3NyZWxlYXNlcy8yMy8wOS8zNDE4NjkxMS90aGUtcmVwb3J0LW9uLW1pbHdhdWtlZS10b29sLW1hcmtldC1mb3JlY2FzdGVkLWZvci10aGUteWVhci0yMDIzLTIwMzAtcmV2ZWFscy1hLXByb21pc2luZy05LTctY2Fnci3SAS1odHRwczovL3d3dy5iZW56aW5nYS5jb20vYW1wL2NvbnRlbnQvMzQxODY5MTE?hl=en-IN&gl=IN&ceid=IN%3Aen,2023-09-02
37,Automotive Ignition Coil market research report proves to be an essential resource for one looking for de,Benzinga,news.google.com/articles/CBMimQFodHRwczovL3d3dy5iZW56aW5nYS5jb20vcHJlc3NyZWxlYXNlcy8yMy8wOS8zNDE4NzI1OC9hdXRvbW90aXZlLWlnbml0aW9uLWNvaWwtbWFya2V0LXJlc2VhcmNoLXJlcG9ydC1wcm92ZXMtdG8tYmUtYW4tZXNzZW50aWFsLXJlc291cmNlLWZvci1vbmUtbG9va2luZy3SAS1odHRwczovL3d3dy5iZW56aW5nYS5jb20vYW1wL2NvbnRlbnQvMzQxODcyNTg?hl=en-IN&gl=IN&ceid=IN%3Aen,2023-09-02
36,"Laundry Gel Ball research report examines market demand as well as key producers and geographical areas,",Benzinga,news.google.com/articles/CBMimQFodHRwczovL3d3dy5iZW56aW5nYS5jb20vcHJlc3NyZWxlYXNlcy8yMy8wOS8zNDE4NzgzMi9sYXVuZHJ5LWdlbC1iYWxsLXJlc2VhcmNoLXJlcG9ydC1leGFtaW5lcy1tYXJrZXQtZGVtYW5kLWFzLXdlbGwtYXMta2V5LXByb2R1Y2Vycy1hbmQtZ2VvZ3JhcGhpY2FsLWHSAS1odHRwczovL3d3dy5iZW56aW5nYS5jb20vYW1wL2NvbnRlbnQvMzQxODc4MzI?hl=en-IN&gl=IN&ceid=IN%3Aen,2023-09-02
34,"The latest global Video Adapter Cable market trends, applications, analysis, growth, and forecast indicat",Benzinga,news.google.com/articles/CBMimQFodHRwczovL3d3dy5iZW56aW5nYS5jb20vcHJlc3NyZWxlYXNlcy8yMy8wOS8zNDE4ODM4NC90aGUtbGF0ZXN0LWdsb2JhbC12aWRlby1hZGFwdGVyLWNhYmxlLW1hcmtldC10cmVuZHMtYXBwbGljYXRpb25zLWFuYWx5c2lzLWdyb3d0aC1hbmQtZm9yZWNhc3QtaW5kaWPSAS1odHRwczovL3d3dy5iZW56aW5nYS5jb20vYW1wL2NvbnRlbnQvMzQxODgzODQ?hl=en-IN&gl=IN&ceid=IN%3Aen,2023-09-02
32,"The analysis on Kitchen Jar market size in terms of value, segment market share, and segment analysis wi",Benzinga,news.google.com/articles/CBMimQFodHRwczovL3d3dy5iZW56aW5nYS5jb20vcHJlc3NyZWxlYXNlcy8yMy8wOS8zNDE4ODQyMi90aGUtYW5hbHlzaXMtb24ta2l0Y2hlbi1qYXItbWFya2V0LXNpemUtaW4tdGVybXMtb2YtdmFsdWUtc2VnbWVudC1tYXJrZXQtc2hhcmUtYW5kLXNlZ21lbnQtYW5hbHlzaXPSAS1odHRwczovL3d3dy5iZW56aW5nYS5jb20vYW1wL2NvbnRlbnQvMzQxODg0MjI?hl=en-IN&gl=IN&ceid=IN%3Aen,2023-09-02
0,"United States Telecom Tower Power System Market to Surpass US$ 987.9 million by 2033 amid Extensive Coverage Needs | Future Market Insights, Inc.",Yahoo Finance,news.google.com/articles/CBMiT2h0dHBzOi8vZmluYW5jZS55YWhvby5jb20vbmV3cy91bml0ZWQtc3RhdGVzLXRlbGVjb20tdG93ZXItcG93ZXItMTUwMDAwODAyLmh0bWzSAVdodHRwczovL2ZpbmFuY2UueWFob28uY29tL2FtcGh0bWwvbmV3cy91bml0ZWQtc3RhdGVzLXRlbGVjb20tdG93ZXItcG93ZXItMTUwMDAwODAyLmh0bWw?hl=en-IN&gl=IN&ceid=IN%3Aen,2023-09-01
19,Daily News 01 / 09 / 2023,European Commission,news.google.com/articles/CBMiQWh0dHBzOi8vZWMuZXVyb3BhLmV1L2NvbW1pc3Npb24vcHJlc3Njb3JuZXIvZGV0YWlsL2VzL21leF8yM180MzIx0gEA?hl=en-IN&gl=IN&ceid=IN%3Aen,2023-09-01
42,Asia Pacific Entrepreneurs Association (APEA) Established to Promote Regional Business Development,Benzinga,news.google.com/articles/CBMilwFodHRwczovL3d3dy5iZW56aW5nYS5jb20vcHJlc3NyZWxlYXNlcy8yMy8wOS9uMzQxNjk2NjkvYXNpYS1wYWNpZmljLWVudHJlcHJlbmV1cnMtYXNzb2NpYXRpb24tYXBlYS1lc3RhYmxpc2hlZC10by1wcm9tb3RlLXJlZ2lvbmFsLWJ1c2luZXNzLWRldmVsb3BtZW500gEtaHR0cHM6Ly93d3cuYmVuemluZ2EuY29tL2FtcC9jb250ZW50LzM0MTY5NjY5?hl=en-IN&gl=IN&ceid=IN%3Aen,2023-09-01
35,"VoIP Media Gateways Market Size in 2023 To 2029 | AudioCodes, Sangoma Technologies, Avaya, Kioxia, Patton Elec",openPR,news.google.com/articles/CBMiXmh0dHBzOi8vd3d3Lm9wZW5wci5jb20vbmV3cy8zMTkyMzc3L3ZvaXAtbWVkaWEtZ2F0ZXdheXMtbWFya2V0LXNpemUtaW4tMjAyMy10by0yMDI5LWF1ZGlvY29kZXPSAV1odHRwczovL3d3dy5vcGVucHIuY29tL2FtcC8zMTkyMzc3L3ZvaXAtbWVkaWEtZ2F0ZXdheXMtbWFya2V0LXNpemUtaW4tMjAyMy10by0yMDI5LWF1ZGlvY29kZXM?hl=en-IN&gl=IN&ceid=IN%3Aen,2023-09-01
28,Preparing for the Future: The Skyrocketing Payment Security Market Predicted to Reach a Whopping $50.63 Billio,openPR,news.google.com/articles/CBMiXmh0dHBzOi8vd3d3Lm9wZW5wci5jb20vbmV3cy8zMTkxOTU0L3ByZXBhcmluZy1mb3ItdGhlLWZ1dHVyZS10aGUtc2t5cm9ja2V0aW5nLXBheW1lbnQtc2VjdXJpdHnSAV1odHRwczovL3d3dy5vcGVucHIuY29tL2FtcC8zMTkxOTU0L3ByZXBhcmluZy1mb3ItdGhlLWZ1dHVyZS10aGUtc2t5cm9ja2V0aW5nLXBheW1lbnQtc2VjdXJpdHk?hl=en-IN&gl=IN&ceid=IN%3Aen,2023-09-01
