,title,source,link,date
93,"The Polyurethane Couplings market's size, share, and future growth rate, as well as revenue and sales tre",Benzinga,news.google.com/articles/CBMimQFodHRwczovL3d3dy5iZW56aW5nYS5jb20vcHJlc3NyZWxlYXNlcy8yMy8wOS8zNDE5MjQxNC90aGUtcG9seXVyZXRoYW5lLWNvdXBsaW5ncy1tYXJrZXRzLXNpemUtc2hhcmUtYW5kLWZ1dHVyZS1ncm93dGgtcmF0ZS1hcy13ZWxsLWFzLXJldmVudWUtYW5kLXNhbGVzLXTSAS1odHRwczovL3d3dy5iZW56aW5nYS5jb20vYW1wL2NvbnRlbnQvMzQxOTI0MTQ?hl=en-IN&gl=IN&ceid=IN%3Aen,2023-09-03
28,Retail India - Retail India News: NEWME Unveils #NEWMEEveryday ...,Indian Retailer,news.google.com/articles/CBMiaWh0dHBzOi8vd3d3LmluZGlhbnJldGFpbGVyLmNvbS9uZXdzL3JldGFpbC1pbmRpYS1uZXdzLW5ld21lLXVudmVpbHMtbmV3bWVldmVyeWRheS1jYW1wYWlnbi1zYW5qYW5hLXNhbmdoadIBbWh0dHBzOi8vd3d3LmluZGlhbnJldGFpbGVyLmNvbS9hbXAvbmV3cy9yZXRhaWwtaW5kaWEtbmV3cy1uZXdtZS11bnZlaWxzLW5ld21lZXZlcnlkYXktY2FtcGFpZ24tc2FuamFuYS1zYW5naGk?hl=en-IN&gl=IN&ceid=IN%3Aen,2023-09-03
60,The Future of the Sealed Pressure Sensors Market: Analysis of Industry Trends and Forecast with a forecas,Benzinga,news.google.com/articles/CBMimQFodHRwczovL3d3dy5iZW56aW5nYS5jb20vcHJlc3NyZWxlYXNlcy8yMy8wOS8zNDE5MjU2MC90aGUtZnV0dXJlLW9mLXRoZS1zZWFsZWQtcHJlc3N1cmUtc2Vuc29ycy1tYXJrZXQtYW5hbHlzaXMtb2YtaW5kdXN0cnktdHJlbmRzLWFuZC1mb3JlY2FzdC13aXRoLWEtZm_SAS1odHRwczovL3d3dy5iZW56aW5nYS5jb20vYW1wL2NvbnRlbnQvMzQxOTI1NjA?hl=en-IN&gl=IN&ceid=IN%3Aen,2023-09-03
59,The Future is Additive: Global Air Abrasion Unit Market Projected to Surge with 7.7% CAGR and market segm,Benzinga,news.google.com/articles/CBMimQFodHRwczovL3d3dy5iZW56aW5nYS5jb20vcHJlc3NyZWxlYXNlcy8yMy8wOS8zNDE5MjMzOC90aGUtZnV0dXJlLWlzLWFkZGl0aXZlLWdsb2JhbC1haXItYWJyYXNpb24tdW5pdC1tYXJrZXQtcHJvamVjdGVkLXRvLXN1cmdlLXdpdGgtNy03LWNhZ3ItYW5kLW1hcmtldC3SAS1odHRwczovL3d3dy5iZW56aW5nYS5jb20vYW1wL2NvbnRlbnQvMzQxOTIzMzg?hl=en-IN&gl=IN&ceid=IN%3Aen,2023-09-03
58,"The Water Based Adhesive market insights provide historical trends and future prospect, projecting a grow",Benzinga,news.google.com/articles/CBMimQFodHRwczovL3d3dy5iZW56aW5nYS5jb20vcHJlc3NyZWxlYXNlcy8yMy8wOS8zNDE5MzQyMC90aGUtd2F0ZXItYmFzZWQtYWRoZXNpdmUtbWFya2V0LWluc2lnaHRzLXByb3ZpZGUtaGlzdG9yaWNhbC10cmVuZHMtYW5kLWZ1dHVyZS1wcm9zcGVjdC1wcm9qZWN0aW5nLWHSAS1odHRwczovL3d3dy5iZW56aW5nYS5jb20vYW1wL2NvbnRlbnQvMzQxOTM0MjA?hl=en-IN&gl=IN&ceid=IN%3Aen,2023-09-03
57,Unveiling the Future of the Floor Sweepers Market: Industry Analysis and Forecast Report with a striking,Benzinga,news.google.com/articles/CBMimQFodHRwczovL3d3dy5iZW56aW5nYS5jb20vcHJlc3NyZWxlYXNlcy8yMy8wOS8zNDE5MzQwMS91bnZlaWxpbmctdGhlLWZ1dHVyZS1vZi10aGUtZmxvb3Itc3dlZXBlcnMtbWFya2V0LWluZHVzdHJ5LWFuYWx5c2lzLWFuZC1mb3JlY2FzdC1yZXBvcnQtd2l0aC1hLXN0cmnSAS1odHRwczovL3d3dy5iZW56aW5nYS5jb20vYW1wL2NvbnRlbnQvMzQxOTM0MDE?hl=en-IN&gl=IN&ceid=IN%3Aen,2023-09-03
55,"The Liquid Milk market insights cover historical trends and future projections, with a projected growth r",Benzinga,news.google.com/articles/CBMimQFodHRwczovL3d3dy5iZW56aW5nYS5jb20vcHJlc3NyZWxlYXNlcy8yMy8wOS8zNDE5MzE3My90aGUtbGlxdWlkLW1pbGstbWFya2V0LWluc2lnaHRzLWNvdmVyLWhpc3RvcmljYWwtdHJlbmRzLWFuZC1mdXR1cmUtcHJvamVjdGlvbnMtd2l0aC1hLXByb2plY3RlZC1ncm_SAS1odHRwczovL3d3dy5iZW56aW5nYS5jb20vYW1wL2NvbnRlbnQvMzQxOTMxNzM?hl=en-IN&gl=IN&ceid=IN%3Aen,2023-09-03
53,"The Melamine Fiber market's size, share, future growth rate, and revenue and sales trends are evaluated i",Benzinga,news.google.com/articles/CBMimQFodHRwczovL3d3dy5iZW56aW5nYS5jb20vcHJlc3NyZWxlYXNlcy8yMy8wOS8zNDE5MjU1My90aGUtbWVsYW1pbmUtZmliZXItbWFya2V0cy1zaXplLXNoYXJlLWZ1dHVyZS1ncm93dGgtcmF0ZS1hbmQtcmV2ZW51ZS1hbmQtc2FsZXMtdHJlbmRzLWFyZS1ldmFsdWF0ZWTSAS1odHRwczovL3d3dy5iZW56aW5nYS5jb20vYW1wL2NvbnRlbnQvMzQxOTI1NTM?hl=en-IN&gl=IN&ceid=IN%3Aen,2023-09-03
52,An Overview on the Refurbished PC Market size and Future Growth Trends with expected CAGR 5.7% for period,Benzinga,news.google.com/articles/CBMimQFodHRwczovL3d3dy5iZW56aW5nYS5jb20vcHJlc3NyZWxlYXNlcy8yMy8wOS8zNDE5MjMwNi9hbi1vdmVydmlldy1vbi10aGUtcmVmdXJiaXNoZWQtcGMtbWFya2V0LXNpemUtYW5kLWZ1dHVyZS1ncm93dGgtdHJlbmRzLXdpdGgtZXhwZWN0ZWQtY2Fnci01LTctZm9yLXDSAS1odHRwczovL3d3dy5iZW56aW5nYS5jb20vYW1wL2NvbnRlbnQvMzQxOTIzMDY?hl=en-IN&gl=IN&ceid=IN%3Aen,2023-09-03
50,"The future of the Beverage Whitener Market Scope is bright, with growth projections indicating a substant",Benzinga,news.google.com/articles/CBMimQFodHRwczovL3d3dy5iZW56aW5nYS5jb20vcHJlc3NyZWxlYXNlcy8yMy8wOS8zNDE5MzA3Mi90aGUtZnV0dXJlLW9mLXRoZS1iZXZlcmFnZS13aGl0ZW5lci1tYXJrZXQtc2NvcGUtaXMtYnJpZ2h0LXdpdGgtZ3Jvd3RoLXByb2plY3Rpb25zLWluZGljYXRpbmctYS1zdWLSAS1odHRwczovL3d3dy5iZW56aW5nYS5jb20vYW1wL2NvbnRlbnQvMzQxOTMwNzI?hl=en-IN&gl=IN&ceid=IN%3Aen,2023-09-03
