,title,source,link,date
3,"With automotive supply chains stabilizing, focus on sustainability expected to rise back up automakers' a",Benzinga,news.google.com/articles/CBMimQFodHRwczovL3d3dy5iZW56aW5nYS5jb20vcHJlc3NyZWxlYXNlcy8yMy8wOS90cjM0MTk5Mzk5L3dpdGgtYXV0b21vdGl2ZS1zdXBwbHktY2hhaW5zLXN0YWJpbGl6aW5nLWZvY3VzLW9uLXN1c3RhaW5hYmlsaXR5LWV4cGVjdGVkLXRvLXJpc2UtYmFjay11cC1hdXRvbWHSAS1odHRwczovL3d3dy5iZW56aW5nYS5jb20vYW1wL2NvbnRlbnQvMzQxOTkzOTk?hl=en-IN&gl=IN&ceid=IN%3Aen,2023-09-04
67,"Rayon Fancy Yarn Market | BILLION HANG, Cortex Textile, Filpucci spa, Grasim Industries Limited",openPR,news.google.com/articles/CBMiYGh0dHBzOi8vd3d3Lm9wZW5wci5jb20vbmV3cy8zMTkzNTc5L3JheW9uLWZhbmN5LXlhcm4tbWFya2V0LWJpbGxpb24taGFuZy1jb3J0ZXgtdGV4dGlsZS1maWxwdWNjadIBX2h0dHBzOi8vd3d3Lm9wZW5wci5jb20vYW1wLzMxOTM1NzkvcmF5b24tZmFuY3kteWFybi1tYXJrZXQtYmlsbGlvbi1oYW5nLWNvcnRleC10ZXh0aWxlLWZpbHB1Y2Np?hl=en-IN&gl=IN&ceid=IN%3Aen,2023-09-04
37,Unlocking the Magic of IoT: Where Technology Meets Wizardry ...,The Fast Mode,news.google.com/articles/CBMia2h0dHBzOi8vd3d3LnRoZWZhc3Rtb2RlLmNvbS9leHBlcnQtb3Bpbmlvbi8zMzE3Ny11bmxvY2tpbmctdGhlLW1hZ2ljLW9mLWlvdC13aGVyZS10ZWNobm9sb2d5LW1lZXRzLXdpemFyZHJ50gEA?hl=en-IN&gl=IN&ceid=IN%3Aen,2023-09-04
39,"Telecom Expense Management Market Trends: Future Demand, Share, Growth Opportunities, and Outlook 2030",Benzinga,news.google.com/articles/CBMimAFodHRwczovL3d3dy5iZW56aW5nYS5jb20vcHJlc3NyZWxlYXNlcy8yMy8wOS8zNDE5NzAxMi90ZWxlY29tLWV4cGVuc2UtbWFuYWdlbWVudC1tYXJrZXQtdHJlbmRzLWZ1dHVyZS1kZW1hbmQtc2hhcmUtZ3Jvd3RoLW9wcG9ydHVuaXRpZXMtYW5kLW91dGxvb2stMjAzMNIBLWh0dHBzOi8vd3d3LmJlbnppbmdhLmNvbS9hbXAvY29udGVudC8zNDE5NzAxMg?hl=en-IN&gl=IN&ceid=IN%3Aen,2023-09-04
42,"Fixed Mount Thermal Cameras Market Future Outlook: Emerging Trends and Key Players- Teledyne,Fluke,(Forti",Benzinga,news.google.com/articles/CBMimQFodHRwczovL3d3dy5iZW56aW5nYS5jb20vcHJlc3NyZWxlYXNlcy8yMy8wOS8zNDE5ODY3NS9maXhlZC1tb3VudC10aGVybWFsLWNhbWVyYXMtbWFya2V0LWZ1dHVyZS1vdXRsb29rLWVtZXJnaW5nLXRyZW5kcy1hbmQta2V5LXBsYXllcnMtdGVsZWR5bmUtZmx1a2UtZm_SAS1odHRwczovL3d3dy5iZW56aW5nYS5jb20vYW1wL2NvbnRlbnQvMzQxOTg2NzU?hl=en-IN&gl=IN&ceid=IN%3Aen,2023-09-04
52,GDS and SK ecoplant Collaborate on Fuel Cell Technology Trial to ...,PR Newswire Asia,news.google.com/articles/CBMikgFodHRwczovL2VuLnBybmFzaWEuY29tL3JlbGVhc2VzL2FwYWMvZ2RzLWFuZC1zay1lY29wbGFudC1jb2xsYWJvcmF0ZS1vbi1mdWVsLWNlbGwtdGVjaG5vbG9neS10cmlhbC10by1wb3dlci1kYXRhLWNlbnRlcnMtaW4tc2luZ2Fwb3JlLTQxNzA0Ni5zaHRtbNIBAA?hl=en-IN&gl=IN&ceid=IN%3Aen,2023-09-04
55,Forecasting the future of the Nylon 66 Chips Market: A Comprehensive Analysis of Growth Potential and its,Benzinga,news.google.com/articles/CBMimQFodHRwczovL3d3dy5iZW56aW5nYS5jb20vcHJlc3NyZWxlYXNlcy8yMy8wOS8zNDE5NDk5OC9mb3JlY2FzdGluZy10aGUtZnV0dXJlLW9mLXRoZS1ueWxvbi02Ni1jaGlwcy1tYXJrZXQtYS1jb21wcmVoZW5zaXZlLWFuYWx5c2lzLW9mLWdyb3d0aC1wb3RlbnRpYWwtYW7SAS1odHRwczovL3d3dy5iZW56aW5nYS5jb20vYW1wL2NvbnRlbnQvMzQxOTQ5OTg?hl=en-IN&gl=IN&ceid=IN%3Aen,2023-09-04
57,"Skeletal Trailers Market | Buiscar Cargo Solutions BV, Dennison Trailers Ltd, Fruehauf NZ Ltd, Gaura Fabricato",openPR,news.google.com/articles/CBMiYGh0dHBzOi8vd3d3Lm9wZW5wci5jb20vbmV3cy8zMTkzMzI1L3NrZWxldGFsLXRyYWlsZXJzLW1hcmtldC1idWlzY2FyLWNhcmdvLXNvbHV0aW9ucy1idi1kZW5uaXNvbtIBX2h0dHBzOi8vd3d3Lm9wZW5wci5jb20vYW1wLzMxOTMzMjUvc2tlbGV0YWwtdHJhaWxlcnMtbWFya2V0LWJ1aXNjYXItY2FyZ28tc29sdXRpb25zLWJ2LWRlbm5pc29u?hl=en-IN&gl=IN&ceid=IN%3Aen,2023-09-04
58,"Travel Security Service Market 2023 Growth, Business Opportunities, and Forecast By 2029",Benzinga,news.google.com/articles/CBMijAFodHRwczovL3d3dy5iZW56aW5nYS5jb20vcHJlc3NyZWxlYXNlcy8yMy8wOS8zNDE5ODYzNi90cmF2ZWwtc2VjdXJpdHktc2VydmljZS1tYXJrZXQtMjAyMy1ncm93dGgtYnVzaW5lc3Mtb3Bwb3J0dW5pdGllcy1hbmQtZm9yZWNhc3QtYnktMjAyOdIBLWh0dHBzOi8vd3d3LmJlbnppbmdhLmNvbS9hbXAvY29udGVudC8zNDE5ODYzNg?hl=en-IN&gl=IN&ceid=IN%3Aen,2023-09-04
62,Photovoltaic Laser Equipment Market 2023 Analysis of Rising Business Opportunities with Prominent Investm,Benzinga,news.google.com/articles/CBMimQFodHRwczovL3d3dy5iZW56aW5nYS5jb20vcHJlc3NyZWxlYXNlcy8yMy8wOS8zNDE5ODU0Mi9waG90b3ZvbHRhaWMtbGFzZXItZXF1aXBtZW50LW1hcmtldC0yMDIzLWFuYWx5c2lzLW9mLXJpc2luZy1idXNpbmVzcy1vcHBvcnR1bml0aWVzLXdpdGgtcHJvbWluZW50LWnSAS1odHRwczovL3d3dy5iZW56aW5nYS5jb20vYW1wL2NvbnRlbnQvMzQxOTg1NDI?hl=en-IN&gl=IN&ceid=IN%3Aen,2023-09-04
