,title,source,link,date
61,Francis Hydro Turbine Market Size studies with estimated future CAGR of 9.9% investigates the market's ex,Benzinga,news.google.com/articles/CBMimQFodHRwczovL3d3dy5iZW56aW5nYS5jb20vcHJlc3NyZWxlYXNlcy8yMy8wOS8zNDE5MjI2Ny9mcmFuY2lzLWh5ZHJvLXR1cmJpbmUtbWFya2V0LXNpemUtc3R1ZGllcy13aXRoLWVzdGltYXRlZC1mdXR1cmUtY2Fnci1vZi05LTktaW52ZXN0aWdhdGVzLXRoZS1tYXJrZXTSAS1odHRwczovL3d3dy5iZW56aW5nYS5jb20vYW1wL2NvbnRlbnQvMzQxOTIyNjc?hl=en-IN&gl=IN&ceid=IN%3Aen,2023-09-03
79,The Future is Additive: Global Air Abrasion Unit Market Projected to Surge with 7.7% CAGR and market segm,Benzinga,news.google.com/articles/CBMimQFodHRwczovL3d3dy5iZW56aW5nYS5jb20vcHJlc3NyZWxlYXNlcy8yMy8wOS8zNDE5MjMzOC90aGUtZnV0dXJlLWlzLWFkZGl0aXZlLWdsb2JhbC1haXItYWJyYXNpb24tdW5pdC1tYXJrZXQtcHJvamVjdGVkLXRvLXN1cmdlLXdpdGgtNy03LWNhZ3ItYW5kLW1hcmtldC3SAS1odHRwczovL3d3dy5iZW56aW5nYS5jb20vYW1wL2NvbnRlbnQvMzQxOTIzMzg?hl=en-IN&gl=IN&ceid=IN%3Aen,2023-09-03
53,An Overview on the Refurbished PC Market size and Future Growth Trends with expected CAGR 5.7% for period,Benzinga,news.google.com/articles/CBMimQFodHRwczovL3d3dy5iZW56aW5nYS5jb20vcHJlc3NyZWxlYXNlcy8yMy8wOS8zNDE5MjMwNi9hbi1vdmVydmlldy1vbi10aGUtcmVmdXJiaXNoZWQtcGMtbWFya2V0LXNpemUtYW5kLWZ1dHVyZS1ncm93dGgtdHJlbmRzLXdpdGgtZXhwZWN0ZWQtY2Fnci01LTctZm9yLXDSAS1odHRwczovL3d3dy5iZW56aW5nYS5jb20vYW1wL2NvbnRlbnQvMzQxOTIzMDY?hl=en-IN&gl=IN&ceid=IN%3Aen,2023-09-03
38,"Future Wafer Coater and Developer market growth will depend on market size, trends, and the compound annu",Benzinga,news.google.com/articles/CBMimQFodHRwczovL3d3dy5iZW56aW5nYS5jb20vcHJlc3NyZWxlYXNlcy8yMy8wOS8zNDE5MjA3NS9mdXR1cmUtd2FmZXItY29hdGVyLWFuZC1kZXZlbG9wZXItbWFya2V0LWdyb3d0aC13aWxsLWRlcGVuZC1vbi1tYXJrZXQtc2l6ZS10cmVuZHMtYW5kLXRoZS1jb21wb3VuZC3SAS1odHRwczovL3d3dy5iZW56aW5nYS5jb20vYW1wL2NvbnRlbnQvMzQxOTIwNzU?hl=en-IN&gl=IN&ceid=IN%3Aen,2023-09-03
3,Cell and Gene Therapy Supply Chain/Logistics Market Future Scope ...,Digital Journal,news.google.com/articles/CBMinQFodHRwczovL3d3dy5kaWdpdGFsam91cm5hbC5jb20vcHIvbmV3cy9pbnNpZ2h0YWNlLWFuYWx5dGljL2NlbGwtYW5kLWdlbmUtdGhlcmFweS1zdXBwbHktY2hhaW4tbG9naXN0aWNzLW1hcmtldC1mdXR1cmUtc2NvcGUtYW5kLWxhdGVzdC10cmVuZHMtYW5hbHlzaXMtcmVwb3J00gEA?hl=en-IN&gl=IN&ceid=IN%3Aen,2023-09-02
42,"We have been investing in expanding our manufacturing footprint in India: Hariharan Subramanian, MD, Siemens Healthcare Private Limited",The Financial Express,news.google.com/articles/CBMiyAFodHRwczovL3d3dy5maW5hbmNpYWxleHByZXNzLmNvbS9oZWFsdGhjYXJlL21lZGljYWxkZXZpY2VzL3dlLWhhdmUtYmVlbi1pbnZlc3RpbmctaW4tZXhwYW5kaW5nLW91ci1tYW51ZmFjdHVyaW5nLWZvb3RwcmludC1pbi1pbmRpYS1oYXJpaGFyYW4tc3VicmFtYW5pYW4tbWQtc2llbWVucy1oZWFsdGhjYXJlLXByaXZhdGUtbGltaXRlZC8zMjMwMTQ1L9IBzQFodHRwczovL3d3dy5maW5hbmNpYWxleHByZXNzLmNvbS9oZWFsdGhjYXJlL21lZGljYWxkZXZpY2VzL3dlLWhhdmUtYmVlbi1pbnZlc3RpbmctaW4tZXhwYW5kaW5nLW91ci1tYW51ZmFjdHVyaW5nLWZvb3RwcmludC1pbi1pbmRpYS1oYXJpaGFyYW4tc3VicmFtYW5pYW4tbWQtc2llbWVucy1oZWFsdGhjYXJlLXByaXZhdGUtbGltaXRlZC8zMjMwMTQ1L2xpdGUv?hl=en-IN&gl=IN&ceid=IN%3Aen,2023-09-02
50,The Future of the Offline Controllers Market: Examining Trends and Forecasting Revenue with future CAGR o,Benzinga,news.google.com/articles/CBMimQFodHRwczovL3d3dy5iZW56aW5nYS5jb20vcHJlc3NyZWxlYXNlcy8yMy8wOS8zNDE5MTQ4OS90aGUtZnV0dXJlLW9mLXRoZS1vZmZsaW5lLWNvbnRyb2xsZXJzLW1hcmtldC1leGFtaW5pbmctdHJlbmRzLWFuZC1mb3JlY2FzdGluZy1yZXZlbnVlLXdpdGgtZnV0dXJlLWPSAS1odHRwczovL3d3dy5iZW56aW5nYS5jb20vYW1wL2NvbnRlbnQvMzQxOTE0ODk?hl=en-IN&gl=IN&ceid=IN%3Aen,2023-09-02
55,"Ultrasonic Tester Market Report Included Historical Trends, Future Projections, and CAGR Valuation of 11.",Benzinga,news.google.com/articles/CBMimQFodHRwczovL3d3dy5iZW56aW5nYS5jb20vcHJlc3NyZWxlYXNlcy8yMy8wOS8zNDE5MjAzNC91bHRyYXNvbmljLXRlc3Rlci1tYXJrZXQtcmVwb3J0LWluY2x1ZGVkLWhpc3RvcmljYWwtdHJlbmRzLWZ1dHVyZS1wcm9qZWN0aW9ucy1hbmQtY2Fnci12YWx1YXRpb24tb2bSAS1odHRwczovL3d3dy5iZW56aW5nYS5jb20vYW1wL2NvbnRlbnQvMzQxOTIwMzQ?hl=en-IN&gl=IN&ceid=IN%3Aen,2023-09-02
58,"Providing both historical trends and future projections, the Carton Film Fixed Resistor CF market insight",Benzinga,news.google.com/articles/CBMimQFodHRwczovL3d3dy5iZW56aW5nYS5jb20vcHJlc3NyZWxlYXNlcy8yMy8wOS8zNDE5MTgwMS9wcm92aWRpbmctYm90aC1oaXN0b3JpY2FsLXRyZW5kcy1hbmQtZnV0dXJlLXByb2plY3Rpb25zLXRoZS1jYXJ0b24tZmlsbS1maXhlZC1yZXNpc3Rvci1jZi1tYXJrZXQtaW7SAS1odHRwczovL3d3dy5iZW56aW5nYS5jb20vYW1wL2NvbnRlbnQvMzQxOTE4MDE?hl=en-IN&gl=IN&ceid=IN%3Aen,2023-09-02
59,The Future is Additive: Global Wire Connectors Market Projected to Surge with 5.2% CAGR and market segmen,Benzinga,news.google.com/articles/CBMimQFodHRwczovL3d3dy5iZW56aW5nYS5jb20vcHJlc3NyZWxlYXNlcy8yMy8wOS8zNDE5MTA0Mi90aGUtZnV0dXJlLWlzLWFkZGl0aXZlLWdsb2JhbC13aXJlLWNvbm5lY3RvcnMtbWFya2V0LXByb2plY3RlZC10by1zdXJnZS13aXRoLTUtMi1jYWdyLWFuZC1tYXJrZXQtc2XSAS1odHRwczovL3d3dy5iZW56aW5nYS5jb20vYW1wL2NvbnRlbnQvMzQxOTEwNDI?hl=en-IN&gl=IN&ceid=IN%3Aen,2023-09-02
