,title,source,link,date
85,The Apatites market size is expected to grow at a 11.1% CAGR until ...,Benzinga,news.google.com/articles/CBMimQFodHRwczovL3d3dy5iZW56aW5nYS5jb20vcHJlc3NyZWxlYXNlcy8yMy8wOS8zNDE5MjQ3OC90aGUtYXBhdGl0ZXMtbWFya2V0LXNpemUtaXMtZXhwZWN0ZWQtdG8tZ3Jvdy1hdC1hLTExLTEtY2Fnci11bnRpbC0yMDMwLWFuZC10aGlzLXJlcG9ydC1wcm92aWRlcy1hbi3SAQA?hl=en-IN&gl=IN&ceid=IN%3Aen,2023-09-03
70,Global Electronic Spirit Level Market Analysis and Growth Outlook: Market Size growing at a 6.9% CAGR Val,Benzinga,news.google.com/articles/CBMimQFodHRwczovL3d3dy5iZW56aW5nYS5jb20vcHJlc3NyZWxlYXNlcy8yMy8wOS8zNDE5MjMzMy9nbG9iYWwtZWxlY3Ryb25pYy1zcGlyaXQtbGV2ZWwtbWFya2V0LWFuYWx5c2lzLWFuZC1ncm93dGgtb3V0bG9vay1tYXJrZXQtc2l6ZS1ncm93aW5nLWF0LWEtNi05LWNhZ3LSAS1odHRwczovL3d3dy5iZW56aW5nYS5jb20vYW1wL2NvbnRlbnQvMzQxOTIzMzM?hl=en-IN&gl=IN&ceid=IN%3Aen,2023-09-03
47,"Based on recent market research, the Insect Pheromones market is expected to witness intense competition",Benzinga,news.google.com/articles/CBMimQFodHRwczovL3d3dy5iZW56aW5nYS5jb20vcHJlc3NyZWxlYXNlcy8yMy8wOS8zNDE5MjM0My9iYXNlZC1vbi1yZWNlbnQtbWFya2V0LXJlc2VhcmNoLXRoZS1pbnNlY3QtcGhlcm9tb25lcy1tYXJrZXQtaXMtZXhwZWN0ZWQtdG8td2l0bmVzcy1pbnRlbnNlLWNvbXBldGnSAS1odHRwczovL3d3dy5iZW56aW5nYS5jb20vYW1wL2NvbnRlbnQvMzQxOTIzNDM?hl=en-IN&gl=IN&ceid=IN%3Aen,2023-09-03
46,This report focuses on the Concentricity Gauges market size at a CAGR of 6.6% from 2023 to 2030,Benzinga,news.google.com/articles/CBMilAFodHRwczovL3d3dy5iZW56aW5nYS5jb20vcHJlc3NyZWxlYXNlcy8yMy8wOS8zNDE5MjE0NC90aGlzLXJlcG9ydC1mb2N1c2VzLW9uLXRoZS1jb25jZW50cmljaXR5LWdhdWdlcy1tYXJrZXQtc2l6ZS1hdC1hLWNhZ3Itb2YtNi02LWZyb20tMjAyMy10by0yMDMw0gEtaHR0cHM6Ly93d3cuYmVuemluZ2EuY29tL2FtcC9jb250ZW50LzM0MTkyMTQ0?hl=en-IN&gl=IN&ceid=IN%3Aen,2023-09-03
45,Aluminum Ammonium Sulfate market analysis report examines the ...,Benzinga,news.google.com/articles/CBMimQFodHRwczovL3d3dy5iZW56aW5nYS5jb20vcHJlc3NyZWxlYXNlcy8yMy8wOS8zNDE5MjQ3MC9hbHVtaW51bS1hbW1vbml1bS1zdWxmYXRlLW1hcmtldC1hbmFseXNpcy1yZXBvcnQtZXhhbWluZXMtdGhlLWluZHVzdHJ5cy1tYXJrZXQtc2l6ZS1jb21wZXRpdGlvbi1jaGHSAQA?hl=en-IN&gl=IN&ceid=IN%3Aen,2023-09-03
44,"Insightful Electronic Pressure Sensitive Tape Dispenser Market: Trends, Growth Opportunities, Market Shar",Benzinga,news.google.com/articles/CBMimQFodHRwczovL3d3dy5iZW56aW5nYS5jb20vcHJlc3NyZWxlYXNlcy8yMy8wOS8zNDE5MjYzOS9pbnNpZ2h0ZnVsLWVsZWN0cm9uaWMtcHJlc3N1cmUtc2Vuc2l0aXZlLXRhcGUtZGlzcGVuc2VyLW1hcmtldC10cmVuZHMtZ3Jvd3RoLW9wcG9ydHVuaXRpZXMtbWFya2V0LXPSAS1odHRwczovL3d3dy5iZW56aW5nYS5jb20vYW1wL2NvbnRlbnQvMzQxOTI2Mzk?hl=en-IN&gl=IN&ceid=IN%3Aen,2023-09-03
56,"Global Pumicites Market Analysis by Type, Application, and Geography: Growth Prospects and Trends Analysi",Benzinga,news.google.com/articles/CBMimQFodHRwczovL3d3dy5iZW56aW5nYS5jb20vcHJlc3NyZWxlYXNlcy8yMy8wOS8zNDE5MjQwNS9nbG9iYWwtcHVtaWNpdGVzLW1hcmtldC1hbmFseXNpcy1ieS10eXBlLWFwcGxpY2F0aW9uLWFuZC1nZW9ncmFwaHktZ3Jvd3RoLXByb3NwZWN0cy1hbmQtdHJlbmRzLWFuYWzSAS1odHRwczovL3d3dy5iZW56aW5nYS5jb20vYW1wL2NvbnRlbnQvMzQxOTI0MDU?hl=en-IN&gl=IN&ceid=IN%3Aen,2023-09-03
42,Nasal Gels market size with forecasted CAGR rate 13% provides critical information on the market segmenta,Benzinga,news.google.com/articles/CBMimQFodHRwczovL3d3dy5iZW56aW5nYS5jb20vcHJlc3NyZWxlYXNlcy8yMy8wOS8zNDE5MjU1NC9uYXNhbC1nZWxzLW1hcmtldC1zaXplLXdpdGgtZm9yZWNhc3RlZC1jYWdyLXJhdGUtMTMtcHJvdmlkZXMtY3JpdGljYWwtaW5mb3JtYXRpb24tb24tdGhlLW1hcmtldC1zZWfSAS1odHRwczovL3d3dy5iZW56aW5nYS5jb20vYW1wL2NvbnRlbnQvMzQxOTI1NTQ?hl=en-IN&gl=IN&ceid=IN%3Aen,2023-09-03
40,"Analysis of the Gingerols Market: Market Size, Growth, Share, Trends, and Forecast from 2023 to 2030 with",Benzinga,news.google.com/articles/CBMimQFodHRwczovL3d3dy5iZW56aW5nYS5jb20vcHJlc3NyZWxlYXNlcy8yMy8wOS8zNDE5MjIxNS9hbmFseXNpcy1vZi10aGUtZ2luZ2Vyb2xzLW1hcmtldC1tYXJrZXQtc2l6ZS1ncm93dGgtc2hhcmUtdHJlbmRzLWFuZC1mb3JlY2FzdC1mcm9tLTIwMjMtdG8tMjAzMC13aXTSAS1odHRwczovL3d3dy5iZW56aW5nYS5jb20vYW1wL2NvbnRlbnQvMzQxOTIyMTU?hl=en-IN&gl=IN&ceid=IN%3Aen,2023-09-03
61,"The Whole Slide Image industry is one of the fastest-growing markets globally, and it is expected to main",Benzinga,news.google.com/articles/CBMimQFodHRwczovL3d3dy5iZW56aW5nYS5jb20vcHJlc3NyZWxlYXNlcy8yMy8wOS8zNDE5MjMwNC90aGUtd2hvbGUtc2xpZGUtaW1hZ2UtaW5kdXN0cnktaXMtb25lLW9mLXRoZS1mYXN0ZXN0LWdyb3dpbmctbWFya2V0cy1nbG9iYWxseS1hbmQtaXQtaXMtZXhwZWN0ZWQtdG_SAS1odHRwczovL3d3dy5iZW56aW5nYS5jb20vYW1wL2NvbnRlbnQvMzQxOTIzMDQ?hl=en-IN&gl=IN&ceid=IN%3Aen,2023-09-03
