,title,source,link,date
39,"Building Information Modeling (BIM) Market Business Strategies 2023-2030: Latest Trends, Future Demand wi",Benzinga,news.google.com/articles/CBMimQFodHRwczovL3d3dy5iZW56aW5nYS5jb20vcHJlc3NyZWxlYXNlcy8yMy8wOS8zNDcxMzgyOC9idWlsZGluZy1pbmZvcm1hdGlvbi1tb2RlbGluZy1iaW0tbWFya2V0LWJ1c2luZXNzLXN0cmF0ZWdpZXMtMjAyMy0yMDMwLWxhdGVzdC10cmVuZHMtZnV0dXJlLWRlbWFuZC3SAS1odHRwczovL3d3dy5iZW56aW5nYS5jb20vYW1wL2NvbnRlbnQvMzQ3MTM4Mjg?hl=en-IN&gl=IN&ceid=IN%3Aen,2023-09-19
32,"Cold Chain Storage Market Opportunities 2023: Strategic Business Insights, Developments, and Future Deman",Benzinga,news.google.com/articles/CBMimQFodHRwczovL3d3dy5iZW56aW5nYS5jb20vcHJlc3NyZWxlYXNlcy8yMy8wOS8zNDcxNTA0Ny9jb2xkLWNoYWluLXN0b3JhZ2UtbWFya2V0LW9wcG9ydHVuaXRpZXMtMjAyMy1zdHJhdGVnaWMtYnVzaW5lc3MtaW5zaWdodHMtZGV2ZWxvcG1lbnRzLWFuZC1mdXR1cmUtZGXSAS1odHRwczovL3d3dy5iZW56aW5nYS5jb20vYW1wL2NvbnRlbnQvMzQ3MTUwNDc?hl=en-IN&gl=IN&ceid=IN%3Aen,2023-09-19
34,Supply Chain Management (SCM) in Textile Industry Market Size ...,Rouge Fox,news.google.com/articles/CBMiZGh0dHBzOi8vcm91Z2Vmb3guY29tL3N1cHBseS1jaGFpbi1tYW5hZ2VtZW50LXNjbS1pbi10ZXh0aWxlLWluZHVzdHJ5LW1hcmtldC1zaXplLXNjb3BlLWFuZC1mb3JlY2FzdC_SAQA?hl=en-IN&gl=IN&ceid=IN%3Aen,2023-09-19
35,BPE announces three key global partnerships to enhance Southeast ...,TimesTech,news.google.com/articles/CBMiZWh0dHBzOi8vdGltZXN0ZWNoLmluL2JwZS1hbm5vdW5jZXMtdGhyZWUta2V5LWdsb2JhbC1wYXJ0bmVyc2hpcHMtdG8tZW5oYW5jZS1zb3V0aGVhc3QtYXNpYW4tcHJlc2VuY2Uv0gEA?hl=en-IN&gl=IN&ceid=IN%3Aen,2023-09-19
36,"Outsourcing in BFSI Sector Market Future Vision 2023-2030: Growth Prospects, Technology Evolution, and Re",Benzinga,news.google.com/articles/CBMimQFodHRwczovL3d3dy5iZW56aW5nYS5jb20vcHJlc3NyZWxlYXNlcy8yMy8wOS8zNDcxNTAwOC9vdXRzb3VyY2luZy1pbi1iZnNpLXNlY3Rvci1tYXJrZXQtZnV0dXJlLXZpc2lvbi0yMDIzLTIwMzAtZ3Jvd3RoLXByb3NwZWN0cy10ZWNobm9sb2d5LWV2b2x1dGlvbi1hbmTSAS1odHRwczovL3d3dy5iZW56aW5nYS5jb20vYW1wL2NvbnRlbnQvMzQ3MTUwMDg?hl=en-IN&gl=IN&ceid=IN%3Aen,2023-09-19
1,2023-2031 Logistics Services Market is Growing Rapidly with Emerging Pattern,Benzinga,news.google.com/articles/CBMiggFodHRwczovL3d3dy5iZW56aW5nYS5jb20vcHJlc3NyZWxlYXNlcy8yMy8wOS8zNDcyODExNC8yMDIzLTIwMzEtbG9naXN0aWNzLXNlcnZpY2VzLW1hcmtldC1pcy1ncm93aW5nLXJhcGlkbHktd2l0aC1lbWVyZ2luZy1wYXR0ZXJu0gEtaHR0cHM6Ly93d3cuYmVuemluZ2EuY29tL2FtcC9jb250ZW50LzM0NzI4MTE0?hl=en-IN&gl=IN&ceid=IN%3Aen,2023-09-19
43,"Talent Acquisition Solutions Market Future Vision: Advancements, Regional Strategies, and Key Player Insi",Benzinga,news.google.com/articles/CBMimQFodHRwczovL3d3dy5iZW56aW5nYS5jb20vcHJlc3NyZWxlYXNlcy8yMy8wOS8zNDcxNDQ4My90YWxlbnQtYWNxdWlzaXRpb24tc29sdXRpb25zLW1hcmtldC1mdXR1cmUtdmlzaW9uLWFkdmFuY2VtZW50cy1yZWdpb25hbC1zdHJhdGVnaWVzLWFuZC1rZXktcGxheWVyLWnSAS1odHRwczovL3d3dy5iZW56aW5nYS5jb20vYW1wL2NvbnRlbnQvMzQ3MTQ0ODM?hl=en-IN&gl=IN&ceid=IN%3Aen,2023-09-19
46,"Game Testing Service Market Future Vision: Advancements, Regional Strategies, and Key Player Insights 203",Benzinga,news.google.com/articles/CBMimQFodHRwczovL3d3dy5iZW56aW5nYS5jb20vcHJlc3NyZWxlYXNlcy8yMy8wOS8zNDcxNTAxOS9nYW1lLXRlc3Rpbmctc2VydmljZS1tYXJrZXQtZnV0dXJlLXZpc2lvbi1hZHZhbmNlbWVudHMtcmVnaW9uYWwtc3RyYXRlZ2llcy1hbmQta2V5LXBsYXllci1pbnNpZ2h0cy3SAS1odHRwczovL3d3dy5iZW56aW5nYS5jb20vYW1wL2NvbnRlbnQvMzQ3MTUwMTk?hl=en-IN&gl=IN&ceid=IN%3Aen,2023-09-19
47,"Smart Cities Market Future Vision: Advancements, Regional Strategies, and Key Player Insights 2030",Benzinga,news.google.com/articles/CBMilQFodHRwczovL3d3dy5iZW56aW5nYS5jb20vcHJlc3NyZWxlYXNlcy8yMy8wOS8zNDcxNDk5NC9zbWFydC1jaXRpZXMtbWFya2V0LWZ1dHVyZS12aXNpb24tYWR2YW5jZW1lbnRzLXJlZ2lvbmFsLXN0cmF0ZWdpZXMtYW5kLWtleS1wbGF5ZXItaW5zaWdodHMtMjAzMNIBLWh0dHBzOi8vd3d3LmJlbnppbmdhLmNvbS9hbXAvY29udGVudC8zNDcxNDk5NA?hl=en-IN&gl=IN&ceid=IN%3Aen,2023-09-19
48,Rising Investments in Refrigerated Warehouses Propel Growth in ...,GlobeNewswire,news.google.com/articles/CBMirgFodHRwczovL3d3dy5nbG9iZW5ld3N3aXJlLmNvbS9uZXdzLXJlbGVhc2UvMjAyMy8wOS8xOS8yNzQ1NTg2LzAvZW4vUmlzaW5nLUludmVzdG1lbnRzLWluLVJlZnJpZ2VyYXRlZC1XYXJlaG91c2VzLVByb3BlbC1Hcm93dGgtaW4tdGhlLUdsb2JhbC1Db2xkLUNoYWluLU1vbml0b3JpbmctTWFya2V0Lmh0bWzSAQA?hl=en-IN&gl=IN&ceid=IN%3Aen,2023-09-19
