,title,source,link,date
2,Aquaculture Cages Market to grow by USD 86.68 million from 2022 to 2027 | Declining fish stock due to unsustainable fishing practices to drive the growth- Technavio,Yahoo Finance,news.google.com/articles/CBMiT2h0dHBzOi8vZmluYW5jZS55YWhvby5jb20vbmV3cy9hcXVhY3VsdHVyZS1jYWdlcy1tYXJrZXQtZ3Jvdy11c2QtMDYzNTAwMzk0Lmh0bWzSAVdodHRwczovL2ZpbmFuY2UueWFob28uY29tL2FtcGh0bWwvbmV3cy9hcXVhY3VsdHVyZS1jYWdlcy1tYXJrZXQtZ3Jvdy11c2QtMDYzNTAwMzk0Lmh0bWw?hl=en-IN&gl=IN&ceid=IN%3Aen,2023-09-26
9,"Agriculture Nets Market will grow at a CAGR of 5.9%, Size, Segments, Key Drivers and Opportunities Analysis",openPR,news.google.com/articles/CBMiW2h0dHBzOi8vd3d3Lm9wZW5wci5jb20vbmV3cy8zMjIyODUzL2FncmljdWx0dXJlLW5ldHMtbWFya2V0LXdpbGwtZ3Jvdy1hdC1hLWNhZ3Itb2YtNS05LXNpemXSAVpodHRwczovL3d3dy5vcGVucHIuY29tL2FtcC8zMjIyODUzL2FncmljdWx0dXJlLW5ldHMtbWFya2V0LXdpbGwtZ3Jvdy1hdC1hLWNhZ3Itb2YtNS05LXNpemU?hl=en-IN&gl=IN&ceid=IN%3Aen,2023-09-25
11,"Agricultural Textiles Market Insights By Size, Growth, Revenue ...",Digital Journal,news.google.com/articles/CBMisAFodHRwczovL3d3dy5kaWdpdGFsam91cm5hbC5jb20vcHIvbmV3cy94aGVyYWxkL2FncmljdWx0dXJhbC10ZXh0aWxlcy1tYXJrZXQtaW5zaWdodHMtYnktc2l6ZS1ncm93dGgtcmV2ZW51ZS1zaGFyZS10b3AtbWFudWZhY3R1cmVycy1jdXJyZW50LWFuZC1lbWVyZ2luZy10cmVuZHMtZm9yZWNhc3QtdG8tMjAzMtIBAA?hl=en-IN&gl=IN&ceid=IN%3Aen,2023-09-22
0,Garware Technical Fibres: Innovations driving global growth,The Textile Magazine,news.google.com/articles/CBMiYGh0dHBzOi8vd3d3LmluZGlhbnRleHRpbGVtYWdhemluZS5pbi9nYXJ3YXJlLXRlY2huaWNhbC1maWJyZXMtaW5ub3ZhdGlvbnMtZHJpdmluZy1nbG9iYWwtZ3Jvd3RoL9IBAA?hl=en-IN&gl=IN&ceid=IN%3Aen,2023-09-20
14,"Stocks To Watch: IOCL, Bharat Electronics, Tata Steel, HAL, Dhanlaxmi Bank, Zomato, Tata Elxsi, PVR Inox",BQ Prime,news.google.com/articles/CBMigQFodHRwczovL3d3dy5icXByaW1lLmNvbS9idXNpbmVzcy9zdG9ja3MtdG8td2F0Y2gtaW9jbC1iaGFyYXQtZWxlY3Ryb25pY3MtdGF0YS1zdGVlbC1oYWwtZGhhbmxheG1pLWJhbmstem9tYXRvLXRhdGEtZWx4c2ktcHZyLWlub3jSAYUBaHR0cHM6Ly93d3cuYnFwcmltZS5jb20vYW1wL2J1c2luZXNzL3N0b2Nrcy10by13YXRjaC1pb2NsLWJoYXJhdC1lbGVjdHJvbmljcy10YXRhLXN0ZWVsLWhhbC1kaGFubGF4bWktYmFuay16b21hdG8tdGF0YS1lbHhzaS1wdnItaW5veA?hl=en-IN&gl=IN&ceid=IN%3Aen,2023-09-18
21,"Dividend Stocks: SAIL, Mastek, RVNL, Mazagon Dock Shipbuilders, others to trade ex-dividend this week; check full list | Mint",Mint,news.google.com/articles/CBMipgFodHRwczovL3d3dy5saXZlbWludC5jb20vbWFya2V0L3N0b2NrLW1hcmtldC1uZXdzL2RpdmlkZW5kLXN0b2Nrcy1zYWlsLW1hc3Rlay1ydm5sLW1hemFnb24tZG9jay1zaGlwYnVpbGRlcnMtb3RoZXJzLXRvLXRyYWRlLWV4LWRpdmlkZW5kLXRoaXMtd2Vlay0xMTY5NDg3NzUzMjQ5OC5odG1s0gGqAWh0dHBzOi8vd3d3LmxpdmVtaW50LmNvbS9tYXJrZXQvc3RvY2stbWFya2V0LW5ld3MvZGl2aWRlbmQtc3RvY2tzLXNhaWwtbWFzdGVrLXJ2bmwtbWF6YWdvbi1kb2NrLXNoaXBidWlsZGVycy1vdGhlcnMtdG8tdHJhZGUtZXgtZGl2aWRlbmQtdGhpcy13ZWVrL2FtcC0xMTY5NDg3NzUzMjQ5OC5odG1s?hl=en-IN&gl=IN&ceid=IN%3Aen,2023-09-16
