,title,source,link,date
0,Bottlenecks Begone: How GE Aerospace Devised a Way to Make ...,General Electric,news.google.com/articles/CBMidmh0dHBzOi8vd3d3LmdlLmNvbS9uZXdzL3JlcG9ydHMvYm90dGxlbmVja3MtYmVnb25lLWhvdy1nZS1hZXJvc3BhY2UtZGV2aXNlZC1hLXdheS10by1tYWtlLWVuZ2luZXMtYW5kLXNhdmUtaHVuZHJlZHMtb2bSAQA?hl=en-IN&gl=IN&ceid=IN%3Aen,2023-09-28
1,Deutsche Bank Initiates Coverage of General Electric (GE) with Buy ...,Nasdaq,news.google.com/articles/CBMib2h0dHBzOi8vd3d3Lm5hc2RhcS5jb20vYXJ0aWNsZXMvZGV1dHNjaGUtYmFuay1pbml0aWF0ZXMtY292ZXJhZ2Utb2YtZ2VuZXJhbC1lbGVjdHJpYy1nZS13aXRoLWJ1eS1yZWNvbW1lbmRhdGlvbtIBAA?hl=en-IN&gl=IN&ceid=IN%3Aen,2023-09-28
3,Douglas Lane & Associates LLC Purchases New Position in GE ...,MarketBeat,news.google.com/articles/CBMiTGh0dHBzOi8vd3d3Lm1hcmtldGJlYXQuY29tL2luc3RhbnQtYWxlcnRzL25hc2RhcS1nZWhjLXNlYy1maWxpbmctMjAyMy0wOS0yOC_SAQA?hl=en-IN&gl=IN&ceid=IN%3Aen,2023-09-28
7,SEGA cancels HYENAS and other unannounced titles by SEGA ...,Gematsu,news.google.com/articles/CBMiX2h0dHBzOi8vd3d3LmdlbWF0c3UuY29tLzIwMjMvMDkvc2VnYS1jYW5jZWxzLWh5ZW5hcy1hbmQtb3RoZXItdW5hbm5vdW5jZWQtdGl0bGVzLWJ5LXNlZ2EtZXVyb3Bl0gEA?hl=en-IN&gl=IN&ceid=IN%3Aen,2023-09-28
4,Kick off your fall baking with a sweet deal on a GE stand mixer: Save ...,CBS News,news.google.com/articles/CBMihgFodHRwczovL3d3dy5jYnNuZXdzLmNvbS9lc3NlbnRpYWxzL2tpY2stb2ZmLXlvdXItZmFsbC1iYWtpbmctd2l0aC10aGUtc3dlZXQtZGVhbC1vbi1hLWdlLXN0YW5kLW1peGVycy1nZXQtaXQtZm9yLTUwLW9mZi1vbi1hbWF6b24tbm93L9IBAA?hl=en-IN&gl=IN&ceid=IN%3Aen,2023-09-27
8,Biden Administration Announces Gainful Employment Rules,Diverse: Issues in Higher Education,news.google.com/articles/CBMie2h0dHBzOi8vd3d3LmRpdmVyc2VlZHVjYXRpb24uY29tL2xlYWRlcnNoaXAtcG9saWN5L2FydGljbGUvMTU2MzUyNzEvYmlkZW4tYWRtaW5pc3RyYXRpb24tYW5ub3VuY2VzLWdhaW5mdWwtZW1wbG95bWVudC1ydWxlc9IBAA?hl=en-IN&gl=IN&ceid=IN%3Aen,2023-09-27
9,"CommonSpirit Health keeps growing, even as it loses money",STAT,news.google.com/articles/CBMiRWh0dHBzOi8vd3d3LnN0YXRuZXdzLmNvbS8yMDIzLzA5LzI1L2NvbW1vbnNwaXJpdC1oZWFsdGgtZGVidC1sYXlvZmZzL9IBAA?hl=en-IN&gl=IN&ceid=IN%3Aen,2023-09-25
