,title,source,link,date
32,"Cocaine hydrochloride, cocaine methiodide and ...",Nature.com,news.google.com/articles/CBMiMmh0dHBzOi8vd3d3Lm5hdHVyZS5jb20vYXJ0aWNsZXMvczQxNTk4LTAyMy00MDg5Mi0x0gEA?hl=en-IN&gl=IN&ceid=IN%3Aen,2023-08-23
25,Effects of 13C isotope-labeled allelochemicals on the growth of the ...,Nature.com,news.google.com/articles/CBMiMmh0dHBzOi8vd3d3Lm5hdHVyZS5jb20vYXJ0aWNsZXMvczQxNTk4LTAyMy0zOTg4OS030gEA?hl=en-IN&gl=IN&ceid=IN%3Aen,2023-08-23
46,Scientist urges more Vibrio awareness as risk moves north,Coastal Review Online,news.google.com/articles/CBMiX2h0dHBzOi8vY29hc3RhbHJldmlldy5vcmcvMjAyMy8wOC92aWJyaW8taW5mZWN0aW9ucy1pbmNyZWFzaW5nLWFzLWNsaW1hdGUtd2FybXMtcmVzZWFyY2gtd2FybnMv0gEA?hl=en-IN&gl=IN&ceid=IN%3Aen,2023-08-22
24,Delayed Presentation of Acute Tonsillitis Due to Monkeypox in an ...,Cureus,news.google.com/articles/CBMitQFodHRwczovL3d3dy5jdXJldXMuY29tL2FydGljbGVzLzE3ODY1NC1kZWxheWVkLXByZXNlbnRhdGlvbi1vZi1hY3V0ZS10b25zaWxsaXRpcy1kdWUtdG8tbW9ua2V5cG94LWluLWFuLWltbXVub2NvbXByb21pc2VkLXBhdGllbnQtdW5pcXVlLWNhdXNlLW9mLWEtY29tbW9uLWRpc2Vhc2U_c2NvcmVfYXJ0aWNsZT10cnVl0gEA?hl=en-IN&gl=IN&ceid=IN%3Aen,2023-08-22
36,ANT(6) associated with aminoglycoside resistance | IDR,Dove Medical Press,news.google.com/articles/CBMigwFodHRwczovL3d3dy5kb3ZlcHJlc3MuY29tL2NoYXJhY3Rlcml6YXRpb24tYW5kLW1vbGVjdWxhci1tZWNoYW5pc20tb2YtYW1pbm9nbHljb3NpZGUtNi1hZGVueWwtdHItcGVlci1yZXZpZXdlZC1mdWxsdGV4dC1hcnRpY2xlLUlEUtIBAA?hl=en-IN&gl=IN&ceid=IN%3Aen,2023-08-22
16,"High Fat Diet Alters Gut Bacteria and Bile Acids in Mice, Increasing ...",Genetic Engineering & Biotechnology News,news.google.com/articles/CBMihAFodHRwczovL3d3dy5nZW5lbmduZXdzLmNvbS90b3BpY3MvY2FuY2VyL2hpZ2gtZmF0LWRpZXQtYWx0ZXJzLWd1dC1iYWN0ZXJpYS1hbmQtYmlsZS1hY2lkcy1pbi1taWNlLWluY3JlYXNpbmctY29sb3JlY3RhbC1jYW5jZXItcmlzay_SAQA?hl=en-IN&gl=IN&ceid=IN%3Aen,2023-08-22
17,A separable temporal convolutional networks based deep learning ...,Nature.com,news.google.com/articles/CBMiMmh0dHBzOi8vd3d3Lm5hdHVyZS5jb20vYXJ0aWNsZXMvczQxNTk4LTAyMy00MDkyMi150gEA?hl=en-IN&gl=IN&ceid=IN%3Aen,2023-08-22
33,Ancient DNA re-opens the question of the phylogenetic position of ...,Nature.com,news.google.com/articles/CBMiMmh0dHBzOi8vd3d3Lm5hdHVyZS5jb20vYXJ0aWNsZXMvczQxNTk4LTAyMy00MDc0Ni130gEA?hl=en-IN&gl=IN&ceid=IN%3Aen,2023-08-21
14,Iranians discover new golden-haired tarantula species in the Zagros ...,Nautilus Magazine,news.google.com/articles/CBMiRmh0dHBzOi8vbmF1dGlsLnVzL25ldy10YXJhbnR1bGEtZGlzY292ZXJlZC1pbi11bmV4cGVjdGVkLXBsYWNlLTM2NTc5OC_SAQA?hl=en-IN&gl=IN&ceid=IN%3Aen,2023-08-21
35,Mathematical assessment of monkeypox disease with the impact of ...,Nature.com,news.google.com/articles/CBMiMmh0dHBzOi8vd3d3Lm5hdHVyZS5jb20vYXJ0aWNsZXMvczQxNTk4LTAyMy00MDc0NS140gEA?hl=en-IN&gl=IN&ceid=IN%3Aen,2023-08-20
