,title,source,link,date
27,K-State researchers make discovery involving dead Salina zoo rhino,Salina Journal,news.google.com/articles/CBMilQFodHRwczovL3d3dy5zYWxpbmEuY29tL3N0b3J5L25ld3MvbG9jYWwvMjAyMy8wOS8yNS9rYW5zYXMtc3RhdGUtcmVzZWFyY2hlcnMtbWFrZS1kaXNjb3ZlcnktaW52b2x2aW5nLWRlYWQtc2FsaW5hLXJvbGxpbmctaGlsbHMtem9vLXJoaW5vLzcwODkwNTY2MDA3L9IBAA?hl=en-IN&gl=IN&ceid=IN%3Aen,2023-09-26
50,"Daniel Andrews: Outgoing Victorian Premier's life in politics, timeline ...",9News,news.google.com/articles/CBMihAFodHRwczovL3d3dy45bmV3cy5jb20uYXUvbmF0aW9uYWwvZGFuaWVsLWFuZHJld3MtcmV0aXJlcy1jYXJlZXItdGltZWxpbmUtcG9saXRpY3MtY29udHJvdmVyc2llcy9kNDcxZWRmZi02YjBiLTQxNTItODY3My00Y2ViNTViNDcxMTbSAQA?hl=en-IN&gl=IN&ceid=IN%3Aen,2023-09-26
64,Hundreds Of Mysterious 'Fairy Circles' Seen From Space For First ...,msnNOW,news.google.com/articles/CBMidGh0dHBzOi8vd3d3Lm1zbi5jb20vZW4tdXMvbmV3cy93b3JsZC9odW5kcmVkcy1vZi1teXN0ZXJpb3VzLWZhaXJ5LWNpcmNsZXMtc2Vlbi1mcm9tLXNwYWNlLWZvci1maXJzdC10aW1lL2FyLUFBMWhlVlVX0gEA?hl=en-IN&gl=IN&ceid=IN%3Aen,2023-09-25
16,Phylogenetic diversity and functional potential of the microbial ...,Nature.com,news.google.com/articles/CBMiMmh0dHBzOi8vd3d3Lm5hdHVyZS5jb20vYXJ0aWNsZXMvczQxNTk4LTAyMy00MzMwNi000gEA?hl=en-IN&gl=IN&ceid=IN%3Aen,2023-09-25
5,"An Ancient Whale Named for King Tut, but Moby-Dinky in Size",The New York Times,news.google.com/articles/CBMiSGh0dHBzOi8vd3d3Lm55dGltZXMuY29tLzIwMjMvMDkvMjUvc2NpZW5jZS9hcmNoYWVvbG9neS13aGFsZXMtZWd5cHQuaHRtbNIBAA?hl=en-IN&gl=IN&ceid=IN%3Aen,2023-09-25
8,Pan-Coronavirus Vaccine Performs Well in Preclinical Studies,Genetic Engineering & Biotechnology News,news.google.com/articles/CBMia2h0dHBzOi8vd3d3LmdlbmVuZ25ld3MuY29tL3RvcGljcy9jb3JvbmF2aXJ1cy9wYW4tY29yb25hdmlydXMtdmFjY2luZS1wZXJmb3Jtcy13ZWxsLWluLXByZWNsaW5pY2FsLXN0dWRpZXMv0gEA?hl=en-IN&gl=IN&ceid=IN%3Aen,2023-09-25
31,"Fluctuation in the diversity of mayflies (Insecta, Ephemerida) as ...",Nature.com,news.google.com/articles/CBMiMmh0dHBzOi8vd3d3Lm5hdHVyZS5jb20vYXJ0aWNsZXMvczQxNTk4LTAyMy00MjU3MS030gEA?hl=en-IN&gl=IN&ceid=IN%3Aen,2023-09-25
14,Cross-species virus transmission found in several species of small furry animals,Phys.org,news.google.com/articles/CBMiUWh0dHBzOi8vcGh5cy5vcmcvbmV3cy8yMDIzLTA5LWNyb3NzLXNwZWNpZXMtdmlydXMtdHJhbnNtaXNzaW9uLXNwZWNpZXMtc21hbGwuaHRtbNIBUGh0dHBzOi8vcGh5cy5vcmcvbmV3cy8yMDIzLTA5LWNyb3NzLXNwZWNpZXMtdmlydXMtdHJhbnNtaXNzaW9uLXNwZWNpZXMtc21hbGwuYW1w?hl=en-IN&gl=IN&ceid=IN%3Aen,2023-09-25
25,Microsporidia MB in the primary malaria vector Anopheles gambiae ...,Parasites & Vectors,news.google.com/articles/CBMiUWh0dHBzOi8vcGFyYXNpdGVzYW5kdmVjdG9ycy5iaW9tZWRjZW50cmFsLmNvbS9hcnRpY2xlcy8xMC4xMTg2L3MxMzA3MS0wMjMtMDU5MzMtONIBAA?hl=en-IN&gl=IN&ceid=IN%3Aen,2023-09-25
39,Mumbai Diary: Sunday Dossier,mid-day.com,news.google.com/articles/CBMiW2h0dHBzOi8vd3d3Lm1pZC1kYXkuY29tL2FtcC9tdW1iYWkvbXVtYmFpLW5ld3MvYXJ0aWNsZS9tdW1iYWktZGlhcnktc3VuZGF5LWRvc3NpZXItMjMzMTA2NDfSAVtodHRwczovL3d3dy5taWQtZGF5LmNvbS9hbXAvbXVtYmFpL211bWJhaS1uZXdzL2FydGljbGUvbXVtYmFpLWRpYXJ5LXN1bmRheS1kb3NzaWVyLTIzMzEwNjQ3?hl=en-IN&gl=IN&ceid=IN%3Aen,2023-09-24
