,title,source,link,date
16,Hide and seek: sharks found in sponge houses,CSIRO,news.google.com/articles/CBMiSmh0dHBzOi8vd3d3LmNzaXJvLmF1L2VuL25ld3MvQWxsL0FydGljbGVzLzIwMjMvU2VwdGVtYmVyL3NoYXJrcy1pbi1zcG9uZ2Vz0gEA?hl=en-IN&gl=IN&ceid=IN%3Aen,2023-09-14
58,What's in the Coosa River and Is It Safe to Swim In?,AZ Animals,news.google.com/articles/CBMiUGh0dHBzOi8vYS16LWFuaW1hbHMuY29tL2Jsb2cvd2hhdHMtaW4tdGhlLWNvb3NhLXJpdmVyLWFuZC1pcy1pdC1zYWZlLXRvLXN3aW0taW4v0gEA?hl=en-IN&gl=IN&ceid=IN%3Aen,2023-09-14
25,Malaria misdiagnosis in the routine health system in Arba Minch ...,Malaria Journal,news.google.com/articles/CBMiTGh0dHBzOi8vbWFsYXJpYWpvdXJuYWwuYmlvbWVkY2VudHJhbC5jb20vYXJ0aWNsZXMvMTAuMTE4Ni9zMTI5MzYtMDIzLTA0NzExLTLSAQA?hl=en-IN&gl=IN&ceid=IN%3Aen,2023-09-14
28,The temporal dynamics of Plasmodium species infection after ...,Malaria Journal,news.google.com/articles/CBMiTGh0dHBzOi8vbWFsYXJpYWpvdXJuYWwuYmlvbWVkY2VudHJhbC5jb20vYXJ0aWNsZXMvMTAuMTE4Ni9zMTI5MzYtMDIzLTA0NzEyLTHSAQA?hl=en-IN&gl=IN&ceid=IN%3Aen,2023-09-14
9,Request for public discussion and ballot to amend SeqCode rules ...,Nature.com,news.google.com/articles/CBMiMmh0dHBzOi8vd3d3Lm5hdHVyZS5jb20vYXJ0aWNsZXMvczQzNzA1LTAyMy0wMDMwMy150gEA?hl=en-IN&gl=IN&ceid=IN%3Aen,2023-09-14
36,Microencapsulation by spray-drying and freeze-drying of extract of ...,Nature.com,news.google.com/articles/CBMiMmh0dHBzOi8vd3d3Lm5hdHVyZS5jb20vYXJ0aWNsZXMvczQxNTk4LTAyMy00MDM5MC000gEA?hl=en-IN&gl=IN&ceid=IN%3Aen,2023-09-14
17,Should we rename the Hitler beetle or the Mussolini butterfly ...,Livescience.com,news.google.com/articles/CBMigwFodHRwczovL3d3dy5saXZlc2NpZW5jZS5jb20vYW5pbWFscy9zaG91bGQtd2UtcmVuYW1lLXRoZS1oaXRsZXItYmVldGxlLW9yLXRoZS1tdXNzb2xpbmktYnV0dGVyZmx5LXNjaWVudGlzdHMtYXJlLXNob2NraW5nbHktZGl2aWRlZNIBAA?hl=en-IN&gl=IN&ceid=IN%3Aen,2023-09-14
15,Newly described gecko from Madagascar a master of disguise,Mongabay.com,news.google.com/articles/CBMiXWh0dHBzOi8vbmV3cy5tb25nYWJheS5jb20vMjAyMy8wOS9uZXdseS1kZXNjcmliZWQtZ2Vja28tZnJvbS1tYWRhZ2FzY2FyLWEtbWFzdGVyLW9mLWRpc2d1aXNlL9IBYWh0dHBzOi8vbmV3cy5tb25nYWJheS5jb20vMjAyMy8wOS9uZXdseS1kZXNjcmliZWQtZ2Vja28tZnJvbS1tYWRhZ2FzY2FyLWEtbWFzdGVyLW9mLWRpc2d1aXNlL2FtcC8?hl=en-IN&gl=IN&ceid=IN%3Aen,2023-09-14
61,First ever dog-fox hybrid discovered in the wild,The Telegraph,news.google.com/articles/CBMiW2h0dHBzOi8vd3d3LnRlbGVncmFwaC5jby51ay9uZXdzLzIwMjMvMDkvMTMvZmlyc3QtZG9nLWZveC1oeWJyaWQtZGlzY292ZXJlZC1pbi13aWxkLWJyYXppbC_SAQA?hl=en-IN&gl=IN&ceid=IN%3Aen,2023-09-13
39,Larvicidal and anti-termite activities of microbial biosurfactant ...,Nature.com,news.google.com/articles/CBMiMmh0dHBzOi8vd3d3Lm5hdHVyZS5jb20vYXJ0aWNsZXMvczQxNTk4LTAyMy00MjQ3NS020gEA?hl=en-IN&gl=IN&ceid=IN%3Aen,2023-09-13
