,title,source,link,date
19,Bacteria distribution & their drug resistance changes: ICUs | IDR,Dove Medical Press,news.google.com/articles/CBMigwFodHRwczovL3d3dy5kb3ZlcHJlc3MuY29tL2FuYWx5c2lzLW9uLWJhY3RlcmlhbC1kaXN0cmlidXRpb24tYW5kLWNoYW5nZS1vZi1kcnVnLXJlc2lzdGFuY2UtcmF0ZS0tcGVlci1yZXZpZXdlZC1mdWxsdGV4dC1hcnRpY2xlLUlEUtIBAA?hl=en-IN&gl=IN&ceid=IN%3Aen,2023-08-29
22,Interrogating the viral dark matter of the rumen ecosystem with a ...,Nature.com,news.google.com/articles/CBMiMmh0dHBzOi8vd3d3Lm5hdHVyZS5jb20vYXJ0aWNsZXMvczQxNDY3LTAyMy00MTA3NS0y0gEA?hl=en-IN&gl=IN&ceid=IN%3Aen,2023-08-29
36,Antioxidant and antimicrobial effects of essential oils from two salvia ...,Nature.com,news.google.com/articles/CBMiMmh0dHBzOi8vd3d3Lm5hdHVyZS5jb20vYXJ0aWNsZXMvczQxNTk4LTAyMy00MTE3OC0y0gEA?hl=en-IN&gl=IN&ceid=IN%3Aen,2023-08-28
68,"Eucalyptus Oil Market is projected to reach $252.0 million by 2030, registering a CAGR of 6.6% from 2021 to 20",openPR,news.google.com/articles/CBMiXWh0dHBzOi8vd3d3Lm9wZW5wci5jb20vbmV3cy8zMTgzMjkwL2V1Y2FseXB0dXMtb2lsLW1hcmtldC1pcy1wcm9qZWN0ZWQtdG8tcmVhY2gtMjUyLTAtbWlsbGlvbtIBXGh0dHBzOi8vd3d3Lm9wZW5wci5jb20vYW1wLzMxODMyOTAvZXVjYWx5cHR1cy1vaWwtbWFya2V0LWlzLXByb2plY3RlZC10by1yZWFjaC0yNTItMC1taWxsaW9u?hl=en-IN&gl=IN&ceid=IN%3Aen,2023-08-28
55,13 Plants that Look Like Poison Ivy... But Are Totally Different,AZ Animals,news.google.com/articles/CBMiWGh0dHBzOi8vYS16LWFuaW1hbHMuY29tL2Jsb2cvcGxhbnRzLXRoYXQtbG9vay1saWtlLXBvaXNvbi1pdnktYnV0LWFyZS10b3RhbGx5LWRpZmZlcmVudC_SAQA?hl=en-IN&gl=IN&ceid=IN%3Aen,2023-08-28
12,A systematic review of experimental studies on Salmonella ...,Nature.com,news.google.com/articles/CBMiMmh0dHBzOi8vd3d3Lm5hdHVyZS5jb20vYXJ0aWNsZXMvczQxNTM4LTAyMy0wMDIyMy0w0gEA?hl=en-IN&gl=IN&ceid=IN%3Aen,2023-08-28
15,Identifying and tracking mobile elements in evolving compost ...,Nature.com,news.google.com/articles/CBMiMmh0dHBzOi8vd3d3Lm5hdHVyZS5jb20vYXJ0aWNsZXMvczQzNzA1LTAyMy0wMDI5NC130gEA?hl=en-IN&gl=IN&ceid=IN%3Aen,2023-08-28
27,Dinoflagellate vertical migration fuels an intense red tide ...,pnas.org,news.google.com/articles/CBMiMGh0dHBzOi8vd3d3LnBuYXMub3JnL2RvaS8xMC4xMDczL3BuYXMuMjMwNDU5MDEyMNIBAA?hl=en-IN&gl=IN&ceid=IN%3Aen,2023-08-28
48,Developmental genetic underpinnings of a symbiosis-associated ...,Nature.com,news.google.com/articles/CBMiMmh0dHBzOi8vd3d3Lm5hdHVyZS5jb20vYXJ0aWNsZXMvczQxNTk4LTAyMy00MDI5Ni0x0gEA?hl=en-IN&gl=IN&ceid=IN%3Aen,2023-08-28
41,Co-delivery of streptomycin and hydroxychloroquine by labeled ...,Nature.com,news.google.com/articles/CBMiMmh0dHBzOi8vd3d3Lm5hdHVyZS5jb20vYXJ0aWNsZXMvczQxNTk4LTAyMy00MTE1MC0w0gEA?hl=en-IN&gl=IN&ceid=IN%3Aen,2023-08-28
