,title,source,link,date
22,Species named for infamous people like Hitler can threaten the animal,Business Insider,news.google.com/articles/CBMiWGh0dHBzOi8vd3d3LmJ1c2luZXNzaW5zaWRlci5jb20vc3BlY2llcy1uYW1lLWNlbGVicml0eS1hd2FyZW5lc3MtcmVncmV0LXRheG9ub215LTIwMjMtMTHSAVxodHRwczovL3d3dy5idXNpbmVzc2luc2lkZXIuY29tL3NwZWNpZXMtbmFtZS1jZWxlYnJpdHktYXdhcmVuZXNzLXJlZ3JldC10YXhvbm9teS0yMDIzLTExP2FtcA?hl=en-IN&gl=IN&ceid=IN%3Aen,2023-11-12
69,Ancient 'Lazarus' Primate Was North America's Last—Until Humans ...,Gizmodo Australia,news.google.com/articles/CBMidGh0dHBzOi8vZ2l6bW9kby5jb20uYXUvMjAyMy8xMS9hbmNpZW50LWxhemFydXMtcHJpbWF0ZS13YXMtbm9ydGgtYW1lcmljYXMtbGFzdC11bnRpbC1odW1hbnMtYXJyaXZlZC1yZXNlYXJjaGVycy1zYXkv0gEA?hl=en-IN&gl=IN&ceid=IN%3Aen,2023-11-11
53,Latest addition to Mindanao's described weevils: The Madayaw ...,BusinessMirror,news.google.com/articles/CBMidmh0dHBzOi8vYnVzaW5lc3NtaXJyb3IuY29tLnBoLzIwMjMvMTEvMTIvbGF0ZXN0LWFkZGl0aW9uLXRvLW1pbmRhbmFvcy1kZXNjcmliZWQtd2Vldmlscy10aGUtbWFkYXlhdy1mbGlnaHRsZXNzLXdlZXZpbC_SAQA?hl=en-IN&gl=IN&ceid=IN%3Aen,2023-11-11
34,UF researchers repurpose pesticide as antibiotic to kill deadly bacteria,Mainstreet Daily News Gainesville,news.google.com/articles/CBMiY2h0dHBzOi8vd3d3Lm1haW5zdHJlZXRkYWlseW5ld3MuY29tL2hlYWx0aC91Zi1yZXNlYXJjaGVycy1wZXN0aWNpZGUtYW50aWJpb3RpYy1raWxsLWRlYWRseS1iYWN0ZXJpYdIBAA?hl=en-IN&gl=IN&ceid=IN%3Aen,2023-11-11
15,The mystery of phosphite -- a scientific detective story,Science Daily,news.google.com/articles/CBMiPmh0dHBzOi8vd3d3LnNjaWVuY2VkYWlseS5jb20vcmVsZWFzZXMvMjAyMy8xMS8yMzExMTAxMTI0NTUuaHRt0gEA?hl=en-IN&gl=IN&ceid=IN%3Aen,2023-11-11
27,The History of Writing is the History of Humanity,Literary Hub,news.google.com/articles/CBMiRWh0dHBzOi8vbGl0aHViLmNvbS90aGUtaGlzdG9yeS1vZi13cml0aW5nLWlzLXRoZS1oaXN0b3J5LW9mLWh1bWFuaXR5L9IBAA?hl=en-IN&gl=IN&ceid=IN%3Aen,2023-11-10
49,"From Minnesota to Arizona, new research tracks a remarkable ...",MPR News,news.google.com/articles/CBMidGh0dHBzOi8vd3d3Lm1wcm5ld3Mub3JnL3N0b3J5LzIwMjMvMTEvMTAvZnJvbS1taW5uZXNvdGEtdG8tYXJpem9uYS1uZXctcmVzZWFyY2gtdHJhY2tzLWEtcmVtYXJrYWJsZS1jZW50ZW5hcmlhbi1maXNo0gEA?hl=en-IN&gl=IN&ceid=IN%3Aen,2023-11-10
42,DNA microarray technique for infectious disease diagnostics. | PLMI,Dove Medical Press,news.google.com/articles/CBMihAFodHRwczovL3d3dy5kb3ZlcHJlc3MuY29tL3JlY2VudC1hcHBsaWNhdGlvbi1vZi1kbmEtbWljcm9hcnJheS10ZWNobmlxdWVzLXRvLWRpYWdub3NlLWluZmVjdGlvdXMtcGVlci1yZXZpZXdlZC1mdWxsdGV4dC1hcnRpY2xlLVBMTUnSAQA?hl=en-IN&gl=IN&ceid=IN%3Aen,2023-11-10
32,Charting the future of IBD treatment: From immune modulators to ...,News-Medical.Net,news.google.com/articles/CBMigAFodHRwczovL3d3dy5uZXdzLW1lZGljYWwubmV0L25ld3MvMjAyMzExMDgvQ2hhcnRpbmctdGhlLWZ1dHVyZS1vZi1JQkQtdHJlYXRtZW50LUZyb20taW1tdW5lLW1vZHVsYXRvcnMtdG8tbWljcm9STkEtdGhlcmFwaWUuYXNweNIBAA?hl=en-IN&gl=IN&ceid=IN%3Aen,2023-11-09
28,Leptospirosis-associated meningitis in a patient with sjögren's ...,BMC Infectious Diseases,news.google.com/articles/CBMiSmh0dHBzOi8vYm1jaW5mZWN0ZGlzLmJpb21lZGNlbnRyYWwuY29tL2FydGljbGVzLzEwLjExODYvczEyODc5LTAyMy0wODc5NC050gEA?hl=en-IN&gl=IN&ceid=IN%3Aen,2023-11-09
