,title,source,link,date
67,"This report offers a competitive landscape and analysis of major rivals in the Nadroparin Calcium market,",Benzinga,news.google.com/articles/CBMimQFodHRwczovL3d3dy5iZW56aW5nYS5jb20vcHJlc3NyZWxlYXNlcy8yMy8wOS8zNDE5MjUwNi90aGlzLXJlcG9ydC1vZmZlcnMtYS1jb21wZXRpdGl2ZS1sYW5kc2NhcGUtYW5kLWFuYWx5c2lzLW9mLW1ham9yLXJpdmFscy1pbi10aGUtbmFkcm9wYXJpbi1jYWxjaXVtLW3SAS1odHRwczovL3d3dy5iZW56aW5nYS5jb20vYW1wL2NvbnRlbnQvMzQxOTI1MDY?hl=en-IN&gl=IN&ceid=IN%3Aen,2023-09-03
60,"Global Prescription Weight Loss Medications Market Size 2023 - 2030: Insights on Sales, Application, Orga",Benzinga,news.google.com/articles/CBMimQFodHRwczovL3d3dy5iZW56aW5nYS5jb20vcHJlc3NyZWxlYXNlcy8yMy8wOS8zNDE5MjA3MS9nbG9iYWwtcHJlc2NyaXB0aW9uLXdlaWdodC1sb3NzLW1lZGljYXRpb25zLW1hcmtldC1zaXplLTIwMjMtMjAzMC1pbnNpZ2h0cy1vbi1zYWxlcy1hcHBsaWNhdGlvbi1vcmfSAS1odHRwczovL3d3dy5iZW56aW5nYS5jb20vYW1wL2NvbnRlbnQvMzQxOTIwNzE?hl=en-IN&gl=IN&ceid=IN%3Aen,2023-09-03
59,"This research contains sales, income, and average selling price future projections by type and applicatio",Benzinga,news.google.com/articles/CBMimQFodHRwczovL3d3dy5iZW56aW5nYS5jb20vcHJlc3NyZWxlYXNlcy8yMy8wOS8zNDE5MjUwNS90aGlzLXJlc2VhcmNoLWNvbnRhaW5zLXNhbGVzLWluY29tZS1hbmQtYXZlcmFnZS1zZWxsaW5nLXByaWNlLWZ1dHVyZS1wcm9qZWN0aW9ucy1ieS10eXBlLWFuZC1hcHBsaWPSAS1odHRwczovL3d3dy5iZW56aW5nYS5jb20vYW1wL2NvbnRlbnQvMzQxOTI1MDU?hl=en-IN&gl=IN&ceid=IN%3Aen,2023-09-03
57,"Detailed analysis of the Fraxiparine market's size, dynamics, and anticipated development from 2023 to 20",Benzinga,news.google.com/articles/CBMimQFodHRwczovL3d3dy5iZW56aW5nYS5jb20vcHJlc3NyZWxlYXNlcy8yMy8wOS8zNDE5MjQ5NS9kZXRhaWxlZC1hbmFseXNpcy1vZi10aGUtZnJheGlwYXJpbmUtbWFya2V0cy1zaXplLWR5bmFtaWNzLWFuZC1hbnRpY2lwYXRlZC1kZXZlbG9wbWVudC1mcm9tLTIwMjMtdG_SAS1odHRwczovL3d3dy5iZW56aW5nYS5jb20vYW1wL2NvbnRlbnQvMzQxOTI0OTU?hl=en-IN&gl=IN&ceid=IN%3Aen,2023-09-03
13,"A comprehensive study of the Tafenoquine market provides reliable insights into market size, share, volum",Benzinga,news.google.com/articles/CBMimQFodHRwczovL3d3dy5iZW56aW5nYS5jb20vcHJlc3NyZWxlYXNlcy8yMy8wOS8zNDE5MjE4MC9hLWNvbXByZWhlbnNpdmUtc3R1ZHktb2YtdGhlLXRhZmVub3F1aW5lLW1hcmtldC1wcm92aWRlcy1yZWxpYWJsZS1pbnNpZ2h0cy1pbnRvLW1hcmtldC1zaXplLXNoYXJlLXbSAS1odHRwczovL3d3dy5iZW56aW5nYS5jb20vYW1wL2NvbnRlbnQvMzQxOTIxODA?hl=en-IN&gl=IN&ceid=IN%3Aen,2023-09-03
55,"The Osmotic Laxative market's size, dynamics, and anticipated development from 2023 to 2030 are thoroughl",Benzinga,news.google.com/articles/CBMimQFodHRwczovL3d3dy5iZW56aW5nYS5jb20vcHJlc3NyZWxlYXNlcy8yMy8wOS8zNDE5MjUzOS90aGUtb3Ntb3RpYy1sYXhhdGl2ZS1tYXJrZXRzLXNpemUtZHluYW1pY3MtYW5kLWFudGljaXBhdGVkLWRldmVsb3BtZW50LWZyb20tMjAyMy10by0yMDMwLWFyZS10aG9yb3XSAS1odHRwczovL3d3dy5iZW56aW5nYS5jb20vYW1wL2NvbnRlbnQvMzQxOTI1Mzk?hl=en-IN&gl=IN&ceid=IN%3Aen,2023-09-03
47,"Considering the cumulative impact of COVID-19 on the Frozen Shoulder Treatment market's size, share, and",Benzinga,news.google.com/articles/CBMimQFodHRwczovL3d3dy5iZW56aW5nYS5jb20vcHJlc3NyZWxlYXNlcy8yMy8wOS8zNDE5MjYyNC9jb25zaWRlcmluZy10aGUtY3VtdWxhdGl2ZS1pbXBhY3Qtb2YtY292aWQtMTktb24tdGhlLWZyb3plbi1zaG91bGRlci10cmVhdG1lbnQtbWFya2V0cy1zaXplLXNoYXJlLWHSAS1odHRwczovL3d3dy5iZW56aW5nYS5jb20vYW1wL2NvbnRlbnQvMzQxOTI2MjQ?hl=en-IN&gl=IN&ceid=IN%3Aen,2023-09-03
46,This report focuses on the Chronic Lymphocytic Leukemia Drugs market size at a CAGR of 8.2% from 2023 t,Benzinga,news.google.com/articles/CBMimQFodHRwczovL3d3dy5iZW56aW5nYS5jb20vcHJlc3NyZWxlYXNlcy8yMy8wOS8zNDE5MjUwMC90aGlzLXJlcG9ydC1mb2N1c2VzLW9uLXRoZS1jaHJvbmljLWx5bXBob2N5dGljLWxldWtlbWlhLWRydWdzLW1hcmtldC1zaXplLWF0LWEtY2Fnci1vZi04LTItZnJvbS0yMDLSAS1odHRwczovL3d3dy5iZW56aW5nYS5jb20vYW1wL2NvbnRlbnQvMzQxOTI1MDA?hl=en-IN&gl=IN&ceid=IN%3Aen,2023-09-03
38,"This report examines the growth trajectory of the Topical Antibiotics market, highlighting new trends and",Benzinga,news.google.com/articles/CBMimQFodHRwczovL3d3dy5iZW56aW5nYS5jb20vcHJlc3NyZWxlYXNlcy8yMy8wOS8zNDE5MjQ1MS90aGlzLXJlcG9ydC1leGFtaW5lcy10aGUtZ3Jvd3RoLXRyYWplY3Rvcnktb2YtdGhlLXRvcGljYWwtYW50aWJpb3RpY3MtbWFya2V0LWhpZ2hsaWdodGluZy1uZXctdHJlbmTSAS1odHRwczovL3d3dy5iZW56aW5nYS5jb20vYW1wL2NvbnRlbnQvMzQxOTI0NTE?hl=en-IN&gl=IN&ceid=IN%3Aen,2023-09-03
1,"India’s Q1FY24 GDP soars, GSK Pharma posts strong results",The Sunday Guardian,news.google.com/articles/CBMiX2h0dHBzOi8vc3VuZGF5Z3VhcmRpYW5saXZlLmNvbS9idXNpbmVzcy9pbmRpYXMtcTFmeTI0LWdkcC1zb2Fycy1nc2stcGhhcm1hLXBvc3RzLXN0cm9uZy1yZXN1bHRz0gEA?hl=en-IN&gl=IN&ceid=IN%3Aen,2023-09-02
