,title,source,link,date
0,China vaccine test provide a shot in the arm for Glaxo boss,This is Money,news.google.com/articles/CBMicGh0dHBzOi8vd3d3LnRoaXNpc21vbmV5LmNvLnVrL21vbmV5L21hcmtldHMvYXJ0aWNsZS0xMjQzODI0MS9DaGluYS12YWNjaW5lLXRlc3QtcHJvdmlkZS1zaG90LWFybS1HbGF4by1ib3NzLmh0bWzSAXRodHRwczovL3d3dy50aGlzaXNtb25leS5jby51ay9tb25leS9tYXJrZXRzL2FydGljbGUtMTI0MzgyNDEvYW1wL0NoaW5hLXZhY2NpbmUtdGVzdC1wcm92aWRlLXNob3QtYXJtLUdsYXhvLWJvc3MuaHRtbA?hl=en-IN&gl=IN&ceid=IN%3Aen,2023-08-23
52,MG Morning Breeze: Updates to Skim before Market,Mettis Link News,news.google.com/articles/CBMiSmh0dHBzOi8vbWV0dGlzZ2xvYmFsLm5ld3MvbWctbW9ybmluZy1icmVlemUtdXBkYXRlcy10by1za2ltLWJlZm9yZS1tYXJrZXQv0gEA?hl=en-IN&gl=IN&ceid=IN%3Aen,2023-08-23
31,Chronic Lymphocytic Leukemia Therapeutics Market Size ...,Medgadget,news.google.com/articles/CBMi6gFodHRwczovL3d3dy5tZWRnYWRnZXQuY29tLzIwMjMvMDgvY2hyb25pYy1seW1waG9jeXRpYy1sZXVrZW1pYS10aGVyYXBldXRpY3MtbWFya2V0LXNpemUtZXN0aW1hdGlvbi1wcmljZS10cmVuZHMtZ3Jvd3RoLWFuYWx5c2lzLWJ1c2luZXNzLWluc2lnaHRzLWFuZC1wcm9qZWN0aW9uLTIwMzAtbm92YXJ0aXMtaW50ZXJuYXRpb25hbC1hZy1nbGF4b3NtaXRoa2xpbmUtcGhhcm1hY2V1dGljYWxzLWxpbWl0Lmh0bWzSAQA?hl=en-IN&gl=IN&ceid=IN%3Aen,2023-08-23
34,"Nanopharmaceuticals Market Blossoming CAGR of +22% Worldwide with Merck, Pfizer, Novartis, Abbott, GlaxoSmithK",openPR,news.google.com/articles/CBMiXmh0dHBzOi8vd3d3Lm9wZW5wci5jb20vbmV3cy8zMTc2Nzk4L25hbm9waGFybWFjZXV0aWNhbHMtbWFya2V0LWJsb3Nzb21pbmctY2Fnci1vZi0yMi13b3JsZHdpZGXSAV1odHRwczovL3d3dy5vcGVucHIuY29tL2FtcC8zMTc2Nzk4L25hbm9waGFybWFjZXV0aWNhbHMtbWFya2V0LWJsb3Nzb21pbmctY2Fnci1vZi0yMi13b3JsZHdpZGU?hl=en-IN&gl=IN&ceid=IN%3Aen,2023-08-23
36,"Global Nasal Polyps Treatment Market 2023 Industry Share, Qualitative Insights, Future Scope And Forecast To 2",openPR,news.google.com/articles/CBMiXGh0dHBzOi8vd3d3Lm9wZW5wci5jb20vbmV3cy8zMTc2NTM1L2dsb2JhbC1uYXNhbC1wb2x5cHMtdHJlYXRtZW50LW1hcmtldC0yMDIzLWluZHVzdHJ5LXNoYXJl0gFbaHR0cHM6Ly93d3cub3BlbnByLmNvbS9hbXAvMzE3NjUzNS9nbG9iYWwtbmFzYWwtcG9seXBzLXRyZWF0bWVudC1tYXJrZXQtMjAyMy1pbmR1c3RyeS1zaGFyZQ?hl=en-IN&gl=IN&ceid=IN%3Aen,2023-08-23
45,"Eosinophilic Granulomatosis Treatment Market | AstraZeneca plc, Baxter Healthcare Corporation, Genentech Inc,",openPR,news.google.com/articles/CBMiXGh0dHBzOi8vd3d3Lm9wZW5wci5jb20vbmV3cy8zMTc2NzYzL2Vvc2lub3BoaWxpYy1ncmFudWxvbWF0b3Npcy10cmVhdG1lbnQtbWFya2V0LWFzdHJhemVuZWNh0gFbaHR0cHM6Ly93d3cub3BlbnByLmNvbS9hbXAvMzE3Njc2My9lb3Npbm9waGlsaWMtZ3JhbnVsb21hdG9zaXMtdHJlYXRtZW50LW1hcmtldC1hc3RyYXplbmVjYQ?hl=en-IN&gl=IN&ceid=IN%3Aen,2023-08-23
49,Bronchiolitis Obliterans Syndrome Market to Register Incremental Growth During the Forecast Period (2023-2032),openPR,news.google.com/articles/CBMiWGh0dHBzOi8vd3d3Lm9wZW5wci5jb20vbmV3cy8zMTc4MTE4L2Jyb25jaGlvbGl0aXMtb2JsaXRlcmFucy1zeW5kcm9tZS1tYXJrZXQtdG8tcmVnaXN0ZXLSAVdodHRwczovL3d3dy5vcGVucHIuY29tL2FtcC8zMTc4MTE4L2Jyb25jaGlvbGl0aXMtb2JsaXRlcmFucy1zeW5kcm9tZS1tYXJrZXQtdG8tcmVnaXN0ZXI?hl=en-IN&gl=IN&ceid=IN%3Aen,2023-08-23
51,Parkinson's disease gene variant found in study of some people of ...,National Institutes of Health (.gov),news.google.com/articles/CBMid2h0dHBzOi8vd3d3Lm5paC5nb3YvbmV3cy1ldmVudHMvbmV3cy1yZWxlYXNlcy9wYXJraW5zb24tcy1kaXNlYXNlLWdlbmUtdmFyaWFudC1mb3VuZC1zdHVkeS1zb21lLXBlb3BsZS1hZnJpY2FuLWFuY2VzdHJ50gEA?hl=en-IN&gl=IN&ceid=IN%3Aen,2023-08-23
53,First RSV vaccine to protect newborns receives FDA approval,WXYZ 7 Action News Detroit,news.google.com/articles/CBMiVWh0dHBzOi8vd3d3Lnd4eXouY29tL25ld3MvZmlyc3QtcnN2LXZhY2NpbmUtdG8tcHJvdGVjdC1uZXdib3Jucy1yZWNlaXZlcy1mZGEtYXBwcm92YWzSAQA?hl=en-IN&gl=IN&ceid=IN%3Aen,2023-08-23
26,Samsung Biologics appoints new leadership to oversee quality and regulatory affairs,Yahoo Finance,news.google.com/articles/CBMiW2h0dHBzOi8vZmluYW5jZS55YWhvby5jb20vbmV3cy9zYW1zdW5nLWJpb2xvZ2ljcy1hcHBvaW50cy1sZWFkZXJzaGlwLW92ZXJzZWUtMjM1OTAwODQ5Lmh0bWzSAWNodHRwczovL2ZpbmFuY2UueWFob28uY29tL2FtcGh0bWwvbmV3cy9zYW1zdW5nLWJpb2xvZ2ljcy1hcHBvaW50cy1sZWFkZXJzaGlwLW92ZXJzZWUtMjM1OTAwODQ5Lmh0bWw?hl=en-IN&gl=IN&ceid=IN%3Aen,2023-08-23
