,title,source,link,date
73,Tiny houses can still have luxurious decor,Jacksonville Journal-Courier,news.google.com/articles/CBMiUWh0dHBzOi8vd3d3Lm15am91cm5hbGNvdXJpZXIuY29tL25ld3MvYXJ0aWNsZS9zbWFsbC1zcGFjZS1kZWNvcmF0aW5nLTE4Mjg1OTE1LnBocNIBAA?hl=en-IN&gl=IN&ceid=IN%3Aen,2023-09-03
83,The Future is Additive: Global Polyimide Coatings Market Projected ...,Benzinga,news.google.com/articles/CBMimQFodHRwczovL3d3dy5iZW56aW5nYS5jb20vcHJlc3NyZWxlYXNlcy8yMy8wOS8zNDE5MjQ1NS90aGUtZnV0dXJlLWlzLWFkZGl0aXZlLWdsb2JhbC1wb2x5aW1pZGUtY29hdGluZ3MtbWFya2V0LXByb2plY3RlZC10by1zdXJnZS13aXRoLTgtMi1jYWdyLWFuZC1tYXJrZXTSAQA?hl=en-IN&gl=IN&ceid=IN%3Aen,2023-09-03
57,The global Micro-Lens Arrays market Size is projected to experience positive growth trends and a CAGR of,Benzinga,news.google.com/articles/CBMimQFodHRwczovL3d3dy5iZW56aW5nYS5jb20vcHJlc3NyZWxlYXNlcy8yMy8wOS8zNDE5MjY0MS90aGUtZ2xvYmFsLW1pY3JvLWxlbnMtYXJyYXlzLW1hcmtldC1zaXplLWlzLXByb2plY3RlZC10by1leHBlcmllbmNlLXBvc2l0aXZlLWdyb3d0aC10cmVuZHMtYW5kLWEtY2HSAS1odHRwczovL3d3dy5iZW56aW5nYS5jb20vYW1wL2NvbnRlbnQvMzQxOTI2NDE?hl=en-IN&gl=IN&ceid=IN%3Aen,2023-09-03
72,"Detailed research on the global Car Wash Detergents and Soaps market provides information on its share, s",Benzinga,news.google.com/articles/CBMimQFodHRwczovL3d3dy5iZW56aW5nYS5jb20vcHJlc3NyZWxlYXNlcy8yMy8wOS8zNDE5MTU3Ni9kZXRhaWxlZC1yZXNlYXJjaC1vbi10aGUtZ2xvYmFsLWNhci13YXNoLWRldGVyZ2VudHMtYW5kLXNvYXBzLW1hcmtldC1wcm92aWRlcy1pbmZvcm1hdGlvbi1vbi1pdHMtc2jSAS1odHRwczovL3d3dy5iZW56aW5nYS5jb20vYW1wL2NvbnRlbnQvMzQxOTE1NzY?hl=en-IN&gl=IN&ceid=IN%3Aen,2023-09-02
71,The Future is Additive: Global Extreme Pressure Additives Market Projected to Surge with 5.6% CAGR and ma,Benzinga,news.google.com/articles/CBMimQFodHRwczovL3d3dy5iZW56aW5nYS5jb20vcHJlc3NyZWxlYXNlcy8yMy8wOS8zNDE5MTYyMS90aGUtZnV0dXJlLWlzLWFkZGl0aXZlLWdsb2JhbC1leHRyZW1lLXByZXNzdXJlLWFkZGl0aXZlcy1tYXJrZXQtcHJvamVjdGVkLXRvLXN1cmdlLXdpdGgtNS02LWNhZ3ItYW7SAS1odHRwczovL3d3dy5iZW56aW5nYS5jb20vYW1wL2NvbnRlbnQvMzQxOTE2MjE?hl=en-IN&gl=IN&ceid=IN%3Aen,2023-09-02
43,"Business Jet Market Research by Future Demand 2023 Leading Players, Global Opportunities and Key Dynamics",Benzinga,news.google.com/articles/CBMimQFodHRwczovL3d3dy5iZW56aW5nYS5jb20vcHJlc3NyZWxlYXNlcy8yMy8wOS8zNDE5MTUxNC9idXNpbmVzcy1qZXQtbWFya2V0LXJlc2VhcmNoLWJ5LWZ1dHVyZS1kZW1hbmQtMjAyMy1sZWFkaW5nLXBsYXllcnMtZ2xvYmFsLW9wcG9ydHVuaXRpZXMtYW5kLWtleS1keW7SAS1odHRwczovL3d3dy5iZW56aW5nYS5jb20vYW1wL2NvbnRlbnQvMzQxOTE1MTQ?hl=en-IN&gl=IN&ceid=IN%3Aen,2023-09-02
69,Density-dependent predatory impacts of an invasive beetle across a ...,Nature.com,news.google.com/articles/CBMiMmh0dHBzOi8vd3d3Lm5hdHVyZS5jb20vYXJ0aWNsZXMvczQxNTk4LTAyMy00MTA4OS0y0gEA?hl=en-IN&gl=IN&ceid=IN%3Aen,2023-09-02
46,Renault Urban Night Limited Edition Launched In India,ThrustZone,news.google.com/articles/CBMiUWh0dHBzOi8vd3d3LnRocnVzdHpvbmUuY29tL3JlbmF1bHQtdXJiYW4tbmlnaHQtbGltaXRlZC1lZGl0aW9uLWxhdW5jaGVkLWluLWluZGlhL9IBAA?hl=en-IN&gl=IN&ceid=IN%3Aen,2023-09-02
36,Assessment of atmospheric emissivity models for clear-sky ...,Nature.com,news.google.com/articles/CBMiMmh0dHBzOi8vd3d3Lm5hdHVyZS5jb20vYXJ0aWNsZXMvczQxNTk4LTAyMy00MDQ5OS020gEA?hl=en-IN&gl=IN&ceid=IN%3Aen,2023-09-02
75,Comprehensive Growth Research on Adhesion Laminated Surface Protection Films Market with a CAGR of 7% fro,Benzinga,news.google.com/articles/CBMimQFodHRwczovL3d3dy5iZW56aW5nYS5jb20vcHJlc3NyZWxlYXNlcy8yMy8wOS8zNDE4OTk4NS9jb21wcmVoZW5zaXZlLWdyb3d0aC1yZXNlYXJjaC1vbi1hZGhlc2lvbi1sYW1pbmF0ZWQtc3VyZmFjZS1wcm90ZWN0aW9uLWZpbG1zLW1hcmtldC13aXRoLWEtY2Fnci1vZi3SAS1odHRwczovL3d3dy5iZW56aW5nYS5jb20vYW1wL2NvbnRlbnQvMzQxODk5ODU?hl=en-IN&gl=IN&ceid=IN%3Aen,2023-09-02
