,title,source,link,date
0,"APRU Director Mellissa Withers, PhD, MHS, marks 10th year of ...",USC News,news.google.com/articles/CBMieGh0dHBzOi8vcHBocy51c2MuZWR1L2FwcnUtZGlyZWN0b3ItbWVsbGlzc2Etd2l0aGVycy1waGQtbWhzLW1hcmtzLTEwdGgteWVhci1vZi1vcmdhbml6aW5nLWdsb2JhbC1oZWFsdGgtcHJvZ3JhbXMtYXQtdXNjL9IBAA?hl=en-IN&gl=IN&ceid=IN%3Aen,2023-10-13
30,Body mass index and waist circumference trajectories across the life ...,Nature.com,news.google.com/articles/CBMiMmh0dHBzOi8vd3d3Lm5hdHVyZS5jb20vYXJ0aWNsZXMvczQxMzY2LTAyMy0wMTM5MS010gEA?hl=en-IN&gl=IN&ceid=IN%3Aen,2023-10-13
35,Enhanced detection of viruses for improved water safety | Scientific ...,Nature.com,news.google.com/articles/CBMiMmh0dHBzOi8vd3d3Lm5hdHVyZS5jb20vYXJ0aWNsZXMvczQxNTk4LTAyMy00NDUyOC0y0gEA?hl=en-IN&gl=IN&ceid=IN%3Aen,2023-10-13
37,Global Vaccine Market is expected to grow to USD 92.32 billion by ...,Medgadget,news.google.com/articles/CBMigQFodHRwczovL3d3dy5tZWRnYWRnZXQuY29tLzIwMjMvMTAvZ2xvYmFsLXZhY2NpbmUtbWFya2V0LWlzLWV4cGVjdGVkLXRvLWdyb3ctdG8tdXNkLTkyLTMyLWJpbGxpb24tYnktMjAyOC1hdC04LTY0LWNhZ3ItZ3Jvd3RoLmh0bWzSAQA?hl=en-IN&gl=IN&ceid=IN%3Aen,2023-10-13
38,Public Health Administrative Specialist-Cooperative Agreement ...,US Embassy in Uganda - USEmbassy.gov,news.google.com/articles/CBMigAFodHRwczovL3VnLnVzZW1iYXNzeS5nb3YvcHVibGljLWhlYWx0aC1hZG1pbmlzdHJhdGl2ZS1zcGVjaWFsaXN0LWNvb3BlcmF0aXZlLWFncmVlbWVudC1rYW1wYWxhLTIwMjMtMDc3LWNsb3Npbmctb2N0b2Jlci0yMi0yMDIzL9IBAA?hl=en-IN&gl=IN&ceid=IN%3Aen,2023-10-13
23,J&J patent decision to enable generic tuberculosis treatment,The Lancet,news.google.com/articles/CBMiU2h0dHBzOi8vd3d3LnRoZWxhbmNldC5jb20vam91cm5hbHMvbGFuY2V0L2FydGljbGUvUElJUzAxNDAtNjczNigyMykwMjI3My0wL2Z1bGx0ZXh00gEA?hl=en-IN&gl=IN&ceid=IN%3Aen,2023-10-13
40,Dopamine and diets: Experts flag ultra-processed foods' possible ...,Food Ingredients First,news.google.com/articles/CBMijgFodHRwczovL3d3dy5mb29kaW5ncmVkaWVudHNmaXJzdC5jb20vbmV3cy9kb3BhbWluZS1hbmQtZGlldHMtZXhwZXJ0cy1mbGFnLXVsdHJhLXByb2Nlc3NlZC1mb29kcy1wb3NzaWJsZS1pbXBhY3RzLW9uLWJyYWlucy1yZXdhcmQtc3lzdGVtcy5odG1s0gEA?hl=en-IN&gl=IN&ceid=IN%3Aen,2023-10-13
42,China: Speech by High Representative/Vice-President Josep Borrell ...,EEAS,news.google.com/articles/CBMicWh0dHBzOi8vd3d3LmVlYXMuZXVyb3BhLmV1L2VlYXMvY2hpbmEtc3BlZWNoLWhpZ2gtcmVwcmVzZW50YXRpdmV2aWNlLXByZXNpZGVudC1qb3NlcC1ib3JyZWxsLXBla2luZy11bml2ZXJzaXR5X2Vu0gEA?hl=en-IN&gl=IN&ceid=IN%3Aen,2023-10-13
19,Strengthening capacity of health workers to diagnose birth defects in ...,BMC Medical Education,news.google.com/articles/CBMiSGh0dHBzOi8vYm1jbWVkZWR1Yy5iaW9tZWRjZW50cmFsLmNvbS9hcnRpY2xlcy8xMC4xMTg2L3MxMjkwOS0wMjMtMDQ3NjAtd9IBAA?hl=en-IN&gl=IN&ceid=IN%3Aen,2023-10-13
18,Closing the gap in maternal health access and quality through ...,Journal of Global Health Reports,news.google.com/articles/CBMijwFodHRwczovL3d3dy5qb2doci5vcmcvYXJ0aWNsZS84ODkxNy1jbG9zaW5nLXRoZS1nYXAtaW4tbWF0ZXJuYWwtaGVhbHRoLWFjY2Vzcy1hbmQtcXVhbGl0eS10aHJvdWdoLXRhcmdldGVkLWludmVzdG1lbnRzLWluLWxvdy1yZXNvdXJjZS1zZXR0aW5nc9IBAA?hl=en-IN&gl=IN&ceid=IN%3Aen,2023-10-13
