,title,source,link,date
0,Morgan Stanley's favorite global artificial intelligence (AI) stocks,CNBC,news.google.com/articles/CBMiZ2h0dHBzOi8vd3d3LmNuYmMuY29tLzIwMjMvMDgvMjQvbW9yZ2FuLXN0YW5sZXlzLWZhdm9yaXRlLWdsb2JhbC1hcnRpZmljaWFsLWludGVsbGlnZW5jZS1haS1zdG9ja3MtLmh0bWzSAQA?hl=en-IN&gl=IN&ceid=IN%3Aen,2023-08-24
67,"Global Agricultural Biologicals Market Set to Reach USD 27.9 Billion by 2028, Fueled by Rising Demand for Organic and Sustainable Food",Yahoo Finance,news.google.com/articles/CBMiWGh0dHBzOi8vZmluYW5jZS55YWhvby5jb20vbmV3cy9nbG9iYWwtYWdyaWN1bHR1cmFsLWJpb2xvZ2ljYWxzLW1hcmtldC1zZXQtMDAxNTAwMjY1Lmh0bWzSAWBodHRwczovL2ZpbmFuY2UueWFob28uY29tL2FtcGh0bWwvbmV3cy9nbG9iYWwtYWdyaWN1bHR1cmFsLWJpb2xvZ2ljYWxzLW1hcmtldC1zZXQtMDAxNTAwMjY1Lmh0bWw?hl=en-IN&gl=IN&ceid=IN%3Aen,2023-08-24
21,"6 things that changed for market overnight: Gift Nifty, Nvidia share rally to global market cues for Sensex today | Mint",Mint,news.google.com/articles/CBMitQFodHRwczovL3d3dy5saXZlbWludC5jb20vbWFya2V0L3N0b2NrLW1hcmtldC1uZXdzLzYtdGhpbmdzLXRoYXQtY2hhbmdlZC1mb3ItbWFya2V0LW92ZXJuaWdodC1naWZ0LW5pZnR5LW52aWRpYS1zaGFyZS1yYWxseS10by1nbG9iYWwtbWFya2V0LWN1ZXMtZm9yLXNlbnNleC10b2RheS0xMTY5Mjg0MTM1MDQ5Mi5odG1s0gG5AWh0dHBzOi8vd3d3LmxpdmVtaW50LmNvbS9tYXJrZXQvc3RvY2stbWFya2V0LW5ld3MvNi10aGluZ3MtdGhhdC1jaGFuZ2VkLWZvci1tYXJrZXQtb3Zlcm5pZ2h0LWdpZnQtbmlmdHktbnZpZGlhLXNoYXJlLXJhbGx5LXRvLWdsb2JhbC1tYXJrZXQtY3Vlcy1mb3Itc2Vuc2V4LXRvZGF5L2FtcC0xMTY5Mjg0MTM1MDQ5Mi5odG1s?hl=en-IN&gl=IN&ceid=IN%3Aen,2023-08-24
1,India’s south pole moon landing is big business for global space race,The Guardian,news.google.com/articles/CBMic2h0dHBzOi8vd3d3LnRoZWd1YXJkaWFuLmNvbS93b3JsZC8yMDIzL2F1Zy8yMy9pbmRpYS1zb3V0aC1wb2xlLW1vb24tbGFuZGluZy1iaWctYnVzaW5lc3MtZ2xvYmFsLXNwYWNlLWxhdW5jaC1tYXJrZXTSAXNodHRwczovL2FtcC50aGVndWFyZGlhbi5jb20vd29ybGQvMjAyMy9hdWcvMjMvaW5kaWEtc291dGgtcG9sZS1tb29uLWxhbmRpbmctYmlnLWJ1c2luZXNzLWdsb2JhbC1zcGFjZS1sYXVuY2gtbWFya2V0?hl=en-IN&gl=IN&ceid=IN%3Aen,2023-08-24
27,India ensured front-row seat in global space club,The Tribune India,news.google.com/articles/CBMiYWh0dHBzOi8vd3d3LnRyaWJ1bmVpbmRpYS5jb20vbmV3cy9uYXRpb24vaW5kaWEtZW5zdXJlZC1mcm9udC1yb3ctc2VhdC1pbi1nbG9iYWwtc3BhY2UtY2x1Yi01Mzc3NjXSAV9odHRwczovL20udHJpYnVuZWluZGlhLmNvbS9uZXdzL25hdGlvbi9pbmRpYS1lbnN1cmVkLWZyb250LXJvdy1zZWF0LWluLWdsb2JhbC1zcGFjZS1jbHViLTUzNzc2NQ?hl=en-IN&gl=IN&ceid=IN%3Aen,2023-08-24
49,"Global Contact Center Software Market Analysis/Forecasts Report 2023-2028: Analyzing Audio and Video Conversations, Embracing AI, Automation, and Robust Self-Service Interactions",Yahoo Finance,news.google.com/articles/CBMiU2h0dHBzOi8vZmluYW5jZS55YWhvby5jb20vbmV3cy9nbG9iYWwtY29udGFjdC1jZW50ZXItc29mdHdhcmUtbWFya2V0LTAyMDAwMDQyMC5odG1s0gFbaHR0cHM6Ly9maW5hbmNlLnlhaG9vLmNvbS9hbXBodG1sL25ld3MvZ2xvYmFsLWNvbnRhY3QtY2VudGVyLXNvZnR3YXJlLW1hcmtldC0wMjAwMDA0MjAuaHRtbA?hl=en-IN&gl=IN&ceid=IN%3Aen,2023-08-24
65,August Global Immigration Update,WR Immigration,news.google.com/articles/CBMiN2h0dHBzOi8vd29sZnNkb3JmLmNvbS9hdWd1c3QtZ2xvYmFsLWltbWlncmF0aW9uLXVwZGF0ZS_SAQA?hl=en-IN&gl=IN&ceid=IN%3Aen,2023-08-24
52,"Dollar Usage in Global Payments in July Rises to Record, Swift Says",Bloomberg,news.google.com/articles/CBMidWh0dHBzOi8vd3d3LmJsb29tYmVyZy5jb20vbmV3cy9hcnRpY2xlcy8yMDIzLTA4LTI0L2RvbGxhci11c2FnZS1pbi1nbG9iYWwtcGF5bWVudHMtaW4tanVseS1yaXNlcy10by1yZWNvcmQtc3dpZnQtc2F5c9IBAA?hl=en-IN&gl=IN&ceid=IN%3Aen,2023-08-24
60,"Oil Falls on Weak Global Economic Data, Rising Supply Worries",The Wall Street Journal,news.google.com/articles/CBMicWh0dHBzOi8vd3d3Lndzai5jb20vZWNvbm9teS9jZW50cmFsLWJhbmtpbmcvb2lsLWZhbGxzLW9uLXdlYWstZ2xvYmFsLWVjb25vbWljLWRhdGEtcmlzaW5nLXN1cHBseS13b3JyaWVzLTQxZGVkOGVl0gEA?hl=en-IN&gl=IN&ceid=IN%3Aen,2023-08-24
15,"China's deflation could spill over into a global concern, economists say",CNBC,news.google.com/articles/CBMia2h0dHBzOi8vd3d3LmNuYmMuY29tLzIwMjMvMDgvMjQvY2hpbmFzLWRlZmxhdGlvbi1jb3VsZC1zcGlsbC1vdmVyLWludG8tYS1nbG9iYWwtY29uY2Vybi1lY29ub21pc3RzLXNheS5odG1s0gFvaHR0cHM6Ly93d3cuY25iYy5jb20vYW1wLzIwMjMvMDgvMjQvY2hpbmFzLWRlZmxhdGlvbi1jb3VsZC1zcGlsbC1vdmVyLWludG8tYS1nbG9iYWwtY29uY2Vybi1lY29ub21pc3RzLXNheS5odG1s?hl=en-IN&gl=IN&ceid=IN%3Aen,2023-08-24
