,title,source,link,date
94,Analyzing the SiC Coating Market: Comprehensive Research Report with a CAGR of 4.6% from 2023 to 2030 on,Benzinga,news.google.com/articles/CBMimQFodHRwczovL3d3dy5iZW56aW5nYS5jb20vcHJlc3NyZWxlYXNlcy8yMy8wOS8zNDE5MTExMy9hbmFseXppbmctdGhlLXNpYy1jb2F0aW5nLW1hcmtldC1jb21wcmVoZW5zaXZlLXJlc2VhcmNoLXJlcG9ydC13aXRoLWEtY2Fnci1vZi00LTYtZnJvbS0yMDIzLXRvLTIwMzDSAS1odHRwczovL3d3dy5iZW56aW5nYS5jb20vYW1wL2NvbnRlbnQvMzQxOTExMTM?hl=en-IN&gl=IN&ceid=IN%3Aen,2023-09-02
76,"Rough Terrain Forklift Market Is Booming Worldwide | Anhui Vmax Heavy Industry, JCB Bamford Excavators, CNH In",openPR,news.google.com/articles/CBMiYWh0dHBzOi8vd3d3Lm9wZW5wci5jb20vbmV3cy8zMTkyODc4L3JvdWdoLXRlcnJhaW4tZm9ya2xpZnQtbWFya2V0LWlzLWJvb21pbmctd29ybGR3aWRlLWFuaHVpLXZtYXjSAWBodHRwczovL3d3dy5vcGVucHIuY29tL2FtcC8zMTkyODc4L3JvdWdoLXRlcnJhaW4tZm9ya2xpZnQtbWFya2V0LWlzLWJvb21pbmctd29ybGR3aWRlLWFuaHVpLXZtYXg?hl=en-IN&gl=IN&ceid=IN%3Aen,2023-09-02
21,"Mineral Wool Acoustic Insulation Market | Acoustical Surfaces, Blachford UK Ltd, Hush Acoustics, Johns Manvill",openPR,news.google.com/articles/CBMiX2h0dHBzOi8vd3d3Lm9wZW5wci5jb20vbmV3cy8zMTkyOTA0L21pbmVyYWwtd29vbC1hY291c3RpYy1pbnN1bGF0aW9uLW1hcmtldC1hY291c3RpY2FsLXN1cmZhY2Vz0gFeaHR0cHM6Ly93d3cub3BlbnByLmNvbS9hbXAvMzE5MjkwNC9taW5lcmFsLXdvb2wtYWNvdXN0aWMtaW5zdWxhdGlvbi1tYXJrZXQtYWNvdXN0aWNhbC1zdXJmYWNlcw?hl=en-IN&gl=IN&ceid=IN%3Aen,2023-09-02
65,Starfield: the Creation Engine evolves to deliver massive ambition ...,Eurogamer.net,news.google.com/articles/CBMiV2h0dHBzOi8vd3d3LmV1cm9nYW1lci5uZXQvZGlnaXRhbGZvdW5kcnktMjAyMy1zdGFyZmllbGQtdGhlLWRpZ2l0YWwtZm91bmRyeS10ZWNoLXJldmlld9IBAA?hl=en-IN&gl=IN&ceid=IN%3Aen,2023-09-02
62,2023 Furniture Market Size and Trends| Market Updates and ...,Benzinga,news.google.com/articles/CBMiigFodHRwczovL3d3dy5iZW56aW5nYS5jb20vcHJlc3NyZWxlYXNlcy8yMy8wOS8zNDE5MDQwOS8yMDIzLWZ1cm5pdHVyZS1tYXJrZXQtc2l6ZS1hbmQtdHJlbmRzLW1hcmtldC11cGRhdGVzLWFuZC1yZWdpb25hbC1hbmFseXNpcy10aWxsLTIwMzDSAQA?hl=en-IN&gl=IN&ceid=IN%3Aen,2023-09-02
60,Comprehensive Growth Research on Adhesion Laminated Surface Protection Films Market with a CAGR of 7% fro,Benzinga,news.google.com/articles/CBMimQFodHRwczovL3d3dy5iZW56aW5nYS5jb20vcHJlc3NyZWxlYXNlcy8yMy8wOS8zNDE4OTk4NS9jb21wcmVoZW5zaXZlLWdyb3d0aC1yZXNlYXJjaC1vbi1hZGhlc2lvbi1sYW1pbmF0ZWQtc3VyZmFjZS1wcm90ZWN0aW9uLWZpbG1zLW1hcmtldC13aXRoLWEtY2Fnci1vZi3SAS1odHRwczovL3d3dy5iZW56aW5nYS5jb20vYW1wL2NvbnRlbnQvMzQxODk5ODU?hl=en-IN&gl=IN&ceid=IN%3Aen,2023-09-02
53,Waterproofing Products Market Value To Cross $58.9 Billion By ...,Digital Journal,news.google.com/articles/CBMipAFodHRwczovL3d3dy5kaWdpdGFsam91cm5hbC5jb20vcHIvbmV3cy9hbGxpZWQtYW5hbHl0aWNzL3dhdGVycHJvb2ZpbmctcHJvZHVjdHMtbWFya2V0LXZhbHVlLXRvLWNyb3NzLTU4LTktYmlsbGlvbi1ieS0yMDI2LXRvcC1jb21wYW5pZXMtYW5kLWluZHVzdHJ5LWdyb3d0aC1pbnNpZ2h0c9IBAA?hl=en-IN&gl=IN&ceid=IN%3Aen,2023-09-02
41,Atmosphere injection of sea salts during large explosive submarine ...,Nature.com,news.google.com/articles/CBMiMmh0dHBzOi8vd3d3Lm5hdHVyZS5jb20vYXJ0aWNsZXMvczQxNTk4LTAyMy00MTYzOS040gEA?hl=en-IN&gl=IN&ceid=IN%3Aen,2023-09-02
37,Density-dependent predatory impacts of an invasive beetle across a ...,Nature.com,news.google.com/articles/CBMiMmh0dHBzOi8vd3d3Lm5hdHVyZS5jb20vYXJ0aWNsZXMvczQxNTk4LTAyMy00MTA4OS0y0gEA?hl=en-IN&gl=IN&ceid=IN%3Aen,2023-09-02
36,The Reinvention of the Original: The all-electric MINI Cooper.,BMW Press,news.google.com/articles/CBMifWh0dHBzOi8vd3d3LnByZXNzLmJtd2dyb3VwLmNvbS9nbG9iYWwvYXJ0aWNsZS9kZXRhaWwvVDA0MzI5NzhFTi90aGUtcmVpbnZlbnRpb24tb2YtdGhlLW9yaWdpbmFsOi10aGUtYWxsLWVsZWN0cmljLW1pbmktY29vcGVy0gEA?hl=en-IN&gl=IN&ceid=IN%3Aen,2023-09-01
