,title,source,link,date
37,"Vegan Leather market report offers information about the market's competitive environment, including some",Benzinga,news.google.com/articles/CBMimQFodHRwczovL3d3dy5iZW56aW5nYS5jb20vcHJlc3NyZWxlYXNlcy8yMy8wOS8zNDQyMTE5NS92ZWdhbi1sZWF0aGVyLW1hcmtldC1yZXBvcnQtb2ZmZXJzLWluZm9ybWF0aW9uLWFib3V0LXRoZS1tYXJrZXRzLWNvbXBldGl0aXZlLWVudmlyb25tZW50LWluY2x1ZGluZy3SAS1odHRwczovL3d3dy5iZW56aW5nYS5jb20vYW1wL2NvbnRlbnQvMzQ0MjExOTU?hl=en-IN&gl=IN&ceid=IN%3Aen,2023-09-11
25,"2023-2030, Train Interiors Market Dynamics and Its Influence on the Architecture Industry",Benzinga,news.google.com/articles/CBMijgFodHRwczovL3d3dy5iZW56aW5nYS5jb20vcHJlc3NyZWxlYXNlcy8yMy8wOS8zNDQwMDczMC8yMDIzLTIwMzAtdHJhaW4taW50ZXJpb3JzLW1hcmtldC1keW5hbWljcy1hbmQtaXRzLWluZmx1ZW5jZS1vbi10aGUtYXJjaGl0ZWN0dXJlLWluZHVzdHJ50gEtaHR0cHM6Ly93d3cuYmVuemluZ2EuY29tL2FtcC9jb250ZW50LzM0NDAwNzMw?hl=en-IN&gl=IN&ceid=IN%3Aen,2023-09-10
18,Tungsten Oxide Nanopowder Market Size and Forecast Report 2023-2030 | with 103 Pages,Benzinga,news.google.com/articles/CBMiiAFodHRwczovL3d3dy5iZW56aW5nYS5jb20vcHJlc3NyZWxlYXNlcy8yMy8wOS8zNDQxMzEzNi90dW5nc3Rlbi1veGlkZS1uYW5vcG93ZGVyLW1hcmtldC1zaXplLWFuZC1mb3JlY2FzdC1yZXBvcnQtMjAyMy0yMDMwLXdpdGgtMTAzLXBhZ2Vz0gEtaHR0cHM6Ly93d3cuYmVuemluZ2EuY29tL2FtcC9jb250ZW50LzM0NDEzMTM2?hl=en-IN&gl=IN&ceid=IN%3Aen,2023-09-10
46,"The Isopentyl Alcohol market research study includes biographies of key players, as well as critical fina",Benzinga,news.google.com/articles/CBMimQFodHRwczovL3d3dy5iZW56aW5nYS5jb20vcHJlc3NyZWxlYXNlcy8yMy8wOS8zNDQxNTc5Ni90aGUtaXNvcGVudHlsLWFsY29ob2wtbWFya2V0LXJlc2VhcmNoLXN0dWR5LWluY2x1ZGVzLWJpb2dyYXBoaWVzLW9mLWtleS1wbGF5ZXJzLWFzLXdlbGwtYXMtY3JpdGljYWzSAS1odHRwczovL3d3dy5iZW56aW5nYS5jb20vYW1wL2NvbnRlbnQvMzQ0MTU3OTY?hl=en-IN&gl=IN&ceid=IN%3Aen,2023-09-10
41,"This report evaluates the demand for the Pearl Pigment Powder market, key suppliers, and key geographic r",Benzinga,news.google.com/articles/CBMimQFodHRwczovL3d3dy5iZW56aW5nYS5jb20vcHJlc3NyZWxlYXNlcy8yMy8wOS8zNDQxNzg5NS90aGlzLXJlcG9ydC1ldmFsdWF0ZXMtdGhlLWRlbWFuZC1mb3ItdGhlLXBlYXJsLXBpZ21lbnQtcG93ZGVyLW1hcmtldC1rZXktc3VwcGxpZXJzLWFuZC1rZXktZ2VvZ3JhcGjSAS1odHRwczovL3d3dy5iZW56aW5nYS5jb20vYW1wL2NvbnRlbnQvMzQ0MTc4OTU?hl=en-IN&gl=IN&ceid=IN%3Aen,2023-09-10
35,"As per the analysis, the Rhodamine B market size is expected to grow at a compound annual growth rate of",Benzinga,news.google.com/articles/CBMimQFodHRwczovL3d3dy5iZW56aW5nYS5jb20vcHJlc3NyZWxlYXNlcy8yMy8wOS8zNDQwNTI3Ny9hcy1wZXItdGhlLWFuYWx5c2lzLXRoZS1yaG9kYW1pbmUtYi1tYXJrZXQtc2l6ZS1pcy1leHBlY3RlZC10by1ncm93LWF0LWEtY29tcG91bmQtYW5udWFsLWdyb3d0aC1yYXTSAS1odHRwczovL3d3dy5iZW56aW5nYS5jb20vYW1wL2NvbnRlbnQvMzQ0MDUyNzc?hl=en-IN&gl=IN&ceid=IN%3Aen,2023-09-10
31,"An in-depth analysis of the Micro Denier Fiber market, including market share, size, growth, analysis, an",Benzinga,news.google.com/articles/CBMimQFodHRwczovL3d3dy5iZW56aW5nYS5jb20vcHJlc3NyZWxlYXNlcy8yMy8wOS8zNDQxNDIzNi9hbi1pbi1kZXB0aC1hbmFseXNpcy1vZi10aGUtbWljcm8tZGVuaWVyLWZpYmVyLW1hcmtldC1pbmNsdWRpbmctbWFya2V0LXNoYXJlLXNpemUtZ3Jvd3RoLWFuYWx5c2lzLWHSAS1odHRwczovL3d3dy5iZW56aW5nYS5jb20vYW1wL2NvbnRlbnQvMzQ0MTQyMzY?hl=en-IN&gl=IN&ceid=IN%3Aen,2023-09-10
24,Global Alfuzosin Market 2023-2030 Significant Increase in CAGR Shaping the Pharmaceuticals Industry,Benzinga,news.google.com/articles/CBMimQFodHRwczovL3d3dy5iZW56aW5nYS5jb20vcHJlc3NyZWxlYXNlcy8yMy8wOS8zNDQwMDc0OC9nbG9iYWwtYWxmdXpvc2luLW1hcmtldC0yMDIzLTIwMzAtc2lnbmlmaWNhbnQtaW5jcmVhc2UtaW4tY2Fnci1zaGFwaW5nLXRoZS1waGFybWFjZXV0aWNhbHMtaW5kdXN0cnnSAS1odHRwczovL3d3dy5iZW56aW5nYS5jb20vYW1wL2NvbnRlbnQvMzQ0MDA3NDg?hl=en-IN&gl=IN&ceid=IN%3Aen,2023-09-10
44,"The Smart Underwear market study examines competitors, their strengths and weaknesses, and provides a CAG",Benzinga,news.google.com/articles/CBMimQFodHRwczovL3d3dy5iZW56aW5nYS5jb20vcHJlc3NyZWxlYXNlcy8yMy8wOS8zNDM5MDQ0OS90aGUtc21hcnQtdW5kZXJ3ZWFyLW1hcmtldC1zdHVkeS1leGFtaW5lcy1jb21wZXRpdG9ycy10aGVpci1zdHJlbmd0aHMtYW5kLXdlYWtuZXNzZXMtYW5kLXByb3ZpZGVzLWHSAS1odHRwczovL3d3dy5iZW56aW5nYS5jb20vYW1wL2NvbnRlbnQvMzQzOTA0NDk?hl=en-IN&gl=IN&ceid=IN%3Aen,2023-09-09
26,LED Grid Screen Market Updates 2023-2030: A Roadmap for Success and Elevate Your Business,Benzinga,news.google.com/articles/CBMijgFodHRwczovL3d3dy5iZW56aW5nYS5jb20vcHJlc3NyZWxlYXNlcy8yMy8wOS8zNDQwMDM3OC9sZWQtZ3JpZC1zY3JlZW4tbWFya2V0LXVwZGF0ZXMtMjAyMy0yMDMwLWEtcm9hZG1hcC1mb3Itc3VjY2Vzcy1hbmQtZWxldmF0ZS15b3VyLWJ1c2luZXNz0gEtaHR0cHM6Ly93d3cuYmVuemluZ2EuY29tL2FtcC9jb250ZW50LzM0NDAwMzc4?hl=en-IN&gl=IN&ceid=IN%3Aen,2023-09-09
