,title,source,link,date
28,Perfecting Perfection: The Surface Inspection Market in 2033 - Advancements in Quality Control and Automation,openPR,news.google.com/articles/CBMiX2h0dHBzOi8vd3d3Lm9wZW5wci5jb20vbmV3cy8zMjMzODI5L3BlcmZlY3RpbmctcGVyZmVjdGlvbi10aGUtc3VyZmFjZS1pbnNwZWN0aW9uLW1hcmtldC1pbi0yMDMz0gFeaHR0cHM6Ly93d3cub3BlbnByLmNvbS9hbXAvMzIzMzgyOS9wZXJmZWN0aW5nLXBlcmZlY3Rpb24tdGhlLXN1cmZhY2UtaW5zcGVjdGlvbi1tYXJrZXQtaW4tMjAzMw?hl=en-IN&gl=IN&ceid=IN%3Aen,2023-10-04
1,Surface Material Market Size & Share | Analysis Report | 2023 2030,Benzinga,news.google.com/articles/CBMicmh0dHBzOi8vd3d3LmJlbnppbmdhLmNvbS9wcmVzc3JlbGVhc2VzLzIzLzEwLzM1MDc3NjY0L3N1cmZhY2UtbWF0ZXJpYWwtbWFya2V0LXNpemUtc2hhcmUtYW5hbHlzaXMtcmVwb3J0LTIwMjMtMjAzMNIBLWh0dHBzOi8vd3d3LmJlbnppbmdhLmNvbS9hbXAvY29udGVudC8zNTA3NzY2NA?hl=en-IN&gl=IN&ceid=IN%3Aen,2023-10-04
25,Reaping the benefits of cooperation | SIWI - Leading expert in water ...,Stockholm International Water Institute,news.google.com/articles/CBMiPGh0dHBzOi8vc2l3aS5vcmcvbGF0ZXN0L3JlYXBpbmctdGhlLWJlbmVmaXRzLW9mLWNvb3BlcmF0aW9uL9IBAA?hl=en-IN&gl=IN&ceid=IN%3Aen,2023-10-03
39,"Prepreg Market Report on Size, Share, Scope and Forecast 2023 ...",Digital Journal,news.google.com/articles/CBMie2h0dHBzOi8vd3d3LmRpZ2l0YWxqb3VybmFsLmNvbS9wci9uZXdzL2luc2lnaHRhY2UtYW5hbHl0aWMvcHJlcHJlZy1tYXJrZXQtcmVwb3J0LW9uLXNpemUtc2hhcmUtc2NvcGUtYW5kLWZvcmVjYXN0LTIwMjMtMjAzMdIBAA?hl=en-IN&gl=IN&ceid=IN%3Aen,2023-10-03
38,Visa (V) Partners Expel to Boost Value-Added Services Suite,Nasdaq,news.google.com/articles/CBMiWWh0dHBzOi8vd3d3Lm5hc2RhcS5jb20vYXJ0aWNsZXMvdmlzYS12LXBhcnRuZXJzLWV4cGVsLXRvLWJvb3N0LXZhbHVlLWFkZGVkLXNlcnZpY2VzLXN1aXRl0gEA?hl=en-IN&gl=IN&ceid=IN%3Aen,2023-10-03
37,The potential use of bacteria and bacterial derivatives as drug ...,Virology Journal,news.google.com/articles/CBMiR2h0dHBzOi8vdmlyb2xvZ3lqLmJpb21lZGNlbnRyYWwuY29tL2FydGljbGVzLzEwLjExODYvczEyOTg1LTAyMy0wMjE4My160gEA?hl=en-IN&gl=IN&ceid=IN%3Aen,2023-10-03
36,HVAC Rental Equipment Market size to increase by USD 1.80 billion during 2022-2027| Growing adoption of cleanrooms across industries to drive the growth- Technavio,Yahoo Finance,news.google.com/articles/CBMiT2h0dHBzOi8vZmluYW5jZS55YWhvby5jb20vbmV3cy9odmFjLXJlbnRhbC1lcXVpcG1lbnQtbWFya2V0LXNpemUtMDcwMDAwMzAwLmh0bWzSAVdodHRwczovL2ZpbmFuY2UueWFob28uY29tL2FtcGh0bWwvbmV3cy9odmFjLXJlbnRhbC1lcXVpcG1lbnQtbWFya2V0LXNpemUtMDcwMDAwMzAwLmh0bWw?hl=en-IN&gl=IN&ceid=IN%3Aen,2023-10-03
35,A New Ag Deal: A 9-Point Plan For Climate-Smart Agriculture,RBC Thought Leadership -,news.google.com/articles/CBMiXWh0dHBzOi8vdGhvdWdodGxlYWRlcnNoaXAucmJjLmNvbS9hLW5ldy1hZy1kZWFsLWEtOS1wb2ludC1wbGFuLWZvci1jbGltYXRlLXNtYXJ0LWFncmljdWx0dXJlL9IBAA?hl=en-IN&gl=IN&ceid=IN%3Aen,2023-10-03
33,Advanced Materials: Reshaping the Future of Industries,AZoM,news.google.com/articles/CBMiMWh0dHBzOi8vd3d3LmF6b20uY29tL2FydGljbGUuYXNweD9BcnRpY2xlSUQ9MjMwNDTSAQA?hl=en-IN&gl=IN&ceid=IN%3Aen,2023-10-03
30,ChatGPT plugs into the internet’s real-time data firehose—again,Fortune,news.google.com/articles/CBMiUGh0dHBzOi8vZm9ydHVuZS5jb20vMjAyMy8xMC8wMy9jaGF0Z3B0LW9wZW5haS1rbm93bGVkZ2UtY3V0b2ZmLWJyb3dzZS13aXRoLWJpbmcv0gFUaHR0cHM6Ly9mb3J0dW5lLmNvbS8yMDIzLzEwLzAzL2NoYXRncHQtb3BlbmFpLWtub3dsZWRnZS1jdXRvZmYtYnJvd3NlLXdpdGgtYmluZy9hbXAv?hl=en-IN&gl=IN&ceid=IN%3Aen,2023-10-03
