,title,source,link,date
1,Revolutionary Surface Computing Technology Reshapes Digital Interaction Landscape,Yahoo Finance UK,news.google.com/articles/CBMiZGh0dHBzOi8vdWsuZmluYW5jZS55YWhvby5jb20vbmV3cy9yZXZvbHV0aW9uYXJ5LXN1cmZhY2UtY29tcHV0aW5nLXRlY2hub2xvZ3ktcmVzaGFwZXMtMDkwODAwODQ1Lmh0bWzSAWxodHRwczovL3VrLmZpbmFuY2UueWFob28uY29tL2FtcGh0bWwvbmV3cy9yZXZvbHV0aW9uYXJ5LXN1cmZhY2UtY29tcHV0aW5nLXRlY2hub2xvZ3ktcmVzaGFwZXMtMDkwODAwODQ1Lmh0bWw?hl=en-IN&gl=IN&ceid=IN%3Aen,2023-11-03
29,Carbon Fiber Construction Repair Market worth $192 million by ...,PR Newswire UK,news.google.com/articles/CBMiogFodHRwczovL3d3dy5wcm5ld3N3aXJlLmNvLnVrL25ld3MtcmVsZWFzZXMvY2FyYm9uLWZpYmVyLWNvbnN0cnVjdGlvbi1yZXBhaXItbWFya2V0LXdvcnRoLTE5Mi1taWxsaW9uLWJ5LTIwMjgtLWV4Y2x1c2l2ZS1yZXBvcnQtYnktbWFya2V0c2FuZG1hcmtldHMtMzAxOTc2OTY3Lmh0bWzSAQA?hl=en-IN&gl=IN&ceid=IN%3Aen,2023-11-03
77,What Makes The Toyota Tundra Hybrid The Best Hybrid Pickup Truck,TopSpeed,news.google.com/articles/CBMiS2h0dHBzOi8vd3d3LnRvcHNwZWVkLmNvbS93aHktdG95b3RhLXR1bmRyYS1oeWJyaWQtYmVzdC1oeWJyaWQtcGlja3VwLXRydWNrL9IBAA?hl=en-IN&gl=IN&ceid=IN%3Aen,2023-11-03
75,"Aerospace Coatings Market: Utilities, Value Chain, Ecosystem Structure, Key Players, Growth rate and Forecasts",openPR,news.google.com/articles/CBMiXWh0dHBzOi8vd3d3Lm9wZW5wci5jb20vbmV3cy8zMjc0OTc2L2Flcm9zcGFjZS1jb2F0aW5ncy1tYXJrZXQtdXRpbGl0aWVzLXZhbHVlLWNoYWluLWVjb3N5c3RlbdIBXGh0dHBzOi8vd3d3Lm9wZW5wci5jb20vYW1wLzMyNzQ5NzYvYWVyb3NwYWNlLWNvYXRpbmdzLW1hcmtldC11dGlsaXRpZXMtdmFsdWUtY2hhaW4tZWNvc3lzdGVt?hl=en-IN&gl=IN&ceid=IN%3Aen,2023-11-03
73,Healthcare UV Disinfection Equipment Market Report on the Untapped Growth Opportunities in the Industry,openPR,news.google.com/articles/CBMiWWh0dHBzOi8vd3d3Lm9wZW5wci5jb20vbmV3cy8zMjc1MjM1L2hlYWx0aGNhcmUtdXYtZGlzaW5mZWN0aW9uLWVxdWlwbWVudC1tYXJrZXQtcmVwb3J0LW9u0gFYaHR0cHM6Ly93d3cub3BlbnByLmNvbS9hbXAvMzI3NTIzNS9oZWFsdGhjYXJlLXV2LWRpc2luZmVjdGlvbi1lcXVpcG1lbnQtbWFya2V0LXJlcG9ydC1vbg?hl=en-IN&gl=IN&ceid=IN%3Aen,2023-11-03
43,Electronics Industry Leverages Hydrogel Innovations to Address ...,PR Newswire,news.google.com/articles/CBMitwFodHRwczovL3d3dy5wcm5ld3N3aXJlLmNvbS9uZXdzLXJlbGVhc2VzL2VsZWN0cm9uaWNzLWluZHVzdHJ5LWxldmVyYWdlcy1oeWRyb2dlbC1pbm5vdmF0aW9ucy10by1hZGRyZXNzLW1hcmtldC1kcml2ZXJzLWZvci1mbGV4aWJsZS1hbmQtZWZmaWNpZW50LWVsZWN0cm9uaWNzLWNvbXBvbmVudHMtMzAxOTc3MTE0Lmh0bWzSAQA?hl=en-IN&gl=IN&ceid=IN%3Aen,2023-11-03
42,"National norovirus and rotavirus report, week 44 report: data up to ...",GOV.UK,news.google.com/articles/CBMizAFodHRwczovL3d3dy5nb3YudWsvZ292ZXJubWVudC9zdGF0aXN0aWNzL25hdGlvbmFsLW5vcm92aXJ1cy1hbmQtcm90YXZpcnVzLXN1cnZlaWxsYW5jZS1yZXBvcnRzLTIwMjMtdG8tMjAyNC1zZWFzb24vbmF0aW9uYWwtbm9yb3ZpcnVzLWFuZC1yb3RhdmlydXMtcmVwb3J0LXdlZWstNDQtcmVwb3J0LWRhdGEtdXAtdG8td2Vlay00Mi0yMi1vY3RvYmVyLTIwMjPSAQA?hl=en-IN&gl=IN&ceid=IN%3Aen,2023-11-03
40,Outstanding innovation and commercialisation of research ...,University of Limerick,news.google.com/articles/CBMidGh0dHBzOi8vd3d3LnVsLmllL25ld3Mvb3V0c3RhbmRpbmctaW5ub3ZhdGlvbi1hbmQtY29tbWVyY2lhbGlzYXRpb24tb2YtcmVzZWFyY2gtY2VsZWJyYXRlZC1hdC11bml2ZXJzaXR5LW9mLWxpbWVyaWNr0gEA?hl=en-IN&gl=IN&ceid=IN%3Aen,2023-11-03
36,"Quartz Market Outlook, Size, Segmentation Analysis, Share, and ...",Taiwan News,news.google.com/articles/CBMiLWh0dHBzOi8vd3d3LnRhaXdhbm5ld3MuY29tLnR3L2VuL25ld3MvNTAzMzA5NtIBAA?hl=en-IN&gl=IN&ceid=IN%3Aen,2023-11-03
35,AJC hip-hop doc chronicles evolution of Atlanta's cultural dominance, The Atlanta Journal Constitution,news.google.com/articles/CBMikAFodHRwczovL3d3dy5hamMuY29tL2xpZmUvYXJ0cy1jdWx0dXJlL2hpcC1ob3AtNTAvYWpjLWhpcC1ob3AtZG9jLWNocm9uaWNsZXMtZXZvbHV0aW9uLW9mLWF0bGFudGFzLWN1bHR1cmFsLWRvbWluYW5jZS9RUzRSRUZCQjNaSEJERlNYV1lFNVk0TFM2SS_SAQA?hl=en-IN&gl=IN&ceid=IN%3Aen,2023-11-03
