,title,source,link,date
5,Education Technology Market Recent Innovations and Upcoming Trends Analysis by 2029,Benzinga,news.google.com/articles/CBMiiQFodHRwczovL3d3dy5iZW56aW5nYS5jb20vcHJlc3NyZWxlYXNlcy8yMy8wOS8zNDIxNTM5NC9lZHVjYXRpb24tdGVjaG5vbG9neS1tYXJrZXQtcmVjZW50LWlubm92YXRpb25zLWFuZC11cGNvbWluZy10cmVuZHMtYW5hbHlzaXMtYnktMjAyOdIBLWh0dHBzOi8vd3d3LmJlbnppbmdhLmNvbS9hbXAvY29udGVudC8zNDIxNTM5NA?hl=en-IN&gl=IN&ceid=IN%3Aen,2023-09-05
7,"Education Technology (EdTech) Market Top Trends, Profitable Analysis and Forecasts to 2029",Benzinga,news.google.com/articles/CBMijQFodHRwczovL3d3dy5iZW56aW5nYS5jb20vcHJlc3NyZWxlYXNlcy8yMy8wOS8zNDIxNTM4MS9lZHVjYXRpb24tdGVjaG5vbG9neS1lZHRlY2gtbWFya2V0LXRvcC10cmVuZHMtcHJvZml0YWJsZS1hbmFseXNpcy1hbmQtZm9yZWNhc3RzLXRvLTIwMjnSAS1odHRwczovL3d3dy5iZW56aW5nYS5jb20vYW1wL2NvbnRlbnQvMzQyMTUzODE?hl=en-IN&gl=IN&ceid=IN%3Aen,2023-09-05
0,WINTON GROUP Ltd Cuts Stock Holdings in Adtalem Global ...,MarketBeat,news.google.com/articles/CBMiSmh0dHBzOi8vd3d3Lm1hcmtldGJlYXQuY29tL2luc3RhbnQtYWxlcnRzL255c2UtYXRnZS1zZWMtZmlsaW5nLTIwMjMtMDktMDQv0gEA?hl=en-IN&gl=IN&ceid=IN%3Aen,2023-09-04
18,Education Cyber Security Market Research | 2023-2030,Benzinga,news.google.com/articles/CBMiaGh0dHBzOi8vd3d3LmJlbnppbmdhLmNvbS9wcmVzc3JlbGVhc2VzLzIzLzA5LzM0MjAwOTY2L2VkdWNhdGlvbi1jeWJlci1zZWN1cml0eS1tYXJrZXQtcmVzZWFyY2gtMjAyMy0yMDMw0gEtaHR0cHM6Ly93d3cuYmVuemluZ2EuY29tL2FtcC9jb250ZW50LzM0MjAwOTY2?hl=en-IN&gl=IN&ceid=IN%3Aen,2023-09-04
45,"Reproductive, maternal, newborn, and child health intervention ...",The Lancet,news.google.com/articles/CBMiU2h0dHBzOi8vd3d3LnRoZWxhbmNldC5jb20vam91cm5hbHMvbGFuZ2xvL2FydGljbGUvUElJUzIyMTQtMTA5WCgyMykwMDM1OC0zL2Z1bGx0ZXh00gEA?hl=en-IN&gl=IN&ceid=IN%3Aen,2023-09-04
42,"English Language Training (ELT) Market Top Trends, Profitable Analysis and Forecasts to 2029",Benzinga,news.google.com/articles/CBMijwFodHRwczovL3d3dy5iZW56aW5nYS5jb20vcHJlc3NyZWxlYXNlcy8yMy8wOS8zNDIwNDMyNi9lbmdsaXNoLWxhbmd1YWdlLXRyYWluaW5nLWVsdC1tYXJrZXQtdG9wLXRyZW5kcy1wcm9maXRhYmxlLWFuYWx5c2lzLWFuZC1mb3JlY2FzdHMtdG8tMjAyOdIBLWh0dHBzOi8vd3d3LmJlbnppbmdhLmNvbS9hbXAvY29udGVudC8zNDIwNDMyNg?hl=en-IN&gl=IN&ceid=IN%3Aen,2023-09-04
28,Azent Revolutionizes the Study Abroad Industry with Live ...,webindia123,news.google.com/articles/CBMiSWh0dHBzOi8vbmV3cy53ZWJpbmRpYTEyMy5jb20vbmV3cy9hcnRpY2xlcy9CdXNpbmVzcy8yMDIzMDkwNC80MTE1MzE2Lmh0bWzSAQA?hl=en-IN&gl=IN&ceid=IN%3Aen,2023-09-04
26,Bridging the digital divide: Empowering education through ...,FE News,news.google.com/articles/CBMicmh0dHBzOi8vd3d3LmZlbmV3cy5jby51ay9leGNsdXNpdmUvYnJpZGdpbmctdGhlLWRpZ2l0YWwtZGl2aWRlLWVtcG93ZXJpbmctZWR1Y2F0aW9uLXRocm91Z2gtZW5oYW5jZWQtY29ubmVjdGl2aXR5L9IBAA?hl=en-IN&gl=IN&ceid=IN%3Aen,2023-09-04
20,"Education and Learning Analytics Software and Services Market Size, Share, Growth, Revenue, Demand, and F",Benzinga,news.google.com/articles/CBMimQFodHRwczovL3d3dy5iZW56aW5nYS5jb20vcHJlc3NyZWxlYXNlcy8yMy8wOS8zNDIwNzM0NC9lZHVjYXRpb24tYW5kLWxlYXJuaW5nLWFuYWx5dGljcy1zb2Z0d2FyZS1hbmQtc2VydmljZXMtbWFya2V0LXNpemUtc2hhcmUtZ3Jvd3RoLXJldmVudWUtZGVtYW5kLWFuZC3SAS1odHRwczovL3d3dy5iZW56aW5nYS5jb20vYW1wL2NvbnRlbnQvMzQyMDczNDQ?hl=en-IN&gl=IN&ceid=IN%3Aen,2023-09-04
48,India’s G20 Leadership: Elevating Capacity Building for Sustainable Development Financing,Observer Research Foundation,news.google.com/articles/CBMiOWh0dHBzOi8vd3d3Lm9yZm9ubGluZS5vcmcvcmVzZWFyY2gvaW5kaWFzLWcyMC1sZWFkZXJzaGlwL9IBOWh0dHBzOi8vd3d3Lm9yZm9ubGluZS5vcmcvcmVzZWFyY2gvaW5kaWFzLWcyMC1sZWFkZXJzaGlwLw?hl=en-IN&gl=IN&ceid=IN%3Aen,2023-09-04
