,title,source,link,date
6,Godrej Agrovet Ltd Share Latest News : अहम स्तरों के ऊपर निकला ...,Sharemanthan,news.google.com/articles/CBMibmh0dHBzOi8vd3d3LnNoYXJlbWFudGhhbi5pbi80NjItYWR2aWNlLzczMTU5LW1hcmtldC1vdXRsb29rLWdvZHJlai1hZ3JvdmV0LXNoYXJlcy1oZW1lbi1rYXBhZGlhLXZpZXdzLTIwMjMxMTI00gEA?hl=en-IN&gl=IN&ceid=IN%3Aen,2023-11-24
8,Top three stocks that saw heavy demand from buyers in the pre ...,Dalal Street Investment Journal,news.google.com/articles/CBMigQFodHRwczovL3d3dy5kc2lqLmluL2RzaWphcnRpY2xlZGV0YWlsL3RvcC10aHJlZS1zdG9ja3MtdGhhdC1zYXctaGVhdnktZGVtYW5kLWZyb20tYnV5ZXJzLWluLXRoZS1wcmUtb3BlbmluZy1zZXNzaW9uLXRvZGF5LTM0Njk3LTHSAQA?hl=en-IN&gl=IN&ceid=IN%3Aen,2023-11-23
9,Godrej Yummiez makes the category-first move of sachetisation of ...,HospiBuz,news.google.com/articles/CBMilgFodHRwczovL2hvc3BpYnV6LmNvbS9nb2RyZWoteXVtbWllei1tYWtlcy10aGUtY2F0ZWdvcnktZmlyc3QtbW92ZS1vZi1zYWNoZXRpc2F0aW9uLW9mLWZyb3plbi1mb29kcy1pbnRyb2R1Y2VzLXRoZS1tb3N0LWFmZm9yZGFibGUtaW5yLTMwLXNhdXNhZ2UtcGFjay_SAQA?hl=en-IN&gl=IN&ceid=IN%3Aen,2023-11-23
75,"Indian Animal Feed Market Report Size, Share, Growth, Analysis, Price, Outlook and Forecast 2024-2032",openPR,news.google.com/articles/CBMiX2h0dHBzOi8vd3d3Lm9wZW5wci5jb20vbmV3cy8zMjk5NTUyL2luZGlhbi1hbmltYWwtZmVlZC1tYXJrZXQtcmVwb3J0LXNpemUtc2hhcmUtZ3Jvd3RoLWFuYWx5c2lz0gFeaHR0cHM6Ly93d3cub3BlbnByLmNvbS9hbXAvMzI5OTU1Mi9pbmRpYW4tYW5pbWFsLWZlZWQtbWFya2V0LXJlcG9ydC1zaXplLXNoYXJlLWdyb3d0aC1hbmFseXNpcw?hl=en-IN&gl=IN&ceid=IN%3Aen,2023-11-23
39,India Ready-to-Eat Market to enjoy ‘explosive growth’ to 2032,Taiwan News,news.google.com/articles/CBMiLWh0dHBzOi8vd3d3LnRhaXdhbm5ld3MuY29tLnR3L2VuL25ld3MvNTA0MzMzN9IBAA?hl=en-IN&gl=IN&ceid=IN%3Aen,2023-11-19
61,India Frozen Foods Market Have High Growth but May Foresee ...,Taiwan News,news.google.com/articles/CBMiLWh0dHBzOi8vd3d3LnRhaXdhbm5ld3MuY29tLnR3L2VuL25ld3MvNTA0MzM0N9IBAA?hl=en-IN&gl=IN&ceid=IN%3Aen,2023-11-19
46,A Brief History of ACI,Future Startup ,news.google.com/articles/CBMiPGh0dHBzOi8vZnV0dXJlc3RhcnR1cC5jb20vMjAyMy8xMS8xOC9hLWJyaWVmLWhpc3Rvcnktb2YtYWNpL9IBAA?hl=en-IN&gl=IN&ceid=IN%3Aen,2023-11-18
