,title,source,link,date
0,HDFC Asset Management's (NSE:HDFCAMC) 17% CAGR outpaced the company's earnings growth over the same five-year period,Simply Wall St,news.google.com/articles/CBMioQFodHRwczovL3NpbXBseXdhbGwuc3Qvc3RvY2tzL2luL2RpdmVyc2lmaWVkLWZpbmFuY2lhbHMvbnNlLWhkZmNhbWMvaGRmYy1hc3NldC1tYW5hZ2VtZW50LXNoYXJlcy9uZXdzL2hkZmMtYXNzZXQtbWFuYWdlbWVudHMtbnNlaGRmY2FtYy0xNy1jYWdyLW91dHBhY2VkLXRoZS1jb21wYdIBpQFodHRwczovL3NpbXBseXdhbGwuc3Qvc3RvY2tzL2luL2RpdmVyc2lmaWVkLWZpbmFuY2lhbHMvbnNlLWhkZmNhbWMvaGRmYy1hc3NldC1tYW5hZ2VtZW50LXNoYXJlcy9uZXdzL2hkZmMtYXNzZXQtbWFuYWdlbWVudHMtbnNlaGRmY2FtYy0xNy1jYWdyLW91dHBhY2VkLXRoZS1jb21wYS9hbXA?hl=en-IN&gl=IN&ceid=IN%3Aen,2023-11-19
3,HDFC MF-Backed Bluechip Stock To Turn Ex-Dividend On Monday ...,Goodreturns,news.google.com/articles/CBMidGh0dHBzOi8vd3d3Lmdvb2RyZXR1cm5zLmluL25ld3MvaGRmYy1tZi1iYWNrZWQtYmx1ZWNoaXAtc3RvY2stdG8tdHVybi1leC1kaXZpZGVuZC1vbi1tb25kYXktZm9yLTMwMC1idXktMTMxMzA1MS5odG1s0gEA?hl=en-IN&gl=IN&ceid=IN%3Aen,2023-11-19
6,Mirae Asset Global Investments Co. Ltd. Acquires 428884 Shares of ...,MarketBeat,news.google.com/articles/CBMiSWh0dHBzOi8vd3d3Lm1hcmtldGJlYXQuY29tL2luc3RhbnQtYWxlcnRzL255c2UtaGRiLXNlYy1maWxpbmctMjAyMy0xMS0xOS_SAQA?hl=en-IN&gl=IN&ceid=IN%3Aen,2023-11-19
59,Why Endowment Plans May Not Be a Good Investment Choice for You,PersonalFN,news.google.com/articles/CBMiaGh0dHBzOi8vd3d3LnBlcnNvbmFsZm4uY29tL2R3bC9JbnN1cmFuY2Uvd2h5LWVuZG93bWVudC1wbGFucy1tYXktbm90LWJlLWEtZ29vZC1pbnZlc3RtZW50LWNob2ljZS1mb3IteW910gEA?hl=en-IN&gl=IN&ceid=IN%3Aen,2023-11-18
2,"Oracle Financial Services Software Limited (NSE:OFSS) stock most popular amongst public companies who own 73%, while individual investors hold 14%",Simply Wall St,news.google.com/articles/CBMinQFodHRwczovL3NpbXBseXdhbGwuc3Qvc3RvY2tzL2luL3NvZnR3YXJlL25zZS1vZnNzL29yYWNsZS1maW5hbmNpYWwtc2VydmljZXMtc29mdHdhcmUtc2hhcmVzL25ld3Mvb3JhY2xlLWZpbmFuY2lhbC1zZXJ2aWNlcy1zb2Z0d2FyZS1saW1pdGVkLW5zZW9mc3Mtc3RvY2stbW9z0gGhAWh0dHBzOi8vc2ltcGx5d2FsbC5zdC9zdG9ja3MvaW4vc29mdHdhcmUvbnNlLW9mc3Mvb3JhY2xlLWZpbmFuY2lhbC1zZXJ2aWNlcy1zb2Z0d2FyZS1zaGFyZXMvbmV3cy9vcmFjbGUtZmluYW5jaWFsLXNlcnZpY2VzLXNvZnR3YXJlLWxpbWl0ZWQtbnNlb2Zzcy1zdG9jay1tb3MvYW1w?hl=en-IN&gl=IN&ceid=IN%3Aen,2023-11-17
12,Artisan Partners Limited Partnership Trims Stock Position in HDFC ...,MarketBeat,news.google.com/articles/CBMiSWh0dHBzOi8vd3d3Lm1hcmtldGJlYXQuY29tL2luc3RhbnQtYWxlcnRzL255c2UtaGRiLXNlYy1maWxpbmctMjAyMy0xMS0xNy_SAQA?hl=en-IN&gl=IN&ceid=IN%3Aen,2023-11-17
8,The Merger of HDFC Limited with HDFC Bank : Synergy or ...,Economic and Political Weekly,news.google.com/articles/CBMiU2h0dHBzOi8vd3d3LmVwdy5pbi9qb3VybmFsLzIwMjMvNDUtNDYvY29tbWVudGFyeS9tZXJnZXItaGRmYy1saW1pdGVkLWhkZmMtYmFuay5odG1s0gEA?hl=en-IN&gl=IN&ceid=IN%3Aen,2023-11-13
