,title,source,link,date
1,Stock Market Live Updates: Equity indices range-bound amidst persistent foreign fund outflows and global market sluggishness,BusinessLine,news.google.com/articles/CBMid2h0dHBzOi8vd3d3LnRoZWhpbmR1YnVzaW5lc3NsaW5lLmNvbS9tYXJrZXRzL3NoYXJlLW1hcmtldC1uaWZ0eS1zZW5zZXgtbGl2ZS11cGRhdGVzLTMwLW9jdG9iZXItMjAyMy9hcnRpY2xlNjc0NzMxNTYuZWNl0gF8aHR0cHM6Ly93d3cudGhlaGluZHVidXNpbmVzc2xpbmUuY29tL21hcmtldHMvc2hhcmUtbWFya2V0LW5pZnR5LXNlbnNleC1saXZlLXVwZGF0ZXMtMzAtb2N0b2Jlci0yMDIzL2FydGljbGU2NzQ3MzE1Ni5lY2UvYW1wLw?hl=en-IN&gl=IN&ceid=IN%3Aen,2023-10-30
14,Bangladesh captain Shakib stumped by 'worst' World Cup display,Arab News Pakistan,news.google.com/articles/CBMiKmh0dHBzOi8vd3d3LmFyYWJuZXdzLnBrL25vZGUvMjM5OTM5Ni9zcG9ydNIBAA?hl=en-IN&gl=IN&ceid=IN%3Aen,2023-10-29
6,Australia edge New Zealand by five runs in record World Cup epic,Arab News,news.google.com/articles/CBMiK2h0dHBzOi8vd3d3LmFyYWJuZXdzLmNvbS9ub2RlLzIzOTkxODYvc3BvcnTSASlodHRwczovL3d3dy5hcmFibmV3cy5jb20vbm9kZS8yMzk5MTg2L2FtcA?hl=en-IN&gl=IN&ceid=IN%3Aen,2023-10-28
17,Newcastle boss Eddie Howe defends controversial substitution ...,Arab News,news.google.com/articles/CBMiK2h0dHBzOi8vd3d3LmFyYWJuZXdzLmNvbS9ub2RlLzIzOTkzMDYvc3BvcnTSASlodHRwczovL3d3dy5hcmFibmV3cy5jb20vbm9kZS8yMzk5MzA2L2FtcA?hl=en-IN&gl=IN&ceid=IN%3Aen,2023-10-28
22,Palestinian athletes suffer as Israel devastates Gaza,Arab News,news.google.com/articles/CBMiK2h0dHBzOi8vd3d3LmFyYWJuZXdzLmNvbS9ub2RlLzIzOTkwNjYvc3BvcnTSASlodHRwczovL3d3dy5hcmFibmV3cy5jb20vbm9kZS8yMzk5MDY2L2FtcA?hl=en-IN&gl=IN&ceid=IN%3Aen,2023-10-28
23,"[INTERVIEW] David Hartmann CEO and Founder, Helio Additive ...",3D Printing Industry,news.google.com/articles/CBMilAFodHRwczovLzNkcHJpbnRpbmdpbmR1c3RyeS5jb20vbmV3cy9pbnRlcnZpZXctZGF2aWQtaGFydG1hbm4tY2VvLWFuZC1mb3VuZGVyLWhlbGlvLWFkZGl0aXZlLXRoZXJtYWwtcGh5c2ljcy1mb3ItZmlyc3QtdGltZS1yaWdodC0zZC1wcmludGluZy0yMjU2MjYv0gEA?hl=en-IN&gl=IN&ceid=IN%3Aen,2023-10-27
4,Reliance Industries Shareholders Approve Appointment of Isha ...,Goodreturns,news.google.com/articles/CBMiigFodHRwczovL3d3dy5nb29kcmV0dXJucy5pbi9uZXdzL3JlbGlhbmNlLWluZHVzdHJpZXMtc2hhcmVob2xkZXJzLWFwcHJvdmUtYXBwb2ludG1lbnQtb2YtaXNoYS1ha2FzaC1hbmQtYW5hbnQtYXMtbm9uLWV4ZWN1dGl2ZS0xMzA4NzAzLmh0bWzSAQA?hl=en-IN&gl=IN&ceid=IN%3Aen,2023-10-27
8,Gaming Experts from Across the Globe Expected to Participate in the ...,Business Wire India,news.google.com/articles/CBMioAFodHRwczovL3d3dy5idXNpbmVzc3dpcmVpbmRpYS5jb20vZ2FtaW5nLWV4cGVydHMtZnJvbS1hY3Jvc3MtdGhlLWdsb2JlLWV4cGVjdGVkLXRvLXBhcnRpY2lwYXRlLWluLXRoZS0xNXRoLWVkaXRpb24tb2YtaW5kaWEtZ2FtZS1kZXZlbG9wZXItY29uZmVyZW5jZS04NzIwNi5odG1s0gEA?hl=en-IN&gl=IN&ceid=IN%3Aen,2023-10-27
10,All-Star line-up confirmed for 'WWE Crown Jewel' in Riyadh,Arab News,news.google.com/articles/CBMiK2h0dHBzOi8vd3d3LmFyYWJuZXdzLmNvbS9ub2RlLzIzOTg2MTYvc3BvcnTSASlodHRwczovL3d3dy5hcmFibmV3cy5jb20vbm9kZS8yMzk4NjE2L2FtcA?hl=en-IN&gl=IN&ceid=IN%3Aen,2023-10-27
11,"Peter Mayiga, Buganda kingdom prime minister… the king’s right ...",The Africa Report,news.google.com/articles/CBMiVWh0dHBzOi8vd3d3LnRoZWFmcmljYXJlcG9ydC5jb20vMzI2MjQ1L3BldGVyLW1heWlnYS10aGUtYnVnYW5kYS1raW5ncy1yaWdodC1oYW5kLW1hbi_SAQA?hl=en-IN&gl=IN&ceid=IN%3Aen,2023-10-27
