,title,source,link,date
37,3D Bioprinting Market projected to reach USD 6.9 Billion by 2030 ...,GlobeNewswire,news.google.com/articles/CBMi-QFodHRwczovL3d3dy5nbG9iZW5ld3N3aXJlLmNvbS9uZXdzLXJlbGVhc2UvMjAyMy8xMS8wOS8yNzc3NjA5LzAvZW4vM0QtQmlvcHJpbnRpbmctTWFya2V0LXByb2plY3RlZC10by1yZWFjaC1VU0QtNi05LUJpbGxpb24tYnktMjAzMC1ncm93aW5nLWF0LWEtQ0FHUi1vZi0xNi03LWR1cmluZy10aGUtZm9yZWNhc3QtcGVyaW9kLW9mLTIwMjMtMjAzMC1wcm9ub3VuY2VkLWJ5LU1hcmtldERpZ2l0cy1pbi1pdHMtcmVjZW50LXN0dWR5Lmh0bWzSAQA?hl=en-IN&gl=IN&ceid=IN%3Aen,2023-11-09
28,"Ascorbic Acid Market Size, Share, Trends by 2031 | Global Key Players; Luwei Pharmaceutical Group Co., Ltd, FU",openPR,news.google.com/articles/CBMiXWh0dHBzOi8vd3d3Lm9wZW5wci5jb20vbmV3cy8zMjgyNDQ4L2FzY29yYmljLWFjaWQtbWFya2V0LXNpemUtc2hhcmUtdHJlbmRzLWJ5LTIwMzEtZ2xvYmFsLWtledIBXGh0dHBzOi8vd3d3Lm9wZW5wci5jb20vYW1wLzMyODI0NDgvYXNjb3JiaWMtYWNpZC1tYXJrZXQtc2l6ZS1zaGFyZS10cmVuZHMtYnktMjAzMS1nbG9iYWwta2V5?hl=en-IN&gl=IN&ceid=IN%3Aen,2023-11-09
90,"Wound Management Devices Market : Trends, Challenges, and Opportunities",openPR,news.google.com/articles/CBMiVWh0dHBzOi8vd3d3Lm9wZW5wci5jb20vbmV3cy8zMjgxNTMxL3dvdW5kLW1hbmFnZW1lbnQtZGV2aWNlcy1tYXJrZXQtdHJlbmRzLWNoYWxsZW5nZXPSAVRodHRwczovL3d3dy5vcGVucHIuY29tL2FtcC8zMjgxNTMxL3dvdW5kLW1hbmFnZW1lbnQtZGV2aWNlcy1tYXJrZXQtdHJlbmRzLWNoYWxsZW5nZXM?hl=en-IN&gl=IN&ceid=IN%3Aen,2023-11-09
83,"Outdoor Fabric Market Share, Demand, Opportunities, Challenges, Drivers and Restraint Research Report by 2023-",openPR,news.google.com/articles/CBMiVGh0dHBzOi8vd3d3Lm9wZW5wci5jb20vbmV3cy8zMjgyNDkzL291dGRvb3ItZmFicmljLW1hcmtldC1zaGFyZS1kZW1hbmQtb3Bwb3J0dW5pdGllc9IBU2h0dHBzOi8vd3d3Lm9wZW5wci5jb20vYW1wLzMyODI0OTMvb3V0ZG9vci1mYWJyaWMtbWFya2V0LXNoYXJlLWRlbWFuZC1vcHBvcnR1bml0aWVz?hl=en-IN&gl=IN&ceid=IN%3Aen,2023-11-09
80,"AC-DC Power Supply Adapter Market In-Depth Analysis [2022-2031]: Top Impacting Factos, Growth Opportunities an",openPR,news.google.com/articles/CBMiV2h0dHBzOi8vd3d3Lm9wZW5wci5jb20vbmV3cy8zMjgzMDAzL2FjLWRjLXBvd2VyLXN1cHBseS1hZGFwdGVyLW1hcmtldC1pbi1kZXB0aC1hbmFseXNpc9IBVmh0dHBzOi8vd3d3Lm9wZW5wci5jb20vYW1wLzMyODMwMDMvYWMtZGMtcG93ZXItc3VwcGx5LWFkYXB0ZXItbWFya2V0LWluLWRlcHRoLWFuYWx5c2lz?hl=en-IN&gl=IN&ceid=IN%3Aen,2023-11-09
73,"Odor Sensor Market In-Depth Analysis [2021-2031]: Key Market Dynamics, Market Share, and Business Growth Oppor",openPR,news.google.com/articles/CBMiXWh0dHBzOi8vd3d3Lm9wZW5wci5jb20vbmV3cy8zMjgzMTcyL29kb3Itc2Vuc29yLW1hcmtldC1pbi1kZXB0aC1hbmFseXNpcy0yMDIxLTIwMzEta2V5LW1hcmtldNIBXGh0dHBzOi8vd3d3Lm9wZW5wci5jb20vYW1wLzMyODMxNzIvb2Rvci1zZW5zb3ItbWFya2V0LWluLWRlcHRoLWFuYWx5c2lzLTIwMjEtMjAzMS1rZXktbWFya2V0?hl=en-IN&gl=IN&ceid=IN%3Aen,2023-11-09
72,"Apple cider vinegar $1819.4 Million and Registering a CAGR of 8.1% | Aspall, Pepsico Inc., Barnes Natural Pty",openPR,news.google.com/articles/CBMiXWh0dHBzOi8vd3d3Lm9wZW5wci5jb20vbmV3cy8zMjgyNjQzL2FwcGxlLWNpZGVyLXZpbmVnYXItMTgxOS00LW1pbGxpb24tYW5kLXJlZ2lzdGVyaW5nLWEtY2FnctIBXGh0dHBzOi8vd3d3Lm9wZW5wci5jb20vYW1wLzMyODI2NDMvYXBwbGUtY2lkZXItdmluZWdhci0xODE5LTQtbWlsbGlvbi1hbmQtcmVnaXN0ZXJpbmctYS1jYWdy?hl=en-IN&gl=IN&ceid=IN%3Aen,2023-11-09
60,"High Temperature Sealants Market Top Growth Companies Global Growth, Size, Trends, Industry Analysis, Key Play",openPR,news.google.com/articles/CBMiYGh0dHBzOi8vd3d3Lm9wZW5wci5jb20vbmV3cy8zMjgzMDAyL2hpZ2gtdGVtcGVyYXR1cmUtc2VhbGFudHMtbWFya2V0LXRvcC1ncm93dGgtY29tcGFuaWVzLWdsb2JhbNIBX2h0dHBzOi8vd3d3Lm9wZW5wci5jb20vYW1wLzMyODMwMDIvaGlnaC10ZW1wZXJhdHVyZS1zZWFsYW50cy1tYXJrZXQtdG9wLWdyb3d0aC1jb21wYW5pZXMtZ2xvYmFs?hl=en-IN&gl=IN&ceid=IN%3Aen,2023-11-09
42,"Enterprise Networking Market Trends 2023 | Growth, Share, Size, Demand and Future Scope 2028",openPR,news.google.com/articles/CBMiXmh0dHBzOi8vd3d3Lm9wZW5wci5jb20vbmV3cy8zMjgxOTMyL2VudGVycHJpc2UtbmV0d29ya2luZy1tYXJrZXQtdHJlbmRzLTIwMjMtZ3Jvd3RoLXNoYXJlLXNpemXSAV1odHRwczovL3d3dy5vcGVucHIuY29tL2FtcC8zMjgxOTMyL2VudGVycHJpc2UtbmV0d29ya2luZy1tYXJrZXQtdHJlbmRzLTIwMjMtZ3Jvd3RoLXNoYXJlLXNpemU?hl=en-IN&gl=IN&ceid=IN%3Aen,2023-11-09
41,"Silicone Encapsulant Market Top Growth Companies Global Growth, Size, Trends, Industry Analysis, Key Players",openPR,news.google.com/articles/CBMiW2h0dHBzOi8vd3d3Lm9wZW5wci5jb20vbmV3cy8zMjgzMTkyL3NpbGljb25lLWVuY2Fwc3VsYW50LW1hcmtldC10b3AtZ3Jvd3RoLWNvbXBhbmllcy1nbG9iYWzSAVpodHRwczovL3d3dy5vcGVucHIuY29tL2FtcC8zMjgzMTkyL3NpbGljb25lLWVuY2Fwc3VsYW50LW1hcmtldC10b3AtZ3Jvd3RoLWNvbXBhbmllcy1nbG9iYWw?hl=en-IN&gl=IN&ceid=IN%3Aen,2023-11-09
