,title,source,link,date
17,Illinois State Upends Valparaiso in Three Sets - Illinois State ...,Illinois State Athletics,news.google.com/articles/CBMiZGh0dHBzOi8vZ29yZWRiaXJkcy5jb20vbmV3cy8yMDIzLzEwLzYvdm9sbGV5YmFsbC1pbGxpbm9pcy1zdGF0ZS11cGVuZHMtdmFscGFyYWlzby1pbi10aHJlZS1zZXRzLmFzcHjSAQA?hl=en-IN&gl=IN&ceid=IN%3Aen,2023-10-07
87,"Coupe du monde de rugby - XV de France - ""Il nous reste 3 matches ...",Eurosport FR,news.google.com/articles/CBMirgFodHRwczovL3d3dy5ldXJvc3BvcnQuZnIvcnVnYnkvY291cGUtZHUtbW9uZGUvMjAyMy9jb3VwZS1kdS1tb25kZS1kZS1ydWdieS14di1kZS1mcmFuY2UtaWwtbm91cy1yZXN0ZS0zLW1hdGNoZXMtcG91ci1yZXZlci1sZXMtYmxldXMtZGVqYS10b3VybmVzLXZlcnMtX3N0bzk4MjY1OTcvc3Rvcnkuc2h0bWzSAQA?hl=en-IN&gl=IN&ceid=IN%3Aen,2023-10-07
23,"Birds Win all But One Event, Roll Eastern Illinois in Season Opener ...",Illinois State Athletics,news.google.com/articles/CBMifWh0dHBzOi8vZ29yZWRiaXJkcy5jb20vbmV3cy8yMDIzLzEwLzYvc3dpbW1pbmctZGl2aW5nLWJpcmRzLXdpbi1hbGwtYnV0LW9uZS1ldmVudC1yb2xsLWVhc3Rlcm4taWxsaW5vaXMtaW4tc2Vhc29uLW9wZW5lci5hc3B40gEA?hl=en-IN&gl=IN&ceid=IN%3Aen,2023-10-07
13,"Anhydrous ammonia accident in Illinois: Family of woman critically hurt in crash near Teutopolis, IL retains Ben Crump as attorney",WLS-TV,news.google.com/articles/CBMiYGh0dHBzOi8vYWJjN2NoaWNhZ28uY29tL2Jlbi1jcnVtcC10ZXV0b3BvbGlzLWlsLWFuaHlkcm91cy1hbW1vbmlhLWFjY2lkZW50LWluLWlsbGlub2lzLzEzODczMjQ0L9IBZGh0dHBzOi8vYWJjN2NoaWNhZ28uY29tL2FtcC9iZW4tY3J1bXAtdGV1dG9wb2xpcy1pbC1hbmh5ZHJvdXMtYW1tb25pYS1hY2NpZGVudC1pbi1pbGxpbm9pcy8xMzg3MzI0NC8?hl=en-IN&gl=IN&ceid=IN%3Aen,2023-10-07
90,IL PRESIDENTE DE LUCA FA IL PUNTO DELLA SETTIMANA ...,Regione Campania,news.google.com/articles/CBMibWh0dHA6Ly9yZWdpb25lLmNhbXBhbmlhLml0L3JlZ2lvbmUvaXQvbmV3cy9wcmltby1waWFuby9pbC1wcmVzaWRlbnRlLWRlLWx1Y2EtZmEtaWwtcHVudG8tZGVsbGEtc2V0dGltYW5hLThhOGfSAQA?hl=en-IN&gl=IN&ceid=IN%3Aen,2023-10-07
78,"Brennero, lunedì atteso il ministro Salvini | mit",Ministero delle Infrastrutture e dei Trasporti,news.google.com/articles/CBMiVGh0dHBzOi8vd3d3Lm1pdC5nb3YuaXQvY29tdW5pY2F6aW9uZS9uZXdzL2JyZW5uZXJvLWx1bmVkaS1hdHRlc28taWwtbWluaXN0cm8tc2FsdmluadIBAA?hl=en-IN&gl=IN&ceid=IN%3Aen,2023-10-06
77,Incontro con il Presidente della Confederazione svizzera a Granada,Governo.it,news.google.com/articles/CBMiWGh0dHBzOi8vd3d3LmdvdmVybm8uaXQvaXQvYXJ0aWNvbG8vY29uLWlsLXByZXNpZGVudGUtZGVsbGEtY29uZmVkZXJhemlvbmUtc3ZpenplcmEvMjM4MTbSAQA?hl=en-IN&gl=IN&ceid=IN%3Aen,2023-10-06
76,Il est complexe de protéger efficacement les enfants contre les ...,France ONU,news.google.com/articles/CBMiZmh0dHBzOi8vb251LmRlbGVnZnJhbmNlLm9yZy9pbC1lc3QtY29tcGxleGUtZGUtcHJvdGVnZXItZWZmaWNhY2VtZW50LWxlcy1lbmZhbnRzLWNvbnRyZS1sZXMtcmlzcXVlcy1lbtIBAA?hl=en-IN&gl=IN&ceid=IN%3Aen,2023-10-06
75,Incontro con il Cancelliere federale della Repubblica di Germania ...,Governo.it,news.google.com/articles/CBMicWh0dHBzOi8vd3d3LmdvdmVybm8uaXQvaXQvYXJ0aWNvbG8vaW5jb250cm8tY29uLWlsLWNhbmNlbGxpZXJlLWZlZGVyYWxlLWRlbGxhLXJlcHViYmxpY2EtZGktZ2VybWFuaWEtc2Nob2x6LzIzODIx0gEA?hl=en-IN&gl=IN&ceid=IN%3Aen,2023-10-06
74,Sanità: Marsilio e Verì visitano a Pescara il Centro Adriatico della ...,Regione Abruzzo |,news.google.com/articles/CBMihgFodHRwczovL3d3dy5yZWdpb25lLmFicnV6em8uaXQvY29udGVudC9zYW5pdCVDMyVBMC1tYXJzaWxpby1lLXZlciVDMyVBQy12aXNpdGFuby1wZXNjYXJhLWlsLWNlbnRyby1hZHJpYXRpY28tZGVsbGEtZm9uZGF6aW9uZS1wYW9sby12adIBAA?hl=en-IN&gl=IN&ceid=IN%3Aen,2023-10-06
