,title,source,link,date
0,"Q2 Results today: IRCTC, Power Grid, Shree Cement, others to announce Q2 earnings | Mint",Mint,news.google.com/articles/CBMikwFodHRwczovL3d3dy5saXZlbWludC5jb20vY29tcGFuaWVzL2NvbXBhbnktcmVzdWx0cy9xMi1yZXN1bHRzLXRvZGF5LWlyY3RjLXBvd2VyLWdyaWQtc2hyZWUtY2VtZW50LW90aGVycy10by1hbm5vdW5jZS1xMi1lYXJuaW5nLTExNjk5MzI2MTU4MjcwLmh0bWzSAZcBaHR0cHM6Ly93d3cubGl2ZW1pbnQuY29tL2NvbXBhbmllcy9jb21wYW55LXJlc3VsdHMvcTItcmVzdWx0cy10b2RheS1pcmN0Yy1wb3dlci1ncmlkLXNocmVlLWNlbWVudC1vdGhlcnMtdG8tYW5ub3VuY2UtcTItZWFybmluZy9hbXAtMTE2OTkzMjYxNTgyNzAuaHRtbA?hl=en-IN&gl=IN&ceid=IN%3Aen,2023-11-07
18,Airline veteran Gidon Novick explains why SA's era of subsidised ...,BizNews,news.google.com/articles/CBMiTmh0dHBzOi8vd3d3LmJpem5ld3MuY29tL2dsb2JhbC1jaXRpemVuLzIwMjMvMTEvMDcvZ2lkb24tbm92aWNrLWNvbWFpci1zYWEtbGlmdNIBAA?hl=en-IN&gl=IN&ceid=IN%3Aen,2023-11-07
36,Christmas at the Kraft Mix and Mingle | Red Bluff Chamber of ...,Red Bluff Daily News,news.google.com/articles/CBMiU2h0dHBzOi8vd3d3LnJlZGJsdWZmZGFpbHluZXdzLmNvbS8yMDIzLzExLzA3L2NocmlzdG1hcy1hdC10aGUta3JhZnQtbWl4LWFuZC1taW5nbGUv0gEA?hl=en-IN&gl=IN&ceid=IN%3Aen,2023-11-07
30,"Increasing Demand In Healthcare Data Commercialization Solution Market is Booming Worldwide Growth Prospects,",openPR,news.google.com/articles/CBMiWmh0dHBzOi8vd3d3Lm9wZW5wci5jb20vbmV3cy8zMjc5MTgxL2luY3JlYXNpbmctZGVtYW5kLWluLWhlYWx0aGNhcmUtZGF0YS1jb21tZXJjaWFsaXphdGlvbtIBWWh0dHBzOi8vd3d3Lm9wZW5wci5jb20vYW1wLzMyNzkxODEvaW5jcmVhc2luZy1kZW1hbmQtaW4taGVhbHRoY2FyZS1kYXRhLWNvbW1lcmNpYWxpemF0aW9u?hl=en-IN&gl=IN&ceid=IN%3Aen,2023-11-07
28,"Increasing Demand In Real-Time Shipment Visibility?solutions Market is Booming Worldwide Growth Prospects, Inc",openPR,news.google.com/articles/CBMiS2h0dHBzOi8vd3d3Lm9wZW5wci5jb20vbmV3cy8zMjc5MDI3L2luY3JlYXNpbmctZGVtYW5kLWluLXJlYWwtdGltZS1zaGlwbWVudNIBSmh0dHBzOi8vd3d3Lm9wZW5wci5jb20vYW1wLzMyNzkwMjcvaW5jcmVhc2luZy1kZW1hbmQtaW4tcmVhbC10aW1lLXNoaXBtZW50?hl=en-IN&gl=IN&ceid=IN%3Aen,2023-11-07
25,CEX.IO's Head of Financial Crime Mark Taylor to Join Panel,GlobeNewswire,news.google.com/articles/CBMinwFodHRwczovL3d3dy5nbG9iZW5ld3N3aXJlLmNvbS9uZXdzLXJlbGVhc2UvMjAyMy8xMS8wNy8yNzc1MDEzLzAvZW4vQ0VYLUlPLXMtSGVhZC1vZi1GaW5hbmNpYWwtQ3JpbWUtTWFyay1UYXlsb3ItdG8tSm9pbi1QYW5lbC1Pcmdhbml6ZWQtYnktRnV0dXJlLUlkZW50aXR5Lmh0bWzSAQA?hl=en-IN&gl=IN&ceid=IN%3Aen,2023-11-07
44,Global Voice Activated Transactions Market Is Expected to Grow at A Stable CAGR During the Forecast Period (20,openPR,news.google.com/articles/CBMiYmh0dHBzOi8vd3d3Lm9wZW5wci5jb20vbmV3cy8zMjc4NTcxL2dsb2JhbC12b2ljZS1hY3RpdmF0ZWQtdHJhbnNhY3Rpb25zLW1hcmtldC1pcy1leHBlY3RlZC10by1ncm930gFhaHR0cHM6Ly93d3cub3BlbnByLmNvbS9hbXAvMzI3ODU3MS9nbG9iYWwtdm9pY2UtYWN0aXZhdGVkLXRyYW5zYWN0aW9ucy1tYXJrZXQtaXMtZXhwZWN0ZWQtdG8tZ3Jvdw?hl=en-IN&gl=IN&ceid=IN%3Aen,2023-11-07
13,Quantum HR Strategy: Building Agile and Resilient Workplaces for Tomorrow | Mint,Mint,news.google.com/articles/CBMigwFodHRwczovL3d3dy5saXZlbWludC5jb20vYnJhbmQtc3Rvcmllcy9xdWFudHVtLWhyLXN0cmF0ZWd5LWJ1aWxkaW5nLWFnaWxlLWFuZC1yZXNpbGllbnQtd29ya3BsYWNlcy1mb3ItdG9tb3Jyb3ctMTE2OTg3NTIxNTc1MjQuaHRtbNIBhwFodHRwczovL3d3dy5saXZlbWludC5jb20vYnJhbmQtc3Rvcmllcy9xdWFudHVtLWhyLXN0cmF0ZWd5LWJ1aWxkaW5nLWFnaWxlLWFuZC1yZXNpbGllbnQtd29ya3BsYWNlcy1mb3ItdG9tb3Jyb3cvYW1wLTExNjk4NzUyMTU3NTI0Lmh0bWw?hl=en-IN&gl=IN&ceid=IN%3Aen,2023-11-06
14,"Commercial Vehicle Aluminum Casting Market Size, Incredible Possibilities and Growth Analysis and Forecast To",openPR,news.google.com/articles/CBMiXmh0dHBzOi8vd3d3Lm9wZW5wci5jb20vbmV3cy8zMjc2NDUzL2NvbW1lcmNpYWwtdmVoaWNsZS1hbHVtaW51bS1jYXN0aW5nLW1hcmtldC1zaXplLWluY3JlZGlibGXSAV1odHRwczovL3d3dy5vcGVucHIuY29tL2FtcC8zMjc2NDUzL2NvbW1lcmNpYWwtdmVoaWNsZS1hbHVtaW51bS1jYXN0aW5nLW1hcmtldC1zaXplLWluY3JlZGlibGU?hl=en-IN&gl=IN&ceid=IN%3Aen,2023-11-06
16,"Incredible Growth of Workforce Connect Solution Market 2023 by Share, Size, Growth, Segments, Revenue and Top",openPR,news.google.com/articles/CBMiX2h0dHBzOi8vd3d3Lm9wZW5wci5jb20vbmV3cy8zMjc3MDU4L2luY3JlZGlibGUtZ3Jvd3RoLW9mLXdvcmtmb3JjZS1jb25uZWN0LXNvbHV0aW9uLW1hcmtldC0yMDIz0gFeaHR0cHM6Ly93d3cub3BlbnByLmNvbS9hbXAvMzI3NzA1OC9pbmNyZWRpYmxlLWdyb3d0aC1vZi13b3JrZm9yY2UtY29ubmVjdC1zb2x1dGlvbi1tYXJrZXQtMjAyMw?hl=en-IN&gl=IN&ceid=IN%3Aen,2023-11-06
