,title,source,link,date
67,"Based on recent market research, the Insect Pheromones market is expected to witness intense competition",Benzinga,news.google.com/articles/CBMimQFodHRwczovL3d3dy5iZW56aW5nYS5jb20vcHJlc3NyZWxlYXNlcy8yMy8wOS8zNDE5MjM0My9iYXNlZC1vbi1yZWNlbnQtbWFya2V0LXJlc2VhcmNoLXRoZS1pbnNlY3QtcGhlcm9tb25lcy1tYXJrZXQtaXMtZXhwZWN0ZWQtdG8td2l0bmVzcy1pbnRlbnNlLWNvbXBldGnSAS1odHRwczovL3d3dy5iZW56aW5nYS5jb20vYW1wL2NvbnRlbnQvMzQxOTIzNDM?hl=en-IN&gl=IN&ceid=IN%3Aen,2023-09-03
95,"Tetrafluoropropanol Market Scope and Size: Company profiles and market share analysis from 2023 to 2030,",Benzinga,news.google.com/articles/CBMimQFodHRwczovL3d3dy5iZW56aW5nYS5jb20vcHJlc3NyZWxlYXNlcy8yMy8wOS8zNDE5MTQ4Mi90ZXRyYWZsdW9yb3Byb3Bhbm9sLW1hcmtldC1zY29wZS1hbmQtc2l6ZS1jb21wYW55LXByb2ZpbGVzLWFuZC1tYXJrZXQtc2hhcmUtYW5hbHlzaXMtZnJvbS0yMDIzLXRvLTLSAS1odHRwczovL3d3dy5iZW56aW5nYS5jb20vYW1wL2NvbnRlbnQvMzQxOTE0ODI?hl=en-IN&gl=IN&ceid=IN%3Aen,2023-09-02
19,"Inclement weather, scab hit apple production in Kashmir",Greater Kashmir,news.google.com/articles/CBMiYmh0dHBzOi8vd3d3LmdyZWF0ZXJrYXNobWlyLmNvbS9mcm9udC1wYWdlLTIvaW5jbGVtZW50LXdlYXRoZXItc2NhYi1oaXQtYXBwbGUtcHJvZHVjdGlvbi1pbi1rYXNobWly0gFsaHR0cHM6Ly93d3cuZ3JlYXRlcmthc2htaXIuY29tL2FtcC9zdG9yeS9mcm9udC1wYWdlLTIvaW5jbGVtZW50LXdlYXRoZXItc2NhYi1oaXQtYXBwbGUtcHJvZHVjdGlvbi1pbi1rYXNobWly?hl=en-IN&gl=IN&ceid=IN%3Aen,2023-09-02
73,The Thioacetamide market trend analysis indicates a positive outlook with a projected CAGR of 6.5% from 2,Benzinga,news.google.com/articles/CBMimQFodHRwczovL3d3dy5iZW56aW5nYS5jb20vcHJlc3NyZWxlYXNlcy8yMy8wOS8zNDE5MTYyNi90aGUtdGhpb2FjZXRhbWlkZS1tYXJrZXQtdHJlbmQtYW5hbHlzaXMtaW5kaWNhdGVzLWEtcG9zaXRpdmUtb3V0bG9vay13aXRoLWEtcHJvamVjdGVkLWNhZ3Itb2YtNi01LWbSAS1odHRwczovL3d3dy5iZW56aW5nYS5jb20vYW1wL2NvbnRlbnQvMzQxOTE2MjY?hl=en-IN&gl=IN&ceid=IN%3Aen,2023-09-02
84,Market Analysis and Revenue Forecast for the Tripropylamine market with a growing CAGR rate of 9.4% durin,Benzinga,news.google.com/articles/CBMimQFodHRwczovL3d3dy5iZW56aW5nYS5jb20vcHJlc3NyZWxlYXNlcy8yMy8wOS8zNDE5MTYxNS9tYXJrZXQtYW5hbHlzaXMtYW5kLXJldmVudWUtZm9yZWNhc3QtZm9yLXRoZS10cmlwcm9weWxhbWluZS1tYXJrZXQtd2l0aC1hLWdyb3dpbmctY2Fnci1yYXRlLW9mLTktNC3SAS1odHRwczovL3d3dy5iZW56aW5nYS5jb20vYW1wL2NvbnRlbnQvMzQxOTE2MTU?hl=en-IN&gl=IN&ceid=IN%3Aen,2023-09-02
85,"The Triisopropyl Borate market is expected to witness significant growth from 2023 to 2030, with a projec",Benzinga,news.google.com/articles/CBMimQFodHRwczovL3d3dy5iZW56aW5nYS5jb20vcHJlc3NyZWxlYXNlcy8yMy8wOS8zNDE5MTU4OS90aGUtdHJpaXNvcHJvcHlsLWJvcmF0ZS1tYXJrZXQtaXMtZXhwZWN0ZWQtdG8td2l0bmVzcy1zaWduaWZpY2FudC1ncm93dGgtZnJvbS0yMDIzLXRvLTIwMzAtd2l0aC1hLXDSAS1odHRwczovL3d3dy5iZW56aW5nYS5jb20vYW1wL2NvbnRlbnQvMzQxOTE1ODk?hl=en-IN&gl=IN&ceid=IN%3Aen,2023-09-02
88,"The Triethyl Orthoacetate market analysis report details its developing growth and global market, which i",Benzinga,news.google.com/articles/CBMimQFodHRwczovL3d3dy5iZW56aW5nYS5jb20vcHJlc3NyZWxlYXNlcy8yMy8wOS8zNDE5MTM0NS90aGUtdHJpZXRoeWwtb3J0aG9hY2V0YXRlLW1hcmtldC1hbmFseXNpcy1yZXBvcnQtZGV0YWlscy1pdHMtZGV2ZWxvcGluZy1ncm93dGgtYW5kLWdsb2JhbC1tYXJrZXQtd2jSAS1odHRwczovL3d3dy5iZW56aW5nYS5jb20vYW1wL2NvbnRlbnQvMzQxOTEzNDU?hl=en-IN&gl=IN&ceid=IN%3Aen,2023-09-02
90,Potassium Ethylate market study provides users access to a comprehensive view and a complete company mark,Benzinga,news.google.com/articles/CBMimQFodHRwczovL3d3dy5iZW56aW5nYS5jb20vcHJlc3NyZWxlYXNlcy8yMy8wOS8zNDE5MTY4NS9wb3Rhc3NpdW0tZXRoeWxhdGUtbWFya2V0LXN0dWR5LXByb3ZpZGVzLXVzZXJzLWFjY2Vzcy10by1hLWNvbXByZWhlbnNpdmUtdmlldy1hbmQtYS1jb21wbGV0ZS1jb21wYW7SAS1odHRwczovL3d3dy5iZW56aW5nYS5jb20vYW1wL2NvbnRlbnQvMzQxOTE2ODU?hl=en-IN&gl=IN&ceid=IN%3Aen,2023-09-02
23,What is India Doing to Prevent Suicide?,DESIblitz,news.google.com/articles/CBMiSGh0dHBzOi8vd3d3LmRlc2libGl0ei5jb20vY29udGVudC93aGF0LWlzLWluZGlhLWRvaW5nLXRvLXByZXZlbnQtc3VpY2lkZdIBAA?hl=en-IN&gl=IN&ceid=IN%3Aen,2023-09-02
79,"The Sulfanilic Acid market's types, applications, and regional analysis are all thoroughly covered in thi",Benzinga,news.google.com/articles/CBMimQFodHRwczovL3d3dy5iZW56aW5nYS5jb20vcHJlc3NyZWxlYXNlcy8yMy8wOS8zNDE5MDY0OS90aGUtc3VsZmFuaWxpYy1hY2lkLW1hcmtldHMtdHlwZXMtYXBwbGljYXRpb25zLWFuZC1yZWdpb25hbC1hbmFseXNpcy1hcmUtYWxsLXRob3JvdWdobHktY292ZXJlZC1pbi3SAS1odHRwczovL3d3dy5iZW56aW5nYS5jb20vYW1wL2NvbnRlbnQvMzQxOTA2NDk?hl=en-IN&gl=IN&ceid=IN%3Aen,2023-09-02
