,title,source,link,date
70,"Based on recent market research, the Insect Pheromones market is expected to witness intense competition",Benzinga,news.google.com/articles/CBMimQFodHRwczovL3d3dy5iZW56aW5nYS5jb20vcHJlc3NyZWxlYXNlcy8yMy8wOS8zNDE5MjM0My9iYXNlZC1vbi1yZWNlbnQtbWFya2V0LXJlc2VhcmNoLXRoZS1pbnNlY3QtcGhlcm9tb25lcy1tYXJrZXQtaXMtZXhwZWN0ZWQtdG8td2l0bmVzcy1pbnRlbnNlLWNvbXBldGnSAS1odHRwczovL3d3dy5iZW56aW5nYS5jb20vYW1wL2NvbnRlbnQvMzQxOTIzNDM?hl=en-IN&gl=IN&ceid=IN%3Aen,2023-09-03
84,Organic Surfactants Market Overview: Industry Worth and Growth ...,Benzinga,news.google.com/articles/CBMimQFodHRwczovL3d3dy5iZW56aW5nYS5jb20vcHJlc3NyZWxlYXNlcy8yMy8wOS8zNDE5MjUwMi9vcmdhbmljLXN1cmZhY3RhbnRzLW1hcmtldC1vdmVydmlldy1pbmR1c3RyeS13b3J0aC1hbmQtZ3Jvd3RoLXBvdGVudGlhbC1yZWdhcmRpbmctcHJvcGVyLWNhZ3Itb2YtOC3SAQA?hl=en-IN&gl=IN&ceid=IN%3Aen,2023-09-03
98,Potassium Ethylate market study provides users access to a comprehensive view and a complete company mark,Benzinga,news.google.com/articles/CBMimQFodHRwczovL3d3dy5iZW56aW5nYS5jb20vcHJlc3NyZWxlYXNlcy8yMy8wOS8zNDE5MTY4NS9wb3Rhc3NpdW0tZXRoeWxhdGUtbWFya2V0LXN0dWR5LXByb3ZpZGVzLXVzZXJzLWFjY2Vzcy10by1hLWNvbXByZWhlbnNpdmUtdmlldy1hbmQtYS1jb21wbGV0ZS1jb21wYW7SAS1odHRwczovL3d3dy5iZW56aW5nYS5jb20vYW1wL2NvbnRlbnQvMzQxOTE2ODU?hl=en-IN&gl=IN&ceid=IN%3Aen,2023-09-02
83,"A detailed analysis of the Pivaloylacetonitrile market's size, dynamics, and anticipated development from",Benzinga,news.google.com/articles/CBMimQFodHRwczovL3d3dy5iZW56aW5nYS5jb20vcHJlc3NyZWxlYXNlcy8yMy8wOS8zNDE5MTY2Ny9hLWRldGFpbGVkLWFuYWx5c2lzLW9mLXRoZS1waXZhbG95bGFjZXRvbml0cmlsZS1tYXJrZXRzLXNpemUtZHluYW1pY3MtYW5kLWFudGljaXBhdGVkLWRldmVsb3BtZW50LWbSAS1odHRwczovL3d3dy5iZW56aW5nYS5jb20vYW1wL2NvbnRlbnQvMzQxOTE2Njc?hl=en-IN&gl=IN&ceid=IN%3Aen,2023-09-02
85,"The Sulfanilic Acid market's types, applications, and regional analysis are all thoroughly covered in thi",Benzinga,news.google.com/articles/CBMimQFodHRwczovL3d3dy5iZW56aW5nYS5jb20vcHJlc3NyZWxlYXNlcy8yMy8wOS8zNDE5MDY0OS90aGUtc3VsZmFuaWxpYy1hY2lkLW1hcmtldHMtdHlwZXMtYXBwbGljYXRpb25zLWFuZC1yZWdpb25hbC1hbmFseXNpcy1hcmUtYWxsLXRob3JvdWdobHktY292ZXJlZC1pbi3SAS1odHRwczovL3d3dy5iZW56aW5nYS5jb20vYW1wL2NvbnRlbnQvMzQxOTA2NDk?hl=en-IN&gl=IN&ceid=IN%3Aen,2023-09-02
24,What is India Doing to Prevent Suicide?,DESIblitz,news.google.com/articles/CBMiSGh0dHBzOi8vd3d3LmRlc2libGl0ei5jb20vY29udGVudC93aGF0LWlzLWluZGlhLWRvaW5nLXRvLXByZXZlbnQtc3VpY2lkZdIBAA?hl=en-IN&gl=IN&ceid=IN%3Aen,2023-09-02
22,Just add water: How the gardens of the future are transforming food ...,Lock Haven Express,news.google.com/articles/CBMid2h0dHBzOi8vd3d3LmxvY2toYXZlbi5jb20vbmV3cy9nYXJkZW4vMjAyMy8wOS9qdXN0LWFkZC13YXRlci1ob3ctdGhlLWdhcmRlbnMtb2YtdGhlLWZ1dHVyZS1hcmUtdHJhbnNmb3JtaW5nLWZvb2QtdG9kYXkv0gEA?hl=en-IN&gl=IN&ceid=IN%3Aen,2023-09-02
20,"Inclement weather, scab hit apple production in Kashmir",Greater Kashmir,news.google.com/articles/CBMiYmh0dHBzOi8vd3d3LmdyZWF0ZXJrYXNobWlyLmNvbS9mcm9udC1wYWdlLTIvaW5jbGVtZW50LXdlYXRoZXItc2NhYi1oaXQtYXBwbGUtcHJvZHVjdGlvbi1pbi1rYXNobWly0gFsaHR0cHM6Ly93d3cuZ3JlYXRlcmthc2htaXIuY29tL2FtcC9zdG9yeS9mcm9udC1wYWdlLTIvaW5jbGVtZW50LXdlYXRoZXItc2NhYi1oaXQtYXBwbGUtcHJvZHVjdGlvbi1pbi1rYXNobWly?hl=en-IN&gl=IN&ceid=IN%3Aen,2023-09-02
76,The Thioacetamide market trend analysis indicates a positive outlook with a projected CAGR of 6.5% from 2,Benzinga,news.google.com/articles/CBMimQFodHRwczovL3d3dy5iZW56aW5nYS5jb20vcHJlc3NyZWxlYXNlcy8yMy8wOS8zNDE5MTYyNi90aGUtdGhpb2FjZXRhbWlkZS1tYXJrZXQtdHJlbmQtYW5hbHlzaXMtaW5kaWNhdGVzLWEtcG9zaXRpdmUtb3V0bG9vay13aXRoLWEtcHJvamVjdGVkLWNhZ3Itb2YtNi01LWbSAS1odHRwczovL3d3dy5iZW56aW5nYS5jb20vYW1wL2NvbnRlbnQvMzQxOTE2MjY?hl=en-IN&gl=IN&ceid=IN%3Aen,2023-09-02
87,Market Analysis and Revenue Forecast for the Tripropylamine market with a growing CAGR rate of 9.4% durin,Benzinga,news.google.com/articles/CBMimQFodHRwczovL3d3dy5iZW56aW5nYS5jb20vcHJlc3NyZWxlYXNlcy8yMy8wOS8zNDE5MTYxNS9tYXJrZXQtYW5hbHlzaXMtYW5kLXJldmVudWUtZm9yZWNhc3QtZm9yLXRoZS10cmlwcm9weWxhbWluZS1tYXJrZXQtd2l0aC1hLWdyb3dpbmctY2Fnci1yYXRlLW9mLTktNC3SAS1odHRwczovL3d3dy5iZW56aW5nYS5jb20vYW1wL2NvbnRlbnQvMzQxOTE2MTU?hl=en-IN&gl=IN&ceid=IN%3Aen,2023-09-02
