,title,source,link,date
84,The Faceplates market is projected to experience significant competition tracking and market size growth,Benzinga,news.google.com/articles/CBMimQFodHRwczovL3d3dy5iZW56aW5nYS5jb20vcHJlc3NyZWxlYXNlcy8yMy8wOS8zNDE5NDE5Mi90aGUtZmFjZXBsYXRlcy1tYXJrZXQtaXMtcHJvamVjdGVkLXRvLWV4cGVyaWVuY2Utc2lnbmlmaWNhbnQtY29tcGV0aXRpb24tdHJhY2tpbmctYW5kLW1hcmtldC1zaXplLWfSAS1odHRwczovL3d3dy5iZW56aW5nYS5jb20vYW1wL2NvbnRlbnQvMzQxOTQxOTI?hl=en-IN&gl=IN&ceid=IN%3Aen,2023-09-03
21,"Washington Trust Bancorp, Inc. (NASDAQ:WASH) Shares Acquired ...",MarketBeat,news.google.com/articles/CBMiTGh0dHBzOi8vd3d3Lm1hcmtldGJlYXQuY29tL2luc3RhbnQtYWxlcnRzL25hc2RhcS13YXNoLXNlYy1maWxpbmctMjAyMy0wOS0wMS_SAQA?hl=en-IN&gl=IN&ceid=IN%3Aen,2023-09-03
82,"RPMI Media market analysis report discusses the impact of Covid-19, marketing channels, economic revital",Benzinga,news.google.com/articles/CBMimQFodHRwczovL3d3dy5iZW56aW5nYS5jb20vcHJlc3NyZWxlYXNlcy8yMy8wOS8zNDE5NDI5Ny9ycG1pLW1lZGlhLW1hcmtldC1hbmFseXNpcy1yZXBvcnQtZGlzY3Vzc2VzLXRoZS1pbXBhY3Qtb2YtY292aWQtMTktbWFya2V0aW5nLWNoYW5uZWxzLWVjb25vbWljLXJldmnSAS1odHRwczovL3d3dy5iZW56aW5nYS5jb20vYW1wL2NvbnRlbnQvMzQxOTQyOTc?hl=en-IN&gl=IN&ceid=IN%3Aen,2023-09-03
80,Floor Care Equipment Market: Market Overview and Forecast with a thorough overview of 7.7% CAGR and a con,Benzinga,news.google.com/articles/CBMimQFodHRwczovL3d3dy5iZW56aW5nYS5jb20vcHJlc3NyZWxlYXNlcy8yMy8wOS8zNDE5Mzg5MS9mbG9vci1jYXJlLWVxdWlwbWVudC1tYXJrZXQtbWFya2V0LW92ZXJ2aWV3LWFuZC1mb3JlY2FzdC13aXRoLWEtdGhvcm91Z2gtb3ZlcnZpZXctb2YtNy03LWNhZ3ItYW5kLWHSAS1odHRwczovL3d3dy5iZW56aW5nYS5jb20vYW1wL2NvbnRlbnQvMzQxOTM4OTE?hl=en-IN&gl=IN&ceid=IN%3Aen,2023-09-03
72,Nickel Sulphamate Solution market Analysis and Revenue Forecast: Exploring Growth Opportunities growing C,Benzinga,news.google.com/articles/CBMimQFodHRwczovL3d3dy5iZW56aW5nYS5jb20vcHJlc3NyZWxlYXNlcy8yMy8wOS8zNDE5NDM3NS9uaWNrZWwtc3VscGhhbWF0ZS1zb2x1dGlvbi1tYXJrZXQtYW5hbHlzaXMtYW5kLXJldmVudWUtZm9yZWNhc3QtZXhwbG9yaW5nLWdyb3d0aC1vcHBvcnR1bml0aWVzLWdyb3fSAS1odHRwczovL3d3dy5iZW56aW5nYS5jb20vYW1wL2NvbnRlbnQvMzQxOTQzNzU?hl=en-IN&gl=IN&ceid=IN%3Aen,2023-09-03
64,"The Trypsin Solution market's size, share, and revenue will be scrutinized, with an anticipated CAGR of 1",Benzinga,news.google.com/articles/CBMimQFodHRwczovL3d3dy5iZW56aW5nYS5jb20vcHJlc3NyZWxlYXNlcy8yMy8wOS8zNDE5NDMwNC90aGUtdHJ5cHNpbi1zb2x1dGlvbi1tYXJrZXRzLXNpemUtc2hhcmUtYW5kLXJldmVudWUtd2lsbC1iZS1zY3J1dGluaXplZC13aXRoLWFuLWFudGljaXBhdGVkLWNhZ3Itb2bSAS1odHRwczovL3d3dy5iZW56aW5nYS5jb20vYW1wL2NvbnRlbnQvMzQxOTQzMDQ?hl=en-IN&gl=IN&ceid=IN%3Aen,2023-09-03
9,"Marcus & Millichap, Inc. (NYSE:MMI) Shares Sold by Russell ...",MarketBeat,news.google.com/articles/CBMiSWh0dHBzOi8vd3d3Lm1hcmtldGJlYXQuY29tL2luc3RhbnQtYWxlcnRzL255c2UtbW1pLXNlYy1maWxpbmctMjAyMy0wOS0wMy_SAQA?hl=en-IN&gl=IN&ceid=IN%3Aen,2023-09-03
58,Forecasting the Fixed Firefighting Systems Market's Growth with a 9.7% CAGR and COVID-19 Impact Analysis,Benzinga,news.google.com/articles/CBMimQFodHRwczovL3d3dy5iZW56aW5nYS5jb20vcHJlc3NyZWxlYXNlcy8yMy8wOS8zNDE5Mzg3NS9mb3JlY2FzdGluZy10aGUtZml4ZWQtZmlyZWZpZ2h0aW5nLXN5c3RlbXMtbWFya2V0cy1ncm93dGgtd2l0aC1hLTktNy1jYWdyLWFuZC1jb3ZpZC0xOS1pbXBhY3QtYW5hbHnSAS1odHRwczovL3d3dy5iZW56aW5nYS5jb20vYW1wL2NvbnRlbnQvMzQxOTM4NzU?hl=en-IN&gl=IN&ceid=IN%3Aen,2023-09-03
39,Market Analysis Report highlights the key trends and drivers that are shaping the Solid NaOH market with,Benzinga,news.google.com/articles/CBMimQFodHRwczovL3d3dy5iZW56aW5nYS5jb20vcHJlc3NyZWxlYXNlcy8yMy8wOS8zNDE5NDIxMi9tYXJrZXQtYW5hbHlzaXMtcmVwb3J0LWhpZ2hsaWdodHMtdGhlLWtleS10cmVuZHMtYW5kLWRyaXZlcnMtdGhhdC1hcmUtc2hhcGluZy10aGUtc29saWQtbmFvaC1tYXJrZXTSAS1odHRwczovL3d3dy5iZW56aW5nYS5jb20vYW1wL2NvbnRlbnQvMzQxOTQyMTI?hl=en-IN&gl=IN&ceid=IN%3Aen,2023-09-03
31,"‘There’s a very real danger here’: AOC on 2024, the climate crisis and ‘selling out’",The Guardian US,news.google.com/articles/CBMiXGh0dHBzOi8vd3d3LnRoZWd1YXJkaWFuLmNvbS91cy1uZXdzLzIwMjMvc2VwLzAzL2FvYy1pbnRlcnZpZXctMjAyNC1lbGVjdGlvbi1jbGltYXRlLWRlbW9jcmF00gFcaHR0cHM6Ly9hbXAudGhlZ3VhcmRpYW4uY29tL3VzLW5ld3MvMjAyMy9zZXAvMDMvYW9jLWludGVydmlldy0yMDI0LWVsZWN0aW9uLWNsaW1hdGUtZGVtb2NyYXQ?hl=en-IN&gl=IN&ceid=IN%3Aen,2023-09-03
