,title,source,link,date
1,Charles County students can register for the 2023 Fall Chess ...,Charles County Public Schools,news.google.com/articles/CBMimAFodHRwczovL3d3dy5jY2JvZS5jb20vYWJvdXQvcHVibGljLWluZm8tbWVkaWEvZGV0YWlscy9-Ym9hcmQvcHJlc3MtcmVsZWFzZXMvcG9zdC9jaGFybGVzLWNvdW50eS1zdHVkZW50cy1jYW4tcmVnaXN0ZXItZm9yLXRoZS0yMDIzLWZhbGwtY2hlc3MtdG91cm5hbWVudNIBAA?hl=en-IN&gl=IN&ceid=IN%3Aen,2023-09-29
2,Service mettle — Building Service Worker Day is Oct. 2 | details,Charles County Public Schools,news.google.com/articles/CBMihAFodHRwczovL3d3dy5jY2JvZS5jb20vYWJvdXQvcHVibGljLWluZm8tbWVkaWEvZGV0YWlscy9-Ym9hcmQvcHJlc3MtcmVsZWFzZXMvcG9zdC9zZXJ2aWNlLW1ldHRsZS1idWlsZGluZy1zZXJ2aWNlLXdvcmtlci1kYXktaXMtb2N0LTLSAQA?hl=en-IN&gl=IN&ceid=IN%3Aen,2023-09-29
3,State releases additional assessment data from last school year,Charles County Public Schools,news.google.com/articles/CBMikAFodHRwczovL3d3dy5jY2JvZS5jb20vYWJvdXQvcHVibGljLWluZm8tbWVkaWEvZGV0YWlscy9-Ym9hcmQvcHJlc3MtcmVsZWFzZXMvcG9zdC9zdGF0ZS1yZWxlYXNlcy1hZGRpdGlvbmFsLWFzc2Vzc21lbnQtZGF0YS1mcm9tLWxhc3Qtc2Nob29sLXllYXLSAQA?hl=en-IN&gl=IN&ceid=IN%3Aen,2023-09-29
4,Art as a passport — Works by North Point students in University of ...,Charles County Public Schools,news.google.com/articles/CBMipAFodHRwczovL3d3dy5jY2JvZS5jb20vYWJvdXQvcHVibGljLWluZm8tbWVkaWEvZGV0YWlscy9-Ym9hcmQvcHJlc3MtcmVsZWFzZXMvcG9zdC9hcnQtYXMtYS1wYXNzcG9ydC13b3Jrcy1ieS1ub3J0aC1wb2ludC1zdHVkZW50cy1pbi11bml2ZXJzaXR5LW9mLWNhcnRhZ2VuYS1hcnQtc2hvd9IBAA?hl=en-IN&gl=IN&ceid=IN%3Aen,2023-09-28
6,Board votes to amend 2024-2025 school calendar | details,Charles County Public Schools,news.google.com/articles/CBMif2h0dHBzOi8vd3d3LmNjYm9lLmNvbS9hYm91dC9wdWJsaWMtaW5mby1tZWRpYS9kZXRhaWxzL35ib2FyZC9wcmVzcy1yZWxlYXNlcy9wb3N0L2JvYXJkLXZvdGVzLXRvLWFtZW5kLTIwMjQtMjAyNS1zY2hvb2wtY2FsZW5kYXLSAQA?hl=en-IN&gl=IN&ceid=IN%3Aen,2023-09-27
5,CCPS juniors and seniors to attend College Fair Oct. 3,Charles County Public Schools,news.google.com/articles/CBMihgFodHRwczovL3d3dy5jY2JvZS5jb20vYWJvdXQvcHVibGljLWluZm8tbWVkaWEvZGV0YWlscy9-Ym9hcmQvcHJlc3MtcmVsZWFzZXMvcG9zdC9jY3BzLWp1bmlvcnMtYW5kLXNlbmlvcnMtdG8tYXR0ZW5kLWNvbGxlZ2UtZmFpci1vY3QtM9IBAA?hl=en-IN&gl=IN&ceid=IN%3Aen,2023-09-25
8,Extended day program offered to students at five high schools,Charles County Public Schools,news.google.com/articles/CBMijgFodHRwczovL3d3dy5jY2JvZS5jb20vYWJvdXQvcHVibGljLWluZm8tbWVkaWEvZGV0YWlscy9-Ym9hcmQvcHJlc3MtcmVsZWFzZXMvcG9zdC9leHRlbmRlZC1kYXktcHJvZ3JhbS1vZmZlcmVkLXRvLXN0dWRlbnRzLWF0LWZpdmUtaGlnaC1zY2hvb2xz0gEA?hl=en-IN&gl=IN&ceid=IN%3Aen,2023-09-25
14,Car Dealer Software Market 2023 | Future Expansions and Analysis and Insights by 2030,Benzinga,news.google.com/articles/CBMiiQFodHRwczovL3d3dy5iZW56aW5nYS5jb20vcHJlc3NyZWxlYXNlcy8yMy8wOS8zNDg0Nzk2Ni9jYXItZGVhbGVyLXNvZnR3YXJlLW1hcmtldC0yMDIzLWZ1dHVyZS1leHBhbnNpb25zLWFuZC1hbmFseXNpcy1hbmQtaW5zaWdodHMtYnktMjAzMNIBLWh0dHBzOi8vd3d3LmJlbnppbmdhLmNvbS9hbXAvY29udGVudC8zNDg0Nzk2Ng?hl=en-IN&gl=IN&ceid=IN%3Aen,2023-09-25
16,"Auto Dealer Software Market Growth Analysis by Size and Share 2023 | Opportunities, Market Dynamics and F",Benzinga,news.google.com/articles/CBMimQFodHRwczovL3d3dy5iZW56aW5nYS5jb20vcHJlc3NyZWxlYXNlcy8yMy8wOS8zNDg4MTcwMS9hdXRvLWRlYWxlci1zb2Z0d2FyZS1tYXJrZXQtZ3Jvd3RoLWFuYWx5c2lzLWJ5LXNpemUtYW5kLXNoYXJlLTIwMjMtb3Bwb3J0dW5pdGllcy1tYXJrZXQtZHluYW1pY3MtYW7SAS1odHRwczovL3d3dy5iZW56aW5nYS5jb20vYW1wL2NvbnRlbnQvMzQ4ODE3MDE?hl=en-IN&gl=IN&ceid=IN%3Aen,2023-09-25
7,CCPS seeking feedback on proposed Educational Equity policy ...,Charles County Public Schools,news.google.com/articles/CBMilAFodHRwczovL3d3dy5jY2JvZS5jb20vYWJvdXQvcHVibGljLWluZm8tbWVkaWEvZGV0YWlscy9-Ym9hcmQvcHJlc3MtcmVsZWFzZXMvcG9zdC9jY3BzLXNlZWtpbmctZmVlZGJhY2stb24tcHJvcG9zZWQtZWR1Y2F0aW9uYWwtZXF1aXR5LXBvbGljeS1jaGFuZ2Vz0gEA?hl=en-IN&gl=IN&ceid=IN%3Aen,2023-09-20
