,title,source,link,date
0,CCPS receives coat donations from bus contractor association ...,Charles County Public Schools,news.google.com/articles/CBMirwFodHRwczovL3d3dy5jY2JvZS5jb20vYWJvdXQvcHVibGljLWluZm8tbWVkaWEvZGV0YWlscy9-Ym9hcmQvcHJlc3MtcmVsZWFzZXMvcG9zdC9jY3BzLXJlY2VpdmVzLWNvYXQtZG9uYXRpb25zLWZyb20tYnVzLWNvbnRyYWN0b3ItYXNzb2NpYXRpb24tbW9yZS10aGFuLTI1MC10by1iZW5lZml0LXN0dWRlbnRz0gEA?hl=en-IN&gl=IN&ceid=IN%3Aen,2023-11-03
1,CCPS seeks name suggestions for Elementary School No. 23 ...,Charles County Public Schools,news.google.com/articles/CBMiqwFodHRwczovL3d3dy5jY2JvZS5jb20vYWJvdXQvcHVibGljLWluZm8tbWVkaWEvZGV0YWlscy9-Ym9hcmQvcHJlc3MtcmVsZWFzZXMvcG9zdC9jY3BzLXNlZWtzLW5hbWUtc3VnZ2VzdGlvbnMtZm9yLWVsZW1lbnRhcnktc2Nob29sLW5vLTIzLWRlYWRsaW5lLXRvLXN1Ym1pdC1hLW5hbWUtaXMtZGVjLTHSAQA?hl=en-IN&gl=IN&ceid=IN%3Aen,2023-11-03
6,The Metals Company Releases Second Annual Impact Report,StreetInsider.com,news.google.com/articles/CBMicmh0dHBzOi8vd3d3LnN0cmVldGluc2lkZXIuY29tL0dsb2JlK05ld3N3aXJlL1RoZStNZXRhbHMrQ29tcGFueStSZWxlYXNlcytTZWNvbmQrQW5udWFsK0ltcGFjdCtSZXBvcnQvMjIzMzY3MzkuaHRtbNIBAA?hl=en-IN&gl=IN&ceid=IN%3Aen,2023-10-31
2,Nominate an outstanding teacher for Teacher of the Year,Charles County Public Schools,news.google.com/articles/CBMiiAFodHRwczovL3d3dy5jY2JvZS5jb20vYWJvdXQvcHVibGljLWluZm8tbWVkaWEvZGV0YWlscy9-Ym9hcmQvcHJlc3MtcmVsZWFzZXMvcG9zdC9ub21pbmF0ZS1hbi1vdXRzdGFuZGluZy10ZWFjaGVyLWZvci10ZWFjaGVyLW9mLXRoZS15ZWFy0gEA?hl=en-IN&gl=IN&ceid=IN%3Aen,2023-10-30
3,Board of Education selects Samichie Thomas to fill District 1 vacancy,Charles County Public Schools,news.google.com/articles/CBMilgFodHRwczovL3d3dy5jY2JvZS5jb20vYWJvdXQvcHVibGljLWluZm8tbWVkaWEvZGV0YWlscy9-Ym9hcmQvcHJlc3MtcmVsZWFzZXMvcG9zdC9ib2FyZC1vZi1lZHVjYXRpb24tc2VsZWN0cy1zYW1pY2hpZS10aG9tYXMtdG8tZmlsbC1kaXN0cmljdC0xLXZhY2FuY3nSAQA?hl=en-IN&gl=IN&ceid=IN%3Aen,2023-10-24
