,title,source,link,date
1,CCPS seeking Blueprint work group volunteers | details,Charles County Public Schools,news.google.com/articles/CBMifWh0dHBzOi8vd3d3LmNjYm9lLmNvbS9hYm91dC9wdWJsaWMtaW5mby1tZWRpYS9kZXRhaWxzL35ib2FyZC9wcmVzcy1yZWxlYXNlcy9wb3N0L2NjcHMtc2Vla2luZy1ibHVlcHJpbnQtd29yay1ncm91cC12b2x1bnRlZXJz0gEA?hl=en-IN&gl=IN&ceid=IN%3Aen,2023-10-02
2,Service mettle — Building Service Worker Day is Oct. 2 | details,Charles County Public Schools,news.google.com/articles/CBMihAFodHRwczovL3d3dy5jY2JvZS5jb20vYWJvdXQvcHVibGljLWluZm8tbWVkaWEvZGV0YWlscy9-Ym9hcmQvcHJlc3MtcmVsZWFzZXMvcG9zdC9zZXJ2aWNlLW1ldHRsZS1idWlsZGluZy1zZXJ2aWNlLXdvcmtlci1kYXktaXMtb2N0LTLSAQA?hl=en-IN&gl=IN&ceid=IN%3Aen,2023-09-29
3,State releases additional assessment data from last school year,Charles County Public Schools,news.google.com/articles/CBMikAFodHRwczovL3d3dy5jY2JvZS5jb20vYWJvdXQvcHVibGljLWluZm8tbWVkaWEvZGV0YWlscy9-Ym9hcmQvcHJlc3MtcmVsZWFzZXMvcG9zdC9zdGF0ZS1yZWxlYXNlcy1hZGRpdGlvbmFsLWFzc2Vzc21lbnQtZGF0YS1mcm9tLWxhc3Qtc2Nob29sLXllYXLSAQA?hl=en-IN&gl=IN&ceid=IN%3Aen,2023-09-29
4,CCPS juniors and seniors to attend College Fair Oct. 3,Charles County Public Schools,news.google.com/articles/CBMihgFodHRwczovL3d3dy5jY2JvZS5jb20vYWJvdXQvcHVibGljLWluZm8tbWVkaWEvZGV0YWlscy9-Ym9hcmQvcHJlc3MtcmVsZWFzZXMvcG9zdC9jY3BzLWp1bmlvcnMtYW5kLXNlbmlvcnMtdG8tYXR0ZW5kLWNvbGxlZ2UtZmFpci1vY3QtM9IBAA?hl=en-IN&gl=IN&ceid=IN%3Aen,2023-09-25
5,Extended day program offered to students at five high schools,Charles County Public Schools,news.google.com/articles/CBMijgFodHRwczovL3d3dy5jY2JvZS5jb20vYWJvdXQvcHVibGljLWluZm8tbWVkaWEvZGV0YWlscy9-Ym9hcmQvcHJlc3MtcmVsZWFzZXMvcG9zdC9leHRlbmRlZC1kYXktcHJvZ3JhbS1vZmZlcmVkLXRvLXN0dWRlbnRzLWF0LWZpdmUtaGlnaC1zY2hvb2xz0gEA?hl=en-IN&gl=IN&ceid=IN%3Aen,2023-09-25
