,title,source,link,date
8,2023-11-21 | Press Release | Top 5 Most Popular Casino Payment ...,Stockhouse Publishing,news.google.com/articles/CBMiaWh0dHBzOi8vc3RvY2tob3VzZS5jb20vbmV3cy9wcmVzcy1yZWxlYXNlcy8yMDIzLzExLzIxL3RvcC01LW1vc3QtcG9wdWxhci1jYXNpbm8tcGF5bWVudC1tZXRob2RzLWluLWNhbmFkYdIBAA?hl=en-IN&gl=IN&ceid=IN%3Aen,2023-11-21
0,Board to host Nov. 27 work session | details,Charles County Public Schools,news.google.com/articles/CBMicmh0dHBzOi8vd3d3LmNjYm9lLmNvbS9hYm91dC9wdWJsaWMtaW5mby1tZWRpYS9kZXRhaWxzL35ib2FyZC9wcmVzcy1yZWxlYXNlcy9wb3N0L2JvYXJkLXRvLWhvc3Qtbm92LTI3LXdvcmstc2Vzc2lvbtIBAA?hl=en-IN&gl=IN&ceid=IN%3Aen,2023-11-20
1,"Legislative breakfast set for Monday, Nov. 27 | details",Charles County Public Schools,news.google.com/articles/CBMifGh0dHBzOi8vd3d3LmNjYm9lLmNvbS9hYm91dC9wdWJsaWMtaW5mby1tZWRpYS9kZXRhaWxzL35ib2FyZC9wcmVzcy1yZWxlYXNlcy9wb3N0L2xlZ2lzbGF0aXZlLWJyZWFrZmFzdC1zZXQtZm9yLW1vbmRheS1ub3YtMjfSAQA?hl=en-IN&gl=IN&ceid=IN%3Aen,2023-11-20
2,National Apprenticeship Week Celebrates Opportunities for ...,Charles County Public Schools,news.google.com/articles/CBMitgFodHRwczovL3d3dy5jY2JvZS5jb20vYWJvdXQvcHVibGljLWluZm8tbWVkaWEvZGV0YWlscy9-Ym9hcmQvcHJlc3MtcmVsZWFzZXMvcG9zdC9uYXRpb25hbC1hcHByZW50aWNlc2hpcC13ZWVrLWNlbGVicmF0ZXMtb3Bwb3J0dW5pdGllcy1mb3Itd29ya3BsYWNlLWV4cGVyaWVuY2UtYW5kLXNraWxscy1kZXZlbG9wbWVudNIBAA?hl=en-IN&gl=IN&ceid=IN%3Aen,2023-11-17
3,You 'autumn' know what the fall play schedule looks like High ...,Charles County Public Schools,news.google.com/articles/CBMitAFodHRwczovL3d3dy5jY2JvZS5jb20vYWJvdXQvcHVibGljLWluZm8tbWVkaWEvZGV0YWlscy9-Ym9hcmQvcHJlc3MtcmVsZWFzZXMvcG9zdC95b3UtYXV0dW1uLWtub3ctd2hhdC10aGUtZmFsbC1wbGF5LXNjaGVkdWxlLWxvb2tzLWxpa2UtaGlnaC1zY2hvb2xzLXN0YWdlLXNob3dzLXRoaXMtbW9udGgtYW5kLW5leHTSAQA?hl=en-IN&gl=IN&ceid=IN%3Aen,2023-11-16
4,"Science Center to offer new community experiences, hosting special ...",Charles County Public Schools,news.google.com/articles/CBMiqwFodHRwczovL3d3dy5jY2JvZS5jb20vYWJvdXQvcHVibGljLWluZm8tbWVkaWEvZGV0YWlscy9-Ym9hcmQvcHJlc3MtcmVsZWFzZXMvcG9zdC9zY2llbmNlLWNlbnRlci10by1vZmZlci1uZXctY29tbXVuaXR5LWV4cGVyaWVuY2VzLWhvc3Rpbmctc3BlY2lhbC13aW50ZXItZXZlbnRzLW5leHQtbW9udGjSAQA?hl=en-IN&gl=IN&ceid=IN%3Aen,2023-11-16
6,"CCPS staff donates to LifeStyles, Community Schools | details",Charles County Public Schools,news.google.com/articles/CBMigwFodHRwczovL3d3dy5jY2JvZS5jb20vYWJvdXQvcHVibGljLWluZm8tbWVkaWEvZGV0YWlscy9-Ym9hcmQvcHJlc3MtcmVsZWFzZXMvcG9zdC9jY3BzLXN0YWZmLWRvbmF0ZXMtdG8tbGlmZXN0eWxlcy1jb21tdW5pdHktc2Nob29sc9IBAA?hl=en-IN&gl=IN&ceid=IN%3Aen,2023-11-16
7,Board of Education recognizes exemplary students at November ...,Charles County Public Schools,news.google.com/articles/CBMimgFodHRwczovL3d3dy5jY2JvZS5jb20vYWJvdXQvcHVibGljLWluZm8tbWVkaWEvZGV0YWlscy9-Ym9hcmQvcHJlc3MtcmVsZWFzZXMvcG9zdC9ib2FyZC1vZi1lZHVjYXRpb24tcmVjb2duaXplcy1leGVtcGxhcnktc3R1ZGVudHMtYXQtbm92ZW1iZXItMjAyMy1tZWV0aW5n0gEA?hl=en-IN&gl=IN&ceid=IN%3Aen,2023-11-15
9,"CCPS, CSM expand Early College program to include industry ...",Charles County Public Schools,news.google.com/articles/CBMimAFodHRwczovL3d3dy5jY2JvZS5jb20vYWJvdXQvcHVibGljLWluZm8tbWVkaWEvZGV0YWlscy9-Ym9hcmQvcHJlc3MtcmVsZWFzZXMvcG9zdC9jY3BzY3NtLWV4cGFuZC1lYXJseS1jb2xsZWdlLXByb2dyYW0tdG8taW5jbHVkZS1pbmR1c3RyeS1jZXJ0aWZpY2F0aW9uc9IBAA?hl=en-IN&gl=IN&ceid=IN%3Aen,2023-11-13
5,"Cultivating a legacy — CCPS students, help plant native tree canopies",Charles County Public Schools,news.google.com/articles/CBMikwFodHRwczovL3d3dy5jY2JvZS5jb20vYWJvdXQvcHVibGljLWluZm8tbWVkaWEvZGV0YWlscy9-Ym9hcmQvcHJlc3MtcmVsZWFzZXMvcG9zdC9jdWx0aXZhdGluZy1hLWxlZ2FjeS1jY3BzLXN0dWRlbnRzLWhlbHAtcGxhbnQtbmF0aXZlLXRyZWUtY2Fub3BpZXPSAQA?hl=en-IN&gl=IN&ceid=IN%3Aen,2023-11-10
