,title,source,link,date
8,"Kyiv behind car bomb assassination, EU accession talks should start ...",Euronews,news.google.com/articles/CBMifmh0dHBzOi8vd3d3LmV1cm9uZXdzLmNvbS8yMDIzLzExLzA4L3J1c3NpYW4tb2ZmaWNpYWwta2lsbGVkLWluLWNhci1ibGFzdC1nNy12b3dzLXRvLW1haW50YWluLWt5aXYtc3VwcG9ydC11cy1iYWNrcy11a3JhaW5lLWRlbdIBAA?hl=en-IN&gl=IN&ceid=IN%3Aen,2023-11-08
10,2023-11-08 | Press Release | What is Video Poker?,Stockhouse Publishing,news.google.com/articles/CBMiSWh0dHBzOi8vc3RvY2tob3VzZS5jb20vbmV3cy9wcmVzcy1yZWxlYXNlcy8yMDIzLzExLzA4L3doYXQtaXMtdmlkZW8tcG9rZXLSAQA?hl=en-IN&gl=IN&ceid=IN%3Aen,2023-11-08
3,"National School Psychology Week, Nov. 6-10, 2023 | details",Charles County Public Schools,news.google.com/articles/CBMifmh0dHBzOi8vd3d3LmNjYm9lLmNvbS9hYm91dC9wdWJsaWMtaW5mby1tZWRpYS9kZXRhaWxzL35ib2FyZC9wcmVzcy1yZWxlYXNlcy9wb3N0L25hdGlvbmFsLXNjaG9vbC1wc3ljaG9sb2d5LXdlZWstbm92LTYtMTAtMjAyM9IBAA?hl=en-IN&gl=IN&ceid=IN%3Aen,2023-11-07
4,Board to meet Nov. 14 for regular meeting | details,Charles County Public Schools,news.google.com/articles/CBMifmh0dHBzOi8vd3d3LmNjYm9lLmNvbS9hYm91dC9wdWJsaWMtaW5mby1tZWRpYS9kZXRhaWxzL35ib2FyZC9wcmVzcy1yZWxlYXNlcy9wb3N0L2JvYXJkLXRvLW1lZXQtbm92LTE0LWZvci1yZWd1bGFyLW1lZXRpbmctMjAyM9IBAA?hl=en-IN&gl=IN&ceid=IN%3Aen,2023-11-07
6,La Plata High School Marching Band compete on a National Level,Charles County Public Schools,news.google.com/articles/CBMijwFodHRwczovL3d3dy5jY2JvZS5jb20vYWJvdXQvcHVibGljLWluZm8tbWVkaWEvZGV0YWlscy9-Ym9hcmQvcHJlc3MtcmVsZWFzZXMvcG9zdC9sYS1wbGF0YS1oaWdoLXNjaG9vbC1tYXJjaGluZy1iYW5kLWNvbXBldGUtb24tYS1uYXRpb25hbC1sZXZlbNIBAA?hl=en-IN&gl=IN&ceid=IN%3Aen,2023-11-06
0,CCPS receives coat donations from bus contractor association ...,Charles County Public Schools,news.google.com/articles/CBMirwFodHRwczovL3d3dy5jY2JvZS5jb20vYWJvdXQvcHVibGljLWluZm8tbWVkaWEvZGV0YWlscy9-Ym9hcmQvcHJlc3MtcmVsZWFzZXMvcG9zdC9jY3BzLXJlY2VpdmVzLWNvYXQtZG9uYXRpb25zLWZyb20tYnVzLWNvbnRyYWN0b3ItYXNzb2NpYXRpb24tbW9yZS10aGFuLTI1MC10by1iZW5lZml0LXN0dWRlbnRz0gEA?hl=en-IN&gl=IN&ceid=IN%3Aen,2023-11-03
1,Nominations for Principal of the Year are due by Dec. 15,Charles County Public Schools,news.google.com/articles/CBMiiAFodHRwczovL3d3dy5jY2JvZS5jb20vYWJvdXQvcHVibGljLWluZm8tbWVkaWEvZGV0YWlscy9-Ym9hcmQvcHJlc3MtcmVsZWFzZXMvcG9zdC9ub21pbmF0aW9ucy1mb3ItcHJpbmNpcGFsLW9mLXRoZS15ZWFyLWFyZS1kdWUtYnktZGVjLTE10gEA?hl=en-IN&gl=IN&ceid=IN%3Aen,2023-10-30
2,Nominate an outstanding teacher for Teacher of the Year,Charles County Public Schools,news.google.com/articles/CBMiiAFodHRwczovL3d3dy5jY2JvZS5jb20vYWJvdXQvcHVibGljLWluZm8tbWVkaWEvZGV0YWlscy9-Ym9hcmQvcHJlc3MtcmVsZWFzZXMvcG9zdC9ub21pbmF0ZS1hbi1vdXRzdGFuZGluZy10ZWFjaGVyLWZvci10ZWFjaGVyLW9mLXRoZS15ZWFy0gEA?hl=en-IN&gl=IN&ceid=IN%3Aen,2023-10-30
