,title,source,link,date
0,You 'autumn' know what the fall play schedule looks like High ...,Charles County Public Schools,news.google.com/articles/CBMitAFodHRwczovL3d3dy5jY2JvZS5jb20vYWJvdXQvcHVibGljLWluZm8tbWVkaWEvZGV0YWlscy9-Ym9hcmQvcHJlc3MtcmVsZWFzZXMvcG9zdC95b3UtYXV0dW1uLWtub3ctd2hhdC10aGUtZmFsbC1wbGF5LXNjaGVkdWxlLWxvb2tzLWxpa2UtaGlnaC1zY2hvb2xzLXN0YWdlLXNob3dzLXRoaXMtbW9udGgtYW5kLW5leHTSAQA?hl=en-IN&gl=IN&ceid=IN%3Aen,2023-11-16
1,"Science Center to offer new community experiences, hosting special ...",Charles County Public Schools,news.google.com/articles/CBMiqwFodHRwczovL3d3dy5jY2JvZS5jb20vYWJvdXQvcHVibGljLWluZm8tbWVkaWEvZGV0YWlscy9-Ym9hcmQvcHJlc3MtcmVsZWFzZXMvcG9zdC9zY2llbmNlLWNlbnRlci10by1vZmZlci1uZXctY29tbXVuaXR5LWV4cGVyaWVuY2VzLWhvc3Rpbmctc3BlY2lhbC13aW50ZXItZXZlbnRzLW5leHQtbW9udGjSAQA?hl=en-IN&gl=IN&ceid=IN%3Aen,2023-11-16
2,Charles County Public Schools partners with United Way,Charles County Public Schools,news.google.com/articles/CBMihwFodHRwczovL3d3dy5jY2JvZS5jb20vYWJvdXQvcHVibGljLWluZm8tbWVkaWEvZGV0YWlscy9-Ym9hcmQvcHJlc3MtcmVsZWFzZXMvcG9zdC9jaGFybGVzLWNvdW50eS1wdWJsaWMtc2Nob29scy1wYXJ0bmVycy13aXRoLXVuaXRlZC13YXnSAQA?hl=en-IN&gl=IN&ceid=IN%3Aen,2023-11-16
3,"CCPS staff donates to LifeStyles, Community Schools | details",Charles County Public Schools,news.google.com/articles/CBMigwFodHRwczovL3d3dy5jY2JvZS5jb20vYWJvdXQvcHVibGljLWluZm8tbWVkaWEvZGV0YWlscy9-Ym9hcmQvcHJlc3MtcmVsZWFzZXMvcG9zdC9jY3BzLXN0YWZmLWRvbmF0ZXMtdG8tbGlmZXN0eWxlcy1jb21tdW5pdHktc2Nob29sc9IBAA?hl=en-IN&gl=IN&ceid=IN%3Aen,2023-11-16
4,Board of Education recognizes exemplary students at November ...,Charles County Public Schools,news.google.com/articles/CBMimgFodHRwczovL3d3dy5jY2JvZS5jb20vYWJvdXQvcHVibGljLWluZm8tbWVkaWEvZGV0YWlscy9-Ym9hcmQvcHJlc3MtcmVsZWFzZXMvcG9zdC9ib2FyZC1vZi1lZHVjYXRpb24tcmVjb2duaXplcy1leGVtcGxhcnktc3R1ZGVudHMtYXQtbm92ZW1iZXItMjAyMy1tZWV0aW5n0gEA?hl=en-IN&gl=IN&ceid=IN%3Aen,2023-11-15
6,"CCPS, CSM expand Early College program to include industry ...",Charles County Public Schools,news.google.com/articles/CBMimAFodHRwczovL3d3dy5jY2JvZS5jb20vYWJvdXQvcHVibGljLWluZm8tbWVkaWEvZGV0YWlscy9-Ym9hcmQvcHJlc3MtcmVsZWFzZXMvcG9zdC9jY3BzY3NtLWV4cGFuZC1lYXJseS1jb2xsZWdlLXByb2dyYW0tdG8taW5jbHVkZS1pbmR1c3RyeS1jZXJ0aWZpY2F0aW9uc9IBAA?hl=en-IN&gl=IN&ceid=IN%3Aen,2023-11-13
5,"Cultivating a legacy — CCPS students, help plant native tree canopies",Charles County Public Schools,news.google.com/articles/CBMikwFodHRwczovL3d3dy5jY2JvZS5jb20vYWJvdXQvcHVibGljLWluZm8tbWVkaWEvZGV0YWlscy9-Ym9hcmQvcHJlc3MtcmVsZWFzZXMvcG9zdC9jdWx0aXZhdGluZy1hLWxlZ2FjeS1jY3BzLXN0dWRlbnRzLWhlbHAtcGxhbnQtbmF0aXZlLXRyZWUtY2Fub3BpZXPSAQA?hl=en-IN&gl=IN&ceid=IN%3Aen,2023-11-10
9,"Kyiv behind car bomb assassination, EU accession talks should start ...",Euronews,news.google.com/articles/CBMifmh0dHBzOi8vd3d3LmV1cm9uZXdzLmNvbS8yMDIzLzExLzA4L3J1c3NpYW4tb2ZmaWNpYWwta2lsbGVkLWluLWNhci1ibGFzdC1nNy12b3dzLXRvLW1haW50YWluLWt5aXYtc3VwcG9ydC11cy1iYWNrcy11a3JhaW5lLWRlbdIBAA?hl=en-IN&gl=IN&ceid=IN%3Aen,2023-11-08
