,title,source,link,date
41,"Wood Sanding Machines Market Analysis: By Application, Organization Size, Sale Volume, Share, Impact of C",Benzinga,news.google.com/articles/CBMimQFodHRwczovL3d3dy5iZW56aW5nYS5jb20vcHJlc3NyZWxlYXNlcy8yMy8wOC8zNDEwOTMzMy93b29kLXNhbmRpbmctbWFjaGluZXMtbWFya2V0LWFuYWx5c2lzLWJ5LWFwcGxpY2F0aW9uLW9yZ2FuaXphdGlvbi1zaXplLXNhbGUtdm9sdW1lLXNoYXJlLWltcGFjdC1vZi3SAS1odHRwczovL3d3dy5iZW56aW5nYS5jb20vYW1wL2NvbnRlbnQvMzQxMDkzMzM?hl=en-IN&gl=IN&ceid=IN%3Aen,2023-08-30
16,DC Electric Fastening Systems Market Has Huge Potential for Growth during Forecast period,Benzinga,news.google.com/articles/CBMijwFodHRwczovL3d3dy5iZW56aW5nYS5jb20vcHJlc3NyZWxlYXNlcy8yMy8wOC8zNDEwODczNC9kYy1lbGVjdHJpYy1mYXN0ZW5pbmctc3lzdGVtcy1tYXJrZXQtaGFzLWh1Z2UtcG90ZW50aWFsLWZvci1ncm93dGgtZHVyaW5nLWZvcmVjYXN0LXBlcmlvZNIBLWh0dHBzOi8vd3d3LmJlbnppbmdhLmNvbS9hbXAvY29udGVudC8zNDEwODczNA?hl=en-IN&gl=IN&ceid=IN%3Aen,2023-08-30
30,"PM10 & PM2.5 Portable Particulate Monitor Market Size, Key Players Analysis and Forecast To 2029 |Thermo",Benzinga,news.google.com/articles/CBMimQFodHRwczovL3d3dy5iZW56aW5nYS5jb20vcHJlc3NyZWxlYXNlcy8yMy8wOC8zNDEwOTg1Ny9wbTEwLXBtMi01LXBvcnRhYmxlLXBhcnRpY3VsYXRlLW1vbml0b3ItbWFya2V0LXNpemUta2V5LXBsYXllcnMtYW5hbHlzaXMtYW5kLWZvcmVjYXN0LXRvLTIwMjktdGhlcm3SAS1odHRwczovL3d3dy5iZW56aW5nYS5jb20vYW1wL2NvbnRlbnQvMzQxMDk4NTc?hl=en-IN&gl=IN&ceid=IN%3Aen,2023-08-30
39,"Three Phase Variable Frequency Drives (VFD) Market Size 2023 Global Sales, Growth Rate, and Forecast to",Benzinga,news.google.com/articles/CBMimQFodHRwczovL3d3dy5iZW56aW5nYS5jb20vcHJlc3NyZWxlYXNlcy8yMy8wOC8zNDEwNjc2NC90aHJlZS1waGFzZS12YXJpYWJsZS1mcmVxdWVuY3ktZHJpdmVzLXZmZC1tYXJrZXQtc2l6ZS0yMDIzLWdsb2JhbC1zYWxlcy1ncm93dGgtcmF0ZS1hbmQtZm9yZWNhc3QtdG_SAS1odHRwczovL3d3dy5iZW56aW5nYS5jb20vYW1wL2NvbnRlbnQvMzQxMDY3NjQ?hl=en-IN&gl=IN&ceid=IN%3Aen,2023-08-30
23,Industrial Air Conditioning Market by Prospects Growth Forecast to 2030,Benzinga,news.google.com/articles/CBMifWh0dHBzOi8vd3d3LmJlbnppbmdhLmNvbS9wcmVzc3JlbGVhc2VzLzIzLzA4LzM0MTE0MTc5L2luZHVzdHJpYWwtYWlyLWNvbmRpdGlvbmluZy1tYXJrZXQtYnktcHJvc3BlY3RzLWdyb3d0aC1mb3JlY2FzdC10by0yMDMw0gEtaHR0cHM6Ly93d3cuYmVuemluZ2EuY29tL2FtcC9jb250ZW50LzM0MTE0MTc5?hl=en-IN&gl=IN&ceid=IN%3Aen,2023-08-30
3,Vinva Investment Management Ltd Makes New $787000 Investment ...,MarketBeat,news.google.com/articles/CBMiSGh0dHBzOi8vd3d3Lm1hcmtldGJlYXQuY29tL2luc3RhbnQtYWxlcnRzL255c2UtaXItc2VjLWZpbGluZy0yMDIzLTA4LTMwL9IBAA?hl=en-IN&gl=IN&ceid=IN%3Aen,2023-08-30
47,Desiccant Dryer Market Detailed In New Research Report 2023,Benzinga,news.google.com/articles/CBMicWh0dHBzOi8vd3d3LmJlbnppbmdhLmNvbS9wcmVzc3JlbGVhc2VzLzIzLzA4LzM0MTA5MzA1L2Rlc2ljY2FudC1kcnllci1tYXJrZXQtZGV0YWlsZWQtaW4tbmV3LXJlc2VhcmNoLXJlcG9ydC0yMDIz0gEtaHR0cHM6Ly93d3cuYmVuemluZ2EuY29tL2FtcC9jb250ZW50LzM0MTA5MzA1?hl=en-IN&gl=IN&ceid=IN%3Aen,2023-08-30
51,"On Site Gas Generator Market Research Status, Business Growth Analysis by Top Countries Data and Segments",Benzinga,news.google.com/articles/CBMimQFodHRwczovL3d3dy5iZW56aW5nYS5jb20vcHJlc3NyZWxlYXNlcy8yMy8wOC8zNDExMDE5OS9vbi1zaXRlLWdhcy1nZW5lcmF0b3ItbWFya2V0LXJlc2VhcmNoLXN0YXR1cy1idXNpbmVzcy1ncm93dGgtYW5hbHlzaXMtYnktdG9wLWNvdW50cmllcy1kYXRhLWFuZC1zZWfSAS1odHRwczovL3d3dy5iZW56aW5nYS5jb20vYW1wL2NvbnRlbnQvMzQxMTAxOTk?hl=en-IN&gl=IN&ceid=IN%3Aen,2023-08-30
63,"Water Chiller Market Industry Trends, Leading Players, Growth, Development and Demand Forecast to 2029",Benzinga,news.google.com/articles/CBMimQFodHRwczovL3d3dy5iZW56aW5nYS5jb20vcHJlc3NyZWxlYXNlcy8yMy8wOC8zNDEwNzc4Ni93YXRlci1jaGlsbGVyLW1hcmtldC1pbmR1c3RyeS10cmVuZHMtbGVhZGluZy1wbGF5ZXJzLWdyb3d0aC1kZXZlbG9wbWVudC1hbmQtZGVtYW5kLWZvcmVjYXN0LXRvLTIwMjnSAS1odHRwczovL3d3dy5iZW56aW5nYS5jb20vYW1wL2NvbnRlbnQvMzQxMDc3ODY?hl=en-IN&gl=IN&ceid=IN%3Aen,2023-08-30
32,"Global Low Speed Vehicle Market Report, Market Size, Share, Trends, Analysis and Forecast to 2028",openPR,news.google.com/articles/CBMiXGh0dHBzOi8vd3d3Lm9wZW5wci5jb20vbmV3cy8zMTg4NDAyL2dsb2JhbC1sb3ctc3BlZWQtdmVoaWNsZS1tYXJrZXQtcmVwb3J0LW1hcmtldC1zaXplLXNoYXJl0gFbaHR0cHM6Ly93d3cub3BlbnByLmNvbS9hbXAvMzE4ODQwMi9nbG9iYWwtbG93LXNwZWVkLXZlaGljbGUtbWFya2V0LXJlcG9ydC1tYXJrZXQtc2l6ZS1zaGFyZQ?hl=en-IN&gl=IN&ceid=IN%3Aen,2023-08-30
