,title,source,link,date
31,"Standalone Embedded Systems Market | ARM Limited, Advantech, Altera, Analog Devices",openPR,news.google.com/articles/CBMiXGh0dHBzOi8vd3d3Lm9wZW5wci5jb20vbmV3cy8zMjAwOTAzL3N0YW5kYWxvbmUtZW1iZWRkZWQtc3lzdGVtcy1tYXJrZXQtYXJtLWxpbWl0ZWQtYWR2YW50ZWNo0gFbaHR0cHM6Ly93d3cub3BlbnByLmNvbS9hbXAvMzIwMDkwMy9zdGFuZGFsb25lLWVtYmVkZGVkLXN5c3RlbXMtbWFya2V0LWFybS1saW1pdGVkLWFkdmFudGVjaA?hl=en-IN&gl=IN&ceid=IN%3Aen,2023-09-08
44,"Upright Ultra-Low Temperature Freezers Market | Arctiko, Azbil, Binder, Eppendorf",openPR,news.google.com/articles/CBMiWWh0dHBzOi8vd3d3Lm9wZW5wci5jb20vbmV3cy8zMjAxMDgxL3VwcmlnaHQtdWx0cmEtbG93LXRlbXBlcmF0dXJlLWZyZWV6ZXJzLW1hcmtldC1hcmN0aWtv0gFYaHR0cHM6Ly93d3cub3BlbnByLmNvbS9hbXAvMzIwMTA4MS91cHJpZ2h0LXVsdHJhLWxvdy10ZW1wZXJhdHVyZS1mcmVlemVycy1tYXJrZXQtYXJjdGlrbw?hl=en-IN&gl=IN&ceid=IN%3Aen,2023-09-08
36,The analysis report of the Organ Care Products market size growing at a CAGR of 11.6% offers a comprehens,Benzinga,news.google.com/articles/CBMimQFodHRwczovL3d3dy5iZW56aW5nYS5jb20vcHJlc3NyZWxlYXNlcy8yMy8wOS8zNDM1ODI5Mi90aGUtYW5hbHlzaXMtcmVwb3J0LW9mLXRoZS1vcmdhbi1jYXJlLXByb2R1Y3RzLW1hcmtldC1zaXplLWdyb3dpbmctYXQtYS1jYWdyLW9mLTExLTYtb2ZmZXJzLWEtY29tcHLSAS1odHRwczovL3d3dy5iZW56aW5nYS5jb20vYW1wL2NvbnRlbnQvMzQzNTgyOTI?hl=en-IN&gl=IN&ceid=IN%3Aen,2023-09-08
38,"T-Head Aerobridge Aerobridge Market | ADELTE, Airport Equipment, CIMC-TianDa, Deerns",openPR,news.google.com/articles/CBMiVmh0dHBzOi8vd3d3Lm9wZW5wci5jb20vbmV3cy8zMjAxMDY0L3QtaGVhZC1hZXJvYnJpZGdlLWFlcm9icmlkZ2UtbWFya2V0LWFkZWx0ZS1haXJwb3J00gFVaHR0cHM6Ly93d3cub3BlbnByLmNvbS9hbXAvMzIwMTA2NC90LWhlYWQtYWVyb2JyaWRnZS1hZXJvYnJpZGdlLW1hcmtldC1hZGVsdGUtYWlycG9ydA?hl=en-IN&gl=IN&ceid=IN%3Aen,2023-09-08
39,"Text Annotation Tool Market | Alegion, Amazon Web Services, Appen, Clickworker GmbH",openPR,news.google.com/articles/CBMiW2h0dHBzOi8vd3d3Lm9wZW5wci5jb20vbmV3cy8zMjAxMDcxL3RleHQtYW5ub3RhdGlvbi10b29sLW1hcmtldC1hbGVnaW9uLWFtYXpvbi13ZWItc2VydmljZXPSAVpodHRwczovL3d3dy5vcGVucHIuY29tL2FtcC8zMjAxMDcxL3RleHQtYW5ub3RhdGlvbi10b29sLW1hcmtldC1hbGVnaW9uLWFtYXpvbi13ZWItc2VydmljZXM?hl=en-IN&gl=IN&ceid=IN%3Aen,2023-09-08
40,"Roasted Grain Ingredients Market | AIT Ingredients, Bairds Malt, Boortmalt, Castle Malting",openPR,news.google.com/articles/CBMiW2h0dHBzOi8vd3d3Lm9wZW5wci5jb20vbmV3cy8zMjAwOTA4L3JvYXN0ZWQtZ3JhaW4taW5ncmVkaWVudHMtbWFya2V0LWFpdC1pbmdyZWRpZW50cy1iYWlyZHPSAVpodHRwczovL3d3dy5vcGVucHIuY29tL2FtcC8zMjAwOTA4L3JvYXN0ZWQtZ3JhaW4taW5ncmVkaWVudHMtbWFya2V0LWFpdC1pbmdyZWRpZW50cy1iYWlyZHM?hl=en-IN&gl=IN&ceid=IN%3Aen,2023-09-08
41,"Terbium Nitrate Market Research Report: Providing Company-Specific Insights with SWOT Analysis, Financial",Benzinga,news.google.com/articles/CBMimQFodHRwczovL3d3dy5iZW56aW5nYS5jb20vcHJlc3NyZWxlYXNlcy8yMy8wOS8zNDM2NjQ0My90ZXJiaXVtLW5pdHJhdGUtbWFya2V0LXJlc2VhcmNoLXJlcG9ydC1wcm92aWRpbmctY29tcGFueS1zcGVjaWZpYy1pbnNpZ2h0cy13aXRoLXN3b3QtYW5hbHlzaXMtZmluYW7SAS1odHRwczovL3d3dy5iZW56aW5nYS5jb20vYW1wL2NvbnRlbnQvMzQzNjY0NDM?hl=en-IN&gl=IN&ceid=IN%3Aen,2023-09-08
42,"Envelope Sealing Machines Market | DSY Packaging Machinery, MAAG MERCURE, SUPERTECH PACKING, Wenzhou Caishun P",openPR,news.google.com/articles/CBMiXGh0dHBzOi8vd3d3Lm9wZW5wci5jb20vbmV3cy8zMjAxMDMzL2VudmVsb3BlLXNlYWxpbmctbWFjaGluZXMtbWFya2V0LWRzeS1wYWNrYWdpbmctbWFjaGluZXJ50gFbaHR0cHM6Ly93d3cub3BlbnByLmNvbS9hbXAvMzIwMTAzMy9lbnZlbG9wZS1zZWFsaW5nLW1hY2hpbmVzLW1hcmtldC1kc3ktcGFja2FnaW5nLW1hY2hpbmVyeQ?hl=en-IN&gl=IN&ceid=IN%3Aen,2023-09-08
43,"Glass-fiber-reinforced (GFR) Plastic Pipes Market | Amiblu Holding, Fibrex, Kolon Industries, Megha Fiber Glas",openPR,news.google.com/articles/CBMiWmh0dHBzOi8vd3d3Lm9wZW5wci5jb20vbmV3cy8zMjAxMDAyL2dsYXNzLWZpYmVyLXJlaW5mb3JjZWQtZ2ZyLXBsYXN0aWMtcGlwZXMtbWFya2V0LWFtaWJsddIBWWh0dHBzOi8vd3d3Lm9wZW5wci5jb20vYW1wLzMyMDEwMDIvZ2xhc3MtZmliZXItcmVpbmZvcmNlZC1nZnItcGxhc3RpYy1waXBlcy1tYXJrZXQtYW1pYmx1?hl=en-IN&gl=IN&ceid=IN%3Aen,2023-09-08
45,"Surgical Face Mask Market | 3M, Berkley Surgical, Cardinal Health, Creative Contract Sdn Bhd",openPR,news.google.com/articles/CBMiWmh0dHBzOi8vd3d3Lm9wZW5wci5jb20vbmV3cy8zMjAxMDIyL3N1cmdpY2FsLWZhY2UtbWFzay1tYXJrZXQtM20tYmVya2xleS1zdXJnaWNhbC1jYXJkaW5hbNIBWWh0dHBzOi8vd3d3Lm9wZW5wci5jb20vYW1wLzMyMDEwMjIvc3VyZ2ljYWwtZmFjZS1tYXNrLW1hcmtldC0zbS1iZXJrbGV5LXN1cmdpY2FsLWNhcmRpbmFs?hl=en-IN&gl=IN&ceid=IN%3Aen,2023-09-08
