,title,source,link,date
68,Indoor Stair Lift market Analysis study provides comprehensive and ...,Benzinga,news.google.com/articles/CBMimQFodHRwczovL3d3dy5iZW56aW5nYS5jb20vcHJlc3NyZWxlYXNlcy8yMy8wOS8zNDM1OTQzOS9pbmRvb3Itc3RhaXItbGlmdC1tYXJrZXQtYW5hbHlzaXMtc3R1ZHktcHJvdmlkZXMtY29tcHJlaGVuc2l2ZS1hbmQtaW4tZGVwdGgtaW5zaWdodC1pbnRvLXRoZS1wcm9kdWPSAQA?hl=en-IN&gl=IN&ceid=IN%3Aen,2023-09-08
49,"Pan-Tilt-Zoom (PTZ) Infrared Camera Market | Axis Communications, DIAS Infrared GmbH, FLIR Systems, Fluke Corp",openPR,news.google.com/articles/CBMiUWh0dHBzOi8vd3d3Lm9wZW5wci5jb20vbmV3cy8zMjAxMDc5L3Bhbi10aWx0LXpvb20tcHR6LWluZnJhcmVkLWNhbWVyYS1tYXJrZXQtYXhpc9IBUGh0dHBzOi8vd3d3Lm9wZW5wci5jb20vYW1wLzMyMDEwNzkvcGFuLXRpbHQtem9vbS1wdHotaW5mcmFyZWQtY2FtZXJhLW1hcmtldC1heGlz?hl=en-IN&gl=IN&ceid=IN%3Aen,2023-09-08
42,The analysis report of the Organ Care Products market size growing ...,Benzinga,news.google.com/articles/CBMimQFodHRwczovL3d3dy5iZW56aW5nYS5jb20vcHJlc3NyZWxlYXNlcy8yMy8wOS8zNDM1ODI5Mi90aGUtYW5hbHlzaXMtcmVwb3J0LW9mLXRoZS1vcmdhbi1jYXJlLXByb2R1Y3RzLW1hcmtldC1zaXplLWdyb3dpbmctYXQtYS1jYWdyLW9mLTExLTYtb2ZmZXJzLWEtY29tcHLSAQA?hl=en-IN&gl=IN&ceid=IN%3Aen,2023-09-08
41,"Text Annotation Tool Market | Alegion, Amazon Web Services, Appen, Clickworker GmbH",openPR,news.google.com/articles/CBMiW2h0dHBzOi8vd3d3Lm9wZW5wci5jb20vbmV3cy8zMjAxMDcxL3RleHQtYW5ub3RhdGlvbi10b29sLW1hcmtldC1hbGVnaW9uLWFtYXpvbi13ZWItc2VydmljZXPSAVpodHRwczovL3d3dy5vcGVucHIuY29tL2FtcC8zMjAxMDcxL3RleHQtYW5ub3RhdGlvbi10b29sLW1hcmtldC1hbGVnaW9uLWFtYXpvbi13ZWItc2VydmljZXM?hl=en-IN&gl=IN&ceid=IN%3Aen,2023-09-08
40,"Non-Alcoholic Beverage Processing Equipment Market | A Due, A. Water Systems, Alfa Laval, Centec",openPR,news.google.com/articles/CBMiXGh0dHBzOi8vd3d3Lm9wZW5wci5jb20vbmV3cy8zMjAwOTU5L25vbi1hbGNvaG9saWMtYmV2ZXJhZ2UtcHJvY2Vzc2luZy1lcXVpcG1lbnQtbWFya2V0LWEtZHVl0gFbaHR0cHM6Ly93d3cub3BlbnByLmNvbS9hbXAvMzIwMDk1OS9ub24tYWxjb2hvbGljLWJldmVyYWdlLXByb2Nlc3NpbmctZXF1aXBtZW50LW1hcmtldC1hLWR1ZQ?hl=en-IN&gl=IN&ceid=IN%3Aen,2023-09-08
39,"T-Head Aerobridge Aerobridge Market | ADELTE, Airport Equipment, CIMC-TianDa, Deerns",openPR,news.google.com/articles/CBMiVmh0dHBzOi8vd3d3Lm9wZW5wci5jb20vbmV3cy8zMjAxMDY0L3QtaGVhZC1hZXJvYnJpZGdlLWFlcm9icmlkZ2UtbWFya2V0LWFkZWx0ZS1haXJwb3J00gFVaHR0cHM6Ly93d3cub3BlbnByLmNvbS9hbXAvMzIwMTA2NC90LWhlYWQtYWVyb2JyaWRnZS1hZXJvYnJpZGdlLW1hcmtldC1hZGVsdGUtYWlycG9ydA?hl=en-IN&gl=IN&ceid=IN%3Aen,2023-09-08
38,"Vertical Mechanical Diaphragm Pump Market | ABEL Pumps, DOSEURO, Depamu Pump Industry Technology, Flowserve",openPR,news.google.com/articles/CBMiWGh0dHBzOi8vd3d3Lm9wZW5wci5jb20vbmV3cy8zMjAwOTA1L3ZlcnRpY2FsLW1lY2hhbmljYWwtZGlhcGhyYWdtLXB1bXAtbWFya2V0LWFiZWwtcHVtcHPSAVdodHRwczovL3d3dy5vcGVucHIuY29tL2FtcC8zMjAwOTA1L3ZlcnRpY2FsLW1lY2hhbmljYWwtZGlhcGhyYWdtLXB1bXAtbWFya2V0LWFiZWwtcHVtcHM?hl=en-IN&gl=IN&ceid=IN%3Aen,2023-09-08
37,"Pesticide Residue Testing Market | ALS Limited, AsureQuality Laboratories, Bureau Veritas, Eurofins Scientific",openPR,news.google.com/articles/CBMiXWh0dHBzOi8vd3d3Lm9wZW5wci5jb20vbmV3cy8zMjAwOTcxL3Blc3RpY2lkZS1yZXNpZHVlLXRlc3RpbmctbWFya2V0LWFscy1saW1pdGVkLWFzdXJlcXVhbGl0edIBXGh0dHBzOi8vd3d3Lm9wZW5wci5jb20vYW1wLzMyMDA5NzEvcGVzdGljaWRlLXJlc2lkdWUtdGVzdGluZy1tYXJrZXQtYWxzLWxpbWl0ZWQtYXN1cmVxdWFsaXR5?hl=en-IN&gl=IN&ceid=IN%3Aen,2023-09-08
46,"Roasted Grain Ingredients Market | AIT Ingredients, Bairds Malt, Boortmalt, Castle Malting",openPR,news.google.com/articles/CBMiW2h0dHBzOi8vd3d3Lm9wZW5wci5jb20vbmV3cy8zMjAwOTA4L3JvYXN0ZWQtZ3JhaW4taW5ncmVkaWVudHMtbWFya2V0LWFpdC1pbmdyZWRpZW50cy1iYWlyZHPSAVpodHRwczovL3d3dy5vcGVucHIuY29tL2FtcC8zMjAwOTA4L3JvYXN0ZWQtZ3JhaW4taW5ncmVkaWVudHMtbWFya2V0LWFpdC1pbmdyZWRpZW50cy1iYWlyZHM?hl=en-IN&gl=IN&ceid=IN%3Aen,2023-09-08
35,"Phosphor Screen Market | Aimil Ltd, Dr. Gassler Electron Devices, GENERAL ELECTRIC COMPANY (GE Healthcare), GI",openPR,news.google.com/articles/CBMiWGh0dHBzOi8vd3d3Lm9wZW5wci5jb20vbmV3cy8zMjAwODg5L3Bob3NwaG9yLXNjcmVlbi1tYXJrZXQtYWltaWwtbHRkLWRyLWdhc3NsZXItZWxlY3Ryb27SAVdodHRwczovL3d3dy5vcGVucHIuY29tL2FtcC8zMjAwODg5L3Bob3NwaG9yLXNjcmVlbi1tYXJrZXQtYWltaWwtbHRkLWRyLWdhc3NsZXItZWxlY3Ryb24?hl=en-IN&gl=IN&ceid=IN%3Aen,2023-09-08
