,title,source,link,date
32,The projected compound annual growth rate of the Pet External ...,Benzinga,news.google.com/articles/CBMimQFodHRwczovL3d3dy5iZW56aW5nYS5jb20vcHJlc3NyZWxlYXNlcy8yMy8wOS8zNDQyNDc1MC90aGUtcHJvamVjdGVkLWNvbXBvdW5kLWFubnVhbC1ncm93dGgtcmF0ZS1vZi10aGUtcGV0LWV4dGVybmFsLWZpeGF0aW9uLW1hcmtldC1zaXplLWlzLTQtMi10aWxsLTIwMzDSAQA?hl=en-IN&gl=IN&ceid=IN%3Aen,2023-09-11
13,Digital Publishing for Education Market Future Opportunities and Barriers by 2030,Benzinga,news.google.com/articles/CBMihwFodHRwczovL3d3dy5iZW56aW5nYS5jb20vcHJlc3NyZWxlYXNlcy8yMy8wOS8zNDQyNDAwNC9kaWdpdGFsLXB1Ymxpc2hpbmctZm9yLWVkdWNhdGlvbi1tYXJrZXQtZnV0dXJlLW9wcG9ydHVuaXRpZXMtYW5kLWJhcnJpZXJzLWJ5LTIwMzDSAS1odHRwczovL3d3dy5iZW56aW5nYS5jb20vYW1wL2NvbnRlbnQvMzQ0MjQwMDQ?hl=en-IN&gl=IN&ceid=IN%3Aen,2023-09-11
15,Trauma Fixation Devices Market | New Insight Report Hit Highest Growth Rate by 2030,Benzinga,news.google.com/articles/CBMihwFodHRwczovL3d3dy5iZW56aW5nYS5jb20vcHJlc3NyZWxlYXNlcy8yMy8wOS8zNDQyNDQyMS90cmF1bWEtZml4YXRpb24tZGV2aWNlcy1tYXJrZXQtbmV3LWluc2lnaHQtcmVwb3J0LWhpdC1oaWdoZXN0LWdyb3d0aC1yYXRlLWJ5LTIwMzDSAS1odHRwczovL3d3dy5iZW56aW5nYS5jb20vYW1wL2NvbnRlbnQvMzQ0MjQ0MjE?hl=en-IN&gl=IN&ceid=IN%3Aen,2023-09-11
33,The global Medical Vacuum Systems market Size is expected to maintain its upward trend and generate billi,Benzinga,news.google.com/articles/CBMimQFodHRwczovL3d3dy5iZW56aW5nYS5jb20vcHJlc3NyZWxlYXNlcy8yMy8wOS8zNDQyMjMwOS90aGUtZ2xvYmFsLW1lZGljYWwtdmFjdXVtLXN5c3RlbXMtbWFya2V0LXNpemUtaXMtZXhwZWN0ZWQtdG8tbWFpbnRhaW4taXRzLXVwd2FyZC10cmVuZC1hbmQtZ2VuZXJhdGXSAS1odHRwczovL3d3dy5iZW56aW5nYS5jb20vYW1wL2NvbnRlbnQvMzQ0MjIzMDk?hl=en-IN&gl=IN&ceid=IN%3Aen,2023-09-11
31,"This report provides a detailed examination of the Pin Cutters market overview and growth outlook, projec",Benzinga,news.google.com/articles/CBMimQFodHRwczovL3d3dy5iZW56aW5nYS5jb20vcHJlc3NyZWxlYXNlcy8yMy8wOS8zNDQwNTgyMS90aGlzLXJlcG9ydC1wcm92aWRlcy1hLWRldGFpbGVkLWV4YW1pbmF0aW9uLW9mLXRoZS1waW4tY3V0dGVycy1tYXJrZXQtb3ZlcnZpZXctYW5kLWdyb3d0aC1vdXRsb29rLXDSAS1odHRwczovL3d3dy5iZW56aW5nYS5jb20vYW1wL2NvbnRlbnQvMzQ0MDU4MjE?hl=en-IN&gl=IN&ceid=IN%3Aen,2023-09-10
12,"Coconut Sugar Market Landscape: Trends, Innovations, and Top Players Strategic Outlook 2030",Benzinga,news.google.com/articles/CBMijgFodHRwczovL3d3dy5iZW56aW5nYS5jb20vcHJlc3NyZWxlYXNlcy8yMy8wOS8zNDQxODUxNy9jb2NvbnV0LXN1Z2FyLW1hcmtldC1sYW5kc2NhcGUtdHJlbmRzLWlubm92YXRpb25zLWFuZC10b3AtcGxheWVycy1zdHJhdGVnaWMtb3V0bG9vay0yMDMw0gEtaHR0cHM6Ly93d3cuYmVuemluZ2EuY29tL2FtcC9jb250ZW50LzM0NDE4NTE3?hl=en-IN&gl=IN&ceid=IN%3Aen,2023-09-10
56,"By examining the developing growth, average selling price, and global market of the Veterinary Dentistry",Benzinga,news.google.com/articles/CBMimQFodHRwczovL3d3dy5iZW56aW5nYS5jb20vcHJlc3NyZWxlYXNlcy8yMy8wOS8zNDQwMzQ3Ny9ieS1leGFtaW5pbmctdGhlLWRldmVsb3BpbmctZ3Jvd3RoLWF2ZXJhZ2Utc2VsbGluZy1wcmljZS1hbmQtZ2xvYmFsLW1hcmtldC1vZi10aGUtdmV0ZXJpbmFyeS1kZW50aXPSAS1odHRwczovL3d3dy5iZW56aW5nYS5jb20vYW1wL2NvbnRlbnQvMzQ0MDM0Nzc?hl=en-IN&gl=IN&ceid=IN%3Aen,2023-09-10
41,"Based on recent market analysis, the Ultrasonic Energy Surgical Device market is expected to grow at a he",Benzinga,news.google.com/articles/CBMimQFodHRwczovL3d3dy5iZW56aW5nYS5jb20vcHJlc3NyZWxlYXNlcy8yMy8wOS8zNDQwMzk0OS9iYXNlZC1vbi1yZWNlbnQtbWFya2V0LWFuYWx5c2lzLXRoZS11bHRyYXNvbmljLWVuZXJneS1zdXJnaWNhbC1kZXZpY2UtbWFya2V0LWlzLWV4cGVjdGVkLXRvLWdyb3ctYXTSAS1odHRwczovL3d3dy5iZW56aW5nYS5jb20vYW1wL2NvbnRlbnQvMzQ0MDM5NDk?hl=en-IN&gl=IN&ceid=IN%3Aen,2023-09-10
59,"Minimally Invasive Surgery Retractors Market Size 2023 - 2030 with CAGR of 10%: Growth Drivers, Trends, D",Benzinga,news.google.com/articles/CBMimQFodHRwczovL3d3dy5iZW56aW5nYS5jb20vcHJlc3NyZWxlYXNlcy8yMy8wOS8zNDQwMjkyMy9taW5pbWFsbHktaW52YXNpdmUtc3VyZ2VyeS1yZXRyYWN0b3JzLW1hcmtldC1zaXplLTIwMjMtMjAzMC13aXRoLWNhZ3Itb2YtMTAtZ3Jvd3RoLWRyaXZlcnMtdHJlbmRzLWTSAS1odHRwczovL3d3dy5iZW56aW5nYS5jb20vYW1wL2NvbnRlbnQvMzQ0MDI5MjM?hl=en-IN&gl=IN&ceid=IN%3Aen,2023-09-10
38,"Artificial Bone Market Size: Global Revenue, Volume, Market Share, Production Cost, and Forecast at a for",Benzinga,news.google.com/articles/CBMimQFodHRwczovL3d3dy5iZW56aW5nYS5jb20vcHJlc3NyZWxlYXNlcy8yMy8wOS8zNDQxMTAwMi9hcnRpZmljaWFsLWJvbmUtbWFya2V0LXNpemUtZ2xvYmFsLXJldmVudWUtdm9sdW1lLW1hcmtldC1zaGFyZS1wcm9kdWN0aW9uLWNvc3QtYW5kLWZvcmVjYXN0LWF0LWEtZm_SAS1odHRwczovL3d3dy5iZW56aW5nYS5jb20vYW1wL2NvbnRlbnQvMzQ0MTEwMDI?hl=en-IN&gl=IN&ceid=IN%3Aen,2023-09-10
