,title,source,link,date
55,"The Wheelchair Oxygen Tank Holders Market Trends report will cover the industry's current state, with a f",Benzinga,news.google.com/articles/CBMimQFodHRwczovL3d3dy5iZW56aW5nYS5jb20vcHJlc3NyZWxlYXNlcy8yMy8wOS8zNDM3OTQwNC90aGUtd2hlZWxjaGFpci1veHlnZW4tdGFuay1ob2xkZXJzLW1hcmtldC10cmVuZHMtcmVwb3J0LXdpbGwtY292ZXItdGhlLWluZHVzdHJ5cy1jdXJyZW50LXN0YXRlLXdpdGjSAS1odHRwczovL3d3dy5iZW56aW5nYS5jb20vYW1wL2NvbnRlbnQvMzQzNzk0MDQ?hl=en-IN&gl=IN&ceid=IN%3Aen,2023-09-09
38,Sublimation Equipment Market provides a comprehensive analysis of market growth drivers from 2023 to 2030,Benzinga,news.google.com/articles/CBMimQFodHRwczovL3d3dy5iZW56aW5nYS5jb20vcHJlc3NyZWxlYXNlcy8yMy8wOS8zNDM4MTYxNy9zdWJsaW1hdGlvbi1lcXVpcG1lbnQtbWFya2V0LXByb3ZpZGVzLWEtY29tcHJlaGVuc2l2ZS1hbmFseXNpcy1vZi1tYXJrZXQtZ3Jvd3RoLWRyaXZlcnMtZnJvbS0yMDIzLXTSAS1odHRwczovL3d3dy5iZW56aW5nYS5jb20vYW1wL2NvbnRlbnQvMzQzODE2MTc?hl=en-IN&gl=IN&ceid=IN%3Aen,2023-09-09
52,"The report on the Optical Coagulation Analyzer market size forecasts a 9.7% CAGR growth rate until 2030,",Benzinga,news.google.com/articles/CBMimQFodHRwczovL3d3dy5iZW56aW5nYS5jb20vcHJlc3NyZWxlYXNlcy8yMy8wOS8zNDM3OTk5NC90aGUtcmVwb3J0LW9uLXRoZS1vcHRpY2FsLWNvYWd1bGF0aW9uLWFuYWx5emVyLW1hcmtldC1zaXplLWZvcmVjYXN0cy1hLTktNy1jYWdyLWdyb3d0aC1yYXRlLXVudGlsLTLSAS1odHRwczovL3d3dy5iZW56aW5nYS5jb20vYW1wL2NvbnRlbnQvMzQzNzk5OTQ?hl=en-IN&gl=IN&ceid=IN%3Aen,2023-09-09
41,The Nanoimprint Lithography Equipment market size is projected to ...,Benzinga,news.google.com/articles/CBMimQFodHRwczovL3d3dy5iZW56aW5nYS5jb20vcHJlc3NyZWxlYXNlcy8yMy8wOS8zNDM4MDU0Ni90aGUtbmFub2ltcHJpbnQtbGl0aG9ncmFwaHktZXF1aXBtZW50LW1hcmtldC1zaXplLWlzLXByb2plY3RlZC10by1ncm93LWF0LWEtMTMtMi1jYWdyLXVudGlsLTIwMzAtYW7SAQA?hl=en-IN&gl=IN&ceid=IN%3Aen,2023-09-09
23,Subscription And Billing Management Market Forecast Report 2023-2030 | 114 Pages Report,Benzinga,news.google.com/articles/CBMiiwFodHRwczovL3d3dy5iZW56aW5nYS5jb20vcHJlc3NyZWxlYXNlcy8yMy8wOS8zNDM4MDIzMy9zdWJzY3JpcHRpb24tYW5kLWJpbGxpbmctbWFuYWdlbWVudC1tYXJrZXQtZm9yZWNhc3QtcmVwb3J0LTIwMjMtMjAzMC0xMTQtcGFnZXMtcmVwb3J00gEtaHR0cHM6Ly93d3cuYmVuemluZ2EuY29tL2FtcC9jb250ZW50LzM0MzgwMjMz?hl=en-IN&gl=IN&ceid=IN%3Aen,2023-09-09
43,"Hysteroscopic Tissue Removal System Market Analysis Report: Identifying Driving Forces, Significant Playe",Benzinga,news.google.com/articles/CBMimQFodHRwczovL3d3dy5iZW56aW5nYS5jb20vcHJlc3NyZWxlYXNlcy8yMy8wOS8zNDM4MjA5OS9oeXN0ZXJvc2NvcGljLXRpc3N1ZS1yZW1vdmFsLXN5c3RlbS1tYXJrZXQtYW5hbHlzaXMtcmVwb3J0LWlkZW50aWZ5aW5nLWRyaXZpbmctZm9yY2VzLXNpZ25pZmljYW50LXDSAS1odHRwczovL3d3dy5iZW56aW5nYS5jb20vYW1wL2NvbnRlbnQvMzQzODIwOTk?hl=en-IN&gl=IN&ceid=IN%3Aen,2023-09-09
50,"Breast X ray Machine Market Analysis Report: Sales, Revenue, Growth Factor, Top Key Players, and Producti",Benzinga,news.google.com/articles/CBMimQFodHRwczovL3d3dy5iZW56aW5nYS5jb20vcHJlc3NyZWxlYXNlcy8yMy8wOS8zNDM4MjA4Ny9icmVhc3QteC1yYXktbWFjaGluZS1tYXJrZXQtYW5hbHlzaXMtcmVwb3J0LXNhbGVzLXJldmVudWUtZ3Jvd3RoLWZhY3Rvci10b3Ata2V5LXBsYXllcnMtYW5kLXByb2R1Y3TSAS1odHRwczovL3d3dy5iZW56aW5nYS5jb20vYW1wL2NvbnRlbnQvMzQzODIwODc?hl=en-IN&gl=IN&ceid=IN%3Aen,2023-09-09
19,Product Engineering Business Analytics Market Size Report 2023-2030 | 104 Pages Report,Benzinga,news.google.com/articles/CBMiigFodHRwczovL3d3dy5iZW56aW5nYS5jb20vcHJlc3NyZWxlYXNlcy8yMy8wOS8zNDM1NjYxNC9wcm9kdWN0LWVuZ2luZWVyaW5nLWJ1c2luZXNzLWFuYWx5dGljcy1tYXJrZXQtc2l6ZS1yZXBvcnQtMjAyMy0yMDMwLTEwNC1wYWdlcy1yZXBvcnTSAS1odHRwczovL3d3dy5iZW56aW5nYS5jb20vYW1wL2NvbnRlbnQvMzQzNTY2MTQ?hl=en-IN&gl=IN&ceid=IN%3Aen,2023-09-08
34,"$4,361 for a half-inch pin: The arms industry's lucrative open secret",Ynetnews,news.google.com/articles/CBMiK2h0dHBzOi8vd3d3LnluZXRuZXdzLmNvbS9hcnRpY2xlL3MxMDAzenRkYW7SAQA?hl=en-IN&gl=IN&ceid=IN%3Aen,2023-09-08
21,"Drinking Fountains Market Size 2023 (New Insights Report) define, describe, and technology, application,",Benzinga,news.google.com/articles/CBMimQFodHRwczovL3d3dy5iZW56aW5nYS5jb20vcHJlc3NyZWxlYXNlcy8yMy8wOS8zNDM2OTYxNy9kcmlua2luZy1mb3VudGFpbnMtbWFya2V0LXNpemUtMjAyMy1uZXctaW5zaWdodHMtcmVwb3J0LWRlZmluZS1kZXNjcmliZS1hbmQtdGVjaG5vbG9neS1hcHBsaWNhdGlvbi3SAS1odHRwczovL3d3dy5iZW56aW5nYS5jb20vYW1wL2NvbnRlbnQvMzQzNjk2MTc?hl=en-IN&gl=IN&ceid=IN%3Aen,2023-09-08
