,title,source,link,date
0,India Set for First South Pole Moon Landing After Russia Crash,Bloomberg,news.google.com/articles/CBMicWh0dHBzOi8vd3d3LmJsb29tYmVyZy5jb20vbmV3cy9hcnRpY2xlcy8yMDIzLTA4LTIzL2luZGlhLXNldC1mb3ItZmlyc3Qtc291dGgtcG9sZS1tb29uLWxhbmRpbmctYWZ0ZXItcnVzc2lhLWNyYXNo0gEA?hl=en-IN&gl=IN&ceid=IN%3Aen,2023-08-23
17,"Beard Growth Oil Market | Alpha Vikings, Beardbrand, DapperGanger, Evolution GMBH",openPR,news.google.com/articles/CBMiVGh0dHBzOi8vd3d3Lm9wZW5wci5jb20vbmV3cy8zMTc2Mzk2L2JlYXJkLWdyb3d0aC1vaWwtbWFya2V0LWFscGhhLXZpa2luZ3MtYmVhcmRicmFuZNIBU2h0dHBzOi8vd3d3Lm9wZW5wci5jb20vYW1wLzMxNzYzOTYvYmVhcmQtZ3Jvd3RoLW9pbC1tYXJrZXQtYWxwaGEtdmlraW5ncy1iZWFyZGJyYW5k?hl=en-IN&gl=IN&ceid=IN%3Aen,2023-08-23
25,"Airport Ground Support Vehicles Market | Aeroservices, Alvest(TLD), COBUS Industries, Ground Support Specialis",openPR,news.google.com/articles/CBMiV2h0dHBzOi8vd3d3Lm9wZW5wci5jb20vbmV3cy8zMTc2NjE3L2FpcnBvcnQtZ3JvdW5kLXN1cHBvcnQtdmVoaWNsZXMtbWFya2V0LWFlcm9zZXJ2aWNlc9IBVmh0dHBzOi8vd3d3Lm9wZW5wci5jb20vYW1wLzMxNzY2MTcvYWlycG9ydC1ncm91bmQtc3VwcG9ydC12ZWhpY2xlcy1tYXJrZXQtYWVyb3NlcnZpY2Vz?hl=en-IN&gl=IN&ceid=IN%3Aen,2023-08-23
24,"Nappa Leather Interior Market | AFI Tannery, AXA Leather Group, Ashrafia, E. Baronos Leather",openPR,news.google.com/articles/CBMiX2h0dHBzOi8vd3d3Lm9wZW5wci5jb20vbmV3cy8zMTc2MzY4L25hcHBhLWxlYXRoZXItaW50ZXJpb3ItbWFya2V0LWFmaS10YW5uZXJ5LWF4YS1sZWF0aGVyLWdyb3Vw0gFeaHR0cHM6Ly93d3cub3BlbnByLmNvbS9hbXAvMzE3NjM2OC9uYXBwYS1sZWF0aGVyLWludGVyaW9yLW1hcmtldC1hZmktdGFubmVyeS1heGEtbGVhdGhlci1ncm91cA?hl=en-IN&gl=IN&ceid=IN%3Aen,2023-08-23
23,"Aero-Engine Coatings Market | APS Material, Inc, Akzo Nobel N.V, Chromalloy Gas Turbine LLC",openPR,news.google.com/articles/CBMiX2h0dHBzOi8vd3d3Lm9wZW5wci5jb20vbmV3cy8zMTc2NTc2L2Flcm8tZW5naW5lLWNvYXRpbmdzLW1hcmtldC1hcHMtbWF0ZXJpYWwtaW5jLWFrem8tbm9iZWwtbi120gFeaHR0cHM6Ly93d3cub3BlbnByLmNvbS9hbXAvMzE3NjU3Ni9hZXJvLWVuZ2luZS1jb2F0aW5ncy1tYXJrZXQtYXBzLW1hdGVyaWFsLWluYy1ha3pvLW5vYmVsLW4tdg?hl=en-IN&gl=IN&ceid=IN%3Aen,2023-08-23
22,"Centralized Control Cabinets Market | ABB, Eaton, Elmech Pneumatic Industries Pvt Ltd, Franzosi s.n.c",openPR,news.google.com/articles/CBMiWGh0dHBzOi8vd3d3Lm9wZW5wci5jb20vbmV3cy8zMTc2NjYzL2NlbnRyYWxpemVkLWNvbnRyb2wtY2FiaW5ldHMtbWFya2V0LWFiYi1lYXRvbi1lbG1lY2jSAVdodHRwczovL3d3dy5vcGVucHIuY29tL2FtcC8zMTc2NjYzL2NlbnRyYWxpemVkLWNvbnRyb2wtY2FiaW5ldHMtbWFya2V0LWFiYi1lYXRvbi1lbG1lY2g?hl=en-IN&gl=IN&ceid=IN%3Aen,2023-08-23
21,"Jumbo Cotton Balls Market | Bioseal, Cardinal Health, DeRoyal ...",openPR,news.google.com/articles/CBMiXWh0dHBzOi8vd3d3Lm9wZW5wci5jb20vbmV3cy8zMTc2Mzc5L2p1bWJvLWNvdHRvbi1iYWxscy1tYXJrZXQtYmlvc2VhbC1jYXJkaW5hbC1oZWFsdGgtZGVyb3lhbNIBAA?hl=en-IN&gl=IN&ceid=IN%3Aen,2023-08-23
19,"Ambient Food Products Packaging Market | Alexir Partnership, Alto Packaging, Amcor Limited, Marsden Packaging",openPR,news.google.com/articles/CBMiXWh0dHBzOi8vd3d3Lm9wZW5wci5jb20vbmV3cy8zMTc2NTYwL2FtYmllbnQtZm9vZC1wcm9kdWN0cy1wYWNrYWdpbmctbWFya2V0LWFsZXhpci1wYXJ0bmVyc2hpcNIBXGh0dHBzOi8vd3d3Lm9wZW5wci5jb20vYW1wLzMxNzY1NjAvYW1iaWVudC1mb29kLXByb2R1Y3RzLXBhY2thZ2luZy1tYXJrZXQtYWxleGlyLXBhcnRuZXJzaGlw?hl=en-IN&gl=IN&ceid=IN%3Aen,2023-08-23
18,"Flexion Tires Market | Alliance Tire Group, Apollo Vredestein, Bridgestone Corporation, Continental AG",openPR,news.google.com/articles/CBMiXmh0dHBzOi8vd3d3Lm9wZW5wci5jb20vbmV3cy8zMTc2NjM2L2ZsZXhpb24tdGlyZXMtbWFya2V0LWFsbGlhbmNlLXRpcmUtZ3JvdXAtYXBvbGxvLXZyZWRlc3RlaW7SAV1odHRwczovL3d3dy5vcGVucHIuY29tL2FtcC8zMTc2NjM2L2ZsZXhpb24tdGlyZXMtbWFya2V0LWFsbGlhbmNlLXRpcmUtZ3JvdXAtYXBvbGxvLXZyZWRlc3RlaW4?hl=en-IN&gl=IN&ceid=IN%3Aen,2023-08-23
16,"Fin Seal Pouches Market | Amcor Limited, Clifton Packaging Group Ltd, Cosmo Films Limited, DS Smith plc.",openPR,news.google.com/articles/CBMiYWh0dHBzOi8vd3d3Lm9wZW5wci5jb20vbmV3cy8zMTc2NDUwL2Zpbi1zZWFsLXBvdWNoZXMtbWFya2V0LWFtY29yLWxpbWl0ZWQtY2xpZnRvbi1wYWNrYWdpbmctZ3JvdXDSAWBodHRwczovL3d3dy5vcGVucHIuY29tL2FtcC8zMTc2NDUwL2Zpbi1zZWFsLXBvdWNoZXMtbWFya2V0LWFtY29yLWxpbWl0ZWQtY2xpZnRvbi1wYWNrYWdpbmctZ3JvdXA?hl=en-IN&gl=IN&ceid=IN%3Aen,2023-08-23
