,title,source,link,date
0,"Global Drippers Market Size, Share, Forecast 2021 - 2030 | Top key players : Elgo Irrigation Ltd. Metzer Azud",openPR,news.google.com/articles/CBMiYGh0dHBzOi8vd3d3Lm9wZW5wci5jb20vbmV3cy8zMjI0NjQ2L2dsb2JhbC1kcmlwcGVycy1tYXJrZXQtc2l6ZS1zaGFyZS1mb3JlY2FzdC0yMDIxLTIwMzAtdG9wLWtledIBX2h0dHBzOi8vd3d3Lm9wZW5wci5jb20vYW1wLzMyMjQ2NDYvZ2xvYmFsLWRyaXBwZXJzLW1hcmtldC1zaXplLXNoYXJlLWZvcmVjYXN0LTIwMjEtMjAzMC10b3Ata2V5?hl=en-IN&gl=IN&ceid=IN%3Aen,2023-09-26
5,Global Inline Drip Irrigation System Market Analysis By Manufacturers and Competitive landscape 2023-2029,openPR,news.google.com/articles/CBMiWGh0dHBzOi8vd3d3Lm9wZW5wci5jb20vbmV3cy8zMjIzNDQwL2dsb2JhbC1pbmxpbmUtZHJpcC1pcnJpZ2F0aW9uLXN5c3RlbS1tYXJrZXQtYW5hbHlzaXPSAVdodHRwczovL3d3dy5vcGVucHIuY29tL2FtcC8zMjIzNDQwL2dsb2JhbC1pbmxpbmUtZHJpcC1pcnJpZ2F0aW9uLXN5c3RlbS1tYXJrZXQtYW5hbHlzaXM?hl=en-IN&gl=IN&ceid=IN%3Aen,2023-09-26
8,"Farm Irrigation Systems Market 2023 Industry Size, Share, Trends, Opportunities, Growth Analysis and Fore",Benzinga,news.google.com/articles/CBMimQFodHRwczovL3d3dy5iZW56aW5nYS5jb20vcHJlc3NyZWxlYXNlcy8yMy8wOS8zNDg5NDIxOS9mYXJtLWlycmlnYXRpb24tc3lzdGVtcy1tYXJrZXQtMjAyMy1pbmR1c3RyeS1zaXplLXNoYXJlLXRyZW5kcy1vcHBvcnR1bml0aWVzLWdyb3d0aC1hbmFseXNpcy1hbmQtZm_SAS1odHRwczovL3d3dy5iZW56aW5nYS5jb20vYW1wL2NvbnRlbnQvMzQ4OTQyMTk?hl=en-IN&gl=IN&ceid=IN%3Aen,2023-09-26
58,"Municipal Gardening Services Market Comprehensive study explores Huge Growth in Future | Reinhart, TruGre",Benzinga,news.google.com/articles/CBMimQFodHRwczovL3d3dy5iZW56aW5nYS5jb20vcHJlc3NyZWxlYXNlcy8yMy8wOS8zNDkwNzUzOS9tdW5pY2lwYWwtZ2FyZGVuaW5nLXNlcnZpY2VzLW1hcmtldC1jb21wcmVoZW5zaXZlLXN0dWR5LWV4cGxvcmVzLWh1Z2UtZ3Jvd3RoLWluLWZ1dHVyZS1yZWluaGFydC10cnXSAS1odHRwczovL3d3dy5iZW56aW5nYS5jb20vYW1wL2NvbnRlbnQvMzQ5MDc1Mzk?hl=en-IN&gl=IN&ceid=IN%3Aen,2023-09-26
17,"Drip Irrigation Tubes Market Growth Analysis by Size and Share 2023 | Opportunities, Market Dynamics and",Benzinga,news.google.com/articles/CBMimQFodHRwczovL3d3dy5iZW56aW5nYS5jb20vcHJlc3NyZWxlYXNlcy8yMy8wOS8zNDkxNTc3Mi9kcmlwLWlycmlnYXRpb24tdHViZXMtbWFya2V0LWdyb3d0aC1hbmFseXNpcy1ieS1zaXplLWFuZC1zaGFyZS0yMDIzLW9wcG9ydHVuaXRpZXMtbWFya2V0LWR5bmFtaWNzLWHSAS1odHRwczovL3d3dy5iZW56aW5nYS5jb20vYW1wL2NvbnRlbnQvMzQ5MTU3NzI?hl=en-IN&gl=IN&ceid=IN%3Aen,2023-09-26
19,Prestressed Corrugated Pipe Market Size 2023 | Historic Data with New Benchmarks till 2030 | No of Pages,Benzinga,news.google.com/articles/CBMimQFodHRwczovL3d3dy5iZW56aW5nYS5jb20vcHJlc3NyZWxlYXNlcy8yMy8wOS8zNDg4Njg4NC9wcmVzdHJlc3NlZC1jb3JydWdhdGVkLXBpcGUtbWFya2V0LXNpemUtMjAyMy1oaXN0b3JpYy1kYXRhLXdpdGgtbmV3LWJlbmNobWFya3MtdGlsbC0yMDMwLW5vLW9mLXBhZ2XSAS1odHRwczovL3d3dy5iZW56aW5nYS5jb20vYW1wL2NvbnRlbnQvMzQ4ODY4ODQ?hl=en-IN&gl=IN&ceid=IN%3Aen,2023-09-26
20,"Smart Plantation Management Systems Market Moving in the Right Direction- Robert Bosch, John Deere, Netaf",Benzinga,news.google.com/articles/CBMimQFodHRwczovL3d3dy5iZW56aW5nYS5jb20vcHJlc3NyZWxlYXNlcy8yMy8wOS8zNDg5NzMzOS9zbWFydC1wbGFudGF0aW9uLW1hbmFnZW1lbnQtc3lzdGVtcy1tYXJrZXQtbW92aW5nLWluLXRoZS1yaWdodC1kaXJlY3Rpb24tcm9iZXJ0LWJvc2NoLWpvaG4tZGVlcmUtbmXSAS1odHRwczovL3d3dy5iZW56aW5nYS5jb20vYW1wL2NvbnRlbnQvMzQ4OTczMzk?hl=en-IN&gl=IN&ceid=IN%3Aen,2023-09-26
51,Global Lawn and Garden Watering Equipment Market Size & Growth | Forecast Report 2023-2031,Benzinga,news.google.com/articles/CBMijAFodHRwczovL3d3dy5iZW56aW5nYS5jb20vcHJlc3NyZWxlYXNlcy8yMy8wOS8zNDg5NTY3MC9nbG9iYWwtbGF3bi1hbmQtZ2FyZGVuLXdhdGVyaW5nLWVxdWlwbWVudC1tYXJrZXQtc2l6ZS1ncm93dGgtZm9yZWNhc3QtcmVwb3J0LTIwMjMtMjAzMdIBLWh0dHBzOi8vd3d3LmJlbnppbmdhLmNvbS9hbXAvY29udGVudC8zNDg5NTY3MA?hl=en-IN&gl=IN&ceid=IN%3Aen,2023-09-26
1,"Microirrigation Systems Market Trend Analysis, Latest Revenue Figures, Business Outlines, Growth Insights, Ind",openPR,news.google.com/articles/CBMiYGh0dHBzOi8vd3d3Lm9wZW5wci5jb20vbmV3cy8zMjI0NTg1L21pY3JvaXJyaWdhdGlvbi1zeXN0ZW1zLW1hcmtldC10cmVuZC1hbmFseXNpcy1sYXRlc3QtcmV2ZW51ZdIBX2h0dHBzOi8vd3d3Lm9wZW5wci5jb20vYW1wLzMyMjQ1ODUvbWljcm9pcnJpZ2F0aW9uLXN5c3RlbXMtbWFya2V0LXRyZW5kLWFuYWx5c2lzLWxhdGVzdC1yZXZlbnVl?hl=en-IN&gl=IN&ceid=IN%3Aen,2023-09-26
24,A Terminal In a Garden: Exploring Bangalore's New Airport,Living Architecture Monitor magazine,news.google.com/articles/CBMiVGh0dHBzOi8vbGl2aW5nYXJjaGl0ZWN0dXJlbW9uaXRvci5jb20vYXJ0aWNsZXMvZXhwbG9yaW5nLWJhbmdhbG9yZXMtbmV3LWFpcnBvcnQtZmEyM9IBAA?hl=en-IN&gl=IN&ceid=IN%3Aen,2023-09-25
