,title,source,link,date
39,A top EU official convenes a summit to deal with a fallout in Europe ...,Arab News,news.google.com/articles/CBMiK2h0dHBzOi8vd3d3LmFyYWJuZXdzLmNvbS9ub2RlLzIzOTIxMzEvd29ybGTSASlodHRwczovL3d3dy5hcmFibmV3cy5jb20vbm9kZS8yMzkyMTMxL2FtcA?hl=en-IN&gl=IN&ceid=IN%3Aen,2023-10-16
25,Indian lawyer calls for 'strict action' against Pakistan's Rizwan for ...,Arab News Pakistan,news.google.com/articles/CBMiLWh0dHBzOi8vd3d3LmFyYWJuZXdzLnBrL25vZGUvMjM5MjExMS9wYWtpc3RhbtIBAA?hl=en-IN&gl=IN&ceid=IN%3Aen,2023-10-16
30,Indian lawyer demands 'strict action' against Pakistan's Muhammad ...,Arab News Pakistan,news.google.com/articles/CBMiJGh0dHBzOi8vd3d3LmFyYWJuZXdzLnBrL25vZGUvMjM5MjExMdIBAA?hl=en-IN&gl=IN&ceid=IN%3Aen,2023-10-16
35,"Pakistan, UAE discuss collaboration in AI, digital economy and ...",Arab News Pakistan,news.google.com/articles/CBMiLWh0dHBzOi8vd3d3LmFyYWJuZXdzLnBrL25vZGUvMjM5MjI3MS9wYWtpc3RhbtIBAA?hl=en-IN&gl=IN&ceid=IN%3Aen,2023-10-16
42,"We must work to stop military operations in Gaza, Saudi crown ...",Arab News Pakistan,news.google.com/articles/CBMiLWh0dHBzOi8vd3d3LmFyYWJuZXdzLnBrL25vZGUvMjM5MjAxNi9wYWtpc3RhbtIBAA?hl=en-IN&gl=IN&ceid=IN%3Aen,2023-10-16
49,"Multilayer Barrier Packaging Market SWOT Analysis by Size, Status ...",Digital Journal,news.google.com/articles/CBMimgFodHRwczovL3d3dy5kaWdpdGFsam91cm5hbC5jb20vcHIvbmV3cy9hbGxpYW5jZS1kYWlseS1uZXdzcGFwZXIvbXVsdGlsYXllci1iYXJyaWVyLXBhY2thZ2luZy1tYXJrZXQtc3dvdC1hbmFseXNpcy1ieS1zaXplLXN0YXR1cy1hbmQtZm9yZWNhc3QtdG8tMjAyMy0yMDMy0gEA?hl=en-IN&gl=IN&ceid=IN%3Aen,2023-10-16
67,Thousands rally in London in solidarity with Palestinians,Arab News,news.google.com/articles/CBMiK2h0dHBzOi8vd3d3LmFyYWJuZXdzLmNvbS9ub2RlLzIzOTEyMTEvd29ybGTSASlodHRwczovL3d3dy5hcmFibmV3cy5jb20vbm9kZS8yMzkxMjExL2FtcA?hl=en-IN&gl=IN&ceid=IN%3Aen,2023-10-14
52,Kanno ends Kingdom's losing streak to snatch late draw with Nigeria,Arab News,news.google.com/articles/CBMiK2h0dHBzOi8vd3d3LmFyYWJuZXdzLmNvbS9ub2RlLzIzOTA5MDEvc3BvcnTSASlodHRwczovL3d3dy5hcmFibmV3cy5jb20vbm9kZS8yMzkwOTAxL2FtcA?hl=en-IN&gl=IN&ceid=IN%3Aen,2023-10-13
10,Will Go First's search for a suitor send more billionaires tumbling? | Mint,Mint,news.google.com/articles/CBMihAFodHRwczovL3d3dy5saXZlbWludC5jb20vb3Bpbmlvbi9vbmxpbmUtdmlld3Mvd2lsbC1nby1maXJzdHMtc2VhcmNoLWZvci1hLXN1aXRvci1zZW5kLW1vcmUtYmlsbGlvbmFpcmVzLXR1bWJsaW5nLTExNjk3MTk1NTE3ODA5Lmh0bWzSAYgBaHR0cHM6Ly93d3cubGl2ZW1pbnQuY29tL29waW5pb24vb25saW5lLXZpZXdzL3dpbGwtZ28tZmlyc3RzLXNlYXJjaC1mb3ItYS1zdWl0b3Itc2VuZC1tb3JlLWJpbGxpb25haXJlcy10dW1ibGluZy9hbXAtMTE2OTcxOTU1MTc4MDkuaHRtbA?hl=en-IN&gl=IN&ceid=IN%3Aen,2023-10-13
56,HDPE Large Blow Molded Products Market is Predicted to Reach ...,GlobeNewswire,news.google.com/articles/CBMiwAFodHRwczovL3d3dy5nbG9iZW5ld3N3aXJlLmNvbS9uZXdzLXJlbGVhc2UvMjAyMy8xMC8xMy8yNzU5ODUzLzMyNjU2L2VuL0hEUEUtTGFyZ2UtQmxvdy1Nb2xkZWQtUHJvZHVjdHMtTWFya2V0LWlzLVByZWRpY3RlZC10by1SZWFjaC1VU0QtMy05LWJpbGxpb24tYnktMjAzMS1SZWNvcmRpbmctYS00LTYtQ0FHUi1UTVItUmVwb3J0Lmh0bWzSAQA?hl=en-IN&gl=IN&ceid=IN%3Aen,2023-10-13
