,title,source,link,date
21,Champika claims media embargo on him – The Island,The Island.lk,news.google.com/articles/CBMiNmh0dHA6Ly9pc2xhbmQubGsvY2hhbXBpa2EtY2xhaW1zLW1lZGlhLWVtYmFyZ28tb24taGltL9IBAA?hl=en-IN&gl=IN&ceid=IN%3Aen,2023-11-09
22,Ven. Maduluawe Sobitha Thero commemorated – The Island,The Island.lk,news.google.com/articles/CBMiOmh0dHA6Ly9pc2xhbmQubGsvdmVuLW1hZHVsdWF3ZS1zb2JpdGhhLXRoZXJvLWNvbW1lbW9yYXRlZC_SAQA?hl=en-IN&gl=IN&ceid=IN%3Aen,2023-11-09
35,Ranawaka warns of 11% hike in fuel prices with revised VAT from ...,The Island.lk,news.google.com/articles/CBMiWGh0dHA6Ly9pc2xhbmQubGsvcmFuYXdha2Etd2FybnMtb2YtMTEtaGlrZS1pbi1mdWVsLXByaWNlcy13aXRoLXJldmlzZWQtdmF0LWZyb20tamFudWFyeS_SAQA?hl=en-IN&gl=IN&ceid=IN%3Aen,2023-11-09
27,SLC ready to accept some members of Interim Committee appointed ...,The Island.lk,news.google.com/articles/CBMiZGh0dHA6Ly9pc2xhbmQubGsvc2xjLXJlYWR5LXRvLWFjY2VwdC1zb21lLW1lbWJlcnMtb2YtaW50ZXJpbS1jb21taXR0ZWUtYXBwb2ludGVkLWJ5LXNwb3J0cy1taW5pc3Rlci_SAQA?hl=en-IN&gl=IN&ceid=IN%3Aen,2023-11-09
13,US funding deepwater container terminal in Colombo,The Island.lk,news.google.com/articles/CBMiRGh0dHA6Ly9pc2xhbmQubGsvdXMtZnVuZGluZy1kZWVwd2F0ZXItY29udGFpbmVyLXRlcm1pbmFsLWluLWNvbG9tYm8v0gEA?hl=en-IN&gl=IN&ceid=IN%3Aen,2023-11-09
26,Wimal: Country descending into anarchy without duly-appointed IGP,The Island.lk,news.google.com/articles/CBMiUmh0dHA6Ly9pc2xhbmQubGsvd2ltYWwtY291bnRyeS1kZXNjZW5kaW5nLWludG8tYW5hcmNoeS13aXRob3V0LWR1bHktYXBwb2ludGVkLWlncC_SAQA?hl=en-IN&gl=IN&ceid=IN%3Aen,2023-11-09
19,COPF calls for tax on companies benefited by 'Midnight Gazette',The Island.lk,news.google.com/articles/CBMiT2h0dHA6Ly9pc2xhbmQubGsvY29wZi1jYWxscy1mb3ItdGF4LW9uLWNvbXBhbmllcy1iZW5lZml0ZWQtYnktbWlkbmlnaHQtZ2F6ZXR0ZS_SAQA?hl=en-IN&gl=IN&ceid=IN%3Aen,2023-11-09
24,House to move joint resolution to remove SLC office-bearers today,The Island.lk,news.google.com/articles/CBMiU2h0dHA6Ly9pc2xhbmQubGsvaG91c2UtdG8tbW92ZS1qb2ludC1yZXNvbHV0aW9uLXRvLXJlbW92ZS1zbGMtb2ZmaWNlLWJlYXJlcnMtdG9kYXkv0gEA?hl=en-IN&gl=IN&ceid=IN%3Aen,2023-11-09
23,'Ministers cannot be expected to consult Prez on every issue',The Island.lk,news.google.com/articles/CBMiTWh0dHA6Ly9pc2xhbmQubGsvbWluaXN0ZXJzLWNhbm5vdC1iZS1leHBlY3RlZC10by1jb25zdWx0LXByZXotb24tZXZlcnktaXNzdWUv0gEA?hl=en-IN&gl=IN&ceid=IN%3Aen,2023-11-09
44,SC: 2/3 majority needed for passage of Online Safety Bill in its ...,The Island.lk,news.google.com/articles/CBMiXmh0dHA6Ly9pc2xhbmQubGsvc2MtMi0zLW1ham9yaXR5LW5lZWRlZC1mb3ItcGFzc2FnZS1vZi1vbmxpbmUtc2FmZXR5LWJpbGwtaW4taXRzLXByZXNlbnQtZm9ybS_SAQA?hl=en-IN&gl=IN&ceid=IN%3Aen,2023-11-08
