,title,source,link,date
20,A Promising Future on Skateboard Platform Market Size is projected ...,Benzinga,news.google.com/articles/CBMimQFodHRwczovL3d3dy5iZW56aW5nYS5jb20vcHJlc3NyZWxlYXNlcy8yMy8wOS8zNDIxMjEwMy9hLXByb21pc2luZy1mdXR1cmUtb24tc2thdGVib2FyZC1wbGF0Zm9ybS1tYXJrZXQtc2l6ZS1pcy1wcm9qZWN0ZWQtdG8tcHJvZ3Jlc3MtYXQtYS1jYWdyLW9mLTYtOC1ieS3SAQA?hl=en-IN&gl=IN&ceid=IN%3Aen,2023-09-04
9,India's Green Hydrogen Transition Will Be A Bumpy Ride,EastMojo,news.google.com/articles/CBMiZmh0dHBzOi8vd3d3LmVhc3Rtb2pvLmNvbS9lbnZpcm9ubWVudC8yMDIzLzA5LzA0L2luZGlhcy1ncmVlbi1oeWRyb2dlbi10cmFuc2l0aW9uLXdpbGwtYmUtYS1idW1weS1yaWRlL9IBAA?hl=en-IN&gl=IN&ceid=IN%3Aen,2023-09-04
4,DPT declares three more candidates,"Kuensel, Buhutan's National Newspaper",news.google.com/articles/CBMiP2h0dHBzOi8va3VlbnNlbG9ubGluZS5jb20vZHB0LWRlY2xhcmVzLXRocmVlLW1vcmUtY2FuZGlkYXRlcy0zL9IBAA?hl=en-IN&gl=IN&ceid=IN%3Aen,2023-09-04
25,Good Fishing to Start Labor Day Weekend - Ocean City MD Fishing,Fish in OC,news.google.com/articles/CBMiPWh0dHBzOi8vZmlzaGlub2MuY29tL2dvb2QtZmlzaGluZy10by1zdGFydC1sYWJvci1kYXktd2Vla2VuZC_SAQA?hl=en-IN&gl=IN&ceid=IN%3Aen,2023-09-03
14,Best Spirituality Books: Top 5 Reads Most Recommended By Experts,Study Finds,news.google.com/articles/CBMiL2h0dHBzOi8vc3R1ZHlmaW5kcy5vcmcvYmVzdC1zcGlyaXR1YWxpdHktYm9va3Mv0gEA?hl=en-IN&gl=IN&ceid=IN%3Aen,2023-09-03
23,I'm gay and tired of closeted married men approaching me for affairs,The Irish Times,news.google.com/articles/CBMif2h0dHBzOi8vd3d3LmlyaXNodGltZXMuY29tL2hlYWx0aC95b3VyLXdlbGxuZXNzLzIwMjMvMDkvMDMvaW0tZ2F5LWFuZC10aXJlZC1vZi1jbG9zZXRlZC1tYXJyaWVkLW1lbi1hcHByb2FjaGluZy1tZS1mb3ItYWZmYWlycy_SAQA?hl=en-IN&gl=IN&ceid=IN%3Aen,2023-09-03
29,2023 Enhanced Water Market Size and Share | Market Sales Volume Status and Outlook till 2030,Benzinga,news.google.com/articles/CBMikAFodHRwczovL3d3dy5iZW56aW5nYS5jb20vcHJlc3NyZWxlYXNlcy8yMy8wOS8zNDE5MDcxMy8yMDIzLWVuaGFuY2VkLXdhdGVyLW1hcmtldC1zaXplLWFuZC1zaGFyZS1tYXJrZXQtc2FsZXMtdm9sdW1lLXN0YXR1cy1hbmQtb3V0bG9vay10aWxsLTIwMzDSAS1odHRwczovL3d3dy5iZW56aW5nYS5jb20vYW1wL2NvbnRlbnQvMzQxOTA3MTM?hl=en-IN&gl=IN&ceid=IN%3Aen,2023-09-02
10,Daily Brief Equity Bottom-Up: Mengniu Dairy (2319 HK): Solid Value ...,Smartkarma,news.google.com/articles/CBMiemh0dHBzOi8vd3d3LnNtYXJ0a2FybWEuY29tL2hvbWUvZGFpbHktYnJpZWZzL2RhaWx5LWJyaWVmLWVxdWl0eS1ib3R0b20tdXAtbWVuZ25pdS1kYWlyeS0yMzE5LWhrLXNvbGlkLXZhbHVlLXBsYXktYW5kLW1vcmUv0gEA?hl=en-IN&gl=IN&ceid=IN%3Aen,2023-09-02
17,Nollywood star charges corps members to shun cybercrimes ...,Blueprint Newspapers Limited,news.google.com/articles/CBMiUmh0dHBzOi8vd3d3LmJsdWVwcmludC5uZy9ub2xseXdvb2Qtc3Rhci1jaGFyZ2VzLWNvcnBzLW1lbWJlcnMtdG8tc2h1bi1jeWJlcmNyaW1lcy_SAQA?hl=en-IN&gl=IN&ceid=IN%3Aen,2023-09-01
22,The Week in Canadian Press Releases: 10 Stories You Need to See,Canada NewsWire,news.google.com/articles/CBMic2h0dHBzOi8vd3d3Lm5ld3N3aXJlLmNhL25ld3MtcmVsZWFzZXMvdGhlLXdlZWstaW4tY2FuYWRpYW4tcHJlc3MtcmVsZWFzZXMtMTAtc3Rvcmllcy15b3UtbmVlZC10by1zZWUtODA5NTM3NzQ1Lmh0bWzSAQA?hl=en-IN&gl=IN&ceid=IN%3Aen,2023-09-01
