,title,source,link,date
15,"Eco World, IJM Corp, UMW, KSL, Dayang, BPlant, Suria Capital ...",The Edge Malaysia,news.google.com/articles/CBMiJ2h0dHBzOi8vdGhlZWRnZW1hbGF5c2lhLmNvbS9ub2RlLzY4MDE3OdIBAA?hl=en-IN&gl=IN&ceid=IN%3Aen,2023-08-25
11,Belgian cyclist Tijl De Decker dies after crash during training,KSL.com,news.google.com/articles/CBMiZGh0dHBzOi8vd3d3LmtzbC5jb20vYXJ0aWNsZS81MDcxNjk2NS9iZWxnaWFuLWN5Y2xpc3QtdGlqbC1kZS1kZWNrZXItZGllcy1hZnRlci1jcmFzaC1kdXJpbmctdHJhaW5pbmfSAQA?hl=en-IN&gl=IN&ceid=IN%3Aen,2023-08-25
39,'Utah's most exclusive club': Honoring the state's 145 centenarians,KSL.com,news.google.com/articles/CBMiY2h0dHBzOi8vd3d3LmtzbC5jb20vYXJ0aWNsZS81MDcxNjQ5NS91dGFocy1tb3N0LWV4Y2x1c2l2ZS1jbHViLWhvbm9yaW5nLXRoZS1zdGF0ZXMtMTQ1LWNlbnRlbmFyaWFuc9IBAA?hl=en-IN&gl=IN&ceid=IN%3Aen,2023-08-25
28,Utahn loses Maui business to fire | KSL.com,KSL.com,news.google.com/articles/CBMiRmh0dHBzOi8vd3d3LmtzbC5jb20vYXJ0aWNsZS81MDcxNTg1OS91dGFobi1sb3Nlcy1tYXVpLWJ1c2luZXNzLXRvLWZpcmXSAQA?hl=en-IN&gl=IN&ceid=IN%3Aen,2023-08-25
1,"Montenegro, Australia, Italy and Latvia win World Cup opening games",KSL.com,news.google.com/articles/CBMiZmh0dHBzOi8vd3d3LmtzbC5jb20vYXJ0aWNsZS81MDcxNjkzMC9tb250ZW5lZ3JvLWF1c3RyYWxpYS1pdGFseS1hbmQtbGF0dmlhLXdpbi13b3JsZC1jdXAtb3BlbmluZy1nYW1lc9IBAA?hl=en-IN&gl=IN&ceid=IN%3Aen,2023-08-25
24,"Man shot, alleged gunman also injured in Millcreek fight",KSL.com,news.google.com/articles/CBMiXGh0dHBzOi8vd3d3LmtzbC5jb20vYXJ0aWNsZS81MDcxNjY1NC9tYW4tc2hvdC1hbGxlZ2VkLWd1bm1hbi1hbHNvLWluanVyZWQtaW4tbWlsbGNyZWVrLWZpZ2h00gEA?hl=en-IN&gl=IN&ceid=IN%3Aen,2023-08-25
19,Who's on the hook if your car gets damaged in a car wash?,KSLTV,news.google.com/articles/CBMiUWh0dHBzOi8va3NsdHYuY29tLzU4MDk0MC93aG9zLW9uLXRoZS1ob29rLWlmLXlvdXItY2FyLWdldHMtZGFtYWdlZC1pbi1hLWNhci13YXNoL9IBAA?hl=en-IN&gl=IN&ceid=IN%3Aen,2023-08-25
18,Hundreds of bats discovered and removed from Salt Lake's ...,KSL.com,news.google.com/articles/CBMiamh0dHBzOi8vd3d3LmtzbC5jb20vYXJ0aWNsZS81MDcxNjcxOC9odW5kcmVkcy1vZi1iYXRzLWRpc2NvdmVyZWQtYW5kLXJlbW92ZWQtZnJvbS1zYWx0LWxha2VzLWhpZ2hsYW5kLWhpZ2jSAQA?hl=en-IN&gl=IN&ceid=IN%3Aen,2023-08-25
35,"Maui County sues utility, alleging negligence over fires that ravaged ...",KSL.com,news.google.com/articles/CBMicWh0dHBzOi8vd3d3LmtzbC5jb20vYXJ0aWNsZS81MDcxNjU1OC9tYXVpLWNvdW50eS1zdWVzLXV0aWxpdHktYWxsZWdpbmctbmVnbGlnZW5jZS1vdmVyLWZpcmVzLXRoYXQtcmF2YWdlZC1sYWhhaW5h0gEA?hl=en-IN&gl=IN&ceid=IN%3Aen,2023-08-25
58,"Criminal cases, not election, may decide if Trump can serve ...",KSLTV,news.google.com/articles/CBMiZGh0dHBzOi8va3NsdHYuY29tLzU4MDk1OC9jcmltaW5hbC1jYXNlcy1ub3QtZWxlY3Rpb24tbWF5LWRlY2lkZS1pZi10cnVtcC1jYW4tc2VydmUtcHJlc2lkZW5jeS1hZ2Fpbi_SAQA?hl=en-IN&gl=IN&ceid=IN%3Aen,2023-08-25
