,title,source,link,date
97,PSG : Luis Enrique a montré son intérêt pour un joueur de l'OM,Onze Mondial,news.google.com/articles/CBMiamh0dHBzOi8vd3d3Lm9uemVtb25kaWFsLmNvbS90cmFuc2ZlcnRzL3BzZy1sdWlzLWVucmlxdWUtYS1tb250cmUtc29uLWludGVyZXQtcG91ci11bi1qb3VldXItZGUtbC1vbS04NDgyMzXSAQA?hl=en-IN&gl=IN&ceid=IN%3Aen,2023-09-03
32,"Obituary for Vivian L. Burns-Webb, of Little Rock, AR",Arkansas Online,news.google.com/articles/CBMiWWh0dHBzOi8vd3d3LmFya2Fuc2Fzb25saW5lLmNvbS9vYml0dWFyaWVzLzIwMjMvc2VwLzAzL3Zpdmlhbi1idXJucy13ZWJiLTIwMjMtMDktMDMtNDIxMTgv0gEA?hl=en-IN&gl=IN&ceid=IN%3Aen,2023-09-03
24,Int'l Conference in Cairo on Social Media's Impact on Religious ...,Asharq Al-awsat - English,news.google.com/articles/CBMidGh0dHBzOi8vZW5nbGlzaC5hYXdzYXQuY29tL2FyYWItd29ybGQvNDUyMzg4Ni1pbnQlRTIlODAlOTlsLWNvbmZlcmVuY2UtY2Fpcm8tc29jaWFsLW1lZGlhcy1pbXBhY3QtcmVsaWdpb3VzLXJoZXRvcmlj0gEA?hl=en-IN&gl=IN&ceid=IN%3Aen,2023-09-03
79,"OM : nouveau couac pour l'Ajax, prochain adversaire européen de ...",Onze Mondial,news.google.com/articles/CBMidmh0dHBzOi8vd3d3Lm9uemVtb25kaWFsLmNvbS9saWd1ZS1ldXJvcGEvb20tbm91dmVhdS1jb3VhYy1wb3VyLWwtYWpheC1wcm9jaGFpbi1hZHZlcnNhaXJlLWV1cm9wZWVuLWRlLW1hcnNlaWxsZS04NDgzMTDSAQA?hl=en-IN&gl=IN&ceid=IN%3Aen,2023-09-03
26,Obituary: Peter L. Ault,Kennebec Journal and Morning Sentinel,news.google.com/articles/CBMiP2h0dHBzOi8vd3d3LmNlbnRyYWxtYWluZS5jb20vMjAyMy8wOS8wMy9vYml0dWFyeXBldGVyLWwtYXVsdC0yL9IBAA?hl=en-IN&gl=IN&ceid=IN%3Aen,2023-09-03
78,L'IAA fait peau neuve: vers une coopétition germano-chinoise?,Le Blog Auto,news.google.com/articles/CBMiN2h0dHBzOi8vd3d3LmxlYmxvZ2F1dG8uY29tL2JpbGFuLWV0LWZpbmFuY2VzL2lhYWEtOTQ3MTHSAQA?hl=en-IN&gl=IN&ceid=IN%3Aen,2023-09-03
28,Blandine L'Hirondel Post-2023 UTMB Interview – iRunFar,iRunFar,news.google.com/articles/CBMiQ2h0dHBzOi8vd3d3LmlydW5mYXIuY29tL2JsYW5kaW5lLWxoaXJvbmRlbC1wb3N0LTIwMjMtdXRtYi1pbnRlcnZpZXfSAQA?hl=en-IN&gl=IN&ceid=IN%3Aen,2023-09-03
29,3-day Model UN Conference held at Chattogram’s Presidency Int’l School,The Business Standard,news.google.com/articles/CBMia2h0dHBzOi8vd3d3LnRic25ld3MubmV0L2JhbmdsYWRlc2gvMy1kYXktbW9kZWwtdW4tY29uZmVyZW5jZS1oZWxkLWNoYXR0b2dyYW1zLXByZXNpZGVuY3ktaW50bC1zY2hvb2wtNjkzOTc40gFvaHR0cHM6Ly93d3cudGJzbmV3cy5uZXQvYmFuZ2xhZGVzaC8zLWRheS1tb2RlbC11bi1jb25mZXJlbmNlLWhlbGQtY2hhdHRvZ3JhbXMtcHJlc2lkZW5jeS1pbnRsLXNjaG9vbC02OTM5Nzg_YW1w?hl=en-IN&gl=IN&ceid=IN%3Aen,2023-09-03
30,Fred L. Goldenberg: Prepare yourself for the Medicare onslaught,Traverse City Record Eagle,news.google.com/articles/CBMimgFodHRwczovL3d3dy5yZWNvcmQtZWFnbGUuY29tL25ld3MvYnVzaW5lc3MvZnJlZC1sLWdvbGRlbmJlcmctcHJlcGFyZS15b3Vyc2VsZi1mb3ItdGhlLW1lZGljYXJlLW9uc2xhdWdodC9hcnRpY2xlX2MwY2YxMTAyLTQ3NDgtMTFlZS04NzIxLTE3YWI0ZThkYTJlZC5odG1s0gEA?hl=en-IN&gl=IN&ceid=IN%3Aen,2023-09-03
77,Al-Ahli : un Marocain et un compatriote plongent l'équipe de Mahrez ...,Afrik-Foot,news.google.com/articles/CBMiR2h0dHBzOi8vd3d3LmFmcmlrLWZvb3QuY29tL2FsLWFobGktZGVmYWl0ZS1tYWhyZXotbW91cmFkLWJhdG5hLWJlbmRlYmth0gEA?hl=en-IN&gl=IN&ceid=IN%3Aen,2023-09-03
