,title,source,link,date
15,Multifunctional Airflow Tower Market Size 2023 Top Companies ...,Benzinga,news.google.com/articles/CBMimQFodHRwczovL3d3dy5iZW56aW5nYS5jb20vcHJlc3NyZWxlYXNlcy8yMy8wOS8zNDQyNDk4OC9tdWx0aWZ1bmN0aW9uYWwtYWlyZmxvdy10b3dlci1tYXJrZXQtc2l6ZS0yMDIzLXRvcC1jb21wYW5pZXMtbG9uZy10ZXJtLXBsYW5uZWQtYnVzaW5lc3Mtc3RyYXRlZ3ktdXDSAQA?hl=en-IN&gl=IN&ceid=IN%3Aen,2023-09-11
27,"Textile Machinery Market Size 2023: Report by Market Share, Growth Rate, Historical Data and Industry Dev",Benzinga,news.google.com/articles/CBMimQFodHRwczovL3d3dy5iZW56aW5nYS5jb20vcHJlc3NyZWxlYXNlcy8yMy8wOS8zNDM3ODk4MC90ZXh0aWxlLW1hY2hpbmVyeS1tYXJrZXQtc2l6ZS0yMDIzLXJlcG9ydC1ieS1tYXJrZXQtc2hhcmUtZ3Jvd3RoLXJhdGUtaGlzdG9yaWNhbC1kYXRhLWFuZC1pbmR1c3RyeS3SAS1odHRwczovL3d3dy5iZW56aW5nYS5jb20vYW1wL2NvbnRlbnQvMzQzNzg5ODA?hl=en-IN&gl=IN&ceid=IN%3Aen,2023-09-09
28,"Textile Machinery Market Dynamics 2023: A Global Analysis of Trends, Challenges, and Opportunities by 203",Benzinga,news.google.com/articles/CBMimQFodHRwczovL3d3dy5iZW56aW5nYS5jb20vcHJlc3NyZWxlYXNlcy8yMy8wOS8zNDMzNzc0NS90ZXh0aWxlLW1hY2hpbmVyeS1tYXJrZXQtZHluYW1pY3MtMjAyMy1hLWdsb2JhbC1hbmFseXNpcy1vZi10cmVuZHMtY2hhbGxlbmdlcy1hbmQtb3Bwb3J0dW5pdGllcy1ieS3SAS1odHRwczovL3d3dy5iZW56aW5nYS5jb20vYW1wL2NvbnRlbnQvMzQzMzc3NDU?hl=en-IN&gl=IN&ceid=IN%3Aen,2023-09-07
29,Machine Tool Market Future Growth Analysis Report till 2030,Benzinga,news.google.com/articles/CBMicWh0dHBzOi8vd3d3LmJlbnppbmdhLmNvbS9wcmVzc3JlbGVhc2VzLzIzLzA5LzM0MzAyMDg2L21hY2hpbmUtdG9vbC1tYXJrZXQtZnV0dXJlLWdyb3d0aC1hbmFseXNpcy1yZXBvcnQtdGlsbC0yMDMw0gEtaHR0cHM6Ly93d3cuYmVuemluZ2EuY29tL2FtcC9jb250ZW50LzM0MzAyMDg2?hl=en-IN&gl=IN&ceid=IN%3Aen,2023-09-07
37,Tea Rolling Machine Market Size in 2023: Competitive landscape and Leading Country Data,Benzinga,news.google.com/articles/CBMijAFodHRwczovL3d3dy5iZW56aW5nYS5jb20vcHJlc3NyZWxlYXNlcy8yMy8wOS8zNDMwNDQ0Mi90ZWEtcm9sbGluZy1tYWNoaW5lLW1hcmtldC1zaXplLWluLTIwMjMtY29tcGV0aXRpdmUtbGFuZHNjYXBlLWFuZC1sZWFkaW5nLWNvdW50cnktZGF0YdIBLWh0dHBzOi8vd3d3LmJlbnppbmdhLmNvbS9hbXAvY29udGVudC8zNDMwNDQ0Mg?hl=en-IN&gl=IN&ceid=IN%3Aen,2023-09-07
30,"Spinning Machinery Market Futuristic Outlook: Growth Patterns, Innovation, Transformation and Expansion 2",Benzinga,news.google.com/articles/CBMimQFodHRwczovL3d3dy5iZW56aW5nYS5jb20vcHJlc3NyZWxlYXNlcy8yMy8wOS8zNDI2MTE2OS9zcGlubmluZy1tYWNoaW5lcnktbWFya2V0LWZ1dHVyaXN0aWMtb3V0bG9vay1ncm93dGgtcGF0dGVybnMtaW5ub3ZhdGlvbi10cmFuc2Zvcm1hdGlvbi1hbmQtZXhwYW5zaW_SAS1odHRwczovL3d3dy5iZW56aW5nYS5jb20vYW1wL2NvbnRlbnQvMzQyNjExNjk?hl=en-IN&gl=IN&ceid=IN%3Aen,2023-09-06
12,Automatic Winding Machine Market Size and Share Analysis: Evaluating Growth Potential and Future Trends w,Benzinga,news.google.com/articles/CBMimQFodHRwczovL3d3dy5iZW56aW5nYS5jb20vcHJlc3NyZWxlYXNlcy8yMy8wOS8zNDIwMTQwNi9hdXRvbWF0aWMtd2luZGluZy1tYWNoaW5lLW1hcmtldC1zaXplLWFuZC1zaGFyZS1hbmFseXNpcy1ldmFsdWF0aW5nLWdyb3d0aC1wb3RlbnRpYWwtYW5kLWZ1dHVyZS10cmXSAS1odHRwczovL3d3dy5iZW56aW5nYS5jb20vYW1wL2NvbnRlbnQvMzQyMDE0MDY?hl=en-IN&gl=IN&ceid=IN%3Aen,2023-09-04
25,"‘If I can, anyone can’: From a government school in Tamil Nadu to the moon, Chandrayaan 3 project director’s rise and rise",The Indian Express,news.google.com/articles/CBMiVGh0dHBzOi8vaW5kaWFuZXhwcmVzcy5jb20vYXJ0aWNsZS9pbmRpYS9jaGFuZHJheWFhbi0zLXByb2plY3QtZGlyZWN0b3ItaXNyby04OTE5ODUyL9IBWWh0dHBzOi8vaW5kaWFuZXhwcmVzcy5jb20vYXJ0aWNsZS9pbmRpYS9jaGFuZHJheWFhbi0zLXByb2plY3QtZGlyZWN0b3ItaXNyby04OTE5ODUyL2xpdGUv?hl=en-IN&gl=IN&ceid=IN%3Aen,2023-09-02
