,title,source,link,date
14,Dustin Rennie of RE/MAX Belize at The Belize Investment Summit 2023,Benzinga,news.google.com/articles/CBMiemh0dHBzOi8vd3d3LmJlbnppbmdhLmNvbS9wcmVzc3JlbGVhc2VzLzIzLzA5L2FiMzQ0NjYyNjkvZHVzdGluLXJlbm5pZS1vZi1yZW1heC1iZWxpemUtYXQtdGhlLWJlbGl6ZS1pbnZlc3RtZW50LXN1bW1pdC0yMDIz0gEtaHR0cHM6Ly93d3cuYmVuemluZ2EuY29tL2FtcC9jb250ZW50LzM0NDY2MjY5?hl=en-IN&gl=IN&ceid=IN%3Aen,2023-09-12
7,"For community built atop former landfill, a long wait for justice",The Christian Science Monitor,news.google.com/articles/CBMicGh0dHBzOi8vd3d3LmNzbW9uaXRvci5jb20vRW52aXJvbm1lbnQvMjAyMy8wOTExL0Zvci1jb21tdW5pdHktYnVpbHQtYXRvcC1mb3JtZXItbGFuZGZpbGwtYS1sb25nLXdhaXQtZm9yLWp1c3RpY2XSAQA?hl=en-IN&gl=IN&ceid=IN%3Aen,2023-09-11
8,Is the UK still a hotbed for fintech innovation?,Fintech Nexus News,news.google.com/articles/CBMiTWh0dHBzOi8vd3d3LmZpbnRlY2huZXh1cy5jb20vaXMtdGhlLXVrLXN0aWxsLWEtaG90YmVkLWZvci1maW50ZWNoLWlubm92YXRpb24v0gEA?hl=en-IN&gl=IN&ceid=IN%3Aen,2023-09-11
2,Savills showcases landmark London Properties at Cityscape Global,ZAWYA,news.google.com/articles/CBMif2h0dHBzOi8vd3d3Lnphd3lhLmNvbS9lbi9wcmVzcy1yZWxlYXNlL2NvbXBhbmllcy1uZXdzL3NhdmlsbHMtc2hvd2Nhc2VzLWxhbmRtYXJrLWxvbmRvbi1wcm9wZXJ0aWVzLWF0LWNpdHlzY2FwZS1nbG9iYWwtdjF1cnQ2dTPSAYUBaHR0cHM6Ly93d3cuemF3eWEuY29tL2VuL3ByZXNzLXJlbGVhc2UvY29tcGFuaWVzLW5ld3Mvc2F2aWxscy1zaG93Y2FzZXMtbGFuZG1hcmstbG9uZG9uLXByb3BlcnRpZXMtYXQtY2l0eXNjYXBlLWdsb2JhbC12MXVydDZ1Mz9hbXA9MQ?hl=en-IN&gl=IN&ceid=IN%3Aen,2023-09-10
16,Tech Industry Cheers G20's Comprehensive Vision for Digital ...,Cryptopolitan,news.google.com/articles/CBMiSWh0dHBzOi8vd3d3LmNyeXB0b3BvbGl0YW4uY29tL2cyMHMtZGlnaXRhbC1pbmZyYXN0cnVjdHVyZS1yZXNwb25zaWJsZS1haS_SAQA?hl=en-IN&gl=IN&ceid=IN%3Aen,2023-09-10
10,In review: sports governance and dispute resolution in United ...,Lexology,news.google.com/articles/CBMiU2h0dHBzOi8vd3d3LmxleG9sb2d5LmNvbS9saWJyYXJ5L2RldGFpbC5hc3B4P2c9ZjIxMTY5MGMtNzViNS00YTc4LTk2ZDAtNmIyMjJiMWYxYzMz0gEA?hl=en-IN&gl=IN&ceid=IN%3Aen,2023-09-08
12,Legible Secures Worldwide Rights to Stan Lee's Workforce in Landmark Deal With Kartoon Studios - Legible,Benzinga,news.google.com/articles/CBMilAFodHRwczovL3d3dy5iZW56aW5nYS5jb20vcHJlc3NyZWxlYXNlcy8yMy8wOS9iMzQzNjAyNzgvbGVnaWJsZS1zZWN1cmVzLXdvcmxkd2lkZS1yaWdodHMtdG8tc3Rhbi1sZWVzLXdvcmtmb3JjZS1pbi1sYW5kbWFyay1kZWFsLXdpdGgta2FydG9vbi1zdHVkaW9z0gEtaHR0cHM6Ly93d3cuYmVuemluZ2EuY29tL2FtcC9jb250ZW50LzM0MzYwMjc4?hl=en-IN&gl=IN&ceid=IN%3Aen,2023-09-08
15,"UN report says the world is way off track to curb global warming, but ...",Arab News,news.google.com/articles/CBMiK2h0dHBzOi8vd3d3LmFyYWJuZXdzLmNvbS9ub2RlLzIzNzAwMzEvd29ybGTSASlodHRwczovL3d3dy5hcmFibmV3cy5jb20vbm9kZS8yMzcwMDMxL2FtcA?hl=en-IN&gl=IN&ceid=IN%3Aen,2023-09-08
0,Penny Stocks: Stocks likely to be in focus tomorrow!,Dalal Street Investment Journal,news.google.com/articles/CBMiXmh0dHBzOi8vd3d3LmRzaWouaW4vZHNpamFydGljbGVkZXRhaWwvcGVubnktc3RvY2tzLXN0b2Nrcy1saWtlbHktdG8tYmUtaW4tZm9jdXMtdG9tb3Jyb3ctMzMxMTTSAQA?hl=en-IN&gl=IN&ceid=IN%3Aen,2023-09-07
5,Legendary Luxury Real Estate Icons Loy Carlos and Kenneth J ...,Business Wire,news.google.com/articles/CBMixwFodHRwczovL3d3dy5idXNpbmVzc3dpcmUuY29tL25ld3MvaG9tZS8yMDIzMDkwNjE0NjYzMS9lbi9MZWdlbmRhcnktTHV4dXJ5LVJlYWwtRXN0YXRlLUljb25zLUxveS1DYXJsb3MtYW5kLUtlbm5ldGgtSi4tTW9vcmUtSm9pbi1OZXN0LVNlZWtlcnMtSW50ZXJuYXRpb25hbC10by1MYXVuY2gtSW5ub3ZhdGl2ZS1HbG9iYWwtV2VhbHRoLURpdmlzaW9u0gEA?hl=en-IN&gl=IN&ceid=IN%3Aen,2023-09-07
