,title,source,link,date
21,Diving into the Fox Hole of the Mysterious Preserve Sporting Club ...,Rhode Island Monthly,news.google.com/articles/CBMiRGh0dHBzOi8vd3d3LnJpbW9udGhseS5jb20vdGhlLXByZXNlcnZlLXNwb3J0aW5nLWNsdWItYW5kLXJlc2lkZW5jZXMv0gEA?hl=en-IN&gl=IN&ceid=IN%3Aen,2023-09-20
3,Cork Company of the Year @ 25: Insights into award winners,Irish Examiner,news.google.com/articles/CBMiQ2h0dHBzOi8vd3d3LmlyaXNoZXhhbWluZXIuY29tL2J1c2luZXNzL2NvbXBhbmllcy9hcmlkLTQxMjMwNjY2Lmh0bWzSAQA?hl=en-IN&gl=IN&ceid=IN%3Aen,2023-09-20
4,"GoDog, The Beach Company Forge Dynamic Partnership to Elevate Pet-Friendly Living Experience",Benzinga,news.google.com/articles/CBMikgFodHRwczovL3d3dy5iZW56aW5nYS5jb20vcHJlc3NyZWxlYXNlcy8yMy8wOS9iMzQ3NjA1NjMvZ29kb2ctdGhlLWJlYWNoLWNvbXBhbnktZm9yZ2UtZHluYW1pYy1wYXJ0bmVyc2hpcC10by1lbGV2YXRlLXBldC1mcmllbmRseS1saXZpbmctZXhwZXJpZW5jZdIBLWh0dHBzOi8vd3d3LmJlbnppbmdhLmNvbS9hbXAvY29udGVudC8zNDc2MDU2Mw?hl=en-IN&gl=IN&ceid=IN%3Aen,2023-09-20
15,International: Private Fund Spotlight,Lexology,news.google.com/articles/CBMiU2h0dHBzOi8vd3d3LmxleG9sb2d5LmNvbS9saWJyYXJ5L2RldGFpbC5hc3B4P2c9MGEwMGU2NmItMDFkNS00MTc4LWE4NjUtMjE4MTBlZmVjMTFk0gEA?hl=en-IN&gl=IN&ceid=IN%3Aen,2023-09-20
6,Find Out If Your Provincial Rep Is Invested In Real Estate,The Maple,news.google.com/articles/CBMiMmh0dHBzOi8vd3d3LnJlYWR0aGVtYXBsZS5jb20vcHJvdmluY2lhbC1sYW5kbG9yZHMv0gEA?hl=en-IN&gl=IN&ceid=IN%3Aen,2023-09-19
9,Disputes and challenges involving NFTs and digital assets,Lexology,news.google.com/articles/CBMidmh0dHBzOi8vd3d3LmxleG9sb2d5LmNvbS9jb21tZW50YXJ5L2xpdGlnYXRpb24vaG9uZy1rb25nL3JwYy9kaXNwdXRlcy1hbmQtY2hhbGxlbmdlcy1pbnZvbHZpbmctbmZ0cy1hbmQtZGlnaXRhbC1hc3NldHPSAQA?hl=en-IN&gl=IN&ceid=IN%3Aen,2023-09-19
16,"Deaths, revoked titles and threats in half-century court battle for ...",Nation,news.google.com/articles/CBMibGh0dHBzOi8vbmF0aW9uLmFmcmljYS9rZW55YS9jb3VudGllcy9uYWlyb2JpL2RlYXRocy10aHJlYXRzLTUzLXllYXItY291cnQtYmF0dGxlLXNoNTRibi1kYW5kb3JhLWxhbmQtNDM3Mjc1ONIBAA?hl=en-IN&gl=IN&ceid=IN%3Aen,2023-09-19
2,Attacq and GEPF conclude landmark R2.7bn equity transaction ...,Property Wheel,news.google.com/articles/CBMiYGh0dHBzOi8vcHJvcGVydHl3aGVlbC5jby56YS8yMDIzLzA5L2F0dGFjcS1hbmQtZ2VwZi1jb25jbHVkZS1sYW5kbWFyay1yMi03Ym4tZXF1aXR5LXRyYW5zYWN0aW9uL9IBAA?hl=en-IN&gl=IN&ceid=IN%3Aen,2023-09-18
13,"Stocks To Watch: IOCL, Bharat Electronics, Tata Steel, HAL, Dhanlaxmi Bank, Zomato, Tata Elxsi, PVR Inox",BQ Prime,news.google.com/articles/CBMigQFodHRwczovL3d3dy5icXByaW1lLmNvbS9idXNpbmVzcy9zdG9ja3MtdG8td2F0Y2gtaW9jbC1iaGFyYXQtZWxlY3Ryb25pY3MtdGF0YS1zdGVlbC1oYWwtZGhhbmxheG1pLWJhbmstem9tYXRvLXRhdGEtZWx4c2ktcHZyLWlub3jSAYUBaHR0cHM6Ly93d3cuYnFwcmltZS5jb20vYW1wL2J1c2luZXNzL3N0b2Nrcy10by13YXRjaC1pb2NsLWJoYXJhdC1lbGVjdHJvbmljcy10YXRhLXN0ZWVsLWhhbC1kaGFubGF4bWktYmFuay16b21hdG8tdGF0YS1lbHhzaS1wdnItaW5veA?hl=en-IN&gl=IN&ceid=IN%3Aen,2023-09-17
11,Transport for London property company to become 'Places for ...,Bdaily News,news.google.com/articles/CBMifGh0dHBzOi8vYmRhaWx5LmNvLnVrL2FydGljbGVzLzIwMjMvMDkvMTUvdHJhbnNwb3J0LWZvci1sb25kb24tcHJvcGVydHktY29tcGFueS10by1iZWNvbWUtcGxhY2VzLWZvci1sb25kb24taW4tbGF0ZS1zZXB0ZW1iZXLSAQA?hl=en-IN&gl=IN&ceid=IN%3Aen,2023-09-15
