,title,source,link,date
25,Car industry reels from Rishi Sunak's retreat on net zero plans,Financial Times,news.google.com/articles/CBMiP2h0dHBzOi8vd3d3LmZ0LmNvbS9jb250ZW50LzIxYmU5YzI4LTY4NWEtNDczZS05Mjc0LWIyNGJiNGE2YzhjOdIBAA?hl=en-IN&gl=IN&ceid=IN%3Aen,2023-09-20
45,"Floods, Winds and Temperature Extremes Challenge Rail Lines",The New York Times,news.google.com/articles/CBMiSmh0dHBzOi8vd3d3Lm55dGltZXMuY29tLzIwMjMvMDkvMjAvY2xpbWF0ZS90cmFpbnMtcmFpbC1jbGltYXRlLWNoYW5nZS5odG1s0gEA?hl=en-IN&gl=IN&ceid=IN%3Aen,2023-09-20
43,"Discussing MotoGP's mass-acceptance potential in India with Vaibhav Sinha, CEO of Fairstreet Sports",Sportskeeda,news.google.com/articles/CBMidmh0dHBzOi8vd3d3LnNwb3J0c2tlZWRhLmNvbS9ib3MvbmV3cy1kaXNjdXNzaW5nLW1vdG9ncC1zLW1hc3MtYWNjZXB0YW5jZS1wb3RlbnRpYWwtdmFpYmhhdi1zaW5oYS1jZW8tZmFpcnN0cmVldC1zcG9ydHPSAXpodHRwczovL3d3dy5zcG9ydHNrZWVkYS5jb20vYW1wL2Jvcy9uZXdzLWRpc2N1c3NpbmctbW90b2dwLXMtbWFzcy1hY2NlcHRhbmNlLXBvdGVudGlhbC12YWliaGF2LXNpbmhhLWNlby1mYWlyc3RyZWV0LXNwb3J0cw?hl=en-IN&gl=IN&ceid=IN%3Aen,2023-09-20
42,Michael Bloomberg Goes After Petrochemicals,The New York Times,news.google.com/articles/CBMiWWh0dHBzOi8vd3d3Lm55dGltZXMuY29tLzIwMjMvMDkvMjAvY2xpbWF0ZS9taWNoYWVsLWJsb29vbWJlcmctY2xpbWF0ZS1wZXRyb2NoZW1pY2Fscy5odG1s0gEA?hl=en-IN&gl=IN&ceid=IN%3Aen,2023-09-20
31,Detroit faces backlash over demolition order for partially collapsed ...,Detroit Metro Times,news.google.com/articles/CBMiiAFodHRwczovL3d3dy5tZXRyb3RpbWVzLmNvbS9uZXdzL2RldHJvaXQtZmFjZXMtYmFja2xhc2gtb3Zlci1kZW1vbGl0aW9uLW9yZGVyLWZvci1wYXJ0aWFsbHktY29sbGFwc2VkLWxhbmRtYXJrLWluLWVhc3Rlcm4tbWFya2V0LTM0MTc1Mzky0gEA?hl=en-IN&gl=IN&ceid=IN%3Aen,2023-09-19
49,Yorkshire based used car specialist branch into bespoke retail offering,Bdaily News,news.google.com/articles/CBMidGh0dHBzOi8vd3d3LmJkYWlseS5jby51ay9hcnRpY2xlcy8yMDIzLzA5LzE5L3lvcmtzaGlyZS1iYXNlZC11c2VkLWNhci1zcGVjaWFsaXN0LWJyYW5jaC1pbnRvLWJlc3Bva2UtcmV0YWlsLW9mZmVyaW5n0gEA?hl=en-IN&gl=IN&ceid=IN%3Aen,2023-09-19
99,US Argues Google Wants Too Much Information Kept Secret In ...,Slashdot,news.google.com/articles/CBMiemh0dHBzOi8veXJvLnNsYXNoZG90Lm9yZy9zdG9yeS8yMy8wOS8xOC8yMDI0MjQxL3VzLWFyZ3Vlcy1nb29nbGUtd2FudHMtdG9vLW11Y2gtaW5mb3JtYXRpb24ta2VwdC1zZWNyZXQtaW4tYW50aXRydXN0LXRyaWFs0gEA?hl=en-IN&gl=IN&ceid=IN%3Aen,2023-09-18
27,"Stocks To Watch: IOCL, Bharat Electronics, Tata Steel, HAL, Dhanlaxmi Bank, Zomato, Tata Elxsi, PVR Inox",BQ Prime,news.google.com/articles/CBMigQFodHRwczovL3d3dy5icXByaW1lLmNvbS9idXNpbmVzcy9zdG9ja3MtdG8td2F0Y2gtaW9jbC1iaGFyYXQtZWxlY3Ryb25pY3MtdGF0YS1zdGVlbC1oYWwtZGhhbmxheG1pLWJhbmstem9tYXRvLXRhdGEtZWx4c2ktcHZyLWlub3jSAYUBaHR0cHM6Ly93d3cuYnFwcmltZS5jb20vYW1wL2J1c2luZXNzL3N0b2Nrcy10by13YXRjaC1pb2NsLWJoYXJhdC1lbGVjdHJvbmljcy10YXRhLXN0ZWVsLWhhbC1kaGFubGF4bWktYmFuay16b21hdG8tdGF0YS1lbHhzaS1wdnItaW5veA?hl=en-IN&gl=IN&ceid=IN%3Aen,2023-09-17
60,5 Of The Most Reliable Volkswagen Models Ever Made,SlashGear,news.google.com/articles/CBMiQmh0dHBzOi8vd3d3LnNsYXNoZ2Vhci5jb20vMTM5MjcxOC9tb3N0LXJlbGlhYmxlLXZvbGtzd2FnZW4tbW9kZWxzL9IBAA?hl=en-IN&gl=IN&ceid=IN%3Aen,2023-09-17
53,"Opinion: With Bharat NCAP out, it’s time for a road safety rating",Autocar India,news.google.com/articles/CBMibWh0dHBzOi8vd3d3LmF1dG9jYXJpbmRpYS5jb20vYXV0by1ibG9ncy9vcGluaW9uLXdpdGgtYmhhcmF0LW5jYXAtb3V0LWl0cy10aW1lLWZvci1hLXJvYWQtc2FmZXR5LXJhdGluZy00MjkzMjDSAXFodHRwczovL3d3dy5hdXRvY2FyaW5kaWEuY29tL2F1dG8tYmxvZ3MtYW1wL29waW5pb24td2l0aC1iaGFyYXQtbmNhcC1vdXQtaXRzLXRpbWUtZm9yLWEtcm9hZC1zYWZldHktcmF0aW5nLTQyOTMyMA?hl=en-IN&gl=IN&ceid=IN%3Aen,2023-09-16
