,title,source,link,date
1,LatentView Analytics Welcomes Marketing Leader Jai Kibe to its Advisory Council,Benzinga,news.google.com/articles/CBMihgFodHRwczovL3d3dy5iZW56aW5nYS5jb20vcHJlc3NyZWxlYXNlcy8yMy8wOC9uMzQwNjU4OTcvbGF0ZW50dmlldy1hbmFseXRpY3Mtd2VsY29tZXMtbWFya2V0aW5nLWxlYWRlci1qYWkta2liZS10by1pdHMtYWR2aXNvcnktY291bmNpbNIBLWh0dHBzOi8vd3d3LmJlbnppbmdhLmNvbS9hbXAvY29udGVudC8zNDA2NTg5Nw?hl=en-IN&gl=IN&ceid=IN%3Aen,2023-08-28
40,Amoxicillin Treatment for Syphilis: Can an Old Drug Learn a New ...,Contagionlive.com,news.google.com/articles/CBMiaGh0dHBzOi8vd3d3LmNvbnRhZ2lvbmxpdmUuY29tL3ZpZXcvYW1veGljaWxsaW4tdHJlYXRtZW50LWZvci1zeXBoaWxpcy1jYW4tYW4tb2xkLWRydWctbGVhcm4tYS1uZXctdHJpY2st0gEA?hl=en-IN&gl=IN&ceid=IN%3Aen,2023-08-28
50,"Jiangsu Recbio Technology Co., Ltd. announced 2023 interim ...",BioSpace,news.google.com/articles/CBMihQFodHRwczovL3d3dy5iaW9zcGFjZS5jb20vYXJ0aWNsZS9yZWxlYXNlcy9qaWFuZ3N1LXJlY2Jpby10ZWNobm9sb2d5LWNvLWx0ZC1hbm5vdW5jZWQtMjAyMy1pbnRlcmltLXJlc3VsdHMtcmVwb3J0LWFuZC1sYXRlc3QtcHJvZ3Jlc3Mv0gEA?hl=en-IN&gl=IN&ceid=IN%3Aen,2023-08-28
81,John Locke: The Harmony of Liberty & Virtue,The Imaginative Conservative,news.google.com/articles/CBMiZ2h0dHBzOi8vdGhlaW1hZ2luYXRpdmVjb25zZXJ2YXRpdmUub3JnLzIwMjMvMDgvam9obi1sb2NrZS1oYXJtb255LWxpYmVydHktYW5kLXZpcnR1ZS1kb25hbGQtZGV2aW5lLmh0bWzSAQA?hl=en-IN&gl=IN&ceid=IN%3Aen,2023-08-28
85,Chinese Feminists Face Paradoxical State Policies,International Viewpoint,news.google.com/articles/CBMiN2h0dHBzOi8vaW50ZXJuYXRpb25hbHZpZXdwb2ludC5vcmcvc3BpcC5waHA_YXJ0aWNsZTgyMjbSAQA?hl=en-IN&gl=IN&ceid=IN%3Aen,2023-08-28
97,Chinese Political Warfare: A Strategic Tautology? The Three Warfares and the Centrality of Political Warfare within Chinese Strategy,The Strategy Bridge,news.google.com/articles/CBMiYmh0dHBzOi8vdGhlc3RyYXRlZ3licmlkZ2Uub3JnL3RoZS1icmlkZ2UvMjAyMy84LzI4L2NoaW5lc2UtcG9saXRpY2FsLXdhcmZhcmUtYS1zdHJhdGVnaWMtdGF1dG9sb2d50gFtaHR0cHM6Ly90aGVzdHJhdGVneWJyaWRnZS5vcmcvdGhlLWJyaWRnZS8yMDIzLzgvMjgvY2hpbmVzZS1wb2xpdGljYWwtd2FyZmFyZS1hLXN0cmF0ZWdpYy10YXV0b2xvZ3k_Zm9ybWF0PWFtcA?hl=en-IN&gl=IN&ceid=IN%3Aen,2023-08-28
18,PathwayZ- A manifesto for producing system-generated champions,The Bridge,news.google.com/articles/CBMibGh0dHBzOi8vdGhlYnJpZGdlLmluL2Zyb20tdGhlLWdyYXNzcm9vdHMvcGF0aHdheXotYS1tYW5pZmVzdG8tZm9yLXByb2R1Y2luZy1zeXN0ZW0tZ2VuZXJhdGVkLWNoYW1waW9ucy00MzU1NNIBcGh0dHBzOi8vdGhlYnJpZGdlLmluL2FtcC9mcm9tLXRoZS1ncmFzc3Jvb3RzL3BhdGh3YXl6LWEtbWFuaWZlc3RvLWZvci1wcm9kdWNpbmctc3lzdGVtLWdlbmVyYXRlZC1jaGFtcGlvbnMtNDM1NTQ?hl=en-IN&gl=IN&ceid=IN%3Aen,2023-08-25
70,Bacterial vaginosis increases STI risk,Contemporary Obgyn,news.google.com/articles/CBMiTWh0dHBzOi8vd3d3LmNvbnRlbXBvcmFyeW9iZ3luLm5ldC92aWV3L2JhY3RlcmlhbC12YWdpbm9zaXMtaW5jcmVhc2VzLXN0aS1yaXNr0gEA?hl=en-IN&gl=IN&ceid=IN%3Aen,2023-08-25
75,"Fighting to Win: Ukraine, Russia, and the War for Survival",Foreign Policy Research Institute,news.google.com/articles/CBMiXWh0dHBzOi8vd3d3LmZwcmkub3JnL2FydGljbGUvMjAyMy8wOC9maWdodGluZy10by13aW4tdWtyYWluZS1ydXNzaWEtYW5kLXRoZS13YXItZm9yLXN1cnZpdmFsL9IBAA?hl=en-IN&gl=IN&ceid=IN%3Aen,2023-08-25
86,Evolutionary metabolomics of specialized metabolism diversification ...,Science,news.google.com/articles/CBMiMmh0dHBzOi8vd3d3LnNjaWVuY2Uub3JnL2RvaS8xMC4xMTI2L3NjaWFkdi5hZGU4OTg00gEA?hl=en-IN&gl=IN&ceid=IN%3Aen,2023-08-25
