,title,source,link,date
35,Antibiotic resistance patterns in soils across the Scottish landscape ...,Nature.com,news.google.com/articles/CBMiMmh0dHBzOi8vd3d3Lm5hdHVyZS5jb20vYXJ0aWNsZXMvczQzMjQ3LTAyMy0wMTA1Ny0w0gEA?hl=en-IN&gl=IN&ceid=IN%3Aen,2023-11-01
75,What makes a 'balanced fleet' and how do we build one?,Defence Connect,news.google.com/articles/CBMiYWh0dHBzOi8vd3d3LmRlZmVuY2Vjb25uZWN0LmNvbS5hdS9uYXZhbC8xMzA1My13aGF0LW1ha2VzLWEtYmFsYW5jZWQtZmxlZXQtYW5kLWhvdy1kby13ZS1idWlsZC1vbmXSAQA?hl=en-IN&gl=IN&ceid=IN%3Aen,2023-11-01
12,"Mark Mobius, Tata Fund-Backed Small Cap Stock Jumps 6% After ...",msnNOW,news.google.com/articles/CBMid2h0dHBzOi8vd3d3Lm1zbi5jb20vZW4taW4vbW9uZXkvbWFya2V0cy9tYXJrLW1vYml1cy10YXRhLWZ1bmQtYmFja2VkLXNtYWxsLWNhcC1zdG9jay1qdW1wcy02LWFmdGVyLXEyLXByaW50L2FyLUFBMWpiTjhX0gEA?hl=en-IN&gl=IN&ceid=IN%3Aen,2023-11-01
38,Aiding food security and sustainability efforts through graph neural ...,Nature.com,news.google.com/articles/CBMiMmh0dHBzOi8vd3d3Lm5hdHVyZS5jb20vYXJ0aWNsZXMvczQxNTk4LTAyMy00NDg1OS0w0gEA?hl=en-IN&gl=IN&ceid=IN%3Aen,2023-11-01
95,"Merit, quotas... Do we wait for some more?",Morung Express,news.google.com/articles/CBMiPmh0dHA6Ly9tb3J1bmdleHByZXNzLmNvbS9tZXJpdC1xdW90YXMtZG8td2Utd2FpdC1mb3Itc29tZS1tb3Jl0gEA?hl=en-IN&gl=IN&ceid=IN%3Aen,2023-10-31
92,Impact of COVID-19 on Ophthalmology Practice Patterns | OPTH,Dove Medical Press,news.google.com/articles/CBMihAFodHRwczovL3d3dy5kb3ZlcHJlc3MuY29tL2Vhcmx5LXBoYXNlLXBlcmNlcHRpb25zLW9mLWNvdmlkLTE5cy1pbXBhY3Qtb24tb3BodGhhbG1vbG9neS1wcmFjdGljZS0tcGVlci1yZXZpZXdlZC1mdWxsdGV4dC1hcnRpY2xlLU9QVEjSAQA?hl=en-IN&gl=IN&ceid=IN%3Aen,2023-10-31
73,Validation of a short version of the Lee fatigue scale in adults living ...,BMC Public Health,news.google.com/articles/CBMiTWh0dHBzOi8vYm1jcHVibGljaGVhbHRoLmJpb21lZGNlbnRyYWwuY29tL2FydGljbGVzLzEwLjExODYvczEyODg5LTAyMy0xNzAzNi0x0gEA?hl=en-IN&gl=IN&ceid=IN%3Aen,2023-10-31
41,AI in Banking: AI Will Be An Incremental Game Changer,S&P Global,news.google.com/articles/CBMifWh0dHBzOi8vd3d3LnNwZ2xvYmFsLmNvbS9lbi9yZXNlYXJjaC1pbnNpZ2h0cy9mZWF0dXJlZC9zcGVjaWFsLWVkaXRvcmlhbC9haS1pbi1iYW5raW5nLWFpLXdpbGwtYmUtYW4taW5jcmVtZW50YWwtZ2FtZS1jaGFuZ2Vy0gEA?hl=en-IN&gl=IN&ceid=IN%3Aen,2023-10-31
37,Powering the future: Opportunities for private capital in the electric grid sector,Observer Research Foundation,news.google.com/articles/CBMiO2h0dHBzOi8vd3d3Lm9yZm9ubGluZS5vcmcvZXhwZXJ0LXNwZWFrL3Bvd2VyaW5nLXRoZS1mdXR1cmUv0gE7aHR0cHM6Ly93d3cub3Jmb25saW5lLm9yZy9leHBlcnQtc3BlYWsvcG93ZXJpbmctdGhlLWZ1dHVyZS8?hl=en-IN&gl=IN&ceid=IN%3Aen,2023-10-31
30,"Q2 में Visa, Marketing खर्च कम होने से मार्जिन में सुधार: राजन वेंकटेशन, CFO, लैटेंट व्यू एनालिटिक्स",Zee Business हिंदी,news.google.com/articles/CBMie2h0dHBzOi8vd3d3LnplZWJpei5jb20vaGluZGkvaW5kaWEvdmlkZW8tbXItcmFqYW4tdmVua2F0ZXNhbi1jZm8tbGF0ZW50LXZpZXctYW5hbHl0aWNzLWx0ZC1pbi10YWxrLXdpdGgtemVlLWJ1c2luZXNzLTE0ODI0ONIBf2h0dHBzOi8vd3d3LnplZWJpei5jb20vaGluZGkvaW5kaWEvdmlkZW8tbXItcmFqYW4tdmVua2F0ZXNhbi1jZm8tbGF0ZW50LXZpZXctYW5hbHl0aWNzLWx0ZC1pbi10YWxrLXdpdGgtemVlLWJ1c2luZXNzLTE0ODI0OC9hbXA?hl=en-IN&gl=IN&ceid=IN%3Aen,2023-10-30
