,title,source,link,date
18,CEP20 promotes invasion and metastasis of non-small cell lung ...,Nature.com,news.google.com/articles/CBMiMmh0dHBzOi8vd3d3Lm5hdHVyZS5jb20vYXJ0aWNsZXMvczQxNTk4LTAyMy00NDc1NC040gEA?hl=en-IN&gl=IN&ceid=IN%3Aen,2023-10-14
30,"Andy Foster, Tamatha Paul, Hana-Rāwhiti Maipi-Clarke: Host of new ...",New Zealand Herald,news.google.com/articles/CBMirQFodHRwczovL3d3dy5uemhlcmFsZC5jby5uei9uei9hbmR5LWZvc3Rlci10YW1hdGhhLXBhdWwtaGFuYS1yYXdoaXRpLW1haXBpLWNsYXJrZS1ob3N0LW9mLW5ldy1mYWNlcy1vbi10cmFjay10by1lbnRlci1uZXctemVhbGFuZHMtNTR0aC1wYXJsaWFtZW50L0xDNEJTTkpPV0pCTVZNVjU3MlJVQzU2SFRJL9IBAA?hl=en-IN&gl=IN&ceid=IN%3Aen,2023-10-14
55,"Free Speech Is Not Safe, but It Is Good | T. K. Coleman",Foundation for Economic Education,news.google.com/articles/CBMiQGh0dHBzOi8vZmVlLm9yZy9hcnRpY2xlcy9mcmVlLXNwZWVjaC1pcy1ub3Qtc2FmZS1idXQtaXQtaXMtZ29vZC_SAQA?hl=en-IN&gl=IN&ceid=IN%3Aen,2023-10-12
46,"The Fall of the House of Usher on Netflix: Release date, trailer, episodes and cast",Manchester Evening News,news.google.com/articles/CBMiWWh0dHBzOi8vd3d3Lm1hbmNoZXN0ZXJldmVuaW5nbmV3cy5jby51ay9uZXdzL3R2L2ZhbGwtaG91c2UtdXNoZXItbmV0ZmxpeC1yZWxlYXNlLTI3ODg2MDM50gFdaHR0cHM6Ly93d3cubWFuY2hlc3RlcmV2ZW5pbmduZXdzLmNvLnVrL25ld3MvdHYvZmFsbC1ob3VzZS11c2hlci1uZXRmbGl4LXJlbGVhc2UtMjc4ODYwMzkuYW1w?hl=en-IN&gl=IN&ceid=IN%3Aen,2023-10-11
54,A Nobel for a Student of Civilization,Foundation for Economic Education,news.google.com/articles/CBMiP2h0dHBzOi8vZmVlLm9yZy9hcnRpY2xlcy9hLW5vYmVsLWZvci1hLXN0dWRlbnQtb2YtY2l2aWxpemF0aW9uL9IBAA?hl=en-IN&gl=IN&ceid=IN%3Aen,2023-10-11
69,NIH's Letter to Wuhan Lab Confirms Rand Paul Was Right and Fauci ...,Foundation for Economic Education,news.google.com/articles/CBMiemh0dHBzOi8vZmVlLm9yZy9hcnRpY2xlcy9uaWhzLWxldHRlci10by13dWhhbi1sYWItY29uZmlybXMtcmFuZC1wYXVsLXdhcy1yaWdodC1hbmQtZmF1Y2ktd2FzLXdyb25nLWFib3V0LWdhaW4tb2YtZnVuY3Rpb24v0gEA?hl=en-IN&gl=IN&ceid=IN%3Aen,2023-10-11
58,"Global Welding Wires Market Size, Share, Price, Trends, Growth ...",Digital Journal,news.google.com/articles/CBMihQFodHRwczovL3d3dy5kaWdpdGFsam91cm5hbC5jb20vcHIvbmV3cy9pbWFyYy9nbG9iYWwtd2VsZGluZy13aXJlcy1tYXJrZXQtc2l6ZS1zaGFyZS1wcmljZS10cmVuZHMtZ3Jvd3RoLXJlcG9ydC1hbmQtZm9yZWNhc3QtMjAyMy0yMDI40gEA?hl=en-IN&gl=IN&ceid=IN%3Aen,2023-10-10
62,The Uncommon Ella Knowles Haskell,Foundation for Economic Education,news.google.com/articles/CBMiO2h0dHBzOi8vZmVlLm9yZy9hcnRpY2xlcy90aGUtdW5jb21tb24tZWxsYS1rbm93bGVzLWhhc2tlbGwv0gEA?hl=en-IN&gl=IN&ceid=IN%3Aen,2023-10-10
64,Honoring the Great Ludwig von Mises—50 Years after His Passing ...,Foundation for Economic Education,news.google.com/articles/CBMiWGh0dHBzOi8vZmVlLm9yZy9hcnRpY2xlcy9ob25vcmluZy10aGUtZ3JlYXQtbHVkd2lnLXZvbi1taXNlcy01MC15ZWFycy1hZnRlci1oaXMtcGFzc2luZy_SAQA?hl=en-IN&gl=IN&ceid=IN%3Aen,2023-10-10
78,Why Your Credit Card Rewards Might Be Going Bye-Bye | Jon ...,Foundation for Economic Education,news.google.com/articles/CBMiTWh0dHBzOi8vZmVlLm9yZy9hcnRpY2xlcy93aHkteW91ci1jcmVkaXQtY2FyZC1yZXdhcmRzLW1pZ2h0LWJlLWdvaW5nLWJ5ZS1ieWUv0gEA?hl=en-IN&gl=IN&ceid=IN%3Aen,2023-10-10
