,title,source,link,date
5,Rice straw-derived cellulose: a comparative study of various pre ...,Nature.com,news.google.com/articles/CBMiMmh0dHBzOi8vd3d3Lm5hdHVyZS5jb20vYXJ0aWNsZXMvczQxNTk4LTAyMy00MzUzNS030gEA?hl=en-IN&gl=IN&ceid=IN%3Aen,2023-09-28
16,"Nonalcoholic Steatohepatitis (NASH) Market to Witness Growth by 2032, Estimates DelveInsight | Inventiva",Benzinga,news.google.com/articles/CBMimQFodHRwczovL3d3dy5iZW56aW5nYS5jb20vcHJlc3NyZWxlYXNlcy8yMy8wOS8zNDg4ODk0MS9ub25hbGNvaG9saWMtc3RlYXRvaGVwYXRpdGlzLW5hc2gtbWFya2V0LXRvLXdpdG5lc3MtZ3Jvd3RoLWJ5LTIwMzItZXN0aW1hdGVzLWRlbHZlaW5zaWdodC1pbnZlbnRpdmHSAS1odHRwczovL3d3dy5iZW56aW5nYS5jb20vYW1wL2NvbnRlbnQvMzQ4ODg5NDE?hl=en-IN&gl=IN&ceid=IN%3Aen,2023-09-26
0,M K Proteins Limited board approves stock split,Equity Bulls,news.google.com/articles/CBMiMmh0dHBzOi8vd3d3LmVxdWl0eWJ1bGxzLmNvbS9jYXRlZ29yeS5waHA_aWQ9MzM4MTkz0gEA?hl=en-IN&gl=IN&ceid=IN%3Aen,2023-09-23
2,"Stocks To Watch: Infosys, ICICI, Wipro, JSW Steel, Vedanta, Glenmark, Zaggle Prepaid, Samhi Hotels, Sai Silks",BQ Prime,news.google.com/articles/CBMiggFodHRwczovL3d3dy5icXByaW1lLmNvbS9idXNpbmVzcy9zdG9ja3MtdG8td2F0Y2gtaW5mb3N5cy1pY2ljaS1iYW5rLXdpcHJvLWpzdy1zdGVlbC12ZWRhbnRhLWdsZW5tYXJrLXBoYXJtYS1zYW1oaS1ob3RlbHMtc2FpLXNpbGtz0gGGAWh0dHBzOi8vd3d3LmJxcHJpbWUuY29tL2FtcC9idXNpbmVzcy9zdG9ja3MtdG8td2F0Y2gtaW5mb3N5cy1pY2ljaS1iYW5rLXdpcHJvLWpzdy1zdGVlbC12ZWRhbnRhLWdsZW5tYXJrLXBoYXJtYS1zYW1oaS1ob3RlbHMtc2FpLXNpbGtz?hl=en-IN&gl=IN&ceid=IN%3Aen,2023-09-21
10,Incidence of immune-mediated inflammatory diseases following ...,BMC Medicine,news.google.com/articles/CBMiSWh0dHBzOi8vYm1jbWVkaWNpbmUuYmlvbWVkY2VudHJhbC5jb20vYXJ0aWNsZXMvMTAuMTE4Ni9zMTI5MTYtMDIzLTAzMDQ5LTXSAQA?hl=en-IN&gl=IN&ceid=IN%3Aen,2023-09-21
