,title,source,link,date
7,Ambassador Nimal Bandara: Lankan nationals trapped in Gaza ...,The Island.lk,news.google.com/articles/CBMieGh0dHA6Ly9pc2xhbmQubGsvYW1iYXNzYWRvci1uaW1hbC1iYW5kYXJhLWxhbmthbi1uYXRpb25hbHMtdHJhcHBlZC1pbi1nYXphLXN0cmlwLWdyYW50ZWQtZXhpdC12aWEtcmFmYWgtYm9yZGVyLWNyb3NzaW5nL9IBAA?hl=en-IN&gl=IN&ceid=IN%3Aen,2023-11-05
9,Thanzyl Thajudeen elected to CIPR International Committee for 2024,The Island.lk,news.google.com/articles/CBMiVGh0dHA6Ly9pc2xhbmQubGsvdGhhbnp5bC10aGFqdWRlZW4tZWxlY3RlZC10by1jaXByLWludGVybmF0aW9uYWwtY29tbWl0dGVlLWZvci0yMDI0L9IBAA?hl=en-IN&gl=IN&ceid=IN%3Aen,2023-11-05
10,"Electoral reforms: President expands commission's scope, adds ...",The Island.lk,news.google.com/articles/CBMiU2h0dHA6Ly9pc2xhbmQubGsvZWxlY3RvcmFsLXJlZm9ybXMtcHJlc2lkZW50LWV4cGFuZHMtY29tbWlzc2lvbnMtc2NvcGUtYWRkcy1tZW1iZXIv0gEA?hl=en-IN&gl=IN&ceid=IN%3Aen,2023-11-05
12,Navy bust gold smuggling racket in Mannar,The Island.lk,news.google.com/articles/CBMiO2h0dHA6Ly9pc2xhbmQubGsvbmF2eS1idXN0LWdvbGQtc211Z2dsaW5nLXJhY2tldC1pbi1tYW5uYXIv0gEA?hl=en-IN&gl=IN&ceid=IN%3Aen,2023-11-04
14,Administration of justice in Sri Lanka is about the oldest in Asia ...,The Island.lk,news.google.com/articles/CBMiXmh0dHA6Ly9pc2xhbmQubGsvYWRtaW5pc3RyYXRpb24tb2YtanVzdGljZS1pbi1zcmktbGFua2EtaXMtYWJvdXQtdGhlLW9sZGVzdC1pbi1hc2lhLXByZXNpZGVudC_SAQA?hl=en-IN&gl=IN&ceid=IN%3Aen,2023-11-04
24,GMOA: 20 govt. hospitals already closed down; number could rise to ...,The Island.lk,news.google.com/articles/CBMiVGh0dHA6Ly9pc2xhbmQubGsvZ21vYS0yMC1nb3Z0LWhvc3BpdGFscy1hbHJlYWR5LWNsb3NlZC1kb3duLW51bWJlci1jb3VsZC1yaXNlLXRvLTcwL9IBAA?hl=en-IN&gl=IN&ceid=IN%3Aen,2023-11-04
23,CIPM's annual graduation ceremony at BMICH: 'A Celebration of ...,The Island.lk,news.google.com/articles/CBMiYGh0dHA6Ly9pc2xhbmQubGsvY2lwbXMtYW5udWFsLWdyYWR1YXRpb24tY2VyZW1vbnktYXQtYm1pY2gtYS1jZWxlYnJhdGlvbi1vZi1leGNlbGxlbmNlLWluLWhybS0yL9IBAA?hl=en-IN&gl=IN&ceid=IN%3Aen,2023-11-04
21,SJB calls for sacking of SLC management,The Island.lk,news.google.com/articles/CBMiOWh0dHA6Ly9pc2xhbmQubGsvc2piLWNhbGxzLWZvci1zYWNraW5nLW9mLXNsYy1tYW5hZ2VtZW50L9IBAA?hl=en-IN&gl=IN&ceid=IN%3Aen,2023-11-04
17,People's Bank and Western Union strengthen their commitment to ...,The Island.lk,news.google.com/articles/CBMiamh0dHA6Ly9pc2xhbmQubGsvcGVvcGxlcy1iYW5rLWFuZC13ZXN0ZXJuLXVuaW9uLXN0cmVuZ3RoZW4tdGhlaXItY29tbWl0bWVudC10by1zZXJ2aW5nLWxhbmthbi1jb21tdW5pdGllcy_SAQA?hl=en-IN&gl=IN&ceid=IN%3Aen,2023-11-04
33,Sri Lankan man taken hostage by Hamas dead,The Island.lk,news.google.com/articles/CBMiPGh0dHA6Ly9pc2xhbmQubGsvc3JpLWxhbmthbi1tYW4tdGFrZW4taG9zdGFnZS1ieS1oYW1hcy1kZWFkL9IBAA?hl=en-IN&gl=IN&ceid=IN%3Aen,2023-11-04
