,title,source,link,date
29,"New Toyota MR2 Rumored With GR Corolla Turbo Engine, But Will We Get It?",CarScoops,news.google.com/articles/CBMicmh0dHBzOi8vd3d3LmNhcnNjb29wcy5jb20vMjAyMy8xMC90b3lvdGEtbWF5LXBsdWctdGhlLWdyLXlhcmlzLXRocmVlLWN5bGluZGVyLWVuZ2luZS1pbnRvLWFuLXVwY29taW5nLW1yMi1yZXZpdmFsL9IBdmh0dHBzOi8vd3d3LmNhcnNjb29wcy5jb20vMjAyMy8xMC90b3lvdGEtbWF5LXBsdWctdGhlLWdyLXlhcmlzLXRocmVlLWN5bGluZGVyLWVuZ2luZS1pbnRvLWFuLXVwY29taW5nLW1yMi1yZXZpdmFsL2FtcC8?hl=en-IN&gl=IN&ceid=IN%3Aen,2023-10-13
3,Jeansonne scores Mazda MX-5 Cup pole at Road Atlanta,RACER,news.google.com/articles/CBMiUmh0dHBzOi8vcmFjZXIuY29tLzIwMjMvMTAvMTIvamVhbnNvbm5lLXNjb3Jlcy1tYXpkYS1teC01LWN1cC1wb2xlLWF0LXJvYWQtYXRsYW50YS_SAQA?hl=en-IN&gl=IN&ceid=IN%3Aen,2023-10-12
36,Check It Out: This 1991 Suzuki Cappuccino Is A Modified Masterpiece,HotCars,news.google.com/articles/CBMiOGh0dHBzOi8vd3d3LmhvdGNhcnMuY29tL21vZGlmaWVkLTE5OTEtc3V6dWtpLWNhcHB1Y2Npbm8v0gEA?hl=en-IN&gl=IN&ceid=IN%3Aen,2023-10-12
5,The Premium Japanese SUV That Packs A Plug-In Hybrid Punch,HotCars,news.google.com/articles/CBMiKWh0dHBzOi8vd3d3LmhvdGNhcnMuY29tLzIwMjQtbWF6ZGEtY3gtOTAv0gEA?hl=en-IN&gl=IN&ceid=IN%3Aen,2023-10-12
6,"The Mazda MX-5 Miata Could Go Electric, Although Batteries Are ...",autoevolution,news.google.com/articles/CBMie2h0dHBzOi8vd3d3LmF1dG9ldm9sdXRpb24uY29tL25ld3MvdGhlLW1hemRhLW14LTUtbWlhdGEtY291bGQtZ28tZWxlY3RyaWMtYnV0LXRoZS1iYXR0ZXJpZXMtYXJlLXN0aWxsLXRvby1oZWF2eS0yMjI2NzYuaHRtbNIBAA?hl=en-IN&gl=IN&ceid=IN%3Aen,2023-10-12
31,Forza Horizon 5 Festival Playlist Weekly Challenges Guide Series 26 ŌĆō Summer,TheXboxHub,news.google.com/articles/CBMiZmh0dHBzOi8vd3d3LnRoZXhib3hodWIuY29tL2ZvcnphLWhvcml6b24tNS1mZXN0aXZhbC1wbGF5bGlzdC13ZWVrbHktY2hhbGxlbmdlcy1ndWlkZS1zZXJpZXMtMjYtc3VtbWVyL9IBZmh0dHBzOi8vd3d3LnRoZXhib3hodWIuY29tL2ZvcnphLWhvcml6b24tNS1mZXN0aXZhbC1wbGF5bGlzdC13ZWVrbHktY2hhbGxlbmdlcy1ndWlkZS1zZXJpZXMtMjYtc3VtbWVyLw?hl=en-IN&gl=IN&ceid=IN%3Aen,2023-10-12
27,Why The Toyota BZ4X Is Just The First Chapter Of Toyota Electric ...,TopSpeed,news.google.com/articles/CBMiS2h0dHBzOi8vd3d3LnRvcHNwZWVkLmNvbS90b3lvdGEtYno0eC1maXJzdC1jaGFwdGVyLW9mLXRveW90YS1lbGVjdHJpYy1zdXZzL9IBAA?hl=en-IN&gl=IN&ceid=IN%3Aen,2023-10-12
21,"BMW X And iX2, Jaguar F-Type ZP Edition, Audi SQ8, Chevy Corvette ZR1, Subaru WRX TR: Rambling About Cars 145",Motor1 ,news.google.com/articles/CBMiamh0dHBzOi8vd3d3Lm1vdG9yMS5jb20vZmVhdHVyZXMvNjkxMDE4L2Jtdy14Mi1qYWd1YXItZi10eXBlLWF1ZGktc3E4LWNvcnZldHRlLXpyMS1yYW1ibGluZy1hYm91dC1jYXJzLTE0NS_SAW5odHRwczovL3d3dy5tb3RvcjEuY29tL2ZlYXR1cmVzLzY5MTAxOC9ibXcteDItamFndWFyLWYtdHlwZS1hdWRpLXNxOC1jb3J2ZXR0ZS16cjEtcmFtYmxpbmctYWJvdXQtY2Fycy0xNDUvYW1wLw?hl=en-IN&gl=IN&ceid=IN%3Aen,2023-10-11
20,These Japanese Classics Are The Holy Grail For Collectors,HotCars,news.google.com/articles/CBMiP2h0dHBzOi8vd3d3LmhvdGNhcnMuY29tL2phcGFuZXNlLWNsYXNzaWNzLXZhbHVlZC1ieS1jb2xsZWN0b3JzL9IBAA?hl=en-IN&gl=IN&ceid=IN%3Aen,2023-10-11
17,"Eunos Cosmo: A Look Back at the Forgotten, Three-Rotor JDM ...",autoevolution,news.google.com/articles/CBMibmh0dHBzOi8vd3d3LmF1dG9ldm9sdXRpb24uY29tL25ld3MvZXVub3MtY29zbW8tYS1sb29rLWJhY2stYXQtdGhlLWZvcmdvdHRlbi10aHJlZS1yb3Rvci1qZG0tbGVnZW5kLTIyMjUzMC5odG1s0gEA?hl=en-IN&gl=IN&ceid=IN%3Aen,2023-10-10
