,title,source,link,date
9,Future of Sustainability Management Software & Services Market by Size and Valuation 2030,Benzinga,news.google.com/articles/CBMijQFodHRwczovL3d3dy5iZW56aW5nYS5jb20vcHJlc3NyZWxlYXNlcy8yMy8wOS8zNDQyMzExMS9mdXR1cmUtb2Ytc3VzdGFpbmFiaWxpdHktbWFuYWdlbWVudC1zb2Z0d2FyZS1zZXJ2aWNlcy1tYXJrZXQtYnktc2l6ZS1hbmQtdmFsdWF0aW9uLTIwMzDSAS1odHRwczovL3d3dy5iZW56aW5nYS5jb20vYW1wL2NvbnRlbnQvMzQ0MjMxMTE?hl=en-IN&gl=IN&ceid=IN%3Aen,2023-09-11
0,"NK Cell Therapy Market 2023 Global Industry Size, Share, Business Growth, Revenue, Trends, Global Market",Benzinga,news.google.com/articles/CBMimQFodHRwczovL3d3dy5iZW56aW5nYS5jb20vcHJlc3NyZWxlYXNlcy8yMy8wOS8zNDQwODMyMC9uay1jZWxsLXRoZXJhcHktbWFya2V0LTIwMjMtZ2xvYmFsLWluZHVzdHJ5LXNpemUtc2hhcmUtYnVzaW5lc3MtZ3Jvd3RoLXJldmVudWUtdHJlbmRzLWdsb2JhbC1tYXJrZXTSAS1odHRwczovL3d3dy5iZW56aW5nYS5jb20vYW1wL2NvbnRlbnQvMzQ0MDgzMjA?hl=en-IN&gl=IN&ceid=IN%3Aen,2023-09-10
5,"Cotton Seed Oil Market 2023 Technological Landscape, Profiling Key Players and Business Approaches till 2",Benzinga,news.google.com/articles/CBMimQFodHRwczovL3d3dy5iZW56aW5nYS5jb20vcHJlc3NyZWxlYXNlcy8yMy8wOS8zNDQxNzY5MS9jb3R0b24tc2VlZC1vaWwtbWFya2V0LTIwMjMtdGVjaG5vbG9naWNhbC1sYW5kc2NhcGUtcHJvZmlsaW5nLWtleS1wbGF5ZXJzLWFuZC1idXNpbmVzcy1hcHByb2FjaGVzLXTSAS1odHRwczovL3d3dy5iZW56aW5nYS5jb20vYW1wL2NvbnRlbnQvMzQ0MTc2OTE?hl=en-IN&gl=IN&ceid=IN%3Aen,2023-09-10
7,"Patient Room Recliners Market | Chattanooga, DeVilbiss Healthcare, Gendron, Graham-Field",openPR,news.google.com/articles/CBMiV2h0dHBzOi8vd3d3Lm9wZW5wci5jb20vbmV3cy8zMjAyMzI0L3BhdGllbnQtcm9vbS1yZWNsaW5lcnMtbWFya2V0LWNoYXR0YW5vb2dhLWRldmlsYmlzc9IBVmh0dHBzOi8vd3d3Lm9wZW5wci5jb20vYW1wLzMyMDIzMjQvcGF0aWVudC1yb29tLXJlY2xpbmVycy1tYXJrZXQtY2hhdHRhbm9vZ2EtZGV2aWxiaXNz?hl=en-IN&gl=IN&ceid=IN%3Aen,2023-09-10
1,"Castor Oil and Derivatives Market 2023 Global Industry Size, Share, Business Growth, Revenue, Trends, Glo",Benzinga,news.google.com/articles/CBMimQFodHRwczovL3d3dy5iZW56aW5nYS5jb20vcHJlc3NyZWxlYXNlcy8yMy8wOS8zNDQwODMxNy9jYXN0b3Itb2lsLWFuZC1kZXJpdmF0aXZlcy1tYXJrZXQtMjAyMy1nbG9iYWwtaW5kdXN0cnktc2l6ZS1zaGFyZS1idXNpbmVzcy1ncm93dGgtcmV2ZW51ZS10cmVuZHMtZ2zSAS1odHRwczovL3d3dy5iZW56aW5nYS5jb20vYW1wL2NvbnRlbnQvMzQ0MDgzMTc?hl=en-IN&gl=IN&ceid=IN%3Aen,2023-09-10
10,"Automobile Parts Remanufacturing Market Size 2023: Report by Market Share, Growth Rate, Historical Data a",Benzinga,news.google.com/articles/CBMimQFodHRwczovL3d3dy5iZW56aW5nYS5jb20vcHJlc3NyZWxlYXNlcy8yMy8wOS8zNDQxMDkxMS9hdXRvbW9iaWxlLXBhcnRzLXJlbWFudWZhY3R1cmluZy1tYXJrZXQtc2l6ZS0yMDIzLXJlcG9ydC1ieS1tYXJrZXQtc2hhcmUtZ3Jvd3RoLXJhdGUtaGlzdG9yaWNhbC1kYXTSAS1odHRwczovL3d3dy5iZW56aW5nYS5jb20vYW1wL2NvbnRlbnQvMzQ0MTA5MTE?hl=en-IN&gl=IN&ceid=IN%3Aen,2023-09-10
19,"Locker Market Futuristic Growth: Size, Share, Innovations, and Projected Opportunities till 2030",Benzinga,news.google.com/articles/CBMikgFodHRwczovL3d3dy5iZW56aW5nYS5jb20vcHJlc3NyZWxlYXNlcy8yMy8wOS8zNDM5NzE4Mi9sb2NrZXItbWFya2V0LWZ1dHVyaXN0aWMtZ3Jvd3RoLXNpemUtc2hhcmUtaW5ub3ZhdGlvbnMtYW5kLXByb2plY3RlZC1vcHBvcnR1bml0aWVzLXRpbGwtMjAzMNIBLWh0dHBzOi8vd3d3LmJlbnppbmdhLmNvbS9hbXAvY29udGVudC8zNDM5NzE4Mg?hl=en-IN&gl=IN&ceid=IN%3Aen,2023-09-09
28,"The Lanolin Cholesterol market insights cover historical trends and future projections, with a projected",Benzinga,news.google.com/articles/CBMimQFodHRwczovL3d3dy5iZW56aW5nYS5jb20vcHJlc3NyZWxlYXNlcy8yMy8wOS8zNDM5ODMyOC90aGUtbGFub2xpbi1jaG9sZXN0ZXJvbC1tYXJrZXQtaW5zaWdodHMtY292ZXItaGlzdG9yaWNhbC10cmVuZHMtYW5kLWZ1dHVyZS1wcm9qZWN0aW9ucy13aXRoLWEtcHJvamXSAS1odHRwczovL3d3dy5iZW56aW5nYS5jb20vYW1wL2NvbnRlbnQvMzQzOTgzMjg?hl=en-IN&gl=IN&ceid=IN%3Aen,2023-09-09
57,The global ECG Monitoring Electrodes market size is expected to experience a CAGR of 11.6% through 2023 -,Benzinga,news.google.com/articles/CBMimQFodHRwczovL3d3dy5iZW56aW5nYS5jb20vcHJlc3NyZWxlYXNlcy8yMy8wOS8zNDM4MDAwNC90aGUtZ2xvYmFsLWVjZy1tb25pdG9yaW5nLWVsZWN0cm9kZXMtbWFya2V0LXNpemUtaXMtZXhwZWN0ZWQtdG8tZXhwZXJpZW5jZS1hLWNhZ3Itb2YtMTEtNi10aHJvdWdoLTLSAS1odHRwczovL3d3dy5iZW56aW5nYS5jb20vYW1wL2NvbnRlbnQvMzQzODAwMDQ?hl=en-IN&gl=IN&ceid=IN%3Aen,2023-09-09
18,"Ship Loader Market Size, Overview, Top Industry Players, Growth, Share and Forecast 2031",Benzinga,news.google.com/articles/CBMiigFodHRwczovL3d3dy5iZW56aW5nYS5jb20vcHJlc3NyZWxlYXNlcy8yMy8wOS8zNDM0NDY4MS9zaGlwLWxvYWRlci1tYXJrZXQtc2l6ZS1vdmVydmlldy10b3AtaW5kdXN0cnktcGxheWVycy1ncm93dGgtc2hhcmUtYW5kLWZvcmVjYXN0LTIwMzHSAS1odHRwczovL3d3dy5iZW56aW5nYS5jb20vYW1wL2NvbnRlbnQvMzQzNDQ2ODE?hl=en-IN&gl=IN&ceid=IN%3Aen,2023-09-08
