,title,source,link,date
42,"Camping Power Bank Market: Technological Advancements and Competitive Landscape | Morui, YUROAD, Jackery, RAVP",openPR,news.google.com/articles/CBMiWGh0dHBzOi8vd3d3Lm9wZW5wci5jb20vbmV3cy8zMjE0NTQzL2NhbXBpbmctcG93ZXItYmFuay1tYXJrZXQtdGVjaG5vbG9naWNhbC1hZHZhbmNlbWVudHPSAVdodHRwczovL3d3dy5vcGVucHIuY29tL2FtcC8zMjE0NTQzL2NhbXBpbmctcG93ZXItYmFuay1tYXJrZXQtdGVjaG5vbG9naWNhbC1hZHZhbmNlbWVudHM?hl=en-IN&gl=IN&ceid=IN%3Aen,2023-09-20
37,"New Trends of Healthy Weight Management Market increasing demand, Analysis by Industry Growth Rate, Future Dyn",openPR,news.google.com/articles/CBMiXWh0dHBzOi8vd3d3Lm9wZW5wci5jb20vbmV3cy8zMjE1MTIyL25ldy10cmVuZHMtb2YtaGVhbHRoeS13ZWlnaHQtbWFuYWdlbWVudC1tYXJrZXQtaW5jcmVhc2luZ9IBXGh0dHBzOi8vd3d3Lm9wZW5wci5jb20vYW1wLzMyMTUxMjIvbmV3LXRyZW5kcy1vZi1oZWFsdGh5LXdlaWdodC1tYW5hZ2VtZW50LW1hcmtldC1pbmNyZWFzaW5n?hl=en-IN&gl=IN&ceid=IN%3Aen,2023-09-20
51,"Anticipating Exponential Growth in the Glycol Dehydrator Market to Drive Future Expansion: Statistics, Predict",openPR,news.google.com/articles/CBMiXGh0dHBzOi8vd3d3Lm9wZW5wci5jb20vbmV3cy8zMjE1MTUyL2FudGljaXBhdGluZy1leHBvbmVudGlhbC1ncm93dGgtaW4tdGhlLWdseWNvbC1kZWh5ZHJhdG9y0gFbaHR0cHM6Ly93d3cub3BlbnByLmNvbS9hbXAvMzIxNTE1Mi9hbnRpY2lwYXRpbmctZXhwb25lbnRpYWwtZ3Jvd3RoLWluLXRoZS1nbHljb2wtZGVoeWRyYXRvcg?hl=en-IN&gl=IN&ceid=IN%3Aen,2023-09-20
50,Anesthesia Ultrasound System Market Region Wise Analysis of Top Players and Changing Growth Factor in Industry,openPR,news.google.com/articles/CBMiY2h0dHBzOi8vd3d3Lm9wZW5wci5jb20vbmV3cy8zMjE0MzAwL2FuZXN0aGVzaWEtdWx0cmFzb3VuZC1zeXN0ZW0tbWFya2V0LXJlZ2lvbi13aXNlLWFuYWx5c2lzLW9mLXRvcNIBYmh0dHBzOi8vd3d3Lm9wZW5wci5jb20vYW1wLzMyMTQzMDAvYW5lc3RoZXNpYS11bHRyYXNvdW5kLXN5c3RlbS1tYXJrZXQtcmVnaW9uLXdpc2UtYW5hbHlzaXMtb2YtdG9w?hl=en-IN&gl=IN&ceid=IN%3Aen,2023-09-20
49,Cartilage Repair and Regeneration Devices Market 2023: Key Insights and Strategic Analysis for Market Players,openPR,news.google.com/articles/CBMiXWh0dHBzOi8vd3d3Lm9wZW5wci5jb20vbmV3cy8zMjE0NzAxL2NhcnRpbGFnZS1yZXBhaXItYW5kLXJlZ2VuZXJhdGlvbi1kZXZpY2VzLW1hcmtldC0yMDIzLWtledIBXGh0dHBzOi8vd3d3Lm9wZW5wci5jb20vYW1wLzMyMTQ3MDEvY2FydGlsYWdlLXJlcGFpci1hbmQtcmVnZW5lcmF0aW9uLWRldmljZXMtbWFya2V0LTIwMjMta2V5?hl=en-IN&gl=IN&ceid=IN%3Aen,2023-09-20
48,Unparalleled Research on Head Protection Safety Helmets Market With Current and Future Growth Analysis by Fore,openPR,news.google.com/articles/CBMiYmh0dHBzOi8vd3d3Lm9wZW5wci5jb20vbmV3cy8zMjE0NTU0L3VucGFyYWxsZWxlZC1yZXNlYXJjaC1vbi1oZWFkLXByb3RlY3Rpb24tc2FmZXR5LWhlbG1ldHMtbWFya2V00gFhaHR0cHM6Ly93d3cub3BlbnByLmNvbS9hbXAvMzIxNDU1NC91bnBhcmFsbGVsZWQtcmVzZWFyY2gtb24taGVhZC1wcm90ZWN0aW9uLXNhZmV0eS1oZWxtZXRzLW1hcmtldA?hl=en-IN&gl=IN&ceid=IN%3Aen,2023-09-20
47,Electrically-Powered Hydraulic Steering Systems Market Includes New Complete Analysis Report to Gain Momentum,openPR,news.google.com/articles/CBMiWmh0dHBzOi8vd3d3Lm9wZW5wci5jb20vbmV3cy8zMjE0OTIwL2VsZWN0cmljYWxseS1wb3dlcmVkLWh5ZHJhdWxpYy1zdGVlcmluZy1zeXN0ZW1zLW1hcmtldNIBWWh0dHBzOi8vd3d3Lm9wZW5wci5jb20vYW1wLzMyMTQ5MjAvZWxlY3RyaWNhbGx5LXBvd2VyZWQtaHlkcmF1bGljLXN0ZWVyaW5nLXN5c3RlbXMtbWFya2V0?hl=en-IN&gl=IN&ceid=IN%3Aen,2023-09-20
45,"Cardioembolic Stroke Occluder Market Trends, Key Players Analysis, Regional Trends, Competitive Landscape, and",openPR,news.google.com/articles/CBMiW2h0dHBzOi8vd3d3Lm9wZW5wci5jb20vbmV3cy8zMjE0NzM0L2NhcmRpb2VtYm9saWMtc3Ryb2tlLW9jY2x1ZGVyLW1hcmtldC10cmVuZHMta2V5LXBsYXllcnPSAVpodHRwczovL3d3dy5vcGVucHIuY29tL2FtcC8zMjE0NzM0L2NhcmRpb2VtYm9saWMtc3Ryb2tlLW9jY2x1ZGVyLW1hcmtldC10cmVuZHMta2V5LXBsYXllcnM?hl=en-IN&gl=IN&ceid=IN%3Aen,2023-09-20
43,"Food Waste Solution Market Analyzing Competitor Results through 2023-2030 | Leading Players: Veolia, Suez, Was",openPR,news.google.com/articles/CBMiW2h0dHBzOi8vd3d3Lm9wZW5wci5jb20vbmV3cy8zMjE1MDg1L2Zvb2Qtd2FzdGUtc29sdXRpb24tbWFya2V0LWFuYWx5emluZy1jb21wZXRpdG9yLXJlc3VsdHPSAVpodHRwczovL3d3dy5vcGVucHIuY29tL2FtcC8zMjE1MDg1L2Zvb2Qtd2FzdGUtc29sdXRpb24tbWFya2V0LWFuYWx5emluZy1jb21wZXRpdG9yLXJlc3VsdHM?hl=en-IN&gl=IN&ceid=IN%3Aen,2023-09-20
41,"Placental Cell-Based Regenerative Medicine Advancements Market Potential growth, Major Strategies, Future Indu",openPR,news.google.com/articles/CBMiW2h0dHBzOi8vd3d3Lm9wZW5wci5jb20vbmV3cy8zMjE1Mzk3L3BsYWNlbnRhbC1jZWxsLWJhc2VkLXJlZ2VuZXJhdGl2ZS1tZWRpY2luZS1hZHZhbmNlbWVudHPSAVpodHRwczovL3d3dy5vcGVucHIuY29tL2FtcC8zMjE1Mzk3L3BsYWNlbnRhbC1jZWxsLWJhc2VkLXJlZ2VuZXJhdGl2ZS1tZWRpY2luZS1hZHZhbmNlbWVudHM?hl=en-IN&gl=IN&ceid=IN%3Aen,2023-09-20
