,title,source,link,date
76,"Palm oil: Amidst tycoon onslaught, North-East farmers discuss ...",Counterview,news.google.com/articles/CBMiT2h0dHBzOi8vd3d3LmNvdW50ZXJ2aWV3Lm5ldC8yMDIzLzA5L3BhbG0tb2lsLWFtaWRzdC10eWNvb24tb25zbGF1Z2h0LW5vcnRoLmh0bWzSAQA?hl=en-IN&gl=IN&ceid=IN%3Aen,2023-09-10
99,Can we sustain rice farming in Bhutan?,"Kuensel, Buhutan's National Newspaper",news.google.com/articles/CBMiQGh0dHBzOi8va3VlbnNlbG9ubGluZS5jb20vY2FuLXdlLXN1c3RhaW4tcmljZS1mYXJtaW5nLWluLWJodXRhbi_SAQA?hl=en-IN&gl=IN&ceid=IN%3Aen,2023-09-09
16,Sulphur Bentonite Market Share Report 2023-2030 | 110 Pages Report,Benzinga,news.google.com/articles/CBMidmh0dHBzOi8vd3d3LmJlbnppbmdhLmNvbS9wcmVzc3JlbGVhc2VzLzIzLzA5LzM0Mzg2MDUxL3N1bHBodXItYmVudG9uaXRlLW1hcmtldC1zaGFyZS1yZXBvcnQtMjAyMy0yMDMwLTExMC1wYWdlcy1yZXBvcnTSAS1odHRwczovL3d3dy5iZW56aW5nYS5jb20vYW1wL2NvbnRlbnQvMzQzODYwNTE?hl=en-IN&gl=IN&ceid=IN%3Aen,2023-09-09
28,Biological Organic Fertilizer Market Recent Innovations and Current Trends Analysis by 2030,Benzinga,news.google.com/articles/CBMikQFodHRwczovL3d3dy5iZW56aW5nYS5jb20vcHJlc3NyZWxlYXNlcy8yMy8wOS8zNDM5MDkyNi9iaW9sb2dpY2FsLW9yZ2FuaWMtZmVydGlsaXplci1tYXJrZXQtcmVjZW50LWlubm92YXRpb25zLWFuZC1jdXJyZW50LXRyZW5kcy1hbmFseXNpcy1ieS0yMDMw0gEtaHR0cHM6Ly93d3cuYmVuemluZ2EuY29tL2FtcC9jb250ZW50LzM0MzkwOTI2?hl=en-IN&gl=IN&ceid=IN%3Aen,2023-09-09
35,G20 Summit: Full text of New Delhi G20 Leaders Declaration. Read here | Mint,Mint,news.google.com/articles/CBMie2h0dHBzOi8vd3d3LmxpdmVtaW50LmNvbS9uZXdzL2luZGlhL2cyMC1zdW1taXQtZnVsbC10ZXh0LW9mLW5ldy1kZWxoaS1nMjAtbGVhZGVycy1kZWNsYXJhdGlvbi1yZWFkLWhlcmUtMTE2OTQyNTk0NzIzOTguaHRtbNIBf2h0dHBzOi8vd3d3LmxpdmVtaW50LmNvbS9uZXdzL2luZGlhL2cyMC1zdW1taXQtZnVsbC10ZXh0LW9mLW5ldy1kZWxoaS1nMjAtbGVhZGVycy1kZWNsYXJhdGlvbi1yZWFkLWhlcmUvYW1wLTExNjk0MjU5NDcyMzk4Lmh0bWw?hl=en-IN&gl=IN&ceid=IN%3Aen,2023-09-09
7,"China slows fertiliser exports, raising industry concerns in India",Reuters,news.google.com/articles/CBMidmh0dHBzOi8vd3d3LnJldXRlcnMuY29tL21hcmtldHMvY29tbW9kaXRpZXMvY2hpbmEtc2xvd3MtZmVydGlsaXNlci1leHBvcnRzLXJhaXNpbmctaW5kdXN0cnktY29uY2VybnMtaW5kaWEtMjAyMy0wOS0wOC_SAQA?hl=en-IN&gl=IN&ceid=IN%3Aen,2023-09-08
1,"Neem Coated Urea Market 2023 Recent Advancements and Business Scenario- National Fertilizers Limited, KRI",Benzinga,news.google.com/articles/CBMimQFodHRwczovL3d3dy5iZW56aW5nYS5jb20vcHJlc3NyZWxlYXNlcy8yMy8wOS8zNDI5OTk1Ny9uZWVtLWNvYXRlZC11cmVhLW1hcmtldC0yMDIzLXJlY2VudC1hZHZhbmNlbWVudHMtYW5kLWJ1c2luZXNzLXNjZW5hcmlvLW5hdGlvbmFsLWZlcnRpbGl6ZXJzLWxpbWl0ZWTSAS1odHRwczovL3d3dy5iZW56aW5nYS5jb20vYW1wL2NvbnRlbnQvMzQyOTk5NTc?hl=en-IN&gl=IN&ceid=IN%3Aen,2023-09-07
96,Increasing Awareness Related To The Advantage Of Organic Food Will Augment The Global Bio-Agriculture Mar,Benzinga,news.google.com/articles/CBMimQFodHRwczovL3d3dy5iZW56aW5nYS5jb20vcHJlc3NyZWxlYXNlcy8yMy8wOS8zNDMyMjQ0NC9pbmNyZWFzaW5nLWF3YXJlbmVzcy1yZWxhdGVkLXRvLXRoZS1hZHZhbnRhZ2Utb2Ytb3JnYW5pYy1mb29kLXdpbGwtYXVnbWVudC10aGUtZ2xvYmFsLWJpby1hZ3JpY3VsdHXSAS1odHRwczovL3d3dy5iZW56aW5nYS5jb20vYW1wL2NvbnRlbnQvMzQzMjI0NDQ?hl=en-IN&gl=IN&ceid=IN%3Aen,2023-09-07
88,"Millet custodian from Odisha, Raimati takes farm success to G20 Summit",The New Indian Express,news.google.com/articles/CBMijQFodHRwczovL3d3dy5uZXdpbmRpYW5leHByZXNzLmNvbS9zdGF0ZXMvb2Rpc2hhLzIwMjMvc2VwLzA3L21pbGxldC1jdXN0b2RpYW4tZnJvbS1vZGlzaGEtcmFpbWF0aS10YWtlcy1mYXJtLXN1Y2Nlc3MtdG8tZzIwLXN1bW1pdC0yNjEyNTY1Lmh0bWzSAYwBaHR0cHM6Ly93d3cubmV3aW5kaWFuZXhwcmVzcy5jb20vc3RhdGVzL29kaXNoYS8yMDIzL3NlcC8wNy9taWxsZXQtY3VzdG9kaWFuLWZyb20tb2Rpc2hhLXJhaW1hdGktdGFrZXMtZmFybS1zdWNjZXNzLXRvLWcyMC1zdW1taXQtMjYxMjU2NS5hbXA?hl=en-IN&gl=IN&ceid=IN%3Aen,2023-09-07
79,"Molten Sulfur Market to increase by USD 154.48 million from 2021 to 2026, Akzo Nobel NV, Chevron Corp., Compania Espanola de Petroleos SA, and more among key companies- Technavio",Yahoo Finance,news.google.com/articles/CBMiT2h0dHBzOi8vZmluYW5jZS55YWhvby5jb20vbmV3cy9tb2x0ZW4tc3VsZnVyLW1hcmtldC1pbmNyZWFzZS11c2QtMDgzNTAwNTkwLmh0bWzSAVdodHRwczovL2ZpbmFuY2UueWFob28uY29tL2FtcGh0bWwvbmV3cy9tb2x0ZW4tc3VsZnVyLW1hcmtldC1pbmNyZWFzZS11c2QtMDgzNTAwNTkwLmh0bWw?hl=en-IN&gl=IN&ceid=IN%3Aen,2023-09-07
