,title,source,link,date
7,CRUCIAL WIN FOR COLTS – British Speedway Official Website,British Speedway Official Website,news.google.com/articles/CBMiOGh0dHBzOi8vYnJpdGlzaHNwZWVkd2F5LmNvLnVrL25kbC9jcnVjaWFsLXdpbi1mb3ItY29sdHMv0gEA?hl=en-IN&gl=IN&ceid=IN%3Aen,2023-08-27
1,PREVIEW: LEICESTER v OXFORD (NDL) – British Speedway ...,British Speedway Official Website,news.google.com/articles/CBMiQ2h0dHBzOi8vYnJpdGlzaHNwZWVkd2F5LmNvLnVrL25kbC9wcmV2aWV3LWxlaWNlc3Rlci12LW94Zm9yZC1uZGwtMi_SAQA?hl=en-IN&gl=IN&ceid=IN%3Aen,2023-08-26
2,PREVIEW: BELLE VUE v WORKINGTON (NDL) – British Speedway ...,British Speedway Official Website,news.google.com/articles/CBMiRWh0dHBzOi8vYnJpdGlzaHNwZWVkd2F5LmNvLnVrL25kbC9wcmV2aWV3LWJlbGxlLXZ1ZS12LXdvcmtpbmd0b24tbmRsL9IBAA?hl=en-IN&gl=IN&ceid=IN%3Aen,2023-08-25
15,"NCC, Oil India ex-dividend stocks, PM Modi’s Greece visit in Top News on August 25: Sahaj Fashions IPO to open, Share market, Bank Nifty outlook, ICC World Cup 2023 tickets sale details",Business Today,news.google.com/articles/CBMi8wFodHRwczovL3d3dy5idXNpbmVzc3RvZGF5LmluL3Zpc3VhbHN0b3JpZXMvbmV3cy9uY2Mtb2lsLWluZGlhLWV4LWRpdmlkZW5kLXN0b2Nrcy1wbS1tb2Rpcy1ncmVlY2UtdmlzaXQtaW4tdG9wLW5ld3Mtb24tYXVndXN0LTI1LXNhaGFqLWZhc2hpb25zLWlwby10by1vcGVuLXNoYXJlLW1hcmtldC1iYW5rLW5pZnR5LW91dGxvb2staWNjLXdvcmxkLWN1cC0yMDIzLXRpY2tldHMtc2FsZS1kZXRhaWxzLTU4MTczLTI1LTA4LTIwMjPSAfMBaHR0cHM6Ly93d3cuYnVzaW5lc3N0b2RheS5pbi92aXN1YWxzdG9yaWVzL25ld3MvbmNjLW9pbC1pbmRpYS1leC1kaXZpZGVuZC1zdG9ja3MtcG0tbW9kaXMtZ3JlZWNlLXZpc2l0LWluLXRvcC1uZXdzLW9uLWF1Z3VzdC0yNS1zYWhhai1mYXNoaW9ucy1pcG8tdG8tb3Blbi1zaGFyZS1tYXJrZXQtYmFuay1uaWZ0eS1vdXRsb29rLWljYy13b3JsZC1jdXAtMjAyMy10aWNrZXRzLXNhbGUtZGV0YWlscy01ODE3My0yNS0wOC0yMDIz?hl=en-IN&gl=IN&ceid=IN%3Aen,2023-08-25
14,10 highlights from our work to build a healthier UK in 2022,The Health Foundation,news.google.com/articles/CBMiemh0dHBzOi8vd3d3LmhlYWx0aC5vcmcudWsvbmV3cy1hbmQtY29tbWVudC9uZXdzbGV0dGVyLWZlYXR1cmVzLzEwLWhpZ2hsaWdodHMtZnJvbS1vdXItd29yay10by1idWlsZC1hLWhlYWx0aGllci11ay1pbi0yMDIy0gEA?hl=en-IN&gl=IN&ceid=IN%3Aen,2023-08-24
3,Watch Niko Omilana match the accent to the person in new NDL video,grmdaily.com,news.google.com/articles/CBMiOmh0dHBzOi8vZ3JtZGFpbHkuY29tL25pa28tb21pbGFuYS1tYXRjaC1hY2NlbnQtcGVyc29uLW5kbC_SAQA?hl=en-IN&gl=IN&ceid=IN%3Aen,2023-08-23
4,CPMI-Iosco report surveys CCP tools for ‘non-default losses’,Central Banking,news.google.com/articles/CBMihwFodHRwczovL3d3dy5jZW50cmFsYmFua2luZy5jb20vY2VudHJhbC1iYW5rcy9maW5hbmNpYWwtc3RhYmlsaXR5L2ZtaS83OTU5NTY4L2NwbWktaW9zY28tcmVwb3J0LXN1cnZleXMtY2NwLXRvb2xzLWZvci1ub24tZGVmYXVsdC1sb3NzZXPSAQA?hl=en-IN&gl=IN&ceid=IN%3Aen,2023-08-23
5,PREVIEW: OXFORD v BERWICK (NDL) – British Speedway Official ...,British Speedway Official Website,news.google.com/articles/CBMiQWh0dHBzOi8vYnJpdGlzaHNwZWVkd2F5LmNvLnVrL25kbC9wcmV2aWV3LW94Zm9yZC12LWJlcndpY2stbmRsLTIv0gEA?hl=en-IN&gl=IN&ceid=IN%3Aen,2023-08-23
26,BOUGHEN JOINS CHEETAHS – British Speedway Official Website,British Speedway Official Website,news.google.com/articles/CBMiTWh0dHBzOi8vYnJpdGlzaHNwZWVkd2F5LmNvLnVrL2NhYi1kaXJlY3QtY2hhbXBpb25zaGlwL2JvdWdoZW4tam9pbnMtY2hlZXRhaHMv0gEA?hl=en-IN&gl=IN&ceid=IN%3Aen,2023-08-22
42,The Nine-Dash Line and Taiwan Independence,Feminine Perspective Magazine,news.google.com/articles/CBMiTWh0dHBzOi8vcmluai5wcmVzcy9mcG0yMDIzL2F1Z3VzdC90aGUtbmluZS1kYXNoLWxpbmUtYW5kLXRhaXdhbi1pbmRlcGVuZGVuY2Uv0gFRaHR0cHM6Ly9yaW5qLnByZXNzL2ZwbTIwMjMvYXVndXN0L3RoZS1uaW5lLWRhc2gtbGluZS1hbmQtdGFpd2FuLWluZGVwZW5kZW5jZS9hbXAv?hl=en-IN&gl=IN&ceid=IN%3Aen,2023-08-22
