,title,source,link,date
11,"Results Review for ABB India, United Spirits, Phoenix Mills, Oil India ...",Investing.com India,news.google.com/articles/CBMiemh0dHBzOi8vaW4uaW52ZXN0aW5nLmNvbS9hbmFseXNpcy9yZXN1bHRzLXJldmlldy1mb3ItYWJiLWluZGlhLXVuaXRlZC1zcGlyaXRzLXBob2VuaXgtbWlsbHMtb2lsLWluZGlhLWJpcmxhLWNvcnAtMjAwNjAyNTc00gEA?hl=en-IN&gl=IN&ceid=IN%3Aen,2023-11-10
1,"Q2 Results today: Lupin, BHEL, MCX, Tata Power, others to announce Q2 earnings | Mint",Mint,news.google.com/articles/CBMikAFodHRwczovL3d3dy5saXZlbWludC5jb20vY29tcGFuaWVzL2NvbXBhbnktcmVzdWx0cy9xMi1yZXN1bHRzLXRvZGF5LWx1cGluLWJoZWwtbWN4LXRhdGEtcG93ZXItb3RoZXJzLXRvLWFubm91bmNlLXEyLWVhcm5pbmdzLTExNjk5NDEzMTczOTkzLmh0bWzSAZQBaHR0cHM6Ly93d3cubGl2ZW1pbnQuY29tL2NvbXBhbmllcy9jb21wYW55LXJlc3VsdHMvcTItcmVzdWx0cy10b2RheS1sdXBpbi1iaGVsLW1jeC10YXRhLXBvd2VyLW90aGVycy10by1hbm5vdW5jZS1xMi1lYXJuaW5ncy9hbXAtMTE2OTk0MTMxNzM5OTMuaHRtbA?hl=en-IN&gl=IN&ceid=IN%3Aen,2023-11-08
71,"Organic Fixed Power Capacitors Market Growth Strategy, Investment Opportunities, Future Trends, Demand, PEST A",openPR,news.google.com/articles/CBMiWWh0dHBzOi8vd3d3Lm9wZW5wci5jb20vbmV3cy8zMjgxMTI3L29yZ2FuaWMtZml4ZWQtcG93ZXItY2FwYWNpdG9ycy1tYXJrZXQtZ3Jvd3RoLXN0cmF0ZWd50gFYaHR0cHM6Ly93d3cub3BlbnByLmNvbS9hbXAvMzI4MTEyNy9vcmdhbmljLWZpeGVkLXBvd2VyLWNhcGFjaXRvcnMtbWFya2V0LWdyb3d0aC1zdHJhdGVneQ?hl=en-IN&gl=IN&ceid=IN%3Aen,2023-11-08
85,"CAR-T Therapy Market Upcoming Opportunities, Growth Prospects, Size, Share, and key Country Outlook To 2030",openPR,news.google.com/articles/CBMiVmh0dHBzOi8vd3d3Lm9wZW5wci5jb20vbmV3cy8zMjgxMDA5L2Nhci10LXRoZXJhcHktbWFya2V0LXVwY29taW5nLW9wcG9ydHVuaXRpZXMtZ3Jvd3Ro0gFVaHR0cHM6Ly93d3cub3BlbnByLmNvbS9hbXAvMzI4MTAwOS9jYXItdC10aGVyYXB5LW1hcmtldC11cGNvbWluZy1vcHBvcnR1bml0aWVzLWdyb3d0aA?hl=en-IN&gl=IN&ceid=IN%3Aen,2023-11-08
83,Concrete Floor Coating Market 2020-2030 Industry Trend and Demands Research Report,openPR,news.google.com/articles/CBMiWmh0dHBzOi8vd3d3Lm9wZW5wci5jb20vbmV3cy8zMjgwMDE3L2NvbmNyZXRlLWZsb29yLWNvYXRpbmctbWFya2V0LTIwMjAtMjAzMC1pbmR1c3RyeS10cmVuZNIBWWh0dHBzOi8vd3d3Lm9wZW5wci5jb20vYW1wLzMyODAwMTcvY29uY3JldGUtZmxvb3ItY29hdGluZy1tYXJrZXQtMjAyMC0yMDMwLWluZHVzdHJ5LXRyZW5k?hl=en-IN&gl=IN&ceid=IN%3Aen,2023-11-08
79,"Blood Purification Equipment Market worth US$ 5,502.8 Million by 2027 - Exclusive Report by The Insight Partne",openPR,news.google.com/articles/CBMiYGh0dHBzOi8vd3d3Lm9wZW5wci5jb20vbmV3cy8zMjgwMDk3L2Jsb29kLXB1cmlmaWNhdGlvbi1lcXVpcG1lbnQtbWFya2V0LXdvcnRoLXVzLTUtNTAyLTgtbWlsbGlvbtIBX2h0dHBzOi8vd3d3Lm9wZW5wci5jb20vYW1wLzMyODAwOTcvYmxvb2QtcHVyaWZpY2F0aW9uLWVxdWlwbWVudC1tYXJrZXQtd29ydGgtdXMtNS01MDItOC1taWxsaW9u?hl=en-IN&gl=IN&ceid=IN%3Aen,2023-11-08
74,"Maternal health Market 2023: Global Industry Share, Demand, Revenue, Size, Trends, Opportunity, Growth Factors",openPR,news.google.com/articles/CBMiXGh0dHBzOi8vd3d3Lm9wZW5wci5jb20vbmV3cy8zMjgxMjIwL21hdGVybmFsLWhlYWx0aC1tYXJrZXQtMjAyMy1nbG9iYWwtaW5kdXN0cnktc2hhcmUtZGVtYW5k0gFbaHR0cHM6Ly93d3cub3BlbnByLmNvbS9hbXAvMzI4MTIyMC9tYXRlcm5hbC1oZWFsdGgtbWFya2V0LTIwMjMtZ2xvYmFsLWluZHVzdHJ5LXNoYXJlLWRlbWFuZA?hl=en-IN&gl=IN&ceid=IN%3Aen,2023-11-08
72,"Pharmaceutical Excipients Market Recent Trends, In-depth Analysis, Size and Forecast 2023 to 2030",openPR,news.google.com/articles/CBMiW2h0dHBzOi8vd3d3Lm9wZW5wci5jb20vbmV3cy8zMjgxMDI2L3BoYXJtYWNldXRpY2FsLWV4Y2lwaWVudHMtbWFya2V0LXJlY2VudC10cmVuZHMtaW4tZGVwdGjSAVpodHRwczovL3d3dy5vcGVucHIuY29tL2FtcC8zMjgxMDI2L3BoYXJtYWNldXRpY2FsLWV4Y2lwaWVudHMtbWFya2V0LXJlY2VudC10cmVuZHMtaW4tZGVwdGg?hl=en-IN&gl=IN&ceid=IN%3Aen,2023-11-08
70,"Beverage Packaging Market Trend Shows a Rapid Growth, Competitive Analysis, Future Prospects And Forecast 2030",openPR,news.google.com/articles/CBMiWGh0dHBzOi8vd3d3Lm9wZW5wci5jb20vbmV3cy8zMjc5OTk5L2JldmVyYWdlLXBhY2thZ2luZy1tYXJrZXQtdHJlbmQtc2hvd3MtYS1yYXBpZC1ncm93dGjSAVdodHRwczovL3d3dy5vcGVucHIuY29tL2FtcC8zMjc5OTk5L2JldmVyYWdlLXBhY2thZ2luZy1tYXJrZXQtdHJlbmQtc2hvd3MtYS1yYXBpZC1ncm93dGg?hl=en-IN&gl=IN&ceid=IN%3Aen,2023-11-08
64,"Anticoagulants Market by Medical Composition, Type, End-Use Industry and Region Analyzed With Trends and Forec",openPR,news.google.com/articles/CBMiXWh0dHBzOi8vd3d3Lm9wZW5wci5jb20vbmV3cy8zMjgwMTY5L2FudGljb2FndWxhbnRzLW1hcmtldC1ieS1tZWRpY2FsLWNvbXBvc2l0aW9uLXR5cGUtZW5kLXVzZdIBXGh0dHBzOi8vd3d3Lm9wZW5wci5jb20vYW1wLzMyODAxNjkvYW50aWNvYWd1bGFudHMtbWFya2V0LWJ5LW1lZGljYWwtY29tcG9zaXRpb24tdHlwZS1lbmQtdXNl?hl=en-IN&gl=IN&ceid=IN%3Aen,2023-11-08
