,title,source,link,date
2,"Animation and Gaming Market Size 2023: Report by Revenue Analysis, Regional Segments and Future Growth Pr",Benzinga,news.google.com/articles/CBMimQFodHRwczovL3d3dy5iZW56aW5nYS5jb20vcHJlc3NyZWxlYXNlcy8yMy8wOS8zNDQxMDE4MS9hbmltYXRpb24tYW5kLWdhbWluZy1tYXJrZXQtc2l6ZS0yMDIzLXJlcG9ydC1ieS1yZXZlbnVlLWFuYWx5c2lzLXJlZ2lvbmFsLXNlZ21lbnRzLWFuZC1mdXR1cmUtZ3Jvd3TSAS1odHRwczovL3d3dy5iZW56aW5nYS5jb20vYW1wL2NvbnRlbnQvMzQ0MTAxODE?hl=en-IN&gl=IN&ceid=IN%3Aen,2023-09-10
8,Churches host art by Noyes Art Gallery artists,Lincoln Journal Star,news.google.com/articles/CBMinQFodHRwczovL2pvdXJuYWxzdGFyLmNvbS9saWZlLWVudGVydGFpbm1lbnQvbG9jYWwvYXJ0LXRoZWF0ZXIvY2h1cmNoZXMtaG9zdC1hcnQtYnktbm95ZXMtYXJ0LWdhbGxlcnktYXJ0aXN0cy9hcnRpY2xlXzMyM2JhMGI2LTRkMDMtMTFlZS1iYjk3LWZmZDcxMzRiMWFhYi5odG1s0gEA?hl=en-IN&gl=IN&ceid=IN%3Aen,2023-09-09
4,"Meet the teams of Aotearoa's newest reno show, House Rules NZ",More FM,news.google.com/articles/CBMibmh0dHBzOi8vd3d3Lm1vcmVmbS5jby5uei9ob21lL2tpd2ktYXMvMjAyMy8wOS9tZWV0LXRoZS10ZWFtcy1vZi1hb3RlYXJvYXMtbmV3ZXN0LXJlbm8tc2hvdy1ob3VzZS1ydWxlcy1uei5odG1s0gEA?hl=en-IN&gl=IN&ceid=IN%3Aen,2023-09-08
5,"UPDATE: New to The Street Proudly Announces its 500th Special Edition 1-hour Broadcast with Guest Appearances, Airs on Newsmax, Saturday, September 9, 2023, 3:00-4:00 PM ET",Yahoo Finance,news.google.com/articles/CBMiVGh0dHBzOi8vZmluYW5jZS55YWhvby5jb20vbmV3cy9zdHJlZXQtcHJvdWRseS1hbm5vdW5jZXMtNTAwdGgtc3BlY2lhbC0xNDM4MDAxNzcuaHRtbNIBXGh0dHBzOi8vZmluYW5jZS55YWhvby5jb20vYW1waHRtbC9uZXdzL3N0cmVldC1wcm91ZGx5LWFubm91bmNlcy01MDB0aC1zcGVjaWFsLTE0MzgwMDE3Ny5odG1s?hl=en-IN&gl=IN&ceid=IN%3Aen,2023-09-08
7,Spotlight: organisation and commercialisation of sports events in ...,Lexology,news.google.com/articles/CBMiU2h0dHBzOi8vd3d3LmxleG9sb2d5LmNvbS9saWJyYXJ5L2RldGFpbC5hc3B4P2c9ZGEyMjI2OGYtYTBjYi00NTcxLWFlZjQtZjNmZDViZDkzMzk50gEA?hl=en-IN&gl=IN&ceid=IN%3Aen,2023-09-08
18,Revolutionizing Networking: Insights into the Acrylic Paper Market size which is expanding with a 4.4% CA,Benzinga,news.google.com/articles/CBMimQFodHRwczovL3d3dy5iZW56aW5nYS5jb20vcHJlc3NyZWxlYXNlcy8yMy8wOS8zNDM2MTgyOC9yZXZvbHV0aW9uaXppbmctbmV0d29ya2luZy1pbnNpZ2h0cy1pbnRvLXRoZS1hY3J5bGljLXBhcGVyLW1hcmtldC1zaXplLXdoaWNoLWlzLWV4cGFuZGluZy13aXRoLWEtNC3SAS1odHRwczovL3d3dy5iZW56aW5nYS5jb20vYW1wL2NvbnRlbnQvMzQzNjE4Mjg?hl=en-IN&gl=IN&ceid=IN%3Aen,2023-09-08
3,"Animation and Gaming Market Size, Current Insights and Demographic Trends 2023-2030",Benzinga,news.google.com/articles/CBMiiAFodHRwczovL3d3dy5iZW56aW5nYS5jb20vcHJlc3NyZWxlYXNlcy8yMy8wOS8zNDMxNDU5OS9hbmltYXRpb24tYW5kLWdhbWluZy1tYXJrZXQtc2l6ZS1jdXJyZW50LWluc2lnaHRzLWFuZC1kZW1vZ3JhcGhpYy10cmVuZHMtMjAyMy0yMDMw0gEtaHR0cHM6Ly93d3cuYmVuemluZ2EuY29tL2FtcC9jb250ZW50LzM0MzE0NTk5?hl=en-IN&gl=IN&ceid=IN%3Aen,2023-09-07
