,title,source,link,date
1,"Social media platforms becoming modern-day diaries, memory albums",Kuwait Times,news.google.com/articles/CBMiXWh0dHBzOi8vd3d3Lmt1d2FpdHRpbWVzLmNvbS9zb2NpYWwtbWVkaWEtcGxhdGZvcm1zLWJlY29taW5nLW1vZGVybi1kYXktZGlhcmllcy1tZW1vcnktYWxidW1zL9IBAA?hl=en-IN&gl=IN&ceid=IN%3Aen,2023-09-11
2,Animation and Gaming Market Size Report 2023-2030 | 99 Pages Report,Benzinga,news.google.com/articles/CBMid2h0dHBzOi8vd3d3LmJlbnppbmdhLmNvbS9wcmVzc3JlbGVhc2VzLzIzLzA5LzM0MzgwMzQxL2FuaW1hdGlvbi1hbmQtZ2FtaW5nLW1hcmtldC1zaXplLXJlcG9ydC0yMDIzLTIwMzAtOTktcGFnZXMtcmVwb3J00gEtaHR0cHM6Ly93d3cuYmVuemluZ2EuY29tL2FtcC9jb250ZW50LzM0MzgwMzQx?hl=en-IN&gl=IN&ceid=IN%3Aen,2023-09-09
5,"Meet the teams of Aotearoa's newest reno show, House Rules NZ",More FM,news.google.com/articles/CBMibmh0dHBzOi8vd3d3Lm1vcmVmbS5jby5uei9ob21lL2tpd2ktYXMvMjAyMy8wOS9tZWV0LXRoZS10ZWFtcy1vZi1hb3RlYXJvYXMtbmV3ZXN0LXJlbm8tc2hvdy1ob3VzZS1ydWxlcy1uei5odG1s0gEA?hl=en-IN&gl=IN&ceid=IN%3Aen,2023-09-08
6,"New to The Street Proudly Announces its 500th Special Edition 1-hour Broadcast with Guest Appearances, Airs on Newsmax, Saturday, September 9, 2023, 3:30 PM ET",Yahoo Finance,news.google.com/articles/CBMiVGh0dHBzOi8vZmluYW5jZS55YWhvby5jb20vbmV3cy9zdHJlZXQtcHJvdWRseS1hbm5vdW5jZXMtNTAwdGgtc3BlY2lhbC0xMzMwMDAxOTcuaHRtbNIBXGh0dHBzOi8vZmluYW5jZS55YWhvby5jb20vYW1waHRtbC9uZXdzL3N0cmVldC1wcm91ZGx5LWFubm91bmNlcy01MDB0aC1zcGVjaWFsLTEzMzAwMDE5Ny5odG1s?hl=en-IN&gl=IN&ceid=IN%3Aen,2023-09-08
7,Spotlight: organisation and commercialisation of sports events in ...,Lexology,news.google.com/articles/CBMiU2h0dHBzOi8vd3d3LmxleG9sb2d5LmNvbS9saWJyYXJ5L2RldGFpbC5hc3B4P2c9ZGEyMjI2OGYtYTBjYi00NTcxLWFlZjQtZjNmZDViZDkzMzk50gEA?hl=en-IN&gl=IN&ceid=IN%3Aen,2023-09-08
22,Revolutionizing Networking: Insights into the Acrylic Paper Market size which is expanding with a 4.4% CA,Benzinga,news.google.com/articles/CBMimQFodHRwczovL3d3dy5iZW56aW5nYS5jb20vcHJlc3NyZWxlYXNlcy8yMy8wOS8zNDM2MTgyOC9yZXZvbHV0aW9uaXppbmctbmV0d29ya2luZy1pbnNpZ2h0cy1pbnRvLXRoZS1hY3J5bGljLXBhcGVyLW1hcmtldC1zaXplLXdoaWNoLWlzLWV4cGFuZGluZy13aXRoLWEtNC3SAS1odHRwczovL3d3dy5iZW56aW5nYS5jb20vYW1wL2NvbnRlbnQvMzQzNjE4Mjg?hl=en-IN&gl=IN&ceid=IN%3Aen,2023-09-08
