,title,source,link,date
2,Stock Market Today: All You Need To Know Going Into Trade On Nov. 24,BQ Prime,news.google.com/articles/CBMiZWh0dHBzOi8vd3d3LmJxcHJpbWUuY29tL2J1c2luZXNzL3N0b2NrLW1hcmtldC10b2RheS1hbGwteW91LW5lZWQtdG8ta25vdy1nb2luZy1pbnRvLXRyYWRlLW9uLW5vdi0yNC0y0gFpaHR0cHM6Ly93d3cuYnFwcmltZS5jb20vYW1wL2J1c2luZXNzL3N0b2NrLW1hcmtldC10b2RheS1hbGwteW91LW5lZWQtdG8ta25vdy1nb2luZy1pbnRvLXRyYWRlLW9uLW5vdi0yNC0y?hl=en-IN&gl=IN&ceid=IN%3Aen,2023-11-23
3,"Stocks To Watch: Lupin, JSW Steel, Apar Industries, IRCTC, JM Financial, LTIMindtree, Karnataka Bank, BHEL",BQ Prime,news.google.com/articles/CBMigwFodHRwczovL3d3dy5icXByaW1lLmNvbS9idXNpbmVzcy9zdG9ja3MtdG8td2F0Y2gtbHVwaW4tanN3LXN0ZWVsLWFwYXItaW5kdXN0cmllcy1pcmN0Yy1qbS1maW5hbmNpYWwtbHRpbWluZHRyZWUta2FybmF0YWthLWJhbmstYmhlbNIBhwFodHRwczovL3d3dy5icXByaW1lLmNvbS9hbXAvYnVzaW5lc3Mvc3RvY2tzLXRvLXdhdGNoLWx1cGluLWpzdy1zdGVlbC1hcGFyLWluZHVzdHJpZXMtaXJjdGMtam0tZmluYW5jaWFsLWx0aW1pbmR0cmVlLWthcm5hdGFrYS1iYW5rLWJoZWw?hl=en-IN&gl=IN&ceid=IN%3Aen,2023-11-23
5,"India Furniture Market Report 2023-28: Size, Share, Trends, Scope, Demand and Opportunity",openPR,news.google.com/articles/CBMiW2h0dHBzOi8vd3d3Lm9wZW5wci5jb20vbmV3cy8zMjk4OTU0L2luZGlhLWZ1cm5pdHVyZS1tYXJrZXQtcmVwb3J0LTIwMjMtMjgtc2l6ZS1zaGFyZS10cmVuZHPSAVpodHRwczovL3d3dy5vcGVucHIuY29tL2FtcC8zMjk4OTU0L2luZGlhLWZ1cm5pdHVyZS1tYXJrZXQtcmVwb3J0LTIwMjMtMjgtc2l6ZS1zaGFyZS10cmVuZHM?hl=en-IN&gl=IN&ceid=IN%3Aen,2023-11-23
6,"Stocks To Watch: Tata Power, Tech Mahindra, IRCTC, Oberoi Realty, Manappuram Finance, Adani Enterprises",BQ Prime,news.google.com/articles/CBMiggFodHRwczovL3d3dy5icXByaW1lLmNvbS9idXNpbmVzcy9zdG9ja3MtdG8td2F0Y2gtdGF0YS1wb3dlci1pcmN0Yy1vYmVyb2ktcmVhbHR5LW1hbmFwcHVyYW0tZmluYW5jZS10ZWNoLW1haGluZHJhLWFkYW5pLWVudGVycHJpc2Vz0gGGAWh0dHBzOi8vd3d3LmJxcHJpbWUuY29tL2FtcC9idXNpbmVzcy9zdG9ja3MtdG8td2F0Y2gtdGF0YS1wb3dlci1pcmN0Yy1vYmVyb2ktcmVhbHR5LW1hbmFwcHVyYW0tZmluYW5jZS10ZWNoLW1haGluZHJhLWFkYW5pLWVudGVycHJpc2Vz?hl=en-IN&gl=IN&ceid=IN%3Aen,2023-11-20
1,"Ergonomic Chairs Market to grow by USD 5.23 billion from 2023 to 2028; market is fragmented due to the presence of prominent companies like Chair Factory, Damro Furnitures Pvt. Ltd. and Durian Pvt. Ltd., and many more - Technavio",Yahoo Finance,news.google.com/articles/CBMiTmh0dHBzOi8vZmluYW5jZS55YWhvby5jb20vbmV3cy9lcmdvbm9taWMtY2hhaXJzLW1hcmtldC1ncm93LXVzZC0xODE1MDAyMDguaHRtbNIBVmh0dHBzOi8vZmluYW5jZS55YWhvby5jb20vYW1waHRtbC9uZXdzL2VyZ29ub21pYy1jaGFpcnMtbWFya2V0LWdyb3ctdXNkLTE4MTUwMDIwOC5odG1s?hl=en-IN&gl=IN&ceid=IN%3Aen,2023-11-15
