,title,source,link,date
39,An intense examination of the Sustainable growth and development with a growing CAGR of 5.8% on Membrane,Benzinga,news.google.com/articles/CBMimQFodHRwczovL3d3dy5iZW56aW5nYS5jb20vcHJlc3NyZWxlYXNlcy8yMy8wOS8zNDQyMjMxOC9hbi1pbnRlbnNlLWV4YW1pbmF0aW9uLW9mLXRoZS1zdXN0YWluYWJsZS1ncm93dGgtYW5kLWRldmVsb3BtZW50LXdpdGgtYS1ncm93aW5nLWNhZ3Itb2YtNS04LW9uLW1lbWLSAS1odHRwczovL3d3dy5iZW56aW5nYS5jb20vYW1wL2NvbnRlbnQvMzQ0MjIzMTg?hl=en-IN&gl=IN&ceid=IN%3Aen,2023-09-11
43,The latest trend analysis for the Low DE Maltodextrin market suggests that it will experience steady grow,Benzinga,news.google.com/articles/CBMimQFodHRwczovL3d3dy5iZW56aW5nYS5jb20vcHJlc3NyZWxlYXNlcy8yMy8wOS8zNDQyMjMwOC90aGUtbGF0ZXN0LXRyZW5kLWFuYWx5c2lzLWZvci10aGUtbG93LWRlLW1hbHRvZGV4dHJpbi1tYXJrZXQtc3VnZ2VzdHMtdGhhdC1pdC13aWxsLWV4cGVyaWVuY2Utc3RlYWTSAS1odHRwczovL3d3dy5iZW56aW5nYS5jb20vYW1wL2NvbnRlbnQvMzQ0MjIzMDg?hl=en-IN&gl=IN&ceid=IN%3Aen,2023-09-11
52,"An extensive evaluation of the Irrigation Cannula market size, including its anticipated 4% from 2023 to",Benzinga,news.google.com/articles/CBMimQFodHRwczovL3d3dy5iZW56aW5nYS5jb20vcHJlc3NyZWxlYXNlcy8yMy8wOS8zNDQwMzUxNS9hbi1leHRlbnNpdmUtZXZhbHVhdGlvbi1vZi10aGUtaXJyaWdhdGlvbi1jYW5udWxhLW1hcmtldC1zaXplLWluY2x1ZGluZy1pdHMtYW50aWNpcGF0ZWQtNC1mcm9tLTIwMjPSAS1odHRwczovL3d3dy5iZW56aW5nYS5jb20vYW1wL2NvbnRlbnQvMzQ0MDM1MTU?hl=en-IN&gl=IN&ceid=IN%3Aen,2023-09-10
51,The latest trend analysis by ReportPrime suggests that the Flatbed Trailers market will witness robust co,Benzinga,news.google.com/articles/CBMimQFodHRwczovL3d3dy5iZW56aW5nYS5jb20vcHJlc3NyZWxlYXNlcy8yMy8wOS8zNDQwNjM0Mi90aGUtbGF0ZXN0LXRyZW5kLWFuYWx5c2lzLWJ5LXJlcG9ydHByaW1lLXN1Z2dlc3RzLXRoYXQtdGhlLWZsYXRiZWQtdHJhaWxlcnMtbWFya2V0LXdpbGwtd2l0bmVzcy1yb2LSAS1odHRwczovL3d3dy5iZW56aW5nYS5jb20vYW1wL2NvbnRlbnQvMzQ0MDYzNDI?hl=en-IN&gl=IN&ceid=IN%3Aen,2023-09-10
12,Libya Closes Four Major Oil Ports as Storm Daniel Sweeps Through,The Maritime Executive,news.google.com/articles/CBMiZ2h0dHBzOi8vbWFyaXRpbWUtZXhlY3V0aXZlLmNvbS9hcnRpY2xlL2xpYnlhLWNsb3Nlcy1mb3VyLW1ham9yLW9pbC1wb3J0cy1hcy1zdG9ybS1kYW5pZWwtc3dlZXBzLXRocm91Z2jSAQA?hl=en-IN&gl=IN&ceid=IN%3Aen,2023-09-10
58,This report on the analysis of the Roller Thrust Bearings market supports growth and forecasts industry a,Benzinga,news.google.com/articles/CBMimQFodHRwczovL3d3dy5iZW56aW5nYS5jb20vcHJlc3NyZWxlYXNlcy8yMy8wOS8zNDQwNTI4MS90aGlzLXJlcG9ydC1vbi10aGUtYW5hbHlzaXMtb2YtdGhlLXJvbGxlci10aHJ1c3QtYmVhcmluZ3MtbWFya2V0LXN1cHBvcnRzLWdyb3d0aC1hbmQtZm9yZWNhc3RzLWluZHXSAS1odHRwczovL3d3dy5iZW56aW5nYS5jb20vYW1wL2NvbnRlbnQvMzQ0MDUyODE?hl=en-IN&gl=IN&ceid=IN%3Aen,2023-09-10
17,"2023, Fluid Rotary Unions Market Growth Dynamics: Empowering Business with New Opportunities till 2030",Benzinga,news.google.com/articles/CBMimQFodHRwczovL3d3dy5iZW56aW5nYS5jb20vcHJlc3NyZWxlYXNlcy8yMy8wOS8zNDQxNzYwOC8yMDIzLWZsdWlkLXJvdGFyeS11bmlvbnMtbWFya2V0LWdyb3d0aC1keW5hbWljcy1lbXBvd2VyaW5nLWJ1c2luZXNzLXdpdGgtbmV3LW9wcG9ydHVuaXRpZXMtdGlsbC0yMDPSAS1odHRwczovL3d3dy5iZW56aW5nYS5jb20vYW1wL2NvbnRlbnQvMzQ0MTc2MDg?hl=en-IN&gl=IN&ceid=IN%3Aen,2023-09-10
60,A Detailed Report on the Global Custom Solenoids Market size with a forecasting CAGR of 6.5% along with i,Benzinga,news.google.com/articles/CBMimQFodHRwczovL3d3dy5iZW56aW5nYS5jb20vcHJlc3NyZWxlYXNlcy8yMy8wOS8zNDQwMzkzNi9hLWRldGFpbGVkLXJlcG9ydC1vbi10aGUtZ2xvYmFsLWN1c3RvbS1zb2xlbm9pZHMtbWFya2V0LXNpemUtd2l0aC1hLWZvcmVjYXN0aW5nLWNhZ3Itb2YtNi01LWFsb25nLXfSAS1odHRwczovL3d3dy5iZW56aW5nYS5jb20vYW1wL2NvbnRlbnQvMzQ0MDM5MzY?hl=en-IN&gl=IN&ceid=IN%3Aen,2023-09-10
64,"Bench Scales market report offers information about the market's competitive environment, including some",Benzinga,news.google.com/articles/CBMimQFodHRwczovL3d3dy5iZW56aW5nYS5jb20vcHJlc3NyZWxlYXNlcy8yMy8wOS8zNDQwMTkxOC9iZW5jaC1zY2FsZXMtbWFya2V0LXJlcG9ydC1vZmZlcnMtaW5mb3JtYXRpb24tYWJvdXQtdGhlLW1hcmtldHMtY29tcGV0aXRpdmUtZW52aXJvbm1lbnQtaW5jbHVkaW5nLXPSAS1odHRwczovL3d3dy5iZW56aW5nYS5jb20vYW1wL2NvbnRlbnQvMzQ0MDE5MTg?hl=en-IN&gl=IN&ceid=IN%3Aen,2023-09-10
20,Aerospace Industry Engraving Machines Market Challenges and Forecast Report 2023-2030 | with 105 Pages,Benzinga,news.google.com/articles/CBMimQFodHRwczovL3d3dy5iZW56aW5nYS5jb20vcHJlc3NyZWxlYXNlcy8yMy8wOS8zNDQxMzAyOS9hZXJvc3BhY2UtaW5kdXN0cnktZW5ncmF2aW5nLW1hY2hpbmVzLW1hcmtldC1jaGFsbGVuZ2VzLWFuZC1mb3JlY2FzdC1yZXBvcnQtMjAyMy0yMDMwLXdpdGgtMTA1LXBhZ2XSAS1odHRwczovL3d3dy5iZW56aW5nYS5jb20vYW1wL2NvbnRlbnQvMzQ0MTMwMjk?hl=en-IN&gl=IN&ceid=IN%3Aen,2023-09-10
