,title,source,link,date
78,Industry Revenue and Market Worth of Calcium Channel Blockers Market provide CAGR rate of 8.3% for period,Benzinga,news.google.com/articles/CBMimQFodHRwczovL3d3dy5iZW56aW5nYS5jb20vcHJlc3NyZWxlYXNlcy8yMy8wOS8zNDY1NzYyMi9pbmR1c3RyeS1yZXZlbnVlLWFuZC1tYXJrZXQtd29ydGgtb2YtY2FsY2l1bS1jaGFubmVsLWJsb2NrZXJzLW1hcmtldC1wcm92aWRlLWNhZ3ItcmF0ZS1vZi04LTMtZm9yLXDSAS1odHRwczovL3d3dy5iZW56aW5nYS5jb20vYW1wL2NvbnRlbnQvMzQ2NTc2MjI?hl=en-IN&gl=IN&ceid=IN%3Aen,2023-09-17
40,"2023 | Bisphosphonate Drug Market Size, Restricted Information Analysis Forecast 2030",Benzinga,news.google.com/articles/CBMiiAFodHRwczovL3d3dy5iZW56aW5nYS5jb20vcHJlc3NyZWxlYXNlcy8yMy8wOS8zNDY1Njk3Ny8yMDIzLWJpc3Bob3NwaG9uYXRlLWRydWctbWFya2V0LXNpemUtcmVzdHJpY3RlZC1pbmZvcm1hdGlvbi1hbmFseXNpcy1mb3JlY2FzdC0yMDMw0gEtaHR0cHM6Ly93d3cuYmVuemluZ2EuY29tL2FtcC9jb250ZW50LzM0NjU2OTc3?hl=en-IN&gl=IN&ceid=IN%3Aen,2023-09-16
28,"Premature Ovarian Insufficiency (POI) Treatment Market 2023-2030 Insight: by Market Dynamics, Analysis an",Benzinga,news.google.com/articles/CBMimQFodHRwczovL3d3dy5iZW56aW5nYS5jb20vcHJlc3NyZWxlYXNlcy8yMy8wOS8zNDY0NzAxNy9wcmVtYXR1cmUtb3Zhcmlhbi1pbnN1ZmZpY2llbmN5LXBvaS10cmVhdG1lbnQtbWFya2V0LTIwMjMtMjAzMC1pbnNpZ2h0LWJ5LW1hcmtldC1keW5hbWljcy1hbmFseXNpcy3SAS1odHRwczovL3d3dy5iZW56aW5nYS5jb20vYW1wL2NvbnRlbnQvMzQ2NDcwMTc?hl=en-IN&gl=IN&ceid=IN%3Aen,2023-09-16
96,Macular Edema and Macular Degeneration Market Insights: Market's Growth Opportunities and Market Size wit,Benzinga,news.google.com/articles/CBMimQFodHRwczovL3d3dy5iZW56aW5nYS5jb20vcHJlc3NyZWxlYXNlcy8yMy8wOS8zNDY0MTEwNC9tYWN1bGFyLWVkZW1hLWFuZC1tYWN1bGFyLWRlZ2VuZXJhdGlvbi1tYXJrZXQtaW5zaWdodHMtbWFya2V0cy1ncm93dGgtb3Bwb3J0dW5pdGllcy1hbmQtbWFya2V0LXNpemXSAS1odHRwczovL3d3dy5iZW56aW5nYS5jb20vYW1wL2NvbnRlbnQvMzQ2NDExMDQ?hl=en-IN&gl=IN&ceid=IN%3Aen,2023-09-16
95,Gas Permeable Contact Lenses market analysis study offers a both qualitative and quantitative analysis of,Benzinga,news.google.com/articles/CBMimQFodHRwczovL3d3dy5iZW56aW5nYS5jb20vcHJlc3NyZWxlYXNlcy8yMy8wOS8zNDY1MzAwOS9nYXMtcGVybWVhYmxlLWNvbnRhY3QtbGVuc2VzLW1hcmtldC1hbmFseXNpcy1zdHVkeS1vZmZlcnMtYS1ib3RoLXF1YWxpdGF0aXZlLWFuZC1xdWFudGl0YXRpdmUtYW5hbHnSAS1odHRwczovL3d3dy5iZW56aW5nYS5jb20vYW1wL2NvbnRlbnQvMzQ2NTMwMDk?hl=en-IN&gl=IN&ceid=IN%3Aen,2023-09-16
91,Topical Corticosteroids industry research covers a wide range of industries with predicted CAGR 12.6% dur,Benzinga,news.google.com/articles/CBMimQFodHRwczovL3d3dy5iZW56aW5nYS5jb20vcHJlc3NyZWxlYXNlcy8yMy8wOS8zNDY0OTk2OS90b3BpY2FsLWNvcnRpY29zdGVyb2lkcy1pbmR1c3RyeS1yZXNlYXJjaC1jb3ZlcnMtYS13aWRlLXJhbmdlLW9mLWluZHVzdHJpZXMtd2l0aC1wcmVkaWN0ZWQtY2Fnci0xMi3SAS1odHRwczovL3d3dy5iZW56aW5nYS5jb20vYW1wL2NvbnRlbnQvMzQ2NDk5Njk?hl=en-IN&gl=IN&ceid=IN%3Aen,2023-09-16
83,Psoriatic Arthritis Treatment Market Report: A Comprehensive Analysis of Industry Growth with estimated f,Benzinga,news.google.com/articles/CBMimQFodHRwczovL3d3dy5iZW56aW5nYS5jb20vcHJlc3NyZWxlYXNlcy8yMy8wOS8zNDY1MTU0MS9wc29yaWF0aWMtYXJ0aHJpdGlzLXRyZWF0bWVudC1tYXJrZXQtcmVwb3J0LWEtY29tcHJlaGVuc2l2ZS1hbmFseXNpcy1vZi1pbmR1c3RyeS1ncm93dGgtd2l0aC1lc3RpbWHSAS1odHRwczovL3d3dy5iZW56aW5nYS5jb20vYW1wL2NvbnRlbnQvMzQ2NTE1NDE?hl=en-IN&gl=IN&ceid=IN%3Aen,2023-09-16
77,Targeted Drug ALK Inhibitors for NSCLC Market Analysis: Examining Trends and Forecasting Revenue Growth w,Benzinga,news.google.com/articles/CBMimQFodHRwczovL3d3dy5iZW56aW5nYS5jb20vcHJlc3NyZWxlYXNlcy8yMy8wOS8zNDY1NjcwOC90YXJnZXRlZC1kcnVnLWFsay1pbmhpYml0b3JzLWZvci1uc2NsYy1tYXJrZXQtYW5hbHlzaXMtZXhhbWluaW5nLXRyZW5kcy1hbmQtZm9yZWNhc3RpbmctcmV2ZW51ZS1ncm_SAS1odHRwczovL3d3dy5iZW56aW5nYS5jb20vYW1wL2NvbnRlbnQvMzQ2NTY3MDg?hl=en-IN&gl=IN&ceid=IN%3Aen,2023-09-16
61,"Oral Anti-Diabetic Drugs Market is Booming with Strong Growth Prospects | Bayer, Merck, Servier",openPR,news.google.com/articles/CBMiYWh0dHBzOi8vd3d3Lm9wZW5wci5jb20vbmV3cy8zMjEwODI0L29yYWwtYW50aS1kaWFiZXRpYy1kcnVncy1tYXJrZXQtaXMtYm9vbWluZy13aXRoLXN0cm9uZy1ncm93dGjSAWBodHRwczovL3d3dy5vcGVucHIuY29tL2FtcC8zMjEwODI0L29yYWwtYW50aS1kaWFiZXRpYy1kcnVncy1tYXJrZXQtaXMtYm9vbWluZy13aXRoLXN0cm9uZy1ncm93dGg?hl=en-IN&gl=IN&ceid=IN%3Aen,2023-09-16
57,Pertuzumab Market Size 2023 | Data-Driven Insights with Adapting to Rapid Changes by Top Players till 203,Benzinga,news.google.com/articles/CBMimQFodHRwczovL3d3dy5iZW56aW5nYS5jb20vcHJlc3NyZWxlYXNlcy8yMy8wOS8zNDY1NDgzOS9wZXJ0dXp1bWFiLW1hcmtldC1zaXplLTIwMjMtZGF0YS1kcml2ZW4taW5zaWdodHMtd2l0aC1hZGFwdGluZy10by1yYXBpZC1jaGFuZ2VzLWJ5LXRvcC1wbGF5ZXJzLXRpbGzSAS1odHRwczovL3d3dy5iZW56aW5nYS5jb20vYW1wL2NvbnRlbnQvMzQ2NTQ4Mzk?hl=en-IN&gl=IN&ceid=IN%3Aen,2023-09-16
