,title,source,link,date
0,Novartis India Limited Announces Change in Registered Office ...,Marketscreener.com,news.google.com/articles/CBMinQFodHRwczovL3d3dy5tYXJrZXRzY3JlZW5lci5jb20vcXVvdGUvc3RvY2svTk9WQVJUSVMtSU5ESUEtTElNSVRFRC02NDkzNjk0L25ld3MvTm92YXJ0aXMtSW5kaWEtTGltaXRlZC1Bbm5vdW5jZXMtQ2hhbmdlLWluLVJlZ2lzdGVyZWQtT2ZmaWNlLUFkZHJlc3MtNDQ4NTI4ODQv0gEA?hl=en-IN&gl=IN&ceid=IN%3Aen,2023-09-15
17,Top 10 Contract Development and Manufacturing Organizations,Genetic Engineering & Biotechnology News,news.google.com/articles/CBMiX2h0dHBzOi8vd3d3LmdlbmVuZ25ld3MuY29tL2EtbGlzdHMvdG9wLTEwLWNvbnRyYWN0LWRldmVsb3BtZW50LWFuZC1tYW51ZmFjdHVyaW5nLW9yZ2FuaXphdGlvbnMv0gEA?hl=en-IN&gl=IN&ceid=IN%3Aen,2023-09-15
96,"The global Isoprenaline market trends, applications, analysis, growth, and forecast predict that the mark",Benzinga,news.google.com/articles/CBMimQFodHRwczovL3d3dy5iZW56aW5nYS5jb20vcHJlc3NyZWxlYXNlcy8yMy8wOS8zNDYzMTM2Mi90aGUtZ2xvYmFsLWlzb3ByZW5hbGluZS1tYXJrZXQtdHJlbmRzLWFwcGxpY2F0aW9ucy1hbmFseXNpcy1ncm93dGgtYW5kLWZvcmVjYXN0LXByZWRpY3QtdGhhdC10aGUtbWHSAS1odHRwczovL3d3dy5iZW56aW5nYS5jb20vYW1wL2NvbnRlbnQvMzQ2MzEzNjI?hl=en-IN&gl=IN&ceid=IN%3Aen,2023-09-15
94,"The Valley Fever Treatment market size from 2023 to 2030 has been examined, with a detailed competitive l",Benzinga,news.google.com/articles/CBMimQFodHRwczovL3d3dy5iZW56aW5nYS5jb20vcHJlc3NyZWxlYXNlcy8yMy8wOS8zNDYzMjI3OS90aGUtdmFsbGV5LWZldmVyLXRyZWF0bWVudC1tYXJrZXQtc2l6ZS1mcm9tLTIwMjMtdG8tMjAzMC1oYXMtYmVlbi1leGFtaW5lZC13aXRoLWEtZGV0YWlsZWQtY29tcGV0aXTSAS1odHRwczovL3d3dy5iZW56aW5nYS5jb20vYW1wL2NvbnRlbnQvMzQ2MzIyNzk?hl=en-IN&gl=IN&ceid=IN%3Aen,2023-09-15
89,Rickets Treatment Market Forecast from 2023 - 2030 Growing at a CAGR of 6% and it takes into account mar,Benzinga,news.google.com/articles/CBMimQFodHRwczovL3d3dy5iZW56aW5nYS5jb20vcHJlc3NyZWxlYXNlcy8yMy8wOS8zNDYzNTA3MC9yaWNrZXRzLXRyZWF0bWVudC1tYXJrZXQtZm9yZWNhc3QtZnJvbS0yMDIzLTIwMzAtZ3Jvd2luZy1hdC1hLWNhZ3Itb2YtNi1hbmQtaXQtdGFrZXMtaW50by1hY2NvdW50LW3SAS1odHRwczovL3d3dy5iZW56aW5nYS5jb20vYW1wL2NvbnRlbnQvMzQ2MzUwNzA?hl=en-IN&gl=IN&ceid=IN%3Aen,2023-09-15
87,"Ophthalmic Lens Market Analysis Report: Market Segmentation by Application and Types, New Technology, its",Benzinga,news.google.com/articles/CBMimQFodHRwczovL3d3dy5iZW56aW5nYS5jb20vcHJlc3NyZWxlYXNlcy8yMy8wOS8zNDYyODk4MS9vcGh0aGFsbWljLWxlbnMtbWFya2V0LWFuYWx5c2lzLXJlcG9ydC1tYXJrZXQtc2VnbWVudGF0aW9uLWJ5LWFwcGxpY2F0aW9uLWFuZC10eXBlcy1uZXctdGVjaG5vbG9neS3SAS1odHRwczovL3d3dy5iZW56aW5nYS5jb20vYW1wL2NvbnRlbnQvMzQ2Mjg5ODE?hl=en-IN&gl=IN&ceid=IN%3Aen,2023-09-15
84,"This report provides a thorough analysis of the Gene Transplant market, including a macro overview and a",Benzinga,news.google.com/articles/CBMimQFodHRwczovL3d3dy5iZW56aW5nYS5jb20vcHJlc3NyZWxlYXNlcy8yMy8wOS8zNDYzNDQxNC90aGlzLXJlcG9ydC1wcm92aWRlcy1hLXRob3JvdWdoLWFuYWx5c2lzLW9mLXRoZS1nZW5lLXRyYW5zcGxhbnQtbWFya2V0LWluY2x1ZGluZy1hLW1hY3JvLW92ZXJ2aWV3LWHSAS1odHRwczovL3d3dy5iZW56aW5nYS5jb20vYW1wL2NvbnRlbnQvMzQ2MzQ0MTQ?hl=en-IN&gl=IN&ceid=IN%3Aen,2023-09-15
83,Pemphigus Vulgaris Treatment Market Revenue and Valuation: A Comprehensive Market Report with a CAGR of 7,Benzinga,news.google.com/articles/CBMimQFodHRwczovL3d3dy5iZW56aW5nYS5jb20vcHJlc3NyZWxlYXNlcy8yMy8wOS8zNDYzMzc1NS9wZW1waGlndXMtdnVsZ2FyaXMtdHJlYXRtZW50LW1hcmtldC1yZXZlbnVlLWFuZC12YWx1YXRpb24tYS1jb21wcmVoZW5zaXZlLW1hcmtldC1yZXBvcnQtd2l0aC1hLWNhZ3LSAS1odHRwczovL3d3dy5iZW56aW5nYS5jb20vYW1wL2NvbnRlbnQvMzQ2MzM3NTU?hl=en-IN&gl=IN&ceid=IN%3Aen,2023-09-15
57,"Medicine for Osteoarthritis Pain Market Segmentation, Analysis by Recent Trends, Development by Regions t",Benzinga,news.google.com/articles/CBMimQFodHRwczovL3d3dy5iZW56aW5nYS5jb20vcHJlc3NyZWxlYXNlcy8yMy8wOS8zNDYxNzQyNy9tZWRpY2luZS1mb3Itb3N0ZW9hcnRocml0aXMtcGFpbi1tYXJrZXQtc2VnbWVudGF0aW9uLWFuYWx5c2lzLWJ5LXJlY2VudC10cmVuZHMtZGV2ZWxvcG1lbnQtYnktcmVnaW_SAS1odHRwczovL3d3dy5iZW56aW5nYS5jb20vYW1wL2NvbnRlbnQvMzQ2MTc0Mjc?hl=en-IN&gl=IN&ceid=IN%3Aen,2023-09-15
53,"Radiopharmaceuticals Market Revenue to Cross USD 13.7 Billion by 2032 | Curium Pharma, Eli Lilly and Company,",openPR,news.google.com/articles/CBMiYWh0dHBzOi8vd3d3Lm9wZW5wci5jb20vbmV3cy8zMjEwMzg0L3JhZGlvcGhhcm1hY2V1dGljYWxzLW1hcmtldC1yZXZlbnVlLXRvLWNyb3NzLXVzZC0xMy03LWJpbGxpb27SAWBodHRwczovL3d3dy5vcGVucHIuY29tL2FtcC8zMjEwMzg0L3JhZGlvcGhhcm1hY2V1dGljYWxzLW1hcmtldC1yZXZlbnVlLXRvLWNyb3NzLXVzZC0xMy03LWJpbGxpb24?hl=en-IN&gl=IN&ceid=IN%3Aen,2023-09-15
