,title,source,link,date
99,The research on the Acute Sinusitis market enables clients to understand the analysis of this market base,Benzinga,news.google.com/articles/CBMimQFodHRwczovL3d3dy5iZW56aW5nYS5jb20vcHJlc3NyZWxlYXNlcy8yMy8wOS8zNDE5MjM0NS90aGUtcmVzZWFyY2gtb24tdGhlLWFjdXRlLXNpbnVzaXRpcy1tYXJrZXQtZW5hYmxlcy1jbGllbnRzLXRvLXVuZGVyc3RhbmQtdGhlLWFuYWx5c2lzLW9mLXRoaXMtbWFya2XSAS1odHRwczovL3d3dy5iZW56aW5nYS5jb20vYW1wL2NvbnRlbnQvMzQxOTIzNDU?hl=en-IN&gl=IN&ceid=IN%3Aen,2023-09-03
94,The projected CAGR of 13.6% for the global Byler Disease Treatment market during the 2023 to 2030 period,Benzinga,news.google.com/articles/CBMimQFodHRwczovL3d3dy5iZW56aW5nYS5jb20vcHJlc3NyZWxlYXNlcy8yMy8wOS8zNDE5MjU0MC90aGUtcHJvamVjdGVkLWNhZ3Itb2YtMTMtNi1mb3ItdGhlLWdsb2JhbC1ieWxlci1kaXNlYXNlLXRyZWF0bWVudC1tYXJrZXQtZHVyaW5nLXRoZS0yMDIzLXRvLTIwMzAtcGXSAS1odHRwczovL3d3dy5iZW56aW5nYS5jb20vYW1wL2NvbnRlbnQvMzQxOTI1NDA?hl=en-IN&gl=IN&ceid=IN%3Aen,2023-09-03
92,The latest market analysis shows that the Thyroid Eye Disease Treatments market is poised to grow at a CA,Benzinga,news.google.com/articles/CBMimQFodHRwczovL3d3dy5iZW56aW5nYS5jb20vcHJlc3NyZWxlYXNlcy8yMy8wOS8zNDE5MjUyMy90aGUtbGF0ZXN0LW1hcmtldC1hbmFseXNpcy1zaG93cy10aGF0LXRoZS10aHlyb2lkLWV5ZS1kaXNlYXNlLXRyZWF0bWVudHMtbWFya2V0LWlzLXBvaXNlZC10by1ncm93LWHSAS1odHRwczovL3d3dy5iZW56aW5nYS5jb20vYW1wL2NvbnRlbnQvMzQxOTI1MjM?hl=en-IN&gl=IN&ceid=IN%3Aen,2023-09-03
66,"This report examines the growth trajectory of the Topical Antibiotics market, highlighting new trends and",Benzinga,news.google.com/articles/CBMimQFodHRwczovL3d3dy5iZW56aW5nYS5jb20vcHJlc3NyZWxlYXNlcy8yMy8wOS8zNDE5MjQ1MS90aGlzLXJlcG9ydC1leGFtaW5lcy10aGUtZ3Jvd3RoLXRyYWplY3Rvcnktb2YtdGhlLXRvcGljYWwtYW50aWJpb3RpY3MtbWFya2V0LWhpZ2hsaWdodGluZy1uZXctdHJlbmTSAS1odHRwczovL3d3dy5iZW56aW5nYS5jb20vYW1wL2NvbnRlbnQvMzQxOTI0NTE?hl=en-IN&gl=IN&ceid=IN%3Aen,2023-09-03
1,"Memory Enhancement Drugs Market Competitive Insights 2023 Pfizer, Novartis, Shire Pharmaceuticals, Aller",Benzinga,news.google.com/articles/CBMimQFodHRwczovL3d3dy5iZW56aW5nYS5jb20vcHJlc3NyZWxlYXNlcy8yMy8wOS8zNDE4ODc1MS9tZW1vcnktZW5oYW5jZW1lbnQtZHJ1Z3MtbWFya2V0LWNvbXBldGl0aXZlLWluc2lnaHRzLTIwMjMtcGZpemVyLW5vdmFydGlzLXNoaXJlLXBoYXJtYWNldXRpY2Fscy1hbGzSAS1odHRwczovL3d3dy5iZW56aW5nYS5jb20vYW1wL2NvbnRlbnQvMzQxODg3NTE?hl=en-IN&gl=IN&ceid=IN%3Aen,2023-09-02
98,"Valsartan Drug Market Size 2023 - 2030 segment application, revenue, selling price, production cost, comp",Benzinga,news.google.com/articles/CBMimQFodHRwczovL3d3dy5iZW56aW5nYS5jb20vcHJlc3NyZWxlYXNlcy8yMy8wOS8zNDE5MDkwMC92YWxzYXJ0YW4tZHJ1Zy1tYXJrZXQtc2l6ZS0yMDIzLTIwMzAtc2VnbWVudC1hcHBsaWNhdGlvbi1yZXZlbnVlLXNlbGxpbmctcHJpY2UtcHJvZHVjdGlvbi1jb3N0LWNvbXDSAS1odHRwczovL3d3dy5iZW56aW5nYS5jb20vYW1wL2NvbnRlbnQvMzQxOTA5MDA?hl=en-IN&gl=IN&ceid=IN%3Aen,2023-09-02
95,"The Fluticasone Propionate and Salmeterol market size is forecasted to grow at a 11.2% CAGR until 2030, a",Benzinga,news.google.com/articles/CBMimQFodHRwczovL3d3dy5iZW56aW5nYS5jb20vcHJlc3NyZWxlYXNlcy8yMy8wOS8zNDE5MTAzNy90aGUtZmx1dGljYXNvbmUtcHJvcGlvbmF0ZS1hbmQtc2FsbWV0ZXJvbC1tYXJrZXQtc2l6ZS1pcy1mb3JlY2FzdGVkLXRvLWdyb3ctYXQtYS0xMS0yLWNhZ3ItdW50aWwtMjDSAS1odHRwczovL3d3dy5iZW56aW5nYS5jb20vYW1wL2NvbnRlbnQvMzQxOTEwMzc?hl=en-IN&gl=IN&ceid=IN%3Aen,2023-09-02
86,A Dexmethylphenidate market share analysis of the major rivals are provided by the competitive landscape,Benzinga,news.google.com/articles/CBMimQFodHRwczovL3d3dy5iZW56aW5nYS5jb20vcHJlc3NyZWxlYXNlcy8yMy8wOS8zNDE5MTAyMS9hLWRleG1ldGh5bHBoZW5pZGF0ZS1tYXJrZXQtc2hhcmUtYW5hbHlzaXMtb2YtdGhlLW1ham9yLXJpdmFscy1hcmUtcHJvdmlkZWQtYnktdGhlLWNvbXBldGl0aXZlLWxhbmTSAS1odHRwczovL3d3dy5iZW56aW5nYS5jb20vYW1wL2NvbnRlbnQvMzQxOTEwMjE?hl=en-IN&gl=IN&ceid=IN%3Aen,2023-09-02
85,Understanding Famciclovir Market Size and Industry Revenue from 2023 to 2030 with growing 13.7% CAGR,Benzinga,news.google.com/articles/CBMimQFodHRwczovL3d3dy5iZW56aW5nYS5jb20vcHJlc3NyZWxlYXNlcy8yMy8wOS8zNDE5MDg3NC91bmRlcnN0YW5kaW5nLWZhbWNpY2xvdmlyLW1hcmtldC1zaXplLWFuZC1pbmR1c3RyeS1yZXZlbnVlLWZyb20tMjAyMy10by0yMDMwLXdpdGgtZ3Jvd2luZy0xMy03LWNhZ3LSAS1odHRwczovL3d3dy5iZW56aW5nYS5jb20vYW1wL2NvbnRlbnQvMzQxOTA4NzQ?hl=en-IN&gl=IN&ceid=IN%3Aen,2023-09-02
73,"Meniere Disease Medication Market 2023 Industry Analysis, Segmentation, Share, Size, Opportunities and Fo",Benzinga,news.google.com/articles/CBMimQFodHRwczovL3d3dy5iZW56aW5nYS5jb20vcHJlc3NyZWxlYXNlcy8yMy8wOS8zNDE4ODU1My9tZW5pZXJlLWRpc2Vhc2UtbWVkaWNhdGlvbi1tYXJrZXQtMjAyMy1pbmR1c3RyeS1hbmFseXNpcy1zZWdtZW50YXRpb24tc2hhcmUtc2l6ZS1vcHBvcnR1bml0aWVzLWFuZC3SAS1odHRwczovL3d3dy5iZW56aW5nYS5jb20vYW1wL2NvbnRlbnQvMzQxODg1NTM?hl=en-IN&gl=IN&ceid=IN%3Aen,2023-09-02
