,title,source,link,date
37,The Power of Digital Journaling: Exploring Apple's Journal App,OPP.Today,news.google.com/articles/CBMiaGh0dHBzOi8vd3d3Lm9wcC50b2RheS9oZWFsdGgvYXBwbGUtam91cm5hbC1pcy1uaWNlLWJ1dC1pdHMtbm8tam91cm5leS1vci1kYXktb25lLWFsdGVybmF0aXZlLXlldC8xNzI0MTQv0gEA?hl=en-IN&gl=IN&ceid=IN%3Aen,2023-10-29
41,Agile Combat Employment: Why Indian Air Force Must ‘Bet Big’ On ACE To Repulse Chinese PLAAF,EurAsian Times,news.google.com/articles/CBMiT2h0dHBzOi8vd3d3LmV1cmFzaWFudGltZXMuY29tL2FnaWxlLWNvbWJhdC1lbXBsb3ltZW50LWFyZS1vdXQtb2YtdGhlLWJveC1pZGVhcy_SAU9odHRwczovL3d3dy5ldXJhc2lhbnRpbWVzLmNvbS9hZ2lsZS1jb21iYXQtZW1wbG95bWVudC1hcmUtb3V0LW9mLXRoZS1ib3gtaWRlYXMv?hl=en-IN&gl=IN&ceid=IN%3Aen,2023-10-29
40,The world's iron ore powerhouse is preparing to reinvent itself ...,MINING.com,news.google.com/articles/CBMiWmh0dHBzOi8vd3d3Lm1pbmluZy5jb20vd2ViL3RoZS13b3JsZHMtaXJvbi1vcmUtcG93ZXJob3VzZS1pcy1wcmVwYXJpbmctdG8tcmVpbnZlbnQtaXRzZWxmL9IBAA?hl=en-IN&gl=IN&ceid=IN%3Aen,2023-10-29
8,"Social entrepreneurship is the way. First, we need empathy",University World News,news.google.com/articles/CBMiRGh0dHBzOi8vd3d3LnVuaXZlcnNpdHl3b3JsZG5ld3MuY29tL3Bvc3QucGhwP3N0b3J5PTIwMjMxMDI3MTU0NjE3OTQ10gEA?hl=en-IN&gl=IN&ceid=IN%3Aen,2023-10-29
33,Show us evidence of wind farm whale damage,Sydney Morning Herald,news.google.com/articles/CBMiY2h0dHBzOi8vd3d3LnNtaC5jb20uYXUvbmF0aW9uYWwvbnN3L3Nob3ctdXMtZXZpZGVuY2Utb2Ytd2luZC1mYXJtLXdoYWxlLWRhbWFnZS0yMDIzMTAyOS1wNWVmdG4uaHRtbNIBY2h0dHBzOi8vYW1wLnNtaC5jb20uYXUvbmF0aW9uYWwvbnN3L3Nob3ctdXMtZXZpZGVuY2Utb2Ytd2luZC1mYXJtLXdoYWxlLWRhbWFnZS0yMDIzMTAyOS1wNWVmdG4uaHRtbA?hl=en-IN&gl=IN&ceid=IN%3Aen,2023-10-29
27,Multi-skill resource-constrained multi-modal project scheduling ...,Nature.com,news.google.com/articles/CBMiMmh0dHBzOi8vd3d3Lm5hdHVyZS5jb20vYXJ0aWNsZXMvczQxNTk4LTAyMy00NTk3MC150gEA?hl=en-IN&gl=IN&ceid=IN%3Aen,2023-10-28
59,Brumbies open to centralisation high-performance changes | Latest ...,Brumbies Rugby,news.google.com/articles/CBMiXGh0dHBzOi8vYnJ1bWJpZXMucnVnYnkvbmV3cy9icnVtYmllcy1vcGVuLXRvLWNlbnRyYWxpc2F0aW9uLWhpZ2hwZXJmb3JtYW5jZS1jaGFuZ2VzLTIwMjMxMDI40gEA?hl=en-IN&gl=IN&ceid=IN%3Aen,2023-10-28
53,"Imagining the future of optical microscopy: everything, everywhere ...",Nature.com,news.google.com/articles/CBMiMmh0dHBzOi8vd3d3Lm5hdHVyZS5jb20vYXJ0aWNsZXMvczQyMDAzLTAyMy0wNTQ2OC050gEA?hl=en-IN&gl=IN&ceid=IN%3Aen,2023-10-28
38,Impact of probe sonication and sulfuric acid pretreatment on ...,Nature.com,news.google.com/articles/CBMiMmh0dHBzOi8vd3d3Lm5hdHVyZS5jb20vYXJ0aWNsZXMvczQxNTk4LTAyMy00NTg3NC140gEA?hl=en-IN&gl=IN&ceid=IN%3Aen,2023-10-28
3,Usage of fractional order $${\textrm{PI}}^\lambda {\textrm{D}}^\mu ...,Nature.com,news.google.com/articles/CBMiMmh0dHBzOi8vd3d3Lm5hdHVyZS5jb20vYXJ0aWNsZXMvczQxNTk4LTAyMy00NTY2Ny0y0gEA?hl=en-IN&gl=IN&ceid=IN%3Aen,2023-10-28
