,title,source,link,date
38,"Electron at the centre: From burning various fuels, India must move to clean power for all energy needs",The Financial Express,news.google.com/articles/CBMilwFodHRwczovL3d3dy5maW5hbmNpYWxleHByZXNzLmNvbS9vcGluaW9uL2VsZWN0cm9uLWF0LXRoZS1jZW50cmUtZnJvbS1idXJuaW5nLXZhcmlvdXMtZnVlbHMtaW5kaWEtbXVzdC1tb3ZlLXRvLWNsZWFuLXBvd2VyLWZvci1hbGwtZW5lcmd5LW5lZWRzLzMyNzY4OTMv0gGcAWh0dHBzOi8vd3d3LmZpbmFuY2lhbGV4cHJlc3MuY29tL29waW5pb24vZWxlY3Ryb24tYXQtdGhlLWNlbnRyZS1mcm9tLWJ1cm5pbmctdmFyaW91cy1mdWVscy1pbmRpYS1tdXN0LW1vdmUtdG8tY2xlYW4tcG93ZXItZm9yLWFsbC1lbmVyZ3ktbmVlZHMvMzI3Njg5My9saXRlLw?hl=en-IN&gl=IN&ceid=IN%3Aen,2023-10-19
0,Check Point Software Recognized by Forbes for the 4th Consecutive ...,Check Point Software,news.google.com/articles/CBMimAFodHRwczovL3d3dy5jaGVja3BvaW50LmNvbS9wcmVzcy1yZWxlYXNlcy9jaGVjay1wb2ludC1zb2Z0d2FyZS1yZWNvZ25pemVkLWJ5LWZvcmJlcy1mb3ItdGhlLTR0aC1jb25zZWN1dGl2ZS15ZWFyLWFzLXdvcmxkcy1iZXN0LWN5YmVyLXNlY3VyaXR5LWVtcGxveWVyL9IBAA?hl=en-IN&gl=IN&ceid=IN%3Aen,2023-10-18
25,Could India become an electric micromobility powerhouse?,Tata Elxsi,news.google.com/articles/CBMiYWh0dHBzOi8vd3d3LnRhdGFlbHhzaS5jb20vbmV3cy1hbmQtZXZlbnRzL2NvdWxkLWluZGlhLWJlY29tZS1hbi1lbGVjdHJpYy1taWNyb21vYmlsaXR5LXBvd2VyaG91c2XSAQA?hl=en-IN&gl=IN&ceid=IN%3Aen,2023-10-18
55,McAfee Total Protection for Mac - Review 2023,PCMag Middle East,news.google.com/articles/CBMiR2h0dHBzOi8vbWUucGNtYWcuY29tL2VuL2FudGl2aXJ1cy8xOTk2OC9tY2FmZWUtdG90YWwtcHJvdGVjdGlvbi1mb3ItbWFj0gEA?hl=en-IN&gl=IN&ceid=IN%3Aen,2023-10-18
54,Anionй interactions suppress phase impurities in FAPbI3 solar cells,Nature.com,news.google.com/articles/CBMiMmh0dHBzOi8vd3d3Lm5hdHVyZS5jb20vYXJ0aWNsZXMvczQxNTg2LTAyMy0wNjYzNy130gEA?hl=en-IN&gl=IN&ceid=IN%3Aen,2023-10-18
50,Backyard zoonoses: The roles of companion animals and peri ...,Science,news.google.com/articles/CBMiOGh0dHBzOi8vd3d3LnNjaWVuY2Uub3JnL2RvaS8xMC4xMTI2L3NjaXRyYW5zbG1lZC5hZGowMDM30gEA?hl=en-IN&gl=IN&ceid=IN%3Aen,2023-10-18
48,Comparing methods to predict baseline mortality for excess mortality ...,BMC Medical Research Methodology,news.google.com/articles/CBMiT2h0dHBzOi8vYm1jbWVkcmVzbWV0aG9kb2wuYmlvbWVkY2VudHJhbC5jb20vYXJ0aWNsZXMvMTAuMTE4Ni9zMTI4NzQtMDIzLTAyMDYxLXfSAQA?hl=en-IN&gl=IN&ceid=IN%3Aen,2023-10-18
43,Azure DevOps vs GitHub: Which DevOps Tool Should You Choose ...,SitePoint,news.google.com/articles/CBMiMWh0dHBzOi8vd3d3LnNpdGVwb2ludC5jb20vYXp1cmUtZGV2b3BzLXZzLWdpdGh1Yi_SAQA?hl=en-IN&gl=IN&ceid=IN%3Aen,2023-10-18
40,TrialAssure Uses Artificial Intelligence to Create Plain Language ...,BioSpace,news.google.com/articles/CBMipwFodHRwczovL3d3dy5iaW9zcGFjZS5jb20vYXJ0aWNsZS9yZWxlYXNlcy90cmlhbGFzc3VyZS11c2VzLWFydGlmaWNpYWwtaW50ZWxsaWdlbmNlLXRvLWNyZWF0ZS1wbGFpbi1sYW5ndWFnZS1zdW1tYXJpZXMtZm9yLTUwLTAwMC1zdHVkaWVzLWxpc3RlZC1vbi1jbGluaWNhbHRyaWFscy1nb3YtL9IBAA?hl=en-IN&gl=IN&ceid=IN%3Aen,2023-10-18
37,Foxconn CSO Chiang Shang-yi discusses new semiconductor ...,Focus Taiwan,news.google.com/articles/CBMiLGh0dHBzOi8vZm9jdXN0YWl3YW4udHcvc2NpLXRlY2gvMjAyMzEwMTgwMDIz0gEA?hl=en-IN&gl=IN&ceid=IN%3Aen,2023-10-18
