,title,source,link,date
1,The hidden costs of neglecting cybersecurity for small businesses,Help Net Security,news.google.com/articles/CBMic2h0dHBzOi8vd3d3LmhlbHBuZXRzZWN1cml0eS5jb20vMjAyMy8wOS8yOC9yYWZmYWVsZS1tYXV0b25lLWp1ZHktc2VjdXJpdHktc21hbGwtYnVzaW5lc3Nlcy1jeWJlcnNlY3VyaXR5LXNvbHV0aW9ucy_SAQA?hl=en-IN&gl=IN&ceid=IN%3Aen,2023-09-28
30,‘We are just getting started’: the plastic-eating bacteria that could change the world,The Guardian,news.google.com/articles/CBMiYmh0dHBzOi8vd3d3LnRoZWd1YXJkaWFuLmNvbS9lbnZpcm9ubWVudC8yMDIzL3NlcC8yOC9wbGFzdGljLWVhdGluZy1iYWN0ZXJpYS1lbnp5bWUtcmVjeWNsaW5nLXdhc3Rl0gFiaHR0cHM6Ly9hbXAudGhlZ3VhcmRpYW4uY29tL2Vudmlyb25tZW50LzIwMjMvc2VwLzI4L3BsYXN0aWMtZWF0aW5nLWJhY3RlcmlhLWVuenltZS1yZWN5Y2xpbmctd2FzdGU?hl=en-IN&gl=IN&ceid=IN%3Aen,2023-09-28
4,Abu Dhabi group IHC sells out of two Adani companies,Financial Times,news.google.com/articles/CBMiP2h0dHBzOi8vd3d3LmZ0LmNvbS9jb250ZW50L2M3ZGEwZWFiLTY2MGItNDQ0ZC1hYTA1LTY0YmI2NWFjYjc4Y9IBAA?hl=en-IN&gl=IN&ceid=IN%3Aen,2023-09-28
25,Artel LLC Partners with Rivada Space Networks for USSF Contract ...,SatNews,news.google.com/articles/CBMidGh0dHBzOi8vbmV3cy5zYXRuZXdzLmNvbS8yMDIzLzA5LzI3L2FydGVsLWxsYy1wYXJ0bmVycy13aXRoLXJpdmFkYS1zcGFjZS1uZXR3b3Jrcy1mb3ItdXNzZi1jb250cmFjdC1mb3ItcC1sZW8tY29tbXMv0gEA?hl=en-IN&gl=IN&ceid=IN%3Aen,2023-09-28
24,User Story: a Placeholder for a Conversation,InfoQ.com,news.google.com/articles/CBMiN2h0dHBzOi8vd3d3LmluZm9xLmNvbS9hcnRpY2xlcy91c2VyLXN0b3J5LWNvbnZlcnNhdGlvbi_SAQA?hl=en-IN&gl=IN&ceid=IN%3Aen,2023-09-28
42,How To Not Get Lost Following Trends? Create An Efficient Strategy ...,Mondaq News Alerts,news.google.com/articles/CBMixwFodHRwczovL3d3dy5tb25kYXEuY29tL3RyYWRlbWFyay8xMzcxMTE4L2hvdy10by1ub3QtZ2V0LWxvc3QtZm9sbG93aW5nLXRyZW5kcy1jcmVhdGUtYW4tZWZmaWNpZW50LXN0cmF0ZWd5LXRvLXByb3RlY3QteW91ci10cmFkZW1hcmtzLWFuZC1pbmR1c3RyaWFsLWRlc2lnbnMtZm9yLWNvc21ldGljLXByb2R1Y3RzLW9uLXRoZS1nbG9iYWwtbWFya2V00gEA?hl=en-IN&gl=IN&ceid=IN%3Aen,2023-09-28
33,Insider Named a Leader in the IDC MarketScape: Worldwide Omnichannel Marketing Platforms for B2C Enterpri,Benzinga,news.google.com/articles/CBMimQFodHRwczovL3d3dy5iZW56aW5nYS5jb20vcHJlc3NyZWxlYXNlcy8yMy8wOS9uMzQ5NzIwNjIvaW5zaWRlci1uYW1lZC1hLWxlYWRlci1pbi10aGUtaWRjLW1hcmtldHNjYXBlLXdvcmxkd2lkZS1vbW5pY2hhbm5lbC1tYXJrZXRpbmctcGxhdGZvcm1zLWZvci1iMmMtZW7SAS1odHRwczovL3d3dy5iZW56aW5nYS5jb20vYW1wL2NvbnRlbnQvMzQ5NzIwNjI?hl=en-IN&gl=IN&ceid=IN%3Aen,2023-09-28
17,Tata Power to strengthen the EV charging network in West Bengal,Construction Week Online India,news.google.com/articles/CBMibmh0dHBzOi8vd3d3LmNvbnN0cnVjdGlvbndlZWtvbmxpbmUuaW4vYnVzaW5lc3MvdGF0YS1wb3dlci10by1zdHJlbmd0aGVuLXRoZS1ldi1jaGFyZ2luZy1uZXR3b3JrLWluLXdlc3QtYmVuZ2Fs0gEA?hl=en-IN&gl=IN&ceid=IN%3Aen,2023-09-28
35,Is hydropower good or bad for the environment? We went to Idaho to ...,Los Angeles Times,news.google.com/articles/CBMikgFodHRwczovL3d3dy5sYXRpbWVzLmNvbS9lbnZpcm9ubWVudC9uZXdzbGV0dGVyLzIwMjMtMDktMjgvaXMtaHlkcm9wb3dlci1nb29kLW9yLWJhZC1mb3ItdGhlLWVudmlyb25tZW50LXdlLXdlbnQtdG8taWRhaG8tdG8tZmluZC1vdXQtYm9pbGluZy1wb2ludNIBAA?hl=en-IN&gl=IN&ceid=IN%3Aen,2023-09-28
14,CCC and Google Collaborate to Make It Easier for Consumers to ...,Business Wire,news.google.com/articles/CBMirAFodHRwczovL3d3dy5idXNpbmVzc3dpcmUuY29tL25ld3MvaG9tZS8yMDIzMDkyODg5NTA5OS9lbi9DQ0MtYW5kLUdvb2dsZS1Db2xsYWJvcmF0ZS10by1NYWtlLUl0LUVhc2llci1mb3ItQ29uc3VtZXJzLXRvLVNjaGVkdWxlLU9ubGluZS1BcHBvaW50bWVudHMtd2l0aC1Db2xsaXNpb24tUmVwYWlyZXJz0gEA?hl=en-IN&gl=IN&ceid=IN%3Aen,2023-09-28
