,title,source,link,date
40,"Digital Commerce Applications Market May See a Big Move | IBM, Salesforce, Cognizant Technology Solution, Orac",openPR,news.google.com/articles/CBMiX2h0dHBzOi8vd3d3Lm9wZW5wci5jb20vbmV3cy8zMTg2NzA0L2RpZ2l0YWwtY29tbWVyY2UtYXBwbGljYXRpb25zLW1hcmtldC1tYXktc2VlLWEtYmlnLW1vdmUtaWJt0gFeaHR0cHM6Ly93d3cub3BlbnByLmNvbS9hbXAvMzE4NjcwNC9kaWdpdGFsLWNvbW1lcmNlLWFwcGxpY2F0aW9ucy1tYXJrZXQtbWF5LXNlZS1hLWJpZy1tb3ZlLWlibQ?hl=en-IN&gl=IN&ceid=IN%3Aen,2023-08-29
36,India Human Capital Management Market Analysis: Predictions and ...,The Knox Student,news.google.com/articles/CBMiigFodHRwczovL3d3dy50aGVrbm94c3R1ZGVudC5jb20vbmV3cy8yMDIzLzA4LzI5L2luZGlhLWh1bWFuLWNhcGl0YWwtbWFuYWdlbWVudC1tYXJrZXQtYW5hbHlzaXMtcHJlZGljdGlvbnMtYW5kLXRyZW5kcy1mb3ItdGhlLW5leHQtNS15ZWFycy_SAQA?hl=en-IN&gl=IN&ceid=IN%3Aen,2023-08-29
67,"Core HR Software Market Trends, Size, Share, Growth, Industry Analysis, Advance Technology and Forecast 2",Benzinga,news.google.com/articles/CBMimQFodHRwczovL3d3dy5iZW56aW5nYS5jb20vcHJlc3NyZWxlYXNlcy8yMy8wOC9hYjM0MDgyOTA3L2NvcmUtaHItc29mdHdhcmUtbWFya2V0LXRyZW5kcy1zaXplLXNoYXJlLWdyb3d0aC1pbmR1c3RyeS1hbmFseXNpcy1hZHZhbmNlLXRlY2hub2xvZ3ktYW5kLWZvcmVjYXPSAS1odHRwczovL3d3dy5iZW56aW5nYS5jb20vYW1wL2NvbnRlbnQvMzQwODI5MDc?hl=en-IN&gl=IN&ceid=IN%3Aen,2023-08-29
60,"Augmented and Virtual Reality in Education Market Size: World Business Growth, Demand, Trends, Key Player",Benzinga,news.google.com/articles/CBMimQFodHRwczovL3d3dy5iZW56aW5nYS5jb20vcHJlc3NyZWxlYXNlcy8yMy8wOC8zNDA4OTg0Ni9hdWdtZW50ZWQtYW5kLXZpcnR1YWwtcmVhbGl0eS1pbi1lZHVjYXRpb24tbWFya2V0LXNpemUtd29ybGQtYnVzaW5lc3MtZ3Jvd3RoLWRlbWFuZC10cmVuZHMta2V5LXBsYXnSAS1odHRwczovL3d3dy5iZW56aW5nYS5jb20vYW1wL2NvbnRlbnQvMzQwODk4NDY?hl=en-IN&gl=IN&ceid=IN%3Aen,2023-08-29
56,"Healthcare Analytics and Medical Research Report 2023-2028: CAGR, Industry Needs, Competition Analysis",Benzinga,news.google.com/articles/CBMimQFodHRwczovL3d3dy5iZW56aW5nYS5jb20vcHJlc3NyZWxlYXNlcy8yMy8wOC8zNDA5NzEyMi9oZWFsdGhjYXJlLWFuYWx5dGljcy1hbmQtbWVkaWNhbC1yZXNlYXJjaC1yZXBvcnQtMjAyMy0yMDI4LWNhZ3ItaW5kdXN0cnktbmVlZHMtY29tcGV0aXRpb24tYW5hbHlzaXPSAS1odHRwczovL3d3dy5iZW56aW5nYS5jb20vYW1wL2NvbnRlbnQvMzQwOTcxMjI?hl=en-IN&gl=IN&ceid=IN%3Aen,2023-08-29
55,Global Transportation Management System (TMS) Market Size to ...,GlobeNewswire,news.google.com/articles/CBMisAFodHRwczovL3d3dy5nbG9iZW5ld3N3aXJlLmNvbS9uZXdzLXJlbGVhc2UvMjAyMy8wOC8yOS8yNzMzNjQ0LzAvZW4vR2xvYmFsLVRyYW5zcG9ydGF0aW9uLU1hbmFnZW1lbnQtU3lzdGVtLVRNUy1NYXJrZXQtU2l6ZS10by1SZWFjaC1VU0QtNDQtOTYtQmlsbGlvbi0yMDMwLUVtZXJnZW4tUmVzZWFyY2guaHRtbNIBAA?hl=en-IN&gl=IN&ceid=IN%3Aen,2023-08-29
53,Global Document Management System Market Size and Forecast ...,The Knox Student,news.google.com/articles/CBMibGh0dHBzOi8vd3d3LnRoZWtub3hzdHVkZW50LmNvbS9uZXdzLzIwMjMvMDgvMjkvZ2xvYmFsLWRvY3VtZW50LW1hbmFnZW1lbnQtc3lzdGVtLW1hcmtldC1zaXplLXNjb3BlLWZvcmVjYXN0L9IBAA?hl=en-IN&gl=IN&ceid=IN%3Aen,2023-08-29
52,"Mobile BI (Business Intelligence) Market Growth Analysis, Size, Key Players, Share, Research and Forecast",Benzinga,news.google.com/articles/CBMimQFodHRwczovL3d3dy5iZW56aW5nYS5jb20vcHJlc3NyZWxlYXNlcy8yMy8wOC8zNDA4Njg0Mi9tb2JpbGUtYmktYnVzaW5lc3MtaW50ZWxsaWdlbmNlLW1hcmtldC1ncm93dGgtYW5hbHlzaXMtc2l6ZS1rZXktcGxheWVycy1zaGFyZS1yZXNlYXJjaC1hbmQtZm9yZWNhc3TSAS1odHRwczovL3d3dy5iZW56aW5nYS5jb20vYW1wL2NvbnRlbnQvMzQwODY4NDI?hl=en-IN&gl=IN&ceid=IN%3Aen,2023-08-29
46,Healthcare Clinical Trial Management System Market Analysis 2023-2028: Maximize Market Research Report Of,Benzinga,news.google.com/articles/CBMimQFodHRwczovL3d3dy5iZW56aW5nYS5jb20vcHJlc3NyZWxlYXNlcy8yMy8wOC8zNDA5NzExMS9oZWFsdGhjYXJlLWNsaW5pY2FsLXRyaWFsLW1hbmFnZW1lbnQtc3lzdGVtLW1hcmtldC1hbmFseXNpcy0yMDIzLTIwMjgtbWF4aW1pemUtbWFya2V0LXJlc2VhcmNoLXJlcG_SAS1odHRwczovL3d3dy5iZW56aW5nYS5jb20vYW1wL2NvbnRlbnQvMzQwOTcxMTE?hl=en-IN&gl=IN&ceid=IN%3Aen,2023-08-29
45,ChatGPT Founder Just Announced a New Product and Companies ...,The Motley Fool,news.google.com/articles/CBMiVGh0dHBzOi8vd3d3LmZvb2wuY29tL2ludmVzdGluZy8yMDIzLzA4LzI5L2lzLXRoZS1uZXctY2hhdGdwdC1wcm9kdWN0LWEtZ2FtZS1jaGFuZ2VyL9IBAA?hl=en-IN&gl=IN&ceid=IN%3Aen,2023-08-29
