,title,source,link,date
5,Pakistan eyes up to $10 billion IT exports annually in next three years,Arab News Pakistan,news.google.com/articles/CBMiLWh0dHBzOi8vd3d3LmFyYWJuZXdzLnBrL25vZGUvMjQxMzg4Ni9wYWtpc3RhbtIBAA?hl=en-IN&gl=IN&ceid=IN%3Aen,2023-11-23
7,Pakistan's mobility startup BusCaro raises pre-seed finance of $1.5 ...,Arab News,news.google.com/articles/CBMiLmh0dHBzOi8vd3d3LmFyYWJuZXdzLmNvbS9ub2RlLzI0MTQwOTYvcGFraXN0YW7SASlodHRwczovL3d3dy5hcmFibmV3cy5jb20vbm9kZS8yNDE0MDk2L2FtcA?hl=en-IN&gl=IN&ceid=IN%3Aen,2023-11-23
9,Pakistan ex-PM Khan's party directed to hold leadership poll or lose ...,Arab News Pakistan,news.google.com/articles/CBMiLWh0dHBzOi8vd3d3LmFyYWJuZXdzLnBrL25vZGUvMjQxMzk2MS9wYWtpc3RhbtIBAA?hl=en-IN&gl=IN&ceid=IN%3Aen,2023-11-23
11,"Pakistani children march in solidarity with Palestinians, demand end ...",Arab News,news.google.com/articles/CBMiLmh0dHBzOi8vd3d3LmFyYWJuZXdzLmNvbS9ub2RlLzI0MTM5NDYvcGFraXN0YW7SASlodHRwczovL3d3dy5hcmFibmV3cy5jb20vbm9kZS8yNDEzOTQ2L2FtcA?hl=en-IN&gl=IN&ceid=IN%3Aen,2023-11-23
12,Pakistan firmly supports two-state solution to Palestine issue ...,Arab News,news.google.com/articles/CBMiLmh0dHBzOi8vd3d3LmFyYWJuZXdzLmNvbS9ub2RlLzI0MTQwMzYvcGFraXN0YW7SASlodHRwczovL3d3dy5hcmFibmV3cy5jb20vbm9kZS8yNDE0MDM2L2FtcA?hl=en-IN&gl=IN&ceid=IN%3Aen,2023-11-23
14,The Future Martian Economy,Securities.io,news.google.com/articles/CBMiNWh0dHBzOi8vd3d3LnNlY3VyaXRpZXMuaW8vdGhlLWZ1dHVyZS1tYXJ0aWFuLWVjb25vbXkv0gEA?hl=en-IN&gl=IN&ceid=IN%3Aen,2023-11-23
17,"Satellite Antenna Market to Reach $17.59 Billion, Globally, by 2032 ...",PR Newswire,news.google.com/articles/CBMinAFodHRwczovL3d3dy5wcm5ld3N3aXJlLmNvbS9uZXdzLXJlbGVhc2VzL3NhdGVsbGl0ZS1hbnRlbm5hLW1hcmtldC10by1yZWFjaC0xNy01OS1iaWxsaW9uLWdsb2JhbGx5LWJ5LTIwMzItYXQtMTUtMS1jYWdyLWFsbGllZC1tYXJrZXQtcmVzZWFyY2gtMzAxOTk2MjIxLmh0bWzSAQA?hl=en-IN&gl=IN&ceid=IN%3Aen,2023-11-23
8,"The spy, the lawyer and their global surveillance empire",ICIJ.org,news.google.com/articles/CBMia2h0dHBzOi8vd3d3LmljaWoub3JnL2ludmVzdGlnYXRpb25zL2N5cHJ1cy1jb25maWRlbnRpYWwvaXNyYWVsaS1wcmVkYXRvci1zcHl3YXJlLWN5cHJ1cy1vZmZzaG9yZS1pbnRlbGxleGEv0gEA?hl=en-IN&gl=IN&ceid=IN%3Aen,2023-11-15
19,SpaceX Discusses Starlink Satellite Unit Spinoff Via IPO as Soon as ...,Bloomberg,news.google.com/articles/CBMiggFodHRwczovL3d3dy5ibG9vbWJlcmcuY29tL25ld3MvYXJ0aWNsZXMvMjAyMy0xMS0xNS9zcGFjZXgtZGlzY3Vzc2VzLXNwaW5vZmYtb2Ytc3Rhcmxpbmstc2F0ZWxsaXRlLXVuaXQtdGhyb3VnaC1pcG8tYXMtc29vbi1hcy0yMDI00gEA?hl=en-IN&gl=IN&ceid=IN%3Aen,2023-11-15
