,title,source,link,date
8,Pakistan eyes up to $10 billion IT exports annually in next three years,Arab News Pakistan,news.google.com/articles/CBMiLWh0dHBzOi8vd3d3LmFyYWJuZXdzLnBrL25vZGUvMjQxMzg4Ni9wYWtpc3RhbtIBAA?hl=en-IN&gl=IN&ceid=IN%3Aen,2023-11-23
10,Pakistan's mobility startup BusCaro raises pre-seed finance of $1.5 ...,Arab News,news.google.com/articles/CBMiLmh0dHBzOi8vd3d3LmFyYWJuZXdzLmNvbS9ub2RlLzI0MTQwOTYvcGFraXN0YW7SASlodHRwczovL3d3dy5hcmFibmV3cy5jb20vbm9kZS8yNDE0MDk2L2FtcA?hl=en-IN&gl=IN&ceid=IN%3Aen,2023-11-23
14,Pakistan ex-PM Khan's party directed to hold leadership poll or lose ...,Arab News Pakistan,news.google.com/articles/CBMiLWh0dHBzOi8vd3d3LmFyYWJuZXdzLnBrL25vZGUvMjQxMzk2MS9wYWtpc3RhbtIBAA?hl=en-IN&gl=IN&ceid=IN%3Aen,2023-11-23
16,"Pakistani children march in solidarity with Palestinians, demand end ...",Arab News,news.google.com/articles/CBMiLmh0dHBzOi8vd3d3LmFyYWJuZXdzLmNvbS9ub2RlLzI0MTM5NDYvcGFraXN0YW7SASlodHRwczovL3d3dy5hcmFibmV3cy5jb20vbm9kZS8yNDEzOTQ2L2FtcA?hl=en-IN&gl=IN&ceid=IN%3Aen,2023-11-23
17,Pakistan firmly supports two-state solution to Palestine issue ...,Arab News,news.google.com/articles/CBMiLmh0dHBzOi8vd3d3LmFyYWJuZXdzLmNvbS9ub2RlLzI0MTQwMzYvcGFraXN0YW7SASlodHRwczovL3d3dy5hcmFibmV3cy5jb20vbm9kZS8yNDE0MDM2L2FtcA?hl=en-IN&gl=IN&ceid=IN%3Aen,2023-11-23
33,Brian Lee Crowley: Canada is becoming irrelevant on the global ...,The Hub,news.google.com/articles/CBMigAFodHRwczovL3RoZWh1Yi5jYS8yMDIzLTExLTIwL2JyaWFuLWxlZS1jcm93bGV5LWNhbmFkYS1pcy1iZWNvbWluZy1pcnJlbGV2YW50LW9uLXRoZS1nbG9iYWwtc3RhZ2UtYW5kLXRoYXRzLWJhZC1uZXdzLWZvci1hbWVyaWNhL9IBAA?hl=en-IN&gl=IN&ceid=IN%3Aen,2023-11-20
7,Ahmedabad's top hangouts to catch the Cricket World Cup Final Live!,Knocksense ,news.google.com/articles/CBMiZmh0dHBzOi8vd3d3Lmtub2Nrc2Vuc2UuY29tL2FobWVkYWJhZC9haG1lZGFiYWRzLXRvcC1oYW5nb3V0cy10by1jYXRjaC10aGUtY3JpY2tldC13b3JsZC1jdXAtZmluYWwtbGl2ZdIBcGh0dHBzOi8vd3d3Lmtub2Nrc2Vuc2UuY29tL2FtcC9zdG9yeS9haG1lZGFiYWQvYWhtZWRhYmFkcy10b3AtaGFuZ291dHMtdG8tY2F0Y2gtdGhlLWNyaWNrZXQtd29ybGQtY3VwLWZpbmFsLWxpdmU?hl=en-IN&gl=IN&ceid=IN%3Aen,2023-11-18
