,title,source,link,date
1,"India's moon rover completes its walk, scientists analyzing data ...",Arab News,news.google.com/articles/CBMiK2h0dHBzOi8vd3d3LmFyYWJuZXdzLmNvbS9ub2RlLzIzNjYzNTEvd29ybGTSASlodHRwczovL3d3dy5hcmFibmV3cy5jb20vbm9kZS8yMzY2MzUxL2FtcA?hl=en-IN&gl=IN&ceid=IN%3Aen,2023-09-03
3,Number of migrants arriving UK in boat crossings hit new daily ...,Arab News,news.google.com/articles/CBMiK2h0dHBzOi8vd3d3LmFyYWJuZXdzLmNvbS9ub2RlLzIzNjY1NjEvd29ybGTSASlodHRwczovL3d3dy5hcmFibmV3cy5jb20vbm9kZS8yMzY2NTYxL2FtcA?hl=en-IN&gl=IN&ceid=IN%3Aen,2023-09-03
4,"Pope Francis, quoting Buddha, urges religious dialogue to fight ...",Arab News,news.google.com/articles/CBMiK2h0dHBzOi8vd3d3LmFyYWJuZXdzLmNvbS9ub2RlLzIzNjYzMzEvd29ybGTSASlodHRwczovL3d3dy5hcmFibmV3cy5jb20vbm9kZS8yMzY2MzMxL2FtcA?hl=en-IN&gl=IN&ceid=IN%3Aen,2023-09-03
0,"Weeks after moon landing, India launches first mission to sun",Arab News,news.google.com/articles/CBMiK2h0dHBzOi8vd3d3LmFyYWJuZXdzLmNvbS9ub2RlLzIzNjU5NzEvd29ybGTSASlodHRwczovL3d3dy5hcmFibmV3cy5jb20vbm9kZS8yMzY1OTcxL2FtcA?hl=en-IN&gl=IN&ceid=IN%3Aen,2023-09-02
6,"Russia says it thwarted attacks on Crimea bridge, shelling and ...",Arab News,news.google.com/articles/CBMiK2h0dHBzOi8vd3d3LmFyYWJuZXdzLmNvbS9ub2RlLzIzNjYwNDYvd29ybGTSASlodHRwczovL3d3dy5hcmFibmV3cy5jb20vbm9kZS8yMzY2MDQ2L2FtcA?hl=en-IN&gl=IN&ceid=IN%3Aen,2023-09-02
7,Nobel Foundation cancels Russian ambassador invite to prize ...,Arab News,news.google.com/articles/CBMiK2h0dHBzOi8vd3d3LmFyYWJuZXdzLmNvbS9ub2RlLzIzNjYwNDEvd29ybGTSASlodHRwczovL3d3dy5hcmFibmV3cy5jb20vbm9kZS8yMzY2MDQxL2FtcA?hl=en-IN&gl=IN&ceid=IN%3Aen,2023-09-02
8,Channel migrants confront tighter French coast patrols,Arab News,news.google.com/articles/CBMiK2h0dHBzOi8vd3d3LmFyYWJuZXdzLmNvbS9ub2RlLzIzNjYxODEvd29ybGTSASlodHRwczovL3d3dy5hcmFibmV3cy5jb20vbm9kZS8yMzY2MTgxL2FtcA?hl=en-IN&gl=IN&ceid=IN%3Aen,2023-09-02
5,Gabon opposition calls for pressure on junta to hand power to civilians,Arab News,news.google.com/articles/CBMiK2h0dHBzOi8vd3d3LmFyYWJuZXdzLmNvbS9ub2RlLzIzNjU3OTEvd29ybGTSASlodHRwczovL3d3dy5hcmFibmV3cy5jb20vbm9kZS8yMzY1NzkxL2FtcA?hl=en-IN&gl=IN&ceid=IN%3Aen,2023-09-01
9,UN contacting Niger coup leaders over access curbs,Arab News,news.google.com/articles/CBMiK2h0dHBzOi8vd3d3LmFyYWJuZXdzLmNvbS9ub2RlLzIzNjU3NzEvd29ybGTSASlodHRwczovL3d3dy5hcmFibmV3cy5jb20vbm9kZS8yMzY1NzcxL2FtcA?hl=en-IN&gl=IN&ceid=IN%3Aen,2023-09-01
10,840000 Afghans who've applied for key US resettlement program ...,Arab News,news.google.com/articles/CBMiK2h0dHBzOi8vd3d3LmFyYWJuZXdzLmNvbS9ub2RlLzIzNjU4OTYvd29ybGTSASlodHRwczovL3d3dy5hcmFibmV3cy5jb20vbm9kZS8yMzY1ODk2L2FtcA?hl=en-IN&gl=IN&ceid=IN%3Aen,2023-09-01
