,title,source,link,date
2,"India's moon rover completes its walk, scientists analyzing data ...",Arab News,news.google.com/articles/CBMiK2h0dHBzOi8vd3d3LmFyYWJuZXdzLmNvbS9ub2RlLzIzNjYzNTEvd29ybGTSASlodHRwczovL3d3dy5hcmFibmV3cy5jb20vbm9kZS8yMzY2MzUxL2FtcA?hl=en-IN&gl=IN&ceid=IN%3Aen,2023-09-03
3,Ukraine's Zelensky moves to replace wartime defense minister,Arab News,news.google.com/articles/CBMiK2h0dHBzOi8vd3d3LmFyYWJuZXdzLmNvbS9ub2RlLzIzNjY3MTEvd29ybGTSASlodHRwczovL3d3dy5hcmFibmV3cy5jb20vbm9kZS8yMzY2NzExL2FtcA?hl=en-IN&gl=IN&ceid=IN%3Aen,2023-09-03
7,Number of migrants arriving UK in boat crossings hit new daily ...,Arab News,news.google.com/articles/CBMiK2h0dHBzOi8vd3d3LmFyYWJuZXdzLmNvbS9ub2RlLzIzNjY1NjEvd29ybGTSASlodHRwczovL3d3dy5hcmFibmV3cy5jb20vbm9kZS8yMzY2NTYxL2FtcA?hl=en-IN&gl=IN&ceid=IN%3Aen,2023-09-03
5,Channel migrants confront tighter French coast patrols,Arab News,news.google.com/articles/CBMiK2h0dHBzOi8vd3d3LmFyYWJuZXdzLmNvbS9ub2RlLzIzNjYxODEvd29ybGTSASlodHRwczovL3d3dy5hcmFibmV3cy5jb20vbm9kZS8yMzY2MTgxL2FtcA?hl=en-IN&gl=IN&ceid=IN%3Aen,2023-09-02
6,How Arab tycoon Mohamed Al-Fayed built a business empire from ...,Arab News,news.google.com/articles/CBMiJWh0dHBzOi8vd3d3LmFyYWJuZXdzLmNvbS9ub2RlLzIzNjYyNTbSASlodHRwczovL3d3dy5hcmFibmV3cy5jb20vbm9kZS8yMzY2MjU2L2FtcA?hl=en-IN&gl=IN&ceid=IN%3Aen,2023-09-02
8,13 people arrested as anti-migrant march in Cyprus turns violent,Arab News,news.google.com/articles/CBMiK2h0dHBzOi8vd3d3LmFyYWJuZXdzLmNvbS9ub2RlLzIzNjYxNzYvd29ybGTSASlodHRwczovL3d3dy5hcmFibmV3cy5jb20vbm9kZS8yMzY2MTc2L2FtcA?hl=en-IN&gl=IN&ceid=IN%3Aen,2023-09-02
11,"News Services Division: Breaking News Today, Top Headlines, Live ...",News On AIR,news.google.com/articles/CBMiPGh0dHBzOi8vbmV3c29uYWlyLmdvdi5pbi9UZXh0LUJ1bGxldGluLURldGFpbHMuYXNweD9pZD00NDI5NdIBAA?hl=en-IN&gl=IN&ceid=IN%3Aen,2023-08-31
