,title,source,link,date
23,"Paper Coating Binders Market Potential Growth, Trends and Forecast to 2029",Benzinga,news.google.com/articles/CBMif2h0dHBzOi8vd3d3LmJlbnppbmdhLmNvbS9wcmVzc3JlbGVhc2VzLzIzLzA5LzM0OTMxMzc2L3BhcGVyLWNvYXRpbmctYmluZGVycy1tYXJrZXQtcG90ZW50aWFsLWdyb3d0aC10cmVuZHMtYW5kLWZvcmVjYXN0LXRvLTIwMjnSAS1odHRwczovL3d3dy5iZW56aW5nYS5jb20vYW1wL2NvbnRlbnQvMzQ5MzEzNzY?hl=en-IN&gl=IN&ceid=IN%3Aen,2023-09-27
26,Clare Jackson · Base People in a Little Island: James and Jahangir ...,London Review of Books,news.google.com/articles/CBMiVGh0dHBzOi8vd3d3LmxyYi5jby51ay90aGUtcGFwZXIvdjQ1L24xOS9jbGFyZS1qYWNrc29uL2Jhc2UtcGVvcGxlLWluLWEtbGl0dGxlLWlzbGFuZNIBAA?hl=en-IN&gl=IN&ceid=IN%3Aen,2023-09-27
32,Looking for your life's calling? Let college be your compass,University of Miami: News@theU,news.google.com/articles/CBMiZmh0dHBzOi8vbmV3cy5taWFtaS5lZHUvc3Rvcmllcy8yMDIzLzA5L2xvb2tpbmctZm9yLXlvdXItbGlmZXMtY2FsbGluZy1sZXQtY29sbGVnZS1iZS15b3VyLWNvbXBhc3MuaHRtbNIBAA?hl=en-IN&gl=IN&ceid=IN%3Aen,2023-09-27
35,Nonreciprocal interactions give rise to fast cilium synchronization in ...,pnas.org,news.google.com/articles/CBMiMGh0dHBzOi8vd3d3LnBuYXMub3JnL2RvaS8xMC4xMDczL3BuYXMuMjMwNzI3OTEyMNIBAA?hl=en-IN&gl=IN&ceid=IN%3Aen,2023-09-27
41,Imagine That: The Serious Business of Having Fun in the Art ...,Oregon ArtsWatch,news.google.com/articles/CBMiYWh0dHBzOi8vd3d3Lm9yYXJ0c3dhdGNoLm9yZy9pbWFnaW5lLXRoYXQtdGhlLXNlcmlvdXMtYnVzaW5lc3Mtb2YtaGF2aW5nLWZ1bi1pbi10aGUtYXJ0LWNsYXNzcm9vbS_SAQA?hl=en-IN&gl=IN&ceid=IN%3Aen,2023-09-27
61,Iraq: Beware of Rayan al-Kildani and his “Christian” Babylon ...,Bitter Winter,news.google.com/articles/CBMiXGh0dHBzOi8vYml0dGVyd2ludGVyLm9yZy9pcmFxLWJld2FyZS1vZi1yYXlhbi1hbC1raWxkYW5pLWFuZC1oaXMtY2hyaXN0aWFuLWJhYnlsb24tbW92ZW1lbnQv0gEA?hl=en-IN&gl=IN&ceid=IN%3Aen,2023-09-27
63,"Deals in brief: NexMind, Funding Societies, and Kiddocare secure ...",KrASIA,news.google.com/articles/CBMigQFodHRwczovL2tyLWFzaWEuY29tL2RlYWxzLWluLWJyaWVmLW5leG1pbmQtZnVuZGluZy1zb2NpZXRpZXMtYW5kLWtpZGRvY2FyZS1zZWN1cmUtZnVuZGluZy1tdWx0aXBsZS1jaGluYS1hbmQtaW5kaWEtZGVhbHMtYW5kLW1vcmXSAQA?hl=en-IN&gl=IN&ceid=IN%3Aen,2023-09-27
16,Flora Tissues celebrates 40 years of unmatched quality and ...,dailymirror.lk,news.google.com/articles/CBMigQFodHRwczovL3d3dy5kYWlseW1pcnJvci5say9idXNpbmVzcy1uZXdzL0Zsb3JhLVRpc3N1ZXMtY2VsZWJyYXRlcy00MC15ZWFycy1vZi11bm1hdGNoZWQtcXVhbGl0eS1hbmQtZXhjZWxsZW5jZS1pbi0yMDIzLzI3My0yNjgwMzbSAQA?hl=en-IN&gl=IN&ceid=IN%3Aen,2023-09-26
49,The True Origins of Woke,The Atlantic,news.google.com/articles/CBMiXWh0dHBzOi8vd3d3LnRoZWF0bGFudGljLmNvbS9pZGVhcy9hcmNoaXZlLzIwMjMvMDkvd29rZS1pZGVvbG9neS1oaXN0b3J5LW9yaWdpbnMtZmxhd3MvNjc1NDU0L9IBAA?hl=en-IN&gl=IN&ceid=IN%3Aen,2023-09-26
36,"An Ancient Whale Named for King Tut, but Moby-Dinky in Size",The New York Times,news.google.com/articles/CBMiSGh0dHBzOi8vd3d3Lm55dGltZXMuY29tLzIwMjMvMDkvMjUvc2NpZW5jZS9hcmNoYWVvbG9neS13aGFsZXMtZWd5cHQuaHRtbNIBAA?hl=en-IN&gl=IN&ceid=IN%3Aen,2023-09-25
