,title,source,link,date
80,"Joel Kinnaman, protagonista de Silent Night de John Woo, no dijo ...","Difoosion: Andro4all, Alfa Beta Juega, Urban Tecno, iPadizate y más",news.google.com/articles/CBMilQFodHRwczovL3d3dy5sYXZhbmd1YXJkaWEuY29tL2FuZHJvNGFsbC9zZXJpZXMvam9lbC1raW5uYW1hbi1wcm90YWdvbmlzdGEtZGUtc2lsZW50LW5pZ2h0LWRlLWpvaG4td29vLW5vLWRpam8tdW5hLXNvbGEtcGFsYWJhLWR1cmFudGUtZG9zLW1lc2VzLW8tY2FzadIBAA?hl=en-IN&gl=IN&ceid=IN%3Aen,2023-11-24
11,Oriental Mindoro’s Mangyan demands equity amid renewable energy push,Philstar.com,news.google.com/articles/CBMikQFodHRwczovL3d3dy5waGlsc3Rhci5jb20vaGVhZGxpbmVzL2NsaW1hdGUtYW5kLWVudmlyb25tZW50LzIwMjMvMTEvMjQvMjMxMzg5OS9vcmllbnRhbC1taW5kb3Jvcy1tYW5neWFuLWRlbWFuZHMtZXF1aXR5LWFtaWQtcmVuZXdhYmxlLWVuZXJneS1wdXNo0gGWAWh0dHBzOi8vd3d3LnBoaWxzdGFyLmNvbS9oZWFkbGluZXMvY2xpbWF0ZS1hbmQtZW52aXJvbm1lbnQvMjAyMy8xMS8yNC8yMzEzODk5L29yaWVudGFsLW1pbmRvcm9zLW1hbmd5YW4tZGVtYW5kcy1lcXVpdHktYW1pZC1yZW5ld2FibGUtZW5lcmd5LXB1c2gvYW1wLw?hl=en-IN&gl=IN&ceid=IN%3Aen,2023-11-24
70,India Renewable Energy Market Report 2023: Insights on How India ...,Padovanews,news.google.com/articles/CBMi2wFodHRwczovL3d3dy5wYWRvdmFuZXdzLml0LzIwMjMvMTEvMjQvaW5kaWEtcmVuZXdhYmxlLWVuZXJneS1tYXJrZXQtcmVwb3J0LTIwMjMtaW5zaWdodHMtb24taG93LWluZGlhLXBsYW5zLXRvLWFjaGlldmUtNTAtb2YtY3VtdWxhdGl2ZS1lbGVjdHJpYy1wb3dlci1mcm9tLXJlbmV3YWJsZXMtYnktMjAzMC1hbmQtYXR0YWluLW5ldC16ZXJvLWNhcmJvbi1lbWlzc2lvbnMtYnktMjA3MC_SAQA?hl=en-IN&gl=IN&ceid=IN%3Aen,2023-11-24
16,Indo-Asian News Service-TEN AND ONWARDS!,IANS India Pvt Ltd,news.google.com/articles/CBMiOWh0dHBzOi8vaWFucy5pbi9wci13aXJlLWRldGFpbC90ZW4tYW5kLW9ud2FyZHMtMjUtMTEtMjAyM9IBAA?hl=en-IN&gl=IN&ceid=IN%3Aen,2023-11-24
44,Lab-grown diamonds are the 'new wave of luxury jewelry' and these ...,Manila Bulletin,news.google.com/articles/CBMifmh0dHBzOi8vbWIuY29tLnBoLzIwMjMvMTEvMjQvbGFiLWdyb3duLWRpYW1vbmRzLWFyZS10aGUtbmV3LXdhdmUtb2YtbHV4dXJ5LWpld2VscnktYW5kLXRoZXNlLWZpbGlwaW5vLWRlc2lnbmVycy1hcmUtanVtcGluZy1pbtIBAA?hl=en-IN&gl=IN&ceid=IN%3Aen,2023-11-24
19,Change in Progress: A Solutions Mindset,AdWorld,news.google.com/articles/CBMiSWh0dHBzOi8vd3d3LmFkd29ybGQuaWUvMjAyMy8xMS8yNC9jaGFuZ2UtaW4tcHJvZ3Jlc3MtYS1zb2x1dGlvbnMtbWluZHNldC_SAQA?hl=en-IN&gl=IN&ceid=IN%3Aen,2023-11-24
40,Dubai Municipality wins Middle East Waste and Recycling Award,ZAWYA,news.google.com/articles/CBMifGh0dHBzOi8vd3d3Lnphd3lhLmNvbS9lbi9wcmVzcy1yZWxlYXNlL2NvbXBhbmllcy1uZXdzL2R1YmFpLW11bmljaXBhbGl0eS13aW5zLW1pZGRsZS1lYXN0LXdhc3RlLWFuZC1yZWN5Y2xpbmctYXdhcmQtZnBrZm00dGzSAYIBaHR0cHM6Ly93d3cuemF3eWEuY29tL2VuL3ByZXNzLXJlbGVhc2UvY29tcGFuaWVzLW5ld3MvZHViYWktbXVuaWNpcGFsaXR5LXdpbnMtbWlkZGxlLWVhc3Qtd2FzdGUtYW5kLXJlY3ljbGluZy1hd2FyZC1mcGtmbTR0bD9hbXA9MQ?hl=en-IN&gl=IN&ceid=IN%3Aen,2023-11-24
27,10 Stand Out Features Of The HiPhi A Electric Super Sedan,TopSpeed,news.google.com/articles/CBMiSWh0dHBzOi8vd3d3LnRvcHNwZWVkLmNvbS9oaXBoaS1hLWVsZWN0cmljLXN1cGVyLXNlZGFuLXN0YW5kLW91dC1mZWF0dXJlcy_SAQA?hl=en-IN&gl=IN&ceid=IN%3Aen,2023-11-24
37,"Apple products are at all-time low prices for Black Friday 2023: Save on iPads, AirPods, Apple Watches and more",Engadget,news.google.com/articles/CBMia2h0dHBzOi8vd3d3LmVuZ2FkZ2V0LmNvbS9iZXN0LWFwcGxlLWJsYWNrLWZyaWRheS1kZWFscy1pcGFkcy1haXJwb2RzLWFwcGxlLXdhdGNoLWlwaG9uZS1tb3JlLTA5NDUzMjIyMS5odG1s0gFvaHR0cHM6Ly93d3cuZW5nYWRnZXQuY29tL2FtcC9iZXN0LWFwcGxlLWJsYWNrLWZyaWRheS1kZWFscy1pcGFkcy1haXJwb2RzLWFwcGxlLXdhdGNoLWlwaG9uZS1tb3JlLTA5NDUzMjIyMS5odG1s?hl=en-IN&gl=IN&ceid=IN%3Aen,2023-11-24
9,"India Renewable Energy Market Report 2023: Insights on How India Plans to Achieve 50% of Cumulative Electric Power from Renewables by 2030, and Attain Net-Zero Carbon Emissions by 2070",Yahoo Finance,news.google.com/articles/CBMiUmh0dHBzOi8vZmluYW5jZS55YWhvby5jb20vbmV3cy9pbmRpYS1yZW5ld2FibGUtZW5lcmd5LW1hcmtldC1yZXBvcnQtMTQ1MzAwMDM5Lmh0bWzSAVpodHRwczovL2ZpbmFuY2UueWFob28uY29tL2FtcGh0bWwvbmV3cy9pbmRpYS1yZW5ld2FibGUtZW5lcmd5LW1hcmtldC1yZXBvcnQtMTQ1MzAwMDM5Lmh0bWw?hl=en-IN&gl=IN&ceid=IN%3Aen,2023-11-24
