,title,source,link,date
40,Global Electrical Isolators Market Is Expected to Grow at A Stable CAGR During the Forecast Period (2023-2028),openPR,news.google.com/articles/CBMiXWh0dHBzOi8vd3d3Lm9wZW5wci5jb20vbmV3cy8zMjg2MDU2L2dsb2JhbC1lbGVjdHJpY2FsLWlzb2xhdG9ycy1tYXJrZXQtaXMtZXhwZWN0ZWQtdG8tZ3Jvdy1hdNIBXGh0dHBzOi8vd3d3Lm9wZW5wci5jb20vYW1wLzMyODYwNTYvZ2xvYmFsLWVsZWN0cmljYWwtaXNvbGF0b3JzLW1hcmtldC1pcy1leHBlY3RlZC10by1ncm93LWF0?hl=en-IN&gl=IN&ceid=IN%3Aen,2023-11-14
12,Release: State of Climate Action report finds progress lags on every ...,Climate Action Tracker,news.google.com/articles/CBMigwFodHRwczovL2NsaW1hdGVhY3Rpb250cmFja2VyLm9yZy9wcmVzcy9yZWxlYXNlLXN0YXRlLW9mLWNsaW1hdGUtYWN0aW9uLXJlcG9ydC1maW5kcy1wcm9ncmVzcy1sYWdzLW9uLWV2ZXJ5LW1lYXN1cmUtZXhjZXB0LWV2LXNhbGVzL9IBAA?hl=en-IN&gl=IN&ceid=IN%3Aen,2023-11-14
54,Veolia inaugure la plus grande centrale solaire sur une usine de ...,Veolia,news.google.com/articles/CBMid2h0dHBzOi8vd3d3LnZlb2xpYS5jb20vZnIvbm9zLW1lZGlhcy9hY3R1YWxpdGVzL3Zlb2xpYS1pbmF1Z3VyZS1wbHVzLWdyYW5kZS1jZW50cmFsZS1zb2xhaXJlLXVzaW5lLWRlc3NhbGVtZW50LWF1LW1veWVu0gEA?hl=en-IN&gl=IN&ceid=IN%3Aen,2023-11-13
31,Dubai's Iconic Wasl Tower: The World's Tallest Sustainable Marvel,stupidDOPE.com,news.google.com/articles/CBMiXmh0dHBzOi8vc3R1cGlkZG9wZS5jb20vMjAyMy8xMS9kdWJhaXMtaWNvbmljLXdhc2wtdG93ZXItdGhlLXdvcmxkcy10YWxsZXN0LXN1c3RhaW5hYmxlLW1hcnZlbC_SAQA?hl=en-IN&gl=IN&ceid=IN%3Aen,2023-11-13
35,Australia strikes neo-colonial “security” pact with Tuvalu to counter ...,WSWS,news.google.com/articles/CBMiOWh0dHBzOi8vd3d3Lndzd3Mub3JnL2VuL2FydGljbGVzLzIwMjMvMTEvMTMvdm91Zi1uMTMuaHRtbNIBAA?hl=en-IN&gl=IN&ceid=IN%3Aen,2023-11-13
13,Ministry launches ‘ambitious’ strategy for carbon neutrality,The Phnom Penh Post,news.google.com/articles/CBMiYWh0dHBzOi8vd3d3LnBobm9tcGVuaHBvc3QuY29tL25hdGlvbmFsL21pbmlzdHJ5LWxhdW5jaGVzLWFtYml0aW91cy1zdHJhdGVneS1mb3ItY2FyYm9uLW5ldXRyYWxpdHnSAQA?hl=en-IN&gl=IN&ceid=IN%3Aen,2023-11-13
15,"Governing the net-zero transition: Strategy, policy, and politics ...",pnas.org,news.google.com/articles/CBMiMGh0dHBzOi8vd3d3LnBuYXMub3JnL2RvaS8xMC4xMDczL3BuYXMuMjIwNzcyNzEyMNIBAA?hl=en-IN&gl=IN&ceid=IN%3Aen,2023-11-13
17,Leveraging neuroscience for climate change research,Nature.com,news.google.com/articles/CBMiMmh0dHBzOi8vd3d3Lm5hdHVyZS5jb20vYXJ0aWNsZXMvczQxNTU4LTAyMy0wMTg1Ny000gEA?hl=en-IN&gl=IN&ceid=IN%3Aen,2023-11-13
19,The historical dismantling of tramways as a case of destabilisation ...,pnas.org,news.google.com/articles/CBMiMGh0dHBzOi8vd3d3LnBuYXMub3JnL2RvaS8xMC4xMDczL3BuYXMuMjIwNjIyNzEyMNIBAA?hl=en-IN&gl=IN&ceid=IN%3Aen,2023-11-13
32,Climate Local Now: Walking Through Nature’s Miracles,East End Beacon,news.google.com/articles/CBMiUWh0dHBzOi8vd3d3LmVhc3RlbmRiZWFjb24uY29tL2NsaW1hdGUtbG9jYWwtbm93LXdhbGtpbmctdGhyb3VnaC1uYXR1cmVzLW1pcmFjbGVzL9IBAA?hl=en-IN&gl=IN&ceid=IN%3Aen,2023-11-13
