,title,source,link,date
43,"Meet one of India's first female brewers, Lynette Pires; India-inspired ...",YourStory,news.google.com/articles/CBMidGh0dHBzOi8veW91cnN0b3J5LmNvbS8yMDIzLzEwL21lZXQtb25lLW9mLWluZGlhcy1maXJzdC1mZW1hbGUtYnJld2Vycy1seW5ldHRlLXBpcmVzLWluZGlhLWluc3BpcmVkLWFydC1mb3ItdGhlLXdvcmxk0gEA?hl=en-IN&gl=IN&ceid=IN%3Aen,2023-10-29
5,There must be real protection of investors instead of harming ...,Tax Management India. Com,news.google.com/articles/CBMiTWh0dHBzOi8vd3d3LnRheG1hbmFnZW1lbnRpbmRpYS5jb20vdmlzaXRvci9kZXRhaWxfYXJ0aWNsZS5hc3A_QXJ0aWNsZUlEPTExOTk00gEA?hl=en-IN&gl=IN&ceid=IN%3Aen,2023-10-28
33,Mamaearth's house-of-brand playbook; Tejas: An overly patriotic tale,YourStory,news.google.com/articles/CBMibWh0dHBzOi8veW91cnN0b3J5LmNvbS8yMDIzLzEwL21hbWFlYXJ0aC1ob3VzZS1vZi1icmFuZC1wbGF5Ym9vay10ZWphcy1hbi1vdmVybHktcGF0cmlvdGljLXRhbGUtcGxhbmV0LXRyb3R0ZXLSAQA?hl=en-IN&gl=IN&ceid=IN%3Aen,2023-10-28
4,Hindalco Industries Limited (NSE:HINDALCO) Stock's Been Sliding But Fundamentals Look Decent: Will The Market Correct The Share Price In The Future?,Simply Wall St,news.google.com/articles/CBMilAFodHRwczovL3NpbXBseXdhbGwuc3Qvc3RvY2tzL2luL21hdGVyaWFscy9uc2UtaGluZGFsY28vaGluZGFsY28taW5kdXN0cmllcy1zaGFyZXMvbmV3cy9oaW5kYWxjby1pbmR1c3RyaWVzLWxpbWl0ZWQtbnNlaGluZGFsY28tc3RvY2tzLWJlZW4tc2xpZGluZy0x0gGYAWh0dHBzOi8vc2ltcGx5d2FsbC5zdC9zdG9ja3MvaW4vbWF0ZXJpYWxzL25zZS1oaW5kYWxjby9oaW5kYWxjby1pbmR1c3RyaWVzLXNoYXJlcy9uZXdzL2hpbmRhbGNvLWluZHVzdHJpZXMtbGltaXRlZC1uc2VoaW5kYWxjby1zdG9ja3MtYmVlbi1zbGlkaW5nLTEvYW1w?hl=en-IN&gl=IN&ceid=IN%3Aen,2023-10-27
48,Levy ADD on Jute Products originating in or exported from Nepal ...,Tax Management India. Com,news.google.com/articles/CBMiTGh0dHBzOi8vd3d3LnRheG1hbmFnZW1lbnRpbmRpYS5jb20vdmlzaXRvci9kZXRhaWxfbm90aWZpY2F0aW9uLmFzcD9JRD0xNDEwMzTSAQA?hl=en-IN&gl=IN&ceid=IN%3Aen,2023-10-27
49,Dangote Cement Plc (DANGCE.ng) Q32023 Interim Report,AfricanFinancials,news.google.com/articles/CBMiPGh0dHBzOi8vYWZyaWNhbmZpbmFuY2lhbHMuY29tL2RvY3VtZW50L25nLWRhbmdjZS0yMDIzLWlyLXEzL9IBAA?hl=en-IN&gl=IN&ceid=IN%3Aen,2023-10-27
35,"Taro Provides Results for September 30, 2023",Business Wire,news.google.com/articles/CBMiZGh0dHBzOi8vd3d3LmJ1c2luZXNzd2lyZS5jb20vbmV3cy9ob21lLzIwMjMxMDI2MzcyNjkyL2VuL1Rhcm8tUHJvdmlkZXMtUmVzdWx0cy1mb3ItU2VwdGVtYmVyLTMwLTIwMjPSAQA?hl=en-IN&gl=IN&ceid=IN%3Aen,2023-10-26
19,Should Weakness in Laxmi Organic Industries Limited's (NSE:LXCHEM) Stock Be Seen As A Sign That Market Will Correct The Share Price Given Decent Financials?,Simply Wall St,news.google.com/articles/CBMilgFodHRwczovL3NpbXBseXdhbGwuc3Qvc3RvY2tzL2luL21hdGVyaWFscy9uc2UtbHhjaGVtL2xheG1pLW9yZ2FuaWMtaW5kdXN0cmllcy1zaGFyZXMvbmV3cy9zaG91bGQtd2Vha25lc3MtaW4tbGF4bWktb3JnYW5pYy1pbmR1c3RyaWVzLWxpbWl0ZWRzLW5zZWx4Y2jSAZoBaHR0cHM6Ly9zaW1wbHl3YWxsLnN0L3N0b2Nrcy9pbi9tYXRlcmlhbHMvbnNlLWx4Y2hlbS9sYXhtaS1vcmdhbmljLWluZHVzdHJpZXMtc2hhcmVzL25ld3Mvc2hvdWxkLXdlYWtuZXNzLWluLWxheG1pLW9yZ2FuaWMtaW5kdXN0cmllcy1saW1pdGVkcy1uc2VseGNoL2FtcA?hl=en-IN&gl=IN&ceid=IN%3Aen,2023-10-24
88,FACT: Good Times to Keep Rolling?,Equitymaster,news.google.com/articles/CBMiZWh0dHBzOi8vd3d3LmVxdWl0eW1hc3Rlci5jb20vZGV0YWlsLmFzcD9kYXRlPTEwLzIwLzIwMjMmc3Rvcnk9OCZ0aXRsZT1GQUNULUdvb2QtVGltZXMtdG8tS2VlcC1Sb2xsaW5n0gEA?hl=en-IN&gl=IN&ceid=IN%3Aen,2023-10-20
1,Page Industries Board to Consider Second Interim Dividend for ...,Marketscreener.com,news.google.com/articles/CBMiowFodHRwczovL3d3dy5tYXJrZXRzY3JlZW5lci5jb20vcXVvdGUvc3RvY2svUEFHRS1JTkRVU1RSSUVTLUxJTUlURUQtOTA1OTc4My9uZXdzL1BhZ2UtSW5kdXN0cmllcy1Cb2FyZC10by1Db25zaWRlci1TZWNvbmQtSW50ZXJpbS1EaXZpZGVuZC1mb3ItRmlzY2FsLTIwMjMtNDUwNzk1MzYv0gEA?hl=en-IN&gl=IN&ceid=IN%3Aen,2023-10-17
