,title,source,link,date
5,There must be real protection of investors instead of harming ...,Tax Management India. Com,news.google.com/articles/CBMiTWh0dHBzOi8vd3d3LnRheG1hbmFnZW1lbnRpbmRpYS5jb20vdmlzaXRvci9kZXRhaWxfYXJ0aWNsZS5hc3A_QXJ0aWNsZUlEPTExOTk00gEA?hl=en-IN&gl=IN&ceid=IN%3Aen,2023-10-28
21,Mamaearth's house-of-brand playbook; Tejas: An overly patriotic tale,YourStory,news.google.com/articles/CBMibWh0dHBzOi8veW91cnN0b3J5LmNvbS8yMDIzLzEwL21hbWFlYXJ0aC1ob3VzZS1vZi1icmFuZC1wbGF5Ym9vay10ZWphcy1hbi1vdmVybHktcGF0cmlvdGljLXRhbGUtcGxhbmV0LXRyb3R0ZXLSAQA?hl=en-IN&gl=IN&ceid=IN%3Aen,2023-10-28
41,Levy ADD on Jute Products originating in or exported from Nepal ...,Tax Management India. Com,news.google.com/articles/CBMiTGh0dHBzOi8vd3d3LnRheG1hbmFnZW1lbnRpbmRpYS5jb20vdmlzaXRvci9kZXRhaWxfbm90aWZpY2F0aW9uLmFzcD9JRD0xNDEwMzTSAQA?hl=en-IN&gl=IN&ceid=IN%3Aen,2023-10-27
50,Opening remarks by the President: EUCO October 2023,European Commission,news.google.com/articles/CBMiR2h0dHBzOi8vZWMuZXVyb3BhLmV1L2NvbW1pc3Npb24vcHJlc3Njb3JuZXIvZGV0YWlsL2VuL3N0YXRlbWVudF8yM181Mzcz0gEA?hl=en-IN&gl=IN&ceid=IN%3Aen,2023-10-27
4,Hindalco Industries Limited (NSE:HINDALCO) Stock's Been Sliding But Fundamentals Look Decent: Will The Market Correct The Share Price In The Future?,Simply Wall St,news.google.com/articles/CBMilAFodHRwczovL3NpbXBseXdhbGwuc3Qvc3RvY2tzL2luL21hdGVyaWFscy9uc2UtaGluZGFsY28vaGluZGFsY28taW5kdXN0cmllcy1zaGFyZXMvbmV3cy9oaW5kYWxjby1pbmR1c3RyaWVzLWxpbWl0ZWQtbnNlaGluZGFsY28tc3RvY2tzLWJlZW4tc2xpZGluZy0x0gGYAWh0dHBzOi8vc2ltcGx5d2FsbC5zdC9zdG9ja3MvaW4vbWF0ZXJpYWxzL25zZS1oaW5kYWxjby9oaW5kYWxjby1pbmR1c3RyaWVzLXNoYXJlcy9uZXdzL2hpbmRhbGNvLWluZHVzdHJpZXMtbGltaXRlZC1uc2VoaW5kYWxjby1zdG9ja3MtYmVlbi1zbGlkaW5nLTEvYW1w?hl=en-IN&gl=IN&ceid=IN%3Aen,2023-10-27
42,Dangote Cement Plc (DANGCE.ng) Q32023 Interim Report,AfricanFinancials,news.google.com/articles/CBMiPGh0dHBzOi8vYWZyaWNhbmZpbmFuY2lhbHMuY29tL2RvY3VtZW50L25nLWRhbmdjZS0yMDIzLWlyLXEzL9IBAA?hl=en-IN&gl=IN&ceid=IN%3Aen,2023-10-27
33,Fitch Upgrades Arthur J. Gallagher to 'BBB+'; Outlook Stable,Fitch Ratings,news.google.com/articles/CBMiemh0dHBzOi8vd3d3LmZpdGNocmF0aW5ncy5jb20vcmVzZWFyY2gvY29ycG9yYXRlLWZpbmFuY2UvZml0Y2gtdXBncmFkZXMtYXJ0aHVyLWotZ2FsbGFnaGVyLXRvLWJiYi1vdXRsb29rLXN0YWJsZS0yNy0xMC0yMDIz0gEA?hl=en-IN&gl=IN&ceid=IN%3Aen,2023-10-27
28,"Taro Provides Results for September 30, 2023",Business Wire,news.google.com/articles/CBMiZGh0dHBzOi8vd3d3LmJ1c2luZXNzd2lyZS5jb20vbmV3cy9ob21lLzIwMjMxMDI2MzcyNjkyL2VuL1Rhcm8tUHJvdmlkZXMtUmVzdWx0cy1mb3ItU2VwdGVtYmVyLTMwLTIwMjPSAQA?hl=en-IN&gl=IN&ceid=IN%3Aen,2023-10-26
29,Declining Stock and Decent Financials: Is The Market Wrong About Finolex Industries Limited (NSE:FINPIPE)?,Simply Wall St,news.google.com/articles/CBMilQFodHRwczovL3NpbXBseXdhbGwuc3Qvc3RvY2tzL2luL21hdGVyaWFscy9uc2UtZmlucGlwZS9maW5vbGV4LWluZHVzdHJpZXMtc2hhcmVzL25ld3MvZGVjbGluaW5nLXN0b2NrLWFuZC1kZWNlbnQtZmluYW5jaWFscy1pcy10aGUtbWFya2V0LXdyb25nLWFiLTg2MdIBmQFodHRwczovL3NpbXBseXdhbGwuc3Qvc3RvY2tzL2luL21hdGVyaWFscy9uc2UtZmlucGlwZS9maW5vbGV4LWluZHVzdHJpZXMtc2hhcmVzL25ld3MvZGVjbGluaW5nLXN0b2NrLWFuZC1kZWNlbnQtZmluYW5jaWFscy1pcy10aGUtbWFya2V0LXdyb25nLWFiLTg2MS9hbXA?hl=en-IN&gl=IN&ceid=IN%3Aen,2023-10-24
19,Should Weakness in Laxmi Organic Industries Limited's (NSE:LXCHEM) Stock Be Seen As A Sign That Market Will Correct The Share Price Given Decent Financials?,Simply Wall St,news.google.com/articles/CBMilgFodHRwczovL3NpbXBseXdhbGwuc3Qvc3RvY2tzL2luL21hdGVyaWFscy9uc2UtbHhjaGVtL2xheG1pLW9yZ2FuaWMtaW5kdXN0cmllcy1zaGFyZXMvbmV3cy9zaG91bGQtd2Vha25lc3MtaW4tbGF4bWktb3JnYW5pYy1pbmR1c3RyaWVzLWxpbWl0ZWRzLW5zZWx4Y2jSAZoBaHR0cHM6Ly9zaW1wbHl3YWxsLnN0L3N0b2Nrcy9pbi9tYXRlcmlhbHMvbnNlLWx4Y2hlbS9sYXhtaS1vcmdhbmljLWluZHVzdHJpZXMtc2hhcmVzL25ld3Mvc2hvdWxkLXdlYWtuZXNzLWluLWxheG1pLW9yZ2FuaWMtaW5kdXN0cmllcy1saW1pdGVkcy1uc2VseGNoL2FtcA?hl=en-IN&gl=IN&ceid=IN%3Aen,2023-10-24
