,title,source,link,date
9,AmpliTech's Satcom Systems Subdivision Receives Orders from ...,StreetInsider.com,news.google.com/articles/CBMikAFodHRwczovL3d3dy5zdHJlZXRpbnNpZGVyLmNvbS9BY2Nlc3N3aXJlL0FtcGxpVGVjaCVFMiU4MCU5OXMrU2F0Y29tK1N5c3RlbXMrU3ViZGl2aXNpb24rUmVjZWl2ZXMrT3JkZXJzK2Zyb20rTWFqb3IrTWVkaWErQ29tcGFuaWVzLzIyMjM3MzUxLmh0bWzSAQA?hl=en-IN&gl=IN&ceid=IN%3Aen,2023-10-04
31,Park & Battery Accelerates Growth Strategy with Key Leadership Appointments,Benzinga,news.google.com/articles/CBMigAFodHRwczovL3d3dy5iZW56aW5nYS5jb20vcHJlc3NyZWxlYXNlcy8yMy8xMC9uMzUwODU2MzYvcGFyay1iYXR0ZXJ5LWFjY2VsZXJhdGVzLWdyb3d0aC1zdHJhdGVneS13aXRoLWtleS1sZWFkZXJzaGlwLWFwcG9pbnRtZW50c9IBLWh0dHBzOi8vd3d3LmJlbnppbmdhLmNvbS9hbXAvY29udGVudC8zNTA4NTYzNg?hl=en-IN&gl=IN&ceid=IN%3Aen,2023-10-04
41,"Public Key Infrastructure (PKI) Market Size, Share with Focus on ...",Benzinga,news.google.com/articles/CBMimQFodHRwczovL3d3dy5iZW56aW5nYS5jb20vcHJlc3NyZWxlYXNlcy8yMy8xMC9hYjM1MDc1MTM4L3B1YmxpYy1rZXktaW5mcmFzdHJ1Y3R1cmUtcGtpLW1hcmtldC1zaXplLXNoYXJlLXdpdGgtZm9jdXMtb24tZW1lcmdpbmctdGVjaG5vbG9naWVzLXRvcC1jb3VudHJpZXPSAQA?hl=en-IN&gl=IN&ceid=IN%3Aen,2023-10-03
13,HMD Global starts manufacturing in Europe with the ‘Made in Hungary’ Nokia XR21 5G phone,TechCrunch,news.google.com/articles/CBMiRWh0dHBzOi8vdGVjaGNydW5jaC5jb20vMjAyMy8xMC8wMy9ub2tpYS1obWQtZ2xvYmFsLWV1cm9wZS1zbWFydHBob25lL9IBSWh0dHBzOi8vdGVjaGNydW5jaC5jb20vMjAyMy8xMC8wMy9ub2tpYS1obWQtZ2xvYmFsLWV1cm9wZS1zbWFydHBob25lL2FtcC8?hl=en-IN&gl=IN&ceid=IN%3Aen,2023-10-03
14,Fighting Climate Change Demands Urgent Action in Environmental ...,United Nations,news.google.com/articles/CBMiLWh0dHBzOi8vcHJlc3MudW4ub3JnL2VuLzIwMjMvZ2FlZjM1ODQuZG9jLmh0bdIBAA?hl=en-IN&gl=IN&ceid=IN%3Aen,2023-10-03
29,Indonesian Personal Data Protection Law Update - What to Expect ...,Lexology,news.google.com/articles/CBMiU2h0dHBzOi8vd3d3LmxleG9sb2d5LmNvbS9saWJyYXJ5L2RldGFpbC5hc3B4P2c9NjM2MDJlODYtY2NiYi00Nzk2LTlhOTEtOGMyZmYxMmJlMWE30gEA?hl=en-IN&gl=IN&ceid=IN%3Aen,2023-10-03
23,Keynote Address of Chairman Rostin Behnam at the Futures ...,Commodity Futures Trading Commission,news.google.com/articles/CBMiPGh0dHBzOi8vd3d3LmNmdGMuZ292L1ByZXNzUm9vbS9TcGVlY2hlc1Rlc3RpbW9ueS9vcGFiZWhuYW0zN9IBAA?hl=en-IN&gl=IN&ceid=IN%3Aen,2023-10-02
26,The Challenge of Automotive Hardware Security Deployment,Design and Reuse,news.google.com/articles/CBMiaWh0dHBzOi8vd3d3LmRlc2lnbi1yZXVzZS5jb20vYXJ0aWNsZXMvNTQ5MzEvdGhlLWNoYWxsZW5nZS1vZi1hdXRvbW90aXZlLWhhcmR3YXJlLXNlY3VyaXR5LWRlcGxveW1lbnQuaHRtbNIBAA?hl=en-IN&gl=IN&ceid=IN%3Aen,2023-10-02
30,"Paramount+ preps boy band doc from Gunpowder & Sky, MTV ...",Realscreen,news.google.com/articles/CBMibGh0dHBzOi8vcmVhbHNjcmVlbi5jb20vMjAyMy8xMC8wMi9wYXJhbW91bnQtcHJlcHMtYm95LWJhbmQtZG9jLWZyb20tZ3VucG93ZGVyLXNreS1tdHYtZW50ZXJ0YWlubWVudC1zdHVkaW9zL9IBAA?hl=en-IN&gl=IN&ceid=IN%3Aen,2023-10-02
5,"Plaza Wires IPO Date, Review, Price, Allotment, Analysis",IPO Watch,news.google.com/articles/CBMiSWh0dHBzOi8vaXBvd2F0Y2guaW4vcGxhemEtd2lyZXMtaXBvLWRhdGUtcmV2aWV3LXByaWNlLWFsbG90bWVudC1hbmFseXNpcy_SAQA?hl=en-IN&gl=IN&ceid=IN%3Aen,2023-09-30
