,title,source,link,date
34,SIP Trunking Service Market 2023-2030: Unveiling Growth Developments with the Latest Updates,Benzinga,news.google.com/articles/CBMikQFodHRwczovL3d3dy5iZW56aW5nYS5jb20vcHJlc3NyZWxlYXNlcy8yMy8wOS8zNDQ4NTQ0NC9zaXAtdHJ1bmtpbmctc2VydmljZS1tYXJrZXQtMjAyMy0yMDMwLXVudmVpbGluZy1ncm93dGgtZGV2ZWxvcG1lbnRzLXdpdGgtdGhlLWxhdGVzdC11cGRhdGVz0gEtaHR0cHM6Ly93d3cuYmVuemluZ2EuY29tL2FtcC9jb250ZW50LzM0NDg1NDQ0?hl=en-IN&gl=IN&ceid=IN%3Aen,2023-09-12
30,Web Real-Time Communication Market Growth 2023 | Exploring Latest Industry Insights with Industry Segment,Benzinga,news.google.com/articles/CBMimQFodHRwczovL3d3dy5iZW56aW5nYS5jb20vcHJlc3NyZWxlYXNlcy8yMy8wOS8zNDQ2NzUyOS93ZWItcmVhbC10aW1lLWNvbW11bmljYXRpb24tbWFya2V0LWdyb3d0aC0yMDIzLWV4cGxvcmluZy1sYXRlc3QtaW5kdXN0cnktaW5zaWdodHMtd2l0aC1pbmR1c3RyeS1zZWfSAS1odHRwczovL3d3dy5iZW56aW5nYS5jb20vYW1wL2NvbnRlbnQvMzQ0Njc1Mjk?hl=en-IN&gl=IN&ceid=IN%3Aen,2023-09-12
58,How To Browse Dark Web Safely,Robots.net,news.google.com/articles/CBMiNmh0dHBzOi8vcm9ib3RzLm5ldC90ZWNoL2hvdy10by1icm93c2UtZGFyay13ZWItc2FmZWx5L9IBAA?hl=en-IN&gl=IN&ceid=IN%3Aen,2023-09-12
56,"High Altitude Long Endurance (Pseudo Satellite) Platform Market Size 2023-2030: Predicting Sales Value, R",Benzinga,news.google.com/articles/CBMimQFodHRwczovL3d3dy5iZW56aW5nYS5jb20vcHJlc3NyZWxlYXNlcy8yMy8wOS8zNDQ4NTYwOC9oaWdoLWFsdGl0dWRlLWxvbmctZW5kdXJhbmNlLXBzZXVkby1zYXRlbGxpdGUtcGxhdGZvcm0tbWFya2V0LXNpemUtMjAyMy0yMDMwLXByZWRpY3Rpbmctc2FsZXMtdmFsdWXSAS1odHRwczovL3d3dy5iZW56aW5nYS5jb20vYW1wL2NvbnRlbnQvMzQ0ODU2MDg?hl=en-IN&gl=IN&ceid=IN%3Aen,2023-09-12
55,Smart City & Connected City Solutions Market Dynamics: Current State and Future Prospects in 2030,Benzinga,news.google.com/articles/CBMilAFodHRwczovL3d3dy5iZW56aW5nYS5jb20vcHJlc3NyZWxlYXNlcy8yMy8wOS8zNDQ3NTk1NS9zbWFydC1jaXR5LWNvbm5lY3RlZC1jaXR5LXNvbHV0aW9ucy1tYXJrZXQtZHluYW1pY3MtY3VycmVudC1zdGF0ZS1hbmQtZnV0dXJlLXByb3NwZWN0cy1pbi0yMDMw0gEtaHR0cHM6Ly93d3cuYmVuemluZ2EuY29tL2FtcC9jb250ZW50LzM0NDc1OTU1?hl=en-IN&gl=IN&ceid=IN%3Aen,2023-09-12
54,Crisis Management Market Trends: Industry Analysis and Growth Projections Through 2030,Benzinga,news.google.com/articles/CBMiiwFodHRwczovL3d3dy5iZW56aW5nYS5jb20vcHJlc3NyZWxlYXNlcy8yMy8wOS8zNDQ4NTU5OS9jcmlzaXMtbWFuYWdlbWVudC1tYXJrZXQtdHJlbmRzLWluZHVzdHJ5LWFuYWx5c2lzLWFuZC1ncm93dGgtcHJvamVjdGlvbnMtdGhyb3VnaC0yMDMw0gEtaHR0cHM6Ly93d3cuYmVuemluZ2EuY29tL2FtcC9jb250ZW50LzM0NDg1NTk5?hl=en-IN&gl=IN&ceid=IN%3Aen,2023-09-12
48,Banking Smart Card Operating Systems Market Insights: Industry Analysis and Projections for Growth by 203,Benzinga,news.google.com/articles/CBMimQFodHRwczovL3d3dy5iZW56aW5nYS5jb20vcHJlc3NyZWxlYXNlcy8yMy8wOS8zNDQ4MzkyMS9iYW5raW5nLXNtYXJ0LWNhcmQtb3BlcmF0aW5nLXN5c3RlbXMtbWFya2V0LWluc2lnaHRzLWluZHVzdHJ5LWFuYWx5c2lzLWFuZC1wcm9qZWN0aW9ucy1mb3ItZ3Jvd3RoLWLSAS1odHRwczovL3d3dy5iZW56aW5nYS5jb20vYW1wL2NvbnRlbnQvMzQ0ODM5MjE?hl=en-IN&gl=IN&ceid=IN%3Aen,2023-09-12
44,Telematics in Heavy Equipment Market Size and Growth 2023 | Exploring Future Trends and Developments by 2,Benzinga,news.google.com/articles/CBMimQFodHRwczovL3d3dy5iZW56aW5nYS5jb20vcHJlc3NyZWxlYXNlcy8yMy8wOS8zNDQ4NTgwMi90ZWxlbWF0aWNzLWluLWhlYXZ5LWVxdWlwbWVudC1tYXJrZXQtc2l6ZS1hbmQtZ3Jvd3RoLTIwMjMtZXhwbG9yaW5nLWZ1dHVyZS10cmVuZHMtYW5kLWRldmVsb3BtZW50cy3SAS1odHRwczovL3d3dy5iZW56aW5nYS5jb20vYW1wL2NvbnRlbnQvMzQ0ODU4MDI?hl=en-IN&gl=IN&ceid=IN%3Aen,2023-09-12
43,"Silicon Carbide Wafer Market to See a Big Move | Wolfspeed Inc., II-VI Incorporated, Xiamen Powerway Advanced",openPR,news.google.com/articles/CBMiYGh0dHBzOi8vd3d3Lm9wZW5wci5jb20vbmV3cy8zMjA0NTk3L3NpbGljb24tY2FyYmlkZS13YWZlci1tYXJrZXQtdG8tc2VlLWEtYmlnLW1vdmUtd29sZnNwZWVkLWluY9IBX2h0dHBzOi8vd3d3Lm9wZW5wci5jb20vYW1wLzMyMDQ1OTcvc2lsaWNvbi1jYXJiaWRlLXdhZmVyLW1hcmtldC10by1zZWUtYS1iaWctbW92ZS13b2xmc3BlZWQtaW5j?hl=en-IN&gl=IN&ceid=IN%3Aen,2023-09-12
41,Mobile Hotspots Market Forecast 2023-2030: Current and Future Challenges with Size and Valuation,Benzinga,news.google.com/articles/CBMilQFodHRwczovL3d3dy5iZW56aW5nYS5jb20vcHJlc3NyZWxlYXNlcy8yMy8wOS8zNDQ4MzY2MS9tb2JpbGUtaG90c3BvdHMtbWFya2V0LWZvcmVjYXN0LTIwMjMtMjAzMC1jdXJyZW50LWFuZC1mdXR1cmUtY2hhbGxlbmdlcy13aXRoLXNpemUtYW5kLXZhbHVhdGlvbtIBLWh0dHBzOi8vd3d3LmJlbnppbmdhLmNvbS9hbXAvY29udGVudC8zNDQ4MzY2MQ?hl=en-IN&gl=IN&ceid=IN%3Aen,2023-09-12
