,title,source,link,date
0,Do Its Financials Have Any Role To Play In Driving Paramount ...,Simply Wall St,news.google.com/articles/CBMioAFodHRwczovL3NpbXBseXdhbGwuc3Qvc3RvY2tzL2luL2NhcGl0YWwtZ29vZHMvbnNlLXBhcmFjYWJsZXMvcGFyYW1vdW50LWNvbW11bmljYXRpb25zLXNoYXJlcy9uZXdzL2RvLWl0cy1maW5hbmNpYWxzLWhhdmUtYW55LXJvbGUtdG8tcGxheS1pbi1kcml2aW5nLXBhcmFtb3VudC0x0gEA?hl=en-IN&gl=IN&ceid=IN%3Aen,2023-09-11
24,"Commercial Wired and Wireless Full Duplex Intercom Systems Market Future Trends, Opportunities and Growth",Benzinga,news.google.com/articles/CBMimQFodHRwczovL3d3dy5iZW56aW5nYS5jb20vcHJlc3NyZWxlYXNlcy8yMy8wOS8zNDQyNTQyOS9jb21tZXJjaWFsLXdpcmVkLWFuZC13aXJlbGVzcy1mdWxsLWR1cGxleC1pbnRlcmNvbS1zeXN0ZW1zLW1hcmtldC1mdXR1cmUtdHJlbmRzLW9wcG9ydHVuaXRpZXMtYW5kLWfSAS1odHRwczovL3d3dy5iZW56aW5nYS5jb20vYW1wL2NvbnRlbnQvMzQ0MjU0Mjk?hl=en-IN&gl=IN&ceid=IN%3Aen,2023-09-11
60,"Insightful Answers in Encrypt Email Messages Market Research Report: Industry Overview, Trends, and Forec",Benzinga,news.google.com/articles/CBMimQFodHRwczovL3d3dy5iZW56aW5nYS5jb20vcHJlc3NyZWxlYXNlcy8yMy8wOS8zNDQyMTcwMC9pbnNpZ2h0ZnVsLWFuc3dlcnMtaW4tZW5jcnlwdC1lbWFpbC1tZXNzYWdlcy1tYXJrZXQtcmVzZWFyY2gtcmVwb3J0LWluZHVzdHJ5LW92ZXJ2aWV3LXRyZW5kcy1hbmQtZm_SAS1odHRwczovL3d3dy5iZW56aW5nYS5jb20vYW1wL2NvbnRlbnQvMzQ0MjE3MDA?hl=en-IN&gl=IN&ceid=IN%3Aen,2023-09-11
29,2023 Video Surveillance and Storage Market Updates: Size and ...,Benzinga,news.google.com/articles/CBMimQFodHRwczovL3d3dy5iZW56aW5nYS5jb20vcHJlc3NyZWxlYXNlcy8yMy8wOS8zNDQyNTQzOC8yMDIzLXZpZGVvLXN1cnZlaWxsYW5jZS1hbmQtc3RvcmFnZS1tYXJrZXQtdXBkYXRlcy1zaXplLWFuZC1zaGFyZS1pbnNpZ2h0cy1hbmQtZnV0dXJlLXRyZW5kcy1ieS0yMDPSAQA?hl=en-IN&gl=IN&ceid=IN%3Aen,2023-09-11
28,Cloud-Based Video Conferencing Market Growth Analysis 2023: Exploring the Latest Industry Trends and Segm,Benzinga,news.google.com/articles/CBMimQFodHRwczovL3d3dy5iZW56aW5nYS5jb20vcHJlc3NyZWxlYXNlcy8yMy8wOS8zNDQyNjE5My9jbG91ZC1iYXNlZC12aWRlby1jb25mZXJlbmNpbmctbWFya2V0LWdyb3d0aC1hbmFseXNpcy0yMDIzLWV4cGxvcmluZy10aGUtbGF0ZXN0LWluZHVzdHJ5LXRyZW5kcy1hbmTSAS1odHRwczovL3d3dy5iZW56aW5nYS5jb20vYW1wL2NvbnRlbnQvMzQ0MjYxOTM?hl=en-IN&gl=IN&ceid=IN%3Aen,2023-09-11
30,Enterprise Networking Market Dynamics: Current State and Future Prospects in 2030,Benzinga,news.google.com/articles/CBMihgFodHRwczovL3d3dy5iZW56aW5nYS5jb20vcHJlc3NyZWxlYXNlcy8yMy8wOS8zNDQyNDUyOS9lbnRlcnByaXNlLW5ldHdvcmtpbmctbWFya2V0LWR5bmFtaWNzLWN1cnJlbnQtc3RhdGUtYW5kLWZ1dHVyZS1wcm9zcGVjdHMtaW4tMjAzMNIBLWh0dHBzOi8vd3d3LmJlbnppbmdhLmNvbS9hbXAvY29udGVudC8zNDQyNDUyOQ?hl=en-IN&gl=IN&ceid=IN%3Aen,2023-09-11
10,5 reasons digital signage is better than email,Digital Signage Today,news.google.com/articles/CBMiWWh0dHBzOi8vd3d3LmRpZ2l0YWxzaWduYWdldG9kYXkuY29tL2Jsb2dzLzUtcmVhc29ucy1kaWdpdGFsLXNpZ25hZ2UtaXMtYmV0dGVyLXRoYW4tZW1haWwv0gEA?hl=en-IN&gl=IN&ceid=IN%3Aen,2023-09-11
69,Analyzing the AC Power Connectors Market Size Outlook and Forecast: Industry Growth and Revenue Trends wi,Benzinga,news.google.com/articles/CBMimQFodHRwczovL3d3dy5iZW56aW5nYS5jb20vcHJlc3NyZWxlYXNlcy8yMy8wOS8zNDQwMzUyNC9hbmFseXppbmctdGhlLWFjLXBvd2VyLWNvbm5lY3RvcnMtbWFya2V0LXNpemUtb3V0bG9vay1hbmQtZm9yZWNhc3QtaW5kdXN0cnktZ3Jvd3RoLWFuZC1yZXZlbnVlLXRyZW7SAS1odHRwczovL3d3dy5iZW56aW5nYS5jb20vYW1wL2NvbnRlbnQvMzQ0MDM1MjQ?hl=en-IN&gl=IN&ceid=IN%3Aen,2023-09-10
41,"IoT Connectivity Management Platform Market Size: Growth Analysis, Future Trends and Developments by 2030",Benzinga,news.google.com/articles/CBMimQFodHRwczovL3d3dy5iZW56aW5nYS5jb20vcHJlc3NyZWxlYXNlcy8yMy8wOS8zNDQxNDcxOS9pb3QtY29ubmVjdGl2aXR5LW1hbmFnZW1lbnQtcGxhdGZvcm0tbWFya2V0LXNpemUtZ3Jvd3RoLWFuYWx5c2lzLWZ1dHVyZS10cmVuZHMtYW5kLWRldmVsb3BtZW50cy1ieS3SAS1odHRwczovL3d3dy5iZW56aW5nYS5jb20vYW1wL2NvbnRlbnQvMzQ0MTQ3MTk?hl=en-IN&gl=IN&ceid=IN%3Aen,2023-09-10
39,Former beer volunteers now chairing Food Truck Festival,Northwest Arkansas Democrat-Gazette,news.google.com/articles/CBMiY2h0dHBzOi8vd3d3Lm53YW9ubGluZS5jb20vbmV3cy8yMDIzL3NlcC8xMC9mb3JtZXItYmVlci12b2x1bnRlZXJzLW5vdy1jaGFpcmluZy1mb29kLXRydWNrLz9mZWF0dXJlc9IBAA?hl=en-IN&gl=IN&ceid=IN%3Aen,2023-09-10
