,title,source,link,date
10,"‘Ensuring Safety, Reliability Of Embedded Systems Are Critical’",Mobility Outlook,news.google.com/articles/CBMia2h0dHBzOi8vd3d3Lm1vYmlsaXR5b3V0bG9vay5jb20vY29udmVyc2F0aW9ucy9lbnN1cmluZy1zYWZldHktcmVsaWFiaWxpdHktb2YtZW1iZWRkZWQtc3lzdGVtcy1hcmUtY3JpdGljYWwv0gEA?hl=en-IN&gl=IN&ceid=IN%3Aen,2023-10-21
34,‘Nigeria can fortify its financial sector against relentless onslaught of Cyber threats’,Guardian Nigeria,news.google.com/articles/CBMidWh0dHBzOi8vZ3VhcmRpYW4ubmcvaW50ZXJ2aWV3L25pZ2VyaWEtY2FuLWZvcnRpZnktaXRzLWZpbmFuY2lhbC1zZWN0b3ItYWdhaW5zdC1yZWxlbnRsZXNzLW9uc2xhdWdodC1vZi1jeWJlci10aHJlYXRzL9IBeGh0dHBzOi8vZ3VhcmRpYW4ubmcvaW50ZXJ2aWV3L25pZ2VyaWEtY2FuLWZvcnRpZnktaXRzLWZpbmFuY2lhbC1zZWN0b3ItYWdhaW5zdC1yZWxlbnRsZXNzLW9uc2xhdWdodC1vZi1jeWJlci10aHJlYXRzL2FtcA?hl=en-IN&gl=IN&ceid=IN%3Aen,2023-10-21
21,Chinese tech company ZTE commits to accelerating digitization of ...,Xinhua,news.google.com/articles/CBMiSGh0dHBzOi8vZW5nbGlzaC5uZXdzLmNuLzIwMjMxMDIxLzJmOGIyNWZmOTUxZDQ4NDRhYzQyNDU5ZWMwM2QwY2RhL2MuaHRtbNIBAA?hl=en-IN&gl=IN&ceid=IN%3Aen,2023-10-20
4,Streamlining group benefits communication: Key innovations ...,FinTech Global,news.google.com/articles/CBMiZ2h0dHBzOi8vZmludGVjaC5nbG9iYWwvMjAyMy8xMC8yMC9zdHJlYW1saW5pbmctZ3JvdXAtYmVuZWZpdHMtY29tbXVuaWNhdGlvbi1rZXktaW5ub3ZhdGlvbnMtc3RyYXRlZ2llcy_SAQA?hl=en-IN&gl=IN&ceid=IN%3Aen,2023-10-20
9,Sixth Committee Speakers Praise Programme of Assistance's ...,United Nations,news.google.com/articles/CBMiLGh0dHBzOi8vcHJlc3MudW4ub3JnL2VuLzIwMjMvZ2FsMzY5Ny5kb2MuaHRt0gEA?hl=en-IN&gl=IN&ceid=IN%3Aen,2023-10-20
13,"AI Roundup: No one knows what AI has taken over, AI image fans ...",Medical Economics,news.google.com/articles/CBMikAFodHRwczovL3d3dy5tZWRpY2FsZWNvbm9taWNzLmNvbS92aWV3L2FpLXJvdW5kdXAtbm8tb25lLWtub3dzLXdoYXQtYWktaGFzLXRha2VuLW92ZXItYWktaW1hZ2UtZmFucy1mbGFtZXMtb2Ytd2FyLWNoYXRncHQtbm93LWhhcy1pbnRlcm5ldC1hY2Nlc3PSAQA?hl=en-IN&gl=IN&ceid=IN%3Aen,2023-10-20
15,Land cover dataset of the China Central-Asia West-Asia Economic ...,Nature.com,news.google.com/articles/CBMiMmh0dHBzOi8vd3d3Lm5hdHVyZS5jb20vYXJ0aWNsZXMvczQxNTk3LTAyMy0wMjYyMy160gEA?hl=en-IN&gl=IN&ceid=IN%3Aen,2023-10-20
18,Official Statement from Patricia Technologies,TechCabal,news.google.com/articles/CBMiT2h0dHBzOi8vdGVjaGNhYmFsLmNvbS8yMDIzLzEwLzIwL29mZmljaWFsLXN0YXRlbWVudC1mcm9tLXBhdHJpY2lhLXRlY2hub2xvZ2llcy_SAQA?hl=en-IN&gl=IN&ceid=IN%3Aen,2023-10-20
24,Guarding the Digital Realm: Celebrating Cybersecurity Awareness ...,CXOToday.com,news.google.com/articles/CBMiaGh0dHBzOi8vd3d3LmN4b3RvZGF5LmNvbS9jeG8tYnl0ZXMvZ3VhcmRpbmctdGhlLWRpZ2l0YWwtcmVhbG0tY2VsZWJyYXRpbmctY3liZXJzZWN1cml0eS1hd2FyZW5lc3MtbW9udGgv0gEA?hl=en-IN&gl=IN&ceid=IN%3Aen,2023-10-20
26,A real-world clinical validation for AI-based MRI monitoring in ...,Nature.com,news.google.com/articles/CBMiMmh0dHBzOi8vd3d3Lm5hdHVyZS5jb20vYXJ0aWNsZXMvczQxNzQ2LTAyMy0wMDk0MC020gEA?hl=en-IN&gl=IN&ceid=IN%3Aen,2023-10-19
