,title,source,link,date
28,The Limit Switch Box market study's evaluation of the 8.6% CAGR forecasted for the Limit Switch Box indus,Benzinga,news.google.com/articles/CBMimQFodHRwczovL3d3dy5iZW56aW5nYS5jb20vcHJlc3NyZWxlYXNlcy8yMy8wOS8zNDY1OTc2MS90aGUtbGltaXQtc3dpdGNoLWJveC1tYXJrZXQtc3R1ZHlzLWV2YWx1YXRpb24tb2YtdGhlLTgtNi1jYWdyLWZvcmVjYXN0ZWQtZm9yLXRoZS1saW1pdC1zd2l0Y2gtYm94LWnSAS1odHRwczovL3d3dy5iZW56aW5nYS5jb20vYW1wL2NvbnRlbnQvMzQ2NTk3NjE?hl=en-IN&gl=IN&ceid=IN%3Aen,2023-09-17
12,"Digital Logistics Market Size: Insights into its By Types, Languages, Share, Average Selling Price, and R",Benzinga,news.google.com/articles/CBMimQFodHRwczovL3d3dy5iZW56aW5nYS5jb20vcHJlc3NyZWxlYXNlcy8yMy8wOS8zNDY1OTY2OS9kaWdpdGFsLWxvZ2lzdGljcy1tYXJrZXQtc2l6ZS1pbnNpZ2h0cy1pbnRvLWl0cy1ieS10eXBlcy1sYW5ndWFnZXMtc2hhcmUtYXZlcmFnZS1zZWxsaW5nLXByaWNlLWFuZC3SAS1odHRwczovL3d3dy5iZW56aW5nYS5jb20vYW1wL2NvbnRlbnQvMzQ2NTk2Njk?hl=en-IN&gl=IN&ceid=IN%3Aen,2023-09-17
20,The Car Night Vision System market size and share analysis provides a comprehensive understanding of the,Benzinga,news.google.com/articles/CBMimQFodHRwczovL3d3dy5iZW56aW5nYS5jb20vcHJlc3NyZWxlYXNlcy8yMy8wOS8zNDY2MDMxMC90aGUtY2FyLW5pZ2h0LXZpc2lvbi1zeXN0ZW0tbWFya2V0LXNpemUtYW5kLXNoYXJlLWFuYWx5c2lzLXByb3ZpZGVzLWEtY29tcHJlaGVuc2l2ZS11bmRlcnN0YW5kaW5nLW_SAS1odHRwczovL3d3dy5iZW56aW5nYS5jb20vYW1wL2NvbnRlbnQvMzQ2NjAzMTA?hl=en-IN&gl=IN&ceid=IN%3Aen,2023-09-17
21,"Driven Axle market size with the Outlook of CAGR rate 10.9% for Period 2023-2030, Provides a market overv",Benzinga,news.google.com/articles/CBMimQFodHRwczovL3d3dy5iZW56aW5nYS5jb20vcHJlc3NyZWxlYXNlcy8yMy8wOS8zNDY2MTk2MS9kcml2ZW4tYXhsZS1tYXJrZXQtc2l6ZS13aXRoLXRoZS1vdXRsb29rLW9mLWNhZ3ItcmF0ZS0xMC05LWZvci1wZXJpb2QtMjAyMy0yMDMwLXByb3ZpZGVzLWEtbWFya2V0LW_SAS1odHRwczovL3d3dy5iZW56aW5nYS5jb20vYW1wL2NvbnRlbnQvMzQ2NjE5NjE?hl=en-IN&gl=IN&ceid=IN%3Aen,2023-09-17
22,This report projects that the global Conference Room Solutions market will grow at a CAGR of 13.9% during,Benzinga,news.google.com/articles/CBMimQFodHRwczovL3d3dy5iZW56aW5nYS5jb20vcHJlc3NyZWxlYXNlcy8yMy8wOS8zNDY1OTY3Ni90aGlzLXJlcG9ydC1wcm9qZWN0cy10aGF0LXRoZS1nbG9iYWwtY29uZmVyZW5jZS1yb29tLXNvbHV0aW9ucy1tYXJrZXQtd2lsbC1ncm93LWF0LWEtY2Fnci1vZi0xMy05LWTSAS1odHRwczovL3d3dy5iZW56aW5nYS5jb20vYW1wL2NvbnRlbnQvMzQ2NTk2NzY?hl=en-IN&gl=IN&ceid=IN%3Aen,2023-09-17
23,"Fuel Cell Forklift market size grows yearly at a CAGR of 9.6% with market revenue, trends, cost of goods,",Benzinga,news.google.com/articles/CBMimQFodHRwczovL3d3dy5iZW56aW5nYS5jb20vcHJlc3NyZWxlYXNlcy8yMy8wOS8zNDY2MDM0My9mdWVsLWNlbGwtZm9ya2xpZnQtbWFya2V0LXNpemUtZ3Jvd3MteWVhcmx5LWF0LWEtY2Fnci1vZi05LTYtd2l0aC1tYXJrZXQtcmV2ZW51ZS10cmVuZHMtY29zdC1vZi1nb2_SAS1odHRwczovL3d3dy5iZW56aW5nYS5jb20vYW1wL2NvbnRlbnQvMzQ2NjAzNDM?hl=en-IN&gl=IN&ceid=IN%3Aen,2023-09-17
24,The report highlights the projected CAGR value of 16% for the Mentoring Software market size from 2023 to,Benzinga,news.google.com/articles/CBMimQFodHRwczovL3d3dy5iZW56aW5nYS5jb20vcHJlc3NyZWxlYXNlcy8yMy8wOS8zNDY1OTcxNy90aGUtcmVwb3J0LWhpZ2hsaWdodHMtdGhlLXByb2plY3RlZC1jYWdyLXZhbHVlLW9mLTE2LWZvci10aGUtbWVudG9yaW5nLXNvZnR3YXJlLW1hcmtldC1zaXplLWZyb20tMjDSAS1odHRwczovL3d3dy5iZW56aW5nYS5jb20vYW1wL2NvbnRlbnQvMzQ2NTk3MTc?hl=en-IN&gl=IN&ceid=IN%3Aen,2023-09-17
29,"A Complete Investigation of the Steering Wheel Switch Market and its Projected CAGR of 6.5%, Market Const",Benzinga,news.google.com/articles/CBMimQFodHRwczovL3d3dy5iZW56aW5nYS5jb20vcHJlc3NyZWxlYXNlcy8yMy8wOS8zNDY1MTU5MS9hLWNvbXBsZXRlLWludmVzdGlnYXRpb24tb2YtdGhlLXN0ZWVyaW5nLXdoZWVsLXN3aXRjaC1tYXJrZXQtYW5kLWl0cy1wcm9qZWN0ZWQtY2Fnci1vZi02LTUtbWFya2V0LWPSAS1odHRwczovL3d3dy5iZW56aW5nYS5jb20vYW1wL2NvbnRlbnQvMzQ2NTE1OTE?hl=en-IN&gl=IN&ceid=IN%3Aen,2023-09-16
66,"Detailed Artificial Intelligence in Aviation Market: Market Size, Share, Trends, and Revenue Generation f",Benzinga,news.google.com/articles/CBMimQFodHRwczovL3d3dy5iZW56aW5nYS5jb20vcHJlc3NyZWxlYXNlcy8yMy8wOS8zNDY0OTc4NC9kZXRhaWxlZC1hcnRpZmljaWFsLWludGVsbGlnZW5jZS1pbi1hdmlhdGlvbi1tYXJrZXQtbWFya2V0LXNpemUtc2hhcmUtdHJlbmRzLWFuZC1yZXZlbnVlLWdlbmVyYXRpb27SAS1odHRwczovL3d3dy5iZW56aW5nYS5jb20vYW1wL2NvbnRlbnQvMzQ2NDk3ODQ?hl=en-IN&gl=IN&ceid=IN%3Aen,2023-09-16
36,Temperature and Humidity Loggers market research report emphasises vital information on the financial ove,Benzinga,news.google.com/articles/CBMimQFodHRwczovL3d3dy5iZW56aW5nYS5jb20vcHJlc3NyZWxlYXNlcy8yMy8wOS8zNDY1NTAxNi90ZW1wZXJhdHVyZS1hbmQtaHVtaWRpdHktbG9nZ2Vycy1tYXJrZXQtcmVzZWFyY2gtcmVwb3J0LWVtcGhhc2lzZXMtdml0YWwtaW5mb3JtYXRpb24tb24tdGhlLWZpbmFuY2nSAS1odHRwczovL3d3dy5iZW56aW5nYS5jb20vYW1wL2NvbnRlbnQvMzQ2NTUwMTY?hl=en-IN&gl=IN&ceid=IN%3Aen,2023-09-16
