,title,source,link,date
18,The research on the Wavelength Selective Switch WSS Modules market gives an overview of the industry's co,Benzinga,news.google.com/articles/CBMimQFodHRwczovL3d3dy5iZW56aW5nYS5jb20vcHJlc3NyZWxlYXNlcy8yMy8wOS8zNDE5MjE4Ny90aGUtcmVzZWFyY2gtb24tdGhlLXdhdmVsZW5ndGgtc2VsZWN0aXZlLXN3aXRjaC13c3MtbW9kdWxlcy1tYXJrZXQtZ2l2ZXMtYW4tb3ZlcnZpZXctb2YtdGhlLWluZHVzdHLSAS1odHRwczovL3d3dy5iZW56aW5nYS5jb20vYW1wL2NvbnRlbnQvMzQxOTIxODc?hl=en-IN&gl=IN&ceid=IN%3Aen,2023-09-03
25,Navigating the Application Specific IC ASIC Market Growth Outlook by market Trends and market size Using,Benzinga,news.google.com/articles/CBMimQFodHRwczovL3d3dy5iZW56aW5nYS5jb20vcHJlc3NyZWxlYXNlcy8yMy8wOS8zNDE4ODgwOS9uYXZpZ2F0aW5nLXRoZS1hcHBsaWNhdGlvbi1zcGVjaWZpYy1pYy1hc2ljLW1hcmtldC1ncm93dGgtb3V0bG9vay1ieS1tYXJrZXQtdHJlbmRzLWFuZC1tYXJrZXQtc2l6ZS3SAS1odHRwczovL3d3dy5iZW56aW5nYS5jb20vYW1wL2NvbnRlbnQvMzQxODg4MDk?hl=en-IN&gl=IN&ceid=IN%3Aen,2023-09-02
23,A Boom on the Horizon: Tow Truck Body Market forecast from 2023 till 2030 with a CAGR of 5.7% By End-Use,Benzinga,news.google.com/articles/CBMimQFodHRwczovL3d3dy5iZW56aW5nYS5jb20vcHJlc3NyZWxlYXNlcy8yMy8wOS8zNDE4OTk3Ni9hLWJvb20tb24tdGhlLWhvcml6b24tdG93LXRydWNrLWJvZHktbWFya2V0LWZvcmVjYXN0LWZyb20tMjAyMy10aWxsLTIwMzAtd2l0aC1hLWNhZ3Itb2YtNS03LWJ5LWVuZC3SAS1odHRwczovL3d3dy5iZW56aW5nYS5jb20vYW1wL2NvbnRlbnQvMzQxODk5NzY?hl=en-IN&gl=IN&ceid=IN%3Aen,2023-09-02
34,Hydraulic Flange Spreaders Market Size with projected CAGR rate 11.8% discusses future development possib,Benzinga,news.google.com/articles/CBMimQFodHRwczovL3d3dy5iZW56aW5nYS5jb20vcHJlc3NyZWxlYXNlcy8yMy8wOS8zNDE5MDQ5MC9oeWRyYXVsaWMtZmxhbmdlLXNwcmVhZGVycy1tYXJrZXQtc2l6ZS13aXRoLXByb2plY3RlZC1jYWdyLXJhdGUtMTEtOC1kaXNjdXNzZXMtZnV0dXJlLWRldmVsb3BtZW50LXDSAS1odHRwczovL3d3dy5iZW56aW5nYS5jb20vYW1wL2NvbnRlbnQvMzQxOTA0OTA?hl=en-IN&gl=IN&ceid=IN%3Aen,2023-09-02
33,"Ceramic Brackets research report with an impressive CAGR rate 9% for Period 2023-2030, investigates the i",Benzinga,news.google.com/articles/CBMimQFodHRwczovL3d3dy5iZW56aW5nYS5jb20vcHJlc3NyZWxlYXNlcy8yMy8wOS8zNDE5MDYzMy9jZXJhbWljLWJyYWNrZXRzLXJlc2VhcmNoLXJlcG9ydC13aXRoLWFuLWltcHJlc3NpdmUtY2Fnci1yYXRlLTktZm9yLXBlcmlvZC0yMDIzLTIwMzAtaW52ZXN0aWdhdGVzLXTSAS1odHRwczovL3d3dy5iZW56aW5nYS5jb20vYW1wL2NvbnRlbnQvMzQxOTA2MzM?hl=en-IN&gl=IN&ceid=IN%3Aen,2023-09-02
30,In-Depth Report on the Automotive Memory Seat Industry: Market Trends and Growth Drivers with expected CA,Benzinga,news.google.com/articles/CBMimQFodHRwczovL3d3dy5iZW56aW5nYS5jb20vcHJlc3NyZWxlYXNlcy8yMy8wOS8zNDE4NjkxMC9pbi1kZXB0aC1yZXBvcnQtb24tdGhlLWF1dG9tb3RpdmUtbWVtb3J5LXNlYXQtaW5kdXN0cnktbWFya2V0LXRyZW5kcy1hbmQtZ3Jvd3RoLWRyaXZlcnMtd2l0aC1leHBlY3TSAS1odHRwczovL3d3dy5iZW56aW5nYS5jb20vYW1wL2NvbnRlbnQvMzQxODY5MTA?hl=en-IN&gl=IN&ceid=IN%3Aen,2023-09-02
28,"To comprehend the Automotive Navigation Systems market size, which is growing at a CAGR of 5.9% annually,",Benzinga,news.google.com/articles/CBMimQFodHRwczovL3d3dy5iZW56aW5nYS5jb20vcHJlc3NyZWxlYXNlcy8yMy8wOS8zNDE4Njk1OS90by1jb21wcmVoZW5kLXRoZS1hdXRvbW90aXZlLW5hdmlnYXRpb24tc3lzdGVtcy1tYXJrZXQtc2l6ZS13aGljaC1pcy1ncm93aW5nLWF0LWEtY2Fnci1vZi01LTktYW5udWHSAS1odHRwczovL3d3dy5iZW56aW5nYS5jb20vYW1wL2NvbnRlbnQvMzQxODY5NTk?hl=en-IN&gl=IN&ceid=IN%3Aen,2023-09-02
27,"Drone Goggles Market Analysis Report: Regional development, By Deployment, Growth Factor, and Market Size",Benzinga,news.google.com/articles/CBMimQFodHRwczovL3d3dy5iZW56aW5nYS5jb20vcHJlc3NyZWxlYXNlcy8yMy8wOS8zNDE4OTMzOC9kcm9uZS1nb2dnbGVzLW1hcmtldC1hbmFseXNpcy1yZXBvcnQtcmVnaW9uYWwtZGV2ZWxvcG1lbnQtYnktZGVwbG95bWVudC1ncm93dGgtZmFjdG9yLWFuZC1tYXJrZXQtc2nSAS1odHRwczovL3d3dy5iZW56aW5nYS5jb20vYW1wL2NvbnRlbnQvMzQxODkzMzg?hl=en-IN&gl=IN&ceid=IN%3Aen,2023-09-02
38,A brief description on Drone Ground Station market with a projected CAGR of 4.8% in a specific geographi,Benzinga,news.google.com/articles/CBMimQFodHRwczovL3d3dy5iZW56aW5nYS5jb20vcHJlc3NyZWxlYXNlcy8yMy8wOS8zNDE4OTMzNi9hLWJyaWVmLWRlc2NyaXB0aW9uLW9uLWRyb25lLWdyb3VuZC1zdGF0aW9uLW1hcmtldC13aXRoLWEtcHJvamVjdGVkLWNhZ3Itb2YtNC04LWluLWEtc3BlY2lmaWMtZ2VvZ3LSAS1odHRwczovL3d3dy5iZW56aW5nYS5jb20vYW1wL2NvbnRlbnQvMzQxODkzMzY?hl=en-IN&gl=IN&ceid=IN%3Aen,2023-09-02
24,Generate Revenue and Research Insights with UAV Flight Control Technology Market Size Report from 2023 to,Benzinga,news.google.com/articles/CBMimQFodHRwczovL3d3dy5iZW56aW5nYS5jb20vcHJlc3NyZWxlYXNlcy8yMy8wOS8zNDE4OTYzNy9nZW5lcmF0ZS1yZXZlbnVlLWFuZC1yZXNlYXJjaC1pbnNpZ2h0cy13aXRoLXVhdi1mbGlnaHQtY29udHJvbC10ZWNobm9sb2d5LW1hcmtldC1zaXplLXJlcG9ydC1mcm9tLTLSAS1odHRwczovL3d3dy5iZW56aW5nYS5jb20vYW1wL2NvbnRlbnQvMzQxODk2Mzc?hl=en-IN&gl=IN&ceid=IN%3Aen,2023-09-02
