,title,source,link,date
10,"Halal Logistics Market Size: Growth Factor, Global Revenue, Competitive Strategies, and Production Cost a",Benzinga,news.google.com/articles/CBMimQFodHRwczovL3d3dy5iZW56aW5nYS5jb20vcHJlc3NyZWxlYXNlcy8yMy8wOS8zNDE5MjgwMy9oYWxhbC1sb2dpc3RpY3MtbWFya2V0LXNpemUtZ3Jvd3RoLWZhY3Rvci1nbG9iYWwtcmV2ZW51ZS1jb21wZXRpdGl2ZS1zdHJhdGVnaWVzLWFuZC1wcm9kdWN0aW9uLWNvc3TSAS1odHRwczovL3d3dy5iZW56aW5nYS5jb20vYW1wL2NvbnRlbnQvMzQxOTI4MDM?hl=en-IN&gl=IN&ceid=IN%3Aen,2023-09-03
17,Low Dropout Linear Regulator market analysis study provides a thorough examination of the strategies adop,Benzinga,news.google.com/articles/CBMimQFodHRwczovL3d3dy5iZW56aW5nYS5jb20vcHJlc3NyZWxlYXNlcy8yMy8wOS8zNDE5MzAxOC9sb3ctZHJvcG91dC1saW5lYXItcmVndWxhdG9yLW1hcmtldC1hbmFseXNpcy1zdHVkeS1wcm92aWRlcy1hLXRob3JvdWdoLWV4YW1pbmF0aW9uLW9mLXRoZS1zdHJhdGVnaWXSAS1odHRwczovL3d3dy5iZW56aW5nYS5jb20vYW1wL2NvbnRlbnQvMzQxOTMwMTg?hl=en-IN&gl=IN&ceid=IN%3Aen,2023-09-03
18,"The growth of the Microohmmeters market size is expected to reach CAGR of 8.2% from 2023 to 2030, combine",Benzinga,news.google.com/articles/CBMimQFodHRwczovL3d3dy5iZW56aW5nYS5jb20vcHJlc3NyZWxlYXNlcy8yMy8wOS8zNDE5MjkzNS90aGUtZ3Jvd3RoLW9mLXRoZS1taWNyb29obW1ldGVycy1tYXJrZXQtc2l6ZS1pcy1leHBlY3RlZC10by1yZWFjaC1jYWdyLW9mLTgtMi1mcm9tLTIwMjMtdG8tMjAzMC1jb23SAS1odHRwczovL3d3dy5iZW56aW5nYS5jb20vYW1wL2NvbnRlbnQvMzQxOTI5MzU?hl=en-IN&gl=IN&ceid=IN%3Aen,2023-09-03
20,Metal and Hard Mask Etch System Market Size with projected CAGR rate 4.7% discusses future development po,Benzinga,news.google.com/articles/CBMimQFodHRwczovL3d3dy5iZW56aW5nYS5jb20vcHJlc3NyZWxlYXNlcy8yMy8wOS8zNDE5MjYzNy9tZXRhbC1hbmQtaGFyZC1tYXNrLWV0Y2gtc3lzdGVtLW1hcmtldC1zaXplLXdpdGgtcHJvamVjdGVkLWNhZ3ItcmF0ZS00LTctZGlzY3Vzc2VzLWZ1dHVyZS1kZXZlbG9wbWXSAS1odHRwczovL3d3dy5iZW56aW5nYS5jb20vYW1wL2NvbnRlbnQvMzQxOTI2Mzc?hl=en-IN&gl=IN&ceid=IN%3Aen,2023-09-03
21,The research on the Wavelength Selective Switch WSS Modules market gives an overview of the industry's co,Benzinga,news.google.com/articles/CBMimQFodHRwczovL3d3dy5iZW56aW5nYS5jb20vcHJlc3NyZWxlYXNlcy8yMy8wOS8zNDE5MjE4Ny90aGUtcmVzZWFyY2gtb24tdGhlLXdhdmVsZW5ndGgtc2VsZWN0aXZlLXN3aXRjaC13c3MtbW9kdWxlcy1tYXJrZXQtZ2l2ZXMtYW4tb3ZlcnZpZXctb2YtdGhlLWluZHVzdHLSAS1odHRwczovL3d3dy5iZW56aW5nYS5jb20vYW1wL2NvbnRlbnQvMzQxOTIxODc?hl=en-IN&gl=IN&ceid=IN%3Aen,2023-09-03
22,Commercial Vehicle Mirror Market Analysis and Market Size with a ...,Benzinga,news.google.com/articles/CBMimQFodHRwczovL3d3dy5iZW56aW5nYS5jb20vcHJlc3NyZWxlYXNlcy8yMy8wOS8zNDE5Mzk4NC9jb21tZXJjaWFsLXZlaGljbGUtbWlycm9yLW1hcmtldC1hbmFseXNpcy1hbmQtbWFya2V0LXNpemUtd2l0aC1hLXN0cmlraW5nLWNhZ3Itb2YtNC0yLWZvcmVjYXN0ZWQtZnLSAQA?hl=en-IN&gl=IN&ceid=IN%3Aen,2023-09-03
26,"Comprehensive analysis of the Sun Visor Monitors market size, share, and revenue is anticipated to increa",Benzinga,news.google.com/articles/CBMimQFodHRwczovL3d3dy5iZW56aW5nYS5jb20vcHJlc3NyZWxlYXNlcy8yMy8wOS8zNDE5MDYzMC9jb21wcmVoZW5zaXZlLWFuYWx5c2lzLW9mLXRoZS1zdW4tdmlzb3ItbW9uaXRvcnMtbWFya2V0LXNpemUtc2hhcmUtYW5kLXJldmVudWUtaXMtYW50aWNpcGF0ZWQtdG8taW7SAS1odHRwczovL3d3dy5iZW56aW5nYS5jb20vYW1wL2NvbnRlbnQvMzQxOTA2MzA?hl=en-IN&gl=IN&ceid=IN%3Aen,2023-09-02
27,Navigating the Application Specific IC ASIC Market Growth Outlook by market Trends and market size Using,Benzinga,news.google.com/articles/CBMimQFodHRwczovL3d3dy5iZW56aW5nYS5jb20vcHJlc3NyZWxlYXNlcy8yMy8wOS8zNDE4ODgwOS9uYXZpZ2F0aW5nLXRoZS1hcHBsaWNhdGlvbi1zcGVjaWZpYy1pYy1hc2ljLW1hcmtldC1ncm93dGgtb3V0bG9vay1ieS1tYXJrZXQtdHJlbmRzLWFuZC1tYXJrZXQtc2l6ZS3SAS1odHRwczovL3d3dy5iZW56aW5nYS5jb20vYW1wL2NvbnRlbnQvMzQxODg4MDk?hl=en-IN&gl=IN&ceid=IN%3Aen,2023-09-02
38,"Ceramic Brackets research report with an impressive CAGR rate 9% for Period 2023-2030, investigates the i",Benzinga,news.google.com/articles/CBMimQFodHRwczovL3d3dy5iZW56aW5nYS5jb20vcHJlc3NyZWxlYXNlcy8yMy8wOS8zNDE5MDYzMy9jZXJhbWljLWJyYWNrZXRzLXJlc2VhcmNoLXJlcG9ydC13aXRoLWFuLWltcHJlc3NpdmUtY2Fnci1yYXRlLTktZm9yLXBlcmlvZC0yMDIzLTIwMzAtaW52ZXN0aWdhdGVzLXTSAS1odHRwczovL3d3dy5iZW56aW5nYS5jb20vYW1wL2NvbnRlbnQvMzQxOTA2MzM?hl=en-IN&gl=IN&ceid=IN%3Aen,2023-09-02
34,In-Depth Report on the Automotive Memory Seat Industry: Market Trends and Growth Drivers with expected CA,Benzinga,news.google.com/articles/CBMimQFodHRwczovL3d3dy5iZW56aW5nYS5jb20vcHJlc3NyZWxlYXNlcy8yMy8wOS8zNDE4NjkxMC9pbi1kZXB0aC1yZXBvcnQtb24tdGhlLWF1dG9tb3RpdmUtbWVtb3J5LXNlYXQtaW5kdXN0cnktbWFya2V0LXRyZW5kcy1hbmQtZ3Jvd3RoLWRyaXZlcnMtd2l0aC1leHBlY3TSAS1odHRwczovL3d3dy5iZW56aW5nYS5jb20vYW1wL2NvbnRlbnQvMzQxODY5MTA?hl=en-IN&gl=IN&ceid=IN%3Aen,2023-09-02
