,title,source,link,date
55,"The Air Cushion Machine market report offers accurate data on market size, share, volume, and growth poss",Benzinga,news.google.com/articles/CBMimQFodHRwczovL3d3dy5iZW56aW5nYS5jb20vcHJlc3NyZWxlYXNlcy8yMy8wOS8zNDYzNzQwNy90aGUtYWlyLWN1c2hpb24tbWFjaGluZS1tYXJrZXQtcmVwb3J0LW9mZmVycy1hY2N1cmF0ZS1kYXRhLW9uLW1hcmtldC1zaXplLXNoYXJlLXZvbHVtZS1hbmQtZ3Jvd3RoLXDSAS1odHRwczovL3d3dy5iZW56aW5nYS5jb20vYW1wL2NvbnRlbnQvMzQ2Mzc0MDc?hl=en-IN&gl=IN&ceid=IN%3Aen,2023-09-16
17,"A Complete Investigation of the Steering Wheel Switch Market and its Projected CAGR of 6.5%, Market Const",Benzinga,news.google.com/articles/CBMimQFodHRwczovL3d3dy5iZW56aW5nYS5jb20vcHJlc3NyZWxlYXNlcy8yMy8wOS8zNDY1MTU5MS9hLWNvbXBsZXRlLWludmVzdGlnYXRpb24tb2YtdGhlLXN0ZWVyaW5nLXdoZWVsLXN3aXRjaC1tYXJrZXQtYW5kLWl0cy1wcm9qZWN0ZWQtY2Fnci1vZi02LTUtbWFya2V0LWPSAS1odHRwczovL3d3dy5iZW56aW5nYS5jb20vYW1wL2NvbnRlbnQvMzQ2NTE1OTE?hl=en-IN&gl=IN&ceid=IN%3Aen,2023-09-16
18,"The Integrated Scanner market is projected to expand at a CAGR of 6.1% until 2030, according to the thoro",Benzinga,news.google.com/articles/CBMimQFodHRwczovL3d3dy5iZW56aW5nYS5jb20vcHJlc3NyZWxlYXNlcy8yMy8wOS8zNDYzOTQ1MC90aGUtaW50ZWdyYXRlZC1zY2FubmVyLW1hcmtldC1pcy1wcm9qZWN0ZWQtdG8tZXhwYW5kLWF0LWEtY2Fnci1vZi02LTEtdW50aWwtMjAzMC1hY2NvcmRpbmctdG8tdGhlLXTSAS1odHRwczovL3d3dy5iZW56aW5nYS5jb20vYW1wL2NvbnRlbnQvMzQ2Mzk0NTA?hl=en-IN&gl=IN&ceid=IN%3Aen,2023-09-16
19,Boom Cranes market Outlook: Forecasting Market Value and Revenue with an expected CAGR value of 12.3% per,Benzinga,news.google.com/articles/CBMimQFodHRwczovL3d3dy5iZW56aW5nYS5jb20vcHJlc3NyZWxlYXNlcy8yMy8wOS8zNDY1MTUzOS9ib29tLWNyYW5lcy1tYXJrZXQtb3V0bG9vay1mb3JlY2FzdGluZy1tYXJrZXQtdmFsdWUtYW5kLXJldmVudWUtd2l0aC1hbi1leHBlY3RlZC1jYWdyLXZhbHVlLW9mLTEyLTPSAS1odHRwczovL3d3dy5iZW56aW5nYS5jb20vYW1wL2NvbnRlbnQvMzQ2NTE1Mzk?hl=en-IN&gl=IN&ceid=IN%3Aen,2023-09-16
23,"The Monobloc Engine market's size, share, and revenue will be closely analyzed, with an anticipated CAGR",Benzinga,news.google.com/articles/CBMimQFodHRwczovL3d3dy5iZW56aW5nYS5jb20vcHJlc3NyZWxlYXNlcy8yMy8wOS8zNDY0OTY4My90aGUtbW9ub2Jsb2MtZW5naW5lLW1hcmtldHMtc2l6ZS1zaGFyZS1hbmQtcmV2ZW51ZS13aWxsLWJlLWNsb3NlbHktYW5hbHl6ZWQtd2l0aC1hbi1hbnRpY2lwYXRlZC1jYWfSAS1odHRwczovL3d3dy5iZW56aW5nYS5jb20vYW1wL2NvbnRlbnQvMzQ2NDk2ODM?hl=en-IN&gl=IN&ceid=IN%3Aen,2023-09-16
24,Temperature and Humidity Loggers market research report emphasises vital information on the financial ove,Benzinga,news.google.com/articles/CBMimQFodHRwczovL3d3dy5iZW56aW5nYS5jb20vcHJlc3NyZWxlYXNlcy8yMy8wOS8zNDY1NTAxNi90ZW1wZXJhdHVyZS1hbmQtaHVtaWRpdHktbG9nZ2Vycy1tYXJrZXQtcmVzZWFyY2gtcmVwb3J0LWVtcGhhc2lzZXMtdml0YWwtaW5mb3JtYXRpb24tb24tdGhlLWZpbmFuY2nSAS1odHRwczovL3d3dy5iZW56aW5nYS5jb20vYW1wL2NvbnRlbnQvMzQ2NTUwMTY?hl=en-IN&gl=IN&ceid=IN%3Aen,2023-09-16
42,Auctioning for Success: A Comprehensive Analysis of the Growing Global Gas Distribution Systems Market si,Benzinga,news.google.com/articles/CBMimQFodHRwczovL3d3dy5iZW56aW5nYS5jb20vcHJlc3NyZWxlYXNlcy8yMy8wOS8zNDYzODkzMS9hdWN0aW9uaW5nLWZvci1zdWNjZXNzLWEtY29tcHJlaGVuc2l2ZS1hbmFseXNpcy1vZi10aGUtZ3Jvd2luZy1nbG9iYWwtZ2FzLWRpc3RyaWJ1dGlvbi1zeXN0ZW1zLW1hcmvSAS1odHRwczovL3d3dy5iZW56aW5nYS5jb20vYW1wL2NvbnRlbnQvMzQ2Mzg5MzE?hl=en-IN&gl=IN&ceid=IN%3Aen,2023-09-16
31,"Detailed Artificial Intelligence in Aviation Market: Market Size, Share, Trends, and Revenue Generation f",Benzinga,news.google.com/articles/CBMimQFodHRwczovL3d3dy5iZW56aW5nYS5jb20vcHJlc3NyZWxlYXNlcy8yMy8wOS8zNDY0OTc4NC9kZXRhaWxlZC1hcnRpZmljaWFsLWludGVsbGlnZW5jZS1pbi1hdmlhdGlvbi1tYXJrZXQtbWFya2V0LXNpemUtc2hhcmUtdHJlbmRzLWFuZC1yZXZlbnVlLWdlbmVyYXRpb27SAS1odHRwczovL3d3dy5iZW56aW5nYS5jb20vYW1wL2NvbnRlbnQvMzQ2NDk3ODQ?hl=en-IN&gl=IN&ceid=IN%3Aen,2023-09-16
33,Heavy Equipment Tracking Device market Analysis and Revenue Forecast: Exploring Growth Opportunities grow,Benzinga,news.google.com/articles/CBMimQFodHRwczovL3d3dy5iZW56aW5nYS5jb20vcHJlc3NyZWxlYXNlcy8yMy8wOS8zNDY1MDY1MC9oZWF2eS1lcXVpcG1lbnQtdHJhY2tpbmctZGV2aWNlLW1hcmtldC1hbmFseXNpcy1hbmQtcmV2ZW51ZS1mb3JlY2FzdC1leHBsb3JpbmctZ3Jvd3RoLW9wcG9ydHVuaXRpZXPSAS1odHRwczovL3d3dy5iZW56aW5nYS5jb20vYW1wL2NvbnRlbnQvMzQ2NTA2NTA?hl=en-IN&gl=IN&ceid=IN%3Aen,2023-09-16
29,"Service Lorry Market Analysis and Global Opportunities: Identifying Market Players, Driving Factors and m",Benzinga,news.google.com/articles/CBMimQFodHRwczovL3d3dy5iZW56aW5nYS5jb20vcHJlc3NyZWxlYXNlcy8yMy8wOS8zNDYzNjI5OS9zZXJ2aWNlLWxvcnJ5LW1hcmtldC1hbmFseXNpcy1hbmQtZ2xvYmFsLW9wcG9ydHVuaXRpZXMtaWRlbnRpZnlpbmctbWFya2V0LXBsYXllcnMtZHJpdmluZy1mYWN0b3JzLWHSAS1odHRwczovL3d3dy5iZW56aW5nYS5jb20vYW1wL2NvbnRlbnQvMzQ2MzYyOTk?hl=en-IN&gl=IN&ceid=IN%3Aen,2023-09-15
