,title,source,link,date
19,A Comprehensive report on Handheld GPS Device Market explore market growth along with a CAGR Projected of,Benzinga,news.google.com/articles/CBMimQFodHRwczovL3d3dy5iZW56aW5nYS5jb20vcHJlc3NyZWxlYXNlcy8yMy8wOS8zNDYxNTAyMy9hLWNvbXByZWhlbnNpdmUtcmVwb3J0LW9uLWhhbmRoZWxkLWdwcy1kZXZpY2UtbWFya2V0LWV4cGxvcmUtbWFya2V0LWdyb3d0aC1hbG9uZy13aXRoLWEtY2Fnci1wcm9qZWPSAS1odHRwczovL3d3dy5iZW56aW5nYS5jb20vYW1wL2NvbnRlbnQvMzQ2MTUwMjM?hl=en-IN&gl=IN&ceid=IN%3Aen,2023-09-15
21,"GaAs RF Switch Market Size anticiapted to grow with a CAGR of 12.7%: Production Cost, Top Key Players, Se",Benzinga,news.google.com/articles/CBMimQFodHRwczovL3d3dy5iZW56aW5nYS5jb20vcHJlc3NyZWxlYXNlcy8yMy8wOS8zNDYwMzE5OC9nYWFzLXJmLXN3aXRjaC1tYXJrZXQtc2l6ZS1hbnRpY2lhcHRlZC10by1ncm93LXdpdGgtYS1jYWdyLW9mLTEyLTctcHJvZHVjdGlvbi1jb3N0LXRvcC1rZXktcGxheWVycy3SAS1odHRwczovL3d3dy5iZW56aW5nYS5jb20vYW1wL2NvbnRlbnQvMzQ2MDMxOTg?hl=en-IN&gl=IN&ceid=IN%3Aen,2023-09-15
23,The Herbicides Safener market study's evaluation of the 13.2% CAGR forecasted for the Herbicides Safener,Benzinga,news.google.com/articles/CBMimQFodHRwczovL3d3dy5iZW56aW5nYS5jb20vcHJlc3NyZWxlYXNlcy8yMy8wOS8zNDYwNDA4NS90aGUtaGVyYmljaWRlcy1zYWZlbmVyLW1hcmtldC1zdHVkeXMtZXZhbHVhdGlvbi1vZi10aGUtMTMtMi1jYWdyLWZvcmVjYXN0ZWQtZm9yLXRoZS1oZXJiaWNpZGVzLXNhZmXSAS1odHRwczovL3d3dy5iZW56aW5nYS5jb20vYW1wL2NvbnRlbnQvMzQ2MDQwODU?hl=en-IN&gl=IN&ceid=IN%3Aen,2023-09-15
28,Hydraulic Chain Hoist market Analysis study provides comprehensive and in-depth insight into the products,Benzinga,news.google.com/articles/CBMimQFodHRwczovL3d3dy5iZW56aW5nYS5jb20vcHJlc3NyZWxlYXNlcy8yMy8wOS8zNDYxODU3OC9oeWRyYXVsaWMtY2hhaW4taG9pc3QtbWFya2V0LWFuYWx5c2lzLXN0dWR5LXByb3ZpZGVzLWNvbXByZWhlbnNpdmUtYW5kLWluLWRlcHRoLWluc2lnaHQtaW50by10aGUtcHLSAS1odHRwczovL3d3dy5iZW56aW5nYS5jb20vYW1wL2NvbnRlbnQvMzQ2MTg1Nzg?hl=en-IN&gl=IN&ceid=IN%3Aen,2023-09-15
31,"The Future of Dock Safety Gate Market Size Study: Analyzing Growth, Segmentation and Market Size with CAG",Benzinga,news.google.com/articles/CBMimQFodHRwczovL3d3dy5iZW56aW5nYS5jb20vcHJlc3NyZWxlYXNlcy8yMy8wOS8zNDU5MTYwMC90aGUtZnV0dXJlLW9mLWRvY2stc2FmZXR5LWdhdGUtbWFya2V0LXNpemUtc3R1ZHktYW5hbHl6aW5nLWdyb3d0aC1zZWdtZW50YXRpb24tYW5kLW1hcmtldC1zaXplLXdpdGjSAS1odHRwczovL3d3dy5iZW56aW5nYS5jb20vYW1wL2NvbnRlbnQvMzQ1OTE2MDA?hl=en-IN&gl=IN&ceid=IN%3Aen,2023-09-14
40,"Crossover Platform Market Growth Outlook: Market Size with a Rapid 4.2% CAGR Expansion, Market Share, COV",Benzinga,news.google.com/articles/CBMimQFodHRwczovL3d3dy5iZW56aW5nYS5jb20vcHJlc3NyZWxlYXNlcy8yMy8wOS8zNDU5MTYwOS9jcm9zc292ZXItcGxhdGZvcm0tbWFya2V0LWdyb3d0aC1vdXRsb29rLW1hcmtldC1zaXplLXdpdGgtYS1yYXBpZC00LTItY2Fnci1leHBhbnNpb24tbWFya2V0LXNoYXJlLWPSAS1odHRwczovL3d3dy5iZW56aW5nYS5jb20vYW1wL2NvbnRlbnQvMzQ1OTE2MDk?hl=en-IN&gl=IN&ceid=IN%3Aen,2023-09-14
35,"The OEM Scan Engine market's types, applications, and regional analysis are all thoroughly covered in thi",Benzinga,news.google.com/articles/CBMimQFodHRwczovL3d3dy5iZW56aW5nYS5jb20vcHJlc3NyZWxlYXNlcy8yMy8wOS8zNDU5NjI2OC90aGUtb2VtLXNjYW4tZW5naW5lLW1hcmtldHMtdHlwZXMtYXBwbGljYXRpb25zLWFuZC1yZWdpb25hbC1hbmFseXNpcy1hcmUtYWxsLXRob3JvdWdobHktY292ZXJlZC1pbi3SAS1odHRwczovL3d3dy5iZW56aW5nYS5jb20vYW1wL2NvbnRlbnQvMzQ1OTYyNjg?hl=en-IN&gl=IN&ceid=IN%3Aen,2023-09-14
34,"Tram Rail Market Analysis covers many critical aspect like resetting itself, post pandemic expectations a",Benzinga,news.google.com/articles/CBMimQFodHRwczovL3d3dy5iZW56aW5nYS5jb20vcHJlc3NyZWxlYXNlcy8yMy8wOS8zNDU5MTEwOC90cmFtLXJhaWwtbWFya2V0LWFuYWx5c2lzLWNvdmVycy1tYW55LWNyaXRpY2FsLWFzcGVjdC1saWtlLXJlc2V0dGluZy1pdHNlbGYtcG9zdC1wYW5kZW1pYy1leHBlY3RhdGnSAS1odHRwczovL3d3dy5iZW56aW5nYS5jb20vYW1wL2NvbnRlbnQvMzQ1OTExMDg?hl=en-IN&gl=IN&ceid=IN%3Aen,2023-09-14
29,A Boom on the Horizon: Transparent PVC Strip Curtains Market forecast from 2023 till 2030 with a CAGR of,Benzinga,news.google.com/articles/CBMimQFodHRwczovL3d3dy5iZW56aW5nYS5jb20vcHJlc3NyZWxlYXNlcy8yMy8wOS8zNDU4ODI4MC9hLWJvb20tb24tdGhlLWhvcml6b24tdHJhbnNwYXJlbnQtcHZjLXN0cmlwLWN1cnRhaW5zLW1hcmtldC1mb3JlY2FzdC1mcm9tLTIwMjMtdGlsbC0yMDMwLXdpdGgtYS1jYWfSAS1odHRwczovL3d3dy5iZW56aW5nYS5jb20vYW1wL2NvbnRlbnQvMzQ1ODgyODA?hl=en-IN&gl=IN&ceid=IN%3Aen,2023-09-14
72,"A comprehensive analysis of the Vitamin B4 market size from 2023 to 2030 has been carried out, with a foc",Benzinga,news.google.com/articles/CBMimQFodHRwczovL3d3dy5iZW56aW5nYS5jb20vcHJlc3NyZWxlYXNlcy8yMy8wOS8zNDUyNDAzOS9hLWNvbXByZWhlbnNpdmUtYW5hbHlzaXMtb2YtdGhlLXZpdGFtaW4tYjQtbWFya2V0LXNpemUtZnJvbS0yMDIzLXRvLTIwMzAtaGFzLWJlZW4tY2FycmllZC1vdXQtd2l0aC3SAS1odHRwczovL3d3dy5iZW56aW5nYS5jb20vYW1wL2NvbnRlbnQvMzQ1MjQwMzk?hl=en-IN&gl=IN&ceid=IN%3Aen,2023-09-13
