,title,source,link,date
67,Myer (ASX:MYR) share price drops despite strong FY23 result,Rask Media,news.google.com/articles/CBMiYWh0dHBzOi8vd3d3LnJhc2ttZWRpYS5jb20uYXUvMjAyMy8wOS8xNC9teWVyLWFzeG15ci1zaGFyZS1wcmljZS1kcm9wcy1kZXNwaXRlLXN0cm9uZy1meTIzLXJlc3VsdC_SAQA?hl=en-IN&gl=IN&ceid=IN%3Aen,2023-09-14
3,Wheat crushing services provided to State Government eligible for ...,Tax Management India. Com,news.google.com/articles/CBMiTWh0dHBzOi8vd3d3LnRheG1hbmFnZW1lbnRpbmRpYS5jb20vdmlzaXRvci9kZXRhaWxfYXJ0aWNsZS5hc3A_QXJ0aWNsZUlEPTExODQ30gEA?hl=en-IN&gl=IN&ceid=IN%3Aen,2023-09-14
5,Philippine Financial Market Infrastructure PDS Group partners with ...,PR Newswire,news.google.com/articles/CBMi6AFodHRwczovL3d3dy5wcm5ld3N3aXJlLmNvbS9hcGFjL25ld3MtcmVsZWFzZXMvcGhpbGlwcGluZS1maW5hbmNpYWwtbWFya2V0LWluZnJhc3RydWN0dXJlLXBkcy1ncm91cC1wYXJ0bmVycy13aXRoLXN0YWNzcy1lc2dwZWRpYS1vbi10aGUtc2ZpYS1hc2Vhbi1zaW5nbGUtYWNjZXNzcG9pbnQtZm9yLWVzZy1kYXRhLXNhZmUtaW5pdGlhdGl2ZS1vbi1lc2ctZGF0YS1kaXNjbG9zdXJlLTMwMTkyNjc4NS5odG1s0gEA?hl=en-IN&gl=IN&ceid=IN%3Aen,2023-09-14
19,Travel insurance exclusions: How drinking alcohol and other ...,Sydney Morning Herald,news.google.com/articles/CBMiggFodHRwczovL3d3dy5zbWguY29tLmF1L3RyYXZlbGxlci90cmF2ZWwtbmV3cy9kZW5pZWQtdGhlLWNvbW1vbi1yZWFzb25zLXRyYXZlbC1pbnN1cmVycy13aWxsLXJlZnVzZS15b3VyLWNsYWltLTIwMjMwOTE0LXA1ZTRxaC5odG1s0gEA?hl=en-IN&gl=IN&ceid=IN%3Aen,2023-09-14
24,Chhetri only known face in 17-member Indian football team for Asian ...,Daily Excelsior,news.google.com/articles/CBMiggFodHRwczovL3d3dy5kYWlseWV4Y2Vsc2lvci5jb20vY2hoZXRyaS1vbmx5LWtub3duLWZhY2UtaW4tMTctbWVtYmVyLWluZGlhbi1mb290YmFsbC10ZWFtLWZvci1hc2lhbi1nYW1lcy1zdGltYWNzLXN0YXR1cy1ub3Qta25vd24v0gEA?hl=en-IN&gl=IN&ceid=IN%3Aen,2023-09-14
2,Shree Ganesh Remedies Ltd Partly Paidup Leads Gainers In B Group,Capital Market Publishers India Pvt Ltd,news.google.com/articles/CBMid2h0dHBzOi8vd3d3LmNhcGl0YWxtYXJrZXQuY29tL25ld3MvaG90LXB1cnN1aXQvc2hyZWUtZ2FuZXNoLXJlbWVkaWVzLWx0ZC1wYXJ0bHktcGFpZHVwLWxlYWRzLWdhaW5lcnMtaW4tYi1ncm91cC8xNDU1OTA30gEA?hl=en-IN&gl=IN&ceid=IN%3Aen,2023-09-13
65,The Match Out: S&P/ASX 200 (INDEXASX:XJO) falls ahead of key ...,Rask Media,news.google.com/articles/CBMicmh0dHBzOi8vd3d3LnJhc2ttZWRpYS5jb20uYXUvMjAyMy8wOS8xMy90aGUtbWF0Y2gtb3V0LXNwLWFzeC0yMDAtaW5kZXhhc3h4am8tZmFsbHMtYWhlYWQtb2Yta2V5LXVzLWluZmxhdGlvbi1kYXRhL9IBAA?hl=en-IN&gl=IN&ceid=IN%3Aen,2023-09-13
61,Oropharyngeal Cancer Market is Expected to Expand at a Healthy Growth Rate During the Study Period (2019,Benzinga,news.google.com/articles/CBMimQFodHRwczovL3d3dy5iZW56aW5nYS5jb20vcHJlc3NyZWxlYXNlcy8yMy8wOS9hYjM0NTM1MjQwL29yb3BoYXJ5bmdlYWwtY2FuY2VyLW1hcmtldC1pcy1leHBlY3RlZC10by1leHBhbmQtYXQtYS1oZWFsdGh5LWdyb3d0aC1yYXRlLWR1cmluZy10aGUtc3R1ZHktcGVyaW_SAS1odHRwczovL3d3dy5iZW56aW5nYS5jb20vYW1wL2NvbnRlbnQvMzQ1MzUyNDA?hl=en-IN&gl=IN&ceid=IN%3Aen,2023-09-13
56,Advanced Driver Assistance Systems (ADAS) Market Global 2023: Wide-Ranging Segment Analysis and Comprehen,Benzinga,news.google.com/articles/CBMimQFodHRwczovL3d3dy5iZW56aW5nYS5jb20vcHJlc3NyZWxlYXNlcy8yMy8wOS8zNDU1MzEyNy9hZHZhbmNlZC1kcml2ZXItYXNzaXN0YW5jZS1zeXN0ZW1zLWFkYXMtbWFya2V0LWdsb2JhbC0yMDIzLXdpZGUtcmFuZ2luZy1zZWdtZW50LWFuYWx5c2lzLWFuZC1jb21wcmXSAS1odHRwczovL3d3dy5iZW56aW5nYS5jb20vYW1wL2NvbnRlbnQvMzQ1NTMxMjc?hl=en-IN&gl=IN&ceid=IN%3Aen,2023-09-13
50,"Man v Google Bard: 10 macro indicators, house prices & inflation ...",Rask Media,news.google.com/articles/CBMiSWh0dHBzOi8vd3d3LnJhc2ttZWRpYS5jb20uYXUvMjAyMy8wOS8xNC9pbnZlc3Rvci12LWdvb2dsZS1iYXJkLWVjb25vbWljcy_SAQA?hl=en-IN&gl=IN&ceid=IN%3Aen,2023-09-13
