,title,source,link,date
73,Tuas (ASX:TUA) share price soars as EBITDA doubles in FY23,Rask Media,news.google.com/articles/CBMiYGh0dHBzOi8vd3d3LnJhc2ttZWRpYS5jb20uYXUvMjAyMy8wOS8xOS90dWFzLWFzeHR1YS1zaGFyZS1wcmljZS1zb2Fycy1hcy1lYml0ZGEtZG91Ymxlcy1pbi1meTIzL9IBAA?hl=en-IN&gl=IN&ceid=IN%3Aen,2023-09-19
4,PDS Announces Latest Improvements to its Vista HCM Solution,Benzinga,news.google.com/articles/CBMicmh0dHBzOi8vd3d3LmJlbnppbmdhLmNvbS9wcmVzc3JlbGVhc2VzLzIzLzA5L2czNDcyOTY1NS9wZHMtYW5ub3VuY2VzLWxhdGVzdC1pbXByb3ZlbWVudHMtdG8taXRzLXZpc3RhLWhjbS1zb2x1dGlvbtIBLWh0dHBzOi8vd3d3LmJlbnppbmdhLmNvbS9hbXAvY29udGVudC8zNDcyOTY1NQ?hl=en-IN&gl=IN&ceid=IN%3Aen,2023-09-19
5,Global Hot Foil Stamp Printing Machine Market Size and Forecast ...,Rouge Fox,news.google.com/articles/CBMiW2h0dHBzOi8vcm91Z2Vmb3guY29tL2dsb2JhbC1ob3QtZm9pbC1zdGFtcC1wcmludGluZy1tYWNoaW5lLW1hcmtldC1zaXplLXNjb3BlLWFuZC1mb3JlY2FzdC_SAQA?hl=en-IN&gl=IN&ceid=IN%3Aen,2023-09-19
6,Insurer wins dispute over covid cover for cancelled cruise,Insurance News Australia,news.google.com/articles/CBMiYWh0dHBzOi8vd3d3Lmluc3VyYW5jZW5ld3MuY29tLmF1L2RhaWx5L2luc3VyZXItd2lucy1kaXNwdXRlLW92ZXItY292aWQtY292ZXItZm9yLWNhbmNlbGxlZC1jcnVpc2XSAQA?hl=en-IN&gl=IN&ceid=IN%3Aen,2023-09-19
70,Dallas City Council Wants Commercial Building Permits to Start at ...,CandysDirt.com,news.google.com/articles/CBMihAFodHRwczovL2NhbmR5c2RpcnQuY29tLzIwMjMvMDkvMTkvZGFsbGFzLWNpdHktY291bmNpbC13YW50cy1jb21tZXJjaWFsLWJ1aWxkaW5nLXBlcm1pdHMtdG8tc3RhcnQtYXQteWVzLXRvLWF2b2lkLXRoaXJkLXBhcnR5LXJldmlldy_SAQA?hl=en-IN&gl=IN&ceid=IN%3Aen,2023-09-19
14,Booyco Beams: Enhancing safety and productivity in mining ...,Creamer Media's Mining Weekly,news.google.com/articles/CBMic2h0dHBzOi8vd3d3Lm1pbmluZ3dlZWtseS5jb20vYXJ0aWNsZS9ib295Y28tYmVhbXMtZW5oYW5jaW5nLXNhZmV0eS1hbmQtcHJvZHVjdGl2aXR5LWluLW1pbmluZy1vcGVyYXRpb25zLTIwMjMtMDktMTnSAQA?hl=en-IN&gl=IN&ceid=IN%3Aen,2023-09-19
67,"iCoreConnect, Inc. Announces New Endorsement Partnership With the Rhode Island Dental Association Continu",Benzinga,news.google.com/articles/CBMimQFodHRwczovL3d3dy5iZW56aW5nYS5jb20vcHJlc3NyZWxlYXNlcy8yMy8wOS9nMzQ3MjU4ODYvaWNvcmVjb25uZWN0LWluYy1hbm5vdW5jZXMtbmV3LWVuZG9yc2VtZW50LXBhcnRuZXJzaGlwLXdpdGgtdGhlLXJob2RlLWlzbGFuZC1kZW50YWwtYXNzb2NpYXRpb24tY2_SAS1odHRwczovL3d3dy5iZW56aW5nYS5jb20vYW1wL2NvbnRlbnQvMzQ3MjU4ODY?hl=en-IN&gl=IN&ceid=IN%3Aen,2023-09-19
64,"Machine Condition Monitoring Market 2023 Industry Size, Shares, Segment and Forecast up to 2031",Benzinga,news.google.com/articles/CBMikwFodHRwczovL3d3dy5iZW56aW5nYS5jb20vcHJlc3NyZWxlYXNlcy8yMy8wOS8zNDcyMTUwMi9tYWNoaW5lLWNvbmRpdGlvbi1tb25pdG9yaW5nLW1hcmtldC0yMDIzLWluZHVzdHJ5LXNpemUtc2hhcmVzLXNlZ21lbnQtYW5kLWZvcmVjYXN0LXVwLXRvLTIwMzHSAS1odHRwczovL3d3dy5iZW56aW5nYS5jb20vYW1wL2NvbnRlbnQvMzQ3MjE1MDI?hl=en-IN&gl=IN&ceid=IN%3Aen,2023-09-19
58,The Match Out: Subdued session ahead of 3 key central bank ...,Rask Media,news.google.com/articles/CBMiWmh0dHBzOi8vd3d3LnJhc2ttZWRpYS5jb20uYXUvMjAyMy8wOS8xOS9zdWJkdWVkLXNlc3Npb24tYWhlYWQtb2YtMy1jZW50cmFsLWJhbmstZGVjaXNpb25zL9IBAA?hl=en-IN&gl=IN&ceid=IN%3Aen,2023-09-19
28,Patient-reported outcome measures in functional dyspepsia: a ...,BMC Gastroenterology,news.google.com/articles/CBMiTmh0dHBzOi8vYm1jZ2FzdHJvZW50ZXJvbC5iaW9tZWRjZW50cmFsLmNvbS9hcnRpY2xlcy8xMC4xMTg2L3MxMjg3Ni0wMjMtMDI5MzUtOdIBAA?hl=en-IN&gl=IN&ceid=IN%3Aen,2023-09-19
