,title,source,link,date
27,"For a Limited Time, Divi Resorts Offers a FREE NIGHT Stay with Bookings of Six Nights or More",Benzinga,news.google.com/articles/CBMikwFodHRwczovL3d3dy5iZW56aW5nYS5jb20vcHJlc3NyZWxlYXNlcy8yMy8wOS9uMzQxNzI4NjcvZm9yLWEtbGltaXRlZC10aW1lLWRpdmktcmVzb3J0cy1vZmZlcnMtYS1mcmVlLW5pZ2h0LXN0YXktd2l0aC1ib29raW5ncy1vZi1zaXgtbmlnaHRzLW9yLW1vcmXSAS1odHRwczovL3d3dy5iZW56aW5nYS5jb20vYW1wL2NvbnRlbnQvMzQxNzI4Njc?hl=en-IN&gl=IN&ceid=IN%3Aen,2023-09-01
8,"Shelly Bay development scrapped, land sold to Sir Peter Jackson",New Zealand Herald,news.google.com/articles/CBMiWmh0dHBzOi8vd3d3Lm56aGVyYWxkLmNvLm56L256L3NoZWxseS1iYXktZGV2ZWxvcG1lbnQtY2FuY2VsbGVkL0xZNUVaVEM0SlpHV1RBMzU0SkxQWE5TRE5BL9IBAA?hl=en-IN&gl=IN&ceid=IN%3Aen,2023-09-01
38,"Remember the Old, Embrace the New: Clementine Valentine on the Timelessness of Their Debut Album",Rolling Stone Australia,news.google.com/articles/CBMiXGh0dHBzOi8vYXUucm9sbGluZ3N0b25lLmNvbS9tdXNpYy9tdXNpYy1mZWF0dXJlcy9jbGVtZW50aW5lLXZhbGVudGluZS1hbGJ1bS1pbnRlcnZpZXctNDk3NTQv0gFgaHR0cHM6Ly9hdS5yb2xsaW5nc3RvbmUuY29tL211c2ljL211c2ljLWZlYXR1cmVzL2NsZW1lbnRpbmUtdmFsZW50aW5lLWFsYnVtLWludGVydmlldy00OTc1NC9hbXAv?hl=en-IN&gl=IN&ceid=IN%3Aen,2023-09-01
15,Llŷn Peninsula farm buildings could be demolished as part of holiday units plan,North Wales Live,news.google.com/articles/CBMiXWh0dHBzOi8vd3d3LmRhaWx5cG9zdC5jby51ay9uZXdzL25vcnRoLXdhbGVzLW5ld3MvbGxuLXBlbmluc3VsYS1mYXJtLWJ1aWxkaW5ncy1jb3VsZC0yNzYyMjk2OdIBYWh0dHBzOi8vd3d3LmRhaWx5cG9zdC5jby51ay9uZXdzL25vcnRoLXdhbGVzLW5ld3MvbGxuLXBlbmluc3VsYS1mYXJtLWJ1aWxkaW5ncy1jb3VsZC0yNzYyMjk2OS5hbXA?hl=en-IN&gl=IN&ceid=IN%3Aen,2023-09-01
26,The Enchanting World of Pink Sand Beaches: A Unique Coastal ...,MapQuest,news.google.com/articles/CBMiM2h0dHBzOi8vd3d3Lm1hcHF1ZXN0LmNvbS90cmF2ZWwvcGluay1zYW5kLWJlYWNoLmh0bdIBAA?hl=en-IN&gl=IN&ceid=IN%3Aen,2023-09-01
24,"Amid Continued Sovereignty Campaign, Wabanaki REACH Creates Play as Part of Truth-Telling Project",Yahoo News,news.google.com/articles/CBMiUmh0dHBzOi8vbmV3cy55YWhvby5jb20vYW1pZC1jb250aW51ZWQtc292ZXJlaWdudHktY2FtcGFpZ24td2FiYW5ha2ktMjIyMDE4OTYwLmh0bWzSAVpodHRwczovL25ld3MueWFob28uY29tL2FtcGh0bWwvYW1pZC1jb250aW51ZWQtc292ZXJlaWdudHktY2FtcGFpZ24td2FiYW5ha2ktMjIyMDE4OTYwLmh0bWw?hl=en-IN&gl=IN&ceid=IN%3Aen,2023-08-31
44,"Optical Grade MS Resins Market Growth: Comprehensive Size and Share Report from 2023-2029 -Denka (JP), Ch",Benzinga,news.google.com/articles/CBMimQFodHRwczovL3d3dy5iZW56aW5nYS5jb20vcHJlc3NyZWxlYXNlcy8yMy8wOC8zNDE0MDM2Ni9vcHRpY2FsLWdyYWRlLW1zLXJlc2lucy1tYXJrZXQtZ3Jvd3RoLWNvbXByZWhlbnNpdmUtc2l6ZS1hbmQtc2hhcmUtcmVwb3J0LWZyb20tMjAyMy0yMDI5LWRlbmthLWpwLWPSAS1odHRwczovL3d3dy5iZW56aW5nYS5jb20vYW1wL2NvbnRlbnQvMzQxNDAzNjY?hl=en-IN&gl=IN&ceid=IN%3Aen,2023-08-31
48,Developers set to flip switch at Alaska's largest solar farm,Anchorage Daily News,news.google.com/articles/CBMipAFodHRwczovL3d3dy5hZG4uY29tL2J1c2luZXNzLWVjb25vbXkvZW5lcmd5LzIwMjMvMDgvMzAvZGV2ZWxvcGVycy10by1mbGlwLXN3aXRjaC1hdC1hbGFza2FzLWxhcmdlc3Qtc29sYXItZmFybS1hcy1yb29mdG9wLWluc3RhbGxhdGlvbnMtYWxzby1tdWx0aXBseS1pbi10aGUtbWF0LXN1L9IBAA?hl=en-IN&gl=IN&ceid=IN%3Aen,2023-08-31
52,A fine balance of demand and sustainability: Need-to-knows for ...,Travelweek,news.google.com/articles/CBMicGh0dHBzOi8vd3d3LnRyYXZlbHdlZWsuY2EvbmV3cy9hLWZpbmUtYmFsYW5jZS1vZi1kZW1hbmQtYW5kLXN1c3RhaW5hYmlsaXR5LW5lZWQtdG8ta25vd3MtZm9yLXNlbGxpbmctYW50YXJjdGljYS_SAQA?hl=en-IN&gl=IN&ceid=IN%3Aen,2023-08-31
46,"Efficient Clean Screen Market 2023 Major Growth and Top Manufacturers Operating as LG Display, Samsung Di",Benzinga,news.google.com/articles/CBMimQFodHRwczovL3d3dy5iZW56aW5nYS5jb20vcHJlc3NyZWxlYXNlcy8yMy8wOC8zNDE0MDM5OC9lZmZpY2llbnQtY2xlYW4tc2NyZWVuLW1hcmtldC0yMDIzLW1ham9yLWdyb3d0aC1hbmQtdG9wLW1hbnVmYWN0dXJlcnMtb3BlcmF0aW5nLWFzLWxnLWRpc3BsYXktc2Ftc3XSAS1odHRwczovL3d3dy5iZW56aW5nYS5jb20vYW1wL2NvbnRlbnQvMzQxNDAzOTg?hl=en-IN&gl=IN&ceid=IN%3Aen,2023-08-31
