,title,source,link,date
40,"Intelligent Thermal Control Coating Market 2023 Dynamics, Strategic Initiative and Business Outlook-Therm",Benzinga,news.google.com/articles/CBMimQFodHRwczovL3d3dy5iZW56aW5nYS5jb20vcHJlc3NyZWxlYXNlcy8yMy8wOC8zNDE0MDM3NS9pbnRlbGxpZ2VudC10aGVybWFsLWNvbnRyb2wtY29hdGluZy1tYXJrZXQtMjAyMy1keW5hbWljcy1zdHJhdGVnaWMtaW5pdGlhdGl2ZS1hbmQtYnVzaW5lc3Mtb3V0bG9vay3SAS1odHRwczovL3d3dy5iZW56aW5nYS5jb20vYW1wL2NvbnRlbnQvMzQxNDAzNzU?hl=en-IN&gl=IN&ceid=IN%3Aen,2023-08-31
57,"High Pressure Containment Vessel Market Share by Key Players-Parker Hannifin, Worthington Industries, Lux",Benzinga,news.google.com/articles/CBMimQFodHRwczovL3d3dy5iZW56aW5nYS5jb20vcHJlc3NyZWxlYXNlcy8yMy8wOC8zNDE0MDQ2MS9oaWdoLXByZXNzdXJlLWNvbnRhaW5tZW50LXZlc3NlbC1tYXJrZXQtc2hhcmUtYnkta2V5LXBsYXllcnMtcGFya2VyLWhhbm5pZmluLXdvcnRoaW5ndG9uLWluZHVzdHJpZXPSAS1odHRwczovL3d3dy5iZW56aW5nYS5jb20vYW1wL2NvbnRlbnQvMzQxNDA0NjE?hl=en-IN&gl=IN&ceid=IN%3Aen,2023-08-31
41,"Efficient Clean Screen Market 2023 Major Growth and Top Manufacturers Operating as LG Display, Samsung Di",Benzinga,news.google.com/articles/CBMimQFodHRwczovL3d3dy5iZW56aW5nYS5jb20vcHJlc3NyZWxlYXNlcy8yMy8wOC8zNDE0MDM5OC9lZmZpY2llbnQtY2xlYW4tc2NyZWVuLW1hcmtldC0yMDIzLW1ham9yLWdyb3d0aC1hbmQtdG9wLW1hbnVmYWN0dXJlcnMtb3BlcmF0aW5nLWFzLWxnLWRpc3BsYXktc2Ftc3XSAS1odHRwczovL3d3dy5iZW56aW5nYS5jb20vYW1wL2NvbnRlbnQvMzQxNDAzOTg?hl=en-IN&gl=IN&ceid=IN%3Aen,2023-08-31
42,"Cell Viability Analyzer Market Moving in the Right Direction-Thermo Fisher Scientific, Beckman Coulter, A",Benzinga,news.google.com/articles/CBMimQFodHRwczovL3d3dy5iZW56aW5nYS5jb20vcHJlc3NyZWxlYXNlcy8yMy8wOC8zNDE0MDQwMi9jZWxsLXZpYWJpbGl0eS1hbmFseXplci1tYXJrZXQtbW92aW5nLWluLXRoZS1yaWdodC1kaXJlY3Rpb24tdGhlcm1vLWZpc2hlci1zY2llbnRpZmljLWJlY2ttYW4tY291bHTSAS1odHRwczovL3d3dy5iZW56aW5nYS5jb20vYW1wL2NvbnRlbnQvMzQxNDA0MDI?hl=en-IN&gl=IN&ceid=IN%3Aen,2023-08-31
43,"Transformer Bushing CT Market Has Huge Potential for Growth during Forecast period 2023-2029 -ABB, GE, Ea",Benzinga,news.google.com/articles/CBMimQFodHRwczovL3d3dy5iZW56aW5nYS5jb20vcHJlc3NyZWxlYXNlcy8yMy8wOC8zNDE0MDQ1OC90cmFuc2Zvcm1lci1idXNoaW5nLWN0LW1hcmtldC1oYXMtaHVnZS1wb3RlbnRpYWwtZm9yLWdyb3d0aC1kdXJpbmctZm9yZWNhc3QtcGVyaW9kLTIwMjMtMjAyOS1hYmItZ2XSAS1odHRwczovL3d3dy5iZW56aW5nYS5jb20vYW1wL2NvbnRlbnQvMzQxNDA0NTg?hl=en-IN&gl=IN&ceid=IN%3Aen,2023-08-31
74,"Stainless Steel Welding Wire Market Opportunities 2023-2029-Illinois Tool Works, Lincoln Electric, Kiswel",Benzinga,news.google.com/articles/CBMimQFodHRwczovL3d3dy5iZW56aW5nYS5jb20vcHJlc3NyZWxlYXNlcy8yMy8wOC8zNDE0MDM4Ny9zdGFpbmxlc3Mtc3RlZWwtd2VsZGluZy13aXJlLW1hcmtldC1vcHBvcnR1bml0aWVzLTIwMjMtMjAyOS1pbGxpbm9pcy10b29sLXdvcmtzLWxpbmNvbG4tZWxlY3RyaWMta2nSAS1odHRwczovL3d3dy5iZW56aW5nYS5jb20vYW1wL2NvbnRlbnQvMzQxNDAzODc?hl=en-IN&gl=IN&ceid=IN%3Aen,2023-08-31
46,"Petroleum Hydrocarbon Analyzer Market Current Scenario Analysis Report till 2029 -Agilent, Thermo Fisher",Benzinga,news.google.com/articles/CBMimQFodHRwczovL3d3dy5iZW56aW5nYS5jb20vcHJlc3NyZWxlYXNlcy8yMy8wOC8zNDE0MDQ1MS9wZXRyb2xldW0taHlkcm9jYXJib24tYW5hbHl6ZXItbWFya2V0LWN1cnJlbnQtc2NlbmFyaW8tYW5hbHlzaXMtcmVwb3J0LXRpbGwtMjAyOS1hZ2lsZW50LXRoZXJtby1maXPSAS1odHRwczovL3d3dy5iZW56aW5nYS5jb20vYW1wL2NvbnRlbnQvMzQxNDA0NTE?hl=en-IN&gl=IN&ceid=IN%3Aen,2023-08-31
47,"Boiler Combustion Chamber Market product sales revenue by companies Materials Inc., SAACKE GmbH, Yanmar",Benzinga,news.google.com/articles/CBMimQFodHRwczovL3d3dy5iZW56aW5nYS5jb20vcHJlc3NyZWxlYXNlcy8yMy8wOC8zNDE0MDQ1NC9ib2lsZXItY29tYnVzdGlvbi1jaGFtYmVyLW1hcmtldC1wcm9kdWN0LXNhbGVzLXJldmVudWUtYnktY29tcGFuaWVzLW1hdGVyaWFscy1pbmMtc2FhY2tlLWdtYmgteWFubWHSAS1odHRwczovL3d3dy5iZW56aW5nYS5jb20vYW1wL2NvbnRlbnQvMzQxNDA0NTQ?hl=en-IN&gl=IN&ceid=IN%3Aen,2023-08-31
49,Double-head Stripping Machine Market Growth Expected to See Next Level-Hans Laser Technology Industry Gro,Benzinga,news.google.com/articles/CBMimQFodHRwczovL3d3dy5iZW56aW5nYS5jb20vcHJlc3NyZWxlYXNlcy8yMy8wOC8zNDE0MDQwMy9kb3VibGUtaGVhZC1zdHJpcHBpbmctbWFjaGluZS1tYXJrZXQtZ3Jvd3RoLWV4cGVjdGVkLXRvLXNlZS1uZXh0LWxldmVsLWhhbnMtbGFzZXItdGVjaG5vbG9neS1pbmR1c3TSAS1odHRwczovL3d3dy5iZW56aW5nYS5jb20vYW1wL2NvbnRlbnQvMzQxNDA0MDM?hl=en-IN&gl=IN&ceid=IN%3Aen,2023-08-31
50,"Acid Oxidation Potential Water Generator Market sales revenue by companies-EcoloxTech, Envirolyte, Hypo S",Benzinga,news.google.com/articles/CBMimQFodHRwczovL3d3dy5iZW56aW5nYS5jb20vcHJlc3NyZWxlYXNlcy8yMy8wOC8zNDE0MDQ2NC9hY2lkLW94aWRhdGlvbi1wb3RlbnRpYWwtd2F0ZXItZ2VuZXJhdG9yLW1hcmtldC1zYWxlcy1yZXZlbnVlLWJ5LWNvbXBhbmllcy1lY29sb3h0ZWNoLWVudmlyb2x5dGUtaHnSAS1odHRwczovL3d3dy5iZW56aW5nYS5jb20vYW1wL2NvbnRlbnQvMzQxNDA0NjQ?hl=en-IN&gl=IN&ceid=IN%3Aen,2023-08-31
