,title,source,link,date
33,"Glass Alcoholic Beverage Packaging Market 2023 Global Insights and Business Scenario- Owens-Illinois, Ver",Benzinga,news.google.com/articles/CBMimQFodHRwczovL3d3dy5iZW56aW5nYS5jb20vcHJlc3NyZWxlYXNlcy8yMy8wOS8zNDI1OTk2Ny9nbGFzcy1hbGNvaG9saWMtYmV2ZXJhZ2UtcGFja2FnaW5nLW1hcmtldC0yMDIzLWdsb2JhbC1pbnNpZ2h0cy1hbmQtYnVzaW5lc3Mtc2NlbmFyaW8tb3dlbnMtaWxsaW5vaXPSAS1odHRwczovL3d3dy5iZW56aW5nYS5jb20vYW1wL2NvbnRlbnQvMzQyNTk5Njc?hl=en-IN&gl=IN&ceid=IN%3Aen,2023-09-06
25,Bear hunting season begins in Michigan — Here's what to know,WWJ,news.google.com/articles/CBMiaGh0dHBzOi8vd3d3LmF1ZGFjeS5jb20vd3dqbmV3c3JhZGlvL25ld3MvbG9jYWwvYmVhci1odW50aW5nLXNlYXNvbi1iZWdpbnMtaW4tbWljaGlnYW4taGVyZXMtd2hhdC10by1rbm930gEA?hl=en-IN&gl=IN&ceid=IN%3Aen,2023-09-05
54,"Purging Plug Market Strongly Growing: DONGKUK RandS, Vishva ...",openPR,news.google.com/articles/CBMiXWh0dHBzOi8vd3d3Lm9wZW5wci5jb20vbmV3cy8zMTk2MjU5L3B1cmdpbmctcGx1Zy1tYXJrZXQtc3Ryb25nbHktZ3Jvd2luZy1kb25na3VrLXJhbmRzLXZpc2h2YdIBAA?hl=en-IN&gl=IN&ceid=IN%3Aen,2023-09-05
41,"Wednesday letters: Natural gas development, Glenwood's red scar ...",Glenwood Springs Post Independent,news.google.com/articles/CBMimgFodHRwczovL3d3dy5wb3N0aW5kZXBlbmRlbnQuY29tL29waW5pb24vd2VkbmVzZGF5LWxldHRlcnMtbmF0dXJhbC1nYXMtZGV2ZWxvcG1lbnQtZ2xlbndvb2RzLXJlZC1zY2FyLWFtZXJpY2FuLWJpcnRocmlnaHQtaG9sZGluZy1jaXR5LWNvdW5jaWwtYWNjb3VudGFibGUv0gEA?hl=en-IN&gl=IN&ceid=IN%3Aen,2023-09-05
5,Dogs enlisted to create pest-free Banks Peninsula success,Stuff.co.nz,news.google.com/articles/CBMiY2h0dHBzOi8vd3d3LnN0dWZmLmNvLm56L25hdGlvbmFsLzEzMjg3NzQ2Ni9kb2dzLWVubGlzdGVkLXRvLWNyZWF0ZS1wZXN0ZnJlZS1iYW5rcy1wZW5pbnN1bGEtc3VjY2Vzc9IBAA?hl=en-IN&gl=IN&ceid=IN%3Aen,2023-09-05
31,"Wall Mounted Wireless RFID Reader Market Size, Growth Analysis, Share, Overview, Trends, and Forecast 202",Benzinga,news.google.com/articles/CBMimQFodHRwczovL3d3dy5iZW56aW5nYS5jb20vcHJlc3NyZWxlYXNlcy8yMy8wOS8zNDIxNzY0OS93YWxsLW1vdW50ZWQtd2lyZWxlc3MtcmZpZC1yZWFkZXItbWFya2V0LXNpemUtZ3Jvd3RoLWFuYWx5c2lzLXNoYXJlLW92ZXJ2aWV3LXRyZW5kcy1hbmQtZm9yZWNhc3QtMjDSAS1odHRwczovL3d3dy5iZW56aW5nYS5jb20vYW1wL2NvbnRlbnQvMzQyMTc2NDk?hl=en-IN&gl=IN&ceid=IN%3Aen,2023-09-05
30,"GCC-Japan summit to discuss trade, energy",Arab News,news.google.com/articles/CBMiJWh0dHBzOi8vd3d3LmFyYWJuZXdzLmNvbS9ub2RlLzIzNjc2MTbSASlodHRwczovL3d3dy5hcmFibmV3cy5jb20vbm9kZS8yMzY3NjE2L2FtcA?hl=en-IN&gl=IN&ceid=IN%3Aen,2023-09-05
28,KSrelief's Masam project clears 772 mines in a week in Yemen,Arab News,news.google.com/articles/CBMiJWh0dHBzOi8vd3d3LmFyYWJuZXdzLmNvbS9ub2RlLzIzNjc1NTHSASlodHRwczovL3d3dy5hcmFibmV3cy5jb20vbm9kZS8yMzY3NTUxL2FtcA?hl=en-IN&gl=IN&ceid=IN%3Aen,2023-09-05
27,"TILT Holdings, Shinnecock Nation and PowerFund Partners Finalize ...",GlobeNewswire,news.google.com/articles/CBMiwwFodHRwczovL3d3dy5nbG9iZW5ld3N3aXJlLmNvbS9uZXdzLXJlbGVhc2UvMjAyMy8wOS8wNS8yNzM3MDQ4LzAvZW4vVElMVC1Ib2xkaW5ncy1TaGlubmVjb2NrLU5hdGlvbi1hbmQtUG93ZXJGdW5kLVBhcnRuZXJzLUZpbmFsaXplLUNoYW5nZS1pbi1QYXJ0bmVyc2hpcC1vZi1MaXR0bGUtQmVhY2gtSGFydmVzdC1Kb2ludC1WZW50dXJlLmh0bWzSAQA?hl=en-IN&gl=IN&ceid=IN%3Aen,2023-09-05
51,"Protective Clothing Textile Market 2023 Will Reflect Significant Growth in Future with Size, Share, Growt",Benzinga,news.google.com/articles/CBMimQFodHRwczovL3d3dy5iZW56aW5nYS5jb20vcHJlc3NyZWxlYXNlcy8yMy8wOS8zNDIxNjgwNy9wcm90ZWN0aXZlLWNsb3RoaW5nLXRleHRpbGUtbWFya2V0LTIwMjMtd2lsbC1yZWZsZWN0LXNpZ25pZmljYW50LWdyb3d0aC1pbi1mdXR1cmUtd2l0aC1zaXplLXNoYXJlLWfSAS1odHRwczovL3d3dy5iZW56aW5nYS5jb20vYW1wL2NvbnRlbnQvMzQyMTY4MDc?hl=en-IN&gl=IN&ceid=IN%3Aen,2023-09-05
