,title,source,link,date
31,Ukraine war – live: Putin accused of trafficking Cubans to fight for Russia in his invasion,Yahoo News,news.google.com/articles/CBMiQ2h0dHBzOi8vbmV3cy55YWhvby5jb20vdWtyYWluZS1ydXNzaWEtd2FyLWxpdmUtcHV0aW4tMDQzNTU4MDk1Lmh0bWzSAUtodHRwczovL25ld3MueWFob28uY29tL2FtcGh0bWwvdWtyYWluZS1ydXNzaWEtd2FyLWxpdmUtcHV0aW4tMDQzNTU4MDk1Lmh0bWw?hl=en-IN&gl=IN&ceid=IN%3Aen,2023-09-05
38,Russia-Ukraine war live: Putin to meet Kim Jong-un for weapons talks in Moscow,Yahoo! Voices,news.google.com/articles/CBMiR2h0dHBzOi8vd3d3LnlhaG9vLmNvbS9uZXdzL3VrcmFpbmUtcnVzc2lhLXdhci1saXZlLXB1dGluLTE0NDgwMTcwMy5odG1s0gFQaHR0cHM6Ly9uZXdzLnlhaG9vLmNvbS9hbXBodG1sL25ld3MvdWtyYWluZS1ydXNzaWEtd2FyLWxpdmUtcHV0aW4tMTQ0ODAxNzAzLmh0bWw?hl=en-IN&gl=IN&ceid=IN%3Aen,2023-09-05
4,Dogs enlisted to create pest-free Banks Peninsula success,Stuff.co.nz,news.google.com/articles/CBMiY2h0dHBzOi8vd3d3LnN0dWZmLmNvLm56L25hdGlvbmFsLzEzMjg3NzQ2Ni9kb2dzLWVubGlzdGVkLXRvLWNyZWF0ZS1wZXN0ZnJlZS1iYW5rcy1wZW5pbnN1bGEtc3VjY2Vzc9IBAA?hl=en-IN&gl=IN&ceid=IN%3Aen,2023-09-05
43,"Aircraft Cooling Turbines Market 2023: Regional Demands, Competitive Landscape Analysis and Future Outloo",Benzinga,news.google.com/articles/CBMimQFodHRwczovL3d3dy5iZW56aW5nYS5jb20vcHJlc3NyZWxlYXNlcy8yMy8wOS8zNDIxNzY0OC9haXJjcmFmdC1jb29saW5nLXR1cmJpbmVzLW1hcmtldC0yMDIzLXJlZ2lvbmFsLWRlbWFuZHMtY29tcGV0aXRpdmUtbGFuZHNjYXBlLWFuYWx5c2lzLWFuZC1mdXR1cmUtb3XSAS1odHRwczovL3d3dy5iZW56aW5nYS5jb20vYW1wL2NvbnRlbnQvMzQyMTc2NDg?hl=en-IN&gl=IN&ceid=IN%3Aen,2023-09-05
41,"Enhanced Flight Vision Systems Market Analysis, Size, Share, Growth, Trends, and Forecast 2029 - Honeywel",Benzinga,news.google.com/articles/CBMijwFodHRwczovL3d3dy5iZW56aW5nYS5jb20vcHJlc3NyZWxlYXNlcy8yMy8wOS8zNDIxNzY0Ny9lbmhhbmNlZC1mbGlnaHQtdmlzaW9uLXN5c3RlbXMtbWFya2V0LWFuYWx5c2lzLXNpemUtc2hhcmUtZ3Jvd3RoLXRyZW5kcy1hbmQtZm9yZWNhc3QtMjAyOdIBLWh0dHBzOi8vd3d3LmJlbnppbmdhLmNvbS9hbXAvY29udGVudC8zNDIxNzY0Nw?hl=en-IN&gl=IN&ceid=IN%3Aen,2023-09-05
23,Saudi Police carry out several drug-busting operations across the ...,Arab News,news.google.com/articles/CBMiMmh0dHBzOi8vd3d3LmFyYWJuZXdzLmNvbS9ub2RlLzIzNjc1MDYvc2F1ZGktYXJhYmlh0gEpaHR0cHM6Ly93d3cuYXJhYm5ld3MuY29tL25vZGUvMjM2NzUwNi9hbXA?hl=en-IN&gl=IN&ceid=IN%3Aen,2023-09-05
22,"Wall Mounted Wireless RFID Reader Market Size, Growth Analysis, Share, Overview, Trends, and Forecast 202",Benzinga,news.google.com/articles/CBMimQFodHRwczovL3d3dy5iZW56aW5nYS5jb20vcHJlc3NyZWxlYXNlcy8yMy8wOS8zNDIxNzY0OS93YWxsLW1vdW50ZWQtd2lyZWxlc3MtcmZpZC1yZWFkZXItbWFya2V0LXNpemUtZ3Jvd3RoLWFuYWx5c2lzLXNoYXJlLW92ZXJ2aWV3LXRyZW5kcy1hbmQtZm9yZWNhc3QtMjDSAS1odHRwczovL3d3dy5iZW56aW5nYS5jb20vYW1wL2NvbnRlbnQvMzQyMTc2NDk?hl=en-IN&gl=IN&ceid=IN%3Aen,2023-09-05
32,How Saudi Arabia is boosting food security by pursuing agricultural ...,Arab News,news.google.com/articles/CBMiMmh0dHBzOi8vd3d3LmFyYWJuZXdzLmNvbS9ub2RlLzIzNjczNzEvc2F1ZGktYXJhYmlh0gEpaHR0cHM6Ly93d3cuYXJhYm5ld3MuY29tL25vZGUvMjM2NzM3MS9hbXA?hl=en-IN&gl=IN&ceid=IN%3Aen,2023-09-04
35,Saudi Geological Survey achieves 4-star rating for Rawasi digital ...,Arab News,news.google.com/articles/CBMiMmh0dHBzOi8vd3d3LmFyYWJuZXdzLmNvbS9ub2RlLzIzNjcyODEvc2F1ZGktYXJhYmlh0gEpaHR0cHM6Ly93d3cuYXJhYm5ld3MuY29tL25vZGUvMjM2NzI4MS9hbXA?hl=en-IN&gl=IN&ceid=IN%3Aen,2023-09-04
36,"Coalition, opposition parties pour cold water on prospect of overhaul compromise",The Times of Israel,news.google.com/articles/CBMiOGh0dHBzOi8vd3d3LnRpbWVzb2Zpc3JhZWwuY29tL2xpdmVibG9nLXNlcHRlbWJlci00LTIwMjMv0gE8aHR0cHM6Ly93d3cudGltZXNvZmlzcmFlbC5jb20vbGl2ZWJsb2ctc2VwdGVtYmVyLTQtMjAyMy9hbXAv?hl=en-IN&gl=IN&ceid=IN%3Aen,2023-09-04
