,title,source,link,date
19,"Malaysian PM Joins Thousands to Condemn Israel, Western Allies ...",Asharq Al-awsat - English,news.google.com/articles/CBMihAFodHRwczovL2VuZ2xpc2guYWF3c2F0LmNvbS93b3JsZC80NjI2MTUxLW1hbGF5c2lhbi1wbS1qb2lucy10aG91c2FuZHMtY29uZGVtbi1pc3JhZWwtd2VzdGVybi1hbGxpZXMtJUUyJTgwJTk4YmFyYmFyaXNtJUUyJTgwJTk5LWdhemHSAQA?hl=en-IN&gl=IN&ceid=IN%3Aen,2023-10-24
3,The first slow-slip events seen off southern Costa Rica,Phys.org,news.google.com/articles/CBMiR2h0dHBzOi8vcGh5cy5vcmcvbmV3cy8yMDIzLTEwLXNsb3ctc2xpcC1ldmVudHMtc291dGhlcm4tY29zdGEtcmljYS5odG1s0gFGaHR0cHM6Ly9waHlzLm9yZy9uZXdzLzIwMjMtMTAtc2xvdy1zbGlwLWV2ZW50cy1zb3V0aGVybi1jb3N0YS1yaWNhLmFtcA?hl=en-IN&gl=IN&ceid=IN%3Aen,2023-10-24
25,IRGC Announces Readiness to Bomb Haifa if 'Necessary',Asharq Al-awsat - English,news.google.com/articles/CBMia2h0dHBzOi8vZW5nbGlzaC5hYXdzYXQuY29tL3dvcmxkLzQ2MjUxMDYtaXJnYy1hbm5vdW5jZXMtcmVhZGluZXNzLWJvbWItaGFpZmEtaWYtJUUyJTgwJTk4bmVjZXNzYXJ5JUUyJTgwJTk50gEA?hl=en-IN&gl=IN&ceid=IN%3Aen,2023-10-24
24,Kremlin Rejects Speculation That Putin Is Ill and Uses Body Doubles,Asharq Al-awsat - English,news.google.com/articles/CBMiamh0dHBzOi8vZW5nbGlzaC5hYXdzYXQuY29tL3dvcmxkLzQ2MjUwODYta3JlbWxpbi1yZWplY3RzLXNwZWN1bGF0aW9uLXB1dGluLWlsbC1hbmQtdXNlcy1ib2R5LWRvdWJsZXMlQzIlQTDSAQA?hl=en-IN&gl=IN&ceid=IN%3Aen,2023-10-24
44,The History of the Israel-Palestine Conflict: Everything You Need to ...,The Teen Magazine,news.google.com/articles/CBMiaGh0dHBzOi8vd3d3LnRoZXRlZW5tYWdhemluZS5jb20vdGhlLWhpc3Rvcnktb2YtdGhlLWlzcmFlbC1wYWxlc3RpbmUtY29uZmxpY3QtZXZlcnl0aGluZy15b3UtbmVlZC10by1rbm930gEA?hl=en-IN&gl=IN&ceid=IN%3Aen,2023-10-23
38,HAL promotes LCA Tejas to Philippines Air Force,Republic World,news.google.com/articles/CBMihgFodHRwczovL3d3dy5yZXB1YmxpY3dvcmxkLmNvbS9kZWZlbmNlL2dsb2JhbC1kZWZlbmNlLW5ld3MvaGFsLXJlbWFpbnMtaG9wZWZ1bC1hcy10ZWphcy1maWdodGVyLWpldHMtY29tcGV0ZS1hZ2FpbnN0LWdsb2JhbC1naWFudHMubmV3c9IBAA?hl=en-IN&gl=IN&ceid=IN%3Aen,2023-10-23
34,China's extended Belt and Road commitment to reshape int'l ...,People's Daily,news.google.com/articles/CBMiNWh0dHA6Ly9lbi5wZW9wbGUuY24vbjMvMjAyMy8xMDIzL2M5MDAwMC0yMDA4NzM0OS5odG1s0gEA?hl=en-IN&gl=IN&ceid=IN%3Aen,2023-10-23
30,Opinion: Send JASSMs Air-Launch Cruise Missiles to Ukraine,Kyiv Post,news.google.com/articles/CBMiJmh0dHBzOi8vd3d3Lmt5aXZwb3N0LmNvbS9vcGluaW9uLzIzMDM10gEA?hl=en-IN&gl=IN&ceid=IN%3Aen,2023-10-23
2,Cargo Therapeutics files for IPO months after it said it raised $200M ...,San Francisco Business Times ,news.google.com/articles/CBMibWh0dHBzOi8vd3d3LmJpempvdXJuYWxzLmNvbS9zYW5mcmFuY2lzY28vbmV3cy8yMDIzLzEwLzIzL2lwby1jYW5jZXItbHltcGhvbWEtY2FyZ28tdGhlcmFwZXV0aWNzLXN0YW5mb3JkLmh0bWzSAQA?hl=en-IN&gl=IN&ceid=IN%3Aen,2023-10-23
23,Thick Fog Covers Bali's Most Popular Tourist Resorts,The Bali Sun,news.google.com/articles/CBMiS2h0dHBzOi8vdGhlYmFsaXN1bi5jb20vdGhpY2stZm9nLWNvdmVycy1iYWxpcy1tb3N0LXBvcHVsYXItdG91cmlzdC1yZXNvcnRzL9IBAA?hl=en-IN&gl=IN&ceid=IN%3Aen,2023-10-23
