,title,source,link,date
2,"Ukraine war: it may be stalemate on land, but Kyiv's Black Sea ...",The Conversation,news.google.com/articles/CBMijQFodHRwczovL3RoZWNvbnZlcnNhdGlvbi5jb20vdWtyYWluZS13YXItaXQtbWF5LWJlLXN0YWxlbWF0ZS1vbi1sYW5kLWJ1dC1reWl2cy1ibGFjay1zZWEtc3VjY2Vzcy1jb3VsZC1icmluZy13aWRlci1iZW5lZml0cy10aGlzLXdpbnRlci0yMTgzMTXSAQA?hl=en-IN&gl=IN&ceid=IN%3Aen,2023-11-23
15,Israel-Hamas deal: What makes a truce lead to lasting peace?,Al Jazeera English,news.google.com/articles/CBMiZGh0dHBzOi8vd3d3LmFsamF6ZWVyYS5jb20vbmV3cy8yMDIzLzExLzIzL2lzcmFlbC1oYW1hcy1kZWFsLXdoYXQtbWFrZXMtYS10cnVjZS1sZWFkLXRvLWxhc3RpbmctcGVhY2XSAQA?hl=en-IN&gl=IN&ceid=IN%3Aen,2023-11-23
32,Will TC Energy’s big battery bid in Meaford hurt Georgian Bay?,The Narwhal,news.google.com/articles/CBMiPWh0dHBzOi8vdGhlbmFyd2hhbC5jYS90Yy1lbmVyZ3ktYmF0dGVyeS1tZWFmb3JkLWdlb3JnaWFuLWJheS_SAQA?hl=en-IN&gl=IN&ceid=IN%3Aen,2023-11-23
29,Minister urged to extend Shannon Callows funding deadline,Agriland,news.google.com/articles/CBMiX2h0dHBzOi8vd3d3LmFncmlsYW5kLmllL2Zhcm1pbmctbmV3cy9taW5pc3Rlci11cmdlZC10by1leHRlbmQtc2hhbm5vbi1jYWxsb3dzLWZ1bmRpbmctZGVhZGxpbmUv0gEA?hl=en-IN&gl=IN&ceid=IN%3Aen,2023-11-23
28,Preliminary Ground Truthing of Hurricane Intrusive Zone Confirms ...,Financial Post,news.google.com/articles/CBMi4QFodHRwczovL2ZpbmFuY2lhbHBvc3QuY29tL3Btbi9idXNpbmVzcy13aXJlLW5ld3MtcmVsZWFzZXMtcG1uL3ByZWxpbWluYXJ5LWdyb3VuZC10cnV0aGluZy1vZi1odXJyaWNhbmUtaW50cnVzaXZlLXpvbmUtY29uZmlybXMtd2lkZXNwcmVhZC1jb3BwZXItYW5kLWdvbGQtbWluZXJhbGl6YXRpb24tc2l4LWtpbG9tZXRyZXMtbm9ydGhlYXN0LW9mLWFnbmljb3MtdXBwZXItYmVhdmVyLWRlcG9zaXTSAQA?hl=en-IN&gl=IN&ceid=IN%3Aen,2023-11-23
3,Penny Stocks: Stocks likely to be in focus tomorrow!,Dalal Street Investment Journal,news.google.com/articles/CBMiYGh0dHBzOi8vd3d3LmRzaWouaW4vZHNpamFydGljbGVkZXRhaWwvcGVubnkxNjBzdG9ja3Mtc3RvY2tzLWxpa2VseS10by1iZS1pbi1mb2N1cy10b21vcnJvdy0zNDcwM9IBAA?hl=en-IN&gl=IN&ceid=IN%3Aen,2023-11-23
23,Ukraine says 3 civilians were killed in a daylight Russian cluster ...,Arab News,news.google.com/articles/CBMiK2h0dHBzOi8vd3d3LmFyYWJuZXdzLmNvbS9ub2RlLzI0MTM5ODEvd29ybGTSASlodHRwczovL3d3dy5hcmFibmV3cy5jb20vbm9kZS8yNDEzOTgxL2FtcA?hl=en-IN&gl=IN&ceid=IN%3Aen,2023-11-23
19,"Five Indian soldiers, two militants killed in Kashmir fighting",Arab News Pakistan,news.google.com/articles/CBMiKmh0dHBzOi8vd3d3LmFyYWJuZXdzLnBrL25vZGUvMjQxMzg3Ni93b3JsZNIBAA?hl=en-IN&gl=IN&ceid=IN%3Aen,2023-11-23
16,"Dispatch: The Watches, People, And Community Of Dubai Watch ...",HODINKEE,news.google.com/articles/CBMiP2h0dHBzOi8vd3d3LmhvZGlua2VlLmNvbS9hcnRpY2xlcy9waG90by1yZXBvcnQtZHViYWktd2F0Y2gtd2Vla9IBAA?hl=en-IN&gl=IN&ceid=IN%3Aen,2023-11-23
27,"Iceland Volcano Eruption Today LIVE: Iceland Braces for Eruption, Stormy Weather Disrupts Monitoring Systems",Times Now,news.google.com/articles/CBMiogFodHRwczovL3d3dy50aW1lc25vd25ld3MuY29tL3dvcmxkL2ljZWxhbmQtdm9sY2Fuby1lcnVwdGlvbi10b2RheS1saXZlLXVwZGF0ZXMtaWNlbGFuZC12b2xjYW5vLWxpa2VseS10by1lcnVwdC1zb29uLW1hZ21hLXZlcnktY2xvc2UtdG8tc3VyZmFjZS1saXZlYmxvZy0xMDUzODA0MzDSAaYBaHR0cHM6Ly93d3cudGltZXNub3duZXdzLmNvbS93b3JsZC9pY2VsYW5kLXZvbGNhbm8tZXJ1cHRpb24tdG9kYXktbGl2ZS11cGRhdGVzLWljZWxhbmQtdm9sY2Fuby1saWtlbHktdG8tZXJ1cHQtc29vbi1tYWdtYS12ZXJ5LWNsb3NlLXRvLXN1cmZhY2UtbGl2ZWJsb2ctMTA1MzgwNDMwL2FtcA?hl=en-IN&gl=IN&ceid=IN%3Aen,2023-11-23
