,title,source,link,date
45,The Great Golf Weekend Guide Part II,Golf Australia Magazine,news.google.com/articles/CBMiVGh0dHBzOi8vd3d3LmdvbGZhdXN0cmFsaWEuY29tLmF1L2ZlYXR1cmUvdGhlLWdyZWF0LWdvbGYtd2Vla2VuZC1ndWlkZS1wYXJ0LWlpLTYwMTYwONIBAA?hl=en-IN&gl=IN&ceid=IN%3Aen,2023-10-25
13,SF Office Building Likely to Trade at Huge Discount,The Real Deal,news.google.com/articles/CBMiZGh0dHBzOi8vdGhlcmVhbGRlYWwuY29tL3NhbmZyYW5jaXNjby8yMDIzLzEwLzI1L3NmLW9mZmljZS1idWlsZGluZy1saWtlbHktdG8tdHJhZGUtYXQtaHVnZS1kaXNjb3VudC_SAQA?hl=en-IN&gl=IN&ceid=IN%3Aen,2023-10-25
30,How to build a spaceport,TNW,news.google.com/articles/CBMiRWh0dHBzOi8vdGhlbmV4dHdlYi5jb20vbmV3cy9ob3ctdG8tYnVpbGQtc2F4YXZvcmQtc3BhY2Vwb3J0LXNwYWNldGVjaNIBAA?hl=en-IN&gl=IN&ceid=IN%3Aen,2023-10-25
32,The Sinai solution: Reimagining Gaza in the post-Oslo period,Mada Masr,news.google.com/articles/CBMidGh0dHBzOi8vd3d3Lm1hZGFtYXNyLmNvbS9lbi8yMDIzLzEwLzI1L2ZlYXR1cmUvcG9saXRpY3MvdGhlLXNpbmFpLXNvbHV0aW9uLXJlaW1hZ2luaW5nLWdhemEtaW4tdGhlLXBvc3Qtb3Nsby1wZXJpb2Qv0gEA?hl=en-IN&gl=IN&ceid=IN%3Aen,2023-10-25
21,The India-Middle East-Europe Economic Corridor: Promises and ...,Australian Institute of International Affairs,news.google.com/articles/CBMigQFodHRwczovL3d3dy5pbnRlcm5hdGlvbmFsYWZmYWlycy5vcmcuYXUvYXVzdHJhbGlhbm91dGxvb2svdGhlLWluZGlhLW1pZGRsZS1lYXN0LWV1cm9wZS1lY29ub21pYy1jb3JyaWRvci1wcm9taXNlcy1hbmQtY2hhbGxlbmdlcy_SAQA?hl=en-IN&gl=IN&ceid=IN%3Aen,2023-10-25
18,New NMU fellowship will help U.P. and students alike,Second Wave Michigan,news.google.com/articles/CBMiRGh0dHBzOi8vd3d3LnNlY29uZHdhdmVtZWRpYS5jb20vdXB3b3JkL2ZlYXR1cmVzL3J1cmFsbGVhZGVyc2hpcC5hc3B40gEA?hl=en-IN&gl=IN&ceid=IN%3Aen,2023-10-25
26,2023 Voter Guide: Candidates in 7 Summit County villages profiled,Akron Beacon Journal,news.google.com/articles/CBMirwFodHRwczovL3d3dy5iZWFjb25qb3VybmFsLmNvbS9zdG9yeS9uZXdzL3BvbGl0aWNzL2VsZWN0aW9ucy8yMDIzLzEwLzI1LzIwMjMtdm90ZXItZ3VpZGUtYm9zdG9uLWhlaWdodHMtY2xpbnRvbi1sYWtlbW9yZS1ub3J0aGZpZWxkLXBlbmluc3VsYS1yaWNoZmllbGQtc2lsdmVyLWxha2UvNzEyMDUzODcwMDcv0gEA?hl=en-IN&gl=IN&ceid=IN%3Aen,2023-10-25
39,Ultimate Iceland Ring Road Itinerary: Explore the Best of Iceland in ...,The Planet D,news.google.com/articles/CBMiM2h0dHBzOi8vdGhlcGxhbmV0ZC5jb20vaWNlbGFuZC1yaW5nLXJvYWQtaXRpbmVyYXJ5L9IBAA?hl=en-IN&gl=IN&ceid=IN%3Aen,2023-10-25
10,'They're running out of time': Ukraine's counteroffensive is gaining urgency as winter approaches,CNBC,news.google.com/articles/CBMiZ2h0dHBzOi8vd3d3LmNuYmMuY29tLzIwMjMvMTAvMjUvdWtyYWluZXMtY291bnRlcm9mZmVuc2l2ZS13b3JyaWVzLWRlZmVuc2UtYW5hbHlzdHMtYWhlYWQtb2Ytd2ludGVyLmh0bWzSAWtodHRwczovL3d3dy5jbmJjLmNvbS9hbXAvMjAyMy8xMC8yNS91a3JhaW5lcy1jb3VudGVyb2ZmZW5zaXZlLXdvcnJpZXMtZGVmZW5zZS1hbmFseXN0cy1haGVhZC1vZi13aW50ZXIuaHRtbA?hl=en-IN&gl=IN&ceid=IN%3Aen,2023-10-25
8,Bank Leaders Find Growth Opportunities in Northern Neck,Federal Reserve Bank of Richmond,news.google.com/articles/CBMiY2h0dHBzOi8vd3d3LnJpY2htb25kZmVkLm9yZy9wcmVzc19yb29tL291cl9uZXdzLzIwMjMvMjAyMzEwMjVfY29tbXVuaXR5X2NvbnZlcnNhdGlvbnNfbm9ydGhlcm5fbmVja9IBAA?hl=en-IN&gl=IN&ceid=IN%3Aen,2023-10-25
