,title,source,link,date
43,"Detailed analysis of the Fraxiparine market's size, dynamics, and anticipated development from 2023 to 20",Benzinga,news.google.com/articles/CBMimQFodHRwczovL3d3dy5iZW56aW5nYS5jb20vcHJlc3NyZWxlYXNlcy8yMy8wOS8zNDE5MjQ5NS9kZXRhaWxlZC1hbmFseXNpcy1vZi10aGUtZnJheGlwYXJpbmUtbWFya2V0cy1zaXplLWR5bmFtaWNzLWFuZC1hbnRpY2lwYXRlZC1kZXZlbG9wbWVudC1mcm9tLTIwMjMtdG_SAS1odHRwczovL3d3dy5iZW56aW5nYS5jb20vYW1wL2NvbnRlbnQvMzQxOTI0OTU?hl=en-IN&gl=IN&ceid=IN%3Aen,2023-09-03
78,"Muscle Invasive Bladder Cancer Treatment market analysis report examines the industry's market size, comp",Benzinga,news.google.com/articles/CBMimQFodHRwczovL3d3dy5iZW56aW5nYS5jb20vcHJlc3NyZWxlYXNlcy8yMy8wOS8zNDE5MjY0NS9tdXNjbGUtaW52YXNpdmUtYmxhZGRlci1jYW5jZXItdHJlYXRtZW50LW1hcmtldC1hbmFseXNpcy1yZXBvcnQtZXhhbWluZXMtdGhlLWluZHVzdHJ5cy1tYXJrZXQtc2l6ZS3SAS1odHRwczovL3d3dy5iZW56aW5nYS5jb20vYW1wL2NvbnRlbnQvMzQxOTI2NDU?hl=en-IN&gl=IN&ceid=IN%3Aen,2023-09-03
71,Neurodegenerative Disease Treatment market research report provides users with pertinent market insights,Benzinga,news.google.com/articles/CBMimQFodHRwczovL3d3dy5iZW56aW5nYS5jb20vcHJlc3NyZWxlYXNlcy8yMy8wOS8zNDE5MjQ0NS9uZXVyb2RlZ2VuZXJhdGl2ZS1kaXNlYXNlLXRyZWF0bWVudC1tYXJrZXQtcmVzZWFyY2gtcmVwb3J0LXByb3ZpZGVzLXVzZXJzLXdpdGgtcGVydGluZW50LW1hcmtldC1pbnPSAS1odHRwczovL3d3dy5iZW56aW5nYS5jb20vYW1wL2NvbnRlbnQvMzQxOTI0NDU?hl=en-IN&gl=IN&ceid=IN%3Aen,2023-09-03
70,The global Hormonal Contraception market is projected to grow at a CAGR of 12.7% in the forcest period fr,Benzinga,news.google.com/articles/CBMimQFodHRwczovL3d3dy5iZW56aW5nYS5jb20vcHJlc3NyZWxlYXNlcy8yMy8wOS8zNDE5Mjg2MC90aGUtZ2xvYmFsLWhvcm1vbmFsLWNvbnRyYWNlcHRpb24tbWFya2V0LWlzLXByb2plY3RlZC10by1ncm93LWF0LWEtY2Fnci1vZi0xMi03LWluLXRoZS1mb3JjZXN0LXBlcmnSAS1odHRwczovL3d3dy5iZW56aW5nYS5jb20vYW1wL2NvbnRlbnQvMzQxOTI4NjA?hl=en-IN&gl=IN&ceid=IN%3Aen,2023-09-03
58,"This report offers a competitive landscape and analysis of major rivals in the Nadroparin Calcium market,",Benzinga,news.google.com/articles/CBMimQFodHRwczovL3d3dy5iZW56aW5nYS5jb20vcHJlc3NyZWxlYXNlcy8yMy8wOS8zNDE5MjUwNi90aGlzLXJlcG9ydC1vZmZlcnMtYS1jb21wZXRpdGl2ZS1sYW5kc2NhcGUtYW5kLWFuYWx5c2lzLW9mLW1ham9yLXJpdmFscy1pbi10aGUtbmFkcm9wYXJpbi1jYWxjaXVtLW3SAS1odHRwczovL3d3dy5iZW56aW5nYS5jb20vYW1wL2NvbnRlbnQvMzQxOTI1MDY?hl=en-IN&gl=IN&ceid=IN%3Aen,2023-09-03
42,"The Retinal Disorders Treatment market insights include historical trends and future projections, with a",Benzinga,news.google.com/articles/CBMimQFodHRwczovL3d3dy5iZW56aW5nYS5jb20vcHJlc3NyZWxlYXNlcy8yMy8wOS8zNDE5MjQ0OC90aGUtcmV0aW5hbC1kaXNvcmRlcnMtdHJlYXRtZW50LW1hcmtldC1pbnNpZ2h0cy1pbmNsdWRlLWhpc3RvcmljYWwtdHJlbmRzLWFuZC1mdXR1cmUtcHJvamVjdGlvbnMtd2nSAS1odHRwczovL3d3dy5iZW56aW5nYS5jb20vYW1wL2NvbnRlbnQvMzQxOTI0NDg?hl=en-IN&gl=IN&ceid=IN%3Aen,2023-09-03
35,The Lomefloxacin market size is increasing at a CAGR of 6.3% with comprehensive analysis of market challe,Benzinga,news.google.com/articles/CBMimQFodHRwczovL3d3dy5iZW56aW5nYS5jb20vcHJlc3NyZWxlYXNlcy8yMy8wOS8zNDE5MjEzMS90aGUtbG9tZWZsb3hhY2luLW1hcmtldC1zaXplLWlzLWluY3JlYXNpbmctYXQtYS1jYWdyLW9mLTYtMy13aXRoLWNvbXByZWhlbnNpdmUtYW5hbHlzaXMtb2YtbWFya2V0LWPSAS1odHRwczovL3d3dy5iZW56aW5nYS5jb20vYW1wL2NvbnRlbnQvMzQxOTIxMzE?hl=en-IN&gl=IN&ceid=IN%3Aen,2023-09-03
55,"India's Moon Rover Completes its Walk, Scientists Analyzing Data ...",Asharq Al-awsat - English,news.google.com/articles/CBMieWh0dHBzOi8vZW5nbGlzaC5hYXdzYXQuY29tL3ZhcmlldGllcy80NTIzNTQxLWluZGlhcy1tb29uLXJvdmVyLWNvbXBsZXRlcy1pdHMtd2Fsay1zY2llbnRpc3RzLWFuYWx5emluZy1kYXRhLWxvb2tpbmctc2lnbnPSAQA?hl=en-IN&gl=IN&ceid=IN%3Aen,2023-09-03
53,"This report examines the growth trajectory of the Topical Antibiotics market, highlighting new trends and",Benzinga,news.google.com/articles/CBMimQFodHRwczovL3d3dy5iZW56aW5nYS5jb20vcHJlc3NyZWxlYXNlcy8yMy8wOS8zNDE5MjQ1MS90aGlzLXJlcG9ydC1leGFtaW5lcy10aGUtZ3Jvd3RoLXRyYWplY3Rvcnktb2YtdGhlLXRvcGljYWwtYW50aWJpb3RpY3MtbWFya2V0LWhpZ2hsaWdodGluZy1uZXctdHJlbmTSAS1odHRwczovL3d3dy5iZW56aW5nYS5jb20vYW1wL2NvbnRlbnQvMzQxOTI0NTE?hl=en-IN&gl=IN&ceid=IN%3Aen,2023-09-03
47,"This research contains sales, income, and average selling price future projections by type and applicatio",Benzinga,news.google.com/articles/CBMimQFodHRwczovL3d3dy5iZW56aW5nYS5jb20vcHJlc3NyZWxlYXNlcy8yMy8wOS8zNDE5MjUwNS90aGlzLXJlc2VhcmNoLWNvbnRhaW5zLXNhbGVzLWluY29tZS1hbmQtYXZlcmFnZS1zZWxsaW5nLXByaWNlLWZ1dHVyZS1wcm9qZWN0aW9ucy1ieS10eXBlLWFuZC1hcHBsaWPSAS1odHRwczovL3d3dy5iZW56aW5nYS5jb20vYW1wL2NvbnRlbnQvMzQxOTI1MDU?hl=en-IN&gl=IN&ceid=IN%3Aen,2023-09-03
