,title,source,link,date
0,Niraparib Maintenance Extends PFS in Newly Diagnosed Ovarian ...,OncLive,news.google.com/articles/CBMiYGh0dHBzOi8vd3d3Lm9uY2xpdmUuY29tL3ZpZXcvbmlyYXBhcmliLW1haW50ZW5hbmNlLWV4dGVuZHMtcGZzLWluLW5ld2x5LWRpYWdub3NlZC1vdmFyaWFuLWNhbmNlctIBAA?hl=en-IN&gl=IN&ceid=IN%3Aen,2023-08-27
64,Zimbabwes President Emmerson Mnangagwa re-elected for second ...,webindia123,news.google.com/articles/CBMiRmh0dHBzOi8vbmV3cy53ZWJpbmRpYTEyMy5jb20vbmV3cy9hcnRpY2xlcy9Xb3JsZC8yMDIzMDgyNy80MTEyNzE4Lmh0bWzSAQA?hl=en-IN&gl=IN&ceid=IN%3Aen,2023-08-27
43,Zhen Explores the Role of Immunotherapy in Upper GI Cancers,Targeted Oncology,news.google.com/articles/CBMiXGh0dHBzOi8vd3d3LnRhcmdldGVkb25jLmNvbS92aWV3L3poZW4tZXhwbG9yZXMtdGhlLXJvbGUtb2YtaW1tdW5vdGhlcmFweS1pbi11cHBlci1naS1jYW5jZXJz0gEA?hl=en-IN&gl=IN&ceid=IN%3Aen,2023-08-27
90,Combining Surgery and Biologic Therapy Improves Outcomes in ...,AJMC.com Managed Markets Network,news.google.com/articles/CBMiamh0dHBzOi8vd3d3LmFqbWMuY29tL3ZpZXcvY29tYmluaW5nLXN1cmdlcnktYW5kLWJpb2xvZ2ljLXRoZXJhcHktaW1wcm92ZXMtb3V0Y29tZXMtaW4tcGF0aWVudHMtd2l0aC1jcnN3bnDSAQA?hl=en-IN&gl=IN&ceid=IN%3Aen,2023-08-26
34,Next Steps for Acalabrutinib in MCL,Targeted Oncology,news.google.com/articles/CBMiRGh0dHBzOi8vd3d3LnRhcmdldGVkb25jLmNvbS92aWV3L25leHQtc3RlcHMtZm9yLWFjYWxhYnJ1dGluaWItaW4tbWNs0gEA?hl=en-IN&gl=IN&ceid=IN%3Aen,2023-08-26
82,"Study Suggests CAR T-Cell Therapy Safe, Effective After Allo-SCT in ...",AJMC.com Managed Markets Network,news.google.com/articles/CBMibWh0dHBzOi8vd3d3LmFqbWMuY29tL3ZpZXcvc3R1ZHktc3VnZ2VzdHMtY2FyLXQtY2VsbC10aGVyYXB5LXNhZmUtZWZmZWN0aXZlLWFmdGVyLWFsbG8tc2N0LWluLW11bHRpcGxlLW15ZWxvbWHSAQA?hl=en-IN&gl=IN&ceid=IN%3Aen,2023-08-26
16,Up-to-date meta-analysis of long-term evaluations of mesenchymal ...,Newswise,news.google.com/articles/CBMikQFodHRwczovL3d3dy5uZXdzd2lzZS5jb20vYXJ0aWNsZXMvdXAtdG8tZGF0ZS1tZXRhLWFuYWx5c2lzLW9mLWxvbmctdGVybS1ldmFsdWF0aW9ucy1vZi1tZXNlbmNoeW1hbC1zdGVtLWNlbGwtdGhlcmFweS1mb3ItY29tcGxleC1wZXJpYW5hbC1maXN0dWxh0gEA?hl=en-IN&gl=IN&ceid=IN%3Aen,2023-08-26
87,Patients With ILD Identify Oxygen Therapy Barriers,AJMC.com Managed Markets Network,news.google.com/articles/CBMiTGh0dHBzOi8vd3d3LmFqbWMuY29tL3ZpZXcvcGF0aWVudHMtd2l0aC1pbGQtaWRlbnRpZnktb3h5Z2VuLXRoZXJhcHktYmFycmllcnPSAQA?hl=en-IN&gl=IN&ceid=IN%3Aen,2023-08-26
30,Participants Debate Which Combination Is Best for High-Risk ...,Targeted Oncology,news.google.com/articles/CBMibWh0dHBzOi8vd3d3LnRhcmdldGVkb25jLmNvbS92aWV3L3BhcnRpY2lwYW50cy1kZWJhdGUtd2hpY2gtY29tYmluYXRpb24taXMtYmVzdC1mb3ItaGlnaC1yaXNrLW11bHRpcGxlLW15ZWxvbWHSAQA?hl=en-IN&gl=IN&ceid=IN%3Aen,2023-08-26
93,Genomic Analyses Reveals Complex Alterations in HGSC,AJMC.com Managed Markets Network,news.google.com/articles/CBMiTmh0dHBzOi8vd3d3LmFqbWMuY29tL3ZpZXcvZ2Vub21pYy1hbmFseXNlcy1yZXZlYWxzLWNvbXBsZXgtYWx0ZXJhdGlvbnMtaW4taGdzY9IBAA?hl=en-IN&gl=IN&ceid=IN%3Aen,2023-08-26
