,title,source,link,date
24,US envoy to Pakistan engages with top political leaders ahead of ...,Arab News,news.google.com/articles/CBMiLmh0dHBzOi8vd3d3LmFyYWJuZXdzLmNvbS9ub2RlLzI0MTExMTEvcGFraXN0YW7SASlodHRwczovL3d3dy5hcmFibmV3cy5jb20vbm9kZS8yNDExMTExL2FtcA?hl=en-IN&gl=IN&ceid=IN%3Aen,2023-11-18
50,Russo-Ukrainian War: The Reckoning,MR Online,news.google.com/articles/CBMiQmh0dHBzOi8vbXJvbmxpbmUub3JnLzIwMjMvMTEvMTgvcnVzc28tdWtyYWluaWFuLXdhci10aGUtcmVja29uaW5nL9IBAA?hl=en-IN&gl=IN&ceid=IN%3Aen,2023-11-18
23,"Pakistani forces eliminate wanted militant commander, three others ...",Arab News Pakistan,news.google.com/articles/CBMiLWh0dHBzOi8vd3d3LmFyYWJuZXdzLnBrL25vZGUvMjQxMTMyNi9wYWtpc3RhbtIBAA?hl=en-IN&gl=IN&ceid=IN%3Aen,2023-11-17
26,Pakistan top court to review objections over petition seeking to ...,Arab News Pakistan,news.google.com/articles/CBMiLWh0dHBzOi8vd3d3LmFyYWJuZXdzLnBrL25vZGUvMjQxMTM4Ni9wYWtpc3RhbtIBAA?hl=en-IN&gl=IN&ceid=IN%3Aen,2023-11-17
33,Mike Tomlin heads top 5 candidates in Coach of the Year race; Sam ...,NFL.com,news.google.com/articles/CBMiaWh0dHBzOi8vd3d3Lm5mbC5jb20vbmV3cy9taWtlLXRvbWxpbi1oZWFkcy10b3AtNS1jYW5kaWRhdGVzLWluLWNvYWNoLW9mLXRoZS15ZWFyLXJhY2Utc2FtLWhvd2VsbC1zLXZpYWJpbNIBAA?hl=en-IN&gl=IN&ceid=IN%3Aen,2023-11-17
69,Israel-Hamas RECAP: Israeli soldiers storm Gaza's al Shifa hospital in 'targeted operation' to root out Hamas,Daily Mail,news.google.com/articles/CBMijwFodHRwczovL3d3dy5kYWlseW1haWwuY28udWsvbmV3cy9hcnRpY2xlLTEyNzUxNTI3L2lzcmFlbC1oYW1hcy13YXItbGl2ZS11cGRhdGVzLWlzcmFlbGktc29sZGllcnMtZ2F6YS1hbC1zaGlmYS1ob3NwaXRhbC10YXJnZXRlZC1vcGVyYXRpb24uaHRtbNIBkwFodHRwczovL3d3dy5kYWlseW1haWwuY28udWsvbmV3cy9hcnRpY2xlLTEyNzUxNTI3L2FtcC9pc3JhZWwtaGFtYXMtd2FyLWxpdmUtdXBkYXRlcy1pc3JhZWxpLXNvbGRpZXJzLWdhemEtYWwtc2hpZmEtaG9zcGl0YWwtdGFyZ2V0ZWQtb3BlcmF0aW9uLmh0bWw?hl=en-IN&gl=IN&ceid=IN%3Aen,2023-11-15
43,"In a first, Pakistan Air Force's JF-17 Block-3 aircraft participate in ...",Arab News,news.google.com/articles/CBMiLmh0dHBzOi8vd3d3LmFyYWJuZXdzLmNvbS9ub2RlLzI0MDgzMzEvcGFraXN0YW7SASlodHRwczovL3d3dy5hcmFibmV3cy5jb20vbm9kZS8yNDA4MzMxL2FtcA?hl=en-IN&gl=IN&ceid=IN%3Aen,2023-11-14
79,Australia politics live: students protesting over climate crisis 'are ...,msnNOW,news.google.com/articles/CBMilgFodHRwczovL3d3dy5tc24uY29tL2VuLWdiL25ld3MvdWtuZXdzL2F1c3RyYWxpYS1wb2xpdGljcy1saXZlLXN0dWRlbnRzLXByb3Rlc3Rpbmctb3Zlci1jbGltYXRlLWNyaXNpcy1hcmUtYmVpbmctdGhlLWFkdWx0cy1hZGFtLWJhbmR0LXNheXMvYXItQUExalJWb3TSAQA?hl=en-IN&gl=IN&ceid=IN%3Aen,2023-11-14
38,"Israel 'taking it too far,' warns Lebanon as border skirmishes continue",Arab News,news.google.com/articles/CBMiMWh0dHBzOi8vd3d3LmFyYWJuZXdzLmNvbS9ub2RlLzI0MDg3ODYvbWlkZGxlLWVhc3TSASlodHRwczovL3d3dy5hcmFibmV3cy5jb20vbm9kZS8yNDA4Nzg2L2FtcA?hl=en-IN&gl=IN&ceid=IN%3Aen,2023-11-13
1,Chief Financial Officer Pakalapati Srihari Sold A Bunch Of Shares In Premier Explosives,Simply Wall St,news.google.com/articles/CBMikwFodHRwczovL3NpbXBseXdhbGwuc3Qvc3RvY2tzL2luL21hdGVyaWFscy9uc2UtcHJlbWV4cGxuL3ByZW1pZXItZXhwbG9zaXZlcy1zaGFyZXMvbmV3cy9jaGllZi1maW5hbmNpYWwtb2ZmaWNlci1wYWthbGFwYXRpLXNyaWhhcmktc29sZC1hLWJ1bmNoLW9mLXPSAZcBaHR0cHM6Ly9zaW1wbHl3YWxsLnN0L3N0b2Nrcy9pbi9tYXRlcmlhbHMvbnNlLXByZW1leHBsbi9wcmVtaWVyLWV4cGxvc2l2ZXMtc2hhcmVzL25ld3MvY2hpZWYtZmluYW5jaWFsLW9mZmljZXItcGFrYWxhcGF0aS1zcmloYXJpLXNvbGQtYS1idW5jaC1vZi1zL2FtcA?hl=en-IN&gl=IN&ceid=IN%3Aen,2023-11-10
