,title,source,link,date
73,"With the projected CAGR of 8.7% from 2023 to 2030, the Outdoor Camping Cookware market size and share ana",Benzinga,news.google.com/articles/CBMimQFodHRwczovL3d3dy5iZW56aW5nYS5jb20vcHJlc3NyZWxlYXNlcy8yMy8wOS8zNDM0NDU0OC93aXRoLXRoZS1wcm9qZWN0ZWQtY2Fnci1vZi04LTctZnJvbS0yMDIzLXRvLTIwMzAtdGhlLW91dGRvb3ItY2FtcGluZy1jb29rd2FyZS1tYXJrZXQtc2l6ZS1hbmQtc2hhcmXSAS1odHRwczovL3d3dy5iZW56aW5nYS5jb20vYW1wL2NvbnRlbnQvMzQzNDQ1NDg?hl=en-IN&gl=IN&ceid=IN%3Aen,2023-09-08
19,Inhibition of selenoprotein synthesis is not the mechanism by which ...,Nature.com,news.google.com/articles/CBMiMmh0dHBzOi8vd3d3Lm5hdHVyZS5jb20vYXJ0aWNsZXMvczQxNTk4LTAyMy0zNjc5Ni050gEA?hl=en-IN&gl=IN&ceid=IN%3Aen,2023-09-07
23,A “safety cap” for improving hospital sanitation and reducing ...,BMC Infectious Diseases,news.google.com/articles/CBMiSmh0dHBzOi8vYm1jaW5mZWN0ZGlzLmJpb21lZGNlbnRyYWwuY29tL2FydGljbGVzLzEwLjExODYvczEyODc5LTAyMy0wODU2Ni010gEA?hl=en-IN&gl=IN&ceid=IN%3Aen,2023-09-07
33,"Clubhouse Media Group, Inc. Closes New Promo Deal With ...",StreetInsider.com,news.google.com/articles/CBMilgFodHRwOi8vd3d3LnN0cmVldGluc2lkZXIuY29tL0FjY2Vzc3dpcmUvQ2x1YmhvdXNlK01lZGlhK0dyb3VwJTJDK0luYy4rQ2xvc2VzK05ldytQcm9tbytEZWFsK1dpdGgrS2V5c2hhd24rSm9obnNvbiUyQytTdXBlcitCb3dsK0NoYW1waW9uLzIyMTM2MjcyLmh0bWzSAQA?hl=en-IN&gl=IN&ceid=IN%3Aen,2023-09-07
34,A new biography of Donald Horne examines a life of indefatigable ...,The Conversation,news.google.com/articles/CBMihQFodHRwczovL3RoZWNvbnZlcnNhdGlvbi5jb20vYS1uZXctYmlvZ3JhcGh5LW9mLWRvbmFsZC1ob3JuZS1leGFtaW5lcy1hLWxpZmUtb2YtaW5kZWZhdGlnYWJsZS1lbmVyZ3ktYW5kLWludGVsbGVjdHVhbC1jdXJpb3NpdHktMjExODg00gEA?hl=en-IN&gl=IN&ceid=IN%3Aen,2023-09-06
39,Scream Factory To Give 'Night Of The Demons' Series New ...,Geek Vibes Nation,news.google.com/articles/CBMigQFodHRwczovL2dlZWt2aWJlc25hdGlvbi5jb20vc2NyZWFtLWZhY3RvcnktdG8tZ2l2ZS1uaWdodC1vZi10aGUtZGVtb25zLXNlcmllcy1uZXctY29sbGVjdG9ycy1lZGl0aW9ucy1yZWxlYXNlcy1vbi00ay11aGQtYmx1LXJheS_SAQA?hl=en-IN&gl=IN&ceid=IN%3Aen,2023-09-05
40,Compound heterozygous variants of THG1L result in autosomal ...,Nature.com,news.google.com/articles/CBMiMmh0dHBzOi8vd3d3Lm5hdHVyZS5jb20vYXJ0aWNsZXMvczEwMDM4LTAyMy0wMTE5Mi040gEA?hl=en-IN&gl=IN&ceid=IN%3Aen,2023-09-05
46,Integrated Building Management Systems Market Share Analysis for 2030,Benzinga,news.google.com/articles/CBMie2h0dHBzOi8vd3d3LmJlbnppbmdhLmNvbS9wcmVzc3JlbGVhc2VzLzIzLzA5LzM0MjA5NTU5L2ludGVncmF0ZWQtYnVpbGRpbmctbWFuYWdlbWVudC1zeXN0ZW1zLW1hcmtldC1zaGFyZS1hbmFseXNpcy1mb3ItMjAzMNIBLWh0dHBzOi8vd3d3LmJlbnppbmdhLmNvbS9hbXAvY29udGVudC8zNDIwOTU1OQ?hl=en-IN&gl=IN&ceid=IN%3Aen,2023-09-04
29,India Ceramic Tiles Market A Rising Trajectory Skyrocketing Market Size Envisioned Ahead,Benzinga,news.google.com/articles/CBMijgFodHRwczovL3d3dy5iZW56aW5nYS5jb20vcHJlc3NyZWxlYXNlcy8yMy8wOS8zNDE2NTU4MS9pbmRpYS1jZXJhbWljLXRpbGVzLW1hcmtldC1hLXJpc2luZy10cmFqZWN0b3J5LXNreXJvY2tldGluZy1tYXJrZXQtc2l6ZS1lbnZpc2lvbmVkLWFoZWFk0gEtaHR0cHM6Ly93d3cuYmVuemluZ2EuY29tL2FtcC9jb250ZW50LzM0MTY1NTgx?hl=en-IN&gl=IN&ceid=IN%3Aen,2023-09-01
37,Individuals in Engineering and Technology Recognized for STEM ...,Society of Women Engineers,news.google.com/articles/CBMiNGh0dHBzOi8vYWxsdG9nZXRoZXIuc3dlLm9yZy8yMDIzLzA4L3N3ZS1hd2FyZHMtMjAyMy_SAQA?hl=en-IN&gl=IN&ceid=IN%3Aen,2023-08-28
