,title,source,link,date
21,Scream Factory To Give 'Night Of The Demons' Series New ...,Geek Vibes Nation,news.google.com/articles/CBMigQFodHRwczovL2dlZWt2aWJlc25hdGlvbi5jb20vc2NyZWFtLWZhY3RvcnktdG8tZ2l2ZS1uaWdodC1vZi10aGUtZGVtb25zLXNlcmllcy1uZXctY29sbGVjdG9ycy1lZGl0aW9ucy1yZWxlYXNlcy1vbi00ay11aGQtYmx1LXJheS_SAQA?hl=en-IN&gl=IN&ceid=IN%3Aen,2023-09-05
22,Compound heterozygous variants of THG1L result in autosomal ...,Nature.com,news.google.com/articles/CBMiMmh0dHBzOi8vd3d3Lm5hdHVyZS5jb20vYXJ0aWNsZXMvczEwMDM4LTAyMy0wMTE5Mi040gEA?hl=en-IN&gl=IN&ceid=IN%3Aen,2023-09-05
35,Integrated Building Management Systems Market Share Analysis for 2030,Benzinga,news.google.com/articles/CBMie2h0dHBzOi8vd3d3LmJlbnppbmdhLmNvbS9wcmVzc3JlbGVhc2VzLzIzLzA5LzM0MjA5NTU5L2ludGVncmF0ZWQtYnVpbGRpbmctbWFuYWdlbWVudC1zeXN0ZW1zLW1hcmtldC1zaGFyZS1hbmFseXNpcy1mb3ItMjAzMNIBLWh0dHBzOi8vd3d3LmJlbnppbmdhLmNvbS9hbXAvY29udGVudC8zNDIwOTU1OQ?hl=en-IN&gl=IN&ceid=IN%3Aen,2023-09-04
51,Quantitation and integrity evaluation of RNA genome in lentiviral ...,Nature.com,news.google.com/articles/CBMiMmh0dHBzOi8vd3d3Lm5hdHVyZS5jb20vYXJ0aWNsZXMvczQxNTk4LTAyMy00MTY0NC140gEA?hl=en-IN&gl=IN&ceid=IN%3Aen,2023-09-02
23,India Ceramic Tiles Market A Rising Trajectory Skyrocketing Market Size Envisioned Ahead,Benzinga,news.google.com/articles/CBMijgFodHRwczovL3d3dy5iZW56aW5nYS5jb20vcHJlc3NyZWxlYXNlcy8yMy8wOS8zNDE2NTU4MS9pbmRpYS1jZXJhbWljLXRpbGVzLW1hcmtldC1hLXJpc2luZy10cmFqZWN0b3J5LXNreXJvY2tldGluZy1tYXJrZXQtc2l6ZS1lbnZpc2lvbmVkLWFoZWFk0gEtaHR0cHM6Ly93d3cuYmVuemluZ2EuY29tL2FtcC9jb250ZW50LzM0MTY1NTgx?hl=en-IN&gl=IN&ceid=IN%3Aen,2023-09-01
63,Capitol Beat: Fight back against opioid addiction | Local News ...,Barre Montpelier Times Argus,news.google.com/articles/CBMiiAFodHRwczovL3d3dy50aW1lc2FyZ3VzLmNvbS9uZXdzL2xvY2FsL2NhcGl0b2wtYmVhdC1maWdodC1iYWNrLWFnYWluc3Qtb3Bpb2lkLWFkZGljdGlvbi9hcnRpY2xlX2E0N2JjYTQ0LTQ3MDYtNTdkOC04YmFhLWM3OTZlYjNkMTgwOS5odG1s0gEA?hl=en-IN&gl=IN&ceid=IN%3Aen,2023-09-01
54,"Variable Air Volume (VAV) Operating System Market Restraints, Segments and Regional Analysis and Forecast",Benzinga,news.google.com/articles/CBMimQFodHRwczovL3d3dy5iZW56aW5nYS5jb20vcHJlc3NyZWxlYXNlcy8yMy8wOC8zNDE0NzEwOC92YXJpYWJsZS1haXItdm9sdW1lLXZhdi1vcGVyYXRpbmctc3lzdGVtLW1hcmtldC1yZXN0cmFpbnRzLXNlZ21lbnRzLWFuZC1yZWdpb25hbC1hbmFseXNpcy1hbmQtZm9yZWPSAS1odHRwczovL3d3dy5iZW56aW5nYS5jb20vYW1wL2NvbnRlbnQvMzQxNDcxMDg?hl=en-IN&gl=IN&ceid=IN%3Aen,2023-08-30
37,Individuals in Engineering and Technology Recognized for STEM ...,Society of Women Engineers,news.google.com/articles/CBMiNGh0dHBzOi8vYWxsdG9nZXRoZXIuc3dlLm9yZy8yMDIzLzA4L3N3ZS1hd2FyZHMtMjAyMy_SAQA?hl=en-IN&gl=IN&ceid=IN%3Aen,2023-08-28
7,Sustainable development is future of cement industry: Experts,The New Indian Express,news.google.com/articles/CBMihgFodHRwczovL3d3dy5uZXdpbmRpYW5leHByZXNzLmNvbS9zdGF0ZXMvdGVsYW5nYW5hLzIwMjMvYXVnLzI2L3N1c3RhaW5hYmxlLWRldmVsb3BtZW50LWlzZnV0dXJlLW9mLWNlbWVudC1pbmR1c3RyeS1leHBlcnRzLTI2MDg3NTIuaHRtbNIBhQFodHRwczovL3d3dy5uZXdpbmRpYW5leHByZXNzLmNvbS9zdGF0ZXMvdGVsYW5nYW5hLzIwMjMvYXVnLzI2L3N1c3RhaW5hYmxlLWRldmVsb3BtZW50LWlzZnV0dXJlLW9mLWNlbWVudC1pbmR1c3RyeS1leHBlcnRzLTI2MDg3NTIuYW1w?hl=en-IN&gl=IN&ceid=IN%3Aen,2023-08-26
