,title,source,link,date
26,Zelenskyy Visits Pentagon in Push for Breakthrough on Long-Range ...,Air & Space Forces Magazine,news.google.com/articles/CBMiSGh0dHBzOi8vd3d3LmFpcmFuZHNwYWNlZm9yY2VzLmNvbS96ZWxlbnNreXktcGVudGFnb24tbG9uZy1yYW5nZS13ZWFwb25zL9IBAA?hl=en-IN&gl=IN&ceid=IN%3Aen,2023-09-21
22,Dietary food patterns as determinants of the gut microbiome ...,Nature.com,news.google.com/articles/CBMiMmh0dHBzOi8vd3d3Lm5hdHVyZS5jb20vYXJ0aWNsZXMvczQxNTk4LTAyMy00MTY1MC160gEA?hl=en-IN&gl=IN&ceid=IN%3Aen,2023-09-21
33,Virucidal activity of three standard chemical disinfectants against ...,Nature.com,news.google.com/articles/CBMiMmh0dHBzOi8vd3d3Lm5hdHVyZS5jb20vYXJ0aWNsZXMvczQxNTk4LTAyMy00MjM3Ni040gEA?hl=en-IN&gl=IN&ceid=IN%3Aen,2023-09-21
32,Validation of the diagnostic efficacy of O-RADS in adnexal masses ...,Nature.com,news.google.com/articles/CBMiMmh0dHBzOi8vd3d3Lm5hdHVyZS5jb20vYXJ0aWNsZXMvczQxNTk4LTAyMy00MjgzNi0x0gEA?hl=en-IN&gl=IN&ceid=IN%3Aen,2023-09-21
30,European industrial policy: the lessons from NGEU in the new ...,Real Instituto Elcano,news.google.com/articles/CBMinQFodHRwczovL3d3dy5yZWFsaW5zdGl0dXRvZWxjYW5vLm9yZy9lbi9hbmFseXNlcy9ldXJvcGVhbi1pbmR1c3RyaWFsLXBvbGljeS10aGUtbGVzc29ucy1mcm9tLW5nZXUtaW4tdGhlLW5ldy1nZW9wb2xpdGljYWwtZnJhbWV3b3JrLW1vcmUtZnVuZHMtYXJlLW5vdC1lbm91Z2gv0gEA?hl=en-IN&gl=IN&ceid=IN%3Aen,2023-09-21
29,Brown Introduces Fresh Produce Procurement Reform Act,Senator Sherrod Brown,news.google.com/articles/CBMiWmh0dHBzOi8vd3d3LmJyb3duLnNlbmF0ZS5nb3YvbmV3c3Jvb20vcHJlc3MvcmVsZWFzZS9icm93bi1mcmVzaC1wcm9kdWNlLXByb2N1cmVtZW50LXJlZm9ybdIBAA?hl=en-IN&gl=IN&ceid=IN%3Aen,2023-09-21
27,The importance of accurate dissolved oxygen condensate/feedwater ...,Power Engineering®️,news.google.com/articles/CBMiaWh0dHBzOi8vd3d3LnBvd2VyLWVuZy5jb20vb20vdGhlLWltcG9ydGFuY2Utb2YtYWNjdXJhdGUtZGlzc29sdmVkLW94eWdlbi1jb25kZW5zYXRlLWZlZWR3YXRlci1tb25pdG9yaW5nL9IBAA?hl=en-IN&gl=IN&ceid=IN%3Aen,2023-09-21
1,Global Mobile Value Added Services (MVAS) Strategic Analysis ...,PR Newswire,news.google.com/articles/CBMi2AFodHRwczovL3d3dy5wcm5ld3N3aXJlLmNvbS9uZXdzLXJlbGVhc2VzL2dsb2JhbC1tb2JpbGUtdmFsdWUtYWRkZWQtc2VydmljZXMtbXZhcy1zdHJhdGVnaWMtYW5hbHlzaXMtcmVwb3J0LTIwMjMtMjAzMC0tLXJvYnVzdC1vdXRsb29rLWZvci1sb2NhdGlvbi1iYXNlZC1hZHZlcnRpc2luZy1zcHVycy1kZW1hbmQtZm9yLWxvY2F0aW9uLWJhc2VkLW12YXMtMzAxOTM0NTI4Lmh0bWzSAQA?hl=en-IN&gl=IN&ceid=IN%3Aen,2023-09-21
37,Landscape structure influences natural pest suppression in a rice ...,Nature.com,news.google.com/articles/CBMiMmh0dHBzOi8vd3d3Lm5hdHVyZS5jb20vYXJ0aWNsZXMvczQxNTk4LTAyMy00MTc4Ni150gEA?hl=en-IN&gl=IN&ceid=IN%3Aen,2023-09-21
23,Decorative Lamps and Smart Lighting Revolutionize Interior Lighting ...,Business Wire,news.google.com/articles/CBMivwFodHRwczovL3d3dy5idXNpbmVzc3dpcmUuY29tL25ld3MvaG9tZS8yMDIzMDkyMTM4MTA5OS9lbi9EZWNvcmF0aXZlLUxhbXBzLWFuZC1TbWFydC1MaWdodGluZy1SZXZvbHV0aW9uaXplLUludGVyaW9yLUxpZ2h0aW5nLU1hcmtldC1Qcm9qZWN0ZWQtdG8tR3Jvdy1hdC1hLUNBR1Itb2YtNS4yLS0tUmVzZWFyY2hBbmRNYXJrZXRzLmNvbdIBAA?hl=en-IN&gl=IN&ceid=IN%3Aen,2023-09-21
