,title,source,link,date
14,"Simultaneous quantification of lead, cadmium and zinc in superficial ...",Nature.com,news.google.com/articles/CBMiMmh0dHBzOi8vd3d3Lm5hdHVyZS5jb20vYXJ0aWNsZXMvczQxNTk4LTAyMy00NzUyNi020gEA?hl=en-IN&gl=IN&ceid=IN%3Aen,2023-11-19
12,Modelling habitat suitability for Moringa oleifera and Moringa ...,Nature.com,news.google.com/articles/CBMiMmh0dHBzOi8vd3d3Lm5hdHVyZS5jb20vYXJ0aWNsZXMvczQxNTk4LTAyMy00NzUzNS010gEA?hl=en-IN&gl=IN&ceid=IN%3Aen,2023-11-18
16,Application of bidirectional long short-term memory network for ...,Nature.com,news.google.com/articles/CBMiMmh0dHBzOi8vd3d3Lm5hdHVyZS5jb20vYXJ0aWNsZXMvczQxNTk4LTAyMy00NzYwNi030gEA?hl=en-IN&gl=IN&ceid=IN%3Aen,2023-11-18
19,Mapping brucellosis risk in Kenya and its implications for control ...,Nature.com,news.google.com/articles/CBMiMmh0dHBzOi8vd3d3Lm5hdHVyZS5jb20vYXJ0aWNsZXMvczQxNTk4LTAyMy00NzYyOC0x0gEA?hl=en-IN&gl=IN&ceid=IN%3Aen,2023-11-18
21,Perioperative outcomes of penile prosthesis implantation in ...,Nature.com,news.google.com/articles/CBMiMmh0dHBzOi8vd3d3Lm5hdHVyZS5jb20vYXJ0aWNsZXMvczQxNDQzLTAyMy0wMDc5Ni0w0gEA?hl=en-IN&gl=IN&ceid=IN%3Aen,2023-11-18
23,Range area and the fast–slow continuum of life history traits predict ...,Nature.com,news.google.com/articles/CBMiMmh0dHBzOi8vd3d3Lm5hdHVyZS5jb20vYXJ0aWNsZXMvczQxNTk4LTAyMy00NzQ0OC0z0gEA?hl=en-IN&gl=IN&ceid=IN%3Aen,2023-11-18
13,RFC Indicators of Compromise for IETF,National Cyber Security Centre,news.google.com/articles/CBMiR2h0dHBzOi8vd3d3Lm5jc2MuZ292LnVrL2Jsb2ctcG9zdC9yZmMtaW5kaWNhdG9ycy1vZi1jb21wcm9taXNlLWZvci1pZXRm0gEA?hl=en-IN&gl=IN&ceid=IN%3Aen,2023-11-17
17,A social path to human-like artificial intelligence,Nature.com,news.google.com/articles/CBMiMmh0dHBzOi8vd3d3Lm5hdHVyZS5jb20vYXJ0aWNsZXMvczQyMjU2LTAyMy0wMDc1NC140gEA?hl=en-IN&gl=IN&ceid=IN%3Aen,2023-11-17
18,Service-UNITED STATES OFFICE FURNITURE MARKET REPORT ...,IANS India Pvt Ltd,news.google.com/articles/CBMi0QFodHRwczovL2lhbnMuaW4vcHItd2lyZS1kZXRhaWwvdW5pdGVkLXN0YXRlcy1vZmZpY2UtZnVybml0dXJlLW1hcmtldC1yZXBvcnQtMjAyMy0yMDI4LWZlYXR1cmluZy1wcm9taW5lbnQtdmVuZG9ycy1zdGVlbGNhc2UtaGVybWFuLW1pbGxlci1oYXdvcnRoLWludGVybmF0aW9uYWwtaG5pLWdsb2JhbC1mdXJuaXR1cmUtZ3JvdXAtYW5kLXRla25pb24tMTgtMTEtMjAyM9IBAA?hl=en-IN&gl=IN&ceid=IN%3Aen,2023-11-17
20,Intricate role of intestinal microbe and metabolite in schizophrenia ...,BMC Psychiatry,news.google.com/articles/CBMiS2h0dHBzOi8vYm1jcHN5Y2hpYXRyeS5iaW9tZWRjZW50cmFsLmNvbS9hcnRpY2xlcy8xMC4xMTg2L3MxMjg4OC0wMjMtMDUzMjktetIBAA?hl=en-IN&gl=IN&ceid=IN%3Aen,2023-11-17
