,title,source,link,date
19,Plasma disinfection procedures for surfaces in emergency service ...,Nature.com,news.google.com/articles/CBMiMmh0dHBzOi8vd3d3Lm5hdHVyZS5jb20vYXJ0aWNsZXMvczQxNTk4LTAyMy00Nzc1OS010gEA?hl=en-IN&gl=IN&ceid=IN%3Aen,2023-11-25
32,Today’s top News - 25 November 2023,Saachi Baat,news.google.com/articles/CBMiQWh0dHBzOi8vc2FhY2hpYmFhdC5jb20vcG9saXRpY3MvdG9kYXlzLXRvcC1uZXdzLTI1LW5vdmVtYmVyLTIwMjMv0gEA?hl=en-IN&gl=IN&ceid=IN%3Aen,2023-11-25
13,Improved estimates of carbon dioxide emissions from drained ...,Nature.com,news.google.com/articles/CBMiMmh0dHBzOi8vd3d3Lm5hdHVyZS5jb20vYXJ0aWNsZXMvczQzMjQ3LTAyMy0wMTA5MS150gEA?hl=en-IN&gl=IN&ceid=IN%3Aen,2023-11-25
15,Muscle activity variability patterns and stride to stride fluctuations of ...,Nature.com,news.google.com/articles/CBMiMmh0dHBzOi8vd3d3Lm5hdHVyZS5jb20vYXJ0aWNsZXMvczQxNTk4LTAyMy00NzgyOC050gEA?hl=en-IN&gl=IN&ceid=IN%3Aen,2023-11-25
16,Dental public health education in Egypt: a cross-sectional survey ...,BMC Medical Education,news.google.com/articles/CBMiSGh0dHBzOi8vYm1jbWVkZWR1Yy5iaW9tZWRjZW50cmFsLmNvbS9hcnRpY2xlcy8xMC4xMTg2L3MxMjkwOS0wMjMtMDQ4ODgtOdIBAA?hl=en-IN&gl=IN&ceid=IN%3Aen,2023-11-25
17,Public discourses and government interventions behind China's ...,Nature.com,news.google.com/articles/CBMiMmh0dHBzOi8vd3d3Lm5hdHVyZS5jb20vYXJ0aWNsZXMvczQzMjQ3LTAyMy0wMTEwMS160gEA?hl=en-IN&gl=IN&ceid=IN%3Aen,2023-11-25
18,Temperature variation in caves and its significance for subterranean ...,Nature.com,news.google.com/articles/CBMiMmh0dHBzOi8vd3d3Lm5hdHVyZS5jb20vYXJ0aWNsZXMvczQxNTk4LTAyMy00ODAxNC030gEA?hl=en-IN&gl=IN&ceid=IN%3Aen,2023-11-25
24,Therapeutic plasma exchange in the treatment of COVID-19 induced ...,BMC Infectious Diseases,news.google.com/articles/CBMiSmh0dHBzOi8vYm1jaW5mZWN0ZGlzLmJpb21lZGNlbnRyYWwuY29tL2FydGljbGVzLzEwLjExODYvczEyODc5LTAyMy0wODgxNi020gEA?hl=en-IN&gl=IN&ceid=IN%3Aen,2023-11-25
23,Willingness toward post-mortem body donation to science at a ...,BMC Medical Ethics,news.google.com/articles/CBMiSmh0dHBzOi8vYm1jbWVkZXRoaWNzLmJpb21lZGNlbnRyYWwuY29tL2FydGljbGVzLzEwLjExODYvczEyOTEwLTAyMy0wMDk4Mi0x0gEA?hl=en-IN&gl=IN&ceid=IN%3Aen,2023-11-25
22,SIAM sourcing conclave focuses on building resilient supply chain,ETAuto,news.google.com/articles/CBMigwFodHRwczovL2F1dG8uZWNvbm9taWN0aW1lcy5pbmRpYXRpbWVzLmNvbS9uZXdzL2luZHVzdHJ5L3NpYW0tc291cmNpbmctY29uY2xhdmUtZm9jdXNlcy1vbi1idWlsZGluZy1yZXNpbGllbnQtc3VwcGx5LWNoYWluLzEwNTQ3MTM1NNIBhwFodHRwczovL2F1dG8uZWNvbm9taWN0aW1lcy5pbmRpYXRpbWVzLmNvbS9hbXAvbmV3cy9pbmR1c3RyeS9zaWFtLXNvdXJjaW5nLWNvbmNsYXZlLWZvY3VzZXMtb24tYnVpbGRpbmctcmVzaWxpZW50LXN1cHBseS1jaGFpbi8xMDU0NzEzNTQ?hl=en-IN&gl=IN&ceid=IN%3Aen,2023-11-24
