,title,source,link,date
14,Global Neuronavigation System Market Set to Reach $4.58 Billion ...,GlobeNewswire,news.google.com/articles/CBMixQFodHRwczovL3d3dy5nbG9iZW5ld3N3aXJlLmNvbS9uZXdzLXJlbGVhc2UvMjAyMy8xMC8wNi8yNzU1OTM2LzAvZW4vR2xvYmFsLU5ldXJvbmF2aWdhdGlvbi1TeXN0ZW0tTWFya2V0LVNldC10by1SZWFjaC00LTU4LUJpbGxpb24tYnktMjAzMS1Ecml2ZW4tYnktUmlzaW5nLVByZXZhbGVuY2Utb2YtTmV1cm9sb2dpY2FsLUNvbmRpdGlvbnMuaHRtbNIBAA?hl=en-IN&gl=IN&ceid=IN%3Aen,2023-10-06
24,"Prevalence, contributing factors, and economic implications of ...",Nature.com,news.google.com/articles/CBMiMmh0dHBzOi8vd3d3Lm5hdHVyZS5jb20vYXJ0aWNsZXMvczQxNTk4LTAyMy00Mzk3Ny160gEA?hl=en-IN&gl=IN&ceid=IN%3Aen,2023-10-06
35,An introduction to COMPASS: A new health and wellness resource ...,Police News,news.google.com/articles/CBMiuAFodHRwczovL3d3dy5wb2xpY2UxLmNvbS9oZWFsdGgtd2VsbG5lc3MvYXJ0aWNsZXMvYW4taW50cm9kdWN0aW9uLXRvLWNvbXBhc3MtYS1uZXctaGVhbHRoLWFuZC13ZWxsbmVzcy1yZXNvdXJjZS1mcm9tLXRoZS1vZmZpY2Utb2YtY29tbXVuaXR5LW9yaWVudGVkLXBvbGljaW5nLXNlcnZpY2VzLVRoYmlaeVpkNFlsNkJUbmkv0gEA?hl=en-IN&gl=IN&ceid=IN%3Aen,2023-10-06
34,Dual water-electricity cooperation improves economic benefits and ...,Nature.com,news.google.com/articles/CBMiMmh0dHBzOi8vd3d3Lm5hdHVyZS5jb20vYXJ0aWNsZXMvczQxNDY3LTAyMy00MjAwOS040gEA?hl=en-IN&gl=IN&ceid=IN%3Aen,2023-10-06
32,Eliminating the interference of water for direct sensing of submerged ...,Nature.com,news.google.com/articles/CBMiMmh0dHBzOi8vd3d3Lm5hdHVyZS5jb20vYXJ0aWNsZXMvczQxNTk4LTAyMy0zOTc1NC030gEA?hl=en-IN&gl=IN&ceid=IN%3Aen,2023-10-06
30,Phenotypic but not genetically predicted heart rate variability ...,Nature.com,news.google.com/articles/CBMiMmh0dHBzOi8vd3d3Lm5hdHVyZS5jb20vYXJ0aWNsZXMvczQyMDAzLTAyMy0wNTM3Ni150gEA?hl=en-IN&gl=IN&ceid=IN%3Aen,2023-10-06
29,Barriers and facilitators to anal cancer screening among people ...,BMC Public Health,news.google.com/articles/CBMiTWh0dHBzOi8vYm1jcHVibGljaGVhbHRoLmJpb21lZGNlbnRyYWwuY29tL2FydGljbGVzLzEwLjExODYvczEyODg5LTAyMy0xNjg0Ny020gEA?hl=en-IN&gl=IN&ceid=IN%3Aen,2023-10-06
26,"Global burden of asthma, & its impact on specific subgroups | JAA",Dove Medical Press,news.google.com/articles/CBMigwFodHRwczovL3d3dy5kb3ZlcHJlc3MuY29tL2dsb2JhbC1idXJkZW4tb2YtYXN0aG1hLWFuZC1pdHMtaW1wYWN0LW9uLXNwZWNpZmljLXN1Ymdyb3Vwcy1uYXNhbC1wb2wtcGVlci1yZXZpZXdlZC1mdWxsdGV4dC1hcnRpY2xlLUpBQdIBAA?hl=en-IN&gl=IN&ceid=IN%3Aen,2023-10-06
22,Increasing prevalence of malaria and acute dengue virus coinfection ...,Malaria Journal,news.google.com/articles/CBMiTGh0dHBzOi8vbWFsYXJpYWpvdXJuYWwuYmlvbWVkY2VudHJhbC5jb20vYXJ0aWNsZXMvMTAuMTE4Ni9zMTI5MzYtMDIzLTA0NzIzLXnSAQA?hl=en-IN&gl=IN&ceid=IN%3Aen,2023-10-06
21,A new research agenda for African generative AI,Nature.com,news.google.com/articles/CBMiMmh0dHBzOi8vd3d3Lm5hdHVyZS5jb20vYXJ0aWNsZXMvczQxNTYyLTAyMy0wMTczNS0x0gEA?hl=en-IN&gl=IN&ceid=IN%3Aen,2023-10-06
