,title,source,link,date
15,Observer Performance Evaluation of a Deep Learning Model for ...,Cureus,news.google.com/articles/CBMisgFodHRwczovL3d3dy5jdXJldXMuY29tL2FydGljbGVzLzE4MjEzNy1vYnNlcnZlci1wZXJmb3JtYW5jZS1ldmFsdWF0aW9uLW9mLWEtZGVlcC1sZWFybmluZy1tb2RlbC1mb3ItbXVsdGlsYWJlbC1jbGFzc2lmaWNhdGlvbi1vZi1hY3RpdmUtdHViZXJjdWxvc2lzLWx1bmctem9uZS13aXNlLW1hbmlmZXN0YXRpb25z0gEA?hl=en-IN&gl=IN&ceid=IN%3Aen,2023-09-09
16,Automotive Driver State Monitoring Systems Market Size 2023 | Data-Driven Insights with Adapting to Rapid,Benzinga,news.google.com/articles/CBMimQFodHRwczovL3d3dy5iZW56aW5nYS5jb20vcHJlc3NyZWxlYXNlcy8yMy8wOS8zNDM5ODIyMS9hdXRvbW90aXZlLWRyaXZlci1zdGF0ZS1tb25pdG9yaW5nLXN5c3RlbXMtbWFya2V0LXNpemUtMjAyMy1kYXRhLWRyaXZlbi1pbnNpZ2h0cy13aXRoLWFkYXB0aW5nLXRvLXLSAS1odHRwczovL3d3dy5iZW56aW5nYS5jb20vYW1wL2NvbnRlbnQvMzQzOTgyMjE?hl=en-IN&gl=IN&ceid=IN%3Aen,2023-09-09
19,"Allometric relationships between stem diameter, height and crown ...",Nature.com,news.google.com/articles/CBMiMmh0dHBzOi8vd3d3Lm5hdHVyZS5jb20vYXJ0aWNsZXMvczQxNTk4LTAyMy00MjIxOS020gEA?hl=en-IN&gl=IN&ceid=IN%3Aen,2023-09-09
20,Commercial Vehicle Fleet Management System Market Size 2023 | Data-Driven Insights with Adapting to Rapid,Benzinga,news.google.com/articles/CBMimQFodHRwczovL3d3dy5iZW56aW5nYS5jb20vcHJlc3NyZWxlYXNlcy8yMy8wOS8zNDQwMDIxMy9jb21tZXJjaWFsLXZlaGljbGUtZmxlZXQtbWFuYWdlbWVudC1zeXN0ZW0tbWFya2V0LXNpemUtMjAyMy1kYXRhLWRyaXZlbi1pbnNpZ2h0cy13aXRoLWFkYXB0aW5nLXRvLXLSAS1odHRwczovL3d3dy5iZW56aW5nYS5jb20vYW1wL2NvbnRlbnQvMzQ0MDAyMTM?hl=en-IN&gl=IN&ceid=IN%3Aen,2023-09-09
27,Analysis of compound health impacts of heatwave and COVID-19 in ...,Nature.com,news.google.com/articles/CBMiMmh0dHBzOi8vd3d3Lm5hdHVyZS5jb20vYXJ0aWNsZXMvczQxNTk4LTAyMy00MTg4MC0x0gEA?hl=en-IN&gl=IN&ceid=IN%3Aen,2023-09-09
18,Press Information Bureau,PIB,news.google.com/articles/CBMiNWh0dHBzOi8vcGliLmdvdi5pbi9QcmVzc1JlbGVhc2VQYWdlLmFzcHg_UFJJRD0xOTU1Njk20gEA?hl=en-IN&gl=IN&ceid=IN%3Aen,2023-09-08
23,Four-dimensional ultrasound guided embryo transfers improve live ...,Nature.com,news.google.com/articles/CBMiMmh0dHBzOi8vd3d3Lm5hdHVyZS5jb20vYXJ0aWNsZXMvczQxNTk4LTAyMy00MTMxMy160gEA?hl=en-IN&gl=IN&ceid=IN%3Aen,2023-09-08
21,Spatial–temporal distribution of global production–living–ecological ...,Nature.com,news.google.com/articles/CBMiMmh0dHBzOi8vd3d3Lm5hdHVyZS5jb20vYXJ0aWNsZXMvczQxNTk3LTAyMy0wMjQ5Ny0x0gEA?hl=en-IN&gl=IN&ceid=IN%3Aen,2023-09-07
24,Microgravity and evasion of plant innate immunity by human ...,Nature.com,news.google.com/articles/CBMiMmh0dHBzOi8vd3d3Lm5hdHVyZS5jb20vYXJ0aWNsZXMvczQxNTI2LTAyMy0wMDMyMy140gEA?hl=en-IN&gl=IN&ceid=IN%3Aen,2023-09-07
35,T2DM with goal-achieved HbA1c using digital models | PPA,Dove Medical Press,news.google.com/articles/CBMigwFodHRwczovL3d3dy5kb3ZlcHJlc3MuY29tL3BvcnRyYWl0LWZvci10eXBlLTItZGlhYmV0ZXMtd2l0aC1nb2FsLWFjaGlldmVkLWhiYTFjLXVzaW5nLWRpZ2l0YWwtZGktcGVlci1yZXZpZXdlZC1mdWxsdGV4dC1hcnRpY2xlLVBQQdIBAA?hl=en-IN&gl=IN&ceid=IN%3Aen,2023-09-07
