,title,source,link,date
8,Introducing the guidelines for secure AI - NCSC.GOV.UK,National Cyber Security Centre,news.google.com/articles/CBMiVWh0dHBzOi8vd3d3Lm5jc2MuZ292LnVrL2Jsb2ctcG9zdC9pbnRyb2R1Y2luZy1ndWlkZWxpbmVzLXNlY3VyZS1haS1zeXN0ZW0tZGV2ZWxvcG1lbnTSAQA?hl=en-IN&gl=IN&ceid=IN%3Aen,2023-11-27
14,Hyperwar Ascendant: The Global Race For Autonomous Military Supremacy,Forbes,news.google.com/articles/CBMieGh0dHBzOi8vd3d3LmZvcmJlcy5jb20vc2l0ZXMvYW1pcmh1c2Fpbi8yMDIzLzExLzI3L2h5cGVyd2FyLWFzY2VuZGFudC10aGUtZ2xvYmFsLXJhY2UtZm9yLWF1dG9ub21vdXMtbWlsaXRhcnktc3VwcmVtYWN5L9IBfGh0dHBzOi8vd3d3LmZvcmJlcy5jb20vc2l0ZXMvYW1pcmh1c2Fpbi8yMDIzLzExLzI3L2h5cGVyd2FyLWFzY2VuZGFudC10aGUtZ2xvYmFsLXJhY2UtZm9yLWF1dG9ub21vdXMtbWlsaXRhcnktc3VwcmVtYWN5L2FtcC8?hl=en-IN&gl=IN&ceid=IN%3Aen,2023-11-27
15,Rapid seaward expansion of seaport footprints worldwide ...,Nature.com,news.google.com/articles/CBMiMmh0dHBzOi8vd3d3Lm5hdHVyZS5jb20vYXJ0aWNsZXMvczQzMjQ3LTAyMy0wMTExMC150gEA?hl=en-IN&gl=IN&ceid=IN%3Aen,2023-11-27
18,Enhancing maize productivity by mitigating alkaline soil challenges ...,Nature.com,news.google.com/articles/CBMiMmh0dHBzOi8vd3d3Lm5hdHVyZS5jb20vYXJ0aWNsZXMvczQxNTk4LTAyMy00ODE2My050gEA?hl=en-IN&gl=IN&ceid=IN%3Aen,2023-11-27
19,Service-GLOBAL DISTRIBUTED ENERGY GENERATION (DEG ...,IANS India Pvt Ltd,news.google.com/articles/CBMingFodHRwczovL2lhbnMuaW4vcHItd2lyZS1kZXRhaWwvZ2xvYmFsLWRpc3RyaWJ1dGVkLWVuZXJneS1nZW5lcmF0aW9uLWRlZy1tYXJrZXQtcmVwb3J0LTIwMjMtZGctbWFya2V0LWFsaWducy13aXRoLWVzZy1nb2Fscy1pbmR1c3RyeS1vdXRsb29rLXRvLTIwMjgtMjctMTEtMjAyM9IBAA?hl=en-IN&gl=IN&ceid=IN%3Aen,2023-11-27
20,Study protocol for safety and efficacy of all-oral shortened regimens ...,BMC Infectious Diseases,news.google.com/articles/CBMiSmh0dHBzOi8vYm1jaW5mZWN0ZGlzLmJpb21lZGNlbnRyYWwuY29tL2FydGljbGVzLzEwLjExODYvczEyODc5LTAyMy0wODY0NC040gEA?hl=en-IN&gl=IN&ceid=IN%3Aen,2023-11-27
21,Trial of Head-Mounted Displays in Stargart Disease Rehab | OPTO,Dove Medical Press,news.google.com/articles/CBMihAFodHRwczovL3d3dy5kb3ZlcHJlc3MuY29tL2F0LWhvbWUtdHJpYWwtb2YtZm91ci1kaWZmZXJlbnQtaGVhZC1tb3VudGVkLWRpc3BsYXlzLWluLXZpc3VhbC1yZWhhYmktcGVlci1yZXZpZXdlZC1mdWxsdGV4dC1hcnRpY2xlLU9QVE_SAQA?hl=en-IN&gl=IN&ceid=IN%3Aen,2023-11-27
22,"Su-57 For India: Lethal Capabilities, Enticing Economic Benefits Could Make IAF Relook At Russian Jets?",EurAsian Times,news.google.com/articles/CBMiSmh0dHBzOi8vd3d3LmV1cmFzaWFudGltZXMuY29tL2luZGlhLWxldGhhbC1jYXBhYmlsaXRpZXMtZW50aWNpbmctZWNvbm9taWMv0gFKaHR0cHM6Ly93d3cuZXVyYXNpYW50aW1lcy5jb20vaW5kaWEtbGV0aGFsLWNhcGFiaWxpdGllcy1lbnRpY2luZy1lY29ub21pYy8?hl=en-IN&gl=IN&ceid=IN%3Aen,2023-11-27
23,India Agricultural Technology Adoption Market Analysis Report 2023 ...,GlobeNewswire,news.google.com/articles/CBMinAFodHRwczovL3d3dy5nbG9iZW5ld3N3aXJlLmNvbS9uZXdzLXJlbGVhc2UvMjAyMy8xMS8yNy8yNzg2Mjg2LzAvZW4vSW5kaWEtQWdyaWN1bHR1cmFsLVRlY2hub2xvZ3ktQWRvcHRpb24tTWFya2V0LUFuYWx5c2lzLVJlcG9ydC0yMDIzLUZvcmVjYXN0cy10by0yMDI4Lmh0bWzSAQA?hl=en-IN&gl=IN&ceid=IN%3Aen,2023-11-27
24,Nonadherence to immunosuppressants in transplant recipients | PPA,Dove Medical Press,news.google.com/articles/CBMigwFodHRwczovL3d3dy5kb3ZlcHJlc3MuY29tL25vbmFkaGVyZW5jZS10by1pbW11bm9zdXBwcmVzc2FudHMtYW1vbmctdHJhbnNwbGFudC1yZWNpcGllbnRzLWVtb3Rpb24tcGVlci1yZXZpZXdlZC1mdWxsdGV4dC1hcnRpY2xlLVBQQdIBAA?hl=en-IN&gl=IN&ceid=IN%3Aen,2023-11-27
