,title,source,link,date
9,World Combat Games open in Riyadh,Arab News,news.google.com/articles/CBMiJWh0dHBzOi8vd3d3LmFyYWJuZXdzLmNvbS9ub2RlLzIzOTQ1NjHSASlodHRwczovL3d3dy5hcmFibmV3cy5jb20vbm9kZS8yMzk0NTYxL2FtcA?hl=en-IN&gl=IN&ceid=IN%3Aen,2023-10-20
5,Ton-up Kohli stars as India overwhelm Bangladesh in World Cup,Arab News,news.google.com/articles/CBMiK2h0dHBzOi8vd3d3LmFyYWJuZXdzLmNvbS9ub2RlLzIzOTQzMTYvc3BvcnTSASlodHRwczovL3d3dy5hcmFibmV3cy5jb20vbm9kZS8yMzk0MzE2L2FtcA?hl=en-IN&gl=IN&ceid=IN%3Aen,2023-10-19
7,14 teams confirmed for FIBA 3x3 World Tour Abu Dhabi Masters 2023,Arab News,news.google.com/articles/CBMiK2h0dHBzOi8vd3d3LmFyYWJuZXdzLmNvbS9ub2RlLzIzOTM5NDEvc3BvcnTSASlodHRwczovL3d3dy5hcmFibmV3cy5jb20vbm9kZS8yMzkzOTQxL2FtcA?hl=en-IN&gl=IN&ceid=IN%3Aen,2023-10-19
12,Jim Ratcliffe could have a major say in Manchester United if he buys ...,Arab News,news.google.com/articles/CBMiJWh0dHBzOi8vd3d3LmFyYWJuZXdzLmNvbS9ub2RlLzIzOTQzNzHSASlodHRwczovL3d3dy5hcmFibmV3cy5jb20vbm9kZS8yMzk0MzcxL2FtcA?hl=en-IN&gl=IN&ceid=IN%3Aen,2023-10-19
6,World Cup: Netherlands confident they 'can beat any side' after ...,Arab News Pakistan,news.google.com/articles/CBMiKmh0dHBzOi8vd3d3LmFyYWJuZXdzLnBrL25vZGUvMjM5MzI2Ni9zcG9ydNIBAA?hl=en-IN&gl=IN&ceid=IN%3Aen,2023-10-18
8,Algerian Atal suspended by Nice for Israel-Hamas conflict post,Arab News,news.google.com/articles/CBMiK2h0dHBzOi8vd3d3LmFyYWJuZXdzLmNvbS9ub2RlLzIzOTM0NTYvc3BvcnTSASlodHRwczovL3d3dy5hcmFibmV3cy5jb20vbm9kZS8yMzkzNDU2L2FtcA?hl=en-IN&gl=IN&ceid=IN%3Aen,2023-10-18
10,Liverpool star Mo Salah calls on world leaders to 'prevent further ...,Arab News,news.google.com/articles/CBMiK2h0dHBzOi8vd3d3LmFyYWJuZXdzLmNvbS9ub2RlLzIzOTM3OTIvc3BvcnTSASlodHRwczovL3d3dy5hcmFibmV3cy5jb20vbm9kZS8yMzkzNzkyL2FtcA?hl=en-IN&gl=IN&ceid=IN%3Aen,2023-10-18
13,"Saudi 2034 World Cup bid boosted by full AFC support, FIFA's Asian ...",Arab News,news.google.com/articles/CBMiK2h0dHBzOi8vd3d3LmFyYWJuZXdzLmNvbS9ub2RlLzIzOTM2OTYvc3BvcnTSASlodHRwczovL3d3dy5hcmFibmV3cy5jb20vbm9kZS8yMzkzNjk2L2FtcA?hl=en-IN&gl=IN&ceid=IN%3Aen,2023-10-18
14,"Gio Reyna scores twice in 4-0 rout of Ghana, his first US goals since ...",Arab News,news.google.com/articles/CBMiK2h0dHBzOi8vd3d3LmFyYWJuZXdzLmNvbS9ub2RlLzIzOTMzMTYvc3BvcnTSASlodHRwczovL3d3dy5hcmFibmV3cy5jb20vbm9kZS8yMzkzMzE2L2FtcA?hl=en-IN&gl=IN&ceid=IN%3Aen,2023-10-18
15,Aramco Team Series set for historic first date in Riyadh,Arab News,news.google.com/articles/CBMiK2h0dHBzOi8vd3d3LmFyYWJuZXdzLmNvbS9ub2RlLzIzOTMwNDEvc3BvcnTSASlodHRwczovL3d3dy5hcmFibmV3cy5jb20vbm9kZS8yMzkzMDQxL2FtcA?hl=en-IN&gl=IN&ceid=IN%3Aen,2023-10-17
