,title,source,link,date
5,World Combat Games open in Riyadh,Arab News,news.google.com/articles/CBMiK2h0dHBzOi8vd3d3LmFyYWJuZXdzLmNvbS9ub2RlLzIzOTQ1NjEvc3BvcnTSAQA?hl=en-IN&gl=IN&ceid=IN%3Aen,2023-10-20
7,Tyson Fury lands in Riyadh for Francis Ngannou fight,Arab News,news.google.com/articles/CBMiK2h0dHBzOi8vd3d3LmFyYWJuZXdzLmNvbS9ub2RlLzIzOTMzNTEvc3BvcnTSASlodHRwczovL3d3dy5hcmFibmV3cy5jb20vbm9kZS8yMzkzMzUxL2FtcA?hl=en-IN&gl=IN&ceid=IN%3Aen,2023-10-20
4,Ton-up Kohli stars as India overwhelm Bangladesh in World Cup,Arab News,news.google.com/articles/CBMiK2h0dHBzOi8vd3d3LmFyYWJuZXdzLmNvbS9ub2RlLzIzOTQzMTYvc3BvcnTSASlodHRwczovL3d3dy5hcmFibmV3cy5jb20vbm9kZS8yMzk0MzE2L2FtcA?hl=en-IN&gl=IN&ceid=IN%3Aen,2023-10-19
6,Jim Ratcliffe could have a major say in Manchester United if he buys ...,Arab News,news.google.com/articles/CBMiJWh0dHBzOi8vd3d3LmFyYWJuZXdzLmNvbS9ub2RlLzIzOTQzNzHSASlodHRwczovL3d3dy5hcmFibmV3cy5jb20vbm9kZS8yMzk0MzcxL2FtcA?hl=en-IN&gl=IN&ceid=IN%3Aen,2023-10-19
9,India retain top ODI spot after thumping World Cup win over Pakistan,Arab News,news.google.com/articles/CBMiK2h0dHBzOi8vd3d3LmFyYWJuZXdzLmNvbS9ub2RlLzIzOTE1MzYvc3BvcnTSASlodHRwczovL3d3dy5hcmFibmV3cy5jb20vbm9kZS8yMzkxNTM2L2FtcA?hl=en-IN&gl=IN&ceid=IN%3Aen,2023-10-15
10,Pep Guardiola's daughter shares powerful post decrying Gaza war,Arab News,news.google.com/articles/CBMiK2h0dHBzOi8vd3d3LmFyYWJuZXdzLmNvbS9ub2RlLzIzOTE1NzYvc3BvcnTSASlodHRwczovL3d3dy5hcmFibmV3cy5jb20vbm9kZS8yMzkxNTc2L2FtcA?hl=en-IN&gl=IN&ceid=IN%3Aen,2023-10-15
11,Al-Shabab edge Al-Ahli in Saudi Women's Premier League clash,Arab News,news.google.com/articles/CBMiK2h0dHBzOi8vd3d3LmFyYWJuZXdzLmNvbS9ub2RlLzIzOTE2MTEvc3BvcnTSASlodHRwczovL3d3dy5hcmFibmV3cy5jb20vbm9kZS8yMzkxNjExL2FtcA?hl=en-IN&gl=IN&ceid=IN%3Aen,2023-10-15
