,title,source,link,date
39,The Wise Investor Group's Simon Hamilton Named to 2023 Virginia 500 Power List,Benzinga,news.google.com/articles/CBMihAFodHRwczovL3d3dy5iZW56aW5nYS5jb20vcHJlc3NyZWxlYXNlcy8yMy8wOS9uMzQ0Mzk1ODQvdGhlLXdpc2UtaW52ZXN0b3ItZ3JvdXBzLXNpbW9uLWhhbWlsdG9uLW5hbWVkLXRvLTIwMjMtdmlyZ2luaWEtNTAwLXBvd2VyLWxpc3TSAS1odHRwczovL3d3dy5iZW56aW5nYS5jb20vYW1wL2NvbnRlbnQvMzQ0Mzk1ODQ?hl=en-IN&gl=IN&ceid=IN%3Aen,2023-09-11
30,Belton's beautiful festive light trail is back with new installations for ...,Lincolnshire Live,news.google.com/articles/CBMiYWh0dHBzOi8vd3d3LmxpbmNvbG5zaGlyZWxpdmUuY28udWsvc3BlY2lhbC1mZWF0dXJlcy9iZWx0b25zLWJlYXV0aWZ1bC1mZXN0aXZlLWxpZ2h0LXRyYWlsLTg3MTUxMzHSAQA?hl=en-IN&gl=IN&ceid=IN%3Aen,2023-09-11
66,Optimus Prime Fund Management Co. Ltd. Reduces Holdings in ...,Best Stocks,news.google.com/articles/CBMiSGh0dHBzOi8vYmVzdHN0b2Nrcy5jb20vb3B0aW11cy1wcmltZS1mdW5kLW1hbmFnZW1lbnQtY28tbHRkLXJlZHVjZXMtaG9sL9IBAA?hl=en-IN&gl=IN&ceid=IN%3Aen,2023-09-11
65,"Macquarie Group Ltd. Decreases Stake in Motorola Solutions, Inc ...",Best Stocks,news.google.com/articles/CBMiSWh0dHBzOi8vYmVzdHN0b2Nrcy5jb20vbWFjcXVhcmllLWdyb3VwLWx0ZC1kZWNyZWFzZXMtc3Rha2UtaW4tbW90b3JvbGEtcy_SAQA?hl=en-IN&gl=IN&ceid=IN%3Aen,2023-09-11
6,Bank Of America Is Bullish On Raymond James: 'Diversified Approach Shines Through' - Raymond James Finl (,Benzinga,news.google.com/articles/CBMilQFodHRwczovL3d3dy5iZW56aW5nYS5jb20vYW5hbHlzdC1yYXRpbmdzL2FuYWx5c3QtY29sb3IvMjMvMDkvMzQ0NDgyNzIvYmFuay1vZi1hbWVyaWNhLWlzLWJ1bGxpc2gtb24tcmF5bW9uZC1qYW1lcy1kaXZlcnNpZmllZC1hcHByb2FjaC1zaGluZXMtdGhyb3VnaNIBLWh0dHBzOi8vd3d3LmJlbnppbmdhLmNvbS9hbXAvY29udGVudC8zNDQ0ODI3Mg?hl=en-IN&gl=IN&ceid=IN%3Aen,2023-09-11
7,Raymond James Maintains Outperform Rating for Phreesia: Here's What You Need To Know - Phreesia (NYSE:PHR,Benzinga,news.google.com/articles/CBMiigFodHRwczovL3d3dy5iZW56aW5nYS5jb20vYW5hbHlzdC1yYXRpbmdzLzIzLzA5LzM0NDUwMjU3L3JheW1vbmQtamFtZXMtbWFpbnRhaW5zLW91dHBlcmZvcm0tcmF0aW5nLWZvci1waHJlZXNpYS1oZXJlcy13aGF0LXlvdS1uZWVkLXRvLWtub3fSAS1odHRwczovL3d3dy5iZW56aW5nYS5jb20vYW1wL2NvbnRlbnQvMzQ0NTAyNTc?hl=en-IN&gl=IN&ceid=IN%3Aen,2023-09-11
8,Where Raymond James Finl Stands With Analysts - Raymond James Finl (NYSE:RJF),Benzinga,news.google.com/articles/CBMiZWh0dHBzOi8vd3d3LmJlbnppbmdhLmNvbS9hbmFseXN0LXJhdGluZ3MvMjMvMDkvMzQ0Mzk4NDUvd2hlcmUtcmF5bW9uZC1qYW1lcy1maW5sLXN0YW5kcy13aXRoLWFuYWx5c3Rz0gEtaHR0cHM6Ly93d3cuYmVuemluZ2EuY29tL2FtcC9jb250ZW50LzM0NDM5ODQ1?hl=en-IN&gl=IN&ceid=IN%3Aen,2023-09-11
9,Raymond James Weighs in on North American Construction Group ...,MarketBeat,news.google.com/articles/CBMiWWh0dHBzOi8vd3d3Lm1hcmtldGJlYXQuY29tL2luc3RhbnQtYWxlcnRzL255c2Utbm9hLWFuYWx5c3QtZWFybmluZ3MtZXN0aW1hdGVzLTIwMjMtMDktMTEv0gEA?hl=en-IN&gl=IN&ceid=IN%3Aen,2023-09-11
61,XTX Topco Ltd Acquires Stake in ADT Inc. Amidst Earnings ...,Best Stocks,news.google.com/articles/CBMiSWh0dHBzOi8vYmVzdHN0b2Nrcy5jb20veHR4LXRvcGNvLWx0ZC1hY3F1aXJlcy1zdGFrZS1pbi1hZHQtaW5jLWFtaWRzdC1lYS_SAQA?hl=en-IN&gl=IN&ceid=IN%3Aen,2023-09-11
43,Financial Services Roundup: Market Talk - WSJ,The Wall Street Journal,news.google.com/articles/CBMiVWh0dHBzOi8vd3d3Lndzai5jb20vZmluYW5jZS9pbnZlc3RpbmcvZmluYW5jaWFsLXNlcnZpY2VzLXJvdW5kdXAtbWFya2V0LXRhbGstZjEyMmZlNTTSAQA?hl=en-IN&gl=IN&ceid=IN%3Aen,2023-09-11
