,title,source,link,date
34,California Pistachios Add a Healthy Twist to Genelia Deshmukh's Dhamakedaar Diwali Celebrations,PSU Watch,news.google.com/articles/CBMiRGh0dHBzOi8vcHN1d2F0Y2guY29tL25ld3N1cGRhdGVzL3ByZXNzLXJlbGVhc2UvY2FsaWZvcm5pYS1waXN0YWNoaW9z0gFOaHR0cHM6Ly9wc3V3YXRjaC5jb20vYW1wL3N0b3J5L25ld3N1cGRhdGVzL3ByZXNzLXJlbGVhc2UvY2FsaWZvcm5pYS1waXN0YWNoaW9z?hl=en-IN&gl=IN&ceid=IN%3Aen,2023-11-09
25,Special campaign: Himachal Pradesh Police traces 140 missing persons,PSU Watch,news.google.com/articles/CBMiSGh0dHBzOi8vcHN1d2F0Y2guY29tL25ld3N1cGRhdGVzL3ByZXNzLXJlbGVhc2UvaHAtcG9saWNlLW1pc3NpbmctcGVyc29uc9IBUmh0dHBzOi8vcHN1d2F0Y2guY29tL2FtcC9zdG9yeS9uZXdzdXBkYXRlcy9wcmVzcy1yZWxlYXNlL2hwLXBvbGljZS1taXNzaW5nLXBlcnNvbnM?hl=en-IN&gl=IN&ceid=IN%3Aen,2023-11-09
27,My govt made 4 cr pucca houses for poor but I haven't made one for myself: PM Modi,PSU Watch,news.google.com/articles/CBMiQGh0dHBzOi8vcHN1d2F0Y2guY29tL25ld3N1cGRhdGVzL3ByZXNzLXJlbGVhc2UvZWxlY3Rpb25zLW1wLXBtLTPSAUpodHRwczovL3BzdXdhdGNoLmNvbS9hbXAvc3RvcnkvbmV3c3VwZGF0ZXMvcHJlc3MtcmVsZWFzZS9lbGVjdGlvbnMtbXAtcG0tMw?hl=en-IN&gl=IN&ceid=IN%3Aen,2023-11-09
28,3 judges appointed to SC; top court to now function with full strength of 34,PSU Watch,news.google.com/articles/CBMiQmh0dHBzOi8vcHN1d2F0Y2guY29tL25ld3N1cGRhdGVzL3ByZXNzLXJlbGVhc2UvbGF3LXNjLWFwcG9pbnRtZW50c9IBTGh0dHBzOi8vcHN1d2F0Y2guY29tL2FtcC9zdG9yeS9uZXdzdXBkYXRlcy9wcmVzcy1yZWxlYXNlL2xhdy1zYy1hcHBvaW50bWVudHM?hl=en-IN&gl=IN&ceid=IN%3Aen,2023-11-09
29,"Rajasthan HC allows govt doctor to contest assembly polls, rejoin duty if he loses",PSU Watch,news.google.com/articles/CBMiO2h0dHBzOi8vcHN1d2F0Y2guY29tL25ld3N1cGRhdGVzL3ByZXNzLXJlbGVhc2UvcmotaGMtZG9jdG9y0gFFaHR0cHM6Ly9wc3V3YXRjaC5jb20vYW1wL3N0b3J5L25ld3N1cGRhdGVzL3ByZXNzLXJlbGVhc2UvcmotaGMtZG9jdG9y?hl=en-IN&gl=IN&ceid=IN%3Aen,2023-11-09
30,"Telangana polls: CM K Chandrasekhar Rao to file nomination papers at Gajwel, Kamareddy today",PSU Watch,news.google.com/articles/CBMiUWh0dHBzOi8vcHN1d2F0Y2guY29tL25ld3N1cGRhdGVzL3ByZXNzLXJlbGVhc2UvZWxlY3Rpb25zLXRlbGFuZ2FuYS1rY3Itbm9taW5hdGlvbtIBW2h0dHBzOi8vcHN1d2F0Y2guY29tL2FtcC9zdG9yeS9uZXdzdXBkYXRlcy9wcmVzcy1yZWxlYXNlL2VsZWN0aW9ucy10ZWxhbmdhbmEta2NyLW5vbWluYXRpb24?hl=en-IN&gl=IN&ceid=IN%3Aen,2023-11-09
31,"'Gang war like' situation in Maharashtra cabinet over Maratha quota issue, claims Raut",PSU Watch,news.google.com/articles/CBMiPGh0dHBzOi8vcHN1d2F0Y2guY29tL25ld3N1cGRhdGVzL3ByZXNzLXJlbGVhc2UvbWgtcXVvdGEtcmF1dNIBRmh0dHBzOi8vcHN1d2F0Y2guY29tL2FtcC9zdG9yeS9uZXdzdXBkYXRlcy9wcmVzcy1yZWxlYXNlL21oLXF1b3RhLXJhdXQ?hl=en-IN&gl=IN&ceid=IN%3Aen,2023-11-09
32,BSF personnel injured in unprovoked firing by Pak rangers along IB in Jammu,PSU Watch,news.google.com/articles/CBMiP2h0dHBzOi8vcHN1d2F0Y2guY29tL25ld3N1cGRhdGVzL3ByZXNzLXJlbGVhc2UvamstbGQtYnNmLWZpcmluZ9IBSWh0dHBzOi8vcHN1d2F0Y2guY29tL2FtcC9zdG9yeS9uZXdzdXBkYXRlcy9wcmVzcy1yZWxlYXNlL2prLWxkLWJzZi1maXJpbmc?hl=en-IN&gl=IN&ceid=IN%3Aen,2023-11-09
33,Sad that accomplishments of athletes with intellectual disabilities often forgotten: HC,PSU Watch,news.google.com/articles/CBMiRWh0dHBzOi8vcHN1d2F0Y2guY29tL25ld3N1cGRhdGVzL3ByZXNzLXJlbGVhc2UvZGwtaGMtc3BlY2lhbC1vbHltcGljc9IBT2h0dHBzOi8vcHN1d2F0Y2guY29tL2FtcC9zdG9yeS9uZXdzdXBkYXRlcy9wcmVzcy1yZWxlYXNlL2RsLWhjLXNwZWNpYWwtb2x5bXBpY3M?hl=en-IN&gl=IN&ceid=IN%3Aen,2023-11-09
35,"Adani Ports Q2 profit rises 1.37 pc to Rs 1,762 cr",PSU Watch,news.google.com/articles/CBMiSGh0dHBzOi8vcHN1d2F0Y2guY29tL25ld3N1cGRhdGVzL3ByZXNzLXJlbGVhc2UvYml6LXJlc3VsdHMtbGQtYWRhbmlwb3J0c9IBAA?hl=en-IN&gl=IN&ceid=IN%3Aen,2023-11-09
