,title,source,link,date
0,Breakingviews - Nomura is merely first in line for new China risk,Reuters,news.google.com/articles/CBMiXGh0dHBzOi8vd3d3LnJldXRlcnMuY29tL2JyZWFraW5ndmlld3Mvbm9tdXJhLWlzLW1lcmVseS1maXJzdC1saW5lLW5ldy1jaGluYS1yaXNrLTIwMjMtMDktMjUv0gEA?hl=en-IN&gl=IN&ceid=IN%3Aen,2023-09-25
11,Ethiopia: Misplaced opposition to the Grand Ethiopian Renaissance ...,"ZeHabesha | Ethiopian News, Video, Analysis and Opinion",news.google.com/articles/CBMiH2h0dHBzOi8vemVoYWJlc2hhLmNvbS80MDA2NTEtMi_SAQA?hl=en-IN&gl=IN&ceid=IN%3Aen,2023-09-25
27,Best Things To Do This Week In Los Angeles And SoCal: Sept. 25 - 28,LAist,news.google.com/articles/CBMieWh0dHBzOi8vbGFpc3QuY29tL25ld3MvYXJ0cy1hbmQtZW50ZXJ0YWlubWVudC9iZXN0LXRoaW5ncy10by1kby10aGlzLXdlZWstbG9zLWFuZ2VsZXMtc291dGhlcm4tY2FsaWZvcm5pYS1zZXB0ZW1iZXItMjUtMjjSAQA?hl=en-IN&gl=IN&ceid=IN%3Aen,2023-09-25
20,Libya's Top Prosecutor Says Several officials Jailed as Part of ...,Asharq Al-awsat - English,news.google.com/articles/CBMieWh0dHBzOi8vZW5nbGlzaC5hYXdzYXQuY29tL2FyYWItd29ybGQvNDU2NjkwMS1saWJ5YXMtdG9wLXByb3NlY3V0b3Itc2F5cy1zZXZlcmFsLW9mZmljaWFscy1qYWlsZWQtcGFydC1pbnZlc3RpZ2F0aW9uLWRhbXPSAQA?hl=en-IN&gl=IN&ceid=IN%3Aen,2023-09-25
19,Ali Ghodsi CEO and Co-Founder of Databricks Announced as a Keynote Speaker for Money20/20 USA,Benzinga,news.google.com/articles/CBMikwFodHRwczovL3d3dy5iZW56aW5nYS5jb20vcHJlc3NyZWxlYXNlcy8yMy8wOS9iMzQ4NjAxODQvYWxpLWdob2RzaS1jZW8tYW5kLWNvLWZvdW5kZXItb2YtZGF0YWJyaWNrcy1hbm5vdW5jZWQtYXMtYS1rZXlub3RlLXNwZWFrZXItZm9yLW1vbmV5MjAyMC11c2HSAS1odHRwczovL3d3dy5iZW56aW5nYS5jb20vYW1wL2NvbnRlbnQvMzQ4NjAxODQ?hl=en-IN&gl=IN&ceid=IN%3Aen,2023-09-25
2,Global Migraine Nasal Spray Market slated to reach US$ 983.5 ...,GlobeNewswire,news.google.com/articles/CBMixAFodHRwczovL3d3dy5nbG9iZW5ld3N3aXJlLmNvbS9uZXdzLXJlbGVhc2UvMjAyMy8wOS8yNS8yNzQ4NzI0LzAvZW4vR2xvYmFsLU1pZ3JhaW5lLU5hc2FsLVNwcmF5LU1hcmtldC1zbGF0ZWQtdG8tcmVhY2gtVVMtOTgzLTUtbWlsbGlvbi1ieS0yMDMzLWV4cGFuZGluZy1hdC1hLTctQ0FHUi1GdXR1cmUtTWFya2V0LUluc2lnaHRzLUluYy5odG1s0gEA?hl=en-IN&gl=IN&ceid=IN%3Aen,2023-09-25
14,Syrian Observatory: Int'l Coalition Arrests Two ISIS Commanders in ...,Asharq Al-awsat - English,news.google.com/articles/CBMifGh0dHBzOi8vZW5nbGlzaC5hYXdzYXQuY29tL2FyYWItd29ybGQvNDU2NjczMS1zeXJpYW4tb2JzZXJ2YXRvcnktaW50JUUyJTgwJTk5bC1jb2FsaXRpb24tYXJyZXN0cy10d28taXNpcy1jb21tYW5kZXJzLWhhc2FrYWjSAQA?hl=en-IN&gl=IN&ceid=IN%3Aen,2023-09-25
16,Egypt to Vote for President in December,Asharq Al-awsat - English,news.google.com/articles/CBMiS2h0dHBzOi8vZW5nbGlzaC5hYXdzYXQuY29tL2FyYWItd29ybGQvNDU2NzY1Ni1lZ3lwdC12b3RlLXByZXNpZGVudC1kZWNlbWJlctIBAA?hl=en-IN&gl=IN&ceid=IN%3Aen,2023-09-25
7,China Metaverse Action Plan: Three-Year National Development ...,China Briefing,news.google.com/articles/CBMibWh0dHBzOi8vd3d3LmNoaW5hLWJyaWVmaW5nLmNvbS9uZXdzL2NoaW5hLXJlbGVhc2VzLXRocmVlLXllYXItYWN0aW9uLXBsYW4tZm9yLW1ldGF2ZXJzZS1pbmR1c3RyeS1kZXZlbG9wbWVudC_SAQA?hl=en-IN&gl=IN&ceid=IN%3Aen,2023-09-25
5,GERD Dispute Takes Center Stage at UN Amid Ongoing Negotiations,Asharq Al-awsat - English,news.google.com/articles/CBMiamh0dHBzOi8vZW5nbGlzaC5hYXdzYXQuY29tL2FyYWItd29ybGQvNDU2NjU4MS1nZXJkLWRpc3B1dGUtdGFrZXMtY2VudGVyLXN0YWdlLXVuLWFtaWQtb25nb2luZy1uZWdvdGlhdGlvbnPSAQA?hl=en-IN&gl=IN&ceid=IN%3Aen,2023-09-25
