,title,source,link,date
47,"Electronic Caliper Market Analysis: Market Size, Share, Trends, Growth Drivers, Restraints, Key Players,",Benzinga,news.google.com/articles/CBMimQFodHRwczovL3d3dy5iZW56aW5nYS5jb20vcHJlc3NyZWxlYXNlcy8yMy8wOS8zNDE5MjMyOC9lbGVjdHJvbmljLWNhbGlwZXItbWFya2V0LWFuYWx5c2lzLW1hcmtldC1zaXplLXNoYXJlLXRyZW5kcy1ncm93dGgtZHJpdmVycy1yZXN0cmFpbnRzLWtleS1wbGF5ZXJzLW_SAS1odHRwczovL3d3dy5iZW56aW5nYS5jb20vYW1wL2NvbnRlbnQvMzQxOTIzMjg?hl=en-IN&gl=IN&ceid=IN%3Aen,2023-09-03
42,"The SCMS Software market's types, applications, and regional analysis are all included in this report, wi",Benzinga,news.google.com/articles/CBMimQFodHRwczovL3d3dy5iZW56aW5nYS5jb20vcHJlc3NyZWxlYXNlcy8yMy8wOS8zNDE5Mjc2Ny90aGUtc2Ntcy1zb2Z0d2FyZS1tYXJrZXRzLXR5cGVzLWFwcGxpY2F0aW9ucy1hbmQtcmVnaW9uYWwtYW5hbHlzaXMtYXJlLWFsbC1pbmNsdWRlZC1pbi10aGlzLXJlcG9ydC3SAS1odHRwczovL3d3dy5iZW56aW5nYS5jb20vYW1wL2NvbnRlbnQvMzQxOTI3Njc?hl=en-IN&gl=IN&ceid=IN%3Aen,2023-09-03
41,Traversing the Cocoa Derivatives market Size by means of a CAGR of 10.7% that takes into account market s,Benzinga,news.google.com/articles/CBMimQFodHRwczovL3d3dy5iZW56aW5nYS5jb20vcHJlc3NyZWxlYXNlcy8yMy8wOS8zNDE5MzE4Ny90cmF2ZXJzaW5nLXRoZS1jb2NvYS1kZXJpdmF0aXZlcy1tYXJrZXQtc2l6ZS1ieS1tZWFucy1vZi1hLWNhZ3Itb2YtMTAtNy10aGF0LXRha2VzLWludG8tYWNjb3VudC1tYXLSAS1odHRwczovL3d3dy5iZW56aW5nYS5jb20vYW1wL2NvbnRlbnQvMzQxOTMxODc?hl=en-IN&gl=IN&ceid=IN%3Aen,2023-09-03
14,Britain has an opportunity to help Ukraine build a major defence ...,The Telegraph,news.google.com/articles/CBMiaGh0dHBzOi8vd3d3LnRlbGVncmFwaC5jby51ay9idXNpbmVzcy8yMDIzLzA5LzAzL2JyaXRhaW4tb3Bwb3J0dW5pdHktaGVscC11a3JhaW5lLWJ1aWxkLWRlZmVuY2UtaW5kdXN0cnkv0gEA?hl=en-IN&gl=IN&ceid=IN%3Aen,2023-09-03
35,"Seasoning and Dressing Market Overview: Analyzing Market Size, Value and Share with a CAGR of 11.2% from",Benzinga,news.google.com/articles/CBMimQFodHRwczovL3d3dy5iZW56aW5nYS5jb20vcHJlc3NyZWxlYXNlcy8yMy8wOS8zNDE5MzUxOC9zZWFzb25pbmctYW5kLWRyZXNzaW5nLW1hcmtldC1vdmVydmlldy1hbmFseXppbmctbWFya2V0LXNpemUtdmFsdWUtYW5kLXNoYXJlLXdpdGgtYS1jYWdyLW9mLTExLTItZnLSAS1odHRwczovL3d3dy5iZW56aW5nYS5jb20vYW1wL2NvbnRlbnQvMzQxOTM1MTg?hl=en-IN&gl=IN&ceid=IN%3Aen,2023-09-03
0,"Dividend Stocks: IRCON International, Max Healthcare, among others to trade ex-dividend next week; check full list | Mint",Mint,news.google.com/articles/CBMitAFodHRwczovL3d3dy5saXZlbWludC5jb20vbWFya2V0L3N0b2NrLW1hcmtldC1uZXdzL2RpdmlkZW5kLXN0b2Nrcy1pcmNvbi1pbnRlcm5hdGlvbmFsLW1heC1oZWFsdGhjYXJlLWFtb25nLW90aGVycy10by10cmFkZS1leC1kaXZpZGVuZC1uZXh0LXdlZWstY2hlY2stZnVsbC1saXN0LTExNjkzNjU2NjI1MzU4Lmh0bWzSAbgBaHR0cHM6Ly93d3cubGl2ZW1pbnQuY29tL21hcmtldC9zdG9jay1tYXJrZXQtbmV3cy9kaXZpZGVuZC1zdG9ja3MtaXJjb24taW50ZXJuYXRpb25hbC1tYXgtaGVhbHRoY2FyZS1hbW9uZy1vdGhlcnMtdG8tdHJhZGUtZXgtZGl2aWRlbmQtbmV4dC13ZWVrLWNoZWNrLWZ1bGwtbGlzdC9hbXAtMTE2OTM2NTY2MjUzNTguaHRtbA?hl=en-IN&gl=IN&ceid=IN%3Aen,2023-09-02
23,"The Industrial Heating Equipment market's types, applications, and regional analysis are all thoroughly c",Benzinga,news.google.com/articles/CBMimQFodHRwczovL3d3dy5iZW56aW5nYS5jb20vcHJlc3NyZWxlYXNlcy8yMy8wOS8zNDE5MTg1OC90aGUtaW5kdXN0cmlhbC1oZWF0aW5nLWVxdWlwbWVudC1tYXJrZXRzLXR5cGVzLWFwcGxpY2F0aW9ucy1hbmQtcmVnaW9uYWwtYW5hbHlzaXMtYXJlLWFsbC10aG9yb3VnaGzSAS1odHRwczovL3d3dy5iZW56aW5nYS5jb20vYW1wL2NvbnRlbnQvMzQxOTE4NTg?hl=en-IN&gl=IN&ceid=IN%3Aen,2023-09-02
74,The latest trend analysis for the Potassium Bromate market suggests that it will experience steady growth,Benzinga,news.google.com/articles/CBMimQFodHRwczovL3d3dy5iZW56aW5nYS5jb20vcHJlc3NyZWxlYXNlcy8yMy8wOS8zNDE5MTQ3NS90aGUtbGF0ZXN0LXRyZW5kLWFuYWx5c2lzLWZvci10aGUtcG90YXNzaXVtLWJyb21hdGUtbWFya2V0LXN1Z2dlc3RzLXRoYXQtaXQtd2lsbC1leHBlcmllbmNlLXN0ZWFkeS3SAS1odHRwczovL3d3dy5iZW56aW5nYS5jb20vYW1wL2NvbnRlbnQvMzQxOTE0NzU?hl=en-IN&gl=IN&ceid=IN%3Aen,2023-09-02
63,"Based on those growth rates of 12.7% CAGRand the related drivers and limits, Underfloor Heating Actuator",Benzinga,news.google.com/articles/CBMimQFodHRwczovL3d3dy5iZW56aW5nYS5jb20vcHJlc3NyZWxlYXNlcy8yMy8wOS8zNDE5MTkzNC9iYXNlZC1vbi10aG9zZS1ncm93dGgtcmF0ZXMtb2YtMTItNy1jYWdyYW5kLXRoZS1yZWxhdGVkLWRyaXZlcnMtYW5kLWxpbWl0cy11bmRlcmZsb29yLWhlYXRpbmctYWN0dWHSAS1odHRwczovL3d3dy5iZW56aW5nYS5jb20vYW1wL2NvbnRlbnQvMzQxOTE5MzQ?hl=en-IN&gl=IN&ceid=IN%3Aen,2023-09-02
56,"By projecting a 12% CAGR growth rate until 2030, this report provides an in-depth and thorough analysis o",Benzinga,news.google.com/articles/CBMimQFodHRwczovL3d3dy5iZW56aW5nYS5jb20vcHJlc3NyZWxlYXNlcy8yMy8wOS8zNDE5MTQyMy9ieS1wcm9qZWN0aW5nLWEtMTItY2Fnci1ncm93dGgtcmF0ZS11bnRpbC0yMDMwLXRoaXMtcmVwb3J0LXByb3ZpZGVzLWFuLWluLWRlcHRoLWFuZC10aG9yb3VnaC1hbmFseXPSAS1odHRwczovL3d3dy5iZW56aW5nYS5jb20vYW1wL2NvbnRlbnQvMzQxOTE0MjM?hl=en-IN&gl=IN&ceid=IN%3Aen,2023-09-02
