,title,source,link,date
40,"Modified Wheels Market Size: Demand Supply Situation, Market Share, Volume, Growth Analysis, and Market S",Benzinga,news.google.com/articles/CBMimQFodHRwczovL3d3dy5iZW56aW5nYS5jb20vcHJlc3NyZWxlYXNlcy8yMy8wOS8zNDE5NTIwNS9tb2RpZmllZC13aGVlbHMtbWFya2V0LXNpemUtZGVtYW5kLXN1cHBseS1zaXR1YXRpb24tbWFya2V0LXNoYXJlLXZvbHVtZS1ncm93dGgtYW5hbHlzaXMtYW5kLW1hcmtldC3SAS1odHRwczovL3d3dy5iZW56aW5nYS5jb20vYW1wL2NvbnRlbnQvMzQxOTUyMDU?hl=en-IN&gl=IN&ceid=IN%3Aen,2023-09-04
13,4D Printing Industry: Shaping the Future One Layer at a Time (2023-2033 Forecast),Benzinga,news.google.com/articles/CBMihAFodHRwczovL3d3dy5iZW56aW5nYS5jb20vcHJlc3NyZWxlYXNlcy8yMy8wOS8zNDE5NjcwMi80ZC1wcmludGluZy1pbmR1c3RyeS1zaGFwaW5nLXRoZS1mdXR1cmUtb25lLWxheWVyLWF0LWEtdGltZS0yMDIzLTIwMzMtZm9yZWNhc3TSAS1odHRwczovL3d3dy5iZW56aW5nYS5jb20vYW1wL2NvbnRlbnQvMzQxOTY3MDI?hl=en-IN&gl=IN&ceid=IN%3Aen,2023-09-04
45,Comprehensive evaluation on the Probiotic Juice Beverage market with suspected CAGR of 7.5% boosted from,Benzinga,news.google.com/articles/CBMimQFodHRwczovL3d3dy5iZW56aW5nYS5jb20vcHJlc3NyZWxlYXNlcy8yMy8wOS8zNDE5NTAwMC9jb21wcmVoZW5zaXZlLWV2YWx1YXRpb24tb24tdGhlLXByb2Jpb3RpYy1qdWljZS1iZXZlcmFnZS1tYXJrZXQtd2l0aC1zdXNwZWN0ZWQtY2Fnci1vZi03LTUtYm9vc3RlZC3SAS1odHRwczovL3d3dy5iZW56aW5nYS5jb20vYW1wL2NvbnRlbnQvMzQxOTUwMDA?hl=en-IN&gl=IN&ceid=IN%3Aen,2023-09-04
78,Fly Swatter Market Size studies with estimated future CAGR of 14% investigates the market's expansion for,Benzinga,news.google.com/articles/CBMimQFodHRwczovL3d3dy5iZW56aW5nYS5jb20vcHJlc3NyZWxlYXNlcy8yMy8wOS8zNDE5MzY5OS9mbHktc3dhdHRlci1tYXJrZXQtc2l6ZS1zdHVkaWVzLXdpdGgtZXN0aW1hdGVkLWZ1dHVyZS1jYWdyLW9mLTE0LWludmVzdGlnYXRlcy10aGUtbWFya2V0cy1leHBhbnNpb27SAS1odHRwczovL3d3dy5iZW56aW5nYS5jb20vYW1wL2NvbnRlbnQvMzQxOTM2OTk?hl=en-IN&gl=IN&ceid=IN%3Aen,2023-09-03
71,"By offering a detailed examination of the market overview and growth outlook, this report provides a comp",Benzinga,news.google.com/articles/CBMimQFodHRwczovL3d3dy5iZW56aW5nYS5jb20vcHJlc3NyZWxlYXNlcy8yMy8wOS8zNDE5NDE0NC9ieS1vZmZlcmluZy1hLWRldGFpbGVkLWV4YW1pbmF0aW9uLW9mLXRoZS1tYXJrZXQtb3ZlcnZpZXctYW5kLWdyb3d0aC1vdXRsb29rLXRoaXMtcmVwb3J0LXByb3ZpZGVzLWHSAS1odHRwczovL3d3dy5iZW56aW5nYS5jb20vYW1wL2NvbnRlbnQvMzQxOTQxNDQ?hl=en-IN&gl=IN&ceid=IN%3Aen,2023-09-03
68,The analysis on Electric Steam Press market size in terms of value ...,Benzinga,news.google.com/articles/CBMimQFodHRwczovL3d3dy5iZW56aW5nYS5jb20vcHJlc3NyZWxlYXNlcy8yMy8wOS8zNDE5NDcwMC90aGUtYW5hbHlzaXMtb24tZWxlY3RyaWMtc3RlYW0tcHJlc3MtbWFya2V0LXNpemUtaW4tdGVybXMtb2YtdmFsdWUtc2VnbWVudC1tYXJrZXQtc2hhcmUtYW5kLXNlZ21lbnTSAQA?hl=en-IN&gl=IN&ceid=IN%3Aen,2023-09-03
60,"The SCMS Software market's types, applications, and regional analysis are all included in this report, wi",Benzinga,news.google.com/articles/CBMimQFodHRwczovL3d3dy5iZW56aW5nYS5jb20vcHJlc3NyZWxlYXNlcy8yMy8wOS8zNDE5Mjc2Ny90aGUtc2Ntcy1zb2Z0d2FyZS1tYXJrZXRzLXR5cGVzLWFwcGxpY2F0aW9ucy1hbmQtcmVnaW9uYWwtYW5hbHlzaXMtYXJlLWFsbC1pbmNsdWRlZC1pbi10aGlzLXJlcG9ydC3SAS1odHRwczovL3d3dy5iZW56aW5nYS5jb20vYW1wL2NvbnRlbnQvMzQxOTI3Njc?hl=en-IN&gl=IN&ceid=IN%3Aen,2023-09-03
59,Traversing the Cocoa Derivatives market Size by means of a CAGR of 10.7% that takes into account market s,Benzinga,news.google.com/articles/CBMimQFodHRwczovL3d3dy5iZW56aW5nYS5jb20vcHJlc3NyZWxlYXNlcy8yMy8wOS8zNDE5MzE4Ny90cmF2ZXJzaW5nLXRoZS1jb2NvYS1kZXJpdmF0aXZlcy1tYXJrZXQtc2l6ZS1ieS1tZWFucy1vZi1hLWNhZ3Itb2YtMTAtNy10aGF0LXRha2VzLWludG8tYWNjb3VudC1tYXLSAS1odHRwczovL3d3dy5iZW56aW5nYS5jb20vYW1wL2NvbnRlbnQvMzQxOTMxODc?hl=en-IN&gl=IN&ceid=IN%3Aen,2023-09-03
24,Britain has an opportunity to help Ukraine build a major defence ...,The Telegraph,news.google.com/articles/CBMiaGh0dHBzOi8vd3d3LnRlbGVncmFwaC5jby51ay9idXNpbmVzcy8yMDIzLzA5LzAzL2JyaXRhaW4tb3Bwb3J0dW5pdHktaGVscC11a3JhaW5lLWJ1aWxkLWRlZmVuY2UtaW5kdXN0cnkv0gEA?hl=en-IN&gl=IN&ceid=IN%3Aen,2023-09-03
55,"Seasoning and Dressing Market Overview: Analyzing Market Size, Value and Share with a CAGR of 11.2% from",Benzinga,news.google.com/articles/CBMimQFodHRwczovL3d3dy5iZW56aW5nYS5jb20vcHJlc3NyZWxlYXNlcy8yMy8wOS8zNDE5MzUxOC9zZWFzb25pbmctYW5kLWRyZXNzaW5nLW1hcmtldC1vdmVydmlldy1hbmFseXppbmctbWFya2V0LXNpemUtdmFsdWUtYW5kLXNoYXJlLXdpdGgtYS1jYWdyLW9mLTExLTItZnLSAS1odHRwczovL3d3dy5iZW56aW5nYS5jb20vYW1wL2NvbnRlbnQvMzQxOTM1MTg?hl=en-IN&gl=IN&ceid=IN%3Aen,2023-09-03
