,title,source,link,date
3,Jio-Facebook Deal: SAT To Hear Reliance’s Appeal Against SEBI Penalty On Oct. 31,BQ Prime,news.google.com/articles/CBMibmh0dHBzOi8vd3d3LmJxcHJpbWUuY29tL2J1c2luZXNzL2ppby1mYWNlYm9vay1kZWFsLXNhdC10by1oZWFyLXJlbGlhbmNlcy1hcHBlYWwtYWdhaW5zdC1zZWJpLXBlbmFsdHktb24tb2N0LTMx0gFyaHR0cHM6Ly93d3cuYnFwcmltZS5jb20vYW1wL2J1c2luZXNzL2ppby1mYWNlYm9vay1kZWFsLXNhdC10by1oZWFyLXJlbGlhbmNlcy1hcHBlYWwtYWdhaW5zdC1zZWJpLXBlbmFsdHktb24tb2N0LTMx?hl=en-IN&gl=IN&ceid=IN%3Aen,2023-10-11
11,Prabhudas Lilladher Advises Buying Maruti Suzuki India with a ...,Share Price India News,news.google.com/articles/CBMic2h0dHBzOi8vc2hhcmVwcmljZWluZGlhLmNvbS9wcmFiaHVkYXMtbGlsbGFkaGVyLWFkdmlzZXMtYnV5aW5nLW1hcnV0aS1zdXp1a2ktaW5kaWEtd2l0aC1hLXRhcmdldC1wcmljZS1vZi1ycy0xMTUwMC_SAQA?hl=en-IN&gl=IN&ceid=IN%3Aen,2023-10-11
12,Prabhudas Lilladher Recommends Buying Bharat Forge with a ...,Share Price India News,news.google.com/articles/CBMibmh0dHBzOi8vc2hhcmVwcmljZWluZGlhLmNvbS9wcmFiaHVkYXMtbGlsbGFkaGVyLXJlY29tbWVuZHMtYnV5aW5nLWJoYXJhdC1mb3JnZS13aXRoLWEtdGFyZ2V0LXByaWNlLW9mLXJzLTExNzAv0gEA?hl=en-IN&gl=IN&ceid=IN%3Aen,2023-10-11
13,Prabhudas Lilladher Recommends Buying Tata Motors With a ...,Share Price India News,news.google.com/articles/CBMibGh0dHBzOi8vc2hhcmVwcmljZWluZGlhLmNvbS9wcmFiaHVkYXMtbGlsbGFkaGVyLXJlY29tbWVuZHMtYnV5aW5nLXRhdGEtbW90b3JzLXdpdGgtYS10YXJnZXQtcHJpY2Utb2YtcnMtNzYwL9IBAA?hl=en-IN&gl=IN&ceid=IN%3Aen,2023-10-11
7,Motilal Oswal Recommends Buying PI Industries with a Target Price ...,Share Price India News,news.google.com/articles/CBMiaWh0dHBzOi8vc2hhcmVwcmljZWluZGlhLmNvbS9tb3RpbGFsLW9zd2FsLXJlY29tbWVuZHMtYnV5aW5nLXBpLWluZHVzdHJpZXMtd2l0aC1hLXRhcmdldC1wcmljZS1vZi1ycy00NTYwL9IBAA?hl=en-IN&gl=IN&ceid=IN%3Aen,2023-10-10
8,JM Financial Recommends Buying Reliance Industries with a Target ...,Share Price India News,news.google.com/articles/CBMibmh0dHBzOi8vc2hhcmVwcmljZWluZGlhLmNvbS9qbS1maW5hbmNpYWwtcmVjb21tZW5kcy1idXlpbmctcmVsaWFuY2UtaW5kdXN0cmllcy13aXRoLWEtdGFyZ2V0LXByaWNlLW9mLXJzLTI5MDAv0gEA?hl=en-IN&gl=IN&ceid=IN%3Aen,2023-10-10
14,Motilal Oswal Recommends Buying Dabur India with a Target Price ...,Share Price India News,news.google.com/articles/CBMiZmh0dHBzOi8vc2hhcmVwcmljZWluZGlhLmNvbS9tb3RpbGFsLW9zd2FsLXJlY29tbWVuZHMtYnV5aW5nLWRhYnVyLWluZGlhLXdpdGgtYS10YXJnZXQtcHJpY2Utb2YtcnMtNjYwL9IBAA?hl=en-IN&gl=IN&ceid=IN%3Aen,2023-10-10
15,Prabhudas Lilladher Recommends Buying Ashok Leyland with a ...,Share Price India News,news.google.com/articles/CBMibmh0dHBzOi8vc2hhcmVwcmljZWluZGlhLmNvbS9wcmFiaHVkYXMtbGlsbGFkaGVyLXJlY29tbWVuZHMtYnV5aW5nLWFzaG9rLWxleWxhbmQtd2l0aC1hLXRhcmdldC1wcmljZS1vZi1ycy0yMjAv0gEA?hl=en-IN&gl=IN&ceid=IN%3Aen,2023-10-10
16,JM Financial Recommends Buying Oil India with a Target Price of ...,Share Price India News,news.google.com/articles/CBMiY2h0dHBzOi8vc2hhcmVwcmljZWluZGlhLmNvbS9qbS1maW5hbmNpYWwtcmVjb21tZW5kcy1idXlpbmctb2lsLWluZGlhLXdpdGgtYS10YXJnZXQtcHJpY2Utb2YtcnMtMzQ1L9IBAA?hl=en-IN&gl=IN&ceid=IN%3Aen,2023-10-10
19,JM Financial Recommends Buying BPCL with a Target Price of Rs 400,Share Price India News,news.google.com/articles/CBMiXmh0dHBzOi8vc2hhcmVwcmljZWluZGlhLmNvbS9qbS1maW5hbmNpYWwtcmVjb21tZW5kcy1idXlpbmctYnBjbC13aXRoLWEtdGFyZ2V0LXByaWNlLW9mLXJzLTQwMC_SAQA?hl=en-IN&gl=IN&ceid=IN%3Aen,2023-10-10
