,title,source,link,date
25,Saving and investing wisely - Dentistry,Dentistry.co.uk,news.google.com/articles/CBMiP2h0dHBzOi8vZGVudGlzdHJ5LmNvLnVrLzIwMjMvMTAvMjAvc2F2aW5nLWFuZC1pbnZlc3Rpbmctd2lzZWx5L9IBAA?hl=en-IN&gl=IN&ceid=IN%3Aen,2023-10-20
26,OMB Proposes Widespread Changes to Guidance on Grants and ...,Wiley Rein,news.google.com/articles/CBMiYGh0dHBzOi8vd3d3LndpbGV5Lmxhdy9hbGVydC1PTUItUHJvcG9zZXMtV2lkZXNwcmVhZC1DaGFuZ2VzLXRvLUd1aWRhbmNlLW9uLUdyYW50cy1hbmQtQWdyZWVtZW50c9IBAA?hl=en-IN&gl=IN&ceid=IN%3Aen,2023-10-20
28,Interview: Swedish Climate Official on Nuclear Prospects Large and ...,Energy Intelligence,news.google.com/articles/CBMiQGh0dHBzOi8vd3d3LmVuZXJneWludGVsLmNvbS8wMDAwMDE4Yi0zOWUzLWQyMGMtYTllZi1iZmZiNzgzNzAwMDDSAQA?hl=en-IN&gl=IN&ceid=IN%3Aen,2023-10-20
40,Sitting down with the Port candidates | The Journal of the San Juan ...,Journal of the San Juan Islands,news.google.com/articles/CBMiSmh0dHBzOi8vd3d3LnNhbmp1YW5qb3VybmFsLmNvbS9uZXdzL3NpdHRpbmctZG93bi13aXRoLXRoZS1wb3J0LWNhbmRpZGF0ZXMv0gEA?hl=en-IN&gl=IN&ceid=IN%3Aen,2023-10-20
20,Pearls for integrating dry eye disease management into your practice,Optometry Times,news.google.com/articles/CBMiaGh0dHBzOi8vd3d3Lm9wdG9tZXRyeXRpbWVzLmNvbS92aWV3L3BlYXJscy1mb3ItaW50ZWdyYXRpbmctZHJ5LWV5ZS1kaXNlYXNlLW1hbmFnZW1lbnQtaW50by15b3VyLXByYWN0aWNl0gEA?hl=en-IN&gl=IN&ceid=IN%3Aen,2023-10-19
30,Creating His Own Brand of Hospitality: Gregory Lee,UNLV NewsCenter,news.google.com/articles/CBMiUGh0dHBzOi8vd3d3LnVubHYuZWR1L25ld3MvYXJ0aWNsZS9jcmVhdGluZy1oaXMtb3duLWJyYW5kLWhvc3BpdGFsaXR5LWdyZWdvcnktbGVl0gEA?hl=en-IN&gl=IN&ceid=IN%3Aen,2023-10-18
8,Sony begins talks with Disney to buy India biz | Mint,Mint,news.google.com/articles/CBMiamh0dHBzOi8vd3d3LmxpdmVtaW50LmNvbS9jb21wYW5pZXMvbmV3cy9zb255LWJlZ2lucy10YWxrcy13aXRoLWRpc25leS10by1idXktaW5kaWEtYml6LTExNjk3MzkwMTkxNDY1Lmh0bWzSAW5odHRwczovL3d3dy5saXZlbWludC5jb20vY29tcGFuaWVzL25ld3Mvc29ueS1iZWdpbnMtdGFsa3Mtd2l0aC1kaXNuZXktdG8tYnV5LWluZGlhLWJpei9hbXAtMTE2OTczOTAxOTE0NjUuaHRtbA?hl=en-IN&gl=IN&ceid=IN%3Aen,2023-10-15
5,Jio-Facebook Deal: SAT To Hear Reliance’s Appeal Against SEBI Penalty On Oct. 31,BQ Prime,news.google.com/articles/CBMibmh0dHBzOi8vd3d3LmJxcHJpbWUuY29tL2J1c2luZXNzL2ppby1mYWNlYm9vay1kZWFsLXNhdC10by1oZWFyLXJlbGlhbmNlcy1hcHBlYWwtYWdhaW5zdC1zZWJpLXBlbmFsdHktb24tb2N0LTMx0gFyaHR0cHM6Ly93d3cuYnFwcmltZS5jb20vYW1wL2J1c2luZXNzL2ppby1mYWNlYm9vay1kZWFsLXNhdC10by1oZWFyLXJlbGlhbmNlcy1hcHBlYWwtYWdhaW5zdC1zZWJpLXBlbmFsdHktb24tb2N0LTMx?hl=en-IN&gl=IN&ceid=IN%3Aen,2023-10-11
16,Prabhudas Lilladher Recommends Buying Mahindra & Mahindra ...,Share Price India News,news.google.com/articles/CBMic2h0dHBzOi8vc2hhcmVwcmljZWluZGlhLmNvbS9wcmFiaHVkYXMtbGlsbGFkaGVyLXJlY29tbWVuZHMtYnV5aW5nLW1haGluZHJhLW1haGluZHJhLXdpdGgtYS10YXJnZXQtcHJpY2Utb2YtcnMtMTc3NS_SAQA?hl=en-IN&gl=IN&ceid=IN%3Aen,2023-10-11
17,Prabhudas Lilladher Recommends Buying Bharat Forge with a ...,Share Price India News,news.google.com/articles/CBMibmh0dHBzOi8vc2hhcmVwcmljZWluZGlhLmNvbS9wcmFiaHVkYXMtbGlsbGFkaGVyLXJlY29tbWVuZHMtYnV5aW5nLWJoYXJhdC1mb3JnZS13aXRoLWEtdGFyZ2V0LXByaWNlLW9mLXJzLTExNzAv0gEA?hl=en-IN&gl=IN&ceid=IN%3Aen,2023-10-11
