,title,source,link,date
20,BUTEX Business Club organises TEXPRES 2023,The Business Standard,news.google.com/articles/CBMiXGh0dHBzOi8vd3d3LnRic25ld3MubmV0L2Vjb25vbXkvY29ycG9yYXRlcy9idXRleC1idXNpbmVzcy1jbHViLW9yZ2FuaXNlcy10ZXhwcmVzLTIwMjMtNzI0MTAy0gEA?hl=en-IN&gl=IN&ceid=IN%3Aen,2023-10-22
29,OMB Proposes Widespread Changes to Guidance on Grants and ...,Wiley Rein,news.google.com/articles/CBMiYGh0dHBzOi8vd3d3LndpbGV5Lmxhdy9hbGVydC1PTUItUHJvcG9zZXMtV2lkZXNwcmVhZC1DaGFuZ2VzLXRvLUd1aWRhbmNlLW9uLUdyYW50cy1hbmQtQWdyZWVtZW50c9IBAA?hl=en-IN&gl=IN&ceid=IN%3Aen,2023-10-20
42,Sitting down with the Port candidates | The Journal of the San Juan ...,Journal of the San Juan Islands,news.google.com/articles/CBMiSmh0dHBzOi8vd3d3LnNhbmp1YW5qb3VybmFsLmNvbS9uZXdzL3NpdHRpbmctZG93bi13aXRoLXRoZS1wb3J0LWNhbmRpZGF0ZXMv0gEA?hl=en-IN&gl=IN&ceid=IN%3Aen,2023-10-20
21,Pearls for integrating dry eye disease management into your practice,Optometry Times,news.google.com/articles/CBMiaGh0dHBzOi8vd3d3Lm9wdG9tZXRyeXRpbWVzLmNvbS92aWV3L3BlYXJscy1mb3ItaW50ZWdyYXRpbmctZHJ5LWV5ZS1kaXNlYXNlLW1hbmFnZW1lbnQtaW50by15b3VyLXByYWN0aWNl0gEA?hl=en-IN&gl=IN&ceid=IN%3Aen,2023-10-19
8,Sony begins talks with Disney to buy India biz | Mint,Mint,news.google.com/articles/CBMiamh0dHBzOi8vd3d3LmxpdmVtaW50LmNvbS9jb21wYW5pZXMvbmV3cy9zb255LWJlZ2lucy10YWxrcy13aXRoLWRpc25leS10by1idXktaW5kaWEtYml6LTExNjk3MzkwMTkxNDY1Lmh0bWzSAW5odHRwczovL3d3dy5saXZlbWludC5jb20vY29tcGFuaWVzL25ld3Mvc29ueS1iZWdpbnMtdGFsa3Mtd2l0aC1kaXNuZXktdG8tYnV5LWluZGlhLWJpei9hbXAtMTE2OTczOTAxOTE0NjUuaHRtbA?hl=en-IN&gl=IN&ceid=IN%3Aen,2023-10-15
5,Jio-Facebook Deal: SAT To Hear Reliance’s Appeal Against SEBI Penalty On Oct. 31,BQ Prime,news.google.com/articles/CBMibmh0dHBzOi8vd3d3LmJxcHJpbWUuY29tL2J1c2luZXNzL2ppby1mYWNlYm9vay1kZWFsLXNhdC10by1oZWFyLXJlbGlhbmNlcy1hcHBlYWwtYWdhaW5zdC1zZWJpLXBlbmFsdHktb24tb2N0LTMx0gFyaHR0cHM6Ly93d3cuYnFwcmltZS5jb20vYW1wL2J1c2luZXNzL2ppby1mYWNlYm9vay1kZWFsLXNhdC10by1oZWFyLXJlbGlhbmNlcy1hcHBlYWwtYWdhaW5zdC1zZWJpLXBlbmFsdHktb24tb2N0LTMx?hl=en-IN&gl=IN&ceid=IN%3Aen,2023-10-11
16,Prabhudas Lilladher Recommends Buying Mahindra & Mahindra ...,Share Price India News,news.google.com/articles/CBMic2h0dHBzOi8vc2hhcmVwcmljZWluZGlhLmNvbS9wcmFiaHVkYXMtbGlsbGFkaGVyLXJlY29tbWVuZHMtYnV5aW5nLW1haGluZHJhLW1haGluZHJhLXdpdGgtYS10YXJnZXQtcHJpY2Utb2YtcnMtMTc3NS_SAQA?hl=en-IN&gl=IN&ceid=IN%3Aen,2023-10-11
17,Prabhudas Lilladher Recommends Buying Bharat Forge with a ...,Share Price India News,news.google.com/articles/CBMibmh0dHBzOi8vc2hhcmVwcmljZWluZGlhLmNvbS9wcmFiaHVkYXMtbGlsbGFkaGVyLXJlY29tbWVuZHMtYnV5aW5nLWJoYXJhdC1mb3JnZS13aXRoLWEtdGFyZ2V0LXByaWNlLW9mLXJzLTExNzAv0gEA?hl=en-IN&gl=IN&ceid=IN%3Aen,2023-10-11
11,Motilal Oswal Recommends Buying PI Industries with a Target Price ...,Share Price India News,news.google.com/articles/CBMiaWh0dHBzOi8vc2hhcmVwcmljZWluZGlhLmNvbS9tb3RpbGFsLW9zd2FsLXJlY29tbWVuZHMtYnV5aW5nLXBpLWluZHVzdHJpZXMtd2l0aC1hLXRhcmdldC1wcmljZS1vZi1ycy00NTYwL9IBAA?hl=en-IN&gl=IN&ceid=IN%3Aen,2023-10-10
12,JM Financial Recommends Buying Reliance Industries with a Target ...,Share Price India News,news.google.com/articles/CBMibmh0dHBzOi8vc2hhcmVwcmljZWluZGlhLmNvbS9qbS1maW5hbmNpYWwtcmVjb21tZW5kcy1idXlpbmctcmVsaWFuY2UtaW5kdXN0cmllcy13aXRoLWEtdGFyZ2V0LXByaWNlLW9mLXJzLTI5MDAv0gEA?hl=en-IN&gl=IN&ceid=IN%3Aen,2023-10-10
