,title,source,link,date
43,Smart Cities Market Growth: Renewable Energy Adoption Revolutionizes Urban Sustainability Across Emerging Econ,openPR,news.google.com/articles/CBMiWGh0dHBzOi8vd3d3Lm9wZW5wci5jb20vbmV3cy8zMzA0MTU0L3NtYXJ0LWNpdGllcy1tYXJrZXQtZ3Jvd3RoLXJlbmV3YWJsZS1lbmVyZ3ktYWRvcHRpb27SAVdodHRwczovL3d3dy5vcGVucHIuY29tL2FtcC8zMzA0MTU0L3NtYXJ0LWNpdGllcy1tYXJrZXQtZ3Jvd3RoLXJlbmV3YWJsZS1lbmVyZ3ktYWRvcHRpb24?hl=en-IN&gl=IN&ceid=IN%3Aen,2023-11-27
56,"Plug-In Fully Digital Thyristor Current Stabilizing Control Cabinet Market Analysis, Key Stakeholders, Regiona",openPR,news.google.com/articles/CBMiX2h0dHBzOi8vd3d3Lm9wZW5wci5jb20vbmV3cy8zMzA0MzAxL3BsdWctaW4tZnVsbHktZGlnaXRhbC10aHlyaXN0b3ItY3VycmVudC1zdGFiaWxpemluZy1jb250cm9s0gFeaHR0cHM6Ly93d3cub3BlbnByLmNvbS9hbXAvMzMwNDMwMS9wbHVnLWluLWZ1bGx5LWRpZ2l0YWwtdGh5cmlzdG9yLWN1cnJlbnQtc3RhYmlsaXppbmctY29udHJvbA?hl=en-IN&gl=IN&ceid=IN%3Aen,2023-11-27
17,IT outsourcing Market is expected to grow at a CAGR of 8.16% during the forecasted period | Evolve Business In,openPR,news.google.com/articles/CBMiZmh0dHBzOi8vd3d3Lm9wZW5wci5jb20vbmV3cy8zMzA0NjU2L2l0LW91dHNvdXJjaW5nLW1hcmtldC1pcy1leHBlY3RlZC10by1ncm93LWF0LWEtY2Fnci1vZi04LTE2LWR1cmluZ9IBZWh0dHBzOi8vd3d3Lm9wZW5wci5jb20vYW1wLzMzMDQ2NTYvaXQtb3V0c291cmNpbmctbWFya2V0LWlzLWV4cGVjdGVkLXRvLWdyb3ctYXQtYS1jYWdyLW9mLTgtMTYtZHVyaW5n?hl=en-IN&gl=IN&ceid=IN%3Aen,2023-11-27
25,"Circuit Breakers Market: Electrifying Growth | APAC Fastest Growing by South Korea, China, Japan",openPR,news.google.com/articles/CBMiXGh0dHBzOi8vd3d3Lm9wZW5wci5jb20vbmV3cy8zMzAzNjg5L2NpcmN1aXQtYnJlYWtlcnMtbWFya2V0LWVsZWN0cmlmeWluZy1ncm93dGgtYXBhYy1mYXN0ZXN00gFbaHR0cHM6Ly93d3cub3BlbnByLmNvbS9hbXAvMzMwMzY4OS9jaXJjdWl0LWJyZWFrZXJzLW1hcmtldC1lbGVjdHJpZnlpbmctZ3Jvd3RoLWFwYWMtZmFzdGVzdA?hl=en-IN&gl=IN&ceid=IN%3Aen,2023-11-27
32,"Structured Cabling Market Size, Share, Growth and Industry Report 2023-2030",openPR,news.google.com/articles/CBMiXGh0dHBzOi8vd3d3Lm9wZW5wci5jb20vbmV3cy8zMzA0NDQwL3N0cnVjdHVyZWQtY2FibGluZy1tYXJrZXQtc2l6ZS1zaGFyZS1ncm93dGgtYW5kLWluZHVzdHJ50gFbaHR0cHM6Ly93d3cub3BlbnByLmNvbS9hbXAvMzMwNDQ0MC9zdHJ1Y3R1cmVkLWNhYmxpbmctbWFya2V0LXNpemUtc2hhcmUtZ3Jvd3RoLWFuZC1pbmR1c3RyeQ?hl=en-IN&gl=IN&ceid=IN%3Aen,2023-11-27
29,"EV Battery & Charging News: Orbia, ABS, Worksport, LeapCharger ...",AUTO Connected Car News,news.google.com/articles/CBMigQFodHRwczovL3d3dy5hdXRvY29ubmVjdGVkY2FyLmNvbS8yMDIzLzExL2V2LWJhdHRlcnktY2hhcmdpbmctbmV3cy1vcmJpYS1hYnMtd29ya3Nwb3J0LWxlYXBjaGFyZ2VyLXRob3Itc2NobmVpZGVyLWZvcmQtc3RlbGxhbnRpcy_SAQA?hl=en-IN&gl=IN&ceid=IN%3Aen,2023-11-26
33,Plug-In Fully Digital Thyristor Current Stabilizing Control Cabinet ...,Taiwan News,news.google.com/articles/CBMiLWh0dHBzOi8vd3d3LnRhaXdhbm5ld3MuY29tLnR3L2VuL25ld3MvNTA0Nzc3OdIBAA?hl=en-IN&gl=IN&ceid=IN%3Aen,2023-11-26
9,Electric Vehicle (EV) Charging Infrastructure Market size to grow by ...,IT News Online,news.google.com/articles/CBMi2gFodHRwOi8vd3d3Lml0bmV3c29ubGluZS5jb20vUFJOZXdzd2lyZS9FbGVjdHJpYy1WZWhpY2xlLUVWLUNoYXJnaW5nLUluZnJhc3RydWN0dXJlLU1hcmtldC1zaXplLXRvLWdyb3ctYnktVVNELTEyMS4zMy1iaWxsaW9uLWZyb20tMjAyMi0tLTIwMjctLVRoZS1ncm93aW5nLXByb2R1Y3Rpb24tb2YtRVZzLXRvLWRyaXZlLXRoZS1tYXJrZXQtZ3Jvd3RoLS0tVGVjaG5hdmlvLzk1OTUzNdIBAA?hl=en-IN&gl=IN&ceid=IN%3Aen,2023-11-24
12,Indo-Asian News Service-MODULAR DATA CENTER MARKET ...,IANS India Pvt Ltd,news.google.com/articles/CBMihgFodHRwczovL2lhbnMuaW4vcHItd2lyZS1kZXRhaWwvbW9kdWxhci1kYXRhLWNlbnRlci1tYXJrZXQtd29ydGgtODEyLWJpbGxpb24tYnktMjAzMC1leGNsdXNpdmUtcmVwb3J0LWJ5LW1hcmtldHNhbmRtYXJrZXRzdG0tMjQtMTEtMjAyM9IBAA?hl=en-IN&gl=IN&ceid=IN%3Aen,2023-11-24
16,Global Industrial Automation Oil & Gas Market Size To Exceed USD ...,GlobeNewswire,news.google.com/articles/CBMiqAFodHRwczovL3d3dy5nbG9iZW5ld3N3aXJlLmNvbS9uZXdzLXJlbGVhc2UvMjAyMy8xMS8yNC8yNzg1NDYzLzAvZW4vR2xvYmFsLUluZHVzdHJpYWwtQXV0b21hdGlvbi1PaWwtR2FzLU1hcmtldC1TaXplLVRvLUV4Y2VlZC1VU0QtMjgtMzktQmlsbGlvbi1ieS0yMDMyLUNBR1Itb2YtNS01Lmh0bWzSAQA?hl=en-IN&gl=IN&ceid=IN%3Aen,2023-11-24
