,title,source,link,date
19,Chandrayaan-3's Success With These Sci-Fi Titles This Weekend,Passionate In Marketing,news.google.com/articles/CBMigQFodHRwczovL3d3dy5wYXNzaW9uYXRlaW5tYXJrZXRpbmcuY29tL3N0cmVhbWluZy10aGUtc3RhcnMtY2VsZWJyYXRlLWNoYW5kcmF5YWFuLTNzLXN1Y2Nlc3Mtd2l0aC10aGVzZS1zY2ktZmktdGl0bGVzLXRoaXMtd2Vla2VuZC_SAQA?hl=en-IN&gl=IN&ceid=IN%3Aen,2023-08-25
32,William Shatner names his favourite sci-fi movies of all time,Far Out Magazine,news.google.com/articles/CBMiW2h0dHBzOi8vZmFyb3V0bWFnYXppbmUuY28udWsvd2lsbGlhbS1zaGF0bmVyLW5hbWVzLWhpcy1mYXZvdXJpdGUtc2NpLWZpLW1vdmllcy1vZi1hbGwtdGltZS_SAV9odHRwczovL2Zhcm91dG1hZ2F6aW5lLmNvLnVrL3dpbGxpYW0tc2hhdG5lci1uYW1lcy1oaXMtZmF2b3VyaXRlLXNjaS1maS1tb3ZpZXMtb2YtYWxsLXRpbWUvP2FtcA?hl=en-IN&gl=IN&ceid=IN%3Aen,2023-08-25
52,China’s military unveils first test of ‘world’s most powerful gun’ with Sci-fi weapon that can launch shell...,The US Sun,news.google.com/articles/CBMiWGh0dHBzOi8vd3d3LnRoZS1zdW4uY29tL25ld3MvODkzMDM1OS9jaGluYXMtbWlsaXRhcnktdW52ZWlscy13b3JsZHMtcG93ZXJmdWwtZ3VuLXdlYXBvbi_SAVxodHRwczovL3d3dy50aGUtc3VuLmNvbS9uZXdzLzg5MzAzNTkvY2hpbmFzLW1pbGl0YXJ5LXVudmVpbHMtd29ybGRzLXBvd2VyZnVsLWd1bi13ZWFwb24vYW1wLw?hl=en-IN&gl=IN&ceid=IN%3Aen,2023-08-25
25,The 12 Best Arthouse Sci-Fi Movies of All Time,MovieWeb,news.google.com/articles/CBMiPWh0dHBzOi8vbW92aWV3ZWIuY29tL2Jlc3QtYXJ0aG91c2Utc2NpLWZpLW1vdmllcy1vZi1hbGwtdGltZS_SAQA?hl=en-IN&gl=IN&ceid=IN%3Aen,2023-08-25
24,Poli Sci Prof Breaks Down BRICS Expansion with Israeli Broadcaster,University of Guelph,news.google.com/articles/CBMiZGh0dHBzOi8vbmV3cy51b2d1ZWxwaC5jYS8yMDIzLzA4L3BvbGktc2NpLXByb2YtYnJlYWtzLWRvd24tYnJpY3MtZXhwYW5zaW9uLXdpdGgtaXNyYWVsaS1icm9hZGNhc3Rlci_SAQA?hl=en-IN&gl=IN&ceid=IN%3Aen,2023-08-25
84,Ryan Reynolds Possessed By Oscar Winner In This Forgotten Sci-Fi ...,Giant Freakin Robot,news.google.com/articles/CBMiQGh0dHBzOi8vd3d3LmdpYW50ZnJlYWtpbnJvYm90LmNvbS9lbnQvcnlhbi1yZXlub2xkcy1zZWZsZXNzLmh0bWzSAQA?hl=en-IN&gl=IN&ceid=IN%3Aen,2023-08-25
57,"Intense Sci-Fi Horror Made Audiences Sick, Now On Streaming",Giant Freakin Robot,news.google.com/articles/CBMiSWh0dHBzOi8vd3d3LmdpYW50ZnJlYWtpbnJvYm90LmNvbS9lbnQvY3JpbWVzLW9mLXRoZS1mdXR1cmUtc3RyZWFtaW5nLmh0bWzSAQA?hl=en-IN&gl=IN&ceid=IN%3Aen,2023-08-25
58,"Vinyl releases of the week: myst milano., Ashnikko and Dana Kelley",The Vinyl Factory,news.google.com/articles/CBMib2h0dHBzOi8vdGhldmlueWxmYWN0b3J5LmNvbS9mZWF0dXJlcy90aGlzLXdlZWstcmh5dGhtaWMtdmFyaWF0aW9uLXNjaS1maS1jb25jZXB0dWFsaXNtLWFuZC1kZWVwLWhvdXNlLWNsYXNzaWNzL9IBAA?hl=en-IN&gl=IN&ceid=IN%3Aen,2023-08-25
18,Collaboration crossroads: U.S.-China sci-tech future,CGTN,news.google.com/articles/CBMib2h0dHBzOi8vbmV3cy5jZ3RuLmNvbS9uZXdzLzIwMjMtMDgtMjUvQ29sbGFib3JhdGlvbi1jcm9zc3JvYWRzLVUtUy1DaGluYS1zY2ktdGVjaC1mdXR1cmUtMW15RDJITGxqUVEvaW5kZXguaHRtbNIBAA?hl=en-IN&gl=IN&ceid=IN%3Aen,2023-08-25
17,Sichuan's Moshi Park presents a sci-fi scene in real life,CGTN,news.google.com/articles/CBMidmh0dHBzOi8vbmV3cy5jZ3RuLmNvbS9uZXdzLzIwMjMtMDgtMjUvU2ljaHVhbi1zLU1vc2hpLVBhcmstcHJlc2VudHMtYS1zY2ktZmktc2NlbmUtaW4tcmVhbC1saWZlLTFteXhxbHpXUExpL2luZGV4Lmh0bWzSAQA?hl=en-IN&gl=IN&ceid=IN%3Aen,2023-08-25
