,title,source,link,date
87,Huge deal sees shoppers snag 'perfect everyday bag' from Uniqlo for free,The Mirror,news.google.com/articles/CBMiVGh0dHBzOi8vd3d3Lm1pcnJvci5jby51ay9tb25leS9zaG9wcGluZy1kZWFscy9odWdlLWRlYWwtc2hvcHBlcnMtdW5pcWxvLWJhZy0zMTM1MjEwOdIBWGh0dHBzOi8vd3d3Lm1pcnJvci5jby51ay9tb25leS9zaG9wcGluZy1kZWFscy9odWdlLWRlYWwtc2hvcHBlcnMtdW5pcWxvLWJhZy0zMTM1MjEwOS5hbXA?hl=en-IN&gl=IN&ceid=IN%3Aen,2023-11-03
43,Kohl’s Season of Savings Continues with Black Friday Early Access Event and Unveiling of Black Friday Week Deals,Yahoo Finance,news.google.com/articles/CBMiUWh0dHBzOi8vZmluYW5jZS55YWhvby5jb20vbmV3cy9rb2hsLXNlYXNvbi1zYXZpbmdzLWNvbnRpbnVlcy1ibGFjay0xMjAwMDAzNTUuaHRtbNIBWWh0dHBzOi8vZmluYW5jZS55YWhvby5jb20vYW1waHRtbC9uZXdzL2tvaGwtc2Vhc29uLXNhdmluZ3MtY29udGludWVzLWJsYWNrLTEyMDAwMDM1NS5odG1s?hl=en-IN&gl=IN&ceid=IN%3Aen,2023-11-03
76,AJIO forays into D2C-focused interactive commerce with Ajiogram,Adgully,news.google.com/articles/CBMiY2h0dHBzOi8vd3d3LmFkZ3VsbHkuY29tL2FqaW8tZm9yYXlzLWludG8tZDJjLWZvY3VzZWQtaW50ZXJhY3RpdmUtY29tbWVyY2Utd2l0aC1hamlvZ3JhbS0xMzg0MzUuaHRtbNIBAA?hl=en-IN&gl=IN&ceid=IN%3Aen,2023-11-03
47,"Mallwalking, Food Courts, and Retail Are Back",Food Institute Blog,news.google.com/articles/CBMiTWh0dHBzOi8vZm9vZGluc3RpdHV0ZS5jb20vcmV0YWlsL21hbGx3YWxraW5nLWZvb2QtY291cnRzLWFuZC1yZXRhaWwtYXJlLWJhY2sv0gEA?hl=en-IN&gl=IN&ceid=IN%3Aen,2023-11-03
78,Amazon FTC lawsuit claims site used secret pricing tool to gouge costs,USA TODAY,news.google.com/articles/CBMiZmh0dHBzOi8vd3d3LnVzYXRvZGF5LmNvbS9zdG9yeS9tb25leS8yMDIzLzExLzAzL2FtYXpvbi1mdGMtbGF3c3VpdC1zZWNyZXQtcHJpY2UtaW5mbGF0aW9uLzcxNDM3MjA1MDA3L9IBAA?hl=en-IN&gl=IN&ceid=IN%3Aen,2023-11-03
6,Inside India's Beauty Boom – WWD,WWD,news.google.com/articles/CBMiU2h0dHBzOi8vd3dkLmNvbS9iZWF1dHktaW5kdXN0cnktbmV3cy9iZWF1dHktZmVhdHVyZXMvaW5kaWFzLWJlYXV0eS1ib29tLTEyMzU4ODk1NTMv0gEA?hl=en-IN&gl=IN&ceid=IN%3Aen,2023-11-03
86,Shoppers can bag a bottle of M&S light-up gin with this savvy sign up offer,The Mirror,news.google.com/articles/CBMiU2h0dHBzOi8vd3d3Lm1pcnJvci5jby51ay9tb25leS9zaG9wcGluZy1kZWFscy9zaG9wcGVycy1jYW4tYmFnLWZyZWUtYm90dGxlLTMxMzUzMDA40gFXaHR0cHM6Ly93d3cubWlycm9yLmNvLnVrL21vbmV5L3Nob3BwaW5nLWRlYWxzL3Nob3BwZXJzLWNhbi1iYWctZnJlZS1ib3R0bGUtMzEzNTMwMDguYW1w?hl=en-IN&gl=IN&ceid=IN%3Aen,2023-11-03
4,Ambani's Reliance partners Sephora for India in latest beauty push,Reuters,news.google.com/articles/CBMidmh0dHBzOi8vd3d3LnJldXRlcnMuY29tL21hcmtldHMvZGVhbHMvaW5kaWFzLWFydmluZC1mYXNoaW9ucy1zZWxsLXNlcGhvcmEtcmV0YWlsLWRpdmlzaW9uLWFtYmFuaXMtcmVsaWFuY2UtMjAyMy0xMS0wMy_SAQA?hl=en-IN&gl=IN&ceid=IN%3Aen,2023-11-03
11,Click & Mortar: The Evolution of India's Retail Ecosystem,Indian Retailer,news.google.com/articles/CBMiemh0dHBzOi8vd3d3LmluZGlhbnJldGFpbGVyLmNvbS9hcnRpY2xlL3RlY2hub2xvZ3ktZS1jb21tZXJjZS9kaWdpdGFsLXRyZW5kcy9jbGljay1tb3J0YXItZXZvbHV0aW9uLWluZGlhcy1yZXRhaWwtZWNvc3lzdGVt0gF-aHR0cHM6Ly93d3cuaW5kaWFucmV0YWlsZXIuY29tL2FtcC9hcnRpY2xlL3RlY2hub2xvZ3ktZS1jb21tZXJjZS9kaWdpdGFsLXRyZW5kcy9jbGljay1tb3J0YXItZXZvbHV0aW9uLWluZGlhcy1yZXRhaWwtZWNvc3lzdGVt?hl=en-IN&gl=IN&ceid=IN%3Aen,2023-11-02
82,‘Just to have them stop you for a receipt check’: Walmart customer complains about workers ‘shooting the sh*t’ with each other while he has to scan $300 worth of groceries at self-checkout,The Daily Dot,news.google.com/articles/CBMiSWh0dHBzOi8vd3d3LmRhaWx5ZG90LmNvbS9uZXdzL3dhbG1hcnQtY3VzdG9tZXItY29tcGxhaW5zLXdvcmtlcnMtdGFsa2luZy_SAU1odHRwczovL3d3dy5kYWlseWRvdC5jb20vbmV3cy93YWxtYXJ0LWN1c3RvbWVyLWNvbXBsYWlucy13b3JrZXJzLXRhbGtpbmcvP2FtcA?hl=en-IN&gl=IN&ceid=IN%3Aen,2023-11-02
