,title,source,link,date
57,Huge deal sees shoppers snag 'perfect everyday bag' from Uniqlo for free,The Mirror,news.google.com/articles/CBMiVGh0dHBzOi8vd3d3Lm1pcnJvci5jby51ay9tb25leS9zaG9wcGluZy1kZWFscy9odWdlLWRlYWwtc2hvcHBlcnMtdW5pcWxvLWJhZy0zMTM1MjEwOdIBWGh0dHBzOi8vd3d3Lm1pcnJvci5jby51ay9tb25leS9zaG9wcGluZy1kZWFscy9odWdlLWRlYWwtc2hvcHBlcnMtdW5pcWxvLWJhZy0zMTM1MjEwOS5hbXA?hl=en-IN&gl=IN&ceid=IN%3Aen,2023-11-03
4,Ambani's Reliance partners Sephora for India in latest beauty push,Reuters,news.google.com/articles/CBMidmh0dHBzOi8vd3d3LnJldXRlcnMuY29tL21hcmtldHMvZGVhbHMvaW5kaWFzLWFydmluZC1mYXNoaW9ucy1zZWxsLXNlcGhvcmEtcmV0YWlsLWRpdmlzaW9uLWFtYmFuaXMtcmVsaWFuY2UtMjAyMy0xMS0wMy_SAQA?hl=en-IN&gl=IN&ceid=IN%3Aen,2023-11-03
48,AJIO forays into D2C-focused interactive commerce with Ajiogram,Adgully,news.google.com/articles/CBMiY2h0dHBzOi8vd3d3LmFkZ3VsbHkuY29tL2FqaW8tZm9yYXlzLWludG8tZDJjLWZvY3VzZWQtaW50ZXJhY3RpdmUtY29tbWVyY2Utd2l0aC1hamlvZ3JhbS0xMzg0MzUuaHRtbNIBAA?hl=en-IN&gl=IN&ceid=IN%3Aen,2023-11-03
6,Inside India's Beauty Boom – WWD,WWD,news.google.com/articles/CBMiU2h0dHBzOi8vd3dkLmNvbS9iZWF1dHktaW5kdXN0cnktbmV3cy9iZWF1dHktZmVhdHVyZXMvaW5kaWFzLWJlYXV0eS1ib29tLTEyMzU4ODk1NTMv0gEA?hl=en-IN&gl=IN&ceid=IN%3Aen,2023-11-03
31,Kohl’s Season of Savings Continues with Black Friday Early Access Event and Unveiling of Black Friday Week Deals,Yahoo Finance,news.google.com/articles/CBMiUWh0dHBzOi8vZmluYW5jZS55YWhvby5jb20vbmV3cy9rb2hsLXNlYXNvbi1zYXZpbmdzLWNvbnRpbnVlcy1ibGFjay0xMjAwMDAzNTUuaHRtbNIBWWh0dHBzOi8vZmluYW5jZS55YWhvby5jb20vYW1waHRtbC9uZXdzL2tvaGwtc2Vhc29uLXNhdmluZ3MtY29udGludWVzLWJsYWNrLTEyMDAwMDM1NS5odG1s?hl=en-IN&gl=IN&ceid=IN%3Aen,2023-11-03
71,Sephora vs. Ulta: which is the better beauty store,Business Insider,news.google.com/articles/CBMiYGh0dHBzOi8vd3d3LmJ1c2luZXNzaW5zaWRlci5jb20vc2VwaG9yYS12cy11bHRhLXN0b3VyZS10b3VyLXdoaWNoLWlzLWJldHRlci1iZWF1dHktc3RvcmUtMjAyMy0xMdIBZGh0dHBzOi8vd3d3LmJ1c2luZXNzaW5zaWRlci5jb20vc2VwaG9yYS12cy11bHRhLXN0b3VyZS10b3VyLXdoaWNoLWlzLWJldHRlci1iZWF1dHktc3RvcmUtMjAyMy0xMT9hbXA?hl=en-IN&gl=IN&ceid=IN%3Aen,2023-11-03
96,Kotak Mahindra Bank Home Loans Now Available on Bajaj Markets,Business Wire India,news.google.com/articles/CBMiamh0dHBzOi8vd3d3LmJ1c2luZXNzd2lyZWluZGlhLmNvbS9rb3Rhay1tYWhpbmRyYS1iYW5rLWhvbWUtbG9hbnMtbm93LWF2YWlsYWJsZS1vbi1iYWphai1tYXJrZXRzLTg3MjgwLmh0bWzSAQA?hl=en-IN&gl=IN&ceid=IN%3Aen,2023-11-02
69,Best Places to Buy Bedding in 2023 | U.S. News,U.S. News & World Report,news.google.com/articles/CBMiQ2h0dHBzOi8vd3d3LnVzbmV3cy5jb20vMzYwLXJldmlld3Mvc2xlZXAvYmVzdC1wbGFjZXMtdG8tYnV5LWJlZGRpbmfSAQA?hl=en-IN&gl=IN&ceid=IN%3Aen,2023-11-02
55,‘Just to have them stop you for a receipt check’: Walmart customer complains about workers ‘shooting the sh*t’ with each other while he has to scan $300 worth of groceries at self-checkout,The Daily Dot,news.google.com/articles/CBMiSWh0dHBzOi8vd3d3LmRhaWx5ZG90LmNvbS9uZXdzL3dhbG1hcnQtY3VzdG9tZXItY29tcGxhaW5zLXdvcmtlcnMtdGFsa2luZy_SAU1odHRwczovL3d3dy5kYWlseWRvdC5jb20vbmV3cy93YWxtYXJ0LWN1c3RvbWVyLWNvbXBsYWlucy13b3JrZXJzLXRhbGtpbmcvP2FtcA?hl=en-IN&gl=IN&ceid=IN%3Aen,2023-11-02
92,Amazon execs destroyed years of evidence before FTC action ...,The Seattle Times,news.google.com/articles/CBMidGh0dHBzOi8vd3d3LnNlYXR0bGV0aW1lcy5jb20vYnVzaW5lc3MvYW1hem9uL2FtYXpvbi1leGVjcy1kZXN0cm95ZWQteWVhcnMtb2YtZXZpZGVuY2UtYmVmb3JlLWZ0Yy1hY3Rpb24tYWdlbmN5LXNheXMv0gEA?hl=en-IN&gl=IN&ceid=IN%3Aen,2023-11-02
