,title,source,link,date
4,Metabolomics analysis of Ligustri Lucidi Fructus at different harvest ...,John Wiley,news.google.com/articles/CBMiOmh0dHBzOi8vb25saW5lbGlicmFyeS53aWxleS5jb20vZG9pLzEwLjEwMDIvanNzYy4yMDIzMDAxOTbSAQA?hl=en-IN&gl=IN&ceid=IN%3Aen,2023-10-09
5,Co-embedding of edges and nodes with deep graph convolutional ...,Nature.com,news.google.com/articles/CBMiMmh0dHBzOi8vd3d3Lm5hdHVyZS5jb20vYXJ0aWNsZXMvczQxNTk4LTAyMy00NDIyNC0x0gEA?hl=en-IN&gl=IN&ceid=IN%3Aen,2023-10-08
6,A robust optimal scheduling system based on multi-performance ...,Nature.com,news.google.com/articles/CBMiMmh0dHBzOi8vd3d3Lm5hdHVyZS5jb20vYXJ0aWNsZXMvczQxNTk4LTAyMy00Mzg1My130gEA?hl=en-IN&gl=IN&ceid=IN%3Aen,2023-10-07
12,"DoorDash, Instacart, Just Eat Billionaire Founders Lose Over $15 ...",Bloomberg,news.google.com/articles/CBMic2h0dHBzOi8vd3d3LmJsb29tYmVyZy5jb20vbmV3cy9hcnRpY2xlcy8yMDIzLTEwLTAzL2JpbGxpb25haXJlcy13aG8tcm9kZS1vbmxpbmUtZGVsaXZlcnktYm9vbS13YXRjaC1mb3J0dW5lcy12YW5pc2jSAQA?hl=en-IN&gl=IN&ceid=IN%3Aen,2023-10-04
3,AI could finally solve a problem that's long plagued education,Fast Company,news.google.com/articles/CBMiYmh0dHBzOi8vd3d3LmZhc3Rjb21wYW55LmNvbS85MDk1OTg5My9haS1jb3VsZC1maW5hbGx5LXNvbHZlLWEtcHJvYmxlbS10aGF0cy1sb25nLXBsYWd1ZWQtZWR1Y2F0aW9u0gEA?hl=en-IN&gl=IN&ceid=IN%3Aen,2023-10-02
8,Nonnegative/Binary matrix factorization for image classification ...,Nature.com,news.google.com/articles/CBMiMmh0dHBzOi8vd3d3Lm5hdHVyZS5jb20vYXJ0aWNsZXMvczQxNTk4LTAyMy00MzcyOS160gEA?hl=en-IN&gl=IN&ceid=IN%3Aen,2023-10-02
13,Fast functional mapping of ligand-gated ion channels ...,Nature.com,news.google.com/articles/CBMiMmh0dHBzOi8vd3d3Lm5hdHVyZS5jb20vYXJ0aWNsZXMvczQyMDAzLTAyMy0wNTM0MC130gEA?hl=en-IN&gl=IN&ceid=IN%3Aen,2023-10-02
10,2D-LC–MS Approaches for the Analysis of In-Process Samples and ...,LCGC Chromatography Online,news.google.com/articles/CBMipAFodHRwczovL3d3dy5jaHJvbWF0b2dyYXBoeW9ubGluZS5jb20vdmlldy8yZC1sYy1tcy1hcHByb2FjaGVzLWZvci10aGUtYW5hbHlzaXMtb2YtaW4tcHJvY2Vzcy1zYW1wbGVzLWFuZC1mb3ItdGhlLWNoYXJhY3Rlcml6YXRpb24tb2YtbWFicy1pbi1hLXJlZ3VsYXRlZC1lbnZpcm9ubWVudNIBAA?hl=en-IN&gl=IN&ceid=IN%3Aen,2023-10-01
9,"Culture Code for Proof of Concepts, Try-Storming, Pilot Tests ...",Quality Magazine,news.google.com/articles/CBMicWh0dHBzOi8vd3d3LnF1YWxpdHltYWcuY29tL2FydGljbGVzLzk3NTY3LWN1bHR1cmUtY29kZS1mb3ItcHJvb2Ytb2YtY29uY2VwdHMtdHJ5LXN0b3JtaW5nLXBpbG90LXRlc3RzLXNpbXVsYXRpb25z0gEA?hl=en-IN&gl=IN&ceid=IN%3Aen,2023-09-29
