,title,source,link,date
2,Combination of AS101 and Mefloquine Inhibits Carbapenem ...,Dove Medical Press,news.google.com/articles/CBMigwFodHRwczovL3d3dy5kb3ZlcHJlc3MuY29tL2NvbWJpbmF0aW9uLW9mLWFzMTAxLWFuZC1tZWZsb3F1aW5lLWluaGliaXRzLWNhcmJhcGVuZW0tcmVzaXN0YW50LXBzZXUtcGVlci1yZXZpZXdlZC1mdWxsdGV4dC1hcnRpY2xlLUlEUtIBAA?hl=en-IN&gl=IN&ceid=IN%3Aen,2023-11-17
3,Simulation examining the factors influencing capillary wick transport ...,Nature.com,news.google.com/articles/CBMiMmh0dHBzOi8vd3d3Lm5hdHVyZS5jb20vYXJ0aWNsZXMvczQxNTk4LTAyMy00MzQ1Ny000gEA?hl=en-IN&gl=IN&ceid=IN%3Aen,2023-11-16
10,AMS Academy: Country’s first online English Medium school,The Business Standard,news.google.com/articles/CBMiaGh0dHBzOi8vd3d3LnRic25ld3MubmV0L2ZlYXR1cmVzL3Bhbm9yYW1hL2Ftcy1hY2FkZW15LWNvdW50cnlzLWZpcnN0LW9ubGluZS1lbmdsaXNoLW1lZGl1bS1zY2hvb2wtNzM5MDY20gFsaHR0cHM6Ly93d3cudGJzbmV3cy5uZXQvZmVhdHVyZXMvcGFub3JhbWEvYW1zLWFjYWRlbXktY291bnRyeXMtZmlyc3Qtb25saW5lLWVuZ2xpc2gtbWVkaXVtLXNjaG9vbC03MzkwNjY_YW1w?hl=en-IN&gl=IN&ceid=IN%3Aen,2023-11-14
5,Aircraft trajectory prediction and aviation safety in ADS-B failure ...,Nature.com,news.google.com/articles/CBMiMmh0dHBzOi8vd3d3Lm5hdHVyZS5jb20vYXJ0aWNsZXMvczQxNTk4LTAyMy00NjkxNC0y0gEA?hl=en-IN&gl=IN&ceid=IN%3Aen,2023-11-11
9,Quantitative analysis of peroxisome tracks using a Hidden Markov ...,Nature.com,news.google.com/articles/CBMiMmh0dHBzOi8vd3d3Lm5hdHVyZS5jb20vYXJ0aWNsZXMvczQxNTk4LTAyMy00NjgxMi030gEA?hl=en-IN&gl=IN&ceid=IN%3Aen,2023-11-11
7,Singly-excited resonant open quantum system Tavis-Cummings ...,Nature.com,news.google.com/articles/CBMiMmh0dHBzOi8vd3d3Lm5hdHVyZS5jb20vYXJ0aWNsZXMvczQxNTk4LTAyMy00NjEzOC000gEA?hl=en-IN&gl=IN&ceid=IN%3Aen,2023-11-09
6,Best practices for portfolio optimization by quantum computing ...,Nature.com,news.google.com/articles/CBMiMmh0dHBzOi8vd3d3Lm5hdHVyZS5jb20vYXJ0aWNsZXMvczQxNTk4LTAyMy00NTM5Mi130gEA?hl=en-IN&gl=IN&ceid=IN%3Aen,2023-11-08
8,Predicting crystal form stability under real-world conditions,Nature.com,news.google.com/articles/CBMiMmh0dHBzOi8vd3d3Lm5hdHVyZS5jb20vYXJ0aWNsZXMvczQxNTg2LTAyMy0wNjU4Ny0z0gEA?hl=en-IN&gl=IN&ceid=IN%3Aen,2023-11-08
11,Improved maximum likelihood method for P-S-N curve fitting method ...,Nature.com,news.google.com/articles/CBMiMmh0dHBzOi8vd3d3Lm5hdHVyZS5jb20vYXJ0aWNsZXMvczQxNTk4LTAyMy00NjU5NC150gEA?hl=en-IN&gl=IN&ceid=IN%3Aen,2023-11-06
