,title,source,link,date
1,"Culture Code for Proof of Concepts, Try-Storming, Pilot Tests ...",Quality Magazine,news.google.com/articles/CBMicWh0dHBzOi8vd3d3LnF1YWxpdHltYWcuY29tL2FydGljbGVzLzk3NTY3LWN1bHR1cmUtY29kZS1mb3ItcHJvb2Ytb2YtY29uY2VwdHMtdHJ5LXN0b3JtaW5nLXBpbG90LXRlc3RzLXNpbXVsYXRpb25z0gEA?hl=en-IN&gl=IN&ceid=IN%3Aen,2023-09-29
2,A quantum engine in the BEC–BCS crossover,Nature.com,news.google.com/articles/CBMiMmh0dHBzOi8vd3d3Lm5hdHVyZS5jb20vYXJ0aWNsZXMvczQxNTg2LTAyMy0wNjQ2OS040gEA?hl=en-IN&gl=IN&ceid=IN%3Aen,2023-09-27
11,"Next-gen composites manufacturing: Combining material, machine ...",CompositesWorld,news.google.com/articles/CBMiiQFodHRwczovL3d3dy5jb21wb3NpdGVzd29ybGQuY29tL2FydGljbGVzL25leHQtZ2VuLWNvbXBvc2l0ZXMtbWFudWZhY3R1cmluZy1jb21iaW5pbmctbWF0ZXJpYWwtbWFjaGluZS1hbmQtbW9sZC1jYXZpdHktZGF0YS13aXRoLWFuYWx5dGljc9IBAA?hl=en-IN&gl=IN&ceid=IN%3Aen,2023-09-26
3,Shear strength characteristics of basalt fiber-reinforced loess ...,Nature.com,news.google.com/articles/CBMiMmh0dHBzOi8vd3d3Lm5hdHVyZS5jb20vYXJ0aWNsZXMvczQxNTk4LTAyMy00MzIzOC160gEA?hl=en-IN&gl=IN&ceid=IN%3Aen,2023-09-23
15,Cryo EM structures map a post vaccination polyclonal antibody ...,Nature.com,news.google.com/articles/CBMiMmh0dHBzOi8vd3d3Lm5hdHVyZS5jb20vYXJ0aWNsZXMvczQyMDAzLTAyMy0wNTMxOS030gEA?hl=en-IN&gl=IN&ceid=IN%3Aen,2023-09-19
