,title,source,link,date
4,State estimation of a physical system with unknown governing ...,Nature.com,news.google.com/articles/CBMiMmh0dHBzOi8vd3d3Lm5hdHVyZS5jb20vYXJ0aWNsZXMvczQxNTg2LTAyMy0wNjU3NC040gEA?hl=en-IN&gl=IN&ceid=IN%3Aen,2023-10-11
7,Co-embedding of edges and nodes with deep graph convolutional ...,Nature.com,news.google.com/articles/CBMiMmh0dHBzOi8vd3d3Lm5hdHVyZS5jb20vYXJ0aWNsZXMvczQxNTk4LTAyMy00NDIyNC0x0gEA?hl=en-IN&gl=IN&ceid=IN%3Aen,2023-10-08
8,A robust optimal scheduling system based on multi-performance ...,Nature.com,news.google.com/articles/CBMiMmh0dHBzOi8vd3d3Lm5hdHVyZS5jb20vYXJ0aWNsZXMvczQxNTk4LTAyMy00Mzg1My130gEA?hl=en-IN&gl=IN&ceid=IN%3Aen,2023-10-07
6,An analytical study on nonlinear viscoelastic lubrication in journal ...,Nature.com,news.google.com/articles/CBMiMmh0dHBzOi8vd3d3Lm5hdHVyZS5jb20vYXJ0aWNsZXMvczQxNTk4LTAyMy00MzcxMi040gEA?hl=en-IN&gl=IN&ceid=IN%3Aen,2023-10-06
21,Chinese scientists make DNA computer breakthrough,The Stack,news.google.com/articles/CBMiSmh0dHBzOi8vd3d3LnRoZXN0YWNrLnRlY2hub2xvZ3kvc2NpZW50aXN0cy1tYWtlLWRuYS1jb21wdXRlci1icmVha3Rocm91Z2gv0gEA?hl=en-IN&gl=IN&ceid=IN%3Aen,2023-10-04
24,Influence of drug and polymer molecular weight on release kinetics ...,Nature.com,news.google.com/articles/CBMiMmh0dHBzOi8vd3d3Lm5hdHVyZS5jb20vYXJ0aWNsZXMvczQxNTk4LTAyMy00MjkyMy0z0gEA?hl=en-IN&gl=IN&ceid=IN%3Aen,2023-10-04
3,AI could finally solve a problem that's long plagued education,Fast Company,news.google.com/articles/CBMiYmh0dHBzOi8vd3d3LmZhc3Rjb21wYW55LmNvbS85MDk1OTg5My9haS1jb3VsZC1maW5hbGx5LXNvbHZlLWEtcHJvYmxlbS10aGF0cy1sb25nLXBsYWd1ZWQtZWR1Y2F0aW9u0gEA?hl=en-IN&gl=IN&ceid=IN%3Aen,2023-10-02
9,Nonnegative/Binary matrix factorization for image classification ...,Nature.com,news.google.com/articles/CBMiMmh0dHBzOi8vd3d3Lm5hdHVyZS5jb20vYXJ0aWNsZXMvczQxNTk4LTAyMy00MzcyOS160gEA?hl=en-IN&gl=IN&ceid=IN%3Aen,2023-10-02
25,Fast functional mapping of ligand-gated ion channels ...,Nature.com,news.google.com/articles/CBMiMmh0dHBzOi8vd3d3Lm5hdHVyZS5jb20vYXJ0aWNsZXMvczQyMDAzLTAyMy0wNTM0MC130gEA?hl=en-IN&gl=IN&ceid=IN%3Aen,2023-10-02
15,2D-LC–MS Approaches for the Analysis of In-Process Samples and ...,LCGC Chromatography Online,news.google.com/articles/CBMipAFodHRwczovL3d3dy5jaHJvbWF0b2dyYXBoeW9ubGluZS5jb20vdmlldy8yZC1sYy1tcy1hcHByb2FjaGVzLWZvci10aGUtYW5hbHlzaXMtb2YtaW4tcHJvY2Vzcy1zYW1wbGVzLWFuZC1mb3ItdGhlLWNoYXJhY3Rlcml6YXRpb24tb2YtbWFicy1pbi1hLXJlZ3VsYXRlZC1lbnZpcm9ubWVudNIBAA?hl=en-IN&gl=IN&ceid=IN%3Aen,2023-10-01
