,title,source,link,date
4,State estimation of a physical system with unknown governing ...,Nature.com,news.google.com/articles/CBMiMmh0dHBzOi8vd3d3Lm5hdHVyZS5jb20vYXJ0aWNsZXMvczQxNTg2LTAyMy0wNjU3NC040gEA?hl=en-IN&gl=IN&ceid=IN%3Aen,2023-10-11
7,Rapid discovery of high-affinity antibodies via massively parallel ...,Nature.com,news.google.com/articles/CBMiMmh0dHBzOi8vd3d3Lm5hdHVyZS5jb20vYXJ0aWNsZXMvczQxNTUxLTAyMy0wMTA5My0z0gEA?hl=en-IN&gl=IN&ceid=IN%3Aen,2023-10-09
8,Co-embedding of edges and nodes with deep graph convolutional ...,Nature.com,news.google.com/articles/CBMiMmh0dHBzOi8vd3d3Lm5hdHVyZS5jb20vYXJ0aWNsZXMvczQxNTk4LTAyMy00NDIyNC0x0gEA?hl=en-IN&gl=IN&ceid=IN%3Aen,2023-10-08
12,A robust optimal scheduling system based on multi-performance ...,Nature.com,news.google.com/articles/CBMiMmh0dHBzOi8vd3d3Lm5hdHVyZS5jb20vYXJ0aWNsZXMvczQxNTk4LTAyMy00Mzg1My130gEA?hl=en-IN&gl=IN&ceid=IN%3Aen,2023-10-07
6,An analytical study on nonlinear viscoelastic lubrication in journal ...,Nature.com,news.google.com/articles/CBMiMmh0dHBzOi8vd3d3Lm5hdHVyZS5jb20vYXJ0aWNsZXMvczQxNTk4LTAyMy00MzcxMi040gEA?hl=en-IN&gl=IN&ceid=IN%3Aen,2023-10-06
