,title,source,link,date
7,"Whether or not govt wants to nab syndicates, is the question",Prothom Alo English,news.google.com/articles/CBMiNmh0dHBzOi8vZW4ucHJvdGhvbWFsby5jb20vb3Bpbmlvbi9pbnRlcnZpZXcvYzg0b2l2MHdtONIBQGh0dHBzOi8vZW4ucHJvdGhvbWFsby5jb20vYW1wL3N0b3J5L29waW5pb24vaW50ZXJ2aWV3L2M4NG9pdjB3bTg?hl=en-IN&gl=IN&ceid=IN%3Aen,2023-09-24
4,Deep learning for tumor margin identification in electromagnetic ...,Nature.com,news.google.com/articles/CBMiMmh0dHBzOi8vd3d3Lm5hdHVyZS5jb20vYXJ0aWNsZXMvczQxNTk4LTAyMy00MjYyNS130gEA?hl=en-IN&gl=IN&ceid=IN%3Aen,2023-09-23
10,GiRAFR improves gRNA detection and annotation in single-cell ...,Nature.com,news.google.com/articles/CBMiMmh0dHBzOi8vd3d3Lm5hdHVyZS5jb20vYXJ0aWNsZXMvczQyMDAzLTAyMy0wNTM1MS030gEA?hl=en-IN&gl=IN&ceid=IN%3Aen,2023-09-23
5,Shear strength characteristics of basalt fiber-reinforced loess ...,Nature.com,news.google.com/articles/CBMiMmh0dHBzOi8vd3d3Lm5hdHVyZS5jb20vYXJ0aWNsZXMvczQxNTk4LTAyMy00MzIzOC160gEA?hl=en-IN&gl=IN&ceid=IN%3Aen,2023-09-23
8,The application of HER2 and CD47 CAR-macrophage in ovarian ...,Journal of Translational Medicine,news.google.com/articles/CBMiVGh0dHBzOi8vdHJhbnNsYXRpb25hbC1tZWRpY2luZS5iaW9tZWRjZW50cmFsLmNvbS9hcnRpY2xlcy8xMC4xMTg2L3MxMjk2Ny0wMjMtMDQ0NzktONIBAA?hl=en-IN&gl=IN&ceid=IN%3Aen,2023-09-22
28,"Socure Achieves 376% Revenue Growth from 2019-2022, Appoints Seasoned Technology Leader as CFO",Benzinga,news.google.com/articles/CBMikwFodHRwczovL3d3dy5iZW56aW5nYS5jb20vcHJlc3NyZWxlYXNlcy8yMy8wOS9uMzQ3OTc5OTAvc29jdXJlLWFjaGlldmVzLTM3Ni1yZXZlbnVlLWdyb3d0aC1mcm9tLTIwMTktMjAyMi1hcHBvaW50cy1zZWFzb25lZC10ZWNobm9sb2d5LWxlYWRlci1hcy1jZm_SAS1odHRwczovL3d3dy5iZW56aW5nYS5jb20vYW1wL2NvbnRlbnQvMzQ3OTc5OTA?hl=en-IN&gl=IN&ceid=IN%3Aen,2023-09-21
17,Cryo EM structures map a post vaccination polyclonal antibody ...,Nature.com,news.google.com/articles/CBMiMmh0dHBzOi8vd3d3Lm5hdHVyZS5jb20vYXJ0aWNsZXMvczQyMDAzLTAyMy0wNTMxOS030gEA?hl=en-IN&gl=IN&ceid=IN%3Aen,2023-09-19
29,Plastic Films Market 2023 Latest Research Highlighting Current and ...,Rouge Fox,news.google.com/articles/CBMiswFodHRwczovL3JvdWdlZm94LmNvbS9wbGFzdGljLWZpbG1zLW1hcmtldC0yMDIzLWxhdGVzdC1yZXNlYXJjaC1oaWdobGlnaHRpbmctY3VycmVudC1hbmQtZnV0dXJlLXRyZW5kcy1hbWNvci1saW1pdGVkLWJlbWlzLWNvbXBhbnktaW5jLWppbmRhbC1wb2x5LWZpbG1zLWx0ZC1zZWFsZWQtYWlyLWNvcnBvcmF0aW9uL9IBAA?hl=en-IN&gl=IN&ceid=IN%3Aen,2023-09-18
27,Financial Planning and Analysis Software Market Research Report 2023-2030 | 133 Pages Report,Benzinga,news.google.com/articles/CBMikAFodHRwczovL3d3dy5iZW56aW5nYS5jb20vcHJlc3NyZWxlYXNlcy8yMy8wOS8zNDY3MjUyNi9maW5hbmNpYWwtcGxhbm5pbmctYW5kLWFuYWx5c2lzLXNvZnR3YXJlLW1hcmtldC1yZXNlYXJjaC1yZXBvcnQtMjAyMy0yMDMwLTEzMy1wYWdlcy1yZXBvcnTSAS1odHRwczovL3d3dy5iZW56aW5nYS5jb20vYW1wL2NvbnRlbnQvMzQ2NzI1MjY?hl=en-IN&gl=IN&ceid=IN%3Aen,2023-09-18
9,Method for efficient calculating earth pressure of retaining wall ...,Nature.com,news.google.com/articles/CBMiMmh0dHBzOi8vd3d3Lm5hdHVyZS5jb20vYXJ0aWNsZXMvczQxNTk4LTAyMy00MjQxMS040gEA?hl=en-IN&gl=IN&ceid=IN%3Aen,2023-09-16
