,title,source,link,date
44,Fuel Supply System Component Market: a Long-term Investment Will Bring Potential Growth Opportunities for Key,openPR,news.google.com/articles/CBMiXmh0dHBzOi8vd3d3Lm9wZW5wci5jb20vbmV3cy8zMTc2Njk2L2Z1ZWwtc3VwcGx5LXN5c3RlbS1jb21wb25lbnQtbWFya2V0LWEtbG9uZy10ZXJtLWludmVzdG1lbnTSAV1odHRwczovL3d3dy5vcGVucHIuY29tL2FtcC8zMTc2Njk2L2Z1ZWwtc3VwcGx5LXN5c3RlbS1jb21wb25lbnQtbWFya2V0LWEtbG9uZy10ZXJtLWludmVzdG1lbnQ?hl=en-IN&gl=IN&ceid=IN%3Aen,2023-08-23
12,Global Machine Condition Monitoring Market 2023 : SWOT Analysis Of Key Driving Factors For Growing CAGR Value,openPR,news.google.com/articles/CBMiYWh0dHBzOi8vd3d3Lm9wZW5wci5jb20vbmV3cy8zMTc2MzA4L2dsb2JhbC1tYWNoaW5lLWNvbmRpdGlvbi1tb25pdG9yaW5nLW1hcmtldC0yMDIzLXN3b3QtYW5hbHlzaXPSAWBodHRwczovL3d3dy5vcGVucHIuY29tL2FtcC8zMTc2MzA4L2dsb2JhbC1tYWNoaW5lLWNvbmRpdGlvbi1tb25pdG9yaW5nLW1hcmtldC0yMDIzLXN3b3QtYW5hbHlzaXM?hl=en-IN&gl=IN&ceid=IN%3Aen,2023-08-23
17,Needle Roller Bearing Market 2023 | Unraveling New Opportunities ...,Digital Journal,news.google.com/articles/CBMifmh0dHBzOi8vd3d3LmRpZ2l0YWxqb3VybmFsLmNvbS9wci9uZXdzL3RoZWV4cHJlc3N3aXJlL25lZWRsZS1yb2xsZXItYmVhcmluZy1tYXJrZXQtMjAyMy11bnJhdmVsaW5nLW5ldy1vcHBvcnR1bml0aWVzLXRpbGwtMjAzMNIBAA?hl=en-IN&gl=IN&ceid=IN%3Aen,2023-08-23
68,"Global Field Balancing Services Market 2023 Worldwide Industry Size, Segments, Competitive Landscape, and Fore",openPR,news.google.com/articles/CBMiYmh0dHBzOi8vd3d3Lm9wZW5wci5jb20vbmV3cy8zMTc2MzQ5L2dsb2JhbC1maWVsZC1iYWxhbmNpbmctc2VydmljZXMtbWFya2V0LTIwMjMtd29ybGR3aWRlLWluZHVzdHJ50gFhaHR0cHM6Ly93d3cub3BlbnByLmNvbS9hbXAvMzE3NjM0OS9nbG9iYWwtZmllbGQtYmFsYW5jaW5nLXNlcnZpY2VzLW1hcmtldC0yMDIzLXdvcmxkd2lkZS1pbmR1c3RyeQ?hl=en-IN&gl=IN&ceid=IN%3Aen,2023-08-23
41,"Bicycle Bearings Market: Analyzing Global Trends, Technological Innovations, and Riding Dynamics in the G",Benzinga,news.google.com/articles/CBMimQFodHRwczovL3d3dy5iZW56aW5nYS5jb20vcHJlc3NyZWxlYXNlcy8yMy8wOC8zMzk5NDQ5OC9iaWN5Y2xlLWJlYXJpbmdzLW1hcmtldC1hbmFseXppbmctZ2xvYmFsLXRyZW5kcy10ZWNobm9sb2dpY2FsLWlubm92YXRpb25zLWFuZC1yaWRpbmctZHluYW1pY3MtaW4tdGjSAS1odHRwczovL3d3dy5iZW56aW5nYS5jb20vYW1wL2NvbnRlbnQvMzM5OTQ0OTg?hl=en-IN&gl=IN&ceid=IN%3Aen,2023-08-22
79,Global Conveyor Cleaning Brush Market Analysis By Major Manufacturers and Competitive landscape 2023-2029,openPR,news.google.com/articles/CBMiW2h0dHBzOi8vd3d3Lm9wZW5wci5jb20vbmV3cy8zMTc0NjA4L2dsb2JhbC1jb252ZXlvci1jbGVhbmluZy1icnVzaC1tYXJrZXQtYW5hbHlzaXMtYnktbWFqb3LSAVpodHRwczovL3d3dy5vcGVucHIuY29tL2FtcC8zMTc0NjA4L2dsb2JhbC1jb252ZXlvci1jbGVhbmluZy1icnVzaC1tYXJrZXQtYW5hbHlzaXMtYnktbWFqb3I?hl=en-IN&gl=IN&ceid=IN%3Aen,2023-08-22
78,Global Engineering Bearing Market Analysis By Major Manufacturers and Competitive landscape 2023-2029,openPR,news.google.com/articles/CBMiV2h0dHBzOi8vd3d3Lm9wZW5wci5jb20vbmV3cy8zMTc0NDEyL2dsb2JhbC1lbmdpbmVlcmluZy1iZWFyaW5nLW1hcmtldC1hbmFseXNpcy1ieS1tYWpvctIBVmh0dHBzOi8vd3d3Lm9wZW5wci5jb20vYW1wLzMxNzQ0MTIvZ2xvYmFsLWVuZ2luZWVyaW5nLWJlYXJpbmctbWFya2V0LWFuYWx5c2lzLWJ5LW1ham9y?hl=en-IN&gl=IN&ceid=IN%3Aen,2023-08-22
73,Global Automatic Conveyor Lubrication Equipment Market Analysis By Major Manufacturers and Competitive landsca,openPR,news.google.com/articles/CBMiWmh0dHBzOi8vd3d3Lm9wZW5wci5jb20vbmV3cy8zMTc0NTgzL2dsb2JhbC1hdXRvbWF0aWMtY29udmV5b3ItbHVicmljYXRpb24tZXF1aXBtZW50LW1hcmtldNIBWWh0dHBzOi8vd3d3Lm9wZW5wci5jb20vYW1wLzMxNzQ1ODMvZ2xvYmFsLWF1dG9tYXRpYy1jb252ZXlvci1sdWJyaWNhdGlvbi1lcXVpcG1lbnQtbWFya2V0?hl=en-IN&gl=IN&ceid=IN%3Aen,2023-08-22
87,"Global Conveyor Monitoring Device Market Revenue & Gross Margin, Opportunities, Challenges and Risks Analysis",openPR,news.google.com/articles/CBMiWmh0dHBzOi8vd3d3Lm9wZW5wci5jb20vbmV3cy8zMTc0NTg4L2dsb2JhbC1jb252ZXlvci1tb25pdG9yaW5nLWRldmljZS1tYXJrZXQtcmV2ZW51ZS1ncm9zc9IBWWh0dHBzOi8vd3d3Lm9wZW5wci5jb20vYW1wLzMxNzQ1ODgvZ2xvYmFsLWNvbnZleW9yLW1vbml0b3JpbmctZGV2aWNlLW1hcmtldC1yZXZlbnVlLWdyb3Nz?hl=en-IN&gl=IN&ceid=IN%3Aen,2023-08-22
30,"Gaskets and Seals Market Share Report, Demand & Outlook [2023 ...",Digital Journal,news.google.com/articles/CBMieWh0dHBzOi8vd3d3LmRpZ2l0YWxqb3VybmFsLmNvbS9wci9uZXdzL3RoZWV4cHJlc3N3aXJlL2dhc2tldHMtYW5kLXNlYWxzLW1hcmtldC1zaGFyZS1yZXBvcnQtZGVtYW5kLWFtcC1vdXRsb29rLTIwMjMtMjAzMC3SAQA?hl=en-IN&gl=IN&ceid=IN%3Aen,2023-08-22
