,title,source,link,date
4,Cania Gorge National Park is now home for these tree-changers who left the Gold Coast for a new lifestyle,ABC News,news.google.com/articles/CBMibmh0dHBzOi8vd3d3LmFiYy5uZXQuYXUvbmV3cy8yMDIzLTA4LTI2L2ZhbWlseS1sZWF2ZXMtZ29sZC1jb2FzdC10by1saXZlLWluLWNhbmlhLWdvcmdlLW5hdGlvbmFsLXBhcmsvMTAyNzU1NjMy0gEoaHR0cHM6Ly9hbXAuYWJjLm5ldC5hdS9hcnRpY2xlLzEwMjc1NTYzMg?hl=en-IN&gl=IN&ceid=IN%3Aen,2023-08-26
31,Homer Jury convicts Debra Spencer for setting structure fire,kinyradio.com,news.google.com/articles/CBMibmh0dHBzOi8vd3d3LmtpbnlyYWRpby5jb20vbmV3cy9uZXdzLW9mLXRoZS1ub3J0aC9ob21lci1qdXJ5LWNvbnZpY3RzLWRlYnJhLXNwZW5jZXItZm9yLXNldHRpbmctc3RydWN0dXJlLWZpcmUv0gEA?hl=en-IN&gl=IN&ceid=IN%3Aen,2023-08-26
32,Marks & Spencer says government response on period pants tax 'isn ...,Retail Week,news.google.com/articles/CBMifmh0dHBzOi8vd3d3LnJldGFpbC13ZWVrLmNvbS9mYXNoaW9uL21hcmtzLWFuZC1zcGVuY2VyLXNheXMtZ292ZXJubWVudC1yZXNwb25zZS1vbi1wZXJpb2QtcGFudHMtdGF4LWlzbnQtZW5vdWdoLzcwNDQ0MzkuYXJ0aWNsZdIBAA?hl=en-IN&gl=IN&ceid=IN%3Aen,2023-08-25
65,"MLB PrizePicks predictions, player picks Aug. 25: Spencer Strider",New York Post ,news.google.com/articles/CBMiXWh0dHBzOi8vbnlwb3N0LmNvbS8yMDIzLzA4LzI1L21sYi1wcml6ZXBpY2tzLXByZWRpY3Rpb25zLXBsYXllci1waWNrcy1hdWctMjUtc3BlbmNlci1zdHJpZGVyL9IBAA?hl=en-IN&gl=IN&ceid=IN%3Aen,2023-08-25
29,"Mock trade has Nets trading Spencer Dinwiddie for Evan Fournier, second-round picks",Yahoo Sports,news.google.com/articles/CBMiR2h0dHBzOi8vc3BvcnRzLnlhaG9vLmNvbS9tb2NrLXRyYWRlLW5ldHMtdHJhZGluZy1zcGVuY2VyLTEzNTY1MjA1MC5odG1s0gFPaHR0cHM6Ly9zcG9ydHMueWFob28uY29tL2FtcGh0bWwvbW9jay10cmFkZS1uZXRzLXRyYWRpbmctc3BlbmNlci0xMzU2NTIwNTAuaHRtbA?hl=en-IN&gl=IN&ceid=IN%3Aen,2023-08-25
33,Guest columnist Julie Spencer-Robinson: Time for a more authentic ...,GazetteNET,news.google.com/articles/CBMiRGh0dHBzOi8vd3d3LmdhemV0dGVuZXQuY29tL0d1ZXN0LWNvbHVtbmlzdC1TcGVuY2VyLVJvYmluc29uLTUyMDc2Njk10gEA?hl=en-IN&gl=IN&ceid=IN%3Aen,2023-08-25
34,Emmerdale Dan Spencer's prison escape 'sealed' as unlikely source helps him break out,Daily Star,news.google.com/articles/CBMiTGh0dHBzOi8vd3d3LmRhaWx5c3Rhci5jby51ay90di9lbW1lcmRhbGUtZGFuLXNwZW5jZXJzLXByaXNvbi1lc2NhcGUtMzA3ODQzMjTSAVBodHRwczovL3d3dy5kYWlseXN0YXIuY28udWsvdHYvZW1tZXJkYWxlLWRhbi1zcGVuY2Vycy1wcmlzb24tZXNjYXBlLTMwNzg0MzI0LmFtcA?hl=en-IN&gl=IN&ceid=IN%3Aen,2023-08-25
35,Randi Winter Explains Employer Religious Accommodations for ...,Spencer Fane,news.google.com/articles/CBMiZWh0dHBzOi8vd3d3LnNwZW5jZXJmYW5lLmNvbS9pbnNpZ2h0L3JhbmRpLXdpbnRlci1leHBsYWlucy1lbXBsb3llci1yZWxpZ2lvdXMtYWNjb21tb2RhdGlvbnMtZm9yLXNocm0v0gEA?hl=en-IN&gl=IN&ceid=IN%3Aen,2023-08-25
36,Blue Bridge briefly shutdown due to crash in Spencer County,14 News WFIE Evansville,news.google.com/articles/CBMiXmh0dHBzOi8vd3d3LjE0bmV3cy5jb20vMjAyMy8wOC8yNS90cmFmZmljLWFsZXJ0LWJsdWUtYnJpZGdlLXNodXRkb3duLWR1ZS1jcmFzaC1zcGVuY2VyLWNvdW50eS_SAW1odHRwczovL3d3dy4xNG5ld3MuY29tLzIwMjMvMDgvMjUvdHJhZmZpYy1hbGVydC1ibHVlLWJyaWRnZS1zaHV0ZG93bi1kdWUtY3Jhc2gtc3BlbmNlci1jb3VudHkvP291dHB1dFR5cGU9YW1w?hl=en-IN&gl=IN&ceid=IN%3Aen,2023-08-25
38,Spencer Ludwig x Capital Cities May Just Have Saved This Summer,Flaunt Magazine,news.google.com/articles/CBMiNmh0dHA6Ly9mbGF1bnQuY29tL3Bvc3Qvc3BlbmNlci1sdWR3aWcteC1jYXBpdGFsLWNpdGllc9IBAA?hl=en-IN&gl=IN&ceid=IN%3Aen,2023-08-25
