,title,source,link,date
0,"Sree Rayalaseema Hi-Strength Hypo Limited (NSE:SRHHYPOLTD) Passed Our Checks, And It's About To Pay A ₹4.00 Dividend",Simply Wall St,news.google.com/articles/CBMiowFodHRwczovL3NpbXBseXdhbGwuc3Qvc3RvY2tzL2luL21hdGVyaWFscy9uc2Utc3JoaHlwb2x0ZC9zcmVlLXJheWFsYXNlZW1hLWhpLXN0cmVuZ3RoLWh5cG8tc2hhcmVzL25ld3Mvc3JlZS1yYXlhbGFzZWVtYS1oaS1zdHJlbmd0aC1oeXBvLWxpbWl0ZWQtbnNlc3JoaHlwb2x0ZC1wYXNz0gGnAWh0dHBzOi8vc2ltcGx5d2FsbC5zdC9zdG9ja3MvaW4vbWF0ZXJpYWxzL25zZS1zcmhoeXBvbHRkL3NyZWUtcmF5YWxhc2VlbWEtaGktc3RyZW5ndGgtaHlwby1zaGFyZXMvbmV3cy9zcmVlLXJheWFsYXNlZW1hLWhpLXN0cmVuZ3RoLWh5cG8tbGltaXRlZC1uc2VzcmhoeXBvbHRkLXBhc3MvYW1w?hl=en-IN&gl=IN&ceid=IN%3Aen,2023-09-14
8,"2023, Sodium Process Calcium Hypochlorite Market Growth Trend, Size, Share and Forecast [2030]",Benzinga,news.google.com/articles/CBMijwFodHRwczovL3d3dy5iZW56aW5nYS5jb20vcHJlc3NyZWxlYXNlcy8yMy8wOS8zNDU0Njg1Mi8yMDIzLXNvZGl1bS1wcm9jZXNzLWNhbGNpdW0taHlwb2NobG9yaXRlLW1hcmtldC1ncm93dGgtdHJlbmQtc2l6ZS1zaGFyZS1hbmQtZm9yZWNhc3QtMjAzMNIBLWh0dHBzOi8vd3d3LmJlbnppbmdhLmNvbS9hbXAvY29udGVudC8zNDU0Njg1Mg?hl=en-IN&gl=IN&ceid=IN%3Aen,2023-09-13
9,Calcium Hypochlorite Market Size in 2023: Competitive landscape and Leading Country Data,Benzinga,news.google.com/articles/CBMijQFodHRwczovL3d3dy5iZW56aW5nYS5jb20vcHJlc3NyZWxlYXNlcy8yMy8wOS8zNDQyNjE3Mi9jYWxjaXVtLWh5cG9jaGxvcml0ZS1tYXJrZXQtc2l6ZS1pbi0yMDIzLWNvbXBldGl0aXZlLWxhbmRzY2FwZS1hbmQtbGVhZGluZy1jb3VudHJ5LWRhdGHSAS1odHRwczovL3d3dy5iZW56aW5nYS5jb20vYW1wL2NvbnRlbnQvMzQ0MjYxNzI?hl=en-IN&gl=IN&ceid=IN%3Aen,2023-09-11
11,"Sodium Process Calcium Hypochlorite Market Size 2023 (New Insights Report) drivers, opportunities, restra",Benzinga,news.google.com/articles/CBMimQFodHRwczovL3d3dy5iZW56aW5nYS5jb20vcHJlc3NyZWxlYXNlcy8yMy8wOS8zNDM3MDY0OC9zb2RpdW0tcHJvY2Vzcy1jYWxjaXVtLWh5cG9jaGxvcml0ZS1tYXJrZXQtc2l6ZS0yMDIzLW5ldy1pbnNpZ2h0cy1yZXBvcnQtZHJpdmVycy1vcHBvcnR1bml0aWVzLXJlc3TSAS1odHRwczovL3d3dy5iZW56aW5nYS5jb20vYW1wL2NvbnRlbnQvMzQzNzA2NDg?hl=en-IN&gl=IN&ceid=IN%3Aen,2023-09-08
2,"Bleach Market to increase by USD 376.56 million from 2022 to 2027, Aditya Birla Management Corp. Pvt. Ltd., Arkema Group, and Ashland Inc., among key companies- Technavio",Yahoo Finance,news.google.com/articles/CBMiTGh0dHBzOi8vZmluYW5jZS55YWhvby5jb20vbmV3cy9ibGVhY2gtbWFya2V0LWluY3JlYXNlLXVzZC0zNzYtMDMzNTAwMzcwLmh0bWzSAVRodHRwczovL2ZpbmFuY2UueWFob28uY29tL2FtcGh0bWwvbmV3cy9ibGVhY2gtbWFya2V0LWluY3JlYXNlLXVzZC0zNzYtMDMzNTAwMzcwLmh0bWw?hl=en-IN&gl=IN&ceid=IN%3Aen,2023-09-07
