,title,source,link,date
23,The Cabozantinib Market: An In-Depth Analysis of Industry Trends and Growth Drivers with an anticipated C,Benzinga,news.google.com/articles/CBMimQFodHRwczovL3d3dy5iZW56aW5nYS5jb20vcHJlc3NyZWxlYXNlcy8yMy8wOS8zNDE5MjE3OC90aGUtY2Fib3phbnRpbmliLW1hcmtldC1hbi1pbi1kZXB0aC1hbmFseXNpcy1vZi1pbmR1c3RyeS10cmVuZHMtYW5kLWdyb3d0aC1kcml2ZXJzLXdpdGgtYW4tYW50aWNpcGHSAS1odHRwczovL3d3dy5iZW56aW5nYS5jb20vYW1wL2NvbnRlbnQvMzQxOTIxNzg?hl=en-IN&gl=IN&ceid=IN%3Aen,2023-09-03
27,"Considering the cumulative impact of COVID-19 on the Frozen Shoulder Treatment market's size, share, and",Benzinga,news.google.com/articles/CBMimQFodHRwczovL3d3dy5iZW56aW5nYS5jb20vcHJlc3NyZWxlYXNlcy8yMy8wOS8zNDE5MjYyNC9jb25zaWRlcmluZy10aGUtY3VtdWxhdGl2ZS1pbXBhY3Qtb2YtY292aWQtMTktb24tdGhlLWZyb3plbi1zaG91bGRlci10cmVhdG1lbnQtbWFya2V0cy1zaXplLXNoYXJlLWHSAS1odHRwczovL3d3dy5iZW56aW5nYS5jb20vYW1wL2NvbnRlbnQvMzQxOTI2MjQ?hl=en-IN&gl=IN&ceid=IN%3Aen,2023-09-03
16,"Vertebrobasilar Insufficiency Treatment Market | Abbott Pharmaceuticals, AstraZeneca plc, Cadila Pharmaceutica",openPR,news.google.com/articles/CBMiWWh0dHBzOi8vd3d3Lm9wZW5wci5jb20vbmV3cy8zMTkzMDcyL3ZlcnRlYnJvYmFzaWxhci1pbnN1ZmZpY2llbmN5LXRyZWF0bWVudC1tYXJrZXQtYWJib3R00gFYaHR0cHM6Ly93d3cub3BlbnByLmNvbS9hbXAvMzE5MzA3Mi92ZXJ0ZWJyb2Jhc2lsYXItaW5zdWZmaWNpZW5jeS10cmVhdG1lbnQtbWFya2V0LWFiYm90dA?hl=en-IN&gl=IN&ceid=IN%3Aen,2023-09-03
98,"The Fluoxetine market is projected to expand at a CAGR of 10.3% until 2030, according to the thorough ana",Benzinga,news.google.com/articles/CBMimQFodHRwczovL3d3dy5iZW56aW5nYS5jb20vcHJlc3NyZWxlYXNlcy8yMy8wOS8zNDE5MDk3Mi90aGUtZmx1b3hldGluZS1tYXJrZXQtaXMtcHJvamVjdGVkLXRvLWV4cGFuZC1hdC1hLWNhZ3Itb2YtMTAtMy11bnRpbC0yMDMwLWFjY29yZGluZy10by10aGUtdGhvcm91Z2jSAS1odHRwczovL3d3dy5iZW56aW5nYS5jb20vYW1wL2NvbnRlbnQvMzQxOTA5NzI?hl=en-IN&gl=IN&ceid=IN%3Aen,2023-09-02
96,"This report presents an in-depth analysis of the Doxycycline Hyclate Oral market, including market size,",Benzinga,news.google.com/articles/CBMimQFodHRwczovL3d3dy5iZW56aW5nYS5jb20vcHJlc3NyZWxlYXNlcy8yMy8wOS8zNDE5MDg5OS90aGlzLXJlcG9ydC1wcmVzZW50cy1hbi1pbi1kZXB0aC1hbmFseXNpcy1vZi10aGUtZG94eWN5Y2xpbmUtaHljbGF0ZS1vcmFsLW1hcmtldC1pbmNsdWRpbmctbWFya2V0LXPSAS1odHRwczovL3d3dy5iZW56aW5nYS5jb20vYW1wL2NvbnRlbnQvMzQxOTA4OTk?hl=en-IN&gl=IN&ceid=IN%3Aen,2023-09-02
67,Comprehensive Analysis on Global Rivastigmine Tartrate Market by Market Size of 4.9% CAGR Valuation and G,Benzinga,news.google.com/articles/CBMimQFodHRwczovL3d3dy5iZW56aW5nYS5jb20vcHJlc3NyZWxlYXNlcy8yMy8wOS8zNDE5MTY3OS9jb21wcmVoZW5zaXZlLWFuYWx5c2lzLW9uLWdsb2JhbC1yaXZhc3RpZ21pbmUtdGFydHJhdGUtbWFya2V0LWJ5LW1hcmtldC1zaXplLW9mLTQtOS1jYWdyLXZhbHVhdGlvbi3SAS1odHRwczovL3d3dy5iZW56aW5nYS5jb20vYW1wL2NvbnRlbnQvMzQxOTE2Nzk?hl=en-IN&gl=IN&ceid=IN%3Aen,2023-09-02
63,Solifenacin Succinate Market Growth Outlook 2023 to 2030: Insights and Analysis from Market Research Repo,Benzinga,news.google.com/articles/CBMimQFodHRwczovL3d3dy5iZW56aW5nYS5jb20vcHJlc3NyZWxlYXNlcy8yMy8wOS8zNDE5MTY2My9zb2xpZmVuYWNpbi1zdWNjaW5hdGUtbWFya2V0LWdyb3d0aC1vdXRsb29rLTIwMjMtdG8tMjAzMC1pbnNpZ2h0cy1hbmQtYW5hbHlzaXMtZnJvbS1tYXJrZXQtcmVzZWFyY2jSAS1odHRwczovL3d3dy5iZW56aW5nYS5jb20vYW1wL2NvbnRlbnQvMzQxOTE2NjM?hl=en-IN&gl=IN&ceid=IN%3Aen,2023-09-02
53,Comprehensive Report on the Venlafaxine Hydrochloride Market Size from 2023 to 2030: Analysis of Technolo,Benzinga,news.google.com/articles/CBMimQFodHRwczovL3d3dy5iZW56aW5nYS5jb20vcHJlc3NyZWxlYXNlcy8yMy8wOS8zNDE5MTY3NC9jb21wcmVoZW5zaXZlLXJlcG9ydC1vbi10aGUtdmVubGFmYXhpbmUtaHlkcm9jaGxvcmlkZS1tYXJrZXQtc2l6ZS1mcm9tLTIwMjMtdG8tMjAzMC1hbmFseXNpcy1vZi10ZWPSAS1odHRwczovL3d3dy5iZW56aW5nYS5jb20vYW1wL2NvbnRlbnQvMzQxOTE2NzQ?hl=en-IN&gl=IN&ceid=IN%3Aen,2023-09-02
51,"This report presents a comprehensive overview of the Lansoprazole market, including market share, size, g",Benzinga,news.google.com/articles/CBMimQFodHRwczovL3d3dy5iZW56aW5nYS5jb20vcHJlc3NyZWxlYXNlcy8yMy8wOS8zNDE5MDE3Mi90aGlzLXJlcG9ydC1wcmVzZW50cy1hLWNvbXByZWhlbnNpdmUtb3ZlcnZpZXctb2YtdGhlLWxhbnNvcHJhem9sZS1tYXJrZXQtaW5jbHVkaW5nLW1hcmtldC1zaGFyZS1zaXrSAS1odHRwczovL3d3dy5iZW56aW5nYS5jb20vYW1wL2NvbnRlbnQvMzQxOTAxNzI?hl=en-IN&gl=IN&ceid=IN%3Aen,2023-09-02
44,"The report on the Gemcitabine HCl market size forecasts a 5.1% CAGR growth rate until 2030, providing a d",Benzinga,news.google.com/articles/CBMimQFodHRwczovL3d3dy5iZW56aW5nYS5jb20vcHJlc3NyZWxlYXNlcy8yMy8wOS8zNDE5MTY3OC90aGUtcmVwb3J0LW9uLXRoZS1nZW1jaXRhYmluZS1oY2wtbWFya2V0LXNpemUtZm9yZWNhc3RzLWEtNS0xLWNhZ3ItZ3Jvd3RoLXJhdGUtdW50aWwtMjAzMC1wcm92aWRpbmfSAS1odHRwczovL3d3dy5iZW56aW5nYS5jb20vYW1wL2NvbnRlbnQvMzQxOTE2Nzg?hl=en-IN&gl=IN&ceid=IN%3Aen,2023-09-02
