,title,source,link,date
0,"ASK Automotive IPO opens tomorrow: GMP, issue details, review, 10 key things to know | Mint",Mint,news.google.com/articles/CBMiiAFodHRwczovL3d3dy5saXZlbWludC5jb20vbWFya2V0L2lwby9hc2stYXV0b21vdGl2ZS1pcG8tb3BlbnMtdG9tb3Jyb3ctZ21wLWlzc3VlLWRldGFpbHMtcmV2aWV3LTEwLWtleS10aGluZ3MtdG8ta25vdy0xMTY5OTI2NzE0MzEwNC5odG1s0gGMAWh0dHBzOi8vd3d3LmxpdmVtaW50LmNvbS9tYXJrZXQvaXBvL2Fzay1hdXRvbW90aXZlLWlwby1vcGVucy10b21vcnJvdy1nbXAtaXNzdWUtZGV0YWlscy1yZXZpZXctMTAta2V5LXRoaW5ncy10by1rbm93L2FtcC0xMTY5OTI2NzE0MzEwNC5odG1s?hl=en-IN&gl=IN&ceid=IN%3Aen,2023-11-06
1,ASK Automotive's IPO to launch with promoter stake dilution,Investing.com India,news.google.com/articles/CBMiZWh0dHBzOi8vaW4uaW52ZXN0aW5nLmNvbS9uZXdzL2Fzay1hdXRvbW90aXZlcy1pcG8tdG8tbGF1bmNoLXdpdGgtcHJvbW90ZXItc3Rha2UtZGlsdXRpb24tOTNDSC0zODg3MjE50gEA?hl=en-IN&gl=IN&ceid=IN%3Aen,2023-11-06
2,"ASK Automotive IPO Date, Review, Price, Allotment Details",IPO Watch,news.google.com/articles/CBMiS2h0dHBzOi8vaXBvd2F0Y2guaW4vYXNrLWF1dG9tb3RpdmUtaXBvLWRhdGUtcmV2aWV3LXByaWNlLWFsbG90bWVudC1kZXRhaWxzL9IBAA?hl=en-IN&gl=IN&ceid=IN%3Aen,2023-11-05
3,Markets holding but no clarity on breakout,Nagaland Post,news.google.com/articles/CBMiTmh0dHBzOi8vbmFnYWxhbmRwb3N0LmNvbS9pbmRleC5waHAvbWFya2V0cy1ob2xkaW5nLWJ1dC1uby1jbGFyaXR5LW9uLWJyZWFrb3V0L9IBAA?hl=en-IN&gl=IN&ceid=IN%3Aen,2023-11-05
6,Markets holding but no clarity on breakout,Daijiworld.com,news.google.com/articles/CBMiRGh0dHBzOi8vd3d3LmRhaWppd29ybGQuY29tL2luZGV4LnBocC9uZXdzL25ld3NEaXNwbGF5P25ld3NJRD0xMTM3MTIy0gEA?hl=en-IN&gl=IN&ceid=IN%3Aen,2023-11-05
5,"Automotive Halogen Headlights Market size to decline by USD -1.72 billion from 2023 to 2028 | Market is fragmented due to the presence of prominent companies like ams OSRAM AG, Autolite (India) Ltd. and HELLA GmbH and Co. KGaA, and many more",Yahoo Finance,news.google.com/articles/CBMiV2h0dHBzOi8vZmluYW5jZS55YWhvby5jb20vbmV3cy9hdXRvbW90aXZlLWhhbG9nZW4taGVhZGxpZ2h0cy1tYXJrZXQtc2l6ZS0yMjM1MDA5NDMuaHRtbNIBX2h0dHBzOi8vZmluYW5jZS55YWhvby5jb20vYW1waHRtbC9uZXdzL2F1dG9tb3RpdmUtaGFsb2dlbi1oZWFkbGlnaHRzLW1hcmtldC1zaXplLTIyMzUwMDk0My5odG1s?hl=en-IN&gl=IN&ceid=IN%3Aen,2023-10-30
