,title,source,link,date
31,How to watch the Chicago Bears vs. Minnesota Vikings NFL game ...,CBS News,news.google.com/articles/CBMiXGh0dHBzOi8vd3d3LmNic25ld3MuY29tL2Vzc2VudGlhbHMvaG93LXRvLXdhdGNoLXRoZS1jaGljYWdvLWJlYXJzLXZzLW1pbm5lc290YS12aWtpbmdzLWdhbWUv0gEA?hl=en-IN&gl=IN&ceid=IN%3Aen,2023-11-26
14,Bronx food pantry says it's struggling to provide for those in need after state grant cuts,CBS New York,news.google.com/articles/CBMiWGh0dHBzOi8vd3d3LmNic25ld3MuY29tL25ld3lvcmsvbmV3cy9wYXJ0LW9mLXRoZS1zb2x1dGlvbi1mb29kLXBhbnRyeS1icm9ueC1zdGF0ZS1ncmFudC_SAVxodHRwczovL3d3dy5jYnNuZXdzLmNvbS9hbXAvbmV3eW9yay9uZXdzL3BhcnQtb2YtdGhlLXNvbHV0aW9uLWZvb2QtcGFudHJ5LWJyb254LXN0YXRlLWdyYW50Lw?hl=en-IN&gl=IN&ceid=IN%3Aen,2023-11-26
23,How to watch today's New England Patriots vs. New York Giants ...,CBS News,news.google.com/articles/CBMiaWh0dHBzOi8vd3d3LmNic25ld3MuY29tL2Vzc2VudGlhbHMvaG93LXRvLXdhdGNoLXRvZGF5cy1uZXctZW5nbGFuZC1wYXRyaW90cy12cy1ueS1naWFudHMtZ2FtZS0yMDIzLTExLTI2L9IBAA?hl=en-IN&gl=IN&ceid=IN%3Aen,2023-11-26
22,How to watch today's Carolina Panthers vs. Tennessee Titans NFL ...,CBS News,news.google.com/articles/CBMibWh0dHBzOi8vd3d3LmNic25ld3MuY29tL2Vzc2VudGlhbHMvaG93LXRvLXdhdGNoLXRvZGF5cy1jYXJvbGluYS1wYW50aGVycy12cy10ZW5uZXNzZWUtdGl0YW5zLWdhbWUtMjAyMy0xMS0yNi_SAQA?hl=en-IN&gl=IN&ceid=IN%3Aen,2023-11-26
21,How to watch today's Jacksonville Jaguars vs. Houston Texans ...,CBS News,news.google.com/articles/CBMifWh0dHBzOi8vd3d3LmNic25ld3MuY29tL25ld3MvaG93LXRvLXdhdGNoLXRvZGF5cy1qYWNrc29udmlsbGUtamFndWFycy12cy1ob3VzdG9uLXRleGFucy1nYW1lLWxpdmVzdHJlYW0tb3B0aW9ucy1raWNrb2ZmLXRpbWUv0gEA?hl=en-IN&gl=IN&ceid=IN%3Aen,2023-11-26
30,How to watch today's New Orleans Saints vs. Atlanta Falcons NFL ...,CBS News,news.google.com/articles/CBMibWh0dHBzOi8vd3d3LmNic25ld3MuY29tL2Vzc2VudGlhbHMvaG93LXRvLXdhdGNoLXRvZGF5cy1uZXctb3JsZWFucy1zYWludHMtdnMtYXRsYW50YS1mYWxjb25zLWdhbWUtMjAyMy0xMS0yNi_SAQA?hl=en-IN&gl=IN&ceid=IN%3Aen,2023-11-26
18,How to watch today's Buffalo Bills vs. Philadelphia Eagles NFL ...,CBS News,news.google.com/articles/CBMibGh0dHBzOi8vd3d3LmNic25ld3MuY29tL2Vzc2VudGlhbHMvaG93LXRvLXdhdGNoLXRvZGF5cy1idWZmYWxvLWJpbGxzLXZzLXBoaWxhZGVscGhpYS1lYWdsZXMtZ2FtZS0yMDIzLTExLTI2L9IBAA?hl=en-IN&gl=IN&ceid=IN%3Aen,2023-11-26
32,How to watch today's Los Angeles Rams vs. Arizona Cardinals NFL ...,CBS News,news.google.com/articles/CBMiZGh0dHBzOi8vd3d3LmNic25ld3MuY29tL2Vzc2VudGlhbHMvaG93LXRvLXdhdGNoLXRvZGF5cy1sYS1yYW1zLXZzLWFyaXpvbmEtY2FyZGluYWxzLWdhbWUtMjAyMy0xMS0yNi_SAQA?hl=en-IN&gl=IN&ceid=IN%3Aen,2023-11-26
16,How to watch today's Pittsburgh Steelers vs. Cincinnati Bengals NFL ...,CBS News,news.google.com/articles/CBMigAFodHRwczovL3d3dy5jYnNuZXdzLmNvbS9uZXdzL2hvdy10by13YXRjaC10b2RheXMtcGl0dHNidXJnaC1zdGVlbGVycy12cy1jaW5jaW5uYXRpLWJlbmdhbHMtZ2FtZS1saXZlc3RyZWFtLW9wdGlvbnMta2lja29mZi10aW1lL9IBAA?hl=en-IN&gl=IN&ceid=IN%3Aen,2023-11-26
33,How to watch today's Cleveland Browns vs. Denver Broncos NFL ...,CBS News,news.google.com/articles/CBMiamh0dHBzOi8vd3d3LmNic25ld3MuY29tL2Vzc2VudGlhbHMvaG93LXRvLXdhdGNoLXRvZGF5cy1jbGV2ZWxhbmQtYnJvd25zLXZzLWRlbnZlci1icm9uY29zLWdhbWUtMjAyMy0xMS0yNi_SAQA?hl=en-IN&gl=IN&ceid=IN%3Aen,2023-11-26
