,title,source,link,date
1,SFMC Marketing Production Professional at S&S Business Unit 1,mediabistro.com,news.google.com/articles/CBMia2h0dHBzOi8vd3d3Lm1lZGlhYmlzdHJvLmNvbS9qb2JzL2FsbHRoZXRvcGJhbmFuYXMtZ3JvdXAvam9iLzM5MTk5MjczLXNmbWMtbWFya2V0aW5nLXByb2R1Y3Rpb24tcHJvZmVzc2lvbmFs0gEA?hl=en-IN&gl=IN&ceid=IN%3Aen,2023-10-24
35,Keeping Your Smart Building Secure with Indoor Mapping ...,BLR,news.google.com/articles/CBMibGh0dHBzOi8vZmFjaWxpdGllc21hbmFnZW1lbnRhZHZpc29yLmJsci5jb20vc2VjdXJpdHkva2VlcGluZy15b3VyLXNtYXJ0LWJ1aWxkaW5nLXNlY3VyZS13aXRoLWluZG9vci1tYXBwaW5nL9IBAA?hl=en-IN&gl=IN&ceid=IN%3Aen,2023-10-24
33,Is SAP's CX for industries move ready for prime time? SAP customers share their challenges - and wins,diginomica,news.google.com/articles/CBMibWh0dHBzOi8vZGlnaW5vbWljYS5jb20vc2Fwcy1jeC1pbmR1c3RyaWVzLW1vdmUtcmVhZHktcHJpbWUtdGltZS1zYXAtY3VzdG9tZXJzLXNoYXJlLXRoZWlyLWNoYWxsZW5nZXMtYW5kLXdpbnPSAXFodHRwczovL2RpZ2lub21pY2EuY29tL3NhcHMtY3gtaW5kdXN0cmllcy1tb3ZlLXJlYWR5LXByaW1lLXRpbWUtc2FwLWN1c3RvbWVycy1zaGFyZS10aGVpci1jaGFsbGVuZ2VzLWFuZC13aW5zP2FtcA?hl=en-IN&gl=IN&ceid=IN%3Aen,2023-10-24
32,The growth of APIs attracts Cybercrime: How to prepare against ...,tripwire.com,news.google.com/articles/CBMibGh0dHBzOi8vd3d3LnRyaXB3aXJlLmNvbS9zdGF0ZS1vZi1zZWN1cml0eS9ncm93dGgtYXBpcy1hdHRyYWN0cy1jeWJlcmNyaW1lLWhvdy1wcmVwYXJlLWFnYWluc3QtY3liZXItYXR0YWNrc9IBAA?hl=en-IN&gl=IN&ceid=IN%3Aen,2023-10-24
31,'Future-proofing' The Global Health Workforce To Address Chronic ...,Health Policy Watch,news.google.com/articles/CBMiaGh0dHBzOi8vaGVhbHRocG9saWN5LXdhdGNoLm5ld3MvZnV0dXJlLXByb29maW5nLXRoZS1nbG9iYWwtaGVhbHRoLXdvcmtmb3JjZS10by1hZGRyZXNzLWNocm9uaWMtZGlzZWFzZXMv0gEA?hl=en-IN&gl=IN&ceid=IN%3Aen,2023-10-24
30,Correcting and Enhancing the Global Understanding of the Role of Condoms in Reproductive Health — the Chinese Approach,Yahoo Finance,news.google.com/articles/CBMiXGh0dHBzOi8vZmluYW5jZS55YWhvby5jb20vbmV3cy9jb3JyZWN0aW5nLWVuaGFuY2luZy1nbG9iYWwtdW5kZXJzdGFuZGluZy1yb2xlLTE1MDAwMDM5MS5odG1s0gFkaHR0cHM6Ly9maW5hbmNlLnlhaG9vLmNvbS9hbXBodG1sL25ld3MvY29ycmVjdGluZy1lbmhhbmNpbmctZ2xvYmFsLXVuZGVyc3RhbmRpbmctcm9sZS0xNTAwMDAzOTEuaHRtbA?hl=en-IN&gl=IN&ceid=IN%3Aen,2023-10-24
28,Climate change reaching unprecedented levels as records tumble,The Natural History Museum,news.google.com/articles/CBMicWh0dHBzOi8vd3d3Lm5obS5hYy51ay9kaXNjb3Zlci9uZXdzLzIwMjMvb2N0b2Jlci9jbGltYXRlLWNoYW5nZS1yZWFjaGluZy11bnByZWNlZGVudGVkLWxldmVscy1yZWNvcmRzLXR1bWJsZS5odG1s0gEA?hl=en-IN&gl=IN&ceid=IN%3Aen,2023-10-24
26,"AI can lessen peer-review woes, researchers say",Inside Higher Ed,news.google.com/articles/CBMigQFodHRwczovL3d3dy5pbnNpZGVoaWdoZXJlZC5jb20vbmV3cy90ZWNoLWlubm92YXRpb24vYXJ0aWZpY2lhbC1pbnRlbGxpZ2VuY2UvMjAyMy8xMC8yNC9haS1jYW4tbGVzc2VuLXBlZXItcmV2aWV3LXdvZXMtcmVzZWFyY2hlcnPSAQA?hl=en-IN&gl=IN&ceid=IN%3Aen,2023-10-24
2,Globus Infocom Ltd. presents Exciting Innovative Products at ...,CXOToday.com,news.google.com/articles/CBMid2h0dHBzOi8vd3d3LmN4b3RvZGF5LmNvbS9wcmVzcy1yZWxlYXNlL2dsb2J1cy1pbmZvY29tLWx0ZC1wcmVzZW50cy1leGNpdGluZy1pbm5vdmF0aXZlLXByb2R1Y3RzLWF0LWluZm9jb21tLWluZGlhLTIwMjMv0gEA?hl=en-IN&gl=IN&ceid=IN%3Aen,2023-10-24
23,"Michael Spence on industrial policy, AI, growth models, and more by ...",Project Syndicate,news.google.com/articles/CBMiemh0dHBzOi8vd3d3LnByb2plY3Qtc3luZGljYXRlLm9yZy9vbnBvaW50L2FuLWludGVydmlldy13aXRoLW1pY2hhZWwtc3BlbmNlLXBlcm1hY3Jpc2lzLWluZHVzdHJpYWwtcG9saWN5LWFpLWdyb3d0aC0yMDIzLTEw0gEA?hl=en-IN&gl=IN&ceid=IN%3Aen,2023-10-24
