,title,source,link,date
7,2023 Tetrapropylammonium Hydroxide Market Is Expected to Boom in Next Few Years,Benzinga,news.google.com/articles/CBMihQFodHRwczovL3d3dy5iZW56aW5nYS5jb20vcHJlc3NyZWxlYXNlcy8yMy8wOS8zNDM4MzgyNC8yMDIzLXRldHJhcHJvcHlsYW1tb25pdW0taHlkcm94aWRlLW1hcmtldC1pcy1leHBlY3RlZC10by1ib29tLWluLW5leHQtZmV3LXllYXJz0gEtaHR0cHM6Ly93d3cuYmVuemluZ2EuY29tL2FtcC9jb250ZW50LzM0MzgzODI0?hl=en-IN&gl=IN&ceid=IN%3Aen,2023-09-09
0,The private sector and the FSS,Turks and Caicos Weekly News,news.google.com/articles/CBMiRmh0dHBzOi8vdGN3ZWVrbHluZXdzLmNvbS90aGUtcHJpdmF0ZS1zZWN0b3ItYW5kLXRoZS1mc3MtcDEzNTAxLTE0NC5odG3SAQA?hl=en-IN&gl=IN&ceid=IN%3Aen,2023-09-08
4,"Global Marine Supplements Market to Exceed a Valuation of US$ 13,669.9 Million by 2033 | Fact.MR Report",Yahoo Finance,news.google.com/articles/CBMiVWh0dHBzOi8vZmluYW5jZS55YWhvby5jb20vbmV3cy9nbG9iYWwtbWFyaW5lLXN1cHBsZW1lbnRzLW1hcmtldC1leGNlZWQtMTUwMDAwMjY5Lmh0bWzSAV1odHRwczovL2ZpbmFuY2UueWFob28uY29tL2FtcGh0bWwvbmV3cy9nbG9iYWwtbWFyaW5lLXN1cHBsZW1lbnRzLW1hcmtldC1leGNlZWQtMTUwMDAwMjY5Lmh0bWw?hl=en-IN&gl=IN&ceid=IN%3Aen,2023-09-07
22,Qualitative Research on Tetraethylammonium Bromide Market Size bottle up CAGR Analysis with a CAGR of 10.,Benzinga,news.google.com/articles/CBMimQFodHRwczovL3d3dy5iZW56aW5nYS5jb20vcHJlc3NyZWxlYXNlcy8yMy8wOS8zNDMwNjE2MC9xdWFsaXRhdGl2ZS1yZXNlYXJjaC1vbi10ZXRyYWV0aHlsYW1tb25pdW0tYnJvbWlkZS1tYXJrZXQtc2l6ZS1ib3R0bGUtdXAtY2Fnci1hbmFseXNpcy13aXRoLWEtY2Fnci3SAS1odHRwczovL3d3dy5iZW56aW5nYS5jb20vYW1wL2NvbnRlbnQvMzQzMDYxNjA?hl=en-IN&gl=IN&ceid=IN%3Aen,2023-09-07
3,The C.O.P. time is up and so are some others,Turks and Caicos Sun,news.google.com/articles/CBMiSmh0dHBzOi8vc3VudGNpLmNvbS90aGUtY29wLXRpbWUtaXMtdXAtYW5kLXNvLWFyZS1zb21lLW90aGVycy1wOTY2OS0xMjkuaHRt0gEA?hl=en-IN&gl=IN&ceid=IN%3Aen,2023-09-05
