,title,source,link,date
17,"Meet Your Neighbors Running For BOE, Police Commission, Other ...",The Newtown Bee,news.google.com/articles/CBMic2h0dHBzOi8vd3d3Lm5ld3Rvd25iZWUuY29tLzEwMDYyMDIzL21lZXQteW91ci1uZWlnaGJvcnMtcnVubmluZy1mb3ItYm9lLXBvbGljZS1jb21taXNzaW9uLW90aGVyLXVuZGVyLXRpY2tldC1yYWNlcy_SAQA?hl=en-IN&gl=IN&ceid=IN%3Aen,2023-10-06
15,"Clean Label Ingredients Market Soars to US$ 169,024.9",GlobeNewswire,news.google.com/articles/CBMi0wFodHRwczovL3d3dy5nbG9iZW5ld3N3aXJlLmNvbS9uZXdzLXJlbGVhc2UvMjAyMy8xMC8wNS8yNzU1MDI5LzAvZW4vQ2xlYW4tTGFiZWwtSW5ncmVkaWVudHMtTWFya2V0LVNvYXJzLXRvLVVTLTE2OS0wMjQtOS1taWxsaW9uLWluLTIwMzMtQm9sc3RlcmVkLWJ5LVN1cHBsZW1lbnRzLWFuZC1OdXRyYWNldXRpY2Fscy1GdXR1cmUtTWFya2V0LUluc2lnaHRzLUluYy5odG1s0gEA?hl=en-IN&gl=IN&ceid=IN%3Aen,2023-10-05
6,A general introduction to foreign investment regulation in Japan,Lexology,news.google.com/articles/CBMiU2h0dHBzOi8vd3d3LmxleG9sb2d5LmNvbS9saWJyYXJ5L2RldGFpbC5hc3B4P2c9OTdjMDhlYmMtNDVmZi00NjYwLTg1M2QtYWE0NjkyOTIxMDQ30gEA?hl=en-IN&gl=IN&ceid=IN%3Aen,2023-10-03
2,When will the TCI Bank in liquidation come to an end?,Turks and Caicos Sun,news.google.com/articles/CBMiVWh0dHBzOi8vc3VudGNpLmNvbS93aGVuLXdpbGwtdGhlLXRjaS1iYW5rLWluLWxpcXVpZGF0aW9uLWNvbWUtdG8tYW4tZW5kLXA5Nzg5LTEyOS5odG3SAQA?hl=en-IN&gl=IN&ceid=IN%3Aen,2023-10-02
8,Bank Julius Baer & Co. Ltd Zurich Raises Stock Holdings in Moody's ...,MarketBeat,news.google.com/articles/CBMiSWh0dHBzOi8vd3d3Lm1hcmtldGJlYXQuY29tL2luc3RhbnQtYWxlcnRzL255c2UtbWNvLXNlYy1maWxpbmctMjAyMy0xMC0wMi_SAQA?hl=en-IN&gl=IN&ceid=IN%3Aen,2023-10-02
0,Get TCI Finance Ltd. Share Price Today Live on BSE | DSIJ,Dalal Street Investment Journal,news.google.com/articles/CBMiMmh0dHBzOi8vd3d3LmRzaWouaW4vc2hhcmUtcHJpY2UvVENJLUZpbmFuY2UtMTAxMjQy0gEA?hl=en-IN&gl=IN&ceid=IN%3Aen,2023-09-27
