,title,source,link,date
3,TCI Postal Service joins 45 countries for Security and EAD Workshop,Turks and Caicos Weekly News,news.google.com/articles/CBMiaGh0dHBzOi8vdGN3ZWVrbHluZXdzLmNvbS90Y2ktcG9zdGFsLXNlcnZpY2Utam9pbnMtY291bnRyaWVzLWZvci1zZWN1cml0eS1hbmQtZWFkLXdvcmtzaG9wLXAxMzQ3MS0xMjcuaHRt0gEA?hl=en-IN&gl=IN&ceid=IN%3Aen,2023-08-25
16,FTR's June Trucking Conditions Index turns in lowest reading since ...,Logistics Management,news.google.com/articles/CBMidWh0dHBzOi8vd3d3LmxvZ2lzdGljc21nbXQuY29tL2FydGljbGUvZnRyc19qdW5lX3RydWNraW5nX2NvbmRpdGlvbnNfaW5kZXhfdHVybnNfaW5fbG93ZXN0X3JlYWRpbmdfc2luY2Vfbm92ZW1iZXJfMjAyMtIBAA?hl=en-IN&gl=IN&ceid=IN%3Aen,2023-08-25
29,Pyrazinamide Market Huge Growth in Future Scope 2023-2030 ...,Digital Journal,news.google.com/articles/CBMiuQFodHRwczovL3d3dy5kaWdpdGFsam91cm5hbC5jb20vcHIvbmV3cy9jb2hlcmVudC1tYXJrZXQtaW5zaWdodHMvcHlyYXppbmFtaWRlLW1hcmtldC1odWdlLWdyb3d0aC1pbi1mdXR1cmUtc2NvcGUtMjAyMy0yMDMwLXB1cmUtY2hlbWlzdHJ5LXNjaWVudGlmaWMtbGdtLXBoYXJtYS10Y2ktaGJjY2hlbS1hbGZhLWNoZW1pc3RyedIBAA?hl=en-IN&gl=IN&ceid=IN%3Aen,2023-08-25
76,Damage assessment and needs analysis training course ...,Turks and Caicos Weekly News,news.google.com/articles/CBMibWh0dHBzOi8vdGN3ZWVrbHluZXdzLmNvbS9kYW1hZ2UtYXNzZXNzbWVudC1hbmQtbmVlZHMtYW5hbHlzaXMtdHJhaW5pbmctY291cnNlLXNoYXJwZW5lZC1za2lsbHMtcDEzNDcyLTEyNy5odG3SAQA?hl=en-IN&gl=IN&ceid=IN%3Aen,2023-08-25
78,Banks not lending despite reduced credit risks -FSC,Turks and Caicos Weekly News,news.google.com/articles/CBMiWmh0dHBzOi8vdGN3ZWVrbHluZXdzLmNvbS9iYW5rcy1ub3QtbGVuZGluZy1kZXNwaXRlLXJlZHVjZWQtY3JlZGl0LXJpc2tzLWZzYy1wMTM0NzktMTI3Lmh0bdIBAA?hl=en-IN&gl=IN&ceid=IN%3Aen,2023-08-25
24,Cows Will Tell You Whether They're Happy With How They're Milked,Bovine Veterinarian,news.google.com/articles/CBMiaGh0dHBzOi8vd3d3LmJvdmluZXZldG9ubGluZS5jb20vbmV3cy9lZHVjYXRpb24vY293cy13aWxsLXRlbGwteW91LXdoZXRoZXItdGhleXJlLWhhcHB5LWhvdy10aGV5cmUtbWlsa2Vk0gEA?hl=en-IN&gl=IN&ceid=IN%3Aen,2023-08-25
23,The Transfer Duty Amendment Ordinance,Turks and Caicos Weekly News,news.google.com/articles/CBMiTWh0dHBzOi8vdGN3ZWVrbHluZXdzLmNvbS90aGUtdHJhbnNmZXItZHV0eS1hbWVuZG1lbnQtb3JkaW5hbmNlLXAxMzQ3MC0xNDQuaHRt0gEA?hl=en-IN&gl=IN&ceid=IN%3Aen,2023-08-25
5,“No cause for alarm” in TCI with new Covid-19 variants,Turks and Caicos Weekly News,news.google.com/articles/CBMiWWh0dHBzOi8vdGN3ZWVrbHluZXdzLmNvbS9uby1jYXVzZS1mb3ItYWxhcm0taW4tdGNpLXdpdGgtbmV3LWNvdmlkLXZhcmlhbnRzLXAxMzQ4MC0xMjcuaHRt0gEA?hl=en-IN&gl=IN&ceid=IN%3Aen,2023-08-25
85,TSX breakout: Intellipharmaceutics stock rallies | 2023-08-25 ...,Stockhouse Publishing,news.google.com/articles/CBMibWh0dHBzOi8vc3RvY2tob3VzZS5jb20vbmV3cy90aGUtbWFya2V0LWhlcmFsZC1uZXdzLzIwMjMvMDgvMjUvdHN4LWJyZWFrb3V0LWludGVsbGlwaGFybWFjZXV0aWNzLXN0b2NrLXJhbGxpZXPSAQA?hl=en-IN&gl=IN&ceid=IN%3Aen,2023-08-25
15,Franklin spares Turks and Caicos after pummelling DR and Haiti,Turks and Caicos Weekly News,news.google.com/articles/CBMiZmh0dHBzOi8vdGN3ZWVrbHluZXdzLmNvbS9mcmFua2xpbi1zcGFyZXMtdHVya3MtYW5kLWNhaWNvcy1hZnRlci1wdW1tZWxsaW5nLWRyLWFuZC1oYWl0aS1wMTM0NzUtMTI3Lmh0bdIBAA?hl=en-IN&gl=IN&ceid=IN%3Aen,2023-08-25
