,title,source,link,date
1,Debt free smallcap stocks that delivered multibagger returns of up to ...,Trade Brains,news.google.com/articles/CBMihgFodHRwczovL3RyYWRlYnJhaW5zLmluL2ZlYXR1cmVzL2RlYnQtZnJlZS1zbWFsbGNhcC1zdG9ja3MtdGhhdC1kZWxpdmVyZWQtbXVsdGliYWdnZXItcmV0dXJucy1vZi11cC10by0xMDMwLWluLTMteXJzLXRvLWtlZXAtYW4tZXllLW9uL9IBAA?hl=en-IN&gl=IN&ceid=IN%3Aen,2023-10-12
2,"Stock Market Live Updates: Sensex, Nifty trade flat; Coal India up 2%, BPCL, Grasim shine, TCS, Cipla shed",BusinessLine,news.google.com/articles/CBMid2h0dHBzOi8vd3d3LnRoZWhpbmR1YnVzaW5lc3NsaW5lLmNvbS9tYXJrZXRzL3NoYXJlLW1hcmtldC1uaWZ0eS1zZW5zZXgtbGl2ZS11cGRhdGVzLTEyLW9jdG9iZXItMjAyMy9hcnRpY2xlNjc0MDkzMTMuZWNl0gF8aHR0cHM6Ly93d3cudGhlaGluZHVidXNpbmVzc2xpbmUuY29tL21hcmtldHMvc2hhcmUtbWFya2V0LW5pZnR5LXNlbnNleC1saXZlLXVwZGF0ZXMtMTItb2N0b2Jlci0yMDIzL2FydGljbGU2NzQwOTMxMy5lY2UvYW1wLw?hl=en-IN&gl=IN&ceid=IN%3Aen,2023-10-12
3,AGI Greenpac: Long-term Growth through Acquisition and Expansion,Moneylife,news.google.com/articles/CBMia2h0dHBzOi8vd3d3Lm1vbmV5bGlmZS5pbi9hcnRpY2xlL2FnaS1ncmVlbnBhYy1sb25nLXRlcm0tZ3Jvd3RoLXRocm91Z2gtYWNxdWlzaXRpb24tYW5kLWV4cGFuc2lvbi83MjI0Mi5odG1s0gEA?hl=en-IN&gl=IN&ceid=IN%3Aen,2023-10-11
30,Anisotropy in spinodal-like dynamics of unknown water at ice V ...,Nature.com,news.google.com/articles/CBMiMmh0dHBzOi8vd3d3Lm5hdHVyZS5jb20vYXJ0aWNsZXMvczQxNTk4LTAyMy00MzI5NS000gEA?hl=en-IN&gl=IN&ceid=IN%3Aen,2023-10-11
32,Anticancer Analysis of CD44 Targeted Cyclosporine Loaded ...,Dove Medical Press,news.google.com/articles/CBMigwFodHRwczovL3d3dy5kb3ZlcHJlc3MuY29tL2FudGljYW5jZXItYW5hbHlzaXMtb2YtY2Q0NC10YXJnZXRlZC1jeWNsb3Nwb3JpbmUtbG9hZGVkLXRoaW9sYXRlZC1jaGktcGVlci1yZXZpZXdlZC1mdWxsdGV4dC1hcnRpY2xlLUlKTtIBAA?hl=en-IN&gl=IN&ceid=IN%3Aen,2023-10-11
41,"Spin Master to Acquire Melissa & Doug, a Trusted Brand in Early ...",PR Newswire,news.google.com/articles/CBMilAFodHRwczovL3d3dy5wcm5ld3N3aXJlLmNvbS9uZXdzLXJlbGVhc2VzL3NwaW4tbWFzdGVyLXRvLWFjcXVpcmUtbWVsaXNzYS0tZG91Zy1hLXRydXN0ZWQtYnJhbmQtaW4tZWFybHktY2hpbGRob29kLXBsYXktZm9yLTk1MC1taWxsaW9uLTMwMTk1MzAyMy5odG1s0gEA?hl=en-IN&gl=IN&ceid=IN%3Aen,2023-10-11
0,India - Electrical equipment market size to grow by USD 52.98 billion from 2022 to 2027 | Increase in investments in the power sector to boost market growth- Technavio,Yahoo Finance,news.google.com/articles/CBMiVGh0dHBzOi8vZmluYW5jZS55YWhvby5jb20vbmV3cy9pbmRpYS1lbGVjdHJpY2FsLWVxdWlwbWVudC1tYXJrZXQtc2l6ZS0wODE1MDAxMDcuaHRtbNIBXGh0dHBzOi8vZmluYW5jZS55YWhvby5jb20vYW1waHRtbC9uZXdzL2luZGlhLWVsZWN0cmljYWwtZXF1aXBtZW50LW1hcmtldC1zaXplLTA4MTUwMDEwNy5odG1s?hl=en-IN&gl=IN&ceid=IN%3Aen,2023-10-10
40,Human milk oligosaccharides modify the strength of priority effects in ...,Nature.com,news.google.com/articles/CBMiMmh0dHBzOi8vd3d3Lm5hdHVyZS5jb20vYXJ0aWNsZXMvczQxMzk2LTAyMy0wMTUyNS030gEA?hl=en-IN&gl=IN&ceid=IN%3Aen,2023-10-10
10,DP Wires: Strong Sales Growth Reduces Worries of Low Margins for ...,Moneylife,news.google.com/articles/CBMib2h0dHBzOi8vd3d3Lm1vbmV5bGlmZS5pbi9hcnRpY2xlL2RwLXdpcmVzLXN0cm9uZy1zYWxlcy1ncm93dGgtcmVkdWNlcy13b3JyaWVzLW9mLWxvdy1tYXJnaW5zLWZvci1ub3cvNzIyMjEuaHRtbNIBAA?hl=en-IN&gl=IN&ceid=IN%3Aen,2023-10-09
12,Stock Market Today: All You Need To Know Going Into Trade On Oct. 6,BQ Prime,news.google.com/articles/CBMiZGh0dHBzOi8vd3d3LmJxcHJpbWUuY29tL2J1c2luZXNzL3N0b2NrLW1hcmtldC10b2RheS1hbGwteW91LW5lZWQtdG8ta25vdy1nb2luZy1pbnRvLXRyYWRlLW9uLW9jdC02LTLSAWhodHRwczovL3d3dy5icXByaW1lLmNvbS9hbXAvYnVzaW5lc3Mvc3RvY2stbWFya2V0LXRvZGF5LWFsbC15b3UtbmVlZC10by1rbm93LWdvaW5nLWludG8tdHJhZGUtb24tb2N0LTYtMg?hl=en-IN&gl=IN&ceid=IN%3Aen,2023-10-05
