,title,source,link,date
30,5 of the Most Memorable Moments From Afterlife's Brooklyn Mirage ...,EDM.com,news.google.com/articles/CBMiX2h0dHBzOi8vZWRtLmNvbS9ldmVudHMvNS1tb3N0LW1lbW9yYWJsZS1tb21lbnRzLWFmdGVybGlmZS1icm9va2x5bi1taXJhZ2Utd2Vla2VuZC10YWtlb3Zlci0yMDIz0gEA?hl=en-IN&gl=IN&ceid=IN%3Aen,2023-09-26
27,Monster machines floating on the waves could be the future of wind ...,The Washington Post,news.google.com/articles/CBMiYWh0dHBzOi8vd3d3Lndhc2hpbmd0b25wb3N0LmNvbS9jbGltYXRlLXNvbHV0aW9ucy8yMDIzLzA5LzI1L2Zsb2F0aW5nLW9mZnNob3JlLXdpbmQtZW5lcmd5LW5vcndheS_SAQA?hl=en-IN&gl=IN&ceid=IN%3Aen,2023-09-26
10,"Japan Vertical Farming Market Size, Share, Forecast 2021 - 2030 | Top key players : ES-CON Japan Ltd Chubu Ele",openPR,news.google.com/articles/CBMiX2h0dHBzOi8vd3d3Lm9wZW5wci5jb20vbmV3cy8zMjI1MDA1L2phcGFuLXZlcnRpY2FsLWZhcm1pbmctbWFya2V0LXNpemUtc2hhcmUtZm9yZWNhc3QtMjAyMS0yMDMw0gFeaHR0cHM6Ly93d3cub3BlbnByLmNvbS9hbXAvMzIyNTAwNS9qYXBhbi12ZXJ0aWNhbC1mYXJtaW5nLW1hcmtldC1zaXplLXNoYXJlLWZvcmVjYXN0LTIwMjEtMjAzMA?hl=en-IN&gl=IN&ceid=IN%3Aen,2023-09-26
51,The Best Folk on Bandcamp: September 2023,bandcamp.com,news.google.com/articles/CBMiTWh0dHBzOi8vZGFpbHkuYmFuZGNhbXAuY29tL2Jlc3QtZm9say90aGUtYmVzdC1mb2xrLW9uLWJhbmRjYW1wLXNlcHRlbWJlci0yMDIz0gEA?hl=en-IN&gl=IN&ceid=IN%3Aen,2023-09-26
16,Tech Trends: What's Next?. Tech Trends: What's Next? | by Techno ...,Medium,news.google.com/articles/CBMiSWh0dHBzOi8vbWVkaXVtLmNvbS9AbXVuZWVidXJyZWhtYW4zNDMvdGVjaC10cmVuZHMtd2hhdHMtbmV4dC00ZmU3MThiZTg3YjbSAQA?hl=en-IN&gl=IN&ceid=IN%3Aen,2023-09-26
42,"Oh, what a Culture Night! And a great few days for bikes too",EchoLive.ie,news.google.com/articles/CBMiNGh0dHBzOi8vd3d3LmVjaG9saXZlLmllL2Nvcmt2aWV3cy9hcmlkLTQxMjM0MDcxLmh0bWzSAQA?hl=en-IN&gl=IN&ceid=IN%3Aen,2023-09-26
20,Weinsanto and Vaquera kick off Paris Fashion Week with daring ...,Fashion Network US,news.google.com/articles/CBMic2h0dHBzOi8vaW4uZmFzaGlvbm5ldHdvcmsuY29tL25ld3MvV2VpbnNhbnRvLWFuZC12YXF1ZXJhLWtpY2stb2ZmLXBhcmlzLWZhc2hpb24td2Vlay13aXRoLWRhcmluZy1zaG93cywxNTYwNDAyLmh0bWzSAQA?hl=en-IN&gl=IN&ceid=IN%3Aen,2023-09-26
32,Luke Una returns to Manchester with his new É Soul Cultura night,Skiddle.com,news.google.com/articles/CBMicWh0dHBzOi8vd3d3LnNraWRkbGUuY29tL25ld3MvYWxsL0x1a2UtVW5hLXJldHVybnMtdG8tTWFuY2hlc3Rlci13aXRoLWhpcy1uZXctLVNvdWwtQ3VsdHVyYS1uaWdodC1hdC1IaWRkZW4vNTgxMzkv0gEA?hl=en-IN&gl=IN&ceid=IN%3Aen,2023-09-26
23,Every brand's cheapest electric car and the discounts available on ...,What Car?,news.google.com/articles/CBMiRmh0dHBzOi8vd3d3LndoYXRjYXIuY29tL25ld3MvZXZlcnktYnJhbmRzLWNoZWFwZXN0LWVsZWN0cmljLWNhci9uMjQzNzHSAQA?hl=en-IN&gl=IN&ceid=IN%3Aen,2023-09-26
1,Techno-fixes to climate change aren't living up to the hype,The Verge,news.google.com/articles/CBMidmh0dHBzOi8vd3d3LnRoZXZlcmdlLmNvbS8yMDIzLzkvMjYvMjM4ODkwNjYvY2xpbWF0ZS1jaGFuZ2UtaW50ZXJuYXRpb25hbC1lbmVyZ3ktYWdlbmN5LXJvYWRtYXAtaHlkcm9nZW4tY2FyYm9uLWNhcHR1cmXSAQA?hl=en-IN&gl=IN&ceid=IN%3Aen,2023-09-26
