,title,source,link,date
34,Citroen C3 Aircross to launch in Brazil with new powertrain,CarWale,news.google.com/articles/CBMiWWh0dHBzOi8vd3d3LmNhcndhbGUuY29tL25ld3MvY2l0cm9lbi1jMy1haXJjcm9zcy10by1sYXVuY2gtaW4tYnJhemlsLXdpdGgtbmV3LXBvd2VydHJhaW4v0gEA?hl=en-IN&gl=IN&ceid=IN%3Aen,2023-11-09
83,Ranked: the largest engine made by every major car company,msnNOW,news.google.com/articles/CBMiamh0dHBzOi8vd3d3Lm1zbi5jb20vZW4taW4vYXV0b3MvbmV3cy9yYW5rZWQtdGhlLWxhcmdlc3QtZW5naW5lLW1hZGUtYnktZXZlcnktbWFqb3ItY2FyLWNvbXBhbnkvc3MtQUExanI1TGXSAQA?hl=en-IN&gl=IN&ceid=IN%3Aen,2023-11-09
70,Powerful appearance and maximum performance: The new MINI ...,BMW Press,news.google.com/articles/CBMiogFodHRwczovL3d3dy5wcmVzcy5ibXdncm91cC5jb20vY2FuYWRhL2FydGljbGUvZGV0YWlsL1QwNDM4MjI1RU4vcG93ZXJmdWwtYXBwZWFyYW5jZS1hbmQtbWF4aW11bS1wZXJmb3JtYW5jZTotdGhlLW5ldy1taW5pLWpvaG4tY29vcGVyLXdvcmtzLWNvdW50cnltYW4_bGFuZ3VhZ2U9ZW7SAQA?hl=en-IN&gl=IN&ceid=IN%3Aen,2023-11-09
76,"Xpeng Motors unveils PX5 humanoid robot, underlining its vision for ...",KrASIA,news.google.com/articles/CBMiYWh0dHBzOi8va3ItYXNpYS5jb20veHBlbmctbW90b3JzLXVudmVpbHMtcHg1LWh1bWFub2lkLXJvYm90LXVuZGVybGluaW5nLWl0cy12aXNpb24tZm9yLXRoZS1mdXR1cmXSAQA?hl=en-IN&gl=IN&ceid=IN%3Aen,2023-11-09
77,Vector Databases: The Engine Behind Today's AI Revolution,Medium,news.google.com/articles/CBMiaGh0dHBzOi8vbWVkaXVtLmNvbS9AdmFsZXJpZXJvc2UyNjEwL3ZlY3Rvci1kYXRhYmFzZXMtdGhlLWVuZ2luZS1iZWhpbmQtdG9kYXlzLWFpLXJldm9sdXRpb24tZDhlODM2NzUwNzVj0gEA?hl=en-IN&gl=IN&ceid=IN%3Aen,2023-11-09
80,Revolt Motors To Supply Electric Bikes For Adani Green Energy’s Fleet,Free Press Journal,news.google.com/articles/CBMibWh0dHBzOi8vd3d3LmZyZWVwcmVzc2pvdXJuYWwuaW4vYnVzaW5lc3MvcmV2b2x0LW1vdG9ycy10by1zdXBwbHktZWxlY3RyaWMtYmlrZXMtZm9yLWFkYW5pLWdyZWVuLWVuZXJneXMtZmxlZXTSAXFodHRwczovL3d3dy5mcmVlcHJlc3Nqb3VybmFsLmluL2FtcC9idXNpbmVzcy9yZXZvbHQtbW90b3JzLXRvLXN1cHBseS1lbGVjdHJpYy1iaWtlcy1mb3ItYWRhbmktZ3JlZW4tZW5lcmd5cy1mbGVldA?hl=en-IN&gl=IN&ceid=IN%3Aen,2023-11-09
11,"Nutrition, metabolic factors could be key to solving ALS puzzle",Australian Institute for Bioengineering and Nanotechnology,news.google.com/articles/CBMiYmh0dHBzOi8vYWlibi51cS5lZHUuYXUvYXJ0aWNsZS8yMDIzLzExL251dHJpdGlvbi1tZXRhYm9saWMtZmFjdG9ycy1jb3VsZC1iZS1rZXktc29sdmluZy1hbHMtcHV6emxl0gEA?hl=en-IN&gl=IN&ceid=IN%3Aen,2023-11-09
28,Former Haas F1 Driver Mick Schumacher Wants to Race Where 'the ...,Autoweek,news.google.com/articles/CBMiZGh0dHBzOi8vd3d3LmF1dG93ZWVrLmNvbS9yYWNpbmcvZm9ybXVsYS0xL2E0NTc4NTI5NS9zY2h1bWFjaGVyLXdhbnRzLXJhY2UtZW5naW5lLXNtZWxscy1tYWtlcy1ub2lzZS_SAQA?hl=en-IN&gl=IN&ceid=IN%3Aen,2023-11-09
6,Unlicensed car dealers on notice after $47600 fine (Alix Aljilani),Commerce WA,news.google.com/articles/CBMiaWh0dHBzOi8vd3d3LmNvbW1lcmNlLndhLmdvdi5hdS9hbm5vdW5jZW1lbnRzL3VubGljZW5zZWQtY2FyLWRlYWxlcnMtbm90aWNlLWFmdGVyLTQ3NjAwLWZpbmUtYWxpeC1hbGppbGFuadIBAA?hl=en-IN&gl=IN&ceid=IN%3Aen,2023-11-09
5,"Future GM EV motors could swap rare earth with ""Clean Earth ...",New Atlas,news.google.com/articles/CBMiQmh0dHBzOi8vbmV3YXRsYXMuY29tL2F1dG9tb3RpdmUvZ20tbmlyb24tY2xlYW4tZWFydGgtbWFnbmV0LW1vdG9yL9IBAA?hl=en-IN&gl=IN&ceid=IN%3Aen,2023-11-09
