,title,source,link,date
95,Malaysian traders: Pakistan emerges as good trading partner: CG,Business Recorder,news.google.com/articles/CBMiJ2h0dHBzOi8vd3d3LmJyZWNvcmRlci5jb20vbmV3cy80MDI2NTA1NNIBAA?hl=en-IN&gl=IN&ceid=IN%3Aen,2023-09-26
11,Bitcoin exchange volume tracks 5-year lows as Fed inspires BTC ...,Cointelegraph,news.google.com/articles/CBMiUmh0dHBzOi8vY29pbnRlbGVncmFwaC5jb20vbmV3cy9iaXRjb2luLWV4Y2hhbmdlLXZvbHVtZS01LXllYXItbG93cy1mZWQtYnRjLWhvZGxpbmfSAQA?hl=en-IN&gl=IN&ceid=IN%3Aen,2023-09-26
64,Our planet is choking on plastic - Opinion,Business Recorder,news.google.com/articles/CBMiJ2h0dHBzOi8vd3d3LmJyZWNvcmRlci5jb20vbmV3cy80MDI2NTA1ONIBAA?hl=en-IN&gl=IN&ceid=IN%3Aen,2023-09-26
66,Profits up for NetSol! - BR Research,Business Recorder,news.google.com/articles/CBMiJ2h0dHBzOi8vd3d3LmJyZWNvcmRlci5jb20vbmV3cy80MDI2NTEyNdIBAA?hl=en-IN&gl=IN&ceid=IN%3Aen,2023-09-26
71,"Hot, humid weather likely for two days - Pakistan",Business Recorder,news.google.com/articles/CBMiJ2h0dHBzOi8vd3d3LmJyZWNvcmRlci5jb20vbmV3cy80MDI2NTA0MNIBAA?hl=en-IN&gl=IN&ceid=IN%3Aen,2023-09-26
72,Gohar Ejaz becomes founding member of Naya Nazimabad ...,Business Recorder,news.google.com/articles/CBMiJ2h0dHBzOi8vd3d3LmJyZWNvcmRlci5jb20vbmV3cy80MDI2NTA5NtIBAA?hl=en-IN&gl=IN&ceid=IN%3Aen,2023-09-26
74,PFA unearths unit producing fabricated milk - Pakistan,Business Recorder,news.google.com/articles/CBMiJ2h0dHBzOi8vd3d3LmJyZWNvcmRlci5jb20vbmV3cy80MDI2NTA0NNIBAA?hl=en-IN&gl=IN&ceid=IN%3Aen,2023-09-26
77,Palestine issue: FM renews Pakistan's call for creation of state ...,Business Recorder,news.google.com/articles/CBMiJ2h0dHBzOi8vd3d3LmJyZWNvcmRlci5jb20vbmV3cy80MDI2NTEwM9IBAA?hl=en-IN&gl=IN&ceid=IN%3Aen,2023-09-26
78,US Assistant Secy to visit Pakistan - Pakistan,Business Recorder,news.google.com/articles/CBMiJ2h0dHBzOi8vd3d3LmJyZWNvcmRlci5jb20vbmV3cy80MDI2NTEwMdIBAA?hl=en-IN&gl=IN&ceid=IN%3Aen,2023-09-26
83,19th Asian women's Cricket Games: Bangladesh beat Pakistan by ...,Business Recorder,news.google.com/articles/CBMiJ2h0dHBzOi8vd3d3LmJyZWNvcmRlci5jb20vbmV3cy80MDI2NTAzN9IBAA?hl=en-IN&gl=IN&ceid=IN%3Aen,2023-09-26
