,title,source,link,date
23,"The Best New Tech, Gadgets, Audio Accessories and More of 2023",Gear Patrol,news.google.com/articles/CBMiQmh0dHBzOi8vd3d3LmdlYXJwYXRyb2wuY29tL3RlY2gvYTQyNzA4NDg5L2Jlc3QtdGVjaC1yZWxlYXNlcy0yMDIzL9IBAA?hl=en-IN&gl=IN&ceid=IN%3Aen,2023-11-03
1,Treasury Hardens Sanctions With 130 New Russian Evasion and ...,Treasury,news.google.com/articles/CBMiNGh0dHBzOi8vaG9tZS50cmVhc3VyeS5nb3YvbmV3cy9wcmVzcy1yZWxlYXNlcy9qeTE4NzHSAQA?hl=en-IN&gl=IN&ceid=IN%3Aen,2023-11-02
2,"Precision, Effectiveness, and Intelligence: Explore the Latest Trend of Healthcare and Medical Equipment Industry at 134th Canton Fair",Yahoo Finance,news.google.com/articles/CBMiYWh0dHBzOi8vZmluYW5jZS55YWhvby5jb20vbmV3cy9wcmVjaXNpb24tZWZmZWN0aXZlbmVzcy1pbnRlbGxpZ2VuY2UtZXhwbG9yZS1sYXRlc3QtMDAwMDAwMTE5Lmh0bWzSAWlodHRwczovL2ZpbmFuY2UueWFob28uY29tL2FtcGh0bWwvbmV3cy9wcmVjaXNpb24tZWZmZWN0aXZlbmVzcy1pbnRlbGxpZ2VuY2UtZXhwbG9yZS1sYXRlc3QtMDAwMDAwMTE5Lmh0bWw?hl=en-IN&gl=IN&ceid=IN%3Aen,2023-11-02
4,"Futures higher after Fed decision, Apple earnings ahead - what's ...",Investing.com India,news.google.com/articles/CBMicmh0dHBzOi8vaW4uaW52ZXN0aW5nLmNvbS9uZXdzL2Z1dHVyZXMtaGlnaGVyLWFmdGVyLWZlZC1kZWNpc2lvbi1hcHBsZS1lYXJuaW5ncy1haGVhZC0td2hhdHMtbW92aW5nLW1hcmtldHMtMzg4MTE1M9IBAA?hl=en-IN&gl=IN&ceid=IN%3Aen,2023-11-02
5,What's the best tailwind? – difference between hub motors and mid ...,GRAN FONDO Cycling Magazine,news.google.com/articles/CBMiPWh0dHBzOi8vZ3JhbmZvbmRvLWN5Y2xpbmcuY29tL2h1Yi1tb3Rvci12cy1taWQtbW91bnRlZC1tb3Rvci_SAQA?hl=en-IN&gl=IN&ceid=IN%3Aen,2023-11-02
11,2024 Chevrolet Colorado Trail Boss Review: Nostalgia For The ...,SlashGear,news.google.com/articles/CBMiTGh0dHBzOi8vd3d3LnNsYXNoZ2Vhci5jb20vMTQzNTc1Mi8yMDI0LWNoZXZyb2xldC1jb2xvcmFkby10cmFpbC1ib3NzLXJldmlldy_SAQA?hl=en-IN&gl=IN&ceid=IN%3Aen,2023-11-01
