,title,source,link,date
28,Tens of thousands of Moroccans in pro-Palestinian demo,Arab News,news.google.com/articles/CBMiMWh0dHBzOi8vd3d3LmFyYWJuZXdzLmNvbS9ub2RlLzI0MTU3ODEvbWlkZGxlLWVhc3TSASlodHRwczovL3d3dy5hcmFibmV3cy5jb20vbm9kZS8yNDE1NzgxL2FtcA?hl=en-IN&gl=IN&ceid=IN%3Aen,2023-11-27
43,Israel summons Irish ambassador over tweet it alleges doesn't ...,Arab News,news.google.com/articles/CBMiMWh0dHBzOi8vd3d3LmFyYWJuZXdzLmNvbS9ub2RlLzI0MTU1NDYvbWlkZGxlLWVhc3TSAQA?hl=en-IN&gl=IN&ceid=IN%3Aen,2023-11-26
39,Jordan's top diplomat wants to align Europeans behind a call for a ...,Arab News,news.google.com/articles/CBMiMWh0dHBzOi8vd3d3LmFyYWJuZXdzLmNvbS9ub2RlLzI0MTU3NTEvbWlkZGxlLWVhc3TSASlodHRwczovL3d3dy5hcmFibmV3cy5jb20vbm9kZS8yNDE1NzUxL2FtcA?hl=en-IN&gl=IN&ceid=IN%3Aen,2023-11-26
72,40 Cyber Week Small Business Deals 2023,BuzzFeed,news.google.com/articles/CBMiS2h0dHBzOi8vd3d3LmJ1enpmZWVkLmNvbS9jaGVsc2Vhc3R1YXJ0L3NtYWxsLWJ1c2luZXNzLWRlYWxzLWN5YmVyLXdlZWstMjAyM9IBAA?hl=en-IN&gl=IN&ceid=IN%3Aen,2023-11-26
53,Israel-Hamas war live: Red Cross confirms exchange of 17 Hamas ...,msnNOW,news.google.com/articles/CBMipwFodHRwczovL3d3dy5tc24uY29tL2VuLWllL25ld3Mvd29ybGQvaXNyYWVsLWhhbWFzLXdhci1saXZlLXJlZC1jcm9zcy1jb25maXJtcy1leGNoYW5nZS1vZi0xNy1oYW1hcy1ob3N0YWdlcy1hbmQtMTktcGFsZXN0aW5pYW5zLWRldGFpbmVkLWluLWlzcmFlbGktcHJpc29ucy9hci1BQTFreHRrQdIBAA?hl=en-IN&gl=IN&ceid=IN%3Aen,2023-11-26
48,Israeli forces kill at least 8 Palestinians in surging West Bank violence,Arab News,news.google.com/articles/CBMiMWh0dHBzOi8vd3d3LmFyYWJuZXdzLmNvbS9ub2RlLzI0MTUyOTEvbWlkZGxlLWVhc3TSASlodHRwczovL3d3dy5hcmFibmV3cy5jb20vbm9kZS8yNDE1MjkxL2FtcA?hl=en-IN&gl=IN&ceid=IN%3Aen,2023-11-26
45,Senior Hamas commander in charge of northern Gaza killed in war,Arab News,news.google.com/articles/CBMiMWh0dHBzOi8vd3d3LmFyYWJuZXdzLmNvbS9ub2RlLzI0MTUzODYvbWlkZGxlLWVhc3TSASlodHRwczovL3d3dy5hcmFibmV3cy5jb20vbm9kZS8yNDE1Mzg2L2FtcA?hl=en-IN&gl=IN&ceid=IN%3Aen,2023-11-26
26,Israel-linked tanker seized off Yemen: US official,Arab News,news.google.com/articles/CBMiMWh0dHBzOi8vd3d3LmFyYWJuZXdzLmNvbS9ub2RlLzI0MTU1MTEvbWlkZGxlLWVhc3TSASlodHRwczovL3d3dy5hcmFibmV3cy5jb20vbm9kZS8yNDE1NTExL2FtcA?hl=en-IN&gl=IN&ceid=IN%3Aen,2023-11-26
41,Killing reported in Gaza refugee camp on third day of truce,Arab News,news.google.com/articles/CBMiMWh0dHBzOi8vd3d3LmFyYWJuZXdzLmNvbS9ub2RlLzI0MTU1ODYvbWlkZGxlLWVhc3TSASlodHRwczovL3d3dy5hcmFibmV3cy5jb20vbm9kZS8yNDE1NTg2L2FtcA?hl=en-IN&gl=IN&ceid=IN%3Aen,2023-11-26
40,"Egypt's foreign minister begins tour that includes Spain, US in push ...",Arab News,news.google.com/articles/CBMiMWh0dHBzOi8vd3d3LmFyYWJuZXdzLmNvbS9ub2RlLzI0MTU1OTYvbWlkZGxlLWVhc3TSASlodHRwczovL3d3dy5hcmFibmV3cy5jb20vbm9kZS8yNDE1NTk2L2FtcA?hl=en-IN&gl=IN&ceid=IN%3Aen,2023-11-26
