,title,source,link,date
49,Green Run victory highlights opening night of high school football in ...,News 3 WTKR Norfolk,news.google.com/articles/CBMib2h0dHBzOi8vd3d3Lnd0a3IuY29tL3Nwb3J0cy9ncmVlbi1ydW4tdmljdG9yeS1oaWdobGlnaHRzLW9wZW5pbmctbmlnaHQtb2YtaGlnaC1zY2hvb2wtZm9vdGJhbGwtaW4taGFtcHRvbi1yb2Fkc9IBAA?hl=en-IN&gl=IN&ceid=IN%3Aen,2023-08-25
8,Lots of moving pieces remain for Tidewater stadium,Providence Business News,news.google.com/articles/CBMiQ2h0dHBzOi8vcGJuLmNvbS9sb3RzLW9mLW1vdmluZy1waWVjZXMtcmVtYWluLWZvci10aWRld2F0ZXItc3RhZGl1bS_SAUlodHRwczovL3Bibi5jb20vbG90cy1vZi1tb3ZpbmctcGllY2VzLXJlbWFpbi1mb3ItdGlkZXdhdGVyLXN0YWRpdW0vP2FtcD0x?hl=en-IN&gl=IN&ceid=IN%3Aen,2023-08-25
70,Rise of Homeschool: Local families say options growing in Hampton ...,News 3 WTKR Norfolk,news.google.com/articles/CBMiYGh0dHBzOi8vd3d3Lnd0a3IuY29tL25ld3MvcmlzZS1vZi1ob21lc2Nob29sLWxvY2FsLWZhbWlsaWVzLXNheS1vcHRpb25zLWdyb3dpbmctaW4taGFtcHRvbi1yb2Fkc9IBAA?hl=en-IN&gl=IN&ceid=IN%3Aen,2023-08-25
48,Hampton Roads Ukrainians reflect on Ukraine's Independence Day,News 3 WTKR Norfolk,news.google.com/articles/CBMiV2h0dHBzOi8vd3d3Lnd0a3IuY29tL25ld3MvaGFtcHRvbi1yb2Fkcy11a3JhaW5pYW5zLXJlZmxlY3Qtb24tdWtyYWluZXMtaW5kZXBlbmRlbmNlLWRhedIBAA?hl=en-IN&gl=IN&ceid=IN%3Aen,2023-08-25
41,Report: Canadian consumption of biobased diesel to grow in 2023 ...,Biomass Magazine,news.google.com/articles/CBMiaWh0dHBzOi8vYmlvbWFzc21hZ2F6aW5lLmNvbS9hcnRpY2xlcy8yMDMyNi9yZXBvcnQtY2FuYWRpYW4tY29uc3VtcHRpb24tb2YtYmlvYmFzZWQtZGllc2VsLXRvLWdyb3ctaW4tMjAyM9IBAA?hl=en-IN&gl=IN&ceid=IN%3Aen,2023-08-24
89,"Dow Jones Futures: Hot Nvidia Earnings, Guidance Lift These AI ...",MSN,news.google.com/articles/CBMilgFodHRwczovL3d3dy5tc24uY29tL2VuLXVzL21vbmV5L21hcmtldHMvZG93LWpvbmVzLWZ1dHVyZXMtcmlzZS1ob3QtbnZpZGlhLWVhcm5pbmdzLWd1aWRhbmNlLWxpZnQtYWktc3RvY2tzLW1hcmtldC1yYWxseS1zdGlsbC1tdXN0LWRvLXRoaXMvYXItQUExZkdNYlHSAQA?hl=en-IN&gl=IN&ceid=IN%3Aen,2023-08-24
78,Modular developer R2 Building puts unbuilt Oakland residential ...,The Business Journals,news.google.com/articles/CBMiX2h0dHBzOi8vd3d3LmJpempvdXJuYWxzLmNvbS9zYW5mcmFuY2lzY28vbmV3cy8yMDIzLzA4LzI0L3IyLWJ1aWxkaW5nLW9ha2xhbmQtMjA0NC1mcmFua2xpbi5odG1s0gEA?hl=en-IN&gl=IN&ceid=IN%3Aen,2023-08-24
68,Region/state roundup: Grant Wells named Virginia Tech's starting ...,The Virginian-Pilot,news.google.com/articles/CBMie2h0dHBzOi8vd3d3LnBpbG90b25saW5lLmNvbS8yMDIzLzA4LzIzL3JlZ2lvbi1zdGF0ZS1yb3VuZHVwLWdyYW50LXdlbGxzLW5hbWVkLXZpcmdpbmlhLXRlY2hzLXN0YXJ0aW5nLXFiLWZvci1vcGVuZXItdnMtb2R1L9IBAA?hl=en-IN&gl=IN&ceid=IN%3Aen,2023-08-24
58,Dyanna Jaye Infuses Climate Policy with Organizing Urgency,Mirage News,news.google.com/articles/CBMiS2h0dHBzOi8vd3d3Lm1pcmFnZW5ld3MuY29tL2R5YW5uYS1qYXllLWluZnVzZXMtY2xpbWF0ZS1wb2xpY3ktd2l0aC0xMDcxMjI5L9IBAA?hl=en-IN&gl=IN&ceid=IN%3Aen,2023-08-24
52,UNCW announces arrival of new flavors to campus dining,WWAY NewsChannel 3,news.google.com/articles/CBMiT2h0dHBzOi8vd3d3Lnd3YXl0djMuY29tL3VuY3ctYW5ub3VuY2VzLWFycml2YWwtb2YtbmV3LWZsYXZvcnMtdG8tY2FtcHVzLWRpbmluZy_SAQA?hl=en-IN&gl=IN&ceid=IN%3Aen,2023-08-24
