,title,source,link,date
71,"""A superb document of, and tribute to, a brilliant band in its prime ...",Louder,news.google.com/articles/CBMiamh0dHBzOi8vd3d3LmxvdWRlcnNvdW5kLmNvbS9yZXZpZXdzL3doaXRlc25ha2UtbGl2ZS1pbi10aGUtaGVhcnQtb2YtdGhlLWNpdHktYWxidW0tb2YtdGhlLXdlZWstY2x1Yi1yZXZpZXfSAQA?hl=en-IN&gl=IN&ceid=IN%3Aen,2023-09-11
17,"Melphalan Market Size and Market Drivers Analysis | Emerging Trends, New Developments and Forecast till 2",Benzinga,news.google.com/articles/CBMimQFodHRwczovL3d3dy5iZW56aW5nYS5jb20vcHJlc3NyZWxlYXNlcy8yMy8wOS8zNDQzOTkzNi9tZWxwaGFsYW4tbWFya2V0LXNpemUtYW5kLW1hcmtldC1kcml2ZXJzLWFuYWx5c2lzLWVtZXJnaW5nLXRyZW5kcy1uZXctZGV2ZWxvcG1lbnRzLWFuZC1mb3JlY2FzdC10aWzSAS1odHRwczovL3d3dy5iZW56aW5nYS5jb20vYW1wL2NvbnRlbnQvMzQ0Mzk5MzY?hl=en-IN&gl=IN&ceid=IN%3Aen,2023-09-11
4,The Weeknd adds fourth show to After Hours Til Dawn tour,Glam Adelaide,news.google.com/articles/CBMiVWh0dHBzOi8vZ2xhbWFkZWxhaWRlLmNvbS5hdS90aGUtd2Vla25kLWFkZHMtZm91cnRoLXNob3ctdG8tYWZ0ZXItaG91cnMtdGlsLWRhd24tdG91ci_SAQA?hl=en-IN&gl=IN&ceid=IN%3Aen,2023-09-11
30,Cellares and Lyell to Evaluate Automated Manufacturing of Lyell's ...,PR Newswire,news.google.com/articles/CBMirQFodHRwczovL3d3dy5wcm5ld3N3aXJlLmNvbS9uZXdzLXJlbGVhc2VzL2NlbGxhcmVzLWFuZC1seWVsbC10by1ldmFsdWF0ZS1hdXRvbWF0ZWQtbWFudWZhY3R1cmluZy1vZi1seWVsbHMtY2FyLXQtY2VsbC10aGVyYXB5LW9uLWNlbGxhcmVzLWNlbGwtc2h1dHRsZS1wbGF0Zm9ybS0zMDE5MjI2NTYuaHRtbNIBAA?hl=en-IN&gl=IN&ceid=IN%3Aen,2023-09-11
28,Compressed Natural Gas and Liquefied Natural Gas Vehicle Market 2023: Size and Research Overview Till 203,Benzinga,news.google.com/articles/CBMimQFodHRwczovL3d3dy5iZW56aW5nYS5jb20vcHJlc3NyZWxlYXNlcy8yMy8wOS8zNDQyNzUzMS9jb21wcmVzc2VkLW5hdHVyYWwtZ2FzLWFuZC1saXF1ZWZpZWQtbmF0dXJhbC1nYXMtdmVoaWNsZS1tYXJrZXQtMjAyMy1zaXplLWFuZC1yZXNlYXJjaC1vdmVydmlldy10aWzSAS1odHRwczovL3d3dy5iZW56aW5nYS5jb20vYW1wL2NvbnRlbnQvMzQ0Mjc1MzE?hl=en-IN&gl=IN&ceid=IN%3Aen,2023-09-11
27,Ski Gear & Equipments Market Quantitative and Qualitative Analysis | Market Challenges and Forecast till,Benzinga,news.google.com/articles/CBMimQFodHRwczovL3d3dy5iZW56aW5nYS5jb20vcHJlc3NyZWxlYXNlcy8yMy8wOS8zNDQyNTI0Mi9za2ktZ2Vhci1lcXVpcG1lbnRzLW1hcmtldC1xdWFudGl0YXRpdmUtYW5kLXF1YWxpdGF0aXZlLWFuYWx5c2lzLW1hcmtldC1jaGFsbGVuZ2VzLWFuZC1mb3JlY2FzdC10aWzSAS1odHRwczovL3d3dy5iZW56aW5nYS5jb20vYW1wL2NvbnRlbnQvMzQ0MjUyNDI?hl=en-IN&gl=IN&ceid=IN%3Aen,2023-09-11
26,Military Helicopter Market Quantitative and Qualitative Analysis | Market Challenges and Forecast till 20,Benzinga,news.google.com/articles/CBMimQFodHRwczovL3d3dy5iZW56aW5nYS5jb20vcHJlc3NyZWxlYXNlcy8yMy8wOS8zNDQyMjk1MS9taWxpdGFyeS1oZWxpY29wdGVyLW1hcmtldC1xdWFudGl0YXRpdmUtYW5kLXF1YWxpdGF0aXZlLWFuYWx5c2lzLW1hcmtldC1jaGFsbGVuZ2VzLWFuZC1mb3JlY2FzdC10aWzSAS1odHRwczovL3d3dy5iZW56aW5nYS5jb20vYW1wL2NvbnRlbnQvMzQ0MjI5NTE?hl=en-IN&gl=IN&ceid=IN%3Aen,2023-09-11
25,Photovoltaic Energy Storage System Market Report Covering Prime Factors and Competitive Outlook till 2029,Benzinga,news.google.com/articles/CBMimQFodHRwczovL3d3dy5iZW56aW5nYS5jb20vcHJlc3NyZWxlYXNlcy8yMy8wOS8zNDQyODY3My9waG90b3ZvbHRhaWMtZW5lcmd5LXN0b3JhZ2Utc3lzdGVtLW1hcmtldC1yZXBvcnQtY292ZXJpbmctcHJpbWUtZmFjdG9ycy1hbmQtY29tcGV0aXRpdmUtb3V0bG9vay10aWzSAS1odHRwczovL3d3dy5iZW56aW5nYS5jb20vYW1wL2NvbnRlbnQvMzQ0Mjg2NzM?hl=en-IN&gl=IN&ceid=IN%3Aen,2023-09-11
24,Offshore Containers Market Quantitative and Qualitative Analysis | Market Challenges and Forecast till 20,Benzinga,news.google.com/articles/CBMimQFodHRwczovL3d3dy5iZW56aW5nYS5jb20vcHJlc3NyZWxlYXNlcy8yMy8wOS8zNDQyOTkzNC9vZmZzaG9yZS1jb250YWluZXJzLW1hcmtldC1xdWFudGl0YXRpdmUtYW5kLXF1YWxpdGF0aXZlLWFuYWx5c2lzLW1hcmtldC1jaGFsbGVuZ2VzLWFuZC1mb3JlY2FzdC10aWzSAS1odHRwczovL3d3dy5iZW56aW5nYS5jb20vYW1wL2NvbnRlbnQvMzQ0Mjk5MzQ?hl=en-IN&gl=IN&ceid=IN%3Aen,2023-09-11
23,"Laser CTP Market Size and Market Drivers Analysis | Emerging Trends, New Developments and Forecast till 2",Benzinga,news.google.com/articles/CBMimQFodHRwczovL3d3dy5iZW56aW5nYS5jb20vcHJlc3NyZWxlYXNlcy8yMy8wOS8zNDQyODgyMi9sYXNlci1jdHAtbWFya2V0LXNpemUtYW5kLW1hcmtldC1kcml2ZXJzLWFuYWx5c2lzLWVtZXJnaW5nLXRyZW5kcy1uZXctZGV2ZWxvcG1lbnRzLWFuZC1mb3JlY2FzdC10aWzSAS1odHRwczovL3d3dy5iZW56aW5nYS5jb20vYW1wL2NvbnRlbnQvMzQ0Mjg4MjI?hl=en-IN&gl=IN&ceid=IN%3Aen,2023-09-11
