,title,source,link,date
14,Ariana Grande Looks Straight Out of the '70s in Her Vintage Yellow Miniskirt and Crop Top Set,Yahoo New Zealand News,news.google.com/articles/CBMiSWh0dHBzOi8vbnoubmV3cy55YWhvby5jb20vYXJpYW5hLWdyYW5kZS1sb29rcy1zdHJhaWdodC03MHMtMTg0ODQ5NjI1Lmh0bWzSAVFodHRwczovL256Lm5ld3MueWFob28uY29tL2FtcGh0bWwvYXJpYW5hLWdyYW5kZS1sb29rcy1zdHJhaWdodC03MHMtMTg0ODQ5NjI1Lmh0bWw?hl=en-IN&gl=IN&ceid=IN%3Aen,2023-08-30
20,Your Guide to the Perfect Labor Day Weekend in Honolulu: Aug. 31 ...,HONOLULU Magazine,news.google.com/articles/CBMiS2h0dHBzOi8vd3d3Lmhvbm9sdWx1bWFnYXppbmUuY29tL3dlZWtlbmQtZ3VpZGUtaG9ub2x1bHUtYXVnLTMxLXNlcHQtNi0yMDIzL9IBAA?hl=en-IN&gl=IN&ceid=IN%3Aen,2023-08-30
5,Oil near flat as investors eye impact of Hurricane Idalia on demand,Reuters,news.google.com/articles/CBMicWh0dHBzOi8vd3d3LnJldXRlcnMuY29tL21hcmtldHMvY29tbW9kaXRpZXMvb2lsLXByaWNlcy1yaXNlLWxhcmdlLXVzLXN0b2NrcGlsZS1kcmF3LWh1cnJpY2FuZS1qaXR0ZXJzLTIwMjMtMDgtMzAv0gEA?hl=en-IN&gl=IN&ceid=IN%3Aen,2023-08-30
18,"Athletics vs. Mariners prediction and odds for Wednesday, Aug. 29 ...",SoDo Mojo,news.google.com/articles/CBMibmh0dHBzOi8vc29kb21vam8uY29tL3Bvc3RzL2F0aGxldGljcy12cy1tYXJpbmVycy1wcmVkaWN0aW9uLWFuZC1vZGRzLWZvci13ZWRuZXNkYXktYXVnLTI5LXNlYXR0bGUtYm91bmNlcy1iYWNr0gEA?hl=en-IN&gl=IN&ceid=IN%3Aen,2023-08-30
11,"Eco Cable Market Worldwide Industry Gross Margin, Leading Player, Progression Status and Forecast till 20",Benzinga,news.google.com/articles/CBMimQFodHRwczovL3d3dy5iZW56aW5nYS5jb20vcHJlc3NyZWxlYXNlcy8yMy8wOC8zNDEwNzM1NC9lY28tY2FibGUtbWFya2V0LXdvcmxkd2lkZS1pbmR1c3RyeS1ncm9zcy1tYXJnaW4tbGVhZGluZy1wbGF5ZXItcHJvZ3Jlc3Npb24tc3RhdHVzLWFuZC1mb3JlY2FzdC10aWzSAS1odHRwczovL3d3dy5iZW56aW5nYS5jb20vYW1wL2NvbnRlbnQvMzQxMDczNTQ?hl=en-IN&gl=IN&ceid=IN%3Aen,2023-08-30
12,Are sunbeds really that bad for you?,HELLO!,news.google.com/articles/CBMiRWh0dHBzOi8vd3d3LmhlbGxvbWFnYXppbmUuY29tL2hmbS81MDEzNjUvYXJlLXN1bmJlZHMtcmVhbGx5LXRoYXQtYmFkL9IBUGh0dHBzOi8vd3d3LmhlbGxvbWFnYXppbmUuY29tL2hmbS81MDEzNjUvYXJlLXN1bmJlZHMtcmVhbGx5LXRoYXQtYmFkLz92aWV3YXM9YW1w?hl=en-IN&gl=IN&ceid=IN%3Aen,2023-08-30
15,Google's AlloyDB AI transforms databases to power generative AI apps,Yahoo Finance UK,news.google.com/articles/CBMiWGh0dHBzOi8vdWsuZmluYW5jZS55YWhvby5jb20vbmV3cy9nb29nbGVzLWFsbG95ZGItYWktdHJhbnNmb3Jtcy1kYXRhYmFzZXMtMTIwMDAxNDU4Lmh0bWzSAWBodHRwczovL3VrLmZpbmFuY2UueWFob28uY29tL2FtcGh0bWwvbmV3cy9nb29nbGVzLWFsbG95ZGItYWktdHJhbnNmb3Jtcy1kYXRhYmFzZXMtMTIwMDAxNDU4Lmh0bWw?hl=en-IN&gl=IN&ceid=IN%3Aen,2023-08-29
19,Caps and Closures Market 2023 Key Product Segments and Their Impact on Industry Growth Analysis till 2031,Benzinga,news.google.com/articles/CBMimQFodHRwczovL3d3dy5iZW56aW5nYS5jb20vcHJlc3NyZWxlYXNlcy8yMy8wOC8zNDA4MzQ3My9jYXBzLWFuZC1jbG9zdXJlcy1tYXJrZXQtMjAyMy1rZXktcHJvZHVjdC1zZWdtZW50cy1hbmQtdGhlaXItaW1wYWN0LW9uLWluZHVzdHJ5LWdyb3d0aC1hbmFseXNpcy10aWzSAS1odHRwczovL3d3dy5iZW56aW5nYS5jb20vYW1wL2NvbnRlbnQvMzQwODM0NzM?hl=en-IN&gl=IN&ceid=IN%3Aen,2023-08-29
17,Plant Growth Regulators Market 2023 Industry Growth and Identifying Lucrative Application Areas till 2031,Benzinga,news.google.com/articles/CBMimQFodHRwczovL3d3dy5iZW56aW5nYS5jb20vcHJlc3NyZWxlYXNlcy8yMy8wOC8zNDA4MzQ1Mi9wbGFudC1ncm93dGgtcmVndWxhdG9ycy1tYXJrZXQtMjAyMy1pbmR1c3RyeS1ncm93dGgtYW5kLWlkZW50aWZ5aW5nLWx1Y3JhdGl2ZS1hcHBsaWNhdGlvbi1hcmVhcy10aWzSAS1odHRwczovL3d3dy5iZW56aW5nYS5jb20vYW1wL2NvbnRlbnQvMzQwODM0NTI?hl=en-IN&gl=IN&ceid=IN%3Aen,2023-08-29
16,Rare Characters Returning to Disney Park for Limited Time,Disney Dining,news.google.com/articles/CBMiRWh0dHBzOi8vd3d3LmRpc25leWRpbmluZy5jb20vaGFsbG93ZWVuLWlzLWhlYWRpbmctdG8tZGlzbmV5bGFuZC1id2IxL9IBAA?hl=en-IN&gl=IN&ceid=IN%3Aen,2023-08-29
