,title,source,link,date
76,"Adoptive Cell Therapy Market - Global Industry Analysis, Size, Growth, Trends and Forecast 2023 to 2030 w",Benzinga,news.google.com/articles/CBMimQFodHRwczovL3d3dy5iZW56aW5nYS5jb20vcHJlc3NyZWxlYXNlcy8yMy8wOS8zNDI2Njg5NC9hZG9wdGl2ZS1jZWxsLXRoZXJhcHktbWFya2V0LWdsb2JhbC1pbmR1c3RyeS1hbmFseXNpcy1zaXplLWdyb3d0aC10cmVuZHMtYW5kLWZvcmVjYXN0LTIwMjMtdG8tMjAzMC3SAS1odHRwczovL3d3dy5iZW56aW5nYS5jb20vYW1wL2NvbnRlbnQvMzQyNjY4OTQ?hl=en-IN&gl=IN&ceid=IN%3Aen,2023-09-06
18,"Vacuum Gas Oil (VGO) Market Strategies 2023: Key Dynamics, Future Demand, and Top Companies Analysis till",Benzinga,news.google.com/articles/CBMimQFodHRwczovL3d3dy5iZW56aW5nYS5jb20vcHJlc3NyZWxlYXNlcy8yMy8wOS8zNDI3NDUwOC92YWN1dW0tZ2FzLW9pbC12Z28tbWFya2V0LXN0cmF0ZWdpZXMtMjAyMy1rZXktZHluYW1pY3MtZnV0dXJlLWRlbWFuZC1hbmQtdG9wLWNvbXBhbmllcy1hbmFseXNpcy10aWzSAS1odHRwczovL3d3dy5iZW56aW5nYS5jb20vYW1wL2NvbnRlbnQvMzQyNzQ1MDg?hl=en-IN&gl=IN&ceid=IN%3Aen,2023-09-06
46,KSQ Therapeutics and CTMC Announce Strategic Collaboration to Accelerate the Development of Novel Enginee,Benzinga,news.google.com/articles/CBMimQFodHRwczovL3d3dy5iZW56aW5nYS5jb20vcHJlc3NyZWxlYXNlcy8yMy8wOS9iMzQyNzEyMzUva3NxLXRoZXJhcGV1dGljcy1hbmQtY3RtYy1hbm5vdW5jZS1zdHJhdGVnaWMtY29sbGFib3JhdGlvbi10by1hY2NlbGVyYXRlLXRoZS1kZXZlbG9wbWVudC1vZi1ub3ZlbC3SAS1odHRwczovL3d3dy5iZW56aW5nYS5jb20vYW1wL2NvbnRlbnQvMzQyNzEyMzU?hl=en-IN&gl=IN&ceid=IN%3Aen,2023-09-06
36,Smart Scale Market Size 2023 | Data-Driven Insights with Adapting to Rapid Changes by Top Players till 20,Benzinga,news.google.com/articles/CBMimQFodHRwczovL3d3dy5iZW56aW5nYS5jb20vcHJlc3NyZWxlYXNlcy8yMy8wOS8zNDI3ODIyNS9zbWFydC1zY2FsZS1tYXJrZXQtc2l6ZS0yMDIzLWRhdGEtZHJpdmVuLWluc2lnaHRzLXdpdGgtYWRhcHRpbmctdG8tcmFwaWQtY2hhbmdlcy1ieS10b3AtcGxheWVycy10aWzSAS1odHRwczovL3d3dy5iZW56aW5nYS5jb20vYW1wL2NvbnRlbnQvMzQyNzgyMjU?hl=en-IN&gl=IN&ceid=IN%3Aen,2023-09-06
48,Danish folk metal band VANSIND release debut album in November,Metal Planet Music,news.google.com/articles/CBMiZGh0dHBzOi8vbWV0YWxwbGFuZXRtdXNpYy5jb20vMjAyMy8wOS9kYW5pc2gtZm9say1tZXRhbC1iYW5kLXZhbnNpbmQtcmVsZWFzZS1kZWJ1dC1hbGJ1bS1pbi1ub3ZlbWJlci_SAQA?hl=en-IN&gl=IN&ceid=IN%3Aen,2023-09-06
33,PET Preform Market Size 2023 | Data-Driven Insights with Adapting to Rapid Changes by Top Players till 20,Benzinga,news.google.com/articles/CBMimQFodHRwczovL3d3dy5iZW56aW5nYS5jb20vcHJlc3NyZWxlYXNlcy8yMy8wOS8zNDI2NDk5Ni9wZXQtcHJlZm9ybS1tYXJrZXQtc2l6ZS0yMDIzLWRhdGEtZHJpdmVuLWluc2lnaHRzLXdpdGgtYWRhcHRpbmctdG8tcmFwaWQtY2hhbmdlcy1ieS10b3AtcGxheWVycy10aWzSAS1odHRwczovL3d3dy5iZW56aW5nYS5jb20vYW1wL2NvbnRlbnQvMzQyNjQ5OTY?hl=en-IN&gl=IN&ceid=IN%3Aen,2023-09-06
31,Rail Tank Cars Hazardous Cleaning and Repair Market Size 2023 | Historic Data with New Benchmarks till 20,Benzinga,news.google.com/articles/CBMimQFodHRwczovL3d3dy5iZW56aW5nYS5jb20vcHJlc3NyZWxlYXNlcy8yMy8wOS8zNDI2NDk4Ni9yYWlsLXRhbmstY2Fycy1oYXphcmRvdXMtY2xlYW5pbmctYW5kLXJlcGFpci1tYXJrZXQtc2l6ZS0yMDIzLWhpc3RvcmljLWRhdGEtd2l0aC1uZXctYmVuY2htYXJrcy10aWzSAS1odHRwczovL3d3dy5iZW56aW5nYS5jb20vYW1wL2NvbnRlbnQvMzQyNjQ5ODY?hl=en-IN&gl=IN&ceid=IN%3Aen,2023-09-06
30,Acetate Tow Market Size 2023 | Data-Driven Insights with Adapting to Rapid Changes by Top Players till 20,Benzinga,news.google.com/articles/CBMimQFodHRwczovL3d3dy5iZW56aW5nYS5jb20vcHJlc3NyZWxlYXNlcy8yMy8wOS8zNDI2NTkxNS9hY2V0YXRlLXRvdy1tYXJrZXQtc2l6ZS0yMDIzLWRhdGEtZHJpdmVuLWluc2lnaHRzLXdpdGgtYWRhcHRpbmctdG8tcmFwaWQtY2hhbmdlcy1ieS10b3AtcGxheWVycy10aWzSAS1odHRwczovL3d3dy5iZW56aW5nYS5jb20vYW1wL2NvbnRlbnQvMzQyNjU5MTU?hl=en-IN&gl=IN&ceid=IN%3Aen,2023-09-06
28,ECDIS Market Size 2023 | Innovative Research Methodologies with Emerging Trends and Opportunities till 20,Benzinga,news.google.com/articles/CBMimQFodHRwczovL3d3dy5iZW56aW5nYS5jb20vcHJlc3NyZWxlYXNlcy8yMy8wOS8zNDI2NTk2MC9lY2Rpcy1tYXJrZXQtc2l6ZS0yMDIzLWlubm92YXRpdmUtcmVzZWFyY2gtbWV0aG9kb2xvZ2llcy13aXRoLWVtZXJnaW5nLXRyZW5kcy1hbmQtb3Bwb3J0dW5pdGllcy10aWzSAS1odHRwczovL3d3dy5iZW56aW5nYS5jb20vYW1wL2NvbnRlbnQvMzQyNjU5NjA?hl=en-IN&gl=IN&ceid=IN%3Aen,2023-09-06
25,2023 Electric Blinds and Shades Market Growth: Analyzing Industry Demand and Future Developments till 203,Benzinga,news.google.com/articles/CBMimQFodHRwczovL3d3dy5iZW56aW5nYS5jb20vcHJlc3NyZWxlYXNlcy8yMy8wOS8zNDI2Mjc3OC8yMDIzLWVsZWN0cmljLWJsaW5kcy1hbmQtc2hhZGVzLW1hcmtldC1ncm93dGgtYW5hbHl6aW5nLWluZHVzdHJ5LWRlbWFuZC1hbmQtZnV0dXJlLWRldmVsb3BtZW50cy10aWzSAS1odHRwczovL3d3dy5iZW56aW5nYS5jb20vYW1wL2NvbnRlbnQvMzQyNjI3Nzg?hl=en-IN&gl=IN&ceid=IN%3Aen,2023-09-06
