,title,source,link,date
24,"5G Small Cells Chips Market Report with Growth, Latest Industry Scope, Future Trends and Analysis till 20",Benzinga,news.google.com/articles/CBMimQFodHRwczovL3d3dy5iZW56aW5nYS5jb20vcHJlc3NyZWxlYXNlcy8yMy8wOS8zNDMxNTY1NS81Zy1zbWFsbC1jZWxscy1jaGlwcy1tYXJrZXQtcmVwb3J0LXdpdGgtZ3Jvd3RoLWxhdGVzdC1pbmR1c3RyeS1zY29wZS1mdXR1cmUtdHJlbmRzLWFuZC1hbmFseXNpcy10aWzSAS1odHRwczovL3d3dy5iZW56aW5nYS5jb20vYW1wL2NvbnRlbnQvMzQzMTU2NTU?hl=en-IN&gl=IN&ceid=IN%3Aen,2023-09-07
19,Hot-Air Balloon Burners Market |2030 Report Intelligence Business Growth and Top Leading Players Till 203,Benzinga,news.google.com/articles/CBMimQFodHRwczovL3d3dy5iZW56aW5nYS5jb20vcHJlc3NyZWxlYXNlcy8yMy8wOS8zNDMyNzE5OS9ob3QtYWlyLWJhbGxvb24tYnVybmVycy1tYXJrZXQtMjAzMC1yZXBvcnQtaW50ZWxsaWdlbmNlLWJ1c2luZXNzLWdyb3d0aC1hbmQtdG9wLWxlYWRpbmctcGxheWVycy10aWzSAS1odHRwczovL3d3dy5iZW56aW5nYS5jb20vYW1wL2NvbnRlbnQvMzQzMjcxOTk?hl=en-IN&gl=IN&ceid=IN%3Aen,2023-09-07
35,Adult Store Market Size 2023 | Data-Driven Insights with Adapting to Rapid Changes by Top Players till 20,Benzinga,news.google.com/articles/CBMimQFodHRwczovL3d3dy5iZW56aW5nYS5jb20vcHJlc3NyZWxlYXNlcy8yMy8wOS8zNDMxODAzMy9hZHVsdC1zdG9yZS1tYXJrZXQtc2l6ZS0yMDIzLWRhdGEtZHJpdmVuLWluc2lnaHRzLXdpdGgtYWRhcHRpbmctdG8tcmFwaWQtY2hhbmdlcy1ieS10b3AtcGxheWVycy10aWzSAS1odHRwczovL3d3dy5iZW56aW5nYS5jb20vYW1wL2NvbnRlbnQvMzQzMTgwMzM?hl=en-IN&gl=IN&ceid=IN%3Aen,2023-09-07
4,Iovance Biotherapeutics to Present at 2023 Wells Fargo Healthcare Conference,Yahoo Finance,news.google.com/articles/CBMiWGh0dHBzOi8vZmluYW5jZS55YWhvby5jb20vbmV3cy9pb3ZhbmNlLWJpb3RoZXJhcGV1dGljcy1wcmVzZW50LTIwMjMtd2VsbHMtMTEzMTAwMTI5Lmh0bWzSAWBodHRwczovL2ZpbmFuY2UueWFob28uY29tL2FtcGh0bWwvbmV3cy9pb3ZhbmNlLWJpb3RoZXJhcGV1dGljcy1wcmVzZW50LTIwMjMtd2VsbHMtMTEzMTAwMTI5Lmh0bWw?hl=en-IN&gl=IN&ceid=IN%3Aen,2023-09-07
33,Credit Risk Management Platform Market | New Developments and Future Growth Prospects of Industry till 20,Benzinga,news.google.com/articles/CBMimQFodHRwczovL3d3dy5iZW56aW5nYS5jb20vcHJlc3NyZWxlYXNlcy8yMy8wOS8zNDMwMzcyNi9jcmVkaXQtcmlzay1tYW5hZ2VtZW50LXBsYXRmb3JtLW1hcmtldC1uZXctZGV2ZWxvcG1lbnRzLWFuZC1mdXR1cmUtZ3Jvd3RoLXByb3NwZWN0cy1vZi1pbmR1c3RyeS10aWzSAS1odHRwczovL3d3dy5iZW56aW5nYS5jb20vYW1wL2NvbnRlbnQvMzQzMDM3MjY?hl=en-IN&gl=IN&ceid=IN%3Aen,2023-09-07
32,Digital Transformation In Freight Forwarding Market Size 2023 | Historic Data with New Benchmarks till 20,Benzinga,news.google.com/articles/CBMimQFodHRwczovL3d3dy5iZW56aW5nYS5jb20vcHJlc3NyZWxlYXNlcy8yMy8wOS8zNDMxNjQyNC9kaWdpdGFsLXRyYW5zZm9ybWF0aW9uLWluLWZyZWlnaHQtZm9yd2FyZGluZy1tYXJrZXQtc2l6ZS0yMDIzLWhpc3RvcmljLWRhdGEtd2l0aC1uZXctYmVuY2htYXJrcy10aWzSAS1odHRwczovL3d3dy5iZW56aW5nYS5jb20vYW1wL2NvbnRlbnQvMzQzMTY0MjQ?hl=en-IN&gl=IN&ceid=IN%3Aen,2023-09-07
31,"MEA Cancer Screening Market Share, Business Growth, Development Factors, Current and Future Trends till 2",Benzinga,news.google.com/articles/CBMimQFodHRwczovL3d3dy5iZW56aW5nYS5jb20vcHJlc3NyZWxlYXNlcy8yMy8wOS8zNDMwOTY4NS9tZWEtY2FuY2VyLXNjcmVlbmluZy1tYXJrZXQtc2hhcmUtYnVzaW5lc3MtZ3Jvd3RoLWRldmVsb3BtZW50LWZhY3RvcnMtY3VycmVudC1hbmQtZnV0dXJlLXRyZW5kcy10aWzSAS1odHRwczovL3d3dy5iZW56aW5nYS5jb20vYW1wL2NvbnRlbnQvMzQzMDk2ODU?hl=en-IN&gl=IN&ceid=IN%3Aen,2023-09-07
30,CRISPR Cas9 Market Size 2023 | Data-Driven Insights with Adapting to Rapid Changes by Top Players till 20,Benzinga,news.google.com/articles/CBMimQFodHRwczovL3d3dy5iZW56aW5nYS5jb20vcHJlc3NyZWxlYXNlcy8yMy8wOS8zNDMzODcxNC9jcmlzcHItY2FzOS1tYXJrZXQtc2l6ZS0yMDIzLWRhdGEtZHJpdmVuLWluc2lnaHRzLXdpdGgtYWRhcHRpbmctdG8tcmFwaWQtY2hhbmdlcy1ieS10b3AtcGxheWVycy10aWzSAS1odHRwczovL3d3dy5iZW56aW5nYS5jb20vYW1wL2NvbnRlbnQvMzQzMzg3MTQ?hl=en-IN&gl=IN&ceid=IN%3Aen,2023-09-07
28,2023 Global Drone Camera Gimbal Market Insights: Recent Analysis and Extensive Industry Forecast till 203,Benzinga,news.google.com/articles/CBMimQFodHRwczovL3d3dy5iZW56aW5nYS5jb20vcHJlc3NyZWxlYXNlcy8yMy8wOS8zNDMwMjE5Ny8yMDIzLWdsb2JhbC1kcm9uZS1jYW1lcmEtZ2ltYmFsLW1hcmtldC1pbnNpZ2h0cy1yZWNlbnQtYW5hbHlzaXMtYW5kLWV4dGVuc2l2ZS1pbmR1c3RyeS1mb3JlY2FzdC10aWzSAS1odHRwczovL3d3dy5iZW56aW5nYS5jb20vYW1wL2NvbnRlbnQvMzQzMDIxOTc?hl=en-IN&gl=IN&ceid=IN%3Aen,2023-09-07
26,Soy Protein Market Size 2023 | Data-Driven Insights with Adapting to Rapid Changes by Top Players till 20,Benzinga,news.google.com/articles/CBMimQFodHRwczovL3d3dy5iZW56aW5nYS5jb20vcHJlc3NyZWxlYXNlcy8yMy8wOS8zNDI5OTU4NC9zb3ktcHJvdGVpbi1tYXJrZXQtc2l6ZS0yMDIzLWRhdGEtZHJpdmVuLWluc2lnaHRzLXdpdGgtYWRhcHRpbmctdG8tcmFwaWQtY2hhbmdlcy1ieS10b3AtcGxheWVycy10aWzSAS1odHRwczovL3d3dy5iZW56aW5nYS5jb20vYW1wL2NvbnRlbnQvMzQyOTk1ODQ?hl=en-IN&gl=IN&ceid=IN%3Aen,2023-09-07
