,title,source,link,date
32,Spotlight: competition law in the pharmaceutical sector in Brazil,Lexology,news.google.com/articles/CBMiU2h0dHBzOi8vd3d3LmxleG9sb2d5LmNvbS9saWJyYXJ5L2RldGFpbC5hc3B4P2c9OGNlNTE5ZTktYThkNi00NDk4LTkxY2QtYjU3ZWNjMWRlNmYz0gEA?hl=en-IN&gl=IN&ceid=IN%3Aen,2023-09-14
16,"Tank Storage Services Market Size and Share 2023 by Developments, Leading Companies and Forecast till 203",Benzinga,news.google.com/articles/CBMimQFodHRwczovL3d3dy5iZW56aW5nYS5jb20vcHJlc3NyZWxlYXNlcy8yMy8wOS8zNDU3MzM5OC90YW5rLXN0b3JhZ2Utc2VydmljZXMtbWFya2V0LXNpemUtYW5kLXNoYXJlLTIwMjMtYnktZGV2ZWxvcG1lbnRzLWxlYWRpbmctY29tcGFuaWVzLWFuZC1mb3JlY2FzdC10aWzSAS1odHRwczovL3d3dy5iZW56aW5nYS5jb20vYW1wL2NvbnRlbnQvMzQ1NzMzOTg?hl=en-IN&gl=IN&ceid=IN%3Aen,2023-09-14
64,Weekend Roundup: Quoi faire? – Apartment613,Apt613,news.google.com/articles/CBMiMWh0dHBzOi8vYXB0NjEzLmNhL3dlZWtlbmQtcm91bmR1cC1xdW9pLWZhaXJlLTMzMy_SAQA?hl=en-IN&gl=IN&ceid=IN%3Aen,2023-09-14
53,"The Hoxton, Lloyd Amsterdam Opens In Eastern Docklands",Hospitality Net,news.google.com/articles/CBMiOWh0dHBzOi8vd3d3Lmhvc3BpdGFsaXR5bmV0Lm9yZy9hbm5vdW5jZW1lbnQvNDEwMTAwNDUuaHRtbNIBAA?hl=en-IN&gl=IN&ceid=IN%3Aen,2023-09-14
51,"Stonecutters’ Brian Omer On Obtaining The Band Name, New ...",Louisville Eccentric Observer (LEO Weekly),news.google.com/articles/CBMibmh0dHBzOi8vd3d3Lmxlb3dlZWtseS5jb20vMjAyMy8wOS9zdG9uZWN1dHRlcnMtYnJpYW4tb21lci1vbi1vYnRhaW5pbmctdGhlLWJhbmQtbmFtZS1uZXctbGluZXVwLWFuZC1uZXctYWxidW0v0gEA?hl=en-IN&gl=IN&ceid=IN%3Aen,2023-09-14
33,"Americas Enzymes Market 2023 Key Applications, Industry Growth, Competitors Analysis and Forecast till 20",Benzinga,news.google.com/articles/CBMimQFodHRwczovL3d3dy5iZW56aW5nYS5jb20vcHJlc3NyZWxlYXNlcy8yMy8wOS8zNDU3ODAyMS9hbWVyaWNhcy1lbnp5bWVzLW1hcmtldC0yMDIzLWtleS1hcHBsaWNhdGlvbnMtaW5kdXN0cnktZ3Jvd3RoLWNvbXBldGl0b3JzLWFuYWx5c2lzLWFuZC1mb3JlY2FzdC10aWzSAS1odHRwczovL3d3dy5iZW56aW5nYS5jb20vYW1wL2NvbnRlbnQvMzQ1NzgwMjE?hl=en-IN&gl=IN&ceid=IN%3Aen,2023-09-14
21,Cheetos and Milk Bar Release a Layer Cake Collaboration,Food & Wine,news.google.com/articles/CBMiR2h0dHBzOi8vd3d3LmZvb2RhbmR3aW5lLmNvbS9jaGVldG9zLW1pbGstYmFyLWNha2UtY29sbGFib3JhdGlvbi03OTY5ODk20gEA?hl=en-IN&gl=IN&ceid=IN%3Aen,2023-09-14
20,"Nebulizers, Inhalers And Respirators For Asthma Treatment Market Future upcoming Analysis Report till 203",Benzinga,news.google.com/articles/CBMimQFodHRwczovL3d3dy5iZW56aW5nYS5jb20vcHJlc3NyZWxlYXNlcy8yMy8wOS8zNDU2NjczNC9uZWJ1bGl6ZXJzLWluaGFsZXJzLWFuZC1yZXNwaXJhdG9ycy1mb3ItYXN0aG1hLXRyZWF0bWVudC1tYXJrZXQtZnV0dXJlLXVwY29taW5nLWFuYWx5c2lzLXJlcG9ydC10aWzSAS1odHRwczovL3d3dy5iZW56aW5nYS5jb20vYW1wL2NvbnRlbnQvMzQ1NjY3MzQ?hl=en-IN&gl=IN&ceid=IN%3Aen,2023-09-14
19,"Thermoforming Plastic Market Size and Share 2023 by Developments, Leading Companies and Forecast till 203",Benzinga,news.google.com/articles/CBMimQFodHRwczovL3d3dy5iZW56aW5nYS5jb20vcHJlc3NyZWxlYXNlcy8yMy8wOS8zNDU3MjE3NS90aGVybW9mb3JtaW5nLXBsYXN0aWMtbWFya2V0LXNpemUtYW5kLXNoYXJlLTIwMjMtYnktZGV2ZWxvcG1lbnRzLWxlYWRpbmctY29tcGFuaWVzLWFuZC1mb3JlY2FzdC10aWzSAS1odHRwczovL3d3dy5iZW56aW5nYS5jb20vYW1wL2NvbnRlbnQvMzQ1NzIxNzU?hl=en-IN&gl=IN&ceid=IN%3Aen,2023-09-14
17,"Focal Adhesion Kinase Market Size and Share 2023 by Developments, Leading Companies and Forecast till 203",Benzinga,news.google.com/articles/CBMimQFodHRwczovL3d3dy5iZW56aW5nYS5jb20vcHJlc3NyZWxlYXNlcy8yMy8wOS8zNDU3MjM2NS9mb2NhbC1hZGhlc2lvbi1raW5hc2UtbWFya2V0LXNpemUtYW5kLXNoYXJlLTIwMjMtYnktZGV2ZWxvcG1lbnRzLWxlYWRpbmctY29tcGFuaWVzLWFuZC1mb3JlY2FzdC10aWzSAS1odHRwczovL3d3dy5iZW56aW5nYS5jb20vYW1wL2NvbnRlbnQvMzQ1NzIzNjU?hl=en-IN&gl=IN&ceid=IN%3Aen,2023-09-14
