,title,source,link,date
0,Ltd. Global Website | Renewal of O&M Services Contract for APM ...,Mitsubishi Heavy Industries,news.google.com/articles/CBMiJGh0dHBzOi8vd3d3Lm1oaS5jb20vbmV3cy8yMzExMjIuaHRtbNIBAA?hl=en-IN&gl=IN&ceid=IN%3Aen,2023-11-22
12,Design of high bulk moduli high entropy alloys using machine ...,Nature.com,news.google.com/articles/CBMiMmh0dHBzOi8vd3d3Lm5hdHVyZS5jb20vYXJ0aWNsZXMvczQxNTk4LTAyMy00NzE4MS140gEA?hl=en-IN&gl=IN&ceid=IN%3Aen,2023-11-22
25,Delegation of Govt. of Japan & ADB Visit the Priority Stretch of RRTS ...,Metro Rail News,news.google.com/articles/CBMiaWh0dHBzOi8vd3d3Lm1ldHJvcmFpbG5ld3MuaW4vZGVsZWdhdGlvbi1vZi1nb3Z0LW9mLWphcGFuLWFkYi12aXNpdC10aGUtcHJpb3JpdHktc3RyZXRjaC1vZi1ycnRzLWNvcnJpZG9yL9IBAA?hl=en-IN&gl=IN&ceid=IN%3Aen,2023-11-22
23,"Retail India - Retail India News: EVM Unlocks Innovation, Expands ...",Indian Retailer,news.google.com/articles/CBMiZmh0dHBzOi8vd3d3LmluZGlhbnJldGFpbGVyLmNvbS9uZXdzL3JldGFpbC1pbmRpYS1uZXdzLWV2bS11bmxvY2tzLWlubm92YXRpb24tZXhwYW5kcy1wcm9kdWN0LXBvcnRmb2xpb9IBamh0dHBzOi8vd3d3LmluZGlhbnJldGFpbGVyLmNvbS9hbXAvbmV3cy9yZXRhaWwtaW5kaWEtbmV3cy1ldm0tdW5sb2Nrcy1pbm5vdmF0aW9uLWV4cGFuZHMtcHJvZHVjdC1wb3J0Zm9saW8?hl=en-IN&gl=IN&ceid=IN%3Aen,2023-11-22
19,The role of polyunsaturated fatty acids in the neurobiology of major ...,Nature.com,news.google.com/articles/CBMiMmh0dHBzOi8vd3d3Lm5hdHVyZS5jb20vYXJ0aWNsZXMvczQxMzgwLTAyMy0wMjMyMi020gEA?hl=en-IN&gl=IN&ceid=IN%3Aen,2023-11-22
1,Why the transport industry must look beyond automotive in the drive ...,Innovation News Network,news.google.com/articles/CBMifGh0dHBzOi8vd3d3Lmlubm92YXRpb25uZXdzbmV0d29yay5jb20vd2h5LXRoZS10cmFuc3BvcnQtaW5kdXN0cnktbXVzdC1sb29rLWJleW9uZC1hdXRvbW90aXZlLWluLXRoZS1kcml2ZS10by1uZXQtemVyby80MDI1NS_SAQA?hl=en-IN&gl=IN&ceid=IN%3Aen,2023-11-22
16,Hopfion rings in a cubic chiral magnet,Nature.com,news.google.com/articles/CBMiMmh0dHBzOi8vd3d3Lm5hdHVyZS5jb20vYXJ0aWNsZXMvczQxNTg2LTAyMy0wNjY1OC010gEA?hl=en-IN&gl=IN&ceid=IN%3Aen,2023-11-22
15,"Salcef buys back own shares for approximately EUR860,000",Marketscreener.com,news.google.com/articles/CBMijgFodHRwczovL3d3dy5tYXJrZXRzY3JlZW5lci5jb20vcXVvdGUvc3RvY2svU0FMQ0VGLUdST1VQLVMtUC1BLTc2MTkxNTM1L25ld3MvU2FsY2VmLWJ1eXMtYmFjay1vd24tc2hhcmVzLWZvci1hcHByb3hpbWF0ZWx5LUVVUjg2MC0wMDAtNDU0MjA3MjQv0gEA?hl=en-IN&gl=IN&ceid=IN%3Aen,2023-11-22
13,Taxonomic and environmental distribution of bacterial amino acid ...,Nature.com,news.google.com/articles/CBMiMmh0dHBzOi8vd3d3Lm5hdHVyZS5jb20vYXJ0aWNsZXMvczQxNDY3LTAyMy00MzQzNS000gEA?hl=en-IN&gl=IN&ceid=IN%3Aen,2023-11-22
35,France's Leclerc Main Battle Tank Is Truly Special (and Dangerous),The National Interest Online,news.google.com/articles/CBMic2h0dHBzOi8vbmF0aW9uYWxpbnRlcmVzdC5vcmcvYmxvZy9idXp6L2ZyYW5jZSVFMiU4MCU5OXMtbGVjbGVyYy1tYWluLWJhdHRsZS10YW5rLXRydWx5LXNwZWNpYWwtYW5kLWRhbmdlcm91cy0yMDc0MjfSAQA?hl=en-IN&gl=IN&ceid=IN%3Aen,2023-11-22
