,title,source,link,date
2,Balanophora genomes display massively convergent evolution with ...,Nature.com,news.google.com/articles/CBMiMmh0dHBzOi8vd3d3Lm5hdHVyZS5jb20vYXJ0aWNsZXMvczQxNDc3LTAyMy0wMTUxNy030gEA?hl=en-IN&gl=IN&ceid=IN%3Aen,2023-09-21
25,Widening participation – recruitment methods in mental health ...,BMC Medical Research Methodology,news.google.com/articles/CBMiT2h0dHBzOi8vYm1jbWVkcmVzbWV0aG9kb2wuYmlvbWVkY2VudHJhbC5jb20vYXJ0aWNsZXMvMTAuMTE4Ni9zMTI4NzQtMDIzLTAyMDMyLTHSAQA?hl=en-IN&gl=IN&ceid=IN%3Aen,2023-09-21
35,"European Paints and Coatings Market is expected to reach USD USD 34.80 billion by 2027 , emerging at a CAGR of",openPR,news.google.com/articles/CBMiZGh0dHBzOi8vd3d3Lm9wZW5wci5jb20vbmV3cy8zMjE2MDIyL2V1cm9wZWFuLXBhaW50cy1hbmQtY29hdGluZ3MtbWFya2V0LWlzLWV4cGVjdGVkLXRvLXJlYWNoLXVzZC11c2TSAWNodHRwczovL3d3dy5vcGVucHIuY29tL2FtcC8zMjE2MDIyL2V1cm9wZWFuLXBhaW50cy1hbmQtY29hdGluZ3MtbWFya2V0LWlzLWV4cGVjdGVkLXRvLXJlYWNoLXVzZC11c2Q?hl=en-IN&gl=IN&ceid=IN%3Aen,2023-09-21
20,A multilevel analysis of the triple burden of malnutrition in Indonesia ...,BMC Public Health,news.google.com/articles/CBMiTWh0dHBzOi8vYm1jcHVibGljaGVhbHRoLmJpb21lZGNlbnRyYWwuY29tL2FydGljbGVzLzEwLjExODYvczEyODg5LTAyMy0xNjcyOC150gEA?hl=en-IN&gl=IN&ceid=IN%3Aen,2023-09-21
19,European industrial policy: the lessons from NGEU in the new ...,Real Instituto Elcano,news.google.com/articles/CBMinQFodHRwczovL3d3dy5yZWFsaW5zdGl0dXRvZWxjYW5vLm9yZy9lbi9hbmFseXNlcy9ldXJvcGVhbi1pbmR1c3RyaWFsLXBvbGljeS10aGUtbGVzc29ucy1mcm9tLW5nZXUtaW4tdGhlLW5ldy1nZW9wb2xpdGljYWwtZnJhbWV3b3JrLW1vcmUtZnVuZHMtYXJlLW5vdC1lbm91Z2gv0gEA?hl=en-IN&gl=IN&ceid=IN%3Aen,2023-09-21
27,The blood glucose-potassium ratio at admission predicts in-hospital ...,Nature.com,news.google.com/articles/CBMiMmh0dHBzOi8vd3d3Lm5hdHVyZS5jb20vYXJ0aWNsZXMvczQxNTk4LTAyMy00MjgyNy0y0gEA?hl=en-IN&gl=IN&ceid=IN%3Aen,2023-09-21
16,[Mission 2024] INSIGHTS DAILY CURRENT AFFAIRS + PIB ...,Insights IAS,news.google.com/articles/CBMidWh0dHBzOi8vd3d3Lmluc2lnaHRzb25pbmRpYS5jb20vMjAyMy8wOS8yMS9taXNzaW9uLTIwMjQtaW5zaWdodHMtZGFpbHktY3VycmVudC1hZmZhaXJzLXBpYi1zdW1tYXJ5LTIxLXNlcHRlbWJlci0yMDIzL9IBAA?hl=en-IN&gl=IN&ceid=IN%3Aen,2023-09-21
14,Virucidal activity of three standard chemical disinfectants against ...,Nature.com,news.google.com/articles/CBMiMmh0dHBzOi8vd3d3Lm5hdHVyZS5jb20vYXJ0aWNsZXMvczQxNTk4LTAyMy00MjM3Ni040gEA?hl=en-IN&gl=IN&ceid=IN%3Aen,2023-09-21
36,"The Protein Trends & Technologies Market is poised to reach US$ 5.02 billion by 2029, exhibiting a robust CAGR",openPR,news.google.com/articles/CBMiYGh0dHBzOi8vd3d3Lm9wZW5wci5jb20vbmV3cy8zMjE3MDg2L3RoZS1wcm90ZWluLXRyZW5kcy10ZWNobm9sb2dpZXMtbWFya2V0LWlzLXBvaXNlZC10by1yZWFjaC11c9IBX2h0dHBzOi8vd3d3Lm9wZW5wci5jb20vYW1wLzMyMTcwODYvdGhlLXByb3RlaW4tdHJlbmRzLXRlY2hub2xvZ2llcy1tYXJrZXQtaXMtcG9pc2VkLXRvLXJlYWNoLXVz?hl=en-IN&gl=IN&ceid=IN%3Aen,2023-09-21
12,Evaluation of port competitiveness along China's “Belt and Road ...,Nature.com,news.google.com/articles/CBMiMmh0dHBzOi8vd3d3Lm5hdHVyZS5jb20vYXJ0aWNsZXMvczQxNTk4LTAyMy00Mjc1NS0x0gEA?hl=en-IN&gl=IN&ceid=IN%3Aen,2023-09-21
