,title,source,link,date
26,Methods of ex vivo analysis of tissue status in vascularized ...,Journal of Translational Medicine,news.google.com/articles/CBMiVGh0dHBzOi8vdHJhbnNsYXRpb25hbC1tZWRpY2luZS5iaW9tZWRjZW50cmFsLmNvbS9hcnRpY2xlcy8xMC4xMTg2L3MxMjk2Ny0wMjMtMDQzNzkteNIBAA?hl=en-IN&gl=IN&ceid=IN%3Aen,2023-09-08
14,Global land and water limits to electrolytic hydrogen production ...,Nature.com,news.google.com/articles/CBMiMmh0dHBzOi8vd3d3Lm5hdHVyZS5jb20vYXJ0aWNsZXMvczQxNDY3LTAyMy00MTEwNy140gEA?hl=en-IN&gl=IN&ceid=IN%3Aen,2023-09-08
51,"C2C E-Commerce Market Hits New High | Emerging Giants Amazon, eBay, Shopee",openPR,news.google.com/articles/CBMiXmh0dHBzOi8vd3d3Lm9wZW5wci5jb20vbmV3cy8zMjAxNzk0L2MyYy1lLWNvbW1lcmNlLW1hcmtldC1oaXRzLW5ldy1oaWdoLWVtZXJnaW5nLWdpYW50cy1hbWF6b27SAV1odHRwczovL3d3dy5vcGVucHIuY29tL2FtcC8zMjAxNzk0L2MyYy1lLWNvbW1lcmNlLW1hcmtldC1oaXRzLW5ldy1oaWdoLWVtZXJnaW5nLWdpYW50cy1hbWF6b24?hl=en-IN&gl=IN&ceid=IN%3Aen,2023-09-08
38,"Workers Struggles: Asia, Australia and the Pacific - World Socialist ...",WSWS,news.google.com/articles/CBMiOWh0dHBzOi8vd3d3Lndzd3Mub3JnL2VuL2FydGljbGVzLzIwMjMvMDkvMDgvaHppZS1zMDguaHRtbNIBAA?hl=en-IN&gl=IN&ceid=IN%3Aen,2023-09-08
33,HS2 | Euston traction substation completed ahead of two year site ...,New Civil Engineer,news.google.com/articles/CBMieWh0dHBzOi8vd3d3Lm5ld2NpdmlsZW5naW5lZXIuY29tL2xhdGVzdC9oczItZXVzdG9uLXRyYWN0aW9uLXN1YnN0YXRpb24tY29tcGxldGVkLWFoZWFkLW9mLXR3by15ZWFyLXNpdGUtcGF1c2UtMDgtMDktMjAyMy_SAQA?hl=en-IN&gl=IN&ceid=IN%3Aen,2023-09-08
32,"Djibouti Inaugurates Debut Wind Farm, a Milestone in Quest to be First African Country Fully Reliant on Green Energy",ZAWYA,news.google.com/articles/CBMisgFodHRwczovL3d3dy56YXd5YS5jb20vZW4vcHJlc3MtcmVsZWFzZS9hZnJpY2EtcHJlc3MtcmVsZWFzZXMvZGppYm91dGktaW5hdWd1cmF0ZXMtZGVidXQtd2luZC1mYXJtLWEtbWlsZXN0b25lLWluLXF1ZXN0LXRvLWJlLWZpcnN0LWFmcmljYW4tY291bnRyeS1mdWxseS1yZWxpYW50LW9uLWdyZWVuLXhjamNzcTA30gG4AWh0dHBzOi8vd3d3Lnphd3lhLmNvbS9lbi9wcmVzcy1yZWxlYXNlL2FmcmljYS1wcmVzcy1yZWxlYXNlcy9kamlib3V0aS1pbmF1Z3VyYXRlcy1kZWJ1dC13aW5kLWZhcm0tYS1taWxlc3RvbmUtaW4tcXVlc3QtdG8tYmUtZmlyc3QtYWZyaWNhbi1jb3VudHJ5LWZ1bGx5LXJlbGlhbnQtb24tZ3JlZW4teGNqY3NxMDc_YW1wPTE?hl=en-IN&gl=IN&ceid=IN%3Aen,2023-09-08
30,Bubble-enhanced basanite–tephrite mixing in the early stages of the ...,Nature.com,news.google.com/articles/CBMiMmh0dHBzOi8vd3d3Lm5hdHVyZS5jb20vYXJ0aWNsZXMvczQxNTk4LTAyMy00MTU5NS0z0gEA?hl=en-IN&gl=IN&ceid=IN%3Aen,2023-09-08
28,Accelerated Miocene incision along the Yangtze River driven by ...,Science,news.google.com/articles/CBMiMmh0dHBzOi8vd3d3LnNjaWVuY2Uub3JnL2RvaS8xMC4xMTI2L3NjaWFkdi5hZGgxNjM20gEA?hl=en-IN&gl=IN&ceid=IN%3Aen,2023-09-08
27,Exploring the attitudes of general medical students toward older ...,BMC Medical Education,news.google.com/articles/CBMiSGh0dHBzOi8vYm1jbWVkZWR1Yy5iaW9tZWRjZW50cmFsLmNvbS9hcnRpY2xlcy8xMC4xMTg2L3MxMjkwOS0wMjMtMDQ2MjYtMdIBAA?hl=en-IN&gl=IN&ceid=IN%3Aen,2023-09-08
25,'Just-in-Time' Manufacturing Reasserts Itself - The Washington Post,The Washington Post,news.google.com/articles/CBMisgFodHRwczovL3d3dy53YXNoaW5ndG9ucG9zdC5jb20vYnVzaW5lc3MvZW5lcmd5LzIwMjMvMDkvMDgvaW5kdXN0cmlhbC1zdHJlbmd0aC1qdXN0LWluLXRpbWUtbWFudWZhY3R1cmluZy1yZWFzc2VydHMtaXRzZWxmLWxtYXZ1cmduLzBkZTcyMzE4LTRlNzMtMTFlZS1iZmNhLTA0ZTBhYzQzZjllNF9zdG9yeS5odG1s0gEA?hl=en-IN&gl=IN&ceid=IN%3Aen,2023-09-08
