,title,source,link,date
13,"Innovative railway enhancements to unite communities, cities",The Malaysian Reserve,news.google.com/articles/CBMiZ2h0dHBzOi8vdGhlbWFsYXlzaWFucmVzZXJ2ZS5jb20vMjAyMy8xMS8yMy9pbm5vdmF0aXZlLXJhaWx3YXktZW5oYW5jZW1lbnRzLXRvLXVuaXRlLWNvbW11bml0aWVzLWNpdGllcy_SAQA?hl=en-IN&gl=IN&ceid=IN%3Aen,2023-11-23
9,Earthquakes: predicting the unpredictable,Allianz,news.google.com/articles/CBMiVmh0dHBzOi8vY29tbWVyY2lhbC5hbGxpYW56LmNvbS9uZXdzLWFuZC1pbnNpZ2h0cy9leHBlcnQtcmlzay1hcnRpY2xlcy9lYXJ0aHF1YWtlcy5odG1s0gEA?hl=en-IN&gl=IN&ceid=IN%3Aen,2023-11-23
11,Punjab and Haryana High Court also granted interim stay on GST ...,Tax Management India. Com,news.google.com/articles/CBMiTWh0dHBzOi8vd3d3LnRheG1hbmFnZW1lbnRpbmRpYS5jb20vdmlzaXRvci9kZXRhaWxfYXJ0aWNsZS5hc3A_QXJ0aWNsZUlEPTEyMDYx0gEA?hl=en-IN&gl=IN&ceid=IN%3Aen,2023-11-23
0,Ltd. Global Website | Renewal of O&M Services Contract for APM ...,Mitsubishi Heavy Industries,news.google.com/articles/CBMiJGh0dHBzOi8vd3d3Lm1oaS5jb20vbmV3cy8yMzExMjIuaHRtbNIBAA?hl=en-IN&gl=IN&ceid=IN%3Aen,2023-11-22
22,The role of polyunsaturated fatty acids in the neurobiology of major ...,Nature.com,news.google.com/articles/CBMiMmh0dHBzOi8vd3d3Lm5hdHVyZS5jb20vYXJ0aWNsZXMvczQxMzgwLTAyMy0wMjMyMi020gEA?hl=en-IN&gl=IN&ceid=IN%3Aen,2023-11-22
1,Why the transport industry must look beyond automotive in the drive ...,Innovation News Network,news.google.com/articles/CBMifGh0dHBzOi8vd3d3Lmlubm92YXRpb25uZXdzbmV0d29yay5jb20vd2h5LXRoZS10cmFuc3BvcnQtaW5kdXN0cnktbXVzdC1sb29rLWJleW9uZC1hdXRvbW90aXZlLWluLXRoZS1kcml2ZS10by1uZXQtemVyby80MDI1NS_SAQA?hl=en-IN&gl=IN&ceid=IN%3Aen,2023-11-22
19,Hopfion rings in a cubic chiral magnet,Nature.com,news.google.com/articles/CBMiMmh0dHBzOi8vd3d3Lm5hdHVyZS5jb20vYXJ0aWNsZXMvczQxNTg2LTAyMy0wNjY1OC010gEA?hl=en-IN&gl=IN&ceid=IN%3Aen,2023-11-22
17,Taxonomic and environmental distribution of bacterial amino acid ...,Nature.com,news.google.com/articles/CBMiMmh0dHBzOi8vd3d3Lm5hdHVyZS5jb20vYXJ0aWNsZXMvczQxNDY3LTAyMy00MzQzNS000gEA?hl=en-IN&gl=IN&ceid=IN%3Aen,2023-11-22
16,Getting Great Britain building again: Speeding up infrastructure ...,GOV.UK,news.google.com/articles/CBMivAFodHRwczovL3d3dy5nb3YudWsvZ292ZXJubWVudC9wdWJsaWNhdGlvbnMvZ2V0dGluZy1ncmVhdC1icml0YWluLWJ1aWxkaW5nLWFnYWluLXNwZWVkaW5nLXVwLWluZnJhc3RydWN0dXJlLWRlbGl2ZXJ5L2dldHRpbmctZ3JlYXQtYnJpdGFpbi1idWlsZGluZy1hZ2Fpbi1zcGVlZGluZy11cC1pbmZyYXN0cnVjdHVyZS1kZWxpdmVyedIBAA?hl=en-IN&gl=IN&ceid=IN%3Aen,2023-11-22
15,Design of high bulk moduli high entropy alloys using machine ...,Nature.com,news.google.com/articles/CBMiMmh0dHBzOi8vd3d3Lm5hdHVyZS5jb20vYXJ0aWNsZXMvczQxNTk4LTAyMy00NzE4MS140gEA?hl=en-IN&gl=IN&ceid=IN%3Aen,2023-11-22
