,title,source,link,date
1,How ULIP is revolutionising India's logistics landscape,YourStory,news.google.com/articles/CBMiQ2h0dHBzOi8veW91cnN0b3J5LmNvbS8yMDIzLzExL3VsaXAtZ2FtZS1jaGFuZ2VyLWxvZ2lzdGljcy1lY29zeXN0ZW3SAQA?hl=en-IN&gl=IN&ceid=IN%3Aen,2023-11-19
14,Selectivity matters: selective ROCK2 inhibitor ameliorates ...,Nature.com,news.google.com/articles/CBMiMmh0dHBzOi8vd3d3Lm5hdHVyZS5jb20vYXJ0aWNsZXMvczQyMDAzLTAyMy0wNTU1Mi0w0gEA?hl=en-IN&gl=IN&ceid=IN%3Aen,2023-11-18
32,Saudi exchange's introduction of single stock options to woo global ...,Arab News,news.google.com/articles/CBMiJWh0dHBzOi8vd3d3LmFyYWJuZXdzLmNvbS9ub2RlLzI0MTEyMTHSASlodHRwczovL3d3dy5hcmFibmV3cy5jb20vbm9kZS8yNDExMjExL2FtcA?hl=en-IN&gl=IN&ceid=IN%3Aen,2023-11-18
29,Sri Lanka's 1.2 million 'Tuks' to undergo 'e-Wheel' Revolution,The Island.lk,news.google.com/articles/CBMiTWh0dHA6Ly9pc2xhbmQubGsvc3JpLWxhbmthcy0xLTItbWlsbGlvbi10dWtzLXRvLXVuZGVyZ28tZS13aGVlbC1yZXZvbHV0aW9uLTIv0gEA?hl=en-IN&gl=IN&ceid=IN%3Aen,2023-11-18
21,"RTS,S/AS01 malaria vaccine pilot implementation in western Kenya ...",BMC Public Health,news.google.com/articles/CBMiTWh0dHBzOi8vYm1jcHVibGljaGVhbHRoLmJpb21lZGNlbnRyYWwuY29tL2FydGljbGVzLzEwLjExODYvczEyODg5LTAyMy0xNzE5NC0y0gEA?hl=en-IN&gl=IN&ceid=IN%3Aen,2023-11-18
20,World must move faster on renewable energy for green transition,Nikkei Asia,news.google.com/articles/CBMiX2h0dHBzOi8vYXNpYS5uaWtrZWkuY29tL09waW5pb24vV29ybGQtbXVzdC1tb3ZlLWZhc3Rlci1vbi1yZW5ld2FibGUtZW5lcmd5LWZvci1ncmVlbi10cmFuc2l0aW9u0gEA?hl=en-IN&gl=IN&ceid=IN%3Aen,2023-11-18
16,Mapping vision loss of patients in a glaucoma backlog following the ...,Nature.com,news.google.com/articles/CBMiMmh0dHBzOi8vd3d3Lm5hdHVyZS5jb20vYXJ0aWNsZXMvczQxNDMzLTAyMy0wMjgyMS000gEA?hl=en-IN&gl=IN&ceid=IN%3Aen,2023-11-18
15,Mapping brucellosis risk in Kenya and its implications for control ...,Nature.com,news.google.com/articles/CBMiMmh0dHBzOi8vd3d3Lm5hdHVyZS5jb20vYXJ0aWNsZXMvczQxNTk4LTAyMy00NzYyOC0x0gEA?hl=en-IN&gl=IN&ceid=IN%3Aen,2023-11-18
41,Swedish Workers Are Uniting Against Tesla,Slashdot,news.google.com/articles/CBMiWmh0dHBzOi8vdGVjaC5zbGFzaGRvdC5vcmcvc3RvcnkvMjMvMTEvMTgvMDA0MTIwMC9zd2VkaXNoLXdvcmtlcnMtYXJlLXVuaXRpbmctYWdhaW5zdC10ZXNsYdIBAA?hl=en-IN&gl=IN&ceid=IN%3Aen,2023-11-18
6,Modelling droplet size distribution in inline electrostatic coalescers ...,Nature.com,news.google.com/articles/CBMiMmh0dHBzOi8vd3d3Lm5hdHVyZS5jb20vYXJ0aWNsZXMvczQxNTk4LTAyMy00NjI1MS000gEA?hl=en-IN&gl=IN&ceid=IN%3Aen,2023-11-18
