,title,source,link,date
27,Looking to give back this holiday season? Here are 21 places to ...,Courier Journal,news.google.com/articles/CBMiiwFodHRwczovL3d3dy5jb3VyaWVyLWpvdXJuYWwuY29tL3N0b3J5L2xpZmUvaG9saWRheS8yMDIzLzExLzA4L2xvb2tpbmctdG8tZ2l2ZS1iYWNrLXRoaXMtaG9saWRheS1wbGFjZXMtdG8tZG9uYXRlLWluLWxvdWlzdmlsbGUvNzEyOTE2NDkwMDcv0gEA?hl=en-IN&gl=IN&ceid=IN%3Aen,2023-11-08
7,ZELLERS UNWRAPS THE ULTIMATE TOY BOOK FOR A JOYFUL ...,Canada NewsWire,news.google.com/articles/CBMikgFodHRwczovL3d3dy5uZXdzd2lyZS5jYS9uZXdzLXJlbGVhc2VzL3plbGxlcnMtdW53cmFwcy10aGUtdWx0aW1hdGUtdG95LWJvb2stZm9yLWEtam95ZnVsLWhvbGlkYXktc2Vhc29uLXdpdGgta2lkcy1zdGFtcC1vZi1hcHByb3ZhbC04MDYwNTIyMjEuaHRtbNIBAA?hl=en-IN&gl=IN&ceid=IN%3Aen,2023-11-08
20,"Medford, N.J.: A Rural Township With a Quaint Downtown",The New York Times,news.google.com/articles/CBMiT2h0dHBzOi8vd3d3Lm55dGltZXMuY29tLzIwMjMvMTEvMDgvcmVhbGVzdGF0ZS9tZWRmb3JkLW5qLWJ1cmxpbmd0b24tY291bnR5Lmh0bWzSAQA?hl=en-IN&gl=IN&ceid=IN%3Aen,2023-11-08
12,MEXICO: Families without food and children out of school two weeks ...,Save the Children International,news.google.com/articles/CBMieGh0dHBzOi8vd3d3LnNhdmV0aGVjaGlsZHJlbi5uZXQvbmV3cy9tZXhpY28tZmFtaWxpZXMtd2l0aG91dC1mb29kLWFuZC1jaGlsZHJlbi1vdXQtc2Nob29sLXR3by13ZWVrcy1hZnRlci1odXJyaWNhbmUtb3Rpc9IBAA?hl=en-IN&gl=IN&ceid=IN%3Aen,2023-11-08
13,These Eco-friendly Hotels in Costa Rica Have Organic Gardens ...,Travel + Leisure,news.google.com/articles/CBMiSmh0dHBzOi8vd3d3LnRyYXZlbGFuZGxlaXN1cmUuY29tL2Vjby1mcmllbmRseS1ob3RlbHMtaW4tY29zdGEtcmljYS04MzgyNjQ10gEA?hl=en-IN&gl=IN&ceid=IN%3Aen,2023-11-08
19,Meet the 2023 National Book Award Finalists ‹ Literary Hub,Literary Hub,news.google.com/articles/CBMiP2h0dHBzOi8vbGl0aHViLmNvbS9tZWV0LXRoZS0yMDIzLW5hdGlvbmFsLWJvb2stYXdhcmQtZmluYWxpc3RzL9IBAA?hl=en-IN&gl=IN&ceid=IN%3Aen,2023-11-08
17,Christmas is Coming: the American Christmas Tree Association ...,PR.com,news.google.com/articles/CBMiJ2h0dHBzOi8vd3d3LnByLmNvbS9wcmVzcy1yZWxlYXNlLzg5OTg0M9IBAA?hl=en-IN&gl=IN&ceid=IN%3Aen,2023-11-08
18,DC Repeals COVID Vaccine Mandate For Public School Students,DCist,news.google.com/articles/CBMiTmh0dHBzOi8vZGNpc3QuY29tL3N0b3J5LzIzLzExLzA3L2RjLWNvdW5jaWwtZGNwcy1jb3ZpZC12YWNjaW5lLW1hbmRhdGUtcmVwZWFsL9IBAA?hl=en-IN&gl=IN&ceid=IN%3Aen,2023-11-07
3,PPN Zoom Book Club: Naturally Inclusive,American Society of Landscape Architects,news.google.com/articles/CBMiTGh0dHBzOi8vdGhlZmllbGQuYXNsYS5vcmcvMjAyMy8xMS8wNy9wcG4tem9vbS1ib29rLWNsdWItbmF0dXJhbGx5LWluY2x1c2l2ZS_SAVBodHRwczovL3RoZWZpZWxkLmFzbGEub3JnLzIwMjMvMTEvMDcvcHBuLXpvb20tYm9vay1jbHViLW5hdHVyYWxseS1pbmNsdXNpdmUvYW1wLw?hl=en-IN&gl=IN&ceid=IN%3Aen,2023-11-07
29,New Bill Creates Free Social Work Master's At UDC,DCist,news.google.com/articles/CBMiTWh0dHBzOi8vZGNpc3QuY29tL3N0b3J5LzIzLzExLzA4L2RjLWNvdW5jaWwtcGFzc2VzLWJpbGwtZnJlZS1tc3ctcHJvZ3JhbS11ZGMv0gEA?hl=en-IN&gl=IN&ceid=IN%3Aen,2023-11-07
