,title,source,link,date
10,Cornish's O'Neill honored for stewardship of forest that she opens to ...,Valley News,news.google.com/articles/CBMiTmh0dHBzOi8vd3d3LnZuZXdzLmNvbS9Db2xsZWVuLU8tTmVpbGwtV2lucy1OSC1UcmVlLUZhcm1lci1vZi10aGUtWWVhci01MjY3MjU4M9IBAA?hl=en-IN&gl=IN&ceid=IN%3Aen,2023-10-22
95,How Ubuntu Linux Snuck Into High-End Dell Laptops,Slashdot,news.google.com/articles/CBMiYmh0dHBzOi8vbmV3cy5zbGFzaGRvdC5vcmcvc3RvcnkvMjMvMTAvMjEvMTgzOTIyOS9ob3ctdWJ1bnR1LWxpbnV4LXNudWNrLWludG8taGlnaC1lbmQtZGVsbC1sYXB0b3Bz0gEA?hl=en-IN&gl=IN&ceid=IN%3Aen,2023-10-21
37,Amazon Eliminated Plastic Packaging At One of Its Warehouses,Slashdot,news.google.com/articles/CBMibGh0dHBzOi8vbmV3cy5zbGFzaGRvdC5vcmcvc3RvcnkvMjMvMTAvMjAvMjIxMjUyL2FtYXpvbi1lbGltaW5hdGVkLXBsYXN0aWMtcGFja2FnaW5nLWF0LW9uZS1vZi1pdHMtd2FyZWhvdXNlc9IBAA?hl=en-IN&gl=IN&ceid=IN%3Aen,2023-10-21
31,What Happens When Major Online Platforms Lower Traffic to News ...,Slashdot,news.google.com/articles/CBMidWh0dHBzOi8vbmV3cy5zbGFzaGRvdC5vcmcvc3RvcnkvMjMvMTAvMjEvMDMxODIyMy93aGF0LWhhcHBlbnMtd2hlbi1tYWpvci1vbmxpbmUtcGxhdGZvcm1zLWxvd2VyLXRyYWZmaWMtdG8tbmV3cy1zaXRlc9IBAA?hl=en-IN&gl=IN&ceid=IN%3Aen,2023-10-21
14,Around Amherst: Councilors seek real estate fees to support ...,GazetteNET,news.google.com/articles/CBMiMmh0dHBzOi8vd3d3LmdhemV0dGVuZXQuY29tL0Fyb3VuZC1BbWhlcnN0LTUyNzE1MTYx0gEA?hl=en-IN&gl=IN&ceid=IN%3Aen,2023-10-20
63,Pipeline Dreams: The Desert City Out To Surpass Phoenix By ...,Slashdot,news.google.com/articles/CBMiemh0dHBzOi8vbmV3cy5zbGFzaGRvdC5vcmcvc3RvcnkvMjMvMTAvMjAvMDYxNTIzNC9waXBlbGluZS1kcmVhbXMtdGhlLWRlc2VydC1jaXR5LW91dC10by1zdXJwYXNzLXBob2VuaXgtYnktaW1wb3J0aW5nLXdhdGVy0gEA?hl=en-IN&gl=IN&ceid=IN%3Aen,2023-10-20
24,Code.org Presses Washington To Make Computer Science a High ...,Slashdot,news.google.com/articles/CBMiiQFodHRwczovL25ld3Muc2xhc2hkb3Qub3JnL3N0b3J5LzIzLzEwLzIwLzAwMTgyMDIvY29kZW9yZy1wcmVzc2VzLXdhc2hpbmd0b24tdG8tbWFrZS1jb21wdXRlci1zY2llbmNlLWEtaGlnaC1zY2hvb2wtZ3JhZHVhdGlvbi1yZXF1aXJlbWVudNIBAA?hl=en-IN&gl=IN&ceid=IN%3Aen,2023-10-20
19,Will Jawando Quits Race For U.S. Senate In Maryland,DCist,news.google.com/articles/CBMibGh0dHBzOi8vZGNpc3QuY29tL3N0b3J5LzIzLzEwLzIwL21vbnRnb21lcnktY291bnR5LWNvdW5jaWxtZW1iZXItd2lsbC1qYXdhbmRvLXF1aXRzLXVzLXNlbmF0ZS1yYWNlLW1hcnlsYW5kL9IBAA?hl=en-IN&gl=IN&ceid=IN%3Aen,2023-10-20
11,"Public Agenda: New parkland, retail policies, safe parking at ...",Palo Alto Online,news.google.com/articles/CBMic2h0dHBzOi8vcGFsb2FsdG9vbmxpbmUuY29tL25ld3MvMjAyMy8xMC8yMC9wdWJsaWMtYWdlbmRhLW5ldy1wYXJrbGFuZC1yZXRhaWwtcG9saWNpZXMtc2FmZS1wYXJraW5nLWF0LWNvbmdyZWdhdGlvbnPSAQA?hl=en-IN&gl=IN&ceid=IN%3Aen,2023-10-20
5,City Economy Gets Big Boost from Nonprofit Arts and Culture Sector,City of Jersey City,news.google.com/articles/CBMiTmh0dHBzOi8vd3d3LmplcnNleWNpdHluai5nb3YvbmV3cy9jaXR5ZWNvbm9teWdldHNib29zdGZyb21hcnRzYW5kY3VsdHVyZXNlY3RvctIBAA?hl=en-IN&gl=IN&ceid=IN%3Aen,2023-10-20
