,title,source,link,date
4,Asha founder awarded honorary doctorate,University of Sydney,news.google.com/articles/CBMiY2h0dHBzOi8vd3d3LnN5ZG5leS5lZHUuYXUvbmV3cy1vcGluaW9uL25ld3MvMjAyMy8xMC8xNy9raXJhbi1tYXJ0aW4tYXdhcmRlZC1ob25vcmFyeS1kb2N0b3JhdGUuaHRtbNIBAA?hl=en-IN&gl=IN&ceid=IN%3Aen,2023-10-17
7,"Visit the University of Lynchburg during Discovery Weekend, Nov ...",University of Lynchburg,news.google.com/articles/CBMiX2h0dHBzOi8vd3d3Lmx5bmNoYnVyZy5lZHUvdmlzaXQtdGhlLXVuaXZlcnNpdHktb2YtbHluY2hidXJnLWR1cmluZy1kaXNjb3Zlcnktd2Vla2VuZC1ub3YtMTAtMTEv0gEA?hl=en-IN&gl=IN&ceid=IN%3Aen,2023-10-17
13,Everything happening in the Mid-Hudson Valley this week & weekend,Hudson Valley One,news.google.com/articles/CBMiZ2h0dHBzOi8vaHVkc29udmFsbGV5b25lLmNvbS8yMDIzLzEwLzE3L2V2ZXJ5dGhpbmctaGFwcGVuaW5nLWluLXRoZS1taWQtaHVkc29uLXZhbGxleS10aGlzLXdlZWstd2Vla2VuZC_SAQA?hl=en-IN&gl=IN&ceid=IN%3Aen,2023-10-17
1,"Government Generates Over Rs 117 Crore Revenue in First Two Weeks of Swachhata Special Campaign 3.0 Through Scrap Disposal, Reports Dr. Jitendra Singh",India Education Diary,news.google.com/articles/CBMitAFodHRwczovL2luZGlhZWR1Y2F0aW9uZGlhcnkuaW4vZ292ZXJubWVudC1nZW5lcmF0ZXMtb3Zlci1ycy0xMTctY3JvcmUtcmV2ZW51ZS1pbi1maXJzdC10d28td2Vla3Mtb2Ytc3dhY2hoYXRhLXNwZWNpYWwtY2FtcGFpZ24tMy0wLXRocm91Z2gtc2NyYXAtZGlzcG9zYWwtcmVwb3J0cy1kci1qaXRlbmRyYS1zaW5naC_SAbQBaHR0cHM6Ly9pbmRpYWVkdWNhdGlvbmRpYXJ5LmluL2dvdmVybm1lbnQtZ2VuZXJhdGVzLW92ZXItcnMtMTE3LWNyb3JlLXJldmVudWUtaW4tZmlyc3QtdHdvLXdlZWtzLW9mLXN3YWNoaGF0YS1zcGVjaWFsLWNhbXBhaWduLTMtMC10aHJvdWdoLXNjcmFwLWRpc3Bvc2FsLXJlcG9ydHMtZHItaml0ZW5kcmEtc2luZ2gv?hl=en-IN&gl=IN&ceid=IN%3Aen,2023-10-17
14,Museum of the Rockies to host 'Haunted Mountain Theater',Montana State University,news.google.com/articles/CBMiWWh0dHBzOi8vd3d3Lm1vbnRhbmEuZWR1L25ld3MvMjMyMjIvbXVzZXVtLW9mLXRoZS1yb2NraWVzLXRvLWhvc3QtaGF1bnRlZC1tb3VudGFpbi10aGVhdGVy0gEA?hl=en-IN&gl=IN&ceid=IN%3Aen,2023-10-16
55,California Begins World's Largest Dam Removal/River Restoration ...,Slashdot,news.google.com/articles/CBMid2h0dHBzOi8vbmV3cy5zbGFzaGRvdC5vcmcvc3RvcnkvMjMvMTAvMTYvMDExODIyNy9jYWxpZm9ybmlhLWJlZ2lucy13b3JsZHMtbGFyZ2VzdC1kYW0tcmVtb3ZhbHJpdmVyLXJlc3RvcmF0aW9uLXByb2plY3Rz0gEA?hl=en-IN&gl=IN&ceid=IN%3Aen,2023-10-16
5,Myanmar: Mental health counsellors are more important than ever,Médecins Sans Frontières Australia,news.google.com/articles/CBMiYWh0dHBzOi8vbXNmLm9yZy5hdS9hcnRpY2xlL3Byb2plY3QtbmV3cy9teWFubWFyLW1lbnRhbC1oZWFsdGgtY291bnNlbGxvcnMtYXJlLW1vcmUtaW1wb3J0YW50LWV2ZXLSAQA?hl=en-IN&gl=IN&ceid=IN%3Aen,2023-10-16
6,Letters to the editor: Gaza crisis; Pine Tree Power; SAD 75 candidates,Press Herald,news.google.com/articles/CBMibGh0dHBzOi8vd3d3LnByZXNzaGVyYWxkLmNvbS8yMDIzLzEwLzE2L2xldHRlcnMtdG8tdGhlLWVkaXRvci1nYXphLWNyaXNpcy1waW5lLXRyZWUtcG93ZXItbXNhZC03NS1jYW5kaWRhdGVzL9IBAA?hl=en-IN&gl=IN&ceid=IN%3Aen,2023-10-16
11,Schoolchildren with asymptomatic malaria are potential hotspot for ...,Malaria Journal,news.google.com/articles/CBMiTGh0dHBzOi8vbWFsYXJpYWpvdXJuYWwuYmlvbWVkY2VudHJhbC5jb20vYXJ0aWNsZXMvMTAuMTE4Ni9zMTI5MzYtMDIzLTA0NzM2LTfSAQA?hl=en-IN&gl=IN&ceid=IN%3Aen,2023-10-16
19,Here's Why DC's Art All Night Is Becoming A Recognizable 'Brand',DCist,news.google.com/articles/CBMiTGh0dHBzOi8vZGNpc3QuY29tL3N0b3J5LzIzLzEwLzE2L2RjLWFydC1hbGwtbmlnaHQtZXZlbnQtYnVpbGRpbmctb24tc3VjY2Vzcy_SAQA?hl=en-IN&gl=IN&ceid=IN%3Aen,2023-10-16
