,title,source,link,date
23,Amazon Eliminated Plastic Packaging At One of Its Warehouses,Slashdot,news.google.com/articles/CBMibGh0dHBzOi8vbmV3cy5zbGFzaGRvdC5vcmcvc3RvcnkvMjMvMTAvMjAvMjIxMjUyL2FtYXpvbi1lbGltaW5hdGVkLXBsYXN0aWMtcGFja2FnaW5nLWF0LW9uZS1vZi1pdHMtd2FyZWhvdXNlc9IBAA?hl=en-IN&gl=IN&ceid=IN%3Aen,2023-10-21
14,Around Amherst: Councilors seek real estate fees to support ...,GazetteNET,news.google.com/articles/CBMiMmh0dHBzOi8vd3d3LmdhemV0dGVuZXQuY29tL0Fyb3VuZC1BbWhlcnN0LTUyNzE1MTYx0gEA?hl=en-IN&gl=IN&ceid=IN%3Aen,2023-10-20
10,Obituary for Eleanor D Fether,Deck-Hanneman Funeral Home,news.google.com/articles/CBMiPGh0dHBzOi8vd3d3Lmhhbm5lbWFuZnVuZXJhbGhvbWVzLmNvbS9vYml0dWFyeS9FbGVhbm9yLUZldGhlctIBAA?hl=en-IN&gl=IN&ceid=IN%3Aen,2023-10-20
22,Code.org Presses Washington To Make Computer Science a High ...,Slashdot,news.google.com/articles/CBMiiQFodHRwczovL25ld3Muc2xhc2hkb3Qub3JnL3N0b3J5LzIzLzEwLzIwLzAwMTgyMDIvY29kZW9yZy1wcmVzc2VzLXdhc2hpbmd0b24tdG8tbWFrZS1jb21wdXRlci1zY2llbmNlLWEtaGlnaC1zY2hvb2wtZ3JhZHVhdGlvbi1yZXF1aXJlbWVudNIBAA?hl=en-IN&gl=IN&ceid=IN%3Aen,2023-10-20
16,Will Jawando Quits Race For U.S. Senate In Maryland,DCist,news.google.com/articles/CBMibGh0dHBzOi8vZGNpc3QuY29tL3N0b3J5LzIzLzEwLzIwL21vbnRnb21lcnktY291bnR5LWNvdW5jaWxtZW1iZXItd2lsbC1qYXdhbmRvLXF1aXRzLXVzLXNlbmF0ZS1yYWNlLW1hcnlsYW5kL9IBAA?hl=en-IN&gl=IN&ceid=IN%3Aen,2023-10-20
12,"Public Agenda: New parkland, retail policies, safe parking at ...",Palo Alto Online,news.google.com/articles/CBMid2h0dHBzOi8vd3d3LnBhbG9hbHRvb25saW5lLmNvbS9uZXdzLzIwMjMvMTAvMjAvcHVibGljLWFnZW5kYS1uZXctcGFya2xhbmQtcmV0YWlsLXBvbGljaWVzLXNhZmUtcGFya2luZy1hdC1jb25ncmVnYXRpb25z0gEA?hl=en-IN&gl=IN&ceid=IN%3Aen,2023-10-20
38,Pipeline Dreams: The Desert City Out To Surpass Phoenix By ...,Slashdot,news.google.com/articles/CBMiemh0dHBzOi8vbmV3cy5zbGFzaGRvdC5vcmcvc3RvcnkvMjMvMTAvMjAvMDYxNTIzNC9waXBlbGluZS1kcmVhbXMtdGhlLWRlc2VydC1jaXR5LW91dC10by1zdXJwYXNzLXBob2VuaXgtYnktaW1wb3J0aW5nLXdhdGVy0gEA?hl=en-IN&gl=IN&ceid=IN%3Aen,2023-10-20
4,City Economy Gets Big Boost from Nonprofit Arts and Culture Sector,City of Jersey City,news.google.com/articles/CBMiTmh0dHBzOi8vd3d3LmplcnNleWNpdHluai5nb3YvbmV3cy9jaXR5ZWNvbm9teWdldHNib29zdGZyb21hcnRzYW5kY3VsdHVyZXNlY3RvctIBAA?hl=en-IN&gl=IN&ceid=IN%3Aen,2023-10-20
7,Addison's Lone Star Analysis Expands Global Footprint with New ...,dallasinnovates.com,news.google.com/articles/CBMibGh0dHBzOi8vZGFsbGFzaW5ub3ZhdGVzLmNvbS9hZGRpc29ucy1sb25lLXN0YXItYW5hbHlzaXMtZXhwYW5kcy1nbG9iYWwtZm9vdHByaW50LXdpdGgtbmV3LW9mZmljZS1pbi1lbmdsYW5kL9IBAA?hl=en-IN&gl=IN&ceid=IN%3Aen,2023-10-19
3,Worthing High School smashes target for Chestnut Tree House ...,SussexWorld,news.google.com/articles/CBMijQFodHRwczovL3d3dy5zdXNzZXhleHByZXNzLmNvLnVrL2VkdWNhdGlvbi93b3J0aGluZy1oaWdoLXNjaG9vbC1zbWFzaGVzLXRhcmdldC1mb3ItY2hlc3RudXQtdHJlZS1ob3VzZS1hbmQtcHJlc2VudHMtY2hlcXVlLWZvci1wczE2Nzk1LTQzNzc4MDPSAQA?hl=en-IN&gl=IN&ceid=IN%3Aen,2023-10-19
