,title,source,link,date
21,England To Diverge From EU Water Monitoring Standards,Slashdot,news.google.com/articles/CBMiZmh0dHBzOi8vbmV3cy5zbGFzaGRvdC5vcmcvc3RvcnkvMjMvMTAvMjgvMDY1NzIyOC9lbmdsYW5kLXRvLWRpdmVyZ2UtZnJvbS1ldS13YXRlci1tb25pdG9yaW5nLXN0YW5kYXJkc9IBAA?hl=en-IN&gl=IN&ceid=IN%3Aen,2023-10-28
0,Popular Tree House Brewing is coming to Saratoga Springs next year,Times Union ,news.google.com/articles/CBMiaGh0dHBzOi8vd3d3LnRpbWVzdW5pb24uY29tL2J1c2luZXNzL2FydGljbGUvcG9wdWxhci10cmVlLWhvdXNlLWJlZXItY29taW5nLXNhcmF0b2dhLXNwcmluZ3MtMTg0NTI3NTEucGhw0gEA?hl=en-IN&gl=IN&ceid=IN%3Aen,2023-10-27
12,Tree of Life shooting anniversary brings calls for change,PublicSource,news.google.com/articles/CBMid2h0dHBzOi8vd3d3LnB1YmxpY3NvdXJjZS5vcmcvdHJlZS1vZi1saWZlLXNob290aW5nLXNxdWlycmVsLWhpbGwtYW5uaXZlcnNhcnktbWFpbmUtZ3VuLXZpb2xlbmNlLWxlZ2lzbGF0aW9uLXBpdHRzYnVyZ2gv0gEA?hl=en-IN&gl=IN&ceid=IN%3Aen,2023-10-27
13,'Tis the Sneezin' to Get Protected: IDPH Launches Campaign to ...,Illinois.gov,news.google.com/articles/CBMiNmh0dHBzOi8vd3d3LmlsbGlub2lzLmdvdi9uZXdzL3ByZXNzLXJlbGVhc2UuMjcyMTMuaHRtbNIBAA?hl=en-IN&gl=IN&ceid=IN%3Aen,2023-10-27
17,"Surprising Many, Maryland Rep. John Sarbanes Won't Seek ...",DCist,news.google.com/articles/CBMiYWh0dHBzOi8vZGNpc3QuY29tL3N0b3J5LzIzLzEwLzI3L21hcnlsYW5kLXJlcHJlc2VudGF0aXZlLWpvaG4tc2FyYmFuZXMtd29udC1zZWVrLXJlZWxlY3Rpb24tMjAyNC_SAQA?hl=en-IN&gl=IN&ceid=IN%3Aen,2023-10-27
5,Halloween Parade and other activities planned for Alexandria area,Alexandria Echo Press,news.google.com/articles/CBMiZmh0dHBzOi8vd3d3LmVjaG9wcmVzcy5jb20vbmV3cy9sb2NhbC9oYWxsb3dlZW4tcGFyYWRlLWFuZC1vdGhlci1hY3Rpdml0aWVzLXBsYW5uZWQtZm9yLWFsZXhhbmRyaWEtYXJlYdIBAA?hl=en-IN&gl=IN&ceid=IN%3Aen,2023-10-26
24,24th annual Can the Griz food drive launches Nov. 4,Montana State University,news.google.com/articles/CBMiVWh0dHBzOi8vd3d3Lm1vbnRhbmEuZWR1L25ld3MvMjMyNTYvMjR0aC1hbm51YWwtY2FuLXRoZS1ncml6LWZvb2QtZHJpdmUtbGF1bmNoZXMtbm92LTTSAQA?hl=en-IN&gl=IN&ceid=IN%3Aen,2023-10-26
57,Bloomsbury Chief Warns of AI Threat To Publishing,Slashdot,news.google.com/articles/CBMiYWh0dHBzOi8vbmV3cy5zbGFzaGRvdC5vcmcvc3RvcnkvMjMvMTAvMjYvMTU1MjAyL2Jsb29tc2J1cnktY2hpZWYtd2FybnMtb2YtYWktdGhyZWF0LXRvLXB1Ymxpc2hpbmfSAQA?hl=en-IN&gl=IN&ceid=IN%3Aen,2023-10-26
68,The UK's Controversial Online Safety Bill Finally Becomes Law,Slashdot,news.google.com/articles/CBMibWh0dHBzOi8vbmV3cy5zbGFzaGRvdC5vcmcvc3RvcnkvMjMvMTAvMjYvMTY0NzI1OS90aGUtdWtzLWNvbnRyb3ZlcnNpYWwtb25saW5lLXNhZmV0eS1iaWxsLWZpbmFsbHktYmVjb21lcy1sYXfSAQA?hl=en-IN&gl=IN&ceid=IN%3Aen,2023-10-26
30,White House To Unveil Sweeping AI Executive Order Next Week,Slashdot,news.google.com/articles/CBMia2h0dHBzOi8vbmV3cy5zbGFzaGRvdC5vcmcvc3RvcnkvMjMvMTAvMjUvMTk4MjI2L3doaXRlLWhvdXNlLXRvLXVudmVpbC1zd2VlcGluZy1haS1leGVjdXRpdmUtb3JkZXItbmV4dC13ZWVr0gEA?hl=en-IN&gl=IN&ceid=IN%3Aen,2023-10-25
