,title,source,link,date
26,Wellhead Equipment Market Unveiling the Upturn Anticipating Skyrocketing Market Size Ahead,Benzinga,news.google.com/articles/CBMikAFodHRwczovL3d3dy5iZW56aW5nYS5jb20vcHJlc3NyZWxlYXNlcy8yMy8wOS8zNDE2NjEwNi93ZWxsaGVhZC1lcXVpcG1lbnQtbWFya2V0LXVudmVpbGluZy10aGUtdXB0dXJuLWFudGljaXBhdGluZy1za3lyb2NrZXRpbmctbWFya2V0LXNpemUtYWhlYWTSAS1odHRwczovL3d3dy5iZW56aW5nYS5jb20vYW1wL2NvbnRlbnQvMzQxNjYxMDY?hl=en-IN&gl=IN&ceid=IN%3Aen,2023-09-01
24,"Climate change glossary: the terms you need to understand, explained",thethirdpole.net,news.google.com/articles/CBMiQGh0dHBzOi8vd3d3LnRoZXRoaXJkcG9sZS5uZXQvZW4vY2xpbWF0ZS9jbGltYXRlLWNoYW5nZS1nbG9zc2FyeS_SAQA?hl=en-IN&gl=IN&ceid=IN%3Aen,2023-09-01
42,Envisioned of Ground fault and ground check monitor Market Economic Impacts Set to Expand by 2030,Benzinga,news.google.com/articles/CBMilwFodHRwczovL3d3dy5iZW56aW5nYS5jb20vcHJlc3NyZWxlYXNlcy8yMy8wOS8zNDE2MjU4My9lbnZpc2lvbmVkLW9mLWdyb3VuZC1mYXVsdC1hbmQtZ3JvdW5kLWNoZWNrLW1vbml0b3ItbWFya2V0LWVjb25vbWljLWltcGFjdHMtc2V0LXRvLWV4cGFuZC1ieS0yMDMw0gEtaHR0cHM6Ly93d3cuYmVuemluZ2EuY29tL2FtcC9jb250ZW50LzM0MTYyNTgz?hl=en-IN&gl=IN&ceid=IN%3Aen,2023-09-01
40,Demolition Robot Market Elevation Scaling New Heights with Dazzling Trends | CAGR of 16.2%,Benzinga,news.google.com/articles/CBMijQFodHRwczovL3d3dy5iZW56aW5nYS5jb20vcHJlc3NyZWxlYXNlcy8yMy8wOS8zNDE2NTYwNC9kZW1vbGl0aW9uLXJvYm90LW1hcmtldC1lbGV2YXRpb24tc2NhbGluZy1uZXctaGVpZ2h0cy13aXRoLWRhenpsaW5nLXRyZW5kcy1jYWdyLW9mLTE2LTLSAS1odHRwczovL3d3dy5iZW56aW5nYS5jb20vYW1wL2NvbnRlbnQvMzQxNjU2MDQ?hl=en-IN&gl=IN&ceid=IN%3Aen,2023-09-01
38,Jackhammer Market Radiant Discoveries Illuminating the Worldwide Markets Trends,Benzinga,news.google.com/articles/CBMihQFodHRwczovL3d3dy5iZW56aW5nYS5jb20vcHJlc3NyZWxlYXNlcy8yMy8wOS8zNDE2NjExNi9qYWNraGFtbWVyLW1hcmtldC1yYWRpYW50LWRpc2NvdmVyaWVzLWlsbHVtaW5hdGluZy10aGUtd29ybGR3aWRlLW1hcmtldHMtdHJlbmRz0gEtaHR0cHM6Ly93d3cuYmVuemluZ2EuY29tL2FtcC9jb250ZW50LzM0MTY2MTE2?hl=en-IN&gl=IN&ceid=IN%3Aen,2023-09-01
33,Ultra High Pressure Hydraulic Rubber Hose Market to 2029 - Business Prospects and Growth Projections,openPR,news.google.com/articles/CBMiXGh0dHBzOi8vd3d3Lm9wZW5wci5jb20vbmV3cy8zMTkyNDg3L3VsdHJhLWhpZ2gtcHJlc3N1cmUtaHlkcmF1bGljLXJ1YmJlci1ob3NlLW1hcmtldC10by0yMDI50gFbaHR0cHM6Ly93d3cub3BlbnByLmNvbS9hbXAvMzE5MjQ4Ny91bHRyYS1oaWdoLXByZXNzdXJlLWh5ZHJhdWxpYy1ydWJiZXItaG9zZS1tYXJrZXQtdG8tMjAyOQ?hl=en-IN&gl=IN&ceid=IN%3Aen,2023-09-01
32,"Crushing, Screening, and Mineral Processing Equipment Market ...",Benzinga,news.google.com/articles/CBMimQFodHRwczovL3d3dy5iZW56aW5nYS5jb20vcHJlc3NyZWxlYXNlcy8yMy8wOS8zNDE2NjcwOS9jcnVzaGluZy1zY3JlZW5pbmctYW5kLW1pbmVyYWwtcHJvY2Vzc2luZy1lcXVpcG1lbnQtbWFya2V0LWVsZXZhdGluZy1zdWNjZXNzLXN0cmF0ZWdpZXMtYW50aWNpcGF0aW7SAQA?hl=en-IN&gl=IN&ceid=IN%3Aen,2023-09-01
31,Tooling Market Shining Bright Worldwide Markets Latest Rising Trends,Benzinga,news.google.com/articles/CBMiemh0dHBzOi8vd3d3LmJlbnppbmdhLmNvbS9wcmVzc3JlbGVhc2VzLzIzLzA5LzM0MTY2MDg5L3Rvb2xpbmctbWFya2V0LXNoaW5pbmctYnJpZ2h0LXdvcmxkd2lkZS1tYXJrZXRzLWxhdGVzdC1yaXNpbmctdHJlbmRz0gEtaHR0cHM6Ly93d3cuYmVuemluZ2EuY29tL2FtcC9jb250ZW50LzM0MTY2MDg5?hl=en-IN&gl=IN&ceid=IN%3Aen,2023-09-01
30,Ethiopia and Djibouti Heavy Equipment Market Upcoming Peaks Market Sizes Projection to Reach New Heights,Benzinga,news.google.com/articles/CBMimQFodHRwczovL3d3dy5iZW56aW5nYS5jb20vcHJlc3NyZWxlYXNlcy8yMy8wOS8zNDE2NjA5Mi9ldGhpb3BpYS1hbmQtZGppYm91dGktaGVhdnktZXF1aXBtZW50LW1hcmtldC11cGNvbWluZy1wZWFrcy1tYXJrZXQtc2l6ZXMtcHJvamVjdGlvbi10by1yZWFjaC1uZXctaGXSAS1odHRwczovL3d3dy5iZW56aW5nYS5jb20vYW1wL2NvbnRlbnQvMzQxNjYwOTI?hl=en-IN&gl=IN&ceid=IN%3Aen,2023-09-01
29,Construction Equipment Market Up and Up Anticipating Market Sizes Skyrocketing Course,Benzinga,news.google.com/articles/CBMiiwFodHRwczovL3d3dy5iZW56aW5nYS5jb20vcHJlc3NyZWxlYXNlcy8yMy8wOS8zNDE2NjEzMC9jb25zdHJ1Y3Rpb24tZXF1aXBtZW50LW1hcmtldC11cC1hbmQtdXAtYW50aWNpcGF0aW5nLW1hcmtldC1zaXplcy1za3lyb2NrZXRpbmctY291cnNl0gEtaHR0cHM6Ly93d3cuYmVuemluZ2EuY29tL2FtcC9jb250ZW50LzM0MTY2MTMw?hl=en-IN&gl=IN&ceid=IN%3Aen,2023-09-01
