,title,source,link,date
10,"Dried Egg Market Size, Growth Analysis By Regions, and Forecast ...",Digital Journal,news.google.com/articles/CBMitgFodHRwczovL3d3dy5kaWdpdGFsam91cm5hbC5jb20vcHIvbmV3cy9uZXdzbWFudHJhYS9kcmllZC1lZ2ctbWFya2V0LXNpemUtZ3Jvd3RoLWFuYWx5c2lzLWJ5LXJlZ2lvbnMtYW5kLWZvcmVjYXN0LTIwMzItaW50ZXJvdm8tZWdnLWdyb3VwLWJ2LXNhbm92by10ZWNobm9sb2d5LWEtcy1hZ3JvaG9sZGluZy1hdmFuZ2FyZNIBAA?hl=en-IN&gl=IN&ceid=IN%3Aen,2023-11-03
2,IPV leads seed round in frozen foods tech platform FroGo,Entrackr,news.google.com/articles/CBMiVmh0dHBzOi8vZW50cmFja3IuY29tLzIwMjMvMTEvaXB2LWxlYWRzLXNlZWQtcm91bmQtaW4tZnJvemVuLWZvb2RzLXRlY2gtcGxhdGZvcm0tZnJvZ28v0gEA?hl=en-IN&gl=IN&ceid=IN%3Aen,2023-11-02
30,Increased Government Efforts to Drive The Global Marek's Disease Vaccine Market,openPR,news.google.com/articles/CBMiXGh0dHBzOi8vd3d3Lm9wZW5wci5jb20vbmV3cy8zMjczODUxL2luY3JlYXNlZC1nb3Zlcm5tZW50LWVmZm9ydHMtdG8tZHJpdmUtdGhlLWdsb2JhbC1tYXJlay1z0gFbaHR0cHM6Ly93d3cub3BlbnByLmNvbS9hbXAvMzI3Mzg1MS9pbmNyZWFzZWQtZ292ZXJubWVudC1lZmZvcnRzLXRvLWRyaXZlLXRoZS1nbG9iYWwtbWFyZWstcw?hl=en-IN&gl=IN&ceid=IN%3Aen,2023-11-02
34,Infectious Laryngotracheitis Disease Vaccine Market: 8.42% CAGR by 2032,openPR,news.google.com/articles/CBMiXGh0dHBzOi8vd3d3Lm9wZW5wci5jb20vbmV3cy8zMjcyNTk4L2luZmVjdGlvdXMtbGFyeW5nb3RyYWNoZWl0aXMtZGlzZWFzZS12YWNjaW5lLW1hcmtldC04LTQy0gFbaHR0cHM6Ly93d3cub3BlbnByLmNvbS9hbXAvMzI3MjU5OC9pbmZlY3Rpb3VzLWxhcnluZ290cmFjaGVpdGlzLWRpc2Vhc2UtdmFjY2luZS1tYXJrZXQtOC00Mg?hl=en-IN&gl=IN&ceid=IN%3Aen,2023-11-01
35,Anil Ravipudi Reveals Venkatesh's Dual Role.!,ఇండియా హెరాల్డ్ గ్రూప్ అఫ్ పబ్లిషర్స్ ప్రై లిమిటెడ్ - India Herald Group of Publishers P LIMITED ,news.google.com/articles/CBMiXGh0dHBzOi8vd3d3LmluZGlhaGVyYWxkLmNvbS9BY3RvcnMvUmVhZC85OTQ2NDM5MzIvQW5pbC1SYXZpcHVkaS1SZXZlYWxzLVZlbmthdGVzaHMtRHVhbC1Sb2xl0gFcaHR0cHM6Ly93d3cuaW5kaWFoZXJhbGQuY29tL0FjdG9ycy9SZWFkLzk5NDY0MzkzMi9BbmlsLVJhdmlwdWRpLVJldmVhbHMtVmVua2F0ZXNocy1EdWFsLVJvbGU?hl=en-IN&gl=IN&ceid=IN%3Aen,2023-10-29
42,Naga Chaitanya's Surprising New Look.!,ఇండియా హెరాల్డ్ గ్రూప్ అఫ్ పబ్లిషర్స్ ప్రై లిమిటెడ్ - India Herald Group of Publishers P LIMITED ,news.google.com/articles/CBMiVWh0dHBzOi8vd3d3LmluZGlhaGVyYWxkLmNvbS9BY3RvcnMvUmVhZC85OTQ2NDMyMzEvTmFnYS1DaGFpdGFueWFzLVN1cnByaXNpbmctTmV3LUxvb2vSAVVodHRwczovL3d3dy5pbmRpYWhlcmFsZC5jb20vQWN0b3JzL1JlYWQvOTk0NjQzMjMxL05hZ2EtQ2hhaXRhbnlhcy1TdXJwcmlzaW5nLU5ldy1Mb29r?hl=en-IN&gl=IN&ceid=IN%3Aen,2023-10-27
