,title,source,link,date
72,Chief Financial Officer Wealth Manager-how to invest without ...,Asia Insurance Review,news.google.com/articles/CBMiNWh0dHBzOi8vd3d3LmFzaWFpbnN1cmFuY2VyZXZpZXcuY29tL2J0Yy9NYkNGV3RjSC5odG1s0gEA?hl=en-IN&gl=IN&ceid=IN%3Aen,2023-08-26
60,Can You Make Money Mining Bitcoins - How To Build Wealth ...,Asia Insurance Review,news.google.com/articles/CBMiNWh0dHBzOi8vd3d3LmFzaWFpbnN1cmFuY2VyZXZpZXcuY29tL2J0Yy95VkZpUWtaaC5odG1s0gEA?hl=en-IN&gl=IN&ceid=IN%3Aen,2023-08-26
74,‘If you want to be rich ... you have to STRIP’: Your Rich BFF’s Vivian Tu became a millionaire at just 27 — here are her 5 steps for building wealth,Yahoo Finance,news.google.com/articles/CBMiRmh0dHBzOi8vZmluYW5jZS55YWhvby5jb20vbmV3cy93YW50LXJpY2gtc3RyaXAtcmljaC1iZmYtMTEwMDAwNDczLmh0bWzSAU5odHRwczovL2ZpbmFuY2UueWFob28uY29tL2FtcGh0bWwvbmV3cy93YW50LXJpY2gtc3RyaXAtcmljaC1iZmYtMTEwMDAwNDczLmh0bWw?hl=en-IN&gl=IN&ceid=IN%3Aen,2023-08-26
36,Benjamin urges teachers to pay more attention to their wealth ...,Jamaica Gleaner,news.google.com/articles/CBMifGh0dHBzOi8vamFtYWljYS1nbGVhbmVyLmNvbS9hcnRpY2xlL2xlYWQtc3Rvcmllcy8yMDIzMDgyNi9iZW5qYW1pbi11cmdlcy10ZWFjaGVycy1wYXktbW9yZS1hdHRlbnRpb24tdGhlaXItd2VhbHRoLW1hbmFnZW1lbnTSAQA?hl=en-IN&gl=IN&ceid=IN%3Aen,2023-08-26
38,"Evergreen Wealth Solutions adds new adviser | News, Sports, Jobs",Williamsport Sun-Gazette,news.google.com/articles/CBMiXWh0dHBzOi8vd3d3LnN1bmdhemV0dGUuY29tL25ld3MvYnVzaW5lc3MvMjAyMy8wOC9ldmVyZ3JlZW4td2VhbHRoLXNvbHV0aW9ucy1hZGRzLW5ldy1hZHZpc2VyL9IBAA?hl=en-IN&gl=IN&ceid=IN%3Aen,2023-08-26
24,How Much Is A Waves Cost - Td Wealth Private Investment Advice,Asia Insurance Review,news.google.com/articles/CBMiNWh0dHBzOi8vd3d3LmFzaWFpbnN1cmFuY2VyZXZpZXcuY29tL2J0Yy9uY1ltd3RHSC5odG1s0gEA?hl=en-IN&gl=IN&ceid=IN%3Aen,2023-08-26
41,DA case: Five ministers of Raghuvar Cabinet in trouble; wealth ...,Avenue Mail,news.google.com/articles/CBMibGh0dHBzOi8vYXZlbnVlbWFpbC5pbi9kYS1jYXNlLWZpdmUtbWluaXN0ZXJzLW9mLXJhZ2h1dmFyLWNhYmluZXQtaW4tdHJvdWJsZS13ZWFsdGgtaW5jcmVhc2UtMTEwMC1pbi01LXllYXJzL9IBAA?hl=en-IN&gl=IN&ceid=IN%3Aen,2023-08-26
42,Avoid Seeking Wealth Through Fetish Means – Okwuosa,Leadership News,news.google.com/articles/CBMiSGh0dHBzOi8vbGVhZGVyc2hpcC5uZy9hdm9pZC1zZWVraW5nLXdlYWx0aC10aHJvdWdoLWZldGlzaC1tZWFucy1va3d1b3NhL9IBAA?hl=en-IN&gl=IN&ceid=IN%3Aen,2023-08-26
49,Community wealth building is topic of public event,Meadville Tribune,news.google.com/articles/CBMiigFodHRwczovL3d3dy5tZWFkdmlsbGV0cmlidW5lLmNvbS9uZXdzL2NvbW11bml0eS13ZWFsdGgtYnVpbGRpbmctaXMtdG9waWMtb2YtcHVibGljLWV2ZW50L2FydGljbGVfNGJhMzI4NjQtNDI5ZC0xMWVlLWJiZWItNWY2N2EzYTMwMzhmLmh0bWzSAQA?hl=en-IN&gl=IN&ceid=IN%3Aen,2023-08-26
59,How Many Bitcoins Equal 1 Dollar - Td Wealth Private Investment ...,Asia Insurance Review,news.google.com/articles/CBMiNWh0dHBzOi8vd3d3LmFzaWFpbnN1cmFuY2VyZXZpZXcuY29tL2J0Yy9TRkNFRWVjUC5odG1s0gEA?hl=en-IN&gl=IN&ceid=IN%3Aen,2023-08-26
