,title,source,link,date
0,SUP-W vs WEL-W Dream11 Team Prediction The Hundred Womens ...,Cricadium,news.google.com/articles/CBMihwFodHRwczovL3d3dy5jcmljYWRpdW0uY29tL3N1cC13LXZzLXdlbC13LWRyZWFtMTEtcHJlZGljdGlvbi10aGUtaHVuZHJlZC13b21lbnMtY29tcGV0aXRpb24tMjAyMy1lbGltaW5hdG9yLXN1cC13LXZzLXdlbC13LWRyZWFtMTEtdGVhbS_SAQA?hl=en-IN&gl=IN&ceid=IN%3Aen,2023-08-25
26,"Tweets of the week: Tom Pidcock jumps off a boat, bikes take over ...",CyclingWeekly,news.google.com/articles/CBMijAFodHRwczovL3d3dy5jeWNsaW5nd2Vla2x5LmNvbS9uZXdzL3R3ZWV0cy1vZi10aGUtd2Vlay10b20tcGlkY29jay1qdW1wcy1vZmYtYS1ib2F0LWJpa2VzLXRha2Utb3Zlci1sb25kb24tYW5kLW9uZS1yaWRlci1nZXRzLWEtY2hlZWt5LW5hbmRvc9IBAA?hl=en-IN&gl=IN&ceid=IN%3Aen,2023-08-25
86,Mats Wieffer kan Feyenoord per direct achter zich laten voor ...,FootballTransfers NL,news.google.com/articles/CBMilAFodHRwczovL3d3dy5mb290YmFsbHRyYW5zZmVycy5jb20vbmwvdHJhbnNmZXJuaWV1d3MvdWstcHJlbWllci1sZWFndWUvMjAyMy8wOC9tYXRzLXdpZWZmZXIta2FuLWZleWVub29yZC1wZXItZGlyZWN0LWFjaHRlci16aWNoLWxhdGVuLXZvb3ItbGl2ZXJwb29s0gEA?hl=en-IN&gl=IN&ceid=IN%3Aen,2023-08-24
59,Republikeinse presidentskandidaten debatteren voor het eerst en ...,Vlaamse Radio- en Televisieomroeporganisatie,news.google.com/articles/CBMiVGh0dHBzOi8vd3d3LnZydC5iZS92cnRud3MvbmwvMjAyMy8wOC8yNC9lZXJzdGUtcmVwdWJsaWtlaW5zZS1kZWJhdC12b29ydmVya2llemluZ2VuL9IBAA?hl=en-IN&gl=IN&ceid=IN%3Aen,2023-08-24
55,Merijn Zeeman van Jumbo-Visma wil met twéé kopmannen in de ...,Trouw,news.google.com/articles/CBMib2h0dHBzOi8vd3d3LnRyb3V3Lm5sL3Nwb3J0L21lcmlqbi16ZWVtYW4tdmFuLWp1bWJvLXZpc21hLXdpbC1tZXQtdHdlZS1rb3BtYW5uZW4taW4tZGUtdnVlbHRhLXN0cmlqZGVufmI0Yjc1Y2UyL9IBAA?hl=en-IN&gl=IN&ceid=IN%3Aen,2023-08-24
46,Lotto Dstny duwt Caleb Ewan stilaan richting uitgang: “Het is aan ...,Het Nieuwsblad,news.google.com/articles/CBMiMmh0dHBzOi8vd3d3Lm5pZXV3c2JsYWQuYmUvY250L2RtZjIwMjMwODI0Xzk1MDU1Nzc10gEA?hl=en-IN&gl=IN&ceid=IN%3Aen,2023-08-24
42,Van pingpongtafel tot open hiring: oplossing van personeelstekort ...,Trouw,news.google.com/articles/CBMiiwFodHRwczovL3d3dy50cm91dy5ubC9kdXVyemFhbWhlaWQtZWNvbm9taWUvdmFuLXBpbmdwb25ndGFmZWwtdG90LW9wZW4taGlyaW5nLW9wbG9zc2luZy12YW4tcGVyc29uZWVsc3Rla29ydC12ZXJndC1jcmVhdGllZi1kZW5rZW5-Yjc5ODdhODUv0gEA?hl=en-IN&gl=IN&ceid=IN%3Aen,2023-08-24
81,Fok platneuzen verder aan banden: regels flink aangescherpt,Telegraaf.nl,news.google.com/articles/CBMiZGh0dHBzOi8vd3d3LnRlbGVncmFhZi5ubC9uaWV1d3MvOTc4Njk2MzMwL2Zvay1wbGF0bmV1emVuLXZlcmRlci1hYW4tYmFuZGVuLXJlZ2Vscy1mbGluay1hYW5nZXNjaGVycHTSAQA?hl=en-IN&gl=IN&ceid=IN%3Aen,2023-08-23
80,Belgen en Britten vechten om handtekening Boussaid,Voetbal International,news.google.com/articles/CBMiS2h0dHBzOi8vd3d3LnZpLm5sL25pZXV3cy9iZWxnZW4tZW4tYnJpdHRlbi12ZWNodGVuLW9tLWhhbmR0ZWtlbmluZy1ib3Vzc2FpZNIBAA?hl=en-IN&gl=IN&ceid=IN%3Aen,2023-08-23
28,Nazdar Welcomes Pramudi Abeydeera as New Digital Ink Chemist,Ink World Magazine,news.google.com/articles/CBMihQFodHRwczovL3d3dy5pbmt3b3JsZG1hZ2F6aW5lLmNvbS9jb250ZW50cy92aWV3X2JyZWFraW5nLW5ld3MvMjAyMy0wOC0yMy9uYXpkYXItd2VsY29tZXMtcHJhbXVkaS1hYmV5ZGVlcmEtYXMtbmV3LWRpZ2l0YWwtaW5rLWNoZW1pc3Qv0gEA?hl=en-IN&gl=IN&ceid=IN%3Aen,2023-08-23
