,title,source,link,date
6,"Stocks in news: Tata Motors, Ashok Leyland, Piramal Enterprises Aurobindo Pharma and more",Business Today,news.google.com/articles/CBMimgFodHRwczovL3d3dy5idXNpbmVzc3RvZGF5LmluL21hcmtldHMvc3RvY2tzL3N0b3J5L3N0b2Nrcy1pbi1uZXdzLXRhdGEtbW90b3JzLWFzaG9rLWxleWxhbmQtcGlyYW1hbC1lbnRlcnByaXNlcy1hdXJvYmluZG8tcGhhcm1hLWFuZC1tb3JlLTQwNTMwNS0yMDIzLTExLTEw0gGeAWh0dHBzOi8vd3d3LmJ1c2luZXNzdG9kYXkuaW4vYW1wL21hcmtldHMvc3RvY2tzL3N0b3J5L3N0b2Nrcy1pbi1uZXdzLXRhdGEtbW90b3JzLWFzaG9rLWxleWxhbmQtcGlyYW1hbC1lbnRlcnByaXNlcy1hdXJvYmluZG8tcGhhcm1hLWFuZC1tb3JlLTQwNTMwNS0yMDIzLTExLTEw?hl=en-IN&gl=IN&ceid=IN%3Aen,2023-11-10
67,Mobile phone players oppose TEC proposal on direct TV broadcast on handsets,PSU Watch,news.google.com/articles/CBMiQ2h0dHBzOi8vcHN1d2F0Y2guY29tL25ld3N1cGRhdGVzL3ByZXNzLXJlbGVhc2UvYml6LW1vYmlsZS1kaXJlY3QtdHbSAU1odHRwczovL3BzdXdhdGNoLmNvbS9hbXAvc3RvcnkvbmV3c3VwZGF0ZXMvcHJlc3MtcmVsZWFzZS9iaXotbW9iaWxlLWRpcmVjdC10dg?hl=en-IN&gl=IN&ceid=IN%3Aen,2023-11-09
86,HC orders tax refund of Rs 1128 cr to Vodafone Idea; pulls up I-T dept for laxity and lethargy,PSU Watch,news.google.com/articles/CBMiRGh0dHBzOi8vcHN1d2F0Y2guY29tL25ld3N1cGRhdGVzL3ByZXNzLXJlbGVhc2UvbWgtaGMtdm9kYWZvbmUtcmVmdW5k0gFOaHR0cHM6Ly9wc3V3YXRjaC5jb20vYW1wL3N0b3J5L25ld3N1cGRhdGVzL3ByZXNzLXJlbGVhc2UvbWgtaGMtdm9kYWZvbmUtcmVmdW5k?hl=en-IN&gl=IN&ceid=IN%3Aen,2023-11-09
70,Lalit Kala Akademi showcases works by Indian modernists from its collection,PSU Watch,news.google.com/articles/CBMiPWh0dHBzOi8vcHN1d2F0Y2guY29tL25ld3N1cGRhdGVzL3ByZXNzLXJlbGVhc2UvYXJ0LWxhbGl0LWthbGHSAUdodHRwczovL3BzdXdhdGNoLmNvbS9hbXAvc3RvcnkvbmV3c3VwZGF0ZXMvcHJlc3MtcmVsZWFzZS9hcnQtbGFsaXQta2FsYQ?hl=en-IN&gl=IN&ceid=IN%3Aen,2023-11-09
71,Bhagat Singh Foundation celebrates 4th anniversary of opening of Kartarpur corridor,PSU Watch,news.google.com/articles/CBMiPGh0dHBzOi8vcHN1d2F0Y2guY29tL25ld3N1cGRhdGVzL3ByZXNzLXJlbGVhc2UvcGFrLWthcnRhcnB1ctIBRmh0dHBzOi8vcHN1d2F0Y2guY29tL2FtcC9zdG9yeS9uZXdzdXBkYXRlcy9wcmVzcy1yZWxlYXNlL3Bhay1rYXJ0YXJwdXI?hl=en-IN&gl=IN&ceid=IN%3Aen,2023-11-09
75,"National Games closing ceremony: Adopt sports, support sportspersons, VP tells govt and firms",PSU Watch,news.google.com/articles/CBMiQ2h0dHBzOi8vcHN1d2F0Y2guY29tL25ld3N1cGRhdGVzL3ByZXNzLXJlbGVhc2UvZ2EtbmF0aW9uYWwtZ2FtZXMtdnDSAU1odHRwczovL3BzdXdhdGNoLmNvbS9hbXAvc3RvcnkvbmV3c3VwZGF0ZXMvcHJlc3MtcmVsZWFzZS9nYS1uYXRpb25hbC1nYW1lcy12cA?hl=en-IN&gl=IN&ceid=IN%3Aen,2023-11-09
76,Businessman Tarun Ghulati wants to become London’s first Indian-origin Mayor,PSU Watch,news.google.com/articles/CBMiPmh0dHBzOi8vcHN1d2F0Y2guY29tL25ld3N1cGRhdGVzL3ByZXNzLXJlbGVhc2UvdWstbWF5b3ItaW5kaWFu0gFIaHR0cHM6Ly9wc3V3YXRjaC5jb20vYW1wL3N0b3J5L25ld3N1cGRhdGVzL3ByZXNzLXJlbGVhc2UvdWstbWF5b3ItaW5kaWFu?hl=en-IN&gl=IN&ceid=IN%3Aen,2023-11-09
77,Delhi govt ready to bear cost of artificial rain to combat pollution; can do it by Nov 20 with Centre's support: Officials,PSU Watch,news.google.com/articles/CBMiR2h0dHBzOi8vcHN1d2F0Y2guY29tL25ld3N1cGRhdGVzL3ByZXNzLXJlbGVhc2UvZGVsaGktYXJ0aWZpY2lhbC1yYWluLWNz0gFRaHR0cHM6Ly9wc3V3YXRjaC5jb20vYW1wL3N0b3J5L25ld3N1cGRhdGVzL3ByZXNzLXJlbGVhc2UvZGVsaGktYXJ0aWZpY2lhbC1yYWluLWNz?hl=en-IN&gl=IN&ceid=IN%3Aen,2023-11-09
79,"Growth getting stronger foothold, inflation coming under control: Guv Das",PSU Watch,news.google.com/articles/CBMiPWh0dHBzOi8vcHN1d2F0Y2guY29tL25ld3N1cGRhdGVzL3ByZXNzLXJlbGVhc2UvYml6LXJiaS1sZC1kYXPSAUdodHRwczovL3BzdXdhdGNoLmNvbS9hbXAvc3RvcnkvbmV3c3VwZGF0ZXMvcHJlc3MtcmVsZWFzZS9iaXotcmJpLWxkLWRhcw?hl=en-IN&gl=IN&ceid=IN%3Aen,2023-11-09
83,Kerala professor selected by UGC to develop course on Arctic studies,PSU Watch,news.google.com/articles/CBMiSWh0dHBzOi8vcHN1d2F0Y2guY29tL25ld3N1cGRhdGVzL3ByZXNzLXJlbGVhc2Uva2wtcHJvZi11Z2MtYXJjdGljLXN0dWRpZXPSAVNodHRwczovL3BzdXdhdGNoLmNvbS9hbXAvc3RvcnkvbmV3c3VwZGF0ZXMvcHJlc3MtcmVsZWFzZS9rbC1wcm9mLXVnYy1hcmN0aWMtc3R1ZGllcw?hl=en-IN&gl=IN&ceid=IN%3Aen,2023-11-09
