,title,source,link,date
1,Blown Film Extrusion Equipment Market 2023: Strategic Insights by Key Players and Forecast to 2030,Benzinga,news.google.com/articles/CBMilwFodHRwczovL3d3dy5iZW56aW5nYS5jb20vcHJlc3NyZWxlYXNlcy8yMy8wOS8zNDI5ODU4NS9ibG93bi1maWxtLWV4dHJ1c2lvbi1lcXVpcG1lbnQtbWFya2V0LTIwMjMtc3RyYXRlZ2ljLWluc2lnaHRzLWJ5LWtleS1wbGF5ZXJzLWFuZC1mb3JlY2FzdC10by0yMDMw0gEtaHR0cHM6Ly93d3cuYmVuemluZ2EuY29tL2FtcC9jb250ZW50LzM0Mjk4NTg1?hl=en-IN&gl=IN&ceid=IN%3Aen,2023-09-07
12,Ontario hospital sounds alarm as aging building faces population boom,Global News,news.google.com/articles/CBMiWmh0dHBzOi8vZ2xvYmFsbmV3cy5jYS9uZXdzLzk5MjkzNzcvb250YXJpby1ob3NwaXRhbC1hZ2luZy1ib29taW5nLXBvcHVsYXRpb24tc291bmRzLWFsYXJtL9IBXmh0dHBzOi8vZ2xvYmFsbmV3cy5jYS9uZXdzLzk5MjkzNzcvb250YXJpby1ob3NwaXRhbC1hZ2luZy1ib29taW5nLXBvcHVsYXRpb24tc291bmRzLWFsYXJtL2FtcC8?hl=en-IN&gl=IN&ceid=IN%3Aen,2023-09-07
3,Leveraging Virtual Twins for Manufacturing Excellence,Tech Briefs,news.google.com/articles/CBMiU2h0dHBzOi8vd3d3LnRlY2hicmllZnMuY29tL2NvbXBvbmVudC9jb250ZW50L2FydGljbGUvdGIvcHViL2ZlYXR1cmVzL2FydGljbGVzLzQ4OTE10gEA?hl=en-IN&gl=IN&ceid=IN%3Aen,2023-09-06
5,"The Resistance Spot Welding Machines market's size, share, and revenue will be closely analyzed, with an",Benzinga,news.google.com/articles/CBMimQFodHRwczovL3d3dy5iZW56aW5nYS5jb20vcHJlc3NyZWxlYXNlcy8yMy8wOS8zNDI3MjQ0NC90aGUtcmVzaXN0YW5jZS1zcG90LXdlbGRpbmctbWFjaGluZXMtbWFya2V0cy1zaXplLXNoYXJlLWFuZC1yZXZlbnVlLXdpbGwtYmUtY2xvc2VseS1hbmFseXplZC13aXRoLWHSAS1odHRwczovL3d3dy5iZW56aW5nYS5jb20vYW1wL2NvbnRlbnQvMzQyNzI0NDQ?hl=en-IN&gl=IN&ceid=IN%3Aen,2023-09-06
15,NEXE Innovations Announces Collaboration with Neighborhood ...,Canada NewsWire,news.google.com/articles/CBMirQFodHRwczovL3d3dy5uZXdzd2lyZS5jYS9uZXdzLXJlbGVhc2VzL25leGUtaW5ub3ZhdGlvbnMtYW5ub3VuY2VzLWNvbGxhYm9yYXRpb24td2l0aC1uZWlnaGJvcmhvb2QtY29mZmVlLWNvbXBhbnktYW5kLWNvbXBsZXRlcy1zZWNvbmQtZGVsaXZlcnktdG8tYXdha2VuLWJyYW5kcy04MDU2ODQyMDkuaHRtbNIBAA?hl=en-IN&gl=IN&ceid=IN%3Aen,2023-09-06
23,"This report presents an in-depth analysis of the Carpet Extraction Cleaner market, including market size,",Benzinga,news.google.com/articles/CBMimQFodHRwczovL3d3dy5iZW56aW5nYS5jb20vcHJlc3NyZWxlYXNlcy8yMy8wOS8zNDI2MjE4OS90aGlzLXJlcG9ydC1wcmVzZW50cy1hbi1pbi1kZXB0aC1hbmFseXNpcy1vZi10aGUtY2FycGV0LWV4dHJhY3Rpb24tY2xlYW5lci1tYXJrZXQtaW5jbHVkaW5nLW1hcmtldC3SAS1odHRwczovL3d3dy5iZW56aW5nYS5jb20vYW1wL2NvbnRlbnQvMzQyNjIxODk?hl=en-IN&gl=IN&ceid=IN%3Aen,2023-09-06
27,Canadian man accused of running over and killing a Muslim family ...,Oil City Derrick,news.google.com/articles/CBMiqAFodHRwczovL3d3dy50aGVkZXJyaWNrLmNvbS9hcC93b3JsZC9jYW5hZGlhbi1tYW4tYWNjdXNlZC1vZi1ydW5uaW5nLW92ZXItYW5kLWtpbGxpbmctYS1tdXNsaW0tZmFtaWx5LXBsZWFkcy1ub3QtZ3VpbHR5L2FydGljbGVfNjI3ZTcxYWItM2VlNC01ZDcwLWI0MzMtMmJiNWEwZTlhYjI2Lmh0bWzSAQA?hl=en-IN&gl=IN&ceid=IN%3Aen,2023-09-06
8,Windsor council submit letter in objection to ticket office closures,Slough and Windsor Observer,news.google.com/articles/CBMibmh0dHBzOi8vd3d3LnNsb3VnaG9ic2VydmVyLmNvLnVrL25ld3MvMjM3NjYzMjkud2luZHNvci1jb3VuY2lsLXN1Ym1pdC1sZXR0ZXItb2JqZWN0aW9uLXRpY2tldC1vZmZpY2UtY2xvc3VyZXMv0gEA?hl=en-IN&gl=IN&ceid=IN%3Aen,2023-09-05
14,"The Frozen Block Flaker market's size, share, and revenue will be closely analyzed, with an anticipated C",Benzinga,news.google.com/articles/CBMimQFodHRwczovL3d3dy5iZW56aW5nYS5jb20vcHJlc3NyZWxlYXNlcy8yMy8wOS8zNDIxNDI3Mi90aGUtZnJvemVuLWJsb2NrLWZsYWtlci1tYXJrZXRzLXNpemUtc2hhcmUtYW5kLXJldmVudWUtd2lsbC1iZS1jbG9zZWx5LWFuYWx5emVkLXdpdGgtYW4tYW50aWNpcGF0ZWTSAS1odHRwczovL3d3dy5iZW56aW5nYS5jb20vYW1wL2NvbnRlbnQvMzQyMTQyNzI?hl=en-IN&gl=IN&ceid=IN%3Aen,2023-09-05
10,"Plastic Injection Molding Machine Market Size 2023 (New Insights Report) define, describe, and technology",Benzinga,news.google.com/articles/CBMimQFodHRwczovL3d3dy5iZW56aW5nYS5jb20vcHJlc3NyZWxlYXNlcy8yMy8wOS8zNDIwNDQzMS9wbGFzdGljLWluamVjdGlvbi1tb2xkaW5nLW1hY2hpbmUtbWFya2V0LXNpemUtMjAyMy1uZXctaW5zaWdodHMtcmVwb3J0LWRlZmluZS1kZXNjcmliZS1hbmQtdGVjaG5vbG_SAS1odHRwczovL3d3dy5iZW56aW5nYS5jb20vYW1wL2NvbnRlbnQvMzQyMDQ0MzE?hl=en-IN&gl=IN&ceid=IN%3Aen,2023-09-04
