,title,source,link,date
21,Automotive Hill Descent Control Industry Analysis and Forecast: Evaluating Market Growth Potential with a,Benzinga,news.google.com/articles/CBMimQFodHRwczovL3d3dy5iZW56aW5nYS5jb20vcHJlc3NyZWxlYXNlcy8yMy8wOS8zNDE4NzExNy9hdXRvbW90aXZlLWhpbGwtZGVzY2VudC1jb250cm9sLWluZHVzdHJ5LWFuYWx5c2lzLWFuZC1mb3JlY2FzdC1ldmFsdWF0aW5nLW1hcmtldC1ncm93dGgtcG90ZW50aWFsLXfSAS1odHRwczovL3d3dy5iZW56aW5nYS5jb20vYW1wL2NvbnRlbnQvMzQxODcxMTc?hl=en-IN&gl=IN&ceid=IN%3Aen,2023-09-02
13,2023 Automotive Electronic Control Unit Market Size and Growth ...,Benzinga,news.google.com/articles/CBMimQFodHRwczovL3d3dy5iZW56aW5nYS5jb20vcHJlc3NyZWxlYXNlcy8yMy8wOS8zNDE4OTg5Ny8yMDIzLWF1dG9tb3RpdmUtZWxlY3Ryb25pYy1jb250cm9sLXVuaXQtbWFya2V0LXNpemUtYW5kLWdyb3d0aC1tYXJrZXQtZHluYW1pY3MtYW5kLW5ldy1kZXZlbG9wbWVudHPSAQA?hl=en-IN&gl=IN&ceid=IN%3Aen,2023-09-02
43,"Automotive Camera And Camera Module Market Size, with Industry Share, Growth, Trends Analysis by 2031",Benzinga,news.google.com/articles/CBMimAFodHRwczovL3d3dy5iZW56aW5nYS5jb20vcHJlc3NyZWxlYXNlcy8yMy8wOS8zNDE2MzM3My9hdXRvbW90aXZlLWNhbWVyYS1hbmQtY2FtZXJhLW1vZHVsZS1tYXJrZXQtc2l6ZS13aXRoLWluZHVzdHJ5LXNoYXJlLWdyb3d0aC10cmVuZHMtYW5hbHlzaXMtYnktMjAzMdIBLWh0dHBzOi8vd3d3LmJlbnppbmdhLmNvbS9hbXAvY29udGVudC8zNDE2MzM3Mw?hl=en-IN&gl=IN&ceid=IN%3Aen,2023-09-01
29,Automotive Regenerative Braking System Market Art of Understanding Consumers Exploring Ethnography Techni,Benzinga,news.google.com/articles/CBMimQFodHRwczovL3d3dy5iZW56aW5nYS5jb20vcHJlc3NyZWxlYXNlcy8yMy8wOS8zNDE2NTM0OC9hdXRvbW90aXZlLXJlZ2VuZXJhdGl2ZS1icmFraW5nLXN5c3RlbS1tYXJrZXQtYXJ0LW9mLXVuZGVyc3RhbmRpbmctY29uc3VtZXJzLWV4cGxvcmluZy1ldGhub2dyYXBoeS3SAS1odHRwczovL3d3dy5iZW56aW5nYS5jb20vYW1wL2NvbnRlbnQvMzQxNjUzNDg?hl=en-IN&gl=IN&ceid=IN%3Aen,2023-09-01
1,"Automotive X-by-wire System Market – Global Industry Size, Share, Trends, Opportunity, and Forecast, 2018-2028F",Yahoo Finance,news.google.com/articles/CBMiTWh0dHBzOi8vZmluYW5jZS55YWhvby5jb20vbmV3cy9hdXRvbW90aXZlLXgtd2lyZS1zeXN0ZW0tbWFya2V0LTA5NDQwMDk2OS5odG1s0gFVaHR0cHM6Ly9maW5hbmNlLnlhaG9vLmNvbS9hbXBodG1sL25ld3MvYXV0b21vdGl2ZS14LXdpcmUtc3lzdGVtLW1hcmtldC0wOTQ0MDA5NjkuaHRtbA?hl=en-IN&gl=IN&ceid=IN%3Aen,2023-09-01
25,Automotive Chassis System Market Maximizing the Value of Social Listening Strategies for Effective Online,Benzinga,news.google.com/articles/CBMimQFodHRwczovL3d3dy5iZW56aW5nYS5jb20vcHJlc3NyZWxlYXNlcy8yMy8wOS8zNDE2NTAwMC9hdXRvbW90aXZlLWNoYXNzaXMtc3lzdGVtLW1hcmtldC1tYXhpbWl6aW5nLXRoZS12YWx1ZS1vZi1zb2NpYWwtbGlzdGVuaW5nLXN0cmF0ZWdpZXMtZm9yLWVmZmVjdGl2ZS3SAS1odHRwczovL3d3dy5iZW56aW5nYS5jb20vYW1wL2NvbnRlbnQvMzQxNjUwMDA?hl=en-IN&gl=IN&ceid=IN%3Aen,2023-09-01
30,Drive by Wire Market From Data to Decisions Making the Most of Focus Group Insights,Benzinga,news.google.com/articles/CBMiiQFodHRwczovL3d3dy5iZW56aW5nYS5jb20vcHJlc3NyZWxlYXNlcy8yMy8wOS8zNDE2NDY3Ny9kcml2ZS1ieS13aXJlLW1hcmtldC1mcm9tLWRhdGEtdG8tZGVjaXNpb25zLW1ha2luZy10aGUtbW9zdC1vZi1mb2N1cy1ncm91cC1pbnNpZ2h0c9IBLWh0dHBzOi8vd3d3LmJlbnppbmdhLmNvbS9hbXAvY29udGVudC8zNDE2NDY3Nw?hl=en-IN&gl=IN&ceid=IN%3Aen,2023-09-01
45,Automotive Axle & Propeller Shaft Market Ethnography Techniques for Deeper Consumer Understanding A Strat,Benzinga,news.google.com/articles/CBMimQFodHRwczovL3d3dy5iZW56aW5nYS5jb20vcHJlc3NyZWxlYXNlcy8yMy8wOS8zNDE2NTMzOS9hdXRvbW90aXZlLWF4bGUtcHJvcGVsbGVyLXNoYWZ0LW1hcmtldC1ldGhub2dyYXBoeS10ZWNobmlxdWVzLWZvci1kZWVwZXItY29uc3VtZXItdW5kZXJzdGFuZGluZy1hLXPSAS1odHRwczovL3d3dy5iZW56aW5nYS5jb20vYW1wL2NvbnRlbnQvMzQxNjUzMzk?hl=en-IN&gl=IN&ceid=IN%3Aen,2023-09-01
20,Anti-lock Braking System (ABS) Market Ethnography Techniques Capturing the Essence of Consumer Behavior,Benzinga,news.google.com/articles/CBMimQFodHRwczovL3d3dy5iZW56aW5nYS5jb20vcHJlc3NyZWxlYXNlcy8yMy8wOS8zNDE2NTM0NS9hbnRpLWxvY2stYnJha2luZy1zeXN0ZW0tYWJzLW1hcmtldC1ldGhub2dyYXBoeS10ZWNobmlxdWVzLWNhcHR1cmluZy10aGUtZXNzZW5jZS1vZi1jb25zdW1lci1iZWhhdmnSAS1odHRwczovL3d3dy5iZW56aW5nYS5jb20vYW1wL2NvbnRlbnQvMzQxNjUzNDU?hl=en-IN&gl=IN&ceid=IN%3Aen,2023-09-01
14,Traction Control System Market Guiding Principles Key Strategies for Effective Focus Group Facilitation,Benzinga,news.google.com/articles/CBMimQFodHRwczovL3d3dy5iZW56aW5nYS5jb20vcHJlc3NyZWxlYXNlcy8yMy8wOS8zNDE2NTAzNC90cmFjdGlvbi1jb250cm9sLXN5c3RlbS1tYXJrZXQtZ3VpZGluZy1wcmluY2lwbGVzLWtleS1zdHJhdGVnaWVzLWZvci1lZmZlY3RpdmUtZm9jdXMtZ3JvdXAtZmFjaWxpdGHSAS1odHRwczovL3d3dy5iZW56aW5nYS5jb20vYW1wL2NvbnRlbnQvMzQxNjUwMzQ?hl=en-IN&gl=IN&ceid=IN%3Aen,2023-09-01
