,title,source,link,date
23,Drive by Wire Market From Data to Decisions Making the Most of Focus Group Insights,Benzinga,news.google.com/articles/CBMiiQFodHRwczovL3d3dy5iZW56aW5nYS5jb20vcHJlc3NyZWxlYXNlcy8yMy8wOS8zNDE2NDY3Ny9kcml2ZS1ieS13aXJlLW1hcmtldC1mcm9tLWRhdGEtdG8tZGVjaXNpb25zLW1ha2luZy10aGUtbW9zdC1vZi1mb2N1cy1ncm91cC1pbnNpZ2h0c9IBLWh0dHBzOi8vd3d3LmJlbnppbmdhLmNvbS9hbXAvY29udGVudC8zNDE2NDY3Nw?hl=en-IN&gl=IN&ceid=IN%3Aen,2023-09-01
1,"Automotive X-by-wire System Market – Global Industry Size, Share, Trends, Opportunity, and Forecast, 2018-2028F",Yahoo Finance UK,news.google.com/articles/CBMiUGh0dHBzOi8vdWsuZmluYW5jZS55YWhvby5jb20vbmV3cy9hdXRvbW90aXZlLXgtd2lyZS1zeXN0ZW0tbWFya2V0LTA5NDQwMDAyMS5odG1s0gFYaHR0cHM6Ly91ay5maW5hbmNlLnlhaG9vLmNvbS9hbXBodG1sL25ld3MvYXV0b21vdGl2ZS14LXdpcmUtc3lzdGVtLW1hcmtldC0wOTQ0MDAwMjEuaHRtbA?hl=en-IN&gl=IN&ceid=IN%3Aen,2023-09-01
21,Automotive Regenerative Braking System Market Art of Understanding Consumers Exploring Ethnography Techni,Benzinga,news.google.com/articles/CBMimQFodHRwczovL3d3dy5iZW56aW5nYS5jb20vcHJlc3NyZWxlYXNlcy8yMy8wOS8zNDE2NTM0OC9hdXRvbW90aXZlLXJlZ2VuZXJhdGl2ZS1icmFraW5nLXN5c3RlbS1tYXJrZXQtYXJ0LW9mLXVuZGVyc3RhbmRpbmctY29uc3VtZXJzLWV4cGxvcmluZy1ldGhub2dyYXBoeS3SAS1odHRwczovL3d3dy5iZW56aW5nYS5jb20vYW1wL2NvbnRlbnQvMzQxNjUzNDg?hl=en-IN&gl=IN&ceid=IN%3Aen,2023-09-01
20,Steering Safety and Comfort: Global ADAS Market 2023 to 2032 ...,PR Newswire,news.google.com/articles/CBMirAFodHRwczovL3d3dy5wcm5ld3N3aXJlLmNvbS9uZXdzLXJlbGVhc2VzL3N0ZWVyaW5nLXNhZmV0eS1hbmQtY29tZm9ydC1nbG9iYWwtYWRhcy1tYXJrZXQtMjAyMy10by0yMDMyLWFuc3dlcmluZy1jb25zdW1lci1kZW1hbmRzLWZvci1zbWFydC1kcml2aW5nLWV4cGVyaWVuY2VzLTMwMTkxNDgzNi5odG1s0gEA?hl=en-IN&gl=IN&ceid=IN%3Aen,2023-09-01
32,Vehicle Electrification Market Sociocultural Clues Ethnographys Influence on Decoding Consumer Behavior |,Benzinga,news.google.com/articles/CBMimQFodHRwczovL3d3dy5iZW56aW5nYS5jb20vcHJlc3NyZWxlYXNlcy8yMy8wOS8zNDE2NDE4MS92ZWhpY2xlLWVsZWN0cmlmaWNhdGlvbi1tYXJrZXQtc29jaW9jdWx0dXJhbC1jbHVlcy1ldGhub2dyYXBoeXMtaW5mbHVlbmNlLW9uLWRlY29kaW5nLWNvbnN1bWVyLWJlaGHSAS1odHRwczovL3d3dy5iZW56aW5nYS5jb20vYW1wL2NvbnRlbnQvMzQxNjQxODE?hl=en-IN&gl=IN&ceid=IN%3Aen,2023-09-01
17,Automotive Chassis System Market Maximizing the Value of Social Listening Strategies for Effective Online,Benzinga,news.google.com/articles/CBMimQFodHRwczovL3d3dy5iZW56aW5nYS5jb20vcHJlc3NyZWxlYXNlcy8yMy8wOS8zNDE2NTAwMC9hdXRvbW90aXZlLWNoYXNzaXMtc3lzdGVtLW1hcmtldC1tYXhpbWl6aW5nLXRoZS12YWx1ZS1vZi1zb2NpYWwtbGlzdGVuaW5nLXN0cmF0ZWdpZXMtZm9yLWVmZmVjdGl2ZS3SAS1odHRwczovL3d3dy5iZW56aW5nYS5jb20vYW1wL2NvbnRlbnQvMzQxNjUwMDA?hl=en-IN&gl=IN&ceid=IN%3Aen,2023-09-01
15,Automotive Suspension Market Forecasting Excellence Pioneering Success through Future Market Sizing,Benzinga,news.google.com/articles/CBMimQFodHRwczovL3d3dy5iZW56aW5nYS5jb20vcHJlc3NyZWxlYXNlcy8yMy8wOS8zNDE2NDcwMS9hdXRvbW90aXZlLXN1c3BlbnNpb24tbWFya2V0LWZvcmVjYXN0aW5nLWV4Y2VsbGVuY2UtcGlvbmVlcmluZy1zdWNjZXNzLXRocm91Z2gtZnV0dXJlLW1hcmtldC1zaXppbmfSAS1odHRwczovL3d3dy5iZW56aW5nYS5jb20vYW1wL2NvbnRlbnQvMzQxNjQ3MDE?hl=en-IN&gl=IN&ceid=IN%3Aen,2023-09-01
13,Traction Control System Market Guiding Principles Key Strategies for Effective Focus Group Facilitation,Benzinga,news.google.com/articles/CBMimQFodHRwczovL3d3dy5iZW56aW5nYS5jb20vcHJlc3NyZWxlYXNlcy8yMy8wOS8zNDE2NTAzNC90cmFjdGlvbi1jb250cm9sLXN5c3RlbS1tYXJrZXQtZ3VpZGluZy1wcmluY2lwbGVzLWtleS1zdHJhdGVnaWVzLWZvci1lZmZlY3RpdmUtZm9jdXMtZ3JvdXAtZmFjaWxpdGHSAS1odHRwczovL3d3dy5iZW56aW5nYS5jb20vYW1wL2NvbnRlbnQvMzQxNjUwMzQ?hl=en-IN&gl=IN&ceid=IN%3Aen,2023-09-01
9,Automotive Domain Control Unit (DCU) Market Set to Witness ...,Digital Journal,news.google.com/articles/CBMimwFodHRwczovL3d3dy5kaWdpdGFsam91cm5hbC5jb20vcHIvbmV3cy94aGVyYWxkL2F1dG9tb3RpdmUtZG9tYWluLWNvbnRyb2wtdW5pdC1kY3UtbWFya2V0LXNldC10by13aXRuZXNzLWV4dHJhb3JkaW5hcnktZ3Jvd3RoLWJ5LTIwMjktdHJlbmRzLWluZHVzdHJ5LWdyb3d0aNIBAA?hl=en-IN&gl=IN&ceid=IN%3Aen,2023-09-01
36,"Automotive Camera And Camera Module Market Size, with Industry Share, Growth, Trends Analysis by 2031",Benzinga,news.google.com/articles/CBMimAFodHRwczovL3d3dy5iZW56aW5nYS5jb20vcHJlc3NyZWxlYXNlcy8yMy8wOS8zNDE2MzM3My9hdXRvbW90aXZlLWNhbWVyYS1hbmQtY2FtZXJhLW1vZHVsZS1tYXJrZXQtc2l6ZS13aXRoLWluZHVzdHJ5LXNoYXJlLWdyb3d0aC10cmVuZHMtYW5hbHlzaXMtYnktMjAzMdIBLWh0dHBzOi8vd3d3LmJlbnppbmdhLmNvbS9hbXAvY29udGVudC8zNDE2MzM3Mw?hl=en-IN&gl=IN&ceid=IN%3Aen,2023-09-01
